id,url,title,source,publication_date,text_length,full_text,is_duplicate,created_at
1,https://deadline.com/2026/03/tiger-woods-mugshot-released-dui-1236768226/,Tiger Woods Mugshot Released As DUI Charged Golf Icon Out Of Jail; Trump Oddly Circumspect About “Good Friend”,Deadline,2026-03-28T04:29:25,5570,"Skip to main content By Dominic Patten Dominic Patten Executive Editor, Legal, Labor & Politics @DeadlineDominic More Stories By Dominic Tiger Woods Mugshot Released As DUI Charged Golf Icon Out Of Jail; Trump Oddly Circumspect About “Good Friend” Trump Rants On Fox Against Jimmy Kimmel’s Derision Of “Country Smart” Markwayne Mullin: “He’s Got No Talent” Kevin Spacey’s Contested Exit From ‘House Of Cards’ Blows Up On MRC In $100M Insurance Trial View All March 27, 2026 9:29pm Tiger Woods ion the links n Palm Beach Gardens, Florida on March 24, 2026 Getty Tiger Woods was released from a short stint in a Florida jail tonight after being arrested earlier in the day for driving under the influence following a car crash . In his second official apprehension by police in the past decade, a red-eyed Woods had his mugshot made public not long before he exited the Martin County Jail at around 8:15 p.m. PT Trying to sneak out a back door of the jail near his home, Woods was driven away in a chauffeured Cadillac. Officials for the Martin County Sheriff’s department would not confirm if Woods put up a bond or was arraigned after being behind bars for several hours. Reps for Woods did not respond Friday to Deadline’s request for comment on his arrest and condition. Related Stories Sports Tiger Woods Arrested For DUI After Being Involved In Rollover Crash In Florida News ‘Air’s Alex Convery Enlisted To Adapt Tiger Woods Book ‘The Tiger Slam’ For Amazon MGM Studios Sheriff John Budensiek told the media today the crash happened just before 2 p.m. ET when Woods’ vehicle, which was going at a “high speed,” overtook a truck hauling a pressure cleaner trailer on a two-lane road with a 30 mph speed limit. Wood’s Land Rover supposedly swerved to avoid the trailer, however, it ended up clipping the back end of it. The Land Rover flipped and skidded to a stop with the driver’s door pinned against the ground. Watch on Deadline Woods climbed out the passenger side, insisting he was unharmed. Sheriff Budensiek said Woods was “cooperative but not trying to incriminate himself.” Woods blew a 0.00 on a breathalyzer test after showing signs of “impairment,” according to the Martin County Sheriff’s Office. In his second known car accident in , the golfer apparently told cops that he had a number of health issues and had several operations. Still, Woods was charged Friday with driving under the influence with property damage, which could get his a year in jail, fines or probation. Also, being charged with failure to take a urine test after the rollover crash today of his Land Rover near his Jupitar Island home, Woods will almost surely have his license suspended for up to a year. As it was, under Florida law, the golfer had to spend 8 hours behind bars. It seems Woods was not in the general population of the Martin County Jail. More starkly, with a previous DUI from 2017 on his record, Woods could get jail time with this latest incident That 2017 DUI was almost in the exact same spot as the incident today, with the banged up Woods found to be under the influence of medication then. To be specific, Woods in 2017 was found to have a mix of Xanex, Vicodin, Ambien, the harsh Dilaudid painkiller, and THC in his system. In February 2021, Woods, who had recently undergone his fifth back surgery and has had multiple knee surgeries, had multiple leg injuries afte r a crash occurred on a residential street in Palos Verdes, California. Just like a 2009 incident, Woods, who been hosting the Genesis Invitational at Rivera County Club in Pacific Palisades over that weekend, was never charged in the 2021 crash – which was deemed an accident to much mockery. Any judge, no matter how big a golf fan they are or are not, is going to have to take the DUI from 9 years ago into account in any sentencing out of what occurred Friday. Donald Trump boards Air Force One in Miami to head to Palm Beach, Florida to spend the weekend at his Mar-a-Lago resort. (Photo:Getty) A unusually circumspect Donald Trump spoke briefly about his “good friend” and what occurred Friday to Woods. “He’s got some difficulty, .. I don’t want to talk about it- Trump said today on the tarmac next to Air Force One after giving a speech ( Paramount ‘s David Ellison was there) in Miami and heading down to his Mar-a-Lago estate in Palm Beach. That good friend, who also dates Trump’s ex-daughter-in-law Vanessa, has seen his latest quest for golf glory and getting back on the PGA tour undermined in part by Trump this week. Playing in the TGL Finals on March 4, and his Jupiter Links Golf Club losing to Los Angeles GC, Woods said of his hopes for the 2026 Masters. “I’ve been trying,” the 50-year-old golf superstar said after the TGL Final “This body just doesn’t recover like it did when I was 24 or 25. I want to play.” In a live phone interview with Fox News’ The Five , on March 26, Trump threw ice cold water on that Augusta National appearance. POTUS said that Woods would be not be participating in the April 9 starting Masters. “He will be there, but he won’t be playing in it,” Trump told the pane show hosts on Thursday of the five-time Masters champ. As of tonight, Woods is still signed up for the July 2-5 U.S. Senior Open in Columbus, Ohio. ‘Project Hail Mary’ Orbiting $46M+ Frame; ‘They Will Kill You’ At $5M-$6M CBS Cancels ‘DMV’ & ‘Watson’; What It Means For Network’s Comedy Pilots Pete Davidson To Play Mafia Killer & Paul Walter Hauser Is DEA Agent In ‘Tommy Karate’ Tiger Woods Arrested For DUI After Rollover Crash In Florida Read More About: Comments",0,2026-03-28 09:46:08
2,https://deadline.com/2026/03/nexstar-tegna-merger-blocked-temporary-restraining-order-1236768329/,Judge Grants Restraining Order To Pause Nexstar-Tegna Merger,Deadline,2026-03-28T04:04:36,3737,"Skip to main content By Ted Johnson Ted Johnson Political Editor @tedstew More Stories By Ted Jane Fonda Leads First Amendment Rally Near Kennedy Center To Warn Of Paramount-Warner Bros Merger & Trump’s Media Attacks Savannah Guthrie Sets Return To ‘Today’ Amid Mother’s Disappearance: “I Can’t Not Come Back, Because It’s My Family” Donald Trump’s Signature To Appear On U.S. Paper Currency, A First For A Sitting President View All March 27, 2026 9:04pm Nexstar Media Group and Tegna Courtesy A federal judge on Friday evening granted a temporary restraining order to halt Nexstar ‘s merger with Tegna , a transaction that creates a broadcasting giant with almost 260 stations across the country. U.S. District Judge Troy Nunley sided with DirecTV, which is seeking to block the merger on the claim that it violates antitrust laws. A group of states, including California and New York, also are seeking to sideline the transaction. In his order, Nunley wrote that DirecTV established “a likelihood of success on the merits” on its claim, and that moving forward with the transaction would create “irreparable harm.” Those are two key factors courts weigh in issuing TROs, after which a judge gives a fuller consideration as the legal process plays out. In ordering at least a temporary halt to the merger, the judge wrote that the “private benefits Nexstar could obtain by acquiring Tegna are outweighed by the harm to” DirecTV. Related Stories Politics Jane Fonda Leads First Amendment Rally Near Kennedy Center To Warn Of Paramount-Warner Bros Merger & Trump's Media Attacks News Savannah Guthrie Sets Return To 'Today' Amid Mother's Disappearance: ""I Can't Not Come Back, Because It's My Family"" His ruling means that Nexstar and Tegna cannot integrate their operations for 14 days, or if he issues another ruling before that. The judge set a hearing for April 7 on whether to issue a preliminary injunction. Watch on Deadline Nexstar and Tegna got the sign off for their merger from the FCC and the Justice Department last week. Shortly after that, Nexstar announced that it had closed the transaction. DirecTV had filed its lawsuit less than a day earlier. Nexstar has argued that the combination of stations is necessary given the changes in the media landscape, as local advertising has shifted to major tech giants. They contend that the transaction will allow them to make greater investments in local news. DirecTV has warned that the transaction would give Nexstar-Tegna market power to raise the amount of restransmission consent fees distributors have to pay for carrying its stations. Those fees, DirecTV argued, ultimately would be passed on to the consumer. The judge wrote, “Nexstar must permit Tegna to continue operating as a separate and distinct, independently managed business unit from Nexstar, and Nexstar must put measures in place to maintain Tegna as an ongoing, economically viable, and active competitor. Tegna shall have separate management that operates Tegna in the ordinary course consistent with pre-closing practices.” Newsmax, DirecTV and a group of state broadband and cable groups are challenging the FCC’s approval of the merger in a federal appellate court in Washington. Donald Trump endorsed the $6.2 billion merger last month, and his FCC chairman, Brendan Carr, indicated his support shortly thereafter, even though the transaction was still being reviewed by the agency. ‘Project Hail Mary’ Orbiting $46M+ Frame; ‘They Will Kill You’ At $5M-$6M CBS Cancels ‘DMV’ & ‘Watson’; What It Means For Network’s Comedy Pilots Pete Davidson To Play Mafia Killer & Paul Walter Hauser Is DEA Agent In ‘Tommy Karate’ Tiger Woods Arrested For DUI After Rollover Crash In Florida Read More About: Comments",0,2026-03-28 09:46:10
3,https://deadline.com/2026/03/bowen-yang-matt-rogers-joey-fatone-jc-chasez-titanique-1236768321/,"Bowen Yang, Matt Rogers, Joey Fatone & JC Chasez Join ‘Titanique’ Producing Team For Limited Broadway Run",Deadline,2026-03-28T03:37:52,3917,"Skip to main content By Glenn Garner Glenn Garner Associate Editor @xoxo_glenn More Stories By Glenn Bowen Yang, Matt Rogers, Joey Fatone & JC Chasez Join ‘Titanique’ Producing Team For Limited Broadway Run Antonio Banderas Was Told He Could Only Play “Bad Guys” Because Of His Ethnicity Corey Feldman Reacts To Exclusion From Rob Reiner Oscars Tribute: “It Is What It Is” View All March 27, 2026 8:37pm (L-R) Matt Rogers, Bowen Yang, Joey Fatone and JC Chasez have joined the 'Titanique' producing team. John Nacion/PMC/Michael Buckner/PMC/Gilbert Flores/PMC/Elyse Jankowski/PMC A new group of passengers have boarded the producing team of Titanique as the musical parody makes its limited Broadway run. Tony-winning producer Eva Price announced this week that Las Culturistas co-hosts Bowen Yang (who famously played the Iceberg on SNL ‘s ‘Weekend Update’)and Matt Rogers and NSYNC members Joey Fatone and JC Chasez have joined her on the cult stage hit as previews kicked off Thursday at the St. James Theatre, with opening night set for April 12 and a final bow on July 12. “We’re beyond excited to welcome this smart, outrageous, and completely unsinkable group of pop culture royalty aboard Titanique,” said Price. “As longtime supporters of the show, it means so much to have them now officially join us in this new capacity and help keep the ship sailing full speed ahead. Titanique is all about big laughs, big talent, and even bigger heart, and this group embodies all of that and more.” Related Stories News Hit Musical Comedy ‘Titanique’ Sailing To Broadway This Spring Casting Jim Parsons, Deborah Cox & Frankie Grande Board Broadway’s Upcoming ‘Titanique’ Co-written by Tye Blue, Marla Mindelle and Constantine Rousouli, the Olivier Award-winning musical is a send-up of James Cameron’s Titanic (1997), complete with a Céline Dion-driven soundtrack that includes ‘My Heart Will Go On’, ‘All By Myself’ and ‘To Love You More’, and told from the perspective of the Canadian pop sensation. Watch on Deadline Directed by Blue with choreography by Ellenore Scott, the Broadway cast includes Marla Mindelle as Céline Dion, Melissa Barrera as Rose DeWitt Bukater, Jim Parsons as Ruth Dewitt Bukater, Deborah Cox as Unsinkable Molly Brown, Frankie Grande as Victor Garber, Rousouli as Jack Dawson, John Riddle as Cal Hockley, Layton Williams as The Iceberg. Background vocalists are Sara Gallo, Polanco Jones and Kristina Leopold, with Tess Marshall, Brad Greer and Kyle Ramar Freeman as understudies. Melissa Barrera as Rose Dewitt Bukater and Constantine Rousouli as Jack Dawson take a bow during the curtain call for ‘Titanique’ on Broadway at the St. James Theatre on March 26, 2026 in New York City. (Bruce Glikas/WireImage) In addition to lead producer Price and its new additions, the producing team includes Diamond Dog Entertainment, Mindelle, Rousouli, Blue, OD Company, OD Universe & Co., MEP, James L. Nederlander, Tristan Schukraft, Joe Mulvihill, Patty Baker, James Berwind, Broadway MDs, Crossroads Live, Ken Davenport, Hungryman Entertainment, John Gore Organization, Perakos-Fellman Adventures, Rogers & Spiro, Monica Saunders-Weinberg, ShowTown Productions & Matthew Sycle, Tom Tuft, Boucher & Grant, Melissa Haizlip, IPN, Jelmoni & Lazar, Lauren Kennedy Brady, Willette Klausner, Manhead Merch, Griffin Schultz, Donald Smith, FGSW Productions, Iris Smith and NSST Entertainment. After making its off-Broadway debut in summer of 2022 at the Asylum Theatre, productions of Titanique have mounted in London’s West End, Sydney, Toronto, Montréal, Chicago, Paris and São Paulo. ‘Project Hail Mary’ Orbiting $46M+ Frame; ‘They Will Kill You’ At $5M-$6M CBS Cancels ‘DMV’ & ‘Watson’; What It Means For Network’s Comedy Pilots Pete Davidson To Play Mafia Killer & Paul Walter Hauser Is DEA Agent In ‘Tommy Karate’ Tiger Woods Arrested For DUI After Rollover Crash In Florida Read More About: Comments",0,2026-03-28 09:46:11
28,https://www.hollywoodreporter.com/tv/tv-news/harry-potter-trailer-most-viewed-hbo-history-1236549353/,"‘Harry Potter’ Trailer Surpasses 277M Views, Becomes Most-Watched in HBO History",Hollywood Reporter,2026-03-28T02:47:23,2445,"Skip to main content By Lexi Carson Plus Icon Lexi Carson Associate Editor View All March 27, 2026 7:47pm Dominic McLaughlin as Harry Potter in 'Harry Potter: The Philosopher's Stone.' Courtesy of HBO Max Logo text Fans are tuned in to see the Boy Who Lived back on screen. Harry Potter and the Philosopher’s Stone , a TV series reimagining J.K. Rowling’s seven-part book series and part of the Warner Bros. franchise, which starred Daniel Radcliffe as its title character, released its first trailer on Wednesday. After the first 48 hours, it had reached more than 277 million organic views across platforms, making it the most-watched trailer in HBO and HBO Max history. The first season of the multiseason series is set to follow Rowling’s first novel, Harry Potter and the Sorcerer’s Stone , and each season will presumably focus on another book. Related Stories TV Bill Maher Says President Trump Tried to Block His Kennedy Center Honor: ""I Respect the Move"" TV For Julio Torres, Life Would Be Better Without Navy Blue “I’ve always wanted to know about my parents,” Harry says in the trailer to Hagrid (Nick Frost), who responds: “Your parents were the kindest, bravest people I have ever met. They were funny and clever and they stood up for what they believed was right. The next time I see you will be at Hogwarts.” The trailer shows Harry meeting, who will become his best friends, Ron Weasley (Alastair Stout) and Hermione Granger (Arabella Stanton), picking up the sorting hat, attending Herbology class and playing Quidditch in, of course, team Gryffindor apparel. Here is the official logline: “There is nothing special about Harry Potter — at least that’s what his Aunt Petunia (Bel Powley) always says. On his 11th birthday, a letter of admittance to Hogwarts School of Witchcraft and Wizardry opens up a hidden world for Harry: one of fun, friendship and magic. But with this new adventure comes great risk as Harry is forced to face a dangerous enemy from his past.” The series also stars John Lithgow as Albus Dumbledore, Janet McTeer as Minerva McGonagall, Paapa Essiedu as Severus Snape, Rory Wilmot as Neville Longbottom and Lox Pratt as Draco Malfoy, among others. Francesca Gardiner ( Succession ) is the showrunner and Mark Mylod ( Game of Thrones ) will direct several episodes. Harry Potter and the Philosopher’s Stone premieres Christmas 2026 on HBO and will stream exclusively on HBO Max. Watch the trailer below. THR",0,2026-03-28 09:46:38
29,https://www.hollywoodreporter.com/tv/tv-news/bill-maher-real-time-trump-kennedy-center-mark-twain-1236548952/,Bill Maher Says President Trump Tried to Block His Kennedy Center Honor: “I Respect the Move”,Hollywood Reporter,2026-03-28T02:41:27,4864,"× Skip to main content By Chris Gardner Plus Icon Chris Gardner chrissgardner Follow Sign Up View All March 27, 2026 7:41pm Bill Maher appears on an episode of ‘Real Time With Bill Maher.’ Courtesy of HBO Max/Warner Bros. Discovery After a confusing swirl that included “fake news” denials from the White House communications team, Bill Maher offered some clarity about being picked to receive the 27th Mark Twain Prize for American Humor from the Kennedy Center . The veteran host leaned into this week’s big news during Friday night’s episode of Real Time With Bill Maher on HBO Max by addressing it in the opening minutes of his monologue as he recognized there’s been “a lot of back and forth” about whether or not he was actually going to get it. “We have reached a compromise. The compromise is that I am going to get it and then I’m going to give it to [President Donald Trump],” he joked. “Everybody’s happy. I just want things to work out.” Related Stories TV 'Harry Potter' Trailer Surpasses 277M Views, Becomes Most-Watched in HBO History News Council on American-Islamic Relations Speaks Out Against Bill Maher Receiving Kennedy Center Honor Looks like they are now after the Kennedy Center confirmed Thursday that Maher would receive the 27th Mark Twain Prize for Humor at a ceremony scheduled for June 28 (and streaming on Netflix at a later date). The honor “recognizes individuals who have had an impact on American society in the same vein as Mark Twain,” and the organization’s vp public relations Roma Daravi praised Maher for “influencing American discourse — one politically incorrect joke at a time.” The official confirmation came a week after the Atlantic published a report citing multiple sources that Maher had been selected to receive the prize and fielded an offer but the stamp of approval could be complicated due to his history with President Trump, who has oversight of the Kennedy Center. President Trump slammed Maher in February as a “highly overrated LIGHTWEIGHT” in a Truth Social post , which detailed his White House dinner with the comedian that he called “a complete waste of time.” After the Atlantic published its story, Trump’s communications deputies shot it down . “This is fake news. Bill Maher will NOT be getting this award,” White House press secretary Karoline Leavitt said. “Literally FAKE NEWS,” White House communications director Steven Cheung added. It’s unclear how it went from “fake news” to being very real when the Kennedy Center confirmed it this week and whether or not Trump gave it his stamp of approval. Maher addressed the spokesperson denials on Friday night, but added that he just wants to say thank you. And he’s “not looking for a fight” nor is he mad at Trump for the back and forth. “Me and the president, we have a complicated relationship that goes back to the orangutan lawsuit,” Maher quipped, referencing a 2013 lawsuit which found Trump suing Maher for comments he made during an appearance on The Tonight Show With Jay Leno . Maher challenged Trump to provide a copy of his birth certificate to prove he’s not “spawn of his mother having sex with an orangutan.” Trump later withdrew the suit. “This has been going on a long time, so him trying to block me from getting it — I respect the move. I respect the move. Keep the game going, baby, OK, I’m all about engagement. Disengagement gets you nothing. You got to engage,” continued Maher, who then turned his attention to the insults Trump has lobbed at him on Truth Social. “We’re back to him calling me a ‘jerk’ and I’m a ‘lightweight ratings loser.’ Get it off your chest, big man, OK, I’m totally fine with that.” Maher even said he was “proud of these last insults” Trump tossed in his direction, and he added them to a long list that he brought with him to the White House. A split screen then showed an image of a sheet of paper with a White House logo and a long list of insults, many of which Maher read aloud. “So I would just like to say as a low ratings lightweight and a rather dumb guy and a pathetic, bloated sleaze bag, a dummy, a terrible student, a nervous, failing comedian and someone who was sick, insane, very sad, totally shot in, a crazy maniac, I am honored to accept the Mark Twain Prize. Thank you very much,” he said. “I will be there, Don, and I hope you will be too. I mean, the place is named after you now, you really should show up. You could show up. You could thank me in person for being one of the few people on the lunatic left who’s glad you hit Iran and is hoping we win that one.” Maher’s newest episode featured a one-on-one interview with U.S. Senator Elissa Slotkin (D-MI), a former CIA analyst and Pentagon official. His panel hosted CNN’s Laura Coates and ESPN star Stephen A. Smith, who hosts Straight Shooter with Stephen A. and The Stephen A. Smith Show on SiriusXM and YouTube. THR",0,2026-03-28 09:46:39
4,https://deadline.com/2026/03/antonio-banderas-told-could-only-play-bad-guys-ethnicity-1236768310/,Antonio Banderas Was Told He Could Only Play “Bad Guys” Because Of His Ethnicity,Deadline,2026-03-28T02:01:23,2841,"Skip to main content By Glenn Garner Glenn Garner Associate Editor @xoxo_glenn More Stories By Glenn Bowen Yang, Matt Rogers, Joey Fatone & JC Chasez Join ‘Titanique’ Producing Team For Limited Broadway Run Antonio Banderas Was Told He Could Only Play “Bad Guys” Because Of His Ethnicity Corey Feldman Reacts To Exclusion From Rob Reiner Oscars Tribute: “It Is What It Is” View All March 27, 2026 7:01pm Antonio Banderas attends the 'Competencia Oficial' premiere during the Malaga Film Festival on March 11, 2026 in Malaga, Spain. Carlos Alvarez/Getty Images Although Antonio Banderas has led a versatile onscreen career, he experienced ethnic stereotyping and typecasting early in his career. The Oscar nominee recently recalled being told he could only play “bad guys” due to Hispanic ethnicity, which is why he’s proud of breaking out of that box with his roles in the Zorro and Shrek franchises. “They said, you are here, like the blacks and the Hispanics, to play the bad guys,” Banderas recalled to The Times . “The problem was a few years later I had a mask, hat, sword and cape and the bad guy was Captain Love, who was blond and had blue eyes. Even more important is Puss in Boots , because it’s for young kids. They see a cat that has a Spanish, even an Andalusian accent and he’s a good guy.” Related Stories News J.K. Rowling Is ""So Happy"" With 'Harry Potter' Teaser As Fans Remain Divided Politics Barack Obama Breaks Silence On ""Deeply Troubling"" Trump-Posted AI Video Depicting Him As Ape, Blames Social Media ""Clown Show"" After Banderas originated the voice role of the swashbuckling feline in Shrek 2 (2004), also appearing in Shrek the Third (2007) and Shrek Forever After (2010), as well as his own spin-offs Puss in Boots (2011) and Puss in Boots: The Last Wish (2022), he said last year that he had not yet been invited back for Shrek 5 , premiering June 30, 2027. Watch on Deadline “I’m not so far, and I’m not being called for that,” Banderas told Parade . “ Puss in Boots did very well. Number two got a nomination for the Oscar, and the movie behaved beautifully at the box office. But I am totally satisfied with the five Puss in Boots that I did. I don’t know what is going to happen in the future. Maybe they [will] call me tomorrow.” Puss in Boots (voiced by Antonio Banderas) in ‘Puss in Boots: The Last Wish’ (2022) (Universal Pictures/Courtesy Everett Collection) The character was influencer by Zorro, whom Banderas also played in The Mask of Zorro (1998) and The Legend of Zorro (2005). ‘Project Hail Mary’ Orbiting $46M+ Frame; ‘They Will Kill You’ At $5M-$6M CBS Cancels ‘DMV’ & ‘Watson’; What It Means For Network’s Comedy Pilots Pete Davidson To Play Mafia Killer & Paul Walter Hauser Is DEA Agent In ‘Tommy Karate’ Tiger Woods Arrested For DUI After Rollover Crash In Florida Read More About: Comments",0,2026-03-28 09:46:12
