id,url,title,source,publication_date,text_length,full_text,is_duplicate,created_at
24,https://variety.com/2026/film/news/scott-pilgrim-game-mike-nick-nick-alice-director-bendavid-grabinski-1236701562/,"Director BenDavid Grabinski on Future of ‘Scott Pilgrim’ After ‘EX’ Video Game, Filming Two Vince Vaughns for ‘Mike & Nick & Nick & Alice’",Variety,2026-03-27T22:00:00,6303,"Mar 27, 2026 3:00pm PT Director BenDavid Grabinski on Future of ‘Scott Pilgrim’ After ‘EX’ Video Game, Filming Two Vince Vaughns for ‘Mike & Nick & Nick & Alice’ By Jennifer Maas Plus Icon Jennifer Maas TV Business Writer @jmaasaronson Latest ‘Poppy Playtime’ Video Game Creators on Chapter 5’s Massive Launch, Film Adaptation and Plotting Chapter 6: ‘What Comes Next Has to Really Hit Hard’ 16 hours ago PlayStation Raises Price of PS5 to $650 in U.S.; PS5 Pro, PlayStation Portal Also See Hikes 20 hours ago Content Creator Alanah Pearce Launches Charred Pictures in Partnership With Game Devs; ‘Faith: The Unholy Trinity’ Film Adaptation, Two More Movies in the Works (EXCLUSIVE) 2 days ago See All Tribute Games “ Scott Pilgrim ” fans got another hit of their favorite world earlier this month with the launch of new beat-em-up video game, “Scott Pilgrim EX.” And there might be more where that came from. BenDavid Grabinski , who produced the Tribute Games video game in collaboration with “Scott Pilgrim” franchise creator Bryan Lee O’Malley, and previously created the Netflix animated series “Scott Pilgrim Takes Off” alongside O’Malley, tells Variety he’s “open to doing ‘Scott’ stuff in any sort of medium that people want to make it.” Related Stories Disney Releases Trailer for New 'Create Your World' Doc Episode, Sets Pre-Orders for Collector Cinderella Doll Debra OConnell Rises to Chairman of U.S. Entertainment TV for Disney as Creative Chief Dana Walden Unveils Her Executive Team “I enjoy kind of being Bryan’s sidekick, where it’s just nice to be a sort of a steward in that universe of stuff,” Grabinski said. “And it’s helpful, too, because when we finished the show and we told people that we didn’t think we wanted to do a Season 2, or there wouldn’t be one, I was like vaguely saying, ‘But there will be more “Scott Pilgrim.”‘ It’s because the game existed then, and we just couldn’t talk about it. So the process of how long these things take is, like, who knows? It’s not like there’s gonna be a Broadway musical, but if there was gonna be one, three years from now, I’d be like, ‘Oh, yeah, by the way, we’ve been working on that.’ It could just be that thing where every few years, suddenly, you pop up with some new iteration of the thing in some other medium. As long as people want to see surreal stuff that takes place in Toronto, Canada, that doesn’t actually exist, I’m interested.” Popular on Variety “Mike & Nick & Nick & Alice”/Hulu SXSW On Friday, Grabinski releases his latest project: the sci-fi, action-comedy “Mike & Nick & Nick & Alice,” starring Vince Vaughn, James Marsden and Eiza González. Available for streaming now on Hulu, the movie is meant to be a buddy-action flick with a time-travel twist. However, Grabinski (who both wrote and directed the film) doesn’t want audiences to get bogged down in the logistics of time travel and strived to make that part of the plot as simple as possible, explaining just as much as you need to understand why there are two Nicks (Vaughn) on screen. “You know that [the time machine] worked,” Grabinski said. “You know the guy built it. You know Nick came back in time six months and you know the machine blew up. So you know they’re not going to be able to use the machine again. And you know that if anything happens to the present-day version of Nick, it’ll happen to the future version, which is all you really need to know. You know, we stab him in the leg, and then the future version of him has a scar on his leg. You sort of give people enough to know the dramatic stakes, and then it just becomes about the characters and what they’re dealing with in the moment. You don’t want it to feel like at any moment they could jump through time again and redo things. Everything they do has a finality to it. This isn’t like a movie that has dozens of loops or alternate timelines or whatever. It’s just, they got to survive the night, bare minimum.” To Grabinski, the quantum physics of “Mike & Nick & Nick & Alice” were less of a headache than the production logistics on the sci-fi film. “I’ll tell you something that’s more difficult than time travel, it’s shooting two Vince Vaughns,” Grabinski said. “It involves science and involves giant machines. It involves a bunch of people who really have to do the charts and graphs and figure out how to do everything. It’s 60% technical and then 40% just traditional performance stuff. But it’s figuring out how to have a guy, who can be a little loose and not stay on script, act across from himself when you have this computer-operated camera that’s as big as a house that you have to program and move to repeat a scene exactly the same.” Grabinski added: “You spend a half a day with Vince’s one character, and then the other half with that [other character], and then have to replicate all of it with an earwig in your ear. The whole goal is that when the audience watches it, it’ll not feel like it’s difficult, and they’re not thinking about it and I think we achieve that. But while we’re making it, we unfortunately had to think about it a lot, which is not exactly my favorite thing to do” Hogwarts Gets Collegiate-Style Merch in New ‘Harry Potter’ Homage Collection John Lithgow on Playing Dumbledore in ‘Harry Potter’ Series and J.K. Rowling’s Trans Views: ‘People Insisted I Walk Away From the Job. I Chose Not to Do That’ John Lithgow Considered Quitting HBO’s ‘Harry Potter’ Series Over J.K. Rowling Backlash: It Will Come Up in ‘Every Interview’ for the ‘Rest of My Life’ Katie Leung ‘Would Not Want to Go Back’ to Her Time Shooting ‘Harry Potter’ Movies: ‘I Was So Easily Influenced’ Tom Felton Has Reached Out to New Draco Malfoy in ‘Harry Potter’ Series: ‘Here’s My Phone Number … If You Need a Word of Encouragement, I’m There’ Daniel Radcliffe Tells Press Not to Always Ask HBO’s ‘Harry Potter’ Cast About the Original Movie Actors: ‘Just Let Them Get On… It’s Going to Be Different’ Loading comments... More From Our Brands Rolling Stone Jack White Slams Trump’s Signature on U.S. Dollars Amid America’s Rising Cost of Living Robb Report Ryan Seacrest Spins His 40-Acre California Wine Country Estate Back on the Market Sportico Lachlan Murdoch Makes 92x Return on Royals Cricket Sale WWD Consumer Confidence Continues to Drop as Gas Prices Rise",0,2026-03-28 09:46:34
12,https://deadline.com/2026/03/snowfall-spinoff-cast-isidora-goreshter-mykelti-williamson-1236768053/,"‘Snowfall’ Spinoff Casts 9 Including Isidora Goreshter, Mykelti Williamson, Brandon Mychal Smith & Nicki Micheaux",Deadline,2026-03-27T22:00:00,3809,"Skip to main content By Denise Petski Denise Petski Senior Managing Editor More Stories By Denise ‘Snowfall’ Spinoff Casts 9 Including Isidora Goreshter, Mykelti Williamson, Brandon Mychal Smith & Nicki Micheaux ‘Kennedy’ Adds 13 To Cast Including Patrick Fischler, Caitlin Fitzgerald, Denis O’Hare & Eddie Marsan; First-Look Photo Taylor Bloom Joins NBC Drama Pilot ‘Protection’ View All March 27, 2026 3:00pm From left: Isidora Goreshter, Mykelti Williamson, Brandon Mychal Smith and Nicki Micheaux FX; Kevin Lynch; Tommy Flanagan EXCLUSIVE: FX is rounding out cast for its as-yet untitled Snowfall spinoff series, adding nine in recurring roles. Isidora Goreshter (Shameless ), Mykelti Williamson ( The Last Rodeo ) Brandon Mychal Smith ( You’re The Worst ) and Nicki Micheaux ( Night Patrol ) heavily recur, along with Eric Balfour ( The Offer ), Richard Portnow ( EZ Street) , Zaire Adams ( Trap House ), Demetrius Grosse ( Banshee) and OG Snowfall cast member Quincy Chad . They will join original series stars Gail Bean and Isaiah John , who are reprising their roles as Wanda and Leon Simmons, respectively. Related Stories News ‘Snowfall’ Spinoff Starring Gail Bean & Isaiah John Picked Up To Series By FX News ‘The AI Doc’ Takes On Humanity’s Great Challenge, Mall Witches Romp In ‘Forbidden Fruits’, Films By Sylvain Chomet, Julia Ducournau In Eclectic Indie Weekend — Specialty Preview Set in ‘90s Los Angeles, the new series follows Snowfall characters Wanda (Bean) and Leon (John) as they fight to take West Coast rap mainstream while gang wars erupt and record labels move to exploit hip hop culture for their own gain. Previously announced Asante Blackk, Peyton Alex Smith and Simmie Sims III also star. The untitled Snowfall spinoff is executive produced by Malcolm Spellman, Dave Andron, Thomas Schlamme, Julie DeJoie, Michael London, Trevor Engelson and Paul Garnes. The series is produced by FX Productions. L-R: Eric Balfour, Richard Portnow, Zaire Adams, Demetrius Grosse and Quincy Chad Getty Images; Michael Greenwald; Vivien Kililea; Zuma Press; David Noles Goreshter, best known for her roles on Shameless and Condor, is repped by IAG and More/Medavoy. Williamson, who next will be seen in the Orion/Amazon MGM feature film Is God Is and in Apple TV’s Dark Matter , is repped by Paradigm, More Medavoy and Myman Greenspan. Smith, who previously starred in Hulu’s Four Weddings and a Funeral and is known for his role as Sam Dresden in FX’s You’re the Worst, is repped by Innovative Artists, Artists First and Jackoway Austen Tyerman. Micheaux, who recently starred in the vampire horror film Night Patrol and will next be seen in the upcoming season of Prime Video’s Ballard, is repped by Arise Artists Agency and Stride Management. Grosse, known for his roles in Banshee , Justified and Fear the Walking Dead , most recently appeared in Marvel’s Wonder Man. He’s repped by Artium Talent and Fox Rothschild. Balfour most recently appeared in the Amazon’s Wilderness and previously starred in Paramount+’s The Offer . He’s repped by Buchwald and Anonymous Content. Adams has appeared in features including Trap House , Netflix’s Senior Year and The Ride , as well as Netflix’s On My Block spinoff Freeridge . He’s repped by CESD, Crimson Media and Skrzyniarz & Mallean. Chad most recently appeared as “Big Deon” on FX’s Snowfall and previously guest-starred on CBS’ S.W.A.T . and recurred on Starz’s Power . He’s repped by Buchwald and Vanguard Management Group. ‘Project Hail Mary’ Orbiting $46M+ Frame; ‘They Will Kill You’ At $5M-$6M CBS Cancels ‘DMV’ & ‘Watson’; What It Means For Network’s Comedy Pilots Pete Davidson To Play Mafia Killer & Paul Walter Hauser Is DEA Agent In ‘Tommy Karate’ Tiger Woods Arrested For DUI After Rollover Crash In Florida Read More About: 1 Comments",0,2026-03-28 09:46:21
36,https://www.hollywoodreporter.com/lifestyle/arts/cazzie-david-regrets-new-book-interview-1236516352/,Cazzie David Has Regrets About Her New Book,Hollywood Reporter,2026-03-27T21:58:50,9204,"× Skip to main content By Seija Rankin Plus Icon Seija Rankin Senior Editor seijawrites Follow Sign Up View All March 27, 2026 2:58pm Cazzie David Cibelle Levi This isn’t Cazzie David’s first time releasing a deeply personal work to the public. In 2020, she published No One Asked for This , in which she wrote candidly about her struggles with panic attacks and her breakup with Pete Davidson. She also co-wrote and directed an indie film about toxic relationships, I Love You Forever (2024). And yet, true to form, neither of those experiences has helped to soften the blow of releasing another book. “I’ve been struggling to find ways to talk about it,” she says of Delusions: of Grandeur, of Romance, of Progress , which muses on turning 30 and all the existential crises therein. “It’s hard to describe a book of essays. This is so harrowing. If someone doesn’t like this book, it’s not just them saying they don’t like my writing. It’s ‘I don’t like your personality.'” Related Stories The AI Issue A New AI Scam Is Targeting Thousands of Authors. I Was One of Them. Lifestyle Disney Adds Official Winnie the Pooh Cookbook to Lineup of 100th Anniversary Collectibles David, now 31, is also grappling with the realization that her book may very well find an audience — an audience who will read stories about her life that she wrote without fully considering the fact that they would go public. “When the time comes to turn the manuscript in you’re like, ‘Wait, I haven’t decided if all this is going to be in the book!’ But I think that about everything in the book, so they take the whole thing. They basically kidnapped this from me and I have no choice.” Some of the essays are benign and well-documented; tales of her own neuroses, and her obsessions with the health of her father, Seinfeld and Curb Your Enthusiasm creator Larry David. Others are more pointed; her recounting of an attempt to make a new friend and the disastrous dinner party that ensued, a nightmarish experience on the set of an (unnamed) indie movie set, a nightmarish experience becoming a member of an (unnamed) celebrity and influencer gym in Los Angeles. “Please don’t say the name of the actual gym, even though it will be pretty obvious to anyone who reads it, but I’m not looking forward to dealing with the aftermath,” she says. “This gym was very convenient for me and I don’t think I’ll be allowed back there. So I will have to mourn the places that I used to go and the people I used to see.” The fact that Los Angeles has a gym that is invite-only for influencers and celebs, and is free to use in exchange for posting on social media, and everyone at the gym wears the clothing owned by the brand — it’s such perfect fodder for a humor essay that I can’t believe you’re the first person to call it out. Yeah, I was surprised no one had and I’m glad I got to. Again, it will impact my life deeply to do so. Any time I’m writing about someone else, whether relationships or career stuff, I’m really scared for anyone to see it. It’s funny because when you read something, or watch a movie, about something real, it doesn’t really occur to you that the person who wrote it might not back it 100 percent. I’m in no way ruthless, I’m not writing this stuff like, “Fuck that.” I’m questioning myself the whole time. It’s the braver choice to write this stuff, and I’m by no means a brave person but I try to justify it as my job as an observer of my own life. And if someone does something ridiculous, you can also tell yourself it’s their fault. I also try to make it about my experience in it; I’m not sharing something personal about someone else. You did an interview with your dad recently, and he said that with Curb Your Enthusiasm , he is inspired by real-life interactions he has but he changes so much that no one recognizes themselves in it; that can’t be true, can it? I don’t think that’s true, either. When he said that, I was like, “OK.” I think he’s really only been confronted about something in the show once, and he thinks he’s making little changes. But also, people are so self-involved that they can watch or read something blatantly about them and it wouldn’t occur to them. Do you give the people in the essays a heads up that you’re writing about them? If someone I’m close to, or someone I used to be close to, is in it then I’ll reach out and tell them even if it’s not very identifiable. But also, a lot of what’s in the book is made up for comedic purposes, or for the sake of the story. There are three boyfriends that I have turned into one new person. So the breakup you write about is an amalgamation of breakups? Yeah. I really wanted to talk about this thing that happens when you’re in your late 20s and early 30s, where you’re not ready to break up with someone but you feel like you have to for your future self. You want to make the right decisions by her and not waste any more time, and it feels like you can’t have a fun boyfriend anymore. That person isn’t someone who can carry their half of the burden of life with you. So to make that character, it required taking stuff from different boyfriends I’ve had in my 20s and putting them into one person. Courtesy of St. Martin’s Press Do you consider yourself an old soul? Those anxieties you describe are totally relatable, but I’m a bit older than you and didn’t start to notice those things among my peers until our 30s. I think I’m really anxious about the future and I engage very earnestly with these pressures and delusions that are inherent to our modern society. I would love to be delusional enough to detach from the modern world and not think about that stuff — I don’t know if it’s rational or irrational to be reasoning my way through an unreasonable existence. Have your parents read the entire book? There are a couple sex scenes and I’m wondering if you let them see those portions. I tried to send a Jeffrey Epstein redacted version. My mom got impatient and just read the unredacted version, which I was very upset by. My parents read my work very differently. My mom reads it as a mother and my dad reads it as a writer, so I’m much more comfortable showing my dad. My mom was totally concerned after reading the book. My dad, the more disturbing it is, the happier he is. Did you watch redacted versions of Curb ? I didn’t watch it until I was in college, so it was the full version. But yeah, no one wants to see that, let’s be honest. Given how you grew up, did you ever have a period of considering another career? Never. After college, I really wanted to get started in the TV industry and it was incredibly challenging despite all the doors I had open for me. I spent eight years in development with four different streamers and six different pilots. I thought my writing lent itself well to a 30-minute screenplay, but I needed an outlet for my ideas and that’s how I started writing essays. A lot of people whose parents are in the industry say that it helped prepare them for the turmoils of the business, or be prepared for rejection. But I can’t imagine you saw a lot of that given your dad’s successes. Was there a particular experience that helped clarify what the business is really like, or are you still looking for that clarity? Part of it is just getting older. Obviously, I started pretty young and I didn’t have a full understanding of what the industry was like. You meet so many writers who are struggling to get stuff made. You see some who are very lucky and don’t know about [rejection] because they’ve gotten really good opportunities. But even famous people have a hard time. I feel very aware of how hard it is, even if you have connections. A few of your essays touch on the toxicity of Instagram; have you ever considered getting off social media? I write about my addiction to the internet, and even since the time I lasted edited that essay, Instagram has changed so much in what they show you and how quickly they adjust your algorithm. I don’t have a healthy relationship to it at all. I’ve stopped trying to because it feels like such a lost cause. So many of us feel like we wasted our entire 20s on our phones. I thought that when I turned 30, I’ll suddenly be off my phone. And then literally when it struck midnight I was on Instagram. I was like, “Great, I guess I’m not changing.” I’m so scared to find out the truth in 10 years when the real results of what we’ve all done to ourselves come to light. It’s going to be really scary to look back on. It already impacts so many different things. Sometimes I’ll look back at an old Hollywood movie star and it’s like, “Oh my God, it doesn’t look like they’re wearing a mask.” Now, it’s like everyone has the same weird mask face. Whose opinion about your work means the most to you? Honestly, everyone’s opinion holds equal weight. I sent Lena Dunham an early copy because I’m obsessed with her, and she was so kind to me. So I would say her, but the man in the basement, as everyone says — he is just as important to me. As the book comes out, what do you care about the most, especially in regard to its success? My biggest wish is always not to be publicly humiliated, and that is the most I can ever ask for. THR",0,2026-03-28 09:46:47
26,https://variety.com/2026/film/news/project-hail-mary-four-hour-cut-embarrassing-1236701473/,‘Project Hail Mary’ Directors Screened a Nearly Four-Hour Cut to Other Filmmakers and Were Told to ‘Get It Way Shorter’: ‘It Was Embarrassing’,Variety,2026-03-27T21:49:17,3912,"Mar 27, 2026 2:49pm PT ‘Project Hail Mary’ Directors Screened a Nearly Four-Hour Cut to Other Filmmakers and Were Told to ‘Get It Way Shorter’: ‘It Was Embarrassing’ By Zack Sharf Plus Icon Zack Sharf Digital News Director ZSharf Latest ‘Project Hail Mary’ Directors Screened a Nearly Four-Hour Cut to Other Filmmakers and Were Told to ‘Get It Way Shorter’: ‘It Was Embarrassing’ 12 hours ago Antonio Banderas Came to Hollywood and Execs Told Him: ‘You Are Here, Like the Blacks and Hispanics, to Play the Bad Guys’ 18 hours ago Andrew Garfield Defends Watching ‘Harry Potter’ Movies Even if ‘It’s Controversial and We Shouldn’t Be Putting Money in the Pocket’ of ‘She That Shall Remain Nameless’ 19 hours ago See All ©MGM/Courtesy Everett Collection “ Project Hail Mary ” directors Phil Lord and Chris Miller recently appeared on the “Happy Sad Confused” podcast and revealed they showed a nearly four-hour cut of their space movie to a group of director friends. However, the results were “embarrassing.” “Our first official test screening went great, but we do a lot of earlier screenings for friends and family and other filmmakers and writers,” Miller explained. “This movie was massive. When we finally got the assembly cut down to under four hours long, we subjected some filmmaker friends of ours to a three hour and 45 minute cut of the movie, which was embarrassing.” Related Stories OpenAI Just Spiked Bob Iger's Final Big Strategic Deal. For Disney, Maybe That's Lucky Tonies Debuts Disney Plush Toys -- Including Simba, Mickey Mouse, Olaf and More Lord noted that the feedback the directing duo got was unanimous: “Get it way shorter.” Popular on Variety “You just don’t know how the scenes are going to land with an audience,” Lord said. “We thought everything was charming, but some of those charming things didn’t land. It made it really easy to get it down to three hours.” “Then we had to slowly, slowly work our way down to 2.5 hours,” Miller added, which is around the final length of the movie’s theatrical cut. “Project Hail Mary” is based on Andy Weir’s book of the same name and stars Ryan Gosling as Ryland Grace, a science teacher and former molecular biologist who is recruited by the government to help save the Earth from dying. Ryland then unwittingly finds himself on an interstellar mission that includes meeting the alien Rocky. The movie was a blockbuster success in its opening weekend with $80.5 million at the domestic box office, the year’s biggest opening so far and the top debut in Amazon MGM’s history. The movie has since crossed the $100 million mark domestically ahead of its second weekend of release. Watch Lord and Miller’s full interview on the “Happy Sad Confused” podcast in the video below. Andrew Garfield Defends Watching ‘Harry Potter’ Movies Even if ‘It’s Controversial and We Shouldn’t Be Putting Money in the Pocket’ of ‘She That Shall Remain Nameless’ ‘Harry Potter’ First Look: The Wizarding World of Hogwarts Is Revealed ‘Harry Potter’ Series Set to Be the ‘Streaming Event of the Decade,’ Says Warner Bros. Discovery Streaming Boss Daniel Radcliffe Spoke to Emma Watson and Rupert Grint About HBO’s ‘Harry Potter’ and ‘How Surreal It Is’ to Watch a New Cast ‘Starting Off on That Journey’ Tom Felton Has Reached Out to New Draco Malfoy in ‘Harry Potter’ Series: ‘Here’s My Phone Number … If You Need a Word of Encouragement, I’m There’ John Lithgow Considered Quitting HBO’s ‘Harry Potter’ Series Over J.K. Rowling Backlash: It Will Come Up in ‘Every Interview’ for the ‘Rest of My Life’ Loading comments... More From Our Brands Rolling Stone Jack White Slams Trump’s Signature on U.S. Dollars Amid America’s Rising Cost of Living Robb Report Ryan Seacrest Spins His 40-Acre California Wine Country Estate Back on the Market Sportico Lachlan Murdoch Makes 92x Return on Royals Cricket Sale WWD Consumer Confidence Continues to Drop as Gas Prices Rise",0,2026-03-28 09:46:36
