id,url,title,source,publication_date,text_length,full_text,is_duplicate,created_at
38,https://www.hollywoodreporter.com/tv/tv-news/adolescence-2026-royal-television-society-program-awards-1236546596/,"‘Adolescence’ Tops 2026 Royal Television Society Program Awards, With 2 Wins for Owen Cooper",Hollywood Reporter,2026-03-25T09:53:06,4216,"× Skip to main content By Lily Ford Plus Icon Lily Ford @lilyfordtweets Follow Sign Up View All March 25, 2026 2:53am 'Adolescence' producers Stephen Graham, Hannah Walters at the RTS Program Awards on Mar. 24, 2026. Courtesy of Getty Hot off the heels of the BAFTA TV Awards nominations , Adolescence is continuing its run of form with four wins at the Royal Television Society ‘s Program Awards. The ceremony took place at London’s JW Marriott Grosvenor House Hotel on Tuesday night, hosted by comedian-presenter Tom Allen with the aim of celebrating the best of U.K. television. Among the attendees were Erin Doherty, Dylan Llewllyn, Steve Coogan, Mawaan Rizwan, Stephen Graham , Katherine Parkinson, Lucy Punch, Davina McCall, Gabby Logan, Alison Steadman, Jack Thorne, and Malachi Kirby. Related Stories TV Far-Right Attacks on Public Broadcasting Threatens Artistic Freedom, European Screenwriters Warn Movies Hong Kong Action Film 'The Furious' Releases Brutal First Trailer Across the 29 competitive categories, the BBC led with 16 awards, including for The Celebrity Traitors and wins for the stars of Unforgivable , Bobby Schofield and Anna Friel, in the leading actor and supporting actress categories. The BBC also won the highly contested drama series category for Blue Lights , and Kat Sadler nabbed best writer for Such Brave Girls . Netflix followed with five wins, four of which went to Adolescence . Breakout star Owen Cooper won both the breakthrough award and supporting actor prize. Cooper’s co-star Erin Doherty also presented the judges’ award to Adolescence producers Stephen Graham, Hannah Walters, and Matriarch Productions, gaining recognition for providing a platform for underrepresented voices — from all cultural backgrounds and social classes — to tell their story. “They wanted to produce work that offered a voice to the voiceless, work that told the neglected narratives of people who’d grown used to their life experiences and struggles being overlooked — or just plain ignored,” said co-star Doherty, presenting them with the award. “In particular, they wanted to tell stories that had a working-class perspective running right through them.” In the comedy categories, Prime Video’s Last One Laughing won comedy entertainment, while Steve Coogan won for his performance in How Are You? It’s Alan (Partridge) . Channel 4’s Big Boys took home the comedy drama award, and the BBC’s Things You Should Have Done , fronted by comedian and internet personality Lucia Keskin/Chi With A C, won in the scripted category. The 2026 outstanding achievement award went to Monty Python star Michael Palin . Check out the full list of winners at RTS’ Program Awards below. Arts The Last Musician of Auschwitz Breakthrough Award Owen Cooper , Adolescence Children’s Program Crongton Comedy Drama Big Boys Comedy Entertainment Last One Laughing Comedy Performance – Female Philippa Dunne, Amandaland Comedy Performance – Male Steve Coogan, How Are You? It’s Alan (Partridge) Daytime Program BBC Breakfast – Our Girls: The Southport Families Documentary Series Bibaa & Nicole: Murder in the Park Drama Series Blue Lights Entertainment & Reality The Celebrity Traitors Entertainment Performance Rob Beckett & Romesh Ranganathan, Rob & Romesh Vs Formatted Popular Factual The Assembly History Flight 149: Hostage of War Leading Actor – Female Narges Rashidi, Prisoner 951 Leading Actor – Male Bobby Schofield, Unforgivable Limited Series and Single Drama Adolescence Live Event Holocaust Memorial Day 2025 (BBC Studios Events for BBC) Presenter Hamza Yassin, Hamza’s Hidden Wild Isles Science & The Natural World Underdogs Scripted Comedy Things You Should Have Done Single Documentary Grenfell: Uncovered Soap and Continuing Drama EastEnders Sports Presenter, Commentator or Pundit Gabby Logan, Women’s Rugby World Cup 2025 Sports Program 2025 Abu Dhabi Grand Prix (Sky Sports) Supporting Actor – Female Anna Friel, Unforgivable Supporting Actor – Male Owen Cooper, Adolescence Writer – Comedy Kat Sadler, Such Brave Girls Writer – Drama Jack Thorne & Stephen Graham, Adolescence Judges’ Award Stephen Graham, Hannah Walters, and Matriarch Productions Outstanding Achievement Award Michael Palin THR",0,2026-03-25 10:00:40
28,https://variety.com/2026/tv/global/getting-under-your-skin-undercover-drama-second-season-1236698759/,‘Getting Under Your Skin’ Undercover Drama Greenlit for Second Season (EXCLUSIVE),Variety,2026-03-25T09:51:56,4190,"Mar 25, 2026 2:51am PT ‘Getting Under Your Skin’ Undercover Drama Greenlit for Second Season (EXCLUSIVE) Canadian creator-writer Simon Boulerice teases ‘a situation just as toxic as in season one,’ Quebec’s Zone3 reveals at Series Mania By John Hopewell Plus Icon John Hopewell Chief International Correspondent john_hopewell Latest A Nuclear Warship Thriller, Kyrgyz Action Drama and Latin Dancing Dramedy Win Series Mania’s Big Industry Prizes 12 hours ago Iceland’s Act4, Co-Led by ‘Severance’ Star Ólafur Darri Ólafsson, Teams With Kari Skogland, Director of ‘The Handsmaid’s Tale,’ to Adapt ‘Dead Weight’ (EXCLUSIVE) 13 hours ago One Real Post-Peak TV Crunch: A Supply Chain That’s Too Slow 23 hours ago See All Getting Under Your Skin Courtesy of Zero3 Writer wunderkind Simon Boulerice ’s “Getting Under Your Skin” has been greenlit for a second season, Zero3 vice-president of fiction development, creation, and production Dominique Veillet told Variety in advance of a Quebec showcase at the Series Mania Forum. The Montreal high school-set undercover drama is one of seven series in the Coming Next From Quebec panel that are seeking market traction in Lille. Related Stories Will Ferrell's Netflix Golf Comedy 'The Hawk' Unveils Teaser and Sets Summer Premiere 'Heated Rivalry' Star Hudson Williams Among Six to Recur in Netflix FTX Series 'The Altruists' The first episode premieres this week on Quebec’s TV5, which greenlit Season 2. Popular on Variety Season 1 of the eight-part series, each 24 minutes, follows Gaspard (Félix-Antoine Bénard), a queer teenage crime-show fan, as he befriends and infiltrates the life of a young police officer (Anthony Therrien) who has disguised himself as a student to investigate a drug-dealing network with connections to organized crime. Bénard is best known for his lead performance in the multi-award-winning 2023 Venice Days head-turner “Humanist Vampire Seeking Consenting Suicidal Person,” and Therrien for his work in three seasons of the French-language Canadian version of “The Red Band Society.” Both actors are returning for season 2 of “Getting Under Your Skin.” “At a time when synthetic drugs are circulating more widely and becoming increasingly insidious, the series takes on a timely and urgent issue,” says Veillet, who produced Season 1 with Caroline Langlois. “What makes the show unique is its hybrid nature, blending a coming-of-age story with a crime drama,” says series director Éric Piccoli, who has been tapped for Season 2. “When those worlds collide, the result is a refreshing and intriguing tale that quickly draws us in and creates a strong emotional connection to the characters.” Script work is already underway for the second season, and Montreal screenwriter Boulerice—a playwright, poet and children’s author, who is also a co-creator and co-writer on Coming Next From Quebec series “Take Care”—is leading his student and cop characters into darker terrain. “My wish is to see Gaspard again a year and a half later, now in CEGEP (pre-university college) and unwittingly caught up, through a series of events, in a situation just as toxic as in Season 1: a juvenile prostitution ring operating in certain bars in the Gay Village,” he tells Variety . “It is in this context that he reconnects with Thomas, who has returned to the world of undercover work.” “Getting Under Your Skin” is repped at Series Mania by Mélanie Ratte of Sphere Abacus. The Movie Business Has Never Been Harder, So Why Are All These New Distribution Companies Launching? Neon Buys Sundance Documentary ‘Once Upon a Time in Harlem’ Following Heated Bidding War Neon Acquires Worldwide Rights to ‘Clarissa’ Starring Sophie Okonedo, David Oyelowo and Ayo Edebiri, Directed by Filmmakers Arie and Chuko Esiri Neon, Oscar-Winning Studio Behind ‘Parasite’ and ‘Anora,’ in Talks to Sell Stake to Department M (EXCLUSIVE) Neon Buys Ryusuke Hamaguchi‘s Paris-Set ‘All of a Sudden’ Loading comments... More From Our Brands Rolling Stone OpenAI Pulls the Plug on Sora Just Months After Launch Robb Report Russell Crowe Shows Off Toledano & Chan’s Newest Brutalist Watch on TikTok Sportico Monarch Makes First WNBA Investment in Cleveland Team",0,2026-03-25 10:00:30
1,https://deadline.com/2026/03/mediawan-group-leonine-studios-ceo-fred-kogel-contract-2028-1236765189/,Mediawan Group Extends Leonine Studios CEO Fred Kogel’s Contract Until 2028,Deadline,2026-03-25T09:35:52,4318,"Skip to main content Dismiss News Banner Breaking News Stephen Colbert Set To Write Next ‘Lord Of The Rings’ Movie After Forthcoming ‘The Hunt For Gollum’ Read the full story By Melanie Goodfellow Melanie Goodfellow Senior International Film Correspondent @mel_goodfellow More Stories By Melanie Postmedia Studios & Elevation Pictures Unveil Strategic Partnership Kicking Off With Wildfire Doc ‘Fire Weather’ Berlinale Shifts 2027 Dates To Accommodate More Public Screenings As It Posts Record Ticket Sales ‘Sirāt’: Neon Sets Digital & Blu-Ray Release Dates For Oscar-Nominated Rave Culture Drama View All March 25, 2026 2:35am Fred Kogel Thomas Dashuber Leonine Studios ‘ longtime CEO Fred Kogel will remain in his role at least until 2028 in a contract extension agreed with parent company Mediawan Group . The announcement comes two years after Paris-based pan-European content group Mediawan acquired Germany’s Leonine Studios, having owned a 25% since 2020. Kogel has been CEO of Leonine Studios since 2019, which he founded in the same year together with New York-based international investment group KKR. Under Kogel’s leadership Leonine Studios has evolved into one of the biggest independent production and distribution groups in German-speaking Europe, with hits including School of Magical Animals 2 & 3, Girl You Know It’s True , and Weekend Rebels , which is now poised for a U.S. remake. Related Stories News Trailer Showcases 'Brabus: One Second Wow'; Premiere Date Set For Luxury Car Brand Series On Prime Video Books Anna Klassen Tapped To Adapt Anna Shilling Novel 'All In Monte Carlo' For Leonine Studios In other C-suite announcements, Quirin Berg will also be appointed Deputy Chairman of the Management Board of Leonine Holding GmbH on April 1, 2026. Watch on Deadline Berg has been responsible for the content strategy of the entire fiction division of Leonine Studios as Chief Creative- and Co-Chief Production Officer Fiction since January 2020. Jochen Köstler, who has been Executive Vice President Non-Fiction and Managing Director of i&u Studios within the Leonine Group since January 2024, will join the Management Board of Leonine Holding as Chief Production Officer Non-Fiction on April 1, 2026. He will be responsible for the entire non-fiction production division in the role. The Management Board of Leonine Holding is completed by Sarah Fischer, who continues in her role as Chief People & Sustainability Officer; Max Wiedemann remains as Business Development and Co-Chief Production Officer Fiction of Leonine Studios as well as Head of AI Mediawan Group; and Bernhard zu Castell remains Chief Distribution Officer, overseeing theatrical, home entertainment, and audio-distribution, the licensing segment as well as channels. “I am delighted that we will be continuing on the highly successful path of Leonine Studios, the production and distribution group I co-founded,” said Kogel. “At the same time, I am looking forward to building on Leonine’s success in the future with Quirin and Jochen in their expanded roles, as well as Sarah, Max, Bernhard and our regional CFO Jens Mezger – my entire management team. In recent years, we have successfully tapped into additional potential thanks to our intensive collaboration with Pierre-Antoine Capton and the Mediawan Group. We will systematically continue to pursue this internationally successful course.” Mediawan Group co-founder and CEO Pierre-Antoine Capton said Mediawan’s collaboration with Leonine Studios was at the heart of the group’s ambitions to be “a global independent champion, driven by top-tier talent and a strong European vision”. “ We are delighted to continue working closely with Fred and his teams and to further accelerate synergies across the group, such as Weekend Warriors, Plan B’s movie adaptation of the film Weekend Rebels developed by Leonine Studios’ production banner Wiedemann & Berg Film – to develop more international projects and strengthen our growth together,” he said. Disney’s $1B Investment In OpenAI DOA As Sam Altman Pulls Plug On Sora Netflix Sets ‘13 Going On 30′ Reboot With Emily Bader & Logan Lerman; Garner An EP Hannah Berner & Paige DeSorbo Lead Comedy Series In Works At Netflix ‘John Wick’ Spinoff About Blind Assassin Caine Locked & Loaded For Start Read More About: Comments",0,2026-03-25 10:00:00
29,https://variety.com/2026/tv/global/streaming-pay-tv-european-audiovisual-observatory-1236698719/,"Streaming Subscriptions, Pay-TV, Theatrical Box Office and Home Video Drive European Audiovisual Industry Revenue to $165 Billion",Variety,2026-03-25T09:32:56,4749,"Mar 25, 2026 2:32am PT Streaming Subscriptions, Pay-TV, Theatrical Box Office and Home Video Drive European Audiovisual Industry Revenue to $165 Billion The European Audiovisual Observatory's latest data shows film production at record high in Europe as Netflix, YouTube and Meta move into leading positions across the region. By Ed Meza Plus Icon Ed Meza @edmezavar Latest Beta Film Group’s Autentic Nabs World Rights to Contrast Film’s Swiss Docuseries ‘Game Over – The Fall of Credit Suisse’ (EXCLUSIVE) 1 day ago ‘Empathy’ Director Guillaume Lonergan Set to Shoot Debut Feature ‘Denise sans Denis,’ Starring Josée Deschênes (EXCLUSIVE) 1 day ago All3Media International Scores Global Pre-Sales for Gemma Arterton Spy Thriller ‘Secret Service’ (EXCLUSIVE) 2 days ago See All 'One Piece' is currently the top Netflix show in Germany. Courtesy of Netflix Europe’s audiovisual sector generated some €142 billion ($164.7 billion) in revenues in 2024, driven largely by consumer spending, which accounted for more than 50% (€72 billion) via streaming subscriptions, pay-TV, cinema tickets and home video, making it the primary engine of growth. The European Audiovisual Observatory presented the latest data from the film and TV sector in its newly published Key Trends 2026 report on Wednesday, offering a snapshot of how the European audiovisual sector is evolving, from the creative workforce and production trends to changing viewing habits, market dynamics and global competition. Related Stories 'BTS The Comeback Live: Arirang' Hits 18.4 Million Viewers on Netflix Netflix Out as Investor in Meghan Markle Brand As Ever The 11th edition of the Key Trends report specifically examines developments in advertising, pay services, broadcasting and production. Popular on Variety Among the main takeaways: European film production hit a record high in 2024, with 2,523 feature films produced across 36 markets, confirming a strong recovery and continued growth since the pandemic. The increase was driven by both fiction and documentary output, while production budgets also continued to rise across much of Europe, according to the report. On the SVOD and TV front, the European Audiovisual Observatory found that audiences in Europe spend most of their streaming time watching series rather than films — 78% vs. 22% — underscoring how episodic storytelling has become the dominant format in the streaming economy. The report also notes that while “SVOD services have become an essential part of the European audiovisual landscape, accounting for around 60% of all pay-service subscriptions in 2024, compared to 40% for pay TV” and the only growing segment, they now appear to be approaching maturity. “The SVOD market is driven more by tariff increases and/or the launch of advertising-supported tiers than by expansion of the subscriber base,” it adds. Another key takeaway: Streaming services are investing more in European content. Global streaming platforms increased their share of spending on original European programming from 8% in 2020 to 24% in 2024, reflecting both regulatory incentives and increasing demand for local content across global markets. Of Europe’s overall scripted films and series produced between 2015 and 2023, 14% were adaptations – the equivalent of 1,524 film and TV series adaptations. On average, over 160 titles and more than 1,400 hours of audiovisual fiction adaptations are produced each year in Europe. Looking at European TV and SVOD fiction adaptations, a large majority — 88% — are based on original European works, with more than half coming from the U.K. (23%), Germany (17%), France (10%) and Spain (7%). Only one in 10 (12%) of all European audiovisual fiction adaptations are based on non-European works, 6% of which originate from the U.S. On a more sobering note, European Audiovisual Observatory found that European players, despite a vibrant domestic industry, account for just 12% of international entertainment sector revenue, far behind the U.S., which dominates the global market. Major global platforms such as Netflix , YouTube and Meta, meanwhile, are now among the leading audiovisual players operating in Europe. ‘Life Is Strange’ TV Series Casts Maisy Stella, Tatum Grace Hopkins as Chloe and Max (EXCLUSIVE) ‘Life Is Strange: Reunion’ Actors on Ending Max and Chloe’s ‘More Mature’ Story in New Video Game, Hopes for Live-Action TV Series ‘Life Is Strange’ TV Series Taps Karyn Kusama to Direct First Two Episodes (EXCLUSIVE) Loading comments... More From Our Brands Rolling Stone OpenAI Pulls the Plug on Sora Just Months After Launch Robb Report Russell Crowe Shows Off Toledano & Chan’s Newest Brutalist Watch on TikTok Sportico Monarch Makes First WNBA Investment in Cleveland Team",0,2026-03-25 10:00:31
39,https://www.hollywoodreporter.com/tv/tv-news/far-right-attacking-artistic-freedom-say-euro-screenwriters-1236543860/,"Far-Right Attacks on Public Broadcasting Threatens Artistic Freedom, European Screenwriters Warn",Hollywood Reporter,2026-03-25T09:30:00,5105,"× Skip to main content By Scott Roxborough Plus Icon Scott Roxborough Europe Bureau Chief sroxborough Follow Sign Up View All March 25, 2026 2:30am 'The Best Immigrant' Courtesy of Sony Pictures Television The Federation of Screenwriters in Europe issued a report on Wednesday documenting how attacks by the far-right on European public broadcasters are threatening free speech and artistic expression. The umbrella group, which represents 31 screenwriters guilds and unions from 25 countries, says these attempts to defund or exert political control over public broadcasters has a direct impact on creatives, who are under pressure to self-censor if they want to get work. In a 61-page report, entitled “Right to Write,” the Federation highlighted cases from across Europe where right-wing parties in power have carried out a “playbook” to systematically “delegitimize journalism, intimidates critics, concentrate media influence, weaponize regulators, politicize cultural bodies, and either defund or capture those public institutions that shape shared reality.” Related Stories TV 'The Pitt' Star Noah Wyle Calls for Universal Health Coverage in U.S., Talks Season 3 and Explains Why the Hit Show ""Could Run Forever"" TV French Sailors, Soviet Gangsters and Canadian Dancers Win Series Mania Forum Awards The report cites efforts by right-wing governments in power in countries including Hungary, Poland, the Czech Republic, Bulgaria, and Slovakia, to exert political control over national media by withdrawing funding, threatening to challenge or revoke broadcasting licenses and by installing loyalists in key positions of power at public broadcasters. “Most far-right and populist parties in Europe are united in their desire to emasculate or close down public service broadcasting, or, if in power, to subordinate it to their agendas,” writes former Federation President Carolin Otto, in the forward to the report. Many of the far-right parties across Europe, writes Otto, are trying to present and propagate a “nationalist fantasy” of “a past that never existed, of faith, family and fatherland” and are ready “to censor those stories that do not fit this frozen mythology, this static and idealized vision of the past.” Their attempts to intimate or influence public channels and funding bodies, she argues, is “an assault” on the freedom of artistic expression. Already in many cases, she notes, systems have been put in place to “limit the subjects and topics that can be addressed by writers” seeking public support, “leading to wide-spread self-censorship.” “This is more of a warning, that we in Europe need to be very alarmed,” says Helen Perquy of Jonnydepony, the Belgian production company behind sci-fi dystopian series Arcadia . “We all see what is happening in the U.S., we never thought that a democracy like the U.S. could become what it is now.” Already, says Perquy, European broadcasters are becoming more cautious and conservative in their commissioning, dialing back efforts to promote diversity on screen or storytelling from marginalized groups. “I’ve been saying, the old white man is back. It’s a joke, but it’s also true,” she says. European public broadcasters, Perquy argues, need to be a counterbalance to bottom-line commercial networks and streamers, to be “bold, diverse and let many voices in.” Public broadcasters are the main source of funding for TV fiction production in Europe, accounting for 55 percent of fiction series commissions in 2023, compared to 31 percent for commercial broadcasters and 14 percent for global streamers. In 2023, the last year for which figures are available, public broadcasters spend around € 7.2 billion ($8.3 billion) on original European content, excluding news and sports rights. State subsidies and government tax incentives are also a primary source of film funding, with the Federation estimating that direct public funding of films accounted for 27 percent of overall production costs for theatrical life-action features in 2022, with a further 20 percent coming from tax and other incentives. Attacks on public broadcasters proposed by far-right parties, writes Otto, is undermining “a central pillar of European audiovisual commissioning and production funding.” European broadcasters, “must be free of politically motivated interference in its work, especially when it broadcasts material critical of government or comments on problematic aspects of contemporary life.” Material “critical of government” commenting on “problematic aspects of contemporary life” would seem to describe a good portion of the line-up at Series Mania this year . The selection Belgium series The Best Immigrant , which imagines a dystopian future following the election of a far-right, anti-migrant party in Flanders; SVT’s legal drama The Burden of Justice , about the corrupting influence of money on the Swedish justice system; and Spanish period drama Anatomy of a Moment , which traces the story of the attempted 1981 coup d’etat that almost pulled the country back into Fascism. The 2026 Series Mania festival runs through March 27. THR",0,2026-03-25 10:00:42
