id,url,title,source,publication_date,text_length,full_text,is_duplicate,created_at
21,https://variety.com/2026/film/news/lionel-messi-fan-film-52-blue-london-indian-film-festival-1236739373/,"Adil Hussain, Neha Dhupia’s Lionel Messi Fan Drama ’52 Blue’ to Open London Indian Film Festival (EXCLUSIVE)",Variety,2026-05-07T07:00:00,4219,"May 7, 2026 12:00am PT Adil Hussain, Neha Dhupia’s Lionel Messi Fan Drama ’52 Blue’ to Open London Indian Film Festival (EXCLUSIVE) By Naman Ramachandran Plus Icon Naman Ramachandran Latest Adil Hussain, Neha Dhupia’s Lionel Messi Fan Drama ’52 Blue’ to Open London Indian Film Festival (EXCLUSIVE) 4 hours ago Amazon MX Player Integrates Into Prime Video in India 4 hours ago ‘Squid Game’ Star Lee Byung-hun Boards Martial Arts Film ‘Nambeol’ 1 day ago See All London Indian Film Festival “ 52 Blue ,” a coming-of-age drama about a sheltered young man’s journey from Kerala to the FIFA World Cup in Qatar in pursuit of his childhood idol, Lionel Messi , will open the 17th London Indian Film Festival with its European premiere at BFI Southbank on July 9. Directed by Ali El Arabi (“Captains of Zaatari”), the film will also screen at Midlands Arts Centre in Birmingham on July 10. El Arabi and members of the cast are scheduled to attend both screenings. Related Stories GameStop (Yes, GameStop) Makes $56 Billion Bid for eBay “52 Blue” centers on Ashish (Yadav Shashidhar), a young man raised in isolation on a Kerala island by an overprotective father and a quietly encouraging mother, played respectively by Adil Hussain (“Life of Pi”) and Neha Dhupia (“Qayamat: City Under Threat”). After breaking free from that sheltered existence, Ashish sets out across continents, driven by a goal bound up in the memory of his late brother. The film features an original song, “It’s Your Turn,” by rapper and singer-songwriter Badshah. Popular on Variety The London Indian Film Festival – which also encompasses the Birmingham Indian Film Festival and Manchester Indian Film Festival – marks its 17th year with a program spanning 20 venues across six U.K. cities: London, Birmingham, Manchester, Sheffield, Bradford and Liverpool. The event presents work in 10 languages and is supported by the BFI Audience Projects Fund, which distributes National Lottery funding. “We are delighted to open our 17th festival with this riveting and inspirational film about youth finding a way against impossible odds, which seems to wonderfully go against the grain of these despondent times,” said Cary Rajinder Sawhney, the festival’s CEO and programming director. “The contrast of the protagonist’s life from smalltown Kerala to the massive spectacle of international stadiums really sums up the dichotomy of experience in the modern world and how Indian people are often the hidden backbone workers of richer nations. El Arabi skillfully extracts commanding performances from their young actor Yadav Shashidhar and globally recognized names like Adil Hussain.” “It goes beyond words to express how deeply grateful and happy I am, not only because the film is screening at Europe’s largest South Asian film festival, reaching an audience that has always felt close to my heart and profoundly moved me, but also because of the privilege of working with extraordinary actors such as Adil Hussain and Neha Dhupia, alongside the remarkable team that brought this story to life, the same spirit that once made the World Cup feel possible,” added El Arabi. “I take immense pride in all of this. But beyond the professional achievement lies something deeply personal: the fulfillment of a dream to show that stories are universal. They have the power to cross borders, languages, and cultures, and still reach us in the most intimate way. Because despite everything that separates us, there is still one language we all understand, the language of the heart. And I hope this film reminds the younger generation that there are no boundaries for dreams, and that even our quietest thoughts carry the power to change the world.” The full multi-city program will be unveiled on June 10. Ranbir Kapoor Unveiled as Lord Rama in Trailer for Nitesh Tiwari’s Epic ‘Ramayana’ Hans Zimmer’s Bleeding Fingers Music Expands to London, Sets U.K. Leadership Loading comments... More From Our Brands Rolling Stone Chris Stapleton Covers Willie Nelson’s Pro-Immigrant Song ‘Living in the Promiseland’ on ‘Colbert’ Robb Report BMW’s ‘Neue Klasse’ iX3 Can Travel 434 Miles on a Single Charge Sportico Inter Miami Takes Equity Stake in Beckham-Founded IM8 Parent",0,2026-05-07 11:13:13
26,https://www.hollywoodreporter.com/movies/movie-news/shana-film-trailer-2026-cannes-directors-fortnight-1236588047/,"‘Shana’ Must Deal With a Toxic Partner Leaving Prison, a Death and More. Can a Ring Protect Her? (Exclusive Cannes Directors’ Fortnight Trailer)",Hollywood Reporter,2026-05-07T06:59:00,2160,"× Skip to main content By Georg Szalai Plus Icon Georg Szalai Global Business Editor View All May 6, 2026 11:59pm 'Shana' Courtesy of Les Films du Losange When her grandmother dies, Shana inherits a ring that is supposed to protect her from bad luck. And wow, does she need it! After all, Shana must not only navigate the trials and tribulations of everyday life with the support of her group of friends. Her toxic partner is also being released from prison. So, all sorts of misfortunes are piling up… This is the set-up for Shana , a French comedy-drama directed by Lila Pinell, which world premieres in the Directors’ Fortnight (Quinzaine des cinéastes) program during the 2026 Cannes Film Festival . The filmmaker’s second feature and her first as a solo director is an adaptation the short film Le Roi David , which she wrote and directed. Related Stories Movies Francesco Sossai's 'Last One for the Road' Sweeps Italy's David di Donatello Awards Business Griffin Gaming Partners Launches $100 Million Fund for Indie Titles With Hollywood Potential (Exclusive) Produced by Ecce Films and CG Cinema, international sales are handled by Les Films du Losange. Starring Eva Huault, who was also the lead in Le Roi David , and Noémie Lvovsky, the movie takes audiences through the environment around the protagonist. “Her character moves around, like the ring, from one story, world or situation to the next,” highlights Pinell in a director’s statement. “In that respect, she is a wonderful narrative engine. Shana gets everything around her moving and stops those worlds from closing in on themselves. She sticks her foot in the door, she knocks down fences. She is in her own right a principle of motion.” About Shana, she says: “There is, in her, the desire for emancipation but she is not really able to put her finger on it. It leads her into confrontational situations and conflicts that seem to resolve nothing.” A trailer for Shana , which THR can now exclusively debut, we meet the protagonist, her friends and a whole lot of her headaches. It also showcases her energy and outspokenness, including at a cemetery. Watch the trailer for Shana here. THR",0,2026-05-07 11:13:19
22,https://variety.com/2026/tv/news/amazon-mx-player-merges-prime-video-india-1236740262/,Amazon MX Player Integrates Into Prime Video in India,Variety,2026-05-07T06:46:47,3665,"May 6, 2026 11:46pm PT Amazon MX Player Integrates Into Prime Video in India By Naman Ramachandran Plus Icon Naman Ramachandran Latest Adil Hussain, Neha Dhupia’s Lionel Messi Fan Drama ’52 Blue’ to Open London Indian Film Festival (EXCLUSIVE) 4 hours ago Amazon MX Player Integrates Into Prime Video in India 4 hours ago ‘Squid Game’ Star Lee Byung-hun Boards Martial Arts Film ‘Nambeol’ 1 day ago See All Amazon MX Player Amazon MX Player is being absorbed into Prime Video , combining India’s free and paid streaming catalogs under a single platform. The integration is expected to complete within the next few months. The unified platform will cover subscription, ad-supported, transactional, and add-on subscription offerings simultaneously, giving Prime members the choice of ad-supported or ad-free viewing. Non-subscribers will have access to a wider free library with a direct path to upgrade to Prime. Related Stories GameStop (Yes, GameStop) Makes $56 Billion Bid for eBay Amazon MX Player emerged in 2024 when Amazon acquired select assets from the legacy MX Player brand and combined them with its Amazon miniTV operation. The merged service built a substantial user base through locally rooted originals, reality formats, microdramas, and a catalog of dubbed international content, along with ad technology that enabled free digital entertainment at scale across India. Popular on Variety “Our focus at Prime Video has always been to bring authentic stories that reflect the diversity of our audiences,” Gaurav Gandhi, VP, Asia-Pacific and ANZ, Prime Video, said. “With the integration of Amazon MX Player’s expansive original slate and audience scale, our collective offering is bigger and stronger than ever – making Prime Video the one-stop destination for quality entertainment, for every customer in the country.” “Amazon MX Player has built remarkable engagement through a diverse library, and bringing it together with Prime Video’s iconic stories means we can keep serving our customers with the largest selection of exclusive and original content from India and around the world,” Gandhi added. On the technical rollout, the Amazon MX Player app on Android will continue operating with a rebranded identity, featuring a dedicated Prime Video experience and a path to Prime membership for users who choose to upgrade. Those accessing Amazon MX Player via iOS, connected TV, or the web will be redirected to Prime Video, where content from both services – including free, ad-supported titles – will be available. “The unification of Amazon MX Player with Prime Video is a gamechanger for advertisers in India,” Girish Prabhu, VP and head of Amazon Ads India, said. “We’ve created a single streaming destination that reaches audiences across the entire spectrum – from free ad-supported viewers to Prime members – enabling true full-funnel advertising on an unprecedented scale. Advertisers now have access to the most relevant and high-performing ad formats, all powered by trillions of shopping, browsing, and streaming signals, transforming every impression into measurable business outcomes, making Prime Video the most comprehensive video advertising service in Indian streaming.” Ranbir Kapoor Unveiled as Lord Rama in Trailer for Nitesh Tiwari’s Epic ‘Ramayana’ Hans Zimmer’s Bleeding Fingers Music Expands to London, Sets U.K. Leadership Loading comments... More From Our Brands Rolling Stone Chris Stapleton Covers Willie Nelson’s Pro-Immigrant Song ‘Living in the Promiseland’ on ‘Colbert’ Robb Report BMW’s ‘Neue Klasse’ iX3 Can Travel 434 Miles on a Single Charge Sportico Inter Miami Takes Equity Stake in Beckham-Founded IM8 Parent",0,2026-05-07 11:13:14
27,https://www.hollywoodreporter.com/movies/movie-news/last-one-for-the-road-sweeps-david-di-donatello-awards-1236588886/,Francesco Sossai’s ‘Last One for the Road’ Sweeps Italy’s David di Donatello Awards,Hollywood Reporter,2026-05-07T06:45:40,5452,"× Skip to main content By Scott Roxborough Plus Icon Scott Roxborough Europe Bureau Chief sroxborough Follow Sign Up View All May 6, 2026 11:45pm 'The Last One for the Road' ©Vivo Film Francesco Sossai’s boozy feel-good dramedy The Last One for the Road ( Le città di pianura ) was the big winner at Italy ’s David di Donatello Awards, sweeping the ceremony held at Rome’s Cinecittà studios on Wednesday night, taking home eight trophies including best film and best director. The road movie, which premiered in Cannes’ Un Certain Regard section in 2025, stars Sergio Romano and Pierpaolo Capovilla as two fifty something men from Italy’s northern Veneto region who strike up an unlikely friendship with a shy student from Naples, played by Filippo Scotti. Related Stories Business Griffin Gaming Partners Launches $100 Million Fund for Indie Titles With Hollywood Potential (Exclusive) Movies Mubi Takes Lukas Dhont's 'Coward' in Multiple Territories, Including U.K., Australia, Germany The film entered the night as the frontrunner, with 16 nominations, and also won prizes for best actor for Romano, original screenplay, editing, original song, casting and producer. Other multiple winners included opera director Damiano Michieletto’s feature debut Primavera , a Venice-set drama inspired by Antonio Vivaldi that collected four awards, including best score and best costumes. Silvio Soldini’s World War II drama The Tasters ( Le assaggiatrici ), about a group of young women forced to serve as food tasters for Adolf Hitler while living in constant fear of poisoning, picked up three prizes including adapted screenplay and the David Giovani youth award. Gabriele Mainetti’s martial arts action-thriller Forbidden City ( La città proibita ) also won three trophies, including cinematography, production design and visual effects. Paul Thomas Anderson’s Oscar Best Picture Winner One Battle After Another won the David for best international film. Anderson was not present to accept the award. Among the honorary prizes, Oscar-winning cinematographer Vittorio Storaro received the Special Cinecittà David Award in recognition of a career that includes work on Francis Ford Coppola’s Apocalypse Now , Bernardo Bertolucci’s The Last Emperor and Warren Beatty’s Reds , as well as collaborations with filmmakers including Dario Argento, Woody Allen, Carlos Saura, Richard Donner, Alfonso Arau and Paul Schrader. Veteran Italian director Gianni Amelio ( The Stolen Children , Lamerica ) was honored with a career David award, while animator and filmmaker Bruno Bozzetto received the Special David prize. The David dello Spettatore, awarded to the year’s biggest local box office success, went to Gennaro Nunziante’s comedy hit Buen Camino , starring Checco Zalone, though neither the director nor the actor attended the ceremony. 2026 David di Donatello Winners Best Film The Last One For The Road ( Le città di pianura ) — Produced by Marta Donzelli and Gregorio Paonessa for Vivo Film, with Rai Cinema, in collaboration with Philipp Kreuzer for Maze Pictures and Cecilia Trautvetter; directed by Francesco Sossai Best Director Francesco Sossai — The Last One For The Road ( Le città di pianura ) Best First Feature Margherita Spampinato — Gioia mia Best Original Screenplay Francesco Sossai and Adriano Candiago — The Last One For The Road ( Le città di pianura ) Best Adapted Screenplay Doriana Leondeff, Silvio Soldini, Lucio Ricca, Cristina Comencini, Giulia Calenda and Ilaria Macchia — The Tasters ( Le assaggiatrici ) Best Producer Marta Donzelli and Gregorio Paonessa for Vivo Film, with Rai Cinema, in collaboration with Philipp Kreuzer for Maze Pictures and Cecilia Trautvetter — The Last One For The Road ( Le città di pianura ) Best Actress Aurora Quattrocchi — Gioia mia Best Actor Sergio Romano — The Last One For The Road ( Le città di pianura ) Best Supporting Actress Matilda De Angelis — Outside ( Fuori ) Best Supporting Actor Lino Musella — Nonostante Best Casting Adriano Candiago — The Last One For The Road ( Le città di pianura ) Best Cinematography Paolo Carnera — Forbidden City ( La città proibita ) Best Score Fabio Massimo Capogrosso — Spring ( Primavera ) Best Original Song “Ti,” written and performed by Krano — The Last One For The Road ( Le città di pianura ) Best Production Design Andrea Castorina and Marco Martucci — Forbidden City ( La città proibita ) Best Costume Design Maria Rita Barbera and Gaia Calderone — Primavera Best Makeup Esmé Sciaroni — The Tasters ( Le assaggiatrici ) Best Hairstyling Marta Iacoponi — Primavera Best Editing Paolo Cottignola — The Last One For The Road ( Le città di pianura ) Best Sound Location Sound: Gianluca Scarlata; Sound Editing: Davide Favargiotti; Sound Design: Daniele Quadroli; Re-Recording Mix: Nadia Paone — Primavera Best Visual Effects Stefano Leoni and Andrea Lo Priore — Forbidden City ( La città proibita ) Best Documentary (David Cecilia Mangini Award) Roberto Rossellini – Più di una vita , directed by Ilaria de Laurentiis, Andrea Paolo Massara and Raffaele Brunetti Best Short Film Everyday in Gaza , directed by Omar Rammal Youth Prize The Tasters ( Le assaggiatrici ), directed by Silvio Soldini Best International Film One Battle After Another , directed by Paul Thomas Anderson David dello Spettatore Buen camino , directed by Gennaro Nunziante Career David Gianni Amelio Special David Bruno Bozzetto Special Cinecittà David 71 Award Vittorio Storaro THR",0,2026-05-07 11:13:20
28,https://www.hollywoodreporter.com/music/music-news/kj-apa-calls-out-mr-fantasy-stealing-image-1236588831/,KJ Apa Calls Out Mr. Fantasy For Stealing His Image: “F***ing Liar and a Thief”,Hollywood Reporter,2026-05-07T04:40:21,3978,"× Skip to main content By Carly Thomas Plus Icon Carly Thomas Senior Editor, Digital carly_thomas_ Follow Sign Up View All May 6, 2026 9:40pm KJ Apa and Mr. Fantasy. Rich Polk/Getty Images for Angel City Sports; Vivien Killilea/Getty Images for 11:11 Media It appears KJ Apa has some beef with himself? His alter ego? It’s not exactly clear, but the Riverdale actor has officially taken to social media to call out Mr. Fantasy . In September 2025, Mr. Fantasy initially went viral for not only his eccentric personality, quirky style and signature black bob, but also because fans were convinced he was Apa’s alter ego . To back up their theories, fans point out that the pair have the exact same tattoos. Up until now, the actor hasn’t addressed the comparisons that have been swirling on social media for months, especially as Mr. Fantasy has continued to see his star power rise from garnering more than 1.2 million followers on TikTok to performing his song “Mr. Fantasy” at the Macy’s Thanksgiving Day Parade . Related Stories Movies KJ Apa Faces Battles as Jimmy Stewart in Trailer for Biopic Movie 'Jimmy' Movies Why Are So Many Actors Creating Online Alter Egos? On Wednesday, Apa posted a lengthy video on his Instagram (below), calling out the singer for stealing his image. “So there has been something going on for a long time that I haven’t addressed because I didn’t think it was even worth addressing,” the actor said in a serious tone. “But now, because of how it’s impacted my life personally, I feel like I have to talk about it, and I don’t usually do this, take things here to talk about. But I have to do it now because it’s hurting me, and my career, and there was recently a music video that was released that included a bunch of people who were really close to me by a guy who’s completely and utterly stolen my image and misappropriated my image. And I think we all know who we’re talking about.” While Apa doesn’t name Mr. Fantasy directly, it’s obvious that the message is directed towards him, as the singer released a music video for his new song “Do Me Right” last week. Numerous celebrities make cameos in the video, including Apa’s Riverdale co-stars Camila Mendes, Lili Reinhart and Madelaine Petsch. Other stars featured are Alex Warren, Dave Franco, Rob Lowe, Nick Jonas, Neal McDonough, Hough Kiernan, Patrick Schwarzenegger, Sombr and Zoey Deutch, among others. “It’s fucked up,” Apa continued. “It’s fucked up because I just lost on a huge job. And can no longer go in for serious work because people think that I’m a joke because of this guy. And I don’t know what to do about it other than bring it here and do everything that I can to protect myself because it’s completely fucking disrespectful and completely wrong to do that.” “If anyone out there thinks that it’s OK to take someone’s image, literal tattoos, and to use it for their own success, it’s completely wrong. And I can’t just sit back and watch it happen and see my life literally, everything that I’ve worked hard for, now come to a halt because of this fucking idiot. That’s all I’ll say. You know, this person advocates for positivity and for kindness and for all of this stuff. Look in the mirror and tell yourself that you’re not a fucking liar and a thief because that’s exactly what you are,” The Map That Leads to You star concluded. Fans will just have to wait and see if Mr. Fantasy drops a response to Apa. When The Hollywood Reporter caught up with the “Wayuwanna” singer last year, Mr. Fantasy said he wasn’t bothered by people comparing him to the actor on social media. “Not bothered by it, not bothered by it,” he said at the time. “Things bother me sometimes, but I keep my eyes upward, and I keep trudging the happy road of happy destiny. You know, things can be hurtful, sure, but I focus on the positive. I focus on the people whom I love and who love me and that have a positive influence on my life, like James Franco.” View this post on Instagram THR",0,2026-05-07 11:13:21
