id,url,title,source,publication_date,text_length,full_text,is_duplicate,created_at
22,https://variety.com/2026/awards/awards/heated-rivalry-stranger-things-traitors-win-glaad-media-awards-1236680434/,"‘Heated Rivalry,’ ‘Stranger Things’ and ‘Traitors’ Win Big at GLAAD Media Awards",Variety,2026-03-06T06:00:00,7367,"Mar 5, 2026 10:00pm PT ‘Heated Rivalry,’ ‘Stranger Things’ and ‘Traitors’ Win Big at GLAAD Media Awards By Marc Malkin Plus Icon Marc Malkin Senior Editor, Culture and Events marcmalkin Latest ‘Heated Rivalry,’ ‘Stranger Things’ and ‘Traitors’ Win Big at GLAAD Media Awards 4 hours ago Leslie Bibb and Alex Edelman Style Tailored Blazers With Shorts and Sneakers In Playful Brooks Brothers Campaign 11 hours ago Billy Crystal and Meg Ryan to Reunite at Oscars for Rob Reiner Tribute; New Details Revealed 2 days ago See All “ Heated Rivalry ,” “ Stranger Things ” and “ Traitors ” were among the big winners at the GLAAD Media Awards Thursday night in Los Angeles. “Heated Rivalry,” the hit HBO Max/Crave series created by Jacob Tierney that follows the love story of two professional hockey players (Connor Storrie and Hudson Williams), was named outstanding new TV series while “Stranger Things” picked up outstanding drama series for its fifth and final season. “Traitors” won outstanding reality competition program and Bravo’s “Southern Hospitality” received outstanding reality program. Related Stories Paramount Skydance Vows to 'Engage Constructively' With Warner Bros. Discovery Board After Making $31 a Share Bid Ted Sarandos Fights to Seal Warner Bros. Discovery Deal: Netflix Co-CEO on Battling 'Misinformation,' the Future of HBO Max and His 'Blood Oath' for Theatrical Exhibition #HeatedRivalry wins Outstanding New TV series at the #GLAADAwards #justforvariety https://t.co/dDk5s3CdMs pic.twitter.com/OeaDHCPbTy — Marc Malkin (@marcmalkin) March 6, 2026 On the film front, “Kiss of the Spider Woman,” Bill Condon’s adaptation of the Broadway musical starring Jennifer Lopez, Tonatiuh and Diego Luna, earned the outstanding wide theatrical release honor. Indie rom-com “Nice Indian Boy” starring Karan Soni and Jonathan Groff and drama “Plainclothes” with Tom Blyth and Russell Tovey tied for limited theatrical release. Popular on Variety Hosted by Jonathan Bennett at the Beverly Hilton, the 37th annual GLAAD Media Awards also handed out special honors to Quinta Brunson (Vanguard Award) and “Las Culturistas” co-hosts Bowen Yang and Matt Rogers (Stephen F. Kolzak Award). Liza Minnelli made a surprise appearance at the end of the ceremony in honor of her 80th birthday on March 12 and the upcoming publication of her memoir, “Kids, Wait Till Hear This!” Singing “Happy Birthday” to Liza Minnelli. #glaadawards #justforvariety https://t.co/dDk5s3CdMs pic.twitter.com/n11h3u8VWh — Marc Malkin (@marcmalkin) March 6, 2026 The evening also included performances by Demi Lovato and Sony Music Group artist Eli. See the full list of winners below. Outstanding New TV Series “Heated Rivalry” (HBO Max/Crave) Outstanding Drama Series “Stranger Things” (Netflix) Outstanding Comedy Series “Palm Royale” (Apple TV) Outstanding Film – Wide Theatrical Release “Kiss of the Spider Woman” (Roadside Attractions) Outstanding Reality Program “Southern Hospitality” (Bravo) Outstanding Reality Competition Program “The Traitors” (Peacock) Outstanding TV Journalism Segment “Community during fascism: Actress Laverne Cox on the importance of WorldPride in Trump’s D.C.,” “The Weekend” (MS NOW) Outstanding Podcast “Handsome” (Headgum) Outstanding Podcast Episode (TIE) “Straight Panic, Gay Excellence,” “I’ve Had It” (PodcastOne) “Chappell Roan: Are People Scared of Me?,” “Call Her Daddy” (The Unwell Network / SiriusXM) Outstanding Limited or Anthology Series “Wayward” (Netflix) Outstanding Film – Limited Theatrical Release (Tie) “A Nice Indian Boy” (Blue Harbor Entertainment) “Plainclothes” (Magnolia Pictures) Outstanding Film – Streaming or TV “Queen of Coal” (Netflix) Outstanding Documentary “Come See Me in the Good Light” (Apple TV) Outstanding Music Artist “Young Miko, Do Not Disturb” (The Wave Music Group / Capitol Records) Outstanding Breakthrough Music Artist KATSEYE (HYBE x Geffen Records) Outstanding Broadway Production “Liberation,” by Bess Wohl Outstanding Video Game “Lost Records: Bloom & Rage” (DON’T NOD) Outstanding Comic Book “Avengers Academy: Marvel’s Voices,” by Anthony Oliveira, Elsa Sjunneson, Carola Borelli, Bailie Rosenlund, Pablo Collar, Charles Stewart III, Alti Firmansyah, Minkyu Jung, KJ Díaz, Ruth Redmond, Dono Sánchez-Almara, Ariana Maher, Joe Caramagna (Marvel Infinity Comics) Outstanding Original Graphic Novel/Anthology “Gaysians,” by Mike Curato (Algonquin Books) Outstanding Children’s Programming “Firebuds” (Disney Jr.) Outstanding Kids & Family Programming – Live Action “XO, Kitty” (Netflix) Outstanding Kids & Family Programming – Animated “Adventure Time: Fionna and Cake” (HBO Max) Outstanding Variety or Talk Show Episode “Guest Host Alan Cumming on Attacks Against the Trans Community & Bringing Kindness Back in America,” “Jimmy Kimmel Live” (ABC) Outstanding Magazine Overall Coverage People Outstanding TV Journalism – Long-Form “A Transgender Marine Speaks Out” (NBC 7 San Diego) Outstanding Online or Print Journalism Article “As the first out trans person in Congress, Sarah McBride is ready to fight for us” by Christopher Wiggins (Advocate) Outstanding Online Journalism – Video or Multimedia “A Mother and Her Trans Teen Decide to Leave the U.S.” Text and Visuals by Sam Wolson, Illustrations by Lilli Carré (NewYorker.com) Outstanding Independent Journalism Under The Desk News with V Spehar Barbara Gittings Award for Excellence in LGBTQ Media Them Special Recognition “The Drowsy Chaperone in Concert” (Breaking the Binary Theatre) Gaydar with Anania Spanish-language Categories Outstanding Scripted Television Series // Serie de Televisión con Guión Sobresaliente Mariliendre (Atresplayer) Outstanding TV Journalism // Periodismo Televisivo Sobresaliente (Tie) “Ni hombre, ni mujer: Intersexual” Noticias Telemundo (Telemundo) “Orgullo 2025 Avances, Desafíos y Caminos” Spectrum Noticias (Spectrum) Outstanding Online Journalism Article // Artículo sobresaliente de periodismo digital “My Coming Out Story” Quién [serie] (Quien.com) Outstanding Online Journalism – Video or Multimedia // Periodismo digital sobresaliente: vídeo o multimedia “¿Tienes HIV, Mijo? A Mother’s Journey,” “Living y Ready” (LatiNation) Reconocimiento Especial Andry José Hernández Romero “Before We Forget” (Twenty Nine Palms Ent.) Timothée Chalamet Kicks Off Asia Tour as ‘Marty Supreme’ Hits $172 Million Globally, Eyes $200 Million Milestone Asia-Pacific Video Revenue to Reach $196 Billion by 2030, With India Overtaking China in SVOD Subscriptions, Report Forecasts Jackie Chan’s ‘Unexpected Family,’ Anthony Chen Competition Entry Lead Chinese Presence at Berlinale, EFM 5 Takeaways From the Ampere Analysis at Mip London: Broadcasters More Important Than Ever, YouTube as a Growing Destination for Factual, Sports Boost Japanese Comedy Hit ‘You Laugh You Lose’ Gets Global Push as Banijay Entertainment Acquires Format Rights From ‘LOL’ Creator Yoshimoto Kogyo (EXCLUSIVE) Timothée Chalamet’s ‘Marty Supreme’ to Get China Theatrical Release Loading comments... More From Our Brands Rolling Stone Watch Jimmy Fallon Pay Tribute to Stephen Colbert Ahead of ‘Late Show’ Ending Robb Report Jack Daniel’s New McLaren F1 Collab Is a High Octane Version of This Tennessee Whiskey Sportico NCAA Asks State Supreme Court to End Chambliss’ Ole Miss Career WWD Designers Experiment With Materials at LVMH Prize Showroom",0,2026-03-06 09:50:21
3,https://deadline.com/2026/03/glaad-media-awards-2026-winners-list-1236745267/,"GLAAD Media Awards Winners Include ‘Heated Rivalry’, ‘Stranger Things’ & ‘The Traitors’ – Full List",Deadline,2026-03-06T06:00:00,5648,"Skip to main content By Erik Pedersen Erik Pedersen Managing Editor More Stories By Erik GLAAD Media Awards Winners Include ‘Heated Rivalry’, ‘Stranger Things’ & ‘The Traitors’ – Full List Oscar Presenters: Will Arnett, Priyanka Chopra Jonas, Robert Downey Jr, Anne Hathaway, Paul Mescal & Gwyneth Paltrow Are Latest Additions Gary Dontzig Dies: ‘Murphy Brown’ Writer-Producer Who Won Three Emmys Was 79 View All March 5, 2026 10:00pm Clockwise from left: 'Stranger Things,' 'Heated Rivalry' and 'The Traitors' NEtflix/HBO/Peacock The HBO Max/Crave phenomenon Heated Rivalry skated off with the Outstanding New TV Series prize at the 37th annual GLAAD Media Awards, which were handed out Thursday night in Los Angeles. Netflix’s Stranger Things and Apple TV’s Palm Royale — both of which have wrapped their runs — won the top Drama and Comedy series prizes, respectively. Winners on the film side included Roadside Attractions’ Kiss of the Spider Woman , Blue Harbor’s A Nice Indian Boy , Magnolia Pictures’ Plainclothes and Apple TV’s documentary Come See Me in the Good Light. See the full list of all 32 categories below. Watch on Deadline Related Stories Below The Line 2026 Awards Season Calendar: Dates For Oscars, Guilds, Tonys & More News ‘Sinners’ Sets Record With Seven Dorian Film Awards Including Best Picture, Director & Screenplay Mean Girls actor Jonathan Bennett hosted the 2026 GLAAD Media Awards , which honors fair, accurate and inclusive LGBTQ stories. Abbott Elementary multihyphenate Quinta Brunson received the 2026 Vanguard Award, and Las Culturistas podcasters Bowen Yang and Matt Rogers the Stephen F. Kolzak Award for their work to eliminate homophobia. Hulu will stream the ceremony starting Saturday, March 21 Here are the winners of the 37th GLAAD Media Awards: Outstanding New TV Series Heated Rivalry (HBO Max/Crave) Outstanding Drama Series Stranger Things (Netflix) Outstanding Comedy Series Palm Royale (Apple TV) Outstanding Film – Wide Theatrical Release Kiss of the Spider Woman (Roadside Attractions) Outstanding Reality Program Southern Hospitality (Bravo) Outstanding Reality Competition Program The Traitors (Peacock) Outstanding TV Journalism Segment “Community during fascism: Actress Laverne Cox on the importance of WorldPride in Trump’s D.C.” The Weekend (MS Now) Outstanding Podcast Handsome (Headgum) Outstanding Podcast Episode (TIE) “Straight Panic, Gay Excellence” I’ve Had It (PodcastOne) “Chappell Roan: Are People Scared of Me?” Call Her Daddy (The Unwell Network / SiriusXM) Outstanding Limited or Anthology Series Wayward (Netflix) Outstanding Film – Limited Theatrical Release (TIE) A Nice Indian Boy (Blue Harbor Entertainment) Plainclothes (Magnolia Pictures) Outstanding Film – Streaming or TV Queen of Coal (Netflix) Outstanding Documentary Come See Me in the Good Light (Apple TV) Outstanding Music Artist Young Miko, Do Not Disturb (The Wave Music Group / Capitol Records) Outstanding Breakthrough Music Artist Katseye (Hybe x Geffen Records) Outstanding Broadway Production Liberation, by Bess Wohl Outstanding Video Game Lost Records: Bloom & Rage (Don’t Nod) Outstanding Comic Book Avengers Academy: Marvel’s Voices, by Anthony Oliveira, Elsa Sjunneson, Carola Borelli, Bailie Rosenlund, Pablo Collar, Charles Stewart III, Alti Firmansyah, Minkyu Jung, KJ Díaz, Ruth Redmond, Dono Sánchez-Almara, Ariana Maher, Joe Caramagna (Marvel Infinity Comics) Outstanding Original Graphic Novel/Anthology Gaysians, by Mike Curato (Algonquin Books) Outstanding Children’s Programming Firebuds (Disney Jr.) Outstanding Kids & Family Programming – Live Action XO, Kitty (Netflix) Outstanding Kids & Family Programming – Animated Adventure Time: Fionna and Cake (HBO Max) Outstanding Variety or Talk Show Episode “Guest Host Alan Cumming on Attacks Against the Trans Community & Bringing Kindness Back in America” Jimmy Kimmel Live (ABC) Outstanding Magazine Overall Coverage People Outstanding TV Journalism – Long-Form “A Transgender Marine Speaks Out” (NBC 7 San Diego) Outstanding Online or Print Journalism Article “As the first out trans person in Congress, Sarah McBride is ready to fight for us” by Christopher Wiggins (Advocate) Outstanding Online Journalism – Video or Multimedia “A Mother and Her Trans Teen Decide to Leave the U.S.” Text and Visuals by Sam Wolson, Illustrations by Lilli Carré (NewYorker.com) Outstanding Independent Journalism Under The Desk News with V Spehar Barbara Gittings Award for Excellence in LGBTQ Media Them Special Recognition The Drowsy Chaperone in Concert (Breaking the Binary Theatre) Gaydar with Anania Outstanding Scripted Television Series (Serie de Televisión con Guión Sobresaliente) Mariliendre (Atresplayer) Outstanding TV Journalism (Periodismo Televisivo Sobresaliente) (TIE) “Ni hombre, ni mujer: Intersexual” Noticias Telemundo (Telemundo) “Orgullo 2025 Avances, Desafíos y Caminos” Spectrum Noticias (Spectrum) Outstanding Online Journalism Article (Artículo sobresaliente de periodismo digital) “My Coming Out Story” Quién [serie] (Quien.com) Outstanding Online Journalism – Video or Multimedia (Periodismo digital sobresaliente: vídeo o multimedia ) “¿Tienes HIV, Mijo? A Mother’s Journey” Living y Ready (LatiNation) Reconocimiento Especial Andry José Hernández Romero Before We Forget (Twenty Nine Palms Ent.) ‘Heated Rivalry’ Creator Sets Historical Drama Series At Netflix; Bateman Among EPs How CAA’s Big-Bucks Loss Behind Closed Doors Is About To Go Large & Public California AG Slams Feds Over WBD Deal, Citing Antitrust Concerns ABC Orders New Seasons Of ‘High Potential,’ ‘9-1-1’ & ‘9-1-1: Nashville’ Read More About: Comments",0,2026-03-06 09:49:59
31,https://www.hollywoodreporter.com/lists/harry-styles-kiss-all-the-time-track-by-track-breakdown/,"Harry Styles Returns With ’Kiss All the Time. Disco, Occasionally’: A Track-By-Track Breakdown",Hollywood Reporter,2026-03-06T05:28:06,7728,"× Skip to main content By Nicole Fell Plus Icon Nicole Fell Assistant Editor View All March 5, 2026 9:28pm Published on March 5, 2026 Harry Styles Laura Jane Coulson The wait is finally over. After nearly four years, Harry Styles is finally back with a new album, Kiss All The Time. Disco, Occasionally . “Aperture,” the album’s pre-release single, dropped in January, giving fans a feel for Styles’ long-awaited fourth studio album. He also announced the Together, Together tour, hitting seven cities around the world. New York City is his only scheduled United States stop for the year; he’s booked a 30-date residency at Madison Square Garden. His last album, Harry’s House , released in 2022, earned the British singer-songwriter his first album of the year win at the Grammy Awards and spawned an extensive, 169-date world tour. In the years since that tour — which wrapped in June 2023 — Styles has been on an extended hiatus from both music and acting, which he’s branched out to in recent years. Styles traveled the world, spending time in Japan, Germany, Spain and Italy. The singer told Runner’s World he loved the Berlin club scene in particular, which can definitely be heard on Kiss All The Time. Disco, Occasionally . To put Kiss All The Time. Disco, Occasionally in terms of previous Styles releases, the 12-track album feels most sonically connected to 32-year-old’s 2019 sophomore solo album Fine Line , which leaned more pop-rock. What sets Kiss All The Time. Disco, Occasionally apart, and Styles is pretty upfront about it with that headline, is the sprinkling of the synth-heavy city pop flare that defined his Grammy Winning album, Harry’s House . While “Aperture,” doesn’t necessarily capture the sonic profile of the entire album, it does capture its’ spirit. The lead single’s a bit more disco than most of the album’s songs, but the whole album grooves. Meanwhile, “Dance No More” carries a similar dance flare and is absolutely a stand-out on the record. Kiss All The Time. Disco, Occasionally sonically flows from one song to the next, making it more than pleasant listening experience. Below is a track-by-track breakdown of Styles’ much anticipated return. “Aperture” Styles kicks off his first album in four years with the album’s pre-release single, “Aperture,” a synth-filled, nearly six-minute game of push and pull. “It’s best you know what you don’t / Aperture lets the light in,” Styles croons on the pre-chorus before diving into the song’s main message: “We belong together / It finally appears it’s only love.” “Aperture” sets listeners up for an album that at-once feels right at home in Styles’ discography and a bit of a departure. Lyrically and sonically, it’s one of the calmer songs on the album, even if it leans much more into the disco vibe than a majority of the album. The dichotomy within the song — a bit sad yet still a bit hopeful — perfectly sets the tone of Kiss All The Time. Disco, Occasionally , which, at first glance, shows Styles self-reflecting in a way he hasn’t before. “American Girls” Admittedly, the most surface level offering on the album, this melodic, windows-down-on-the-PCH track is a true sonic blend of his past albums. It feels as though Styles was hoping to ease fans back into his world with “American Girls.” Think of it as a warmup for what’s to come. “My friends are in love with American girls / I’ve seen it in stages all over the world / My friends are in love with American girls,” he cheekily sings on the song’s chorus. It’s catchy and fun, but given how interesting the rest of the album is, it’s unlikely to be at the top of anyone’s list. “Ready Steady Go!” This dreamy pop-rock track is where Kiss All The Time. Disco, Occasionally really starts to pick up. Styles opts for a for a funky vocal effect on the song’s chorus. It’s catchy enough that listeners will likely find themselves singing the chorus back to themselves with lyrics like, “One time in the light, it’s two times’ as fun already.” “Are You Listening Yet?” Well, are you listening yet ? Perhaps it’s looking too much into things — even if Styles has never seemed like someone to do things on accident — but the placement of this frenetic, guitar-heavy track feels like the singer checking the listener’s pulse at this point of the album. Pay attention, he’s seemingly saying. “Now you’re all out of choices / Are you listening yet?” he sings. The funky, borderline spoken-word verses set over a guitar beat make this song enjoyable and memorable. “Taste Back” It’s feeling very 2008 at this point in the album, with Styles’ most spiritually Vampire Weekend-esque offering to date. The song’s overall message seems to revolve around love, and needing a bit more of it. The bridge is, undoubtedly, a standout moment of the track, but the lyrics also make the song work: “Where’d you find the confidence to call me baby?” and “Must be lonely out in Paris if you talk like that” just to share a couple. “The Waiting Game” The album’s sixth track offers a bit of a slower pace with some interesting synth-pop moments. There’s plenty of ways to interpret this song, but it feels perhaps a bit of self-reflection on Styles as celebrity personality. “You can romanticize your shortcomings / Ignore your agency to stop / Write a ballad with the details / While skimming off the top,” could surely be about anyone, but the song feels like it has a bit more weight if those moments of introspection are intentional. Also, the song’s outro is beautiful. “Season 2 Weight Loss” The song title I was most perplexed by, “Season 2 Weight Loss” features electro-pop opening with a distorted voice effect in the beginning. We seem to be finding Styles embracing trippy vocal effort across Kiss All The Time. Disco, Occasionally . It sits amongst a segment of groovier songs on the album. “Let light come in once in a while / You’ve got to sit yourself down sometimes,” stands out as a lyric to remember. “Coming Up Roses” This track is one of the most romantic and grand in scale on the album. With its waltz beat, it would serve as the perfect soundtrack to the grand gesture moment of any romance film. It’s the most unique song on the album, simply because it deviates away from the established sonic formula and goes more stripped back. It also sits in the middle of the album’s most disco forward tracks. ”Pop” Throughout the entirety of Kiss All The Time. Disco, Occasionally , “Pop” is a top-two contender for most fun you’ll have, and it’s among the more disco and synth-pop tracks on the record. It’s definitely the song most likely to get stuck in your head, with echoes of “pop!” littered throughout the song. ”Dance No More” Sonically speaking, this downright groovy track pays off the promise of disco-infused tracks laid out by “Aperture.” The song has it all — catchy lyrics, a dynamite outro and rock-laced beat. It’s not clear what Styles next single will be, but “Dance No More” should definitely be in contention. ”Paint By Numbers” Styles slows it down with an acoustic guitar for the penultimate track of the album. “Paint By Numbers” is another reflective track — the song’s opening lyric is “Oh, what a gift it is to be noticed.” It’s exactly the kind of song one would envision when hearing an artist spent time leisurely traveling beforehand. It also feels like through this song, Styles himself is showcasing a calmer side of himself. ”Carla’s Song” The British pop star closes the album much like he starts it — in a dreamy space in between meloncoly and hopefulness. But the decision to end on this track feels important. Styles last words of the album are pitch perfect with the tone of the work overall — “I know what you like, you can hear it anytime.” THR",0,2026-03-06 09:50:31
32,https://www.hollywoodreporter.com/business/business-news/sandy-wernick-dead-manager-brillstein-entertainment-partner-1236523368/,"Sandy Wernick, Adam Sandler’s Longtime Manager and Brillstein Entertainment Partner, Dies at 86",Hollywood Reporter,2026-03-06T05:16:56,2506,"Skip to main content By Carly Thomas Plus Icon Carly Thomas Senior Editor, Digital carly_thomas_ Follow Sign Up View All March 5, 2026 9:16pm Sandy Wernick Courtesy of a family representative Sanford “Sandy” Wernick, a longtime talent manager of clients including Adam Sandler, Lorne Michaels, Tim Herlihy, John Davies and Rob Schneider, who also became partner and senior executive vp at Brillstein Entertainment Partners, died Thursday. He was 86. Wernick died in Rancho Mirage, California, after a brief illness, surrounded by his family and loved ones, a family representative told The Hollywood Reporter . Born on March 22, 1939, in the Bronx, Wernick went on to serve in the Army from 1960 to 1962 and graduate from NYU. Related Stories TV Gary Dontzig, Emmy-Winning Writer and Producer on 'Murphy Brown,' Dies at 79 TV Bob Rosenfarb, Writer-Producer on 'Who's the Boss?' and 'Step by Step,' Dies at 74 Before becoming a manager in the 1970s, he worked as an agent and made his way from the mailroom at MCA to vice president of the TV division at ICM. Later in his career, he became a partner and senior executive VP of Brillstein Entertainment Partners. While working in television, Wernick co-created and executive-produced Def Comedy Jam . He was also involved in packaging and producing shows such as Saturday Night Live , The Muppet Show , The Sopranos , Politically Incorrect , Just Shoot Me , NewsRadio , Alf and The Larry Sanders Show . On the film side, he served as an executive producer on several of Sandler’s movies, including Happy Gilmore , Billy Madison , The Wedding Singer and Bulletproof . He also made cameos in several films and TV shows. As a manager and agent, his clients included Sandler, Herlihy, Davies, Akira (Leo) Yoshimura, Michaels, Ray Klausen, Don Mischer, Stan Lathan, Jeff Ross, Marilyn Wilson, Marty Pasetta, Victor Levin, Buz Kohan, Colin Quinn, Schneider, Norm Crosby, Peter Falk and Alexandra Pelosi, among others. Wernick also spent years as an adjunct professor at the USC School of Cinematic Arts’ Peter Stark Producing Program and volunteered in the Cedars Sinai emergency room. In his free time, he liked to golf and was also a former yo-yo champion. He is survived by his wife Barbara of 64 years, daughter Michele, son Barry, daughter-in-law Jillian, grandson Sammy, sister Joyce and brother-in-law Jules as well as several nieces, nephews and cousins. A private service will be held in Palm Desert, followed by a memorial celebration in Los Angeles. THR",0,2026-03-06 09:50:32
