id,url,title,source,publication_date,text_length,full_text,is_duplicate,created_at
26,https://www.hollywoodreporter.com/tv/tv-news/ai-microdramas-must-see-tv-seriencamp-2026-preview-1236614484/,5 Things to Watch at SerienCamp 2026,Hollywood Reporter,2026-06-08T12:55:00,7632,"× Skip to main content By Scott Roxborough Plus Icon Scott Roxborough Europe Bureau Chief sroxborough Follow Sign Up View All June 8, 2026 5:55am (L to R): SerienCamp Festival Highlights include 'Mermaids to Lovers', Jemaine Clement, Nicola Walker in 'Alice and Steve,' Gillian Anderson, Lola Petticrew in 'Trespasses,' Helena Zengel in 'Westend Girl Courtesy of SerienCamp Major broadcasters, streamers, producers and creatives descend on Cologne this week for SerienCamp (June 9-11), arriving at a moment when the foundations of TV drama are shifting under everyone’s feet. Commissioning budgets are shrinking, audiences are scattered across social platforms and games, and the cultural weight that prestige television once carried automatically now has to be earned — often with less money than before. From microdramas to AI, IP universe-building and new financing models, here are five issues that will be on everyone’s mind this year. 1. Surviving the Post-Commissioning World For decades, the logic was simple: producers pitch to broadcasters, broadcasters commission and fund, and the marketing and distribution problem belongs to the channel. That model is now structurally inadequate for the ambitions — and economics — of high-end drama. Commissioning budgets have contracted, the window between greenlight and audience discovery has narrowed, and the channels that once guaranteed cultural reach can no longer deliver it reliably. Related Stories TV 'Star Trek' 60th Anniversary Celebration, Stars Set for Italian Global Series' Second Edition Movies Maggie Gyllenhaal, Jesse Eisenberg to Receive Karlovy Vary Honors “I don’t think quality overall has declined. There are still a lot of great shows out there,” says SerienCamp artistic director Gerhard Maier. “I just think that for those that exist, it’s becoming much harder to find their audience. The cultural impact [of social media or games] is often much higher than that of high-end drama series.” The producers who will survive the next five years will not be those waiting for the next commissioning round, he argues, but the ones who can build direct relationships with audiences — by owning distribution, treating IP as a long-term asset rather than a one-time license, and developing the B2C capabilities that the traditional B2B model never required them to have. “Think about what your business model could look like if commissioning no longer exists, or no longer plays a major role,” Maier says. “How can you pivot from a B2B business model to a B2C business model?” The question SerienCamp is putting on the table is not whether this shift is coming, but how far European production infrastructure — with its deep dependency on producer-broadcaster relationships — is capable of making it. 2. The Microdrama Moment — What the Creator Economy Can Teach TV SerienCamp was ahead of the vertical content curve – the conference held its first talks on Microdramas back in 2018, inviting execs from China and Snapchat Originals to present this then-radical cell-phone-first format. Beyond the hype, vertical drama has demonstrated a new means of production — working quickly, often with small teams of just 2-3 creators, using data and audience response to drive creative decisions — that traditional TV has been slow to adopt. Instead of seeing Microdramas as a threat, Maier thinks producers can learn from the lessons of the creator class. “I think it would be helpful for television producers to adapt to what successful creators do when distributing via TikTok and Instagram, how they test what works on the platform and refine it to rise up in the algorithm to reaching the largest possible audience,” he says. Online creators can also give pointers on storytelling, “how to generate emotionally complete content in one minute that some series don’t achieve in twenty,” Maier notes. 3. Series as Brands: How To Build an IP Universe One of the more ambitious conversations SerienCamp 2026 is likely to host concerns a model that has proved enormously lucrative in Asia and the anglophone market, but remains largely theoretical in European TV: the 360-degree IP universe. The idea — building story worlds with multiple touchpoints across series, games, social content and live experience, rather than simply adapting one property across formats — has have long been standard practice in Japan and Korea. “But for me the question is how far the system in Europe , and especially in Germany, even permits something like that to emerge — through the commissioning system, through the relationship between production, creatives and broadcasters,” says Maier. Structural experiments are beginning to appear. Studio 112 in France is combining the activities of a talent agency with production to package projects before approaching a commissioner, giving creatives a skin in the game and more control over their own content. In Munich, Alan Greenspan, longtime ICM packaging agent and partner at UK production company 6 Degree Media producer ( Fever Pitch ) has joined forces with investment attorney Tom De Gols to launch Bridge MP, a British/German management and production firm that will actively take stakes in the productions it packages. “These are examples of companies attempting to practice a form of vertical or diagonal integration a little more strongly,” Maier says. 4. AI As Promise and Existential Threat The European film and series industry has largely responded to AI as a set of production tools to be evaluated for cost efficiency, an approach, according to Maier, that misreads the technology’s potential for disruption. “I’m often surprised by how relaxed many parts of the film and series industry are — because if you don’t adapt to this, I think it can be existentially threatening,” he says. While much of the media focus has been on AI replacing individual writers or directors, Maier sees a more structural threat in AI-enabled production at industrial scale generating volumes of “good enough” content that crowds out culturally ambitious work across every distribution channel. In China, AI-driven pipelines are already operational and the displacement, particularly in vertical production, is measurable. SerienCamp’s dedicated AI conference, Plot Next, will focus on concrete hybrid production models already in use and on practical frameworks for integrating AI into high-end workflows without ceding the creative and cultural ground that differentiates prestige drama from algorithmic slop. At the moment, there is a strong audience backlash to AI-generated content. “But that is largely driven by the fact that people can identify this content as AI,” warns Maier. “What happens when you can no longer tell?” 5. Works in Progress — the Next Gen of Must-See TV Amid all the discussions of disruption and data-driven innovation, SerienCamp remains a TV drama showcase, a location for best-in-class series from around the world. It’s Works in Progress strand has an impressive track record of discovering the German-language series that will break through globally. Shows like Babylon Berlin , Charité, 4 Blocks, and Maxon Hall all passed through the WIP program before their premieres. “We like to follow a show across its full development arc, from a Writers’ Vision pitch to international co-production financing in the Story Exchange market, to first industry presentation in Works in Progress, to the premiere at the festival,” says Maier. Among the titles to watch at this year’s WIP showcase are Isabel Kleefeld’s upcoming Netflix thriller The Trap and the dystopian new-future drama Dronenland from ZDF/Magenta TV. THR",0,2026-06-08 13:12:09
16,https://variety.com/2026/tv/global/death-in-benidorm-premiere-italian-global-series-festival-1236769160/,"U.K. Detective Drama Series ‘Death in Benidorm,’ Brazil’s ‘Emergency 53’ to Bow at Italian Global Series Festival",Variety,2026-06-08T12:37:33,5717,"Jun 8, 2026 5:37am PT U.K. Detective Drama Series ‘Death in Benidorm,’ Brazil’s ‘Emergency 53’ to Bow at Italian Global Series Festival The rapidly growing fest will also pay homage to the 60th anniversary of ""Star Trek"" By Nick Vivarelli Plus Icon Nick Vivarelli International Correspondent @NickVivarelli Latest Jafar Panahi’s One-Year Prison Sentence Upheld by Iranian Court 22 hours ago Shivani Pandya Malhotra Steps Down as Managing Director of Saudi Arabia’s Red Sea Film Festival (EXCLUSIVE) 2 days ago Brad Pitt on Set of Plan B-Produced ‘Isle of Man’ Movie as Filming Kicks Off During Motorcycle Race 3 days ago See All MAKSYMILIAN CZAPLEWSKI This year’s Italian Global Series Festival will host the premieres of “Benindorm Is Murder,” a new Channel 5 detective drama series starring John Hannah , and hotly anticipated Brazilian medical show “Emergency 53.” The event’s second edition will take place July 3-11 in the seaside cities of Rimini and Riccione. “Benindorm Is Murder,” formerly titled “Death in Benindorm,” sees Hannah playing Dennis, a former detective trying to escape his past who swaps the chaos of the U.K. for a quieter life running a bar in the Spanish coastal resort of Benidorm. But when tourists start turning up dead, he’s reluctantly drawn back into detective work. Dennis is egged on by his barmaid Rosa, a crime drama superfan, played by Carolina Bécquer. Hannah is set to attend the show’s launch. Related Stories Tony Awards 2026: 'Death of a Salesman' Leads With Six Wins, as 'Ragtime,' 'Schmigadoon!' and 'Liberation' Also Take Top Honors Backstage at 'The Lost Boys': How Tony Nominee Ali Louis Bourzgui Becomes a Punk Rock Vampire “Emergency 53,” which bowed for buyers earlier this year at the prestigious Berlinale Series Market — where it won the Studio Babelsberg Production Excellence Award — follows a series of doctors, nurses and drivers of a special mobile service unit as they navigate personal and professional dramas while burdened by the responsibility to prevent others from dying. Popular on Variety Also having their international launches at the rapidly growing Italian TV fest are espionage thriller “Secret Service,” directed by Oscar winner James Marsh and starring Gemma Arterton; Korean thriller “Speaking Dead,” directed by Lee Jung-hyo; and the Scott Free-produced anthology series “The Terror With Devil in Silver,” the first U.S. title competing at the fest, with stars Judith Light and CCH Pounder making the trek to Riccione. The fest’s Limited Series section will open with France’s “Le Rouge et Le Noir,” a new adaptation of Stendhal’s “The Red and the Black,” starring Victor Belmondo and featuring Camille Razat and Virginie Ledoyen, both of whom will attend in Rimini alongside director Gaël Morel. From the U.K. comes the world bow of Channel 4’s drama “Falling,” the first romance from “Adolescence” writer Jack Thorne, directed by Peter Hoar. The Limited Series section’s international premieres are Prague-set noir “The Widow Killer” and historical epic “Raza Brava,” set in the world of Santiago’s violent soccer fans, known as ultras, during the dictatorship of Chilean general Augusto Pinochet. French series “Laura’s Treatment,” starring Valérie Bonneton, will also be screening with her in tow. The fest’s comedy section comprises Belgium’s “Boho,” set in Antwerp’s multicultural neighborhood of Borgerhout; award-winning German comedy “The Flaws,” created by a theater collective and produced by Berlin-based indie Razor Film; and, from BBC Northern Ireland, “Leonard and Hungry Paul,” starring Alex Lawther and featuring the voice of Julia Roberts. BritBox drama “Riot Women,” directed by the U.K.’s Sally Wainwright is also screening, with her attending alongside “Riot Women” star Tamsin Greig. Italian Global Series Festival will also be celebrating the 60th anniversary of “ Star Trek .” Actress Jeri Ryan, known for her iconic role as Seven of Nine in the Star Trek universe, is set to hold a talk on contemporary female role models in TV. An onstage conversation between producer David W. Zucker and director Nicholas Meyer is also planned, and the fest will host a special preview screening of an episode of the upcoming fourth season of “Star Trek: Strange New Worlds.” As previously announced, Oscar- and Emmy-nominated writer and director Meyer will serve as president of the limited series jury; veteran U.S. producer Marti Noxon (“Buffy the Vampire Slayer,” “Grey’s Anatomy”) will preside over the drama series jury; and French actor Bruno Gouery (“Emily in Paris) will head up the fest’s comedy series jury. How ‘Heated Rivalry’ Is Still Having an Impact at the TV Academy — Even Though It’s Not Emmy-Eligible ‘The Comeback’ Creators Lisa Kudrow and Michael Patrick King on Ending the Series, the AI Threat, Valerie Cherish’s Evolution and Why Ice Cream as a Dessert ‘Is B.S.’ David Harbour Sets Emmy Bid for ‘DTF St. Louis’ in Supporting Actor With Multiple Noms in Play (EXCLUSIVE) How ‘Margo’s Got Money Troubles’ Unique Opening Credits Scene Was Created (EXCLUSIVE) ‘Get Kevin Feige on the Phone’: Yahya Abdul-Mateen II on Taking Control of His Marvel Offer and What’s Next for ‘Wonder Man’ Elisabeth Moss Wins Emmys Petition, Will Compete as Guest Actress for ‘The Testaments’ After Reprising ‘The Handmaid’s Tale’ Role (EXCLUSIVE) Loading comments... More From Our Brands Rolling Stone ‘Cats’ Costume Designer Qween Jean Becomes First Openly Trans Person to Win Tony Award Robb Report Bombardier’s Global 8000 Jet Just Flew From Canada to France in Record Time Sportico Jalen Brunson Caught in a Fraught Era for Signature Shoes WWD Estée Lauder Invests in the U.K., Bringing Candle, Home Fragrance Making In-house",0,2026-06-08 13:11:59
17,https://variety.com/2026/tv/news/fox-nfl-rights-mexico-1236769194/,Fox Wins Rights to Show NFL Games in Mexico,Variety,2026-06-08T12:19:29,3452,"Jun 8, 2026 5:19am PT Fox Wins Rights to Show NFL Games in Mexico By Brian Steinberg Plus Icon Brian Steinberg Senior TV Editor bristei Latest Fox Wins Rights to Show NFL Games in Mexico 37 minutes ago Scott Pelley Presses Paramount to Remove CBS News Chief Bari Weiss: ‘CBS News Is on Fire’ 1 day ago Paramount Made Radical Changes to CBS Late Night and ‘60 Minutes.’ Will Advertisers Still Spend? 3 days ago See All Rey Del Rio/Getty Images Mexico will soon have a fuller source of el fútbol americano . Fox Corp. said it secured a new deal to show a wide range of NFL games via its Mexican outlets, including transmissions of “Thursday Night Football” and the Super Bowl, the latest example of deal-making between the sports organization and various U.S. media outlets as worries grow about the next tranche of media rights the league will seek amid the continued popularity of its games. Related Stories Chrissy Metz to Make Broadway Debut in '& Juliet' (EXCLUSIVE) Broadway's 'Death Becomes Her' to Close in June, Sets North American Tour Under terms of the new pact, Fox will be able to show NFL games and other events to Mexican audiences via its linear TV operations as well as via the Fox One streaming service and even its ad-supported streamer Tubi. Fox will also show four weekly original programs dedicated to the NFL that have been developed especially for fans in Mexico, including two editions of a fantasy football-focused show. Popular on Variety The overall package of games will include Thursday Night Football, regular-season Sunday games, Thanksgiving games, all NFC playoff matches, Pro Bowl games and the Super Bowl. The deal surfaces as speculation grows that the NFL may seek to utilize an “opt-out” clause in its current contracts with Fox, Paramount Skydance, NBCUniversal and Amazon to renegotiate rights deals and gain sizable increases in the fees it collects from the media companies. The league believes it can get more value from its carriage pacts, according to a person familiar with the matter, particularly given the increases in fees the NBA was recently able to gain with new alliances with Disney’s ESPN, Amazon and NBC. “Mexico is a market with an enormous passion for football, and we are proud to offer fans a sizeable NFL package in the country, with a robust content experience, designed to engage audiences throughout the entire year,” said Carlos Martínez, executive vice president of Fox’s Latin American operations. More to come… Lady Gaga Submits to Emmys With ‘Wednesday’ Original Song ‘The Dead Dance’ (EXCLUSIVE) Facing the Fascism: How This Season’s Emmy Contenders Pepper Storytelling With Real-World Perils ‘I’m FYC-Eligible!’: Bowen Yang, Marcello Hernández and the ‘Saturday Night Live’ Cast Toast (and Roast) Each Other at Emmy Panel Universal Studio Group Brings ‘A Salute to Artisans’ to Pole Banners Around Los Angeles (EXCLUSIVE) Paramount+’s ‘The Madison’ Goes Market to Table in a Wide Mix of Themed FYC Promotions (EXCLUSIVE) NBC, TV Academy Tap Jesse Collins Entertainment to Produce the Emmys for a Fourth Consecutive Year Loading comments... More From Our Brands Rolling Stone ‘Cats’ Costume Designer Qween Jean Becomes First Openly Trans Person to Win Tony Award Robb Report TAG Heuer Just Unveiled a New Monaco Watch With a 12-Cylinder Dial Sportico Jalen Brunson Caught in a Fraught Era for Signature Shoes WWD Can Madonna and Macy’s Bring Kiko Milano’s Makeup Reign to the U.S.?",0,2026-06-08 13:12:00
2,https://deadline.com/2026/06/adrian-j-walker-the-end-of-the-world-running-club-feature-1236950083/,Adrian J. Walker’s Novel ‘The End of The World Running Club’ To Be Adapted Into Feature Film,Deadline,2026-06-08T12:12:26,2806,"Continue to Deadline SKIP AD You will be redirected back to your article in seconds Skip to main content Dismiss News Banner Breaking News Tony Awards Winners: 'Schmigadoon!' Best Musical, 'Liberation' Best Play; John Lithgow, Lesley Manville, 'Ragtime' Duo Top Acting Honors Read the full story By Zac Ntim Zac Ntim International Reporter @ZacharyNtim More Stories By Zac Indie Outfit Mirak Studio To Launch Production Facility In Albania Italian Global Series: Sally Wainwright Among Guests Set For Second Edition David Mamet To Direct Feature Project ‘Russian Poland’; Archstone Boards As Sales Rep View All June 8, 2026 5:12am Adrian J. Walker and Chris Reading. Rama Knight/Shakespeare Sisters EXCLUSIVE: Candr Pictures has optioned the rights to adapt The End of The World Running Club , the post-apocalyptic novel by Adrian J. Walker, into a feature film. The movie will be written and directed by Chris Reading, best known for comedy sci-fi Time Travel Is Dangerous . Walker also comes on as Executive Producer. The End of the World Running Club is set after catastrophic asteroid impacts across Europe. The synopsis reads: Edinburgh father Ed embarks on a desperate 500-mile race on foot to reach his family before the last evacuation ships leave Britain’s shores. Related Stories News Indie Outfit Mirak Studio To Launch Production Facility In Albania News Italian Global Series: Sally Wainwright Among Guests Set For Second Edition The book was published by Penguin Random House UK and has been translated into French, German, Spanish, Czech, and Turkish. Watch on Deadline “I’m beyond thrilled that Candr Pictures are adapting The End of the World Running Club ,” Adrian J. Walker said in a statement. “I love Chris’s work, and his uniquely British blend of dark humour, sci-fi and humanity is a perfect fit for the story. I still receive messages from new readers all over the world telling me how much the book moved them, and I can’t wait for them to be able to relive the excitement (and pain) of Ed’s journey brought to life on the screen.” Chris Reading added: “We don’t see many British apocalypse stories, which is a shame; all the weird characters it can throw up, the chaos, the gallows humour. Adrian’s book has all of that in spades. At its centre is a beautifully simple premise: one man trying to get to his family. I want to make something that lovers of the book will recognise and embrace, whilst bringing my own sense of fun, irreverence and dark laughs to the ride.” P!nk Opener; First Openly Trans Winner; EGOT Alert; Best Of The Red Carpet ‘Scary Movie’ Stabbing Record $55M Bow; $29M For He-Man’s ‘Universe’ Raman Bests Pratt In Latest Vote Count For No. 2 In L.A. Mayor Race ‘Power Ballad’ Looks To Connect Without YouTube Phenoms Or Jump Scares Read More About: Comments",0,2026-06-08 13:11:42
3,https://deadline.com/2026/06/mirak-studio-production-facility-albania-1236950100/,Indie Outfit Mirak Studio To Launch Production Facility In Albania,Deadline,2026-06-08T12:05:08,2339,"Continue to Deadline SKIP AD You will be redirected back to your article in seconds Skip to main content Dismiss News Banner Breaking News Tony Awards Winners: 'Schmigadoon!' Best Musical, 'Liberation' Best Play; John Lithgow, Lesley Manville, 'Ragtime' Duo Top Acting Honors Read the full story By Zac Ntim Zac Ntim International Reporter @ZacharyNtim More Stories By Zac Indie Outfit Mirak Studio To Launch Production Facility In Albania Italian Global Series: Sally Wainwright Among Guests Set For Second Edition Maggie Gyllenhaal & Jesse Eisenberg To Be Honored At Karlovy Vary View All June 8, 2026 5:05am Mirak Studio EXCLUSIVE: Indie Outfit Mirak Studio has set plans to build a production facility in Albania . Mirak Studio was founded by Jamie Neale, Chris Beyrooty, Grayson Stubbs, and Klevis Elmazaj. Entertainment lawyer and former Vice President at Twentieth Century Fox Film, Eric Thompson, has signed on to oversee legal representation. The group said the studio will feature LED virtual production stages, purpose-built sound stages, a fully equipped podcast studio, a rental equipment department, expansive backlot space, and international production incentives under “one integrated ecosystem.” They said the facility will also feature two large-scale stages, Stage A and Stage B, housed within a studio complex alongside a “substantial outdoor backlot designed to accommodate large-scale set builds.” Watch on Deadline “Global film, television, and commercial production is expanding rapidly, but infrastructure has not kept pace in emerging European markets,” the Mirak founders said in a joint statement. “The Balkan region represents a rare opportunity to build a next-generation production hub at the intersection of cost efficiency, incentives, and modern infrastructure.” The company said it will aim for the studio to support both international productions and the local entertainment industry, helping create new jobs and establish “the Balkan region as a long-term creative and production destination.” P!nk Opener; First Openly Trans Winner; EGOT Alert; Best Of The Red Carpet ‘Scary Movie’ Stabbing Record $55M Bow; $29M For He-Man’s ‘Universe’ Raman Bests Pratt In Latest Vote Count For No. 2 In L.A. Mayor Race ‘Power Ballad’ Looks To Connect Without YouTube Phenoms Or Jump Scares Read More About: Comments",0,2026-06-08 13:11:44
