id,url,title,source,publication_date,text_length,full_text,is_duplicate,created_at
8,https://deadline.com/2026/03/owen-cooper-adolescence-royal-television-society-awards-1236765125/,Owen Cooper Wins Two Prizes As ‘Adolescence’ Triumphs At Royal Television Society Awards,Deadline,2026-03-25T06:41:08,13774,"Skip to main content Dismiss News Banner Breaking News Stephen Colbert Set To Write Next ‘Lord Of The Rings’ Movie After Forthcoming ‘The Hunt For Gollum’ Read the full story By Jake Kanter Jake Kanter International Investigations Editor @Jake_Kanter More Stories By Jake Owen Cooper Wins Two Prizes As ‘Adolescence’ Triumphs At Royal Television Society Awards ‘Harry Potter’ First Look: Wizard Wears Gryffindor Cloak In Image From HBO Series ‘Bridgerton’ Season 5 To Spotlight Female Love Story As Production Gets Underway View All March 24, 2026 11:41pm Owen Cooper in 'Adolescence' Netflix Adolescence scooped four prizes at the Royal Television Society Programme Awards on Tuesday night, with Owen Cooper receiving two honors. Fresh from earning 11 BAFTA nominations , Adolescence won Best Limited Series, while Jack Thorne and Stephen Graham clinched Best Writer – Drama. Cooper triumphed in the Supporting Actor – Male category for his performance as troubled teenager Jamie Miller in the Netflix series. He also took home the Breakthrough Award, with judges praising him as “the real deal, an astounding new talent who gave a performance that will live on in all our memories for many years to come.” Watch on Deadline Related Stories News BTS Comeback Concert Scores 13.1M Views Through Sunday On Netflix; 'Peaky Blinders' Movie Debuts At No. 1 For Film Casting '13 Going On 30' Reboot Set At Netflix With Emily Bader & Logan Lerman Starring; Brett Haley Directing, Jennifer Garner Aboard As EP There were surprises in other categories, however. Graham and Erin Doherty did not win for Adolescence in the race for Leading Actor and Supporting Actor – Female. Bobby Schofield and Anna Friel were the respective winners for their performances in BBC drama Unforgivable . Elsewhere, LOL: Last One Laughing UK won Best Comedy Entertainment show for Amazon Prime Video, while BBC One’s The Celebrity Traitors was victorious in Entertainment & Reality. Full Royal Television Society Programme Awards winners: Arts WINNER – The Last Musician of Auschwitz (Two Rivers Media in association with Access for BBC) “An extraordinarily affecting film…this was a masterpiece,” said the judges of the winning title. Nominees: Nick Cave’s Veiled World (Supercollider for Sky Arts) The Trouble With Mr Doodle (acme in association with Lightbox for Channel 4) Breakthrough Award WINNER – Owen Cooper – Adolescence (Warp Films, Matriarch Productions and Plan B for Netflix) The judges described the winner as “the real deal, an astounding new talent who gave a performance that will live on in all our memories for many years to come.” Nominees: Ellis Howard – What It Feels Like for a Girl (Hera Pictures for BBC) Kaydrah Walker-Wilkie – Just Act Normal (The Forge Entertainment for BBC) Maximilian Fairley – Unforgotten (Mainstreet Pictures, ITV Studios and Masterpiece for ITV1/ITVX) Children’s Programme WINNER – Crongton (New Pictures for BBC) “Authentic, engaging, contemporary storytelling, delivered with great confidence,” remarked the judges on the winning show. Nominees: Sky Kids Investigates: World. War. Me. (Fresh Start Media for Sky News) Wolf King (Lime Pictures for Netflix) Comedy Drama WINNER – Big Boys (Roughcut TV for Channel 4) The judges said the winning show “combines great comedy with genuine dramatic emotion – it’s a sublime piece of work.” Nominees: Dreaming Whilst Black (Big Deal Films for BBC) Juice (Various Artists Limited for BBC) Comedy Entertainment WINNER – Last One Laughing (Zeppotron/Initial for Prime Video) The winning show, the judges said, “feels genuinely unique – and never less than laugh-out-loud funny”. Nominees: Taskmaster (Avalon for Channel 4) Would I Lie to You? (Zeppotron for BBC) Comedy Performance – Female WINNER – Philippa Dunne – Amandaland (Merman Television for BBC) “She makes an immediate impact the moment she arrives on screen,” said the judges of the winner, adding “The comedic ability she brings to this show is extraordinary.” Nominees: Jordan Gray – Transaction (Big Talk Studios for ITV2/ITVX) Katherine Parkinson – Here We Go (BBC Studios Comedy for BBC) Lucy Punch – Amandaland (Merman Television for BBC) Comedy Performance – Male WINNER – Steve Coogan – How Are You? It’s Alan (Partridge) (Baby Cow Productions for BBC) “A winning performance of definitive comic expertise…he just never stops pushing the boundaries of the brilliantly drawn character,” said the judges. Nominees: Adjani Salmon – Dreaming Whilst Black (Big Deal Films for BBC) Jon Pointing – Big Boys (Roughcut TV for Channel 4) Oliver Savell – Changing Ends (Baby Cow Productions for ITV1/ITVX) Daytime Programme WINNER – BBC Breakfast – Our Girls: The Southport Families (BBC Breakfast for BBC) The winning programme, said the judges, “was produced with profound sensitivity, telling the story and articulating the emotions so beautifully.” Nominees: Loose Women (MultiStory Media, part of ITV Studios, for ITV1/ITVX) The Marvellous Miniature Workshop (MGM Alternative for BBC) Documentary Series WINNER – Bibaa & Nicole: Murder in the Park (True Vision for Sky Documentaries) The judges said the winning series “told a deeply impactful story with great care, handling trusted access with genuine sensitivity and responsibility.” Nominees: Boyzone: No Matter What (Curious Films for Sky Documentaries) Murder 24/7 (Expectation TV for BBC) Drama Series WINNER – Blue Lights (Two Cities Television/Gallagher Films for BBC) “A tense, nail-biting watch – a series so beautifully paced and immaculately written,” said the judges. Nominees: Code of Silence (Mammoth Screen for ITV1/ITVX) Slow Horses (See-Saw Films for Apple TV) This City Is Ours (Left Bank Pictures for BBC) Entertainment & Reality WINNER – The Celebrity Traitors (Studio Lambert for BBC) The winning show was described by the judges as “imaginatively cast and brilliantly produced, a real masterclass in popular television.” Nominees: Married at First Sight UK (CPL Productions for E4) Race Across The World (Studio Lambert for BBC) Entertainment Performance WINNER – Rob Beckett & Romesh Ranganathan – Rob & Romesh Vs (CPL Productions for Sky Max) “Supremely entertaining at all times, and so funny…” said the judges of the winner. Nominees: Romesh Ranganathan – Romesh: Can’t Knock the Hustle (Ranga Bee Productions for Sky Max) Claudia Winkleman – The Celebrity Traitors (Studio Lambert for BBC) Formatted Popular Factual WINNER – The Assembly (Rockerdale Studios for ITV1/ITVX) This programme, said the judges, “brilliantly created a space for difficult questions in a production crafted with real care.” Nominees: Go Back to Where You Came From (Minnow Films for Channel 4) The Jury: Murder Trial (Screendog Productions for Channel 4) History WINNER – Flight 149: Hostage of War (Drum Studios for Sky Documentaries) The judges described the winner as “a complex story told with profound clarity, a fine work with a gripping sense of purpose.” Nominees: Simon Schama: The Road to Auschwitz (Oxford Film for BBC) Unforgotten: The Bradford City Fire (acme for BBC) Leading Actor – Female WINNER – Narges Rashidi – Prisoner 951 (Dancing Ledge Productions for BBC) “A winning performance that showed true range and depth, but also real nuance,” said the judges. “She made her character very real.” Nominees: Rose Ayling-Ellis – Code Of Silence (Mammoth Screen for ITV1/ITVX) Erin Doherty – A Thousand Blows (The Story Collective, Matriarch Productions and Water & Power Productions for Disney+) Tamara Lawrance – Get Millie Black (Motive Pictures for Channel 4) Leading Actor – Male WINNER – Bobby Schofield – Unforgivable (LA Productions for BBC) “An outstanding performance of great control; he skilfully elicited empathy for a deeply troubling character,” commented the judges. Nominees: Anthony Boyle – House of Guinness (Kudos and Nebulastar for Netflix) Malachi Kirby – A Thousand Blows (The Story Collective, Matriarch Productions and Water & Power Productions for Disney+) Stephen Graham – Adolescence (Warp Films, Matriarch Productions and Plan B for Netflix) Limited Series and Single Drama WINNER – Adolescence (Warp Films, Matriarch Productions and Plan B for Netflix) “This was an immense achievement in programme making,” said the judges of the winner. “Compelling storytelling and stand out performances…a drama of real social impact.” Nominees: Get Millie Black (Motive Pictures for Channel 4) I Fought the Law (Hera Pictures for ITV1/ITVX) What It Feels Like for a Girl (Hera Pictures for BBC) Live Event WINNER – Holocaust Memorial Day 2025 (BBC Studios Events for BBC) The winning programme, said the judges, “was so thoughtfully produced, perfectly finding the right tone for the occasion.” Nominees: VE Day 80: A Celebration to Remember (BBC Studios Events for BBC) Last Night of the Proms: Finale (Livewire Pictures for BBC) Presenter WINNER – Hamza Yassin – Hamza’s Hidden Wild Isles (Silverback Films for BBC) The winning presenter, said the judges, “combines a deep understanding of the subject with a commitment and passion that leaps out of the screen.” Nominees: Martin Lewis – The Martin Lewis Money Show Live (MultiStory Media, part of ITV Studios, for ITV1/ITVX) Davina McCall – Stand Up To Cancer: Cancer Clinic Live (Bango Studios & HiddenLight Productions for Channel 4) Science & The Natural World WINNER – Underdogs (Wildstar Films, a Fremantle company, in partnership with Maximum Effort for National Geographic and Disney+) The judges called the winning programme “completely original in so many ways, an absolutely stunning watch.” Nominees: Confessions Of A Brain Surgeon (Curious Films for BBC) Pangolin: Kulu’s Journey (Anonymous Content, Dog Star and Water Creature for Netflix) Scripted Comedy WINNER – Things You Should Have Done (Roughcut TV for BBC) In selecting the winner, the judges were drawn to what they called “the strong, original voice at the show’s heart, delivering moments of pure joy and utter absurdity.” Nominees: Here We Go (BBC Studios Comedy for BBC) How Are You? It’s Alan (Partridge) (Baby Cow Productions for BBC) Such Brave Girls (Various Artists Limited for BBC) Single Documentary WINNER – Grenfell: Uncovered (Rogan Productions for Netflix) “An important film in which the devastating first person testimonies delivered a real gut punch, reinforcing what a scandalous story this remains,” said the judges. Nominees: Gaza: Doctors Under Attack (Basement Films for Channel 4) Groomed: A National Scandal (Candour Productions for Channel 4) Soap and Continuing Drama WINNER – EastEnders (BBC Studios for BBC) The winning programme, said the judges, “had the full package – fine performances from great actors, strong writing and fantastic production values.” Nominees: Casualty (BBC Studios for BBC) Hollyoaks (Lime Pictures for Channel 4) Sports Presenter, Commentator or Pundit WINNER – Gabby Logan – Women’s Rugby World Cup 2025 (Whisper Cymru for BBC) The judges described the winner as “a consummate professional who sets the gold standard for sports broadcasting, and who excelled in this coverage.” Nominees: Alex Jacques – 2025 Formula 1 Highlights (Whisper for Channel 4) Ruby Tui – Women’s Rugby World Cup 2025 (Whisper Cymru for BBC) Sports Programme WINNER – 2025 Abu Dhabi Grand Prix (Sky Sports) “A gripping watch, blending innovation with terrific story telling as the amazing event unfolded,” said the judges. Nominees: UEFA Women’s Euro 2025 Final (Sunset+Vine for BBC) Women’s Rugby World Cup 2025 (Whisper Cymru for BBC) Supporting Actor – Female WINNER – Anna Friel – Unforgivable (LA Productions for BBC) The winner, the judges said, “gave a performance that just stays with you. Powerful, authentic…and utterly truthful.” Nominees: Aimee Lou Wood – Toxic Town (Broke & Bones for Netflix) Erin Doherty – Adolescence (Warp Films, Matriarch Productions and Plan B for Netflix) Saskia Reeves – Slow Horses (See-Saw Films for Apple TV) Supporting Actor – Male WINNER – Owen Cooper – Adolescence (Warp Films, Matriarch Productions and Plan B for Netflix) “This was work that showed total conviction from a natural talent,” said the judges. “A performance of phenomenal skill in a demanding, uncompromising role.” Nominees: Alexej Manvelov – Dept. Q (Left Bank Pictures for Netflix) Christopher Chung – Slow Horses (See-Saw Films for Apple TV) Joshua McGuire – The Gold (Tannadice Pictures, part of Objective Media Group for BBC) Writer – Comedy WINNER – Kat Sadler – Such Brave Girls (Various Artists Limited for BBC) The judges described this work as “uncompromisingly bold and extremely funny, pairing blistering jokes with surprising warmth.” Nominees: Adjani Salmon & Ali Hughes – Dreaming Whilst Black (Big Deal Films for BBC) Tom Basden – Here We Go (BBC Studios Comedy for BBC) Jack Rooke – Big Boys (Roughcut TV for Channel 4) Writer – Drama WINNER – Jack Thorne & Stephen Graham – Adolescence (Warp Films, Matriarch Productions and Plan B for Netflix) The judges described this writing as “outstanding and exceptional”, adding that “it sets a new, very high benchmark for dramatic work”. Nominees: Adam Patterson & Declan Lawn – Blue Lights (Two Cities Television/Gallagher Films for BBC) Catherine Moulton – Code of Silence (Mammoth Screen for ITV1/ITVX) Sally Wainwright – Riot Women (Drama Republic for BBC and BritBox) Judges’ Award WINNER – Stephen Graham, Hannah Walters and Matriarch Productions Outstanding Achievement Award WINNER – Sir Michael Palin Disney’s $1B Investment In OpenAI DOA As Sam Altman Pulls Plug On Sora Netflix Sets ‘13 Going On 30′ Reboot With Emily Bader & Logan Lerman; Garner An EP Hannah Berner & Paige DeSorbo Lead Comedy Series In Works At Netflix ‘John Wick’ Spinoff About Blind Assassin Caine Locked & Loaded For Start Read More About: Comments",0,2026-03-25 10:00:07
40,https://www.hollywoodreporter.com/movies/movie-news/the-furious-trailer-joe-taslim-kenji-tanigaki-xie-miao-1236546558/,Hong Kong Action Film ‘The Furious’ Releases Brutal First Trailer,Hollywood Reporter,2026-03-25T06:30:16,2190,"× Skip to main content By Abid Rahman Plus Icon Abid Rahman International Editor, Digital gentlemanabroad Follow Sign Up View All March 24, 2026 11:30pm 'The Furious' Lionsgate Logo text Calling it now fight fans, we may have an all-time action classic on our hands. Lionsgate released the first official trailer for its upcoming Hong Kong action film The Furious , and the words brutal and intense will be seared on to your brain after watching it. Kenji Tanigaki ‘s film is an amalgam of the very best of Asian action cinema and features Chinese actor Xie Miao (aka Mo Tse, who starred with Jet Li in The New Legend of Shaolin and My Father Is a Hero ) and Indonesian star Joe Taslim (yes, the guy from The Raid films and also Sub-Zero in the Mortal Kombat movies). The cast also includes Indonesian action favorite Yayan Ruhian (another breakout star from Gareth Evans’ Raid films) and Thai actress Yanin Vismitananda ( Europe Raiders , Triple Threat ). Related Stories TV Disney+ Sets Big-Budget Korean Remake of 'The Americans' Starring Lee Byung-hun, Han Ji-min TV 'The Pitt' Star Noah Wyle Calls for Universal Health Coverage in U.S., Talks Season 3 and Explains Why the Hit Show ""Could Run Forever"" Though The Furious is only Japan-born Tanigaki’s third outing as a director, the filmmaker is something of a legend in Hong Kong cinema having been the stunt co-ordinator or fight choreographer for films such as Flash Point, Hidden Man, Raging Fire and Twilight of the Warriors: Walled In , as well as the Hollywood film Blade II. The plot of film revolves around Wei (Xie), a father desparately searching for his daughter after she was kidnapped by an international organized crime group. Helping Wei is Navin (Taslim), a journalist with secrets of his own. Together they fight their through the criminal underworld to rescue Wei’s daughter. The Furious premiered as part of the Midnight Madness sidebar of the 2025 Toronto Film Festival and was a huge hit with viewers, finishing as runners up in the People’s Choice Award. After its debut at TIFF, Lionsgate acquired the worldwide rights (excluding China, Hong Kong and Macao) to the film. The Furious hits theaters on May 29. THR",0,2026-03-25 10:00:43
36,https://variety.com/2026/film/news/indian-institute-of-zombies-kuku-theatrical-debut-1236697577/,‘Indian Institute of Zombies’ Marks Kuku’s Big-Screen Debut With Campus Horror Comedy (EXCLUSIVE),Variety,2026-03-25T06:00:00,4509,"Mar 24, 2026 11:00pm PT ‘Indian Institute of Zombies’ Marks Kuku’s Big-Screen Debut With Campus Horror Comedy (EXCLUSIVE) By Naman Ramachandran Plus Icon Naman Ramachandran Latest Kevin Costner, Jake Gyllenhaal to Film ‘Honeymoon With Harry’ in Queensland 33 minutes ago Webtoon’s Studio N CEO Says Western Industry Is Still Learning the Power of Webcomic IP: ‘Every Time We Have a Hit Project, Our Job Gets Easier’ 2 hours ago ‘Indian Institute of Zombies’ Marks Kuku’s Big-Screen Debut With Campus Horror Comedy (EXCLUSIVE) 3 hours ago See All Kuku Kuku , which has built a substantial presence in Indian digital entertainment through its audio and short-form video platforms, is stepping into theatrical cinema for the first time with “ Indian Institute of Zombies ,” a Hindi-language horror comedy due in cinemas on May 8. The film unfolds on an elite engineering campus, weaving together zombie horror, youth comedy and social satire. Kuku is positioning it as a genre first for Indian cinema, with the theatrical setting central to its strategy – the company sees the communal big-screen experience as distinct from, rather than an extension of, its existing digital offerings. Related Stories Netflix Out as Investor in Meghan Markle Brand As Ever Harry Styles Claps Back at Queerbaiting Criticism During 'SNL' Opening Monologue, Ends Segment With Male Kiss: 'Now That's Queerbaiting!' The ensemble cast includes Jessie Lever, Anupriya Goenka, Mohan Kapur, Ranjan Raj, Shivani Paliwal, Shantanu Anam, Rose Sardana, Sachin Kavetham and Tanishq Chaudhary, among others. The screenplay was written by Hussain Dalal and Abbas Dalal, whose previous credits include “Brahmāstra: Part One – Shiva” and “Farzi.” Direction is by Gaganjeet Singh and Alok Dwivedi of Low Gravity Productions, a team with a background in streaming series and ad films. Popular on Variety The story originated internally at Kuku, with the project framed as the opening move in what the company intends to be a growing theatrical slate. Kuku’s two main platforms occupy distinct corners of the Indian digital market. Kuku FM has scaled into a major destination for audio storytelling, while Kuku TV has carved out a following among younger audiences through the microdrama format, delivering narratives built for mobile viewing. “Kuku has always been obsessed with how India consumes stories,” said Lal Chand Bisu, CEO of Kuku. “We built scale in personal consumption through Kuku FM and created a new microdrama category in India with Kuku TV. Theatres for us represent the next frontier and we are excited to make our first steps in it. ‘Indian Institute of Zombies’ marks the first of our many, rooted in youth culture, genre innovation and mass Indian tastes.” Alongside its creative ambitions, the company is also making a case for artificial intelligence as a structural part of how it makes films. Rather than deploying AI at the margins, Kuku says it has built the technology into the project’s foundations – informing how the story was developed and structured, how production logistics were modelled, and how creative decisions were tested and refined throughout the process. Kunj Sanghvi, senior VP at Kuku, explained the thinking behind both the genre choice and the technology strategy. “‘Indian Institute of Zombies’ is a film for everyone who has ever been on a college campus. We hope our audiences get to experience their adventurous and brave side as they watch this hilarious film on zombies. We observed the success rates of horror comedies at the cinemas, the lack of a breakout Indian zombie film yet and the insatiable appetite for campus stories across age groups in India,” he said. “We don’t see AI as a replacement for creativity, but more as an amplifier. By deeply integrating AI into our filmmaking process, we’re able to iterate faster, visualize better and make sharper decisions earlier,” he added. ‘Life Is Strange: Reunion’ Actors on Ending Max and Chloe’s ‘More Mature’ Story in New Video Game, Hopes for Live-Action TV Series ‘Life Is Strange’ TV Series Casts Maisy Stella, Tatum Grace Hopkins as Chloe and Max (EXCLUSIVE) ‘Life Is Strange’ TV Series Taps Karyn Kusama to Direct First Two Episodes (EXCLUSIVE) Loading comments... More From Our Brands Rolling Stone ‘Lord of the Rings’ Superfan Stephen Colbert to Write New Movie for Peter Jackson Robb Report Russell Crowe Shows Off Toledano & Chan’s Newest Brutalist Watch on TikTok Sportico Monarch Makes First WNBA Investment in Cleveland Team",0,2026-03-25 10:00:38
37,https://variety.com/2026/film/news/vincent-donofrio-marvel-sony-spider-man-kingpin-1236698689/,Vincent D’Onofrio Says Marvel and Sony Need to ‘Get Their S— Together’ So Spider-Man Can Fight Kingpin: ‘It’s a Complicated Rights Issue’,Variety,2026-03-25T05:16:37,3286,"Mar 24, 2026 10:16pm PT Vincent D’Onofrio Says Marvel and Sony Need to ‘Get Their S— Together’ So Spider-Man Can Fight Kingpin: ‘It’s a Complicated Rights Issue’ By Jack Dunn Plus Icon Jack Dunn Latest Vincent D’Onofrio Says Marvel and Sony Need to ‘Get Their S— Together’ So Spider-Man Can Fight Kingpin: ‘It’s a Complicated Rights Issue’ 4 hours ago ‘Reacher’ Star Alan Ritchson Won’t Face Criminal Charges After Alleged Fight With Neighbor, Police Say 10 hours ago Jon Stewart Jokes the ‘Only Thing Giving Me Joy’ in Trump’s America Is ‘Looking Forward’ to Watching Taylor Frankie Paul on ‘The Bachelorette’: ‘Hold On, I’m Getting a Call’ 1 day ago See All Getty Images for Disney Vincent D’Onofrio is calling for Marvel and Sony to clear out the red tape so that his “ Daredevil: Born Again ” character, the villainous crime lord Kingpin, can face off against his longtime comic book nemesis, Spider-Man, on the big screen. In a reply to a fan on social media calling for a live-action showdown between Spidey and Kingpin, D’Onofrio wrote , “If Sony and Marvel ever get their sh*t together maybe. It’s a complicated rights issue. Hope so.” Related Stories Maya Hawke Joins Netflix Drama Series 'God of the Woods' Jada Pinkett Smith to Reprise 'A Different World' Role in Netflix Sequel Series While D’Onofrio’s Kingpin is part of Disney and Marvel’s IP machine, Sony owns the film rights to the red and blue wall crawler. However, the studio lends out the character to Marvel so he can appear in films like “Avengers: Infinity War.” Popular on Variety Kingpin and Spider-Man have technically appeared in a movie together, but it was the 2018 animated film “Spider-Man: Into the Spider-Verse.” Liev Schreiber voiced Kingpin, who faced off against Shameik Moore’s Miles Morales. D’Onofrio was most recently seen as Wilson Fisk, aka Kingpin, in the new season of “Daredevil: Born Again,” which premiered on Disney+ Tuesday night. In the new season, Fisk is the mayor of New York City, stirring civil unrest with the help of his ultra-violent Anti-Vigilante Task Force. The highly anticipated “ Spider-Man: Brand New Day ” will mark the next appearance of Holland’s web-slinging hero. Hitting theaters on July 31, the film also stars Zendaya, Sadie Sink, Jacob Batalon, Jon Bernthal and Mark Ruffalo. It’s directed by Destin Daniel Cretton and written by Chris McKenna and Erik Sommers. The sequel picks up after the events of 2021’s “No Way Home,” which saw the whole world forget that Peter Parker is Spider-Man. Sony’s released the trailer for “Brand New Day’ on March 17. In just four days, it crossed 1 billion views, becoming the first movie trailer ever to reach the milestone. ‘Life Is Strange’ TV Series Casts Maisy Stella, Tatum Grace Hopkins as Chloe and Max (EXCLUSIVE) ‘Life Is Strange: Reunion’ Actors on Ending Max and Chloe’s ‘More Mature’ Story in New Video Game, Hopes for Live-Action TV Series ‘Life Is Strange’ TV Series Taps Karyn Kusama to Direct First Two Episodes (EXCLUSIVE) Loading comments... More From Our Brands Rolling Stone ‘Lord of the Rings’ Superfan Stephen Colbert to Write New Movie for Peter Jackson Robb Report Russell Crowe Shows Off Toledano & Chan’s Newest Brutalist Watch on TikTok Sportico Monarch Makes First WNBA Investment in Cleveland Team",0,2026-03-25 10:00:39
