id,url,title,source,publication_date,text_length,full_text,is_duplicate,created_at
18,https://variety.com/2026/film/global/ricky-gervais-netflix-alley-cats-annecy-1236790121/,Ricky Gervais Talks Netflix’s ‘Alley Cats’ as Annecy Sings Him ‘Happy Birthday’: ‘I Hope You Like Cats. And Swearing’,Variety,2026-06-25T09:42:28,5716,"Jun 25, 2026 2:42am PT Ricky Gervais Talks Netflix’s ‘Alley Cats’ as Annecy Sings Him ‘Happy Birthday’: ‘I Hope You Like Cats. And Swearing’ By Marta Balaga Plus Icon Marta Balaga Latest Ricky Gervais Talks Netflix’s ‘Alley Cats’ as Annecy Sings Him ‘Happy Birthday’: ‘I Hope You Like Cats. And Swearing’ 2 hours ago Brothers Quay Talk ‘Humble Craft’ of Animation, Tease New Project: ‘There’s No Script Yet, but We’re Getting There’ 2 days ago WIA Celebrates 10 Years of WIA World Summit at Annecy, Announces Bonnie Arnold’s Fireside Chat and Asks What Comes Next (EXCLUSIVE) 1 week ago See All Rob Latour/Variety/PMC Ricky Gervais is ready for Netflix ‘s “ Alley Cats .” “I hope you like cats. And swearing,” he told the audience at Annecy. The viewers serenaded him before the screening of the first two episodes, singing Happy Birthday.’ In the show, the comedian and creator of “The Office” and “After Life” decided to turn his attention to British feral cats. Gervais explained why he wanted to try his hand at animation. Related Stories 'Ponies' Canceled After One Season at Peacock 'All Her Fault' Team Sets Peacock Mystery Series 'The Break-In' Based on Katherine Faulkner Novel “Many reasons. I don’t have to do hair and makeup, or get up early. I can just sit in a chair and do this forever.” Also, cats are “perfect creatures.” “They are so independent and so tiny. They think they are lions,” he laughed. Popular on Variety “But it’s a sitcom. I don’t even like the term ‘adult animation,’ because it’s a family of cats – just like in a sitcom.” “You write it and then you just play with it. It’s just fun. There are no restrictions.” The hilarious new series had the audience in stitches. “Sometimes I would think: Can we do it?!” He wanted the actors to keep things real when voicing the characters. “It’s recorded very differently to average [animation]. We were in a room at the same time, firing. I told them: ‘Don’t be ‘funny.” Everything is realistic – apart from the cats talking. I said: ‘Think of them as people, sitting on a couch and watching TV’.” Looking at a photo of the team at work, he said: “They look like a posh orchestra, but they are about to say ‘cunt’.” Gervais also treated the audience to his very first drawing of one of the cats, Gus. They “left his attitude.” “Sitcom is all about the characters. if you love them, you can watch them do nothing. I could watch Homer Simpson read something for hours. I told everyone: ‘If people will love these cats, we’ve done it’.” He added: “The fact that someone is animating that absolute drivel is already funny.” “I don’t know how we fucking did it. It came out not only as I wanted it in my head, but it seemed… easy. It was fun! There was one thing we had three goes at – there’s dancing at the end, and we had to figure out what’s the best way for these cats to dance.” “You don’t have to do much to make it slightly different,” he added. Still, it was a “big learning curve” for Gervais. “I had to learn fast, but kept everything in my wheelhouse.” He also talked about using “There Is a Light That Never Goes Out” by The Smiths in one of the scenes. “My favorite bit in the craft is: How can I get emotions across?” He noted: “This song is so existential and uplifting. Everything I’ve done is slightly existential and it’s exaggerated with cats, because they have such short lives. Then we had to get permission, so I had to write a nice letter to Morrissey and Johnny Marr, and they both said yes.” “I like pathos. With any fiction, you create your own heroes and villains as a roleplay for the soul. it’s all there is. I’ve never been interested in ‘oh, that was a great dolly shot.’ Do I believe the actor? Do I care about these characters? Everything you do, there’s got to be a bigger picture. Otherwise, we don’t care.” Death is very present in the show, “on purpose.” “I want people to want them to survive. And they do. I just want them to love the cats,” he noted. “I should also say how great Netflix is, because I want a second season. They commissioned it based on: ‘There are cats and they swear a lot.’ ‘What happens?’ ‘Nothing happens’.” The show is “very British,” but only “on a trivial level.” “‘The Office’ was supposed to be British, too. But the themes are universal. [In the original version] we put a stapler in jelly – in the French version it was cheese. It translates! I’ve always written about humanity. The joke is that I’m not a fan, but I am. I just like being honest about it. Drama hides a hero’s flaws; comedy exaggerates it. It says: ‘We are all idiots.’ I love humanity and I love bringing that out.” Courtesy of Netflix ‘Gone,’ ‘Tip Toe’ Star David Morrissey on Relying on Gut Instinct: ‘Analysis Can Be Paralysis Sometimes’ John Hannah Teases New ‘Mummy’: ‘You’ve Heard All the Rumors and It’s True. Everyone’s Back’ How ‘The Other Bennet Sister’ Star Ella Bruccoleri Learned to Love Jane Austen: ‘It Actually Feels Like She’s on My Side’ Lesley Manville, Aldis Hodge, Kevin McKidd to Headline Business Forum Lineup at Monte-Carlo Television Festival David Boreanaz on Taking On Iconic Role of Jim Rockford in ‘The Rockford Files’: ‘My Attitude Is “I Want to Make James Garner Proud”’ ‘There Has to Be Meat on the Bone’ to Create Long-Running Series, Executive Producers Argue at Monte-Carlo: ‘Follow the Stories You Want to Dig Into’ Loading comments... More From Our Brands Rolling Stone Leonard Cohen Estate Does Not Support Trump’s Plan to Use ‘Hallelujah’ at Freedom 250 Rally Robb Report Pomellato’s New High Jewelry Collection Is a Masterclass in Eclecticism Sportico CC Sabathia, Hunter Pence, Dexter Fowler on Day 3 at Cannes Lions WWD H&M Sees Flat Sales in Q2 With 3% Fewer Stores",0,2026-06-25 11:44:54
19,https://variety.com/2026/film/festivals/virginie-efira-locarno-film-festival-1236790170/,Virginie Efira to Be Honored by Locarno Film Festival,Variety,2026-06-25T09:33:31,3798,"Jun 25, 2026 2:33am PT Virginie Efira to Be Honored by Locarno Film Festival By Nick Vivarelli Plus Icon Nick Vivarelli International Correspondent @NickVivarelli Latest Paramount-Warner Bros. Merger Set to Clear European Union Regulatory Hurdle (Report) 20 hours ago Eugene Jarecki Knew Streamers ‘Were Never Going to Touch’ His Julian Assange Documentary. So He’s Releasing It Through Bitcoin With the Help of Jack Dorsey 20 hours ago Shivani Pandya Malhotra, Former Managing Director of Saudi Arabia’s Red Sea Film Festival, on Expanding Her Dubai-Based Ta Films Shingle (EXCLUSIVE) 2 days ago See All Courtesy Locarno Film Festival The Locarno Film Festival will celebrate Virginie Efira , the Belgian-born, France-based actress who was recently in Cannes with lead roles in two competition films: Ryusuke Hamaguchi’s “All of a Sudden” and Asghar Farhadi’s “Parallel Tales.” Efira will be feted by the Swiss fest, which is Europe’s preeminent event dedicated to indie cinema, with its Leopard Club Award. She will receive the prize on Aug. 7 when “All of a Sudden,” for which Efira won acting honors in Cannes — and for which she learned to act partly in Japanese — will screen in the lakeside town’s 6,500-seat outdoor Piazza Grande venue. Related Stories 'Ponies' Canceled After One Season at Peacock Alan Jackson's Star-Studded Farewell Concert to Be Filmed for 'The Last Show' NBC Special In a statement, the fest noted that Efira’s career trajectory has been marked by “memorable turns” in works by Dutch director Paul Verhoeven and by “Anatomy of a Fall” filmmaker Justine Triet. Popular on Variety “In Verhoeven’s ‘Elle’ (2016), and especially in ‘Benedetta’ (2021), Efira demonstrated a willingness to inhabit provocative, demanding characters whose thorny complexities resist easy categorization,” the statement said. “Her extraordinary performances in Triet’s ‘Victoria’ (2016) and ‘Sibyl’ (2019) likewise confirmed that gift and, along with a handful of other remarkable films of that period, secured her status as one of the rising stars of modern European cinema.” Commented Locarno artistic director Giona A. Nazzaro: “Virginie Efira brings a unique sensibility to her roles as a performer. Bold yet thoughtful, instinctive yet ironic, she offers contemporary cinema a fresh perspective that continually reinvents itself. From working with Verhoeven to Hamaguchi and beyond, she has consistently explored her artistic potential, revealing a talent that evolves with freedom and vitality. Efira captures the beauty of what it means to be an actress in today’s cinema.” Previous recipients of Locarno’s Leopard Club Award include Faye Dunaway, Mia Farrow, Andy Garcia, Stefania Sandrelli, Adrien Brody, Meg Ryan, Hilary Swank, Kasia Smutniak and Daisy Edgar-Jones. The 79th edition of Locarno will run Aug. 5-15. YouTube Will Start Automatically Tagging Videos That Make ‘Significant’ Use of AI, and It’s Making Labels for AI-Generated Content More Prominent Google Asserts That YouTube’s Terms of Service Allow It to Train AI Models YouTube Pumps Up Ad Sales 10.7% to $9.9 Billion in Q1 ‘Dead Meat’ Horror Awards Set Ticketed Live-Stream Event in Addition to YouTube Broadcast for 2026 Show (EXCLUSIVE) YouTube India Positions Connected TV as New Prime-Time Screen, Unveils Three-Lever Strategy for M&E Partners at APOS YouTube Creators are Making a Splash This Awards Season. Here’s a Guide to the Platform’s Top Contenders Loading comments... More From Our Brands Rolling Stone Leonard Cohen Estate Does Not Support Trump’s Plan to Use ‘Hallelujah’ at Freedom 250 Rally Robb Report Pomellato’s New High Jewelry Collection Is a Masterclass in Eclecticism Sportico CC Sabathia, Hunter Pence, Dexter Fowler on Day 3 at Cannes Lions WWD H&M Sees Flat Sales in Q2 With 3% Fewer Stores",0,2026-06-25 11:44:55
5,https://deadline.com/2026/06/sky-itv-agree-terms-deal-love-productions-to-itv-studios-1236967160/,Sky & ITV Agree Terms Over $2.1B Deal With Official Announcement Expected Imminently — Report,Deadline,2026-06-25T09:17:34,2847,"Skip to main content By Max Goldbart Max Goldbart International TV Co-Editor @Goldbart1 More Stories By Max Sky & ITV Agree Terms Over $2.1B Deal With Official Announcement Expected Imminently — Report Netflix’s ‘Dept. Q’ Adds New Cast & Rolls Cameras On Season 2 BBC & BritBox Returning To ‘The Other Bennet Sister’ For Three-Part Christmas Special View All June 25, 2026 2:17am Sky's 'SNL UK' Sky Sky and ITV have agreed terms over their £1.6B ($2.1B) acquisition deal and the move that will shake up British broadcasting could be announced in the next fortnight, according to Reuters. As part of the deal, Reuters confirmed previous reporting that The Great British Bake Off producer Love Productions will be sold to ITV Studios . The deal is for ITV’s Media & Entertainment arm, not its Studios production and distribution division, and it first emerged late last year . In May, ITV followed up by saying it remained in “active discussions” with Sky. Reuters said it is now being finalized by lawyers and an announcement could be made in the next couple of weeks. Related Stories News Acorn TV & ITV Buy Kiwi Cozy Crime Drama 'Blue Murder Motel' News 'Possession' Teaser: Gugu Mbatha-Raw Leads Sky's Limited Series Set Between Bristol & Jamaica ITV Studios, which makes the likes of Love Island and Squid Game: The Challenge, will remain separate and will add Love Productions to its stable, a huge boon given the Great British Bake Off IP. Sky bought 70% of Love in 2014 and the remainder in 2020. Founder Richard McKerrow exited last year . Watch on Deadline Earlier this month, ITV boss Carolyn McCall gave an impassioned speech at a leaders conference about why the Media & Entertainment biz, aka ITV channels and streamer ITVX, is “extremely resilient and cash generative.” The network is “recognized by shareholders as a strong business, not what it was six or seven years ago,” she said. ITV’s share price rose 2.5% this morning. In a Q1 trading update a few weeks back , revenue at ITV’s M&E biz declined slightly to £477M, while ITV Studios grew 4% to £400M, with further growth forecast for the latter. Sky is owned by U.S. media giant Comcast but we are told Sky is very much leading on the ITV deal with its parent in the background. The deal will require approval from Ofcom and the Competition Markets Authority and will lead to question marks over what will happen to Sky and ITV’s respective news operations. ITV News is run by Channel 4 and 5 newsmaker ITN. ITV declined comment. Deadline has reached out to Sky for comment. Sky & ITV Agree Terms Over $2.1B Deal, Anno Imminent: Report James Bond Search Heats Up As Producers Target Actors, Set New Auditions ‘Supergirl’ Review: DC’s Latest Superhero Pic Doesn’t Fly High Enough ‘Toy Story 5’ Won’t Play Nice With ‘Supergirl’, Eyes Win With Near-$90M Read More About: Comments",0,2026-06-25 11:44:38
6,https://deadline.com/2026/06/virginie-efira-locarno-leopard-club-award-1236967161/,Virginie Efira To Receive Locarno’s Honorary Leopard Club Award,Deadline,2026-06-25T09:14:42,2970,"Skip to main content By Zac Ntim Zac Ntim International Reporter @ZacharyNtim More Stories By Zac CJ Obasi To Co-Write & Direct ‘The Boy Who Runs,’ A Biopic Based On The Life Of Ugandan Distance Runner Turned Politician Julius Achon Cinema Admissions Dropped Across Europe In 2025 Circle Women Doc Accelerator Selects 10 Nonfiction Projects For 2026 Mentorship Program View All June 25, 2026 2:14am Virginie Efira Rudy Marme Virginie Efira will be awarded Locarno ’s honorary Leopard Club Award during this year’s festival, which runs from August 5-15. Efira will receive the award at the festival’s Piazza Grande stage on August 7 and will also present, as part of the Festival programme, Ryusuke Hamaguchi’s All of a Sudden , the film for which she won the Best Actress award at Cannes. Locarno’s Leopard Club Award is handed out to individuals “whose work in the film industry has left its mark on the collective imagination.” Previous winners include Faye Dunaway, Mia Farrow, Andy García, Stefania Sandrelli, Adrien Brody, Meg Ryan, Hilary Swank, Kasia Smutniak, Daisy Edgar-Jones, Irène Jacob, and Emma Thompson. Related Stories News 'An American Werewolf In London' & Michael Jackson's 'Thriller' Make-Up Artist Rick Baker Set For Locarno Honorary Award News Asia Argento Set For Locarno Lifetime Achievement Award Locarno Artistic Director Giona A. Nazzaro described Efira as a performer with “a unique sensibility to her roles.” Watch on Deadline “Bold yet thoughtful, instinctive yet ironic, she offers contemporary cinema a fresh perspective that continually reinvents itself,” Nazzaro said of Efira. “From working with Verhoeven to Hamaguchi and beyond, she has consistently explored her artistic potential, revealing a talent that evolves with freedom and vitality. Efira captures the beauty of what it means to be an actress in today’s cinema.” All Of A Sudden is Ryusuke Hamaguchi’s follow-up to Evil Does Not Exist, which won the Silver Lion Grand Jury Prize at the 2023 Venice Film Festival. Hamaguchi wrote the script in collaboration with Léa Le Dimna, which is loosely inspired by a collection of real-life exchanged letters published in the book When Life Suddenly Takes a Turn: Twenty Letters Between a Philosopher with Terminal Cancer and Medical Anthropologist by Makiko Miyano and Maho Isono. The film is produced by David Gauquié, Julien Deris, Jean-Luc Ormières, Renan Artukmaç for Paris-based Cinefrance Studios; Hiroko Matsuda, Kosuke Oshida, Yuji Sadai for Japan’s Office Shirous & Bitters End; Bettina Brokemper for Germany’s Heimatfilm; and Joseph Rouschop for Belgium’s Tarantula. Neon has acquired North American rights to the film. Sky & ITV Agree Terms Over $2.1B Deal, Anno Imminent: Report James Bond Search Heats Up As Producers Target Actors, Set New Auditions ‘Supergirl’ Review: DC’s Latest Superhero Pic Doesn’t Fly High Enough ‘Toy Story 5’ Won’t Play Nice With ‘Supergirl’, Eyes Win With Near-$90M Read More About: 1 Comments",0,2026-06-25 11:44:40
20,https://variety.com/2026/tv/global/dept-q-season-2-adds-cast-starts-production-1236790151/,"‘Dept. Q’ Season 2 Adds Aisling Franciosi, Greg Wise and More to Cast as Production Starts in Scotland",Variety,2026-06-25T09:09:21,4620,"Jun 25, 2026 2:09am PT ‘Dept. Q’ Season 2 Adds Aisling Franciosi, Greg Wise and More to Cast as Production Starts in Scotland By Ellise Shafer Plus Icon Ellise Shafer Latest ‘The Other Bennet Sister’ Sets Christmas Special at BritBox and BBC 20 hours ago ‘Invincible’: Jack Quaid Joins Voice Cast as Prime Video Reveals Early Season 6 Renewal 23 hours ago Taylor Swift Sings ‘Love Story’ With Lainey Wilson in Surprise Performance at Travis Kelce’s Tight End University 1 day ago See All Jamie Simpson The second season of “Dept. Q” is officially underway, with the Netflix crime series starting production in Scotland and adding 10 cast members. Matthew Goode is set to return as DCI Carl Morck alongside his rag-tag team of Alexej Manvelov as Akram Salim, Leah Byrne as DC Rose Dickson and Jamie Sives as DS James Hardy. Season 2 will once again be filmed and set in Edinburgh. Joining the cast for Season 2 are Aisling Franciosi (“Speak No Evil,” “The Nightingale”) as Kimmie; Greg Wise (“The Crown,” “The Buccaneers”) as Derek Powell; Nicholas Rowe (“Red Eye” S2, “Spy Among Friends”) as Thomas Fulton; Tony Curran (“Outlander: Blood of My Blood,” “Mary and George”) as Winnie Calderwood; Hamish Clark (“Monarch of the Glen”) as Christopher Herron; Alex Ferns (“Waiting for the Out,” “The Batman”) as Phil Allenbeck; Ross Anderson (“Knight of the Seven Kingdoms,” “The Rig”) as Ricky Daddario; Rebecca Root (“Heartstopper,” “The Wheel of Time”) as June Lovesay; Isla Johnston (“The Queen’s Gambit,” “The Carpenter’s Son”) as Agnes; and Amy Brenneman (“The Old Man,” “Judging Amy”) as Helen. Related Stories 'Love Island USA' Season 8 Is Peacock's Most-Watched TV Debut Ever, With 23% of Viewership on Phones and Tablets Peacock Gives Series Order to ‘Dungeon Crawler Carl’ TV Series From Seth MacFarlane’s Fuzzy Door, Chris Yost Other returning faces from Season 1 include Mark Bonnar as Stephen Burns, Kate Dickie as Moira Jacobson, Aaron McVeigh as Jasper and Sanjeev Kohli as Martin Fleming. Popular on Variety Written and directed by Scott Frank (“The Queen’s Gambit”) and produced by Left Bank Pictures (“The Crown”), the show follows Morck as as he “heads up the maverick Dept. Q from the basement of an Edinburgh police station, charged with cases previously deemed unsolvable,” according to its synopsis. “This darkly humorous, propulsive show delivers all the pleasures of a procedural, but takes us into the complex mysteries not just of the cases but of the detectives themselves.” Executive producers include Frank, Rob Bullock and Charlotte Moore, with Manda Levin and Jessica Burdett overseeing for Netflix. “This season, Carl and his band of misfits tackle a terrible crime hidden in the highest echelons of Scottish society,” Left Bank’s Bullock said in a statement. “It is a story for our times: rich and powerful people who believe they are above the law. Carl, of course, knows otherwise. It’s a joy to be working with master storyteller Scott Frank once again, along with the rest of team dolally. We applaud Netflix’s courage for letting them loose once again.” Added Netflix’s Levin: “Season 1 of ‘Dept. Q’ made us laugh and cry; it shocked and intrigued us; we fell in love with the characters and with the incredibly vivid and iconic world that Scott Frank and his amazing team conjured up in one of our very favorite cities. That it was embraced so wholeheartedly by an audience in Scotland, in the rest of the U.K., and across the world, was thrilling. The story of Season 2 is as darkly delicious as you’d expect, and Carl and his glorious gang will have their work cut out pinning down the perpetrators as we launch back in for more!” YouTube India Positions Connected TV as New Prime-Time Screen, Unveils Three-Lever Strategy for M&E Partners at APOS Google Asserts That YouTube’s Terms of Service Allow It to Train AI Models YouTube Pumps Up Ad Sales 10.7% to $9.9 Billion in Q1 YouTube Music Unveils Indie ‘Foundry Class’ of 2026: Julia Wolf, RaiNao, Kelela and More YouTube Will Start Automatically Tagging Videos That Make ‘Significant’ Use of AI, and It’s Making Labels for AI-Generated Content More Prominent ‘Dead Meat’ Horror Awards Set Ticketed Live-Stream Event in Addition to YouTube Broadcast for 2026 Show (EXCLUSIVE) Loading comments... More From Our Brands Rolling Stone Leonard Cohen Estate Does Not Support Trump’s Plan to Use ‘Hallelujah’ at Freedom 250 Rally Robb Report Pomellato’s New High Jewelry Collection Is a Masterclass in Eclecticism Sportico CC Sabathia, Hunter Pence, Dexter Fowler on Day 3 at Cannes Lions WWD H&M Sees Flat Sales in Q2 With 3% Fewer Stores",0,2026-06-25 11:44:56
