id,url,title,source,publication_date,text_length,full_text,is_duplicate,created_at
10,https://deadline.com/2026/03/jane-fonda-paramount-warner-bros-kennedy-center-1236768109/,Jane Fonda Leads First Amendment Rally Near Kennedy Center To Warn Of Paramount-Warner Bros Merger & Trump’s Media Attacks,Deadline,2026-03-27T22:05:36,5672,"Skip to main content By Ted Johnson Ted Johnson Political Editor @tedstew More Stories By Ted Jane Fonda Leads First Amendment Rally Near Kennedy Center To Warn Of Paramount-Warner Bros Merger & Trump’s Media Attacks Savannah Guthrie Sets Return To ‘Today’ Amid Mother’s Disappearance: “I Can’t Not Come Back, Because It’s My Family” Donald Trump’s Signature To Appear On U.S. Paper Currency, A First For A Sitting President View All March 27, 2026 3:05pm Jane Fonda C-SPAN screenshot Jane Fonda brought her Committee for the First Amendment to Washington, D.C. on Friday for a pre-No Kings Day rally that focused on Donald Trump’s attacks on the media and the pending merger between Paramount and Warner Bros. Discovery . Held on a street just near the Kennedy Center , the event’s purpose was to “defend free expression and political intimidation, institutional capture, and censorship across the arts, culture and media.” Joining her were actors and performers including Joan Baez , Billy Porter, Maggie Rogers, Rupi Kaur, Sam Waterston, Griffin Dunne, Crys Matthews and Kristy Lee, as well as journalists Jim Acosta and Joy Reid, and writers Ann Patchett and Bess Kalb. Watch the full rally below. Watch on Deadline Related Stories News Savannah Guthrie Sets Return To ‘Today’ Amid Mother’s Disappearance: “I Can’t Not Come Back, Because It’s My Family” News Eva Longoria Expresses Fears Over WBD-Paramount Merger: “The Consolidation Is The Scary Part Of It” Fonda has been outspoken about the impact of recent media consolidation, not just Paramount -WBD but the FCC’s recent greenlight to the Nexstar-Tegna combination , creating a broadcast giant of almost 270 TV stations. “Since Trump has taken over the approval of media mergers, we risk having major jewels in the crown of independent journalism and nuanced entertainment being gutted,” Fonda told the crowd. “I am referring to Warner Bros Studios, CNN and HBO. God, it hurts me to say those names that may still not be what they were.” She characterized attacks on artists, writers and journalists as being “page one in the authoritarian playbook.” She added, “The general public may think this all doesn’t affect them, but it does if we don’t fight back. The news will be increasingly fake. We won’t be allowed to know what’s really happening. Our children’s academic curricula will actually be censored. Ticket costs for cultural events will go up, while the quality will go down. Books and films will be shallower, lacking complexity.” Paramount CEO David Ellison has defended the merger. He has said that CNN’s independence “needs to be maintained,” while he has argued that the merger of the two studios will boost film output. The transaction is being reviewed by the Justice Department, but it’s also being scrutinized by California Attorney General Rob Bonta . Fonda relaunched the Committee for the First Amendment last year, a nod to the late-1940s group of artists formed to protest the emerging blacklist era. At Friday’s event, Waterston, Porter and Dunne read from one of the key moments from that time, when Paul Robeson testified before the House Un-American Activities Committee. Fonda was a weekly presence in Washington in the fall and early winter of 2019, when she led climate protests on Capitol Hill and was arrested five times. This being D.C., it was not only March cold and rainy, but the sounds of another, unrelated protest outside the Saudi Arabia embassy could be heard as Fonda spoke from a makeshift stage. She heard the sounds, and realized that it was an alternate event, not a counter-demonstration. “It’s a separate protest. We like protests,” she said. Fonda’s event featured multiple references to Trump’s takeover of the Kennedy Center board which, late last year, added the president’s name to the arts complex . The board recently approved Trump’s plan to shutter the facility for two years in July, in what the president has said is needed for renovations. But the center has seen an exodus of artists following the name change, while ticket sales have been lagging, according to analyses in the Washington Post and the New York Times . “I considered turning in my Kennedy Center Honor, but that would be admitting defeat,” Baez told the crowd. “It would mean we have given in to a bully, who is doing his best to strip us of our freedoms, to strip us of our joy.” She and Rogers performed “The Times They Are A Changin'” and “Ain’t Gonna Let Nobody Turn Me Around,” while Lee led a finale of “Free Love.” Lee was among the artists who backed out of planned Kennedy Center performances earlier this year. Ric Grenell, who was president of the center until earlier this month, dismissed the artist cancellations following the name change for Trump. “Boycotting the Arts to show you support the arts is a form of derangement syndrome,” Grenell wrote at the time. Lee, though, has said that adding Trump’s name was an effort to impose “political branding” on the arts institution. At the event on Friday, she said, “There’s a lot of things happening right now that we all know just ain’t right, and it’s got a lot of people disconnected from each other.” “I’m not going to lie. I was looking forward to the opportunity,” she said. “But playing at that center after what happened would have cost me my integrity, and that’s worth more than a paycheck.” ‘Project Hail Mary’ Orbiting $46M+ Frame; ‘They Will Kill You’ At $5M-$6M CBS Cancels ‘DMV’ & ‘Watson’; What It Means For Network’s Comedy Pilots Pete Davidson To Play Mafia Killer & Paul Walter Hauser Is DEA Agent In ‘Tommy Karate’ Tiger Woods Arrested For DUI After Rollover Crash In Florida Read More About: Comments",0,2026-03-28 09:46:18
11,https://deadline.com/2026/03/watson-dmv-canceled-cbs-series-finale-date-comedy-pilots-1236768077/,"‘Watson’ & ‘DMV’ Canceled By CBS, Series Finales Set; What Does That Mean For Net’s Comedy Pilots?",Deadline,2026-03-27T22:00:15,2452,"Skip to main content By Nellie Andreeva Nellie Andreeva Editor-In-Chief @DeadlineNellie More Stories By Nellie ‘Watson’ & ‘DMV’ Canceled By CBS, Series Finales Set; What Does That Mean For Net’s Comedy Pilots? ‘Chicago Fire’, ‘Chicago P.D.’ & ‘Chicago Med’ Renewed By NBC For 2026-27 Season Sean Hayes Joins ‘The Morning Show’ For Season 5 View All March 27, 2026 3:00pm 'DMV' and 'Watson' CBS CBS has finalized its 2026-27 lineup of returning scripted series, canceling the two shows on the bubble, sophomore drama Watson , headlined by Morris Chestnut, and freshman comedy DMV , led by Harriet Dyer. Their season — now series — finales will air May 3 and May 11, respectively. The news comes a week and a half before the network is slated to unveil its 2026-27 schedule on April 15. Related Stories Cancellations and Renewals 2026 TV Cancellations Photo Gallery: Series Ending This Year & Beyond Cancellations and Renewals 2026 TV Series Renewals Photo Gallery Watson and DMV ‘s pending cancellations were telegraphed back in January when, after a blitz of early renewals, they were the only CBS on-air scripted series left in limbo . Among the network’s lowest rated shows, their survival faced long odds and depended on how CBS’ then-upcoming midseason dramas Marshals and CIA would perform and how the network’s comedy pilots Eternally Yours and Tillbrooks (fka Regency) would come in. Yellowstone spinoff Marshals, riding high with a Season 2 writers room commissioned prior to launch, landed one of the quickest renewals ever after only two episodes. FBI offshoot CIA followed with a Season 2 pickup of its own earlier this week , shutting the door for Watson. Overall, CBS renewed 12 dramas for next season, including all 4 freshmen, Marshals, CIA, Sheriff Country and Boston Blue , with two new series previously picked up for 2026-27, Robert and Michelle King’s Cupertino and Einstein , headlined by Matthew Gray Gubler, set to join them. Watch on Deadline Since veteran CBS comedy series The Neighborhood is ending its run with the current eighth season, there was a glimmer of hope for DMV contingent on the network’s two pilots, single-camera vampire comedy Eternally Yours , from Ghosts showrunners Joe Port and Joe Wiseman, and the multi-camera Tillbrooks , a historical spin on the classic multi-cam family sitcom. The fact that CBS has pulled the trigger on DMV ‘s cancellation indicates that its executives feel good about the pilots.",0,2026-03-28 09:46:19
23,https://variety.com/2026/tv/news/ed-bernard-dead-police-woman-the-white-shadow-1236701836/,"Ed Bernard, ‘Police Woman’ and ‘The White Shadow’ Actor, Dies at 86",Variety,2026-03-27T22:00:10,3615,"Mar 27, 2026 3:00pm PT Ed Bernard, ‘Police Woman’ and ‘The White Shadow’ Actor, Dies at 86 By Payton Turkeltaub Plus Icon Payton Turkeltaub Latest ‘World of Warcraft’ Concert Series Sets Anniversary Tour (Gaming News Roundup) 11 hours ago Ed Bernard, ‘Police Woman’ and ‘The White Shadow’ Actor, Dies at 86 11 hours ago ‘The Reunion: Laguna Beach’ Trailer: Original Cast Reunites 20 Years Later (TV News Roundup) 2 days ago See All Courtesy Everett Collection Ed Bernard , an actor best known for roles on the TV series “Police Woman” and “The White Shadow,” died on Jan. 23 in Northridge, Calif. He was 86. News of Bernard’s death was confirmed by his son, Edward B. Bernard. “While the world knew him as a star, his family knew him as a devoted father, a proud grandfather and a man of deep curiosity. Ed was a true ‘foodie’ who loved sushi and healthy cooking, a lifelong learner and a man of great faith,” wrote Edward in a statement. Related Stories OpenAI Will Shut Down Sora Video App; Disney Drops Plans for $1 Billion Investment Disney's Next CEO: Five Things to Know About Josh D'Amaro Bernard’s career first began in 1971 when he appeared in Gordon Parks’ classic “Shaft.” He continued to collect credits in films like Peter Yates’ “The Hot Rock” and Barry Shear’s “Across 110th Street” in 1972 before making his first TV appearance in 1973’s “Love Story.” Popular on Variety In 1974, he was cast as Detective Joe Styles on NBC’s “Police Woman,” a crime drama that follows undercover cop Sergeant “Pepper” Anderson. He played Styles for all four seasons of the crime drama, culminating in 90 episodes. Over the course of its run, “Police Woman” was nominated for seven primetime Emmys. In 1978, Bernard joined the cast of Bruce Paltrow’s “The White Shadow,” a TV series about a basketball coach at an inner-city high school. He played Principal Jim Willis over 33 episodes until 1980. Bernard also made appearances on TV series including “Hardcastle and McCormick,” “Life with Lucy,” “Doogie Howser, M.D.,” “ER” and “Cold Case.” In addition to his work on screen, Bernard also performed onstage, most notably appearing in a 1969 production of “Five on the Black Hand Side” at the American Place Theatre. Bernard was born in Philadelphia on July 4, 1939. He is survived by his sons Edward and Mark Sheldon Beranard and his grandchildren Liz, Joshua, Samantha and Alexandra. Shirley Mae Bernard, his wife of 44 years, died in 2005. Bernard will be “laid to rest at sea” during a private family service, per the family’s statement. Katie Leung ‘Would Not Want to Go Back’ to Her Time Shooting ‘Harry Potter’ Movies: ‘I Was So Easily Influenced’ Hogwarts Gets Collegiate-Style Merch in New ‘Harry Potter’ Homage Collection Paul Bettany ‘Hasn’t Heard Anything’ About Playing Voldemort in HBO’s ‘Harry Potter’ Series but Says He’s a ‘Big Fan’ of the Franchise ‘Harry Potter’ Series Set to Be the ‘Streaming Event of the Decade,’ Says Warner Bros. Discovery Streaming Boss Daniel Radcliffe Tells Press Not to Always Ask HBO’s ‘Harry Potter’ Cast About the Original Movie Actors: ‘Just Let Them Get On… It’s Going to Be Different’ ‘Harry Potter’ Series Will Take Viewers Inside Malfoy Manor, Says New Draco Actor: ‘You Get an Insight Into How He Is’ Loading comments... More From Our Brands Rolling Stone Jack White Slams Trump’s Signature on U.S. Dollars Amid America’s Rising Cost of Living Robb Report Ryan Seacrest Spins His 40-Acre California Wine Country Estate Back on the Market Sportico Lachlan Murdoch Makes 92x Return on Royals Cricket Sale WWD Consumer Confidence Continues to Drop as Gas Prices Rise",0,2026-03-28 09:46:33
35,https://www.hollywoodreporter.com/tv/tv-news/cbs-cancels-watson-dmv-1236549115/,CBS Cancels ‘Watson’ and ‘DMV’,Hollywood Reporter,2026-03-27T22:00:00,2788,"Skip to main content By Katie Kilkenny Plus Icon Katie Kilkenny Labor & Media Reporter katiekilkenny7 Follow Sign Up View All March 27, 2026 3:00pm Tony Cavalero, Harriet Dyer and Tim Meadows in ‘DMV’ Bertrand Calmeau/CBS Logo text Take it easy today on friends and acquaintances who love CBS ’ Watson or DMV . On Friday CBS announced that it was canceling both shows after just two seasons and one season, respectively. The network cut ties with creator Craig Sweeny’s short-lived medical spin on the Sherlock Holmes novels and creator Dana Klein’s Department of Motor Vehicles workplace comedy as it recommits to shows including Marshals and George & Mandy’s First Marriage . Waston ’s series finale will air May 3 at 10 p.m. ET/PT, while DMV will conclude with a final episode on May 11 at 8:30 p.m. ET/PT. Starring Morris Chestnut as the titular buddy of Sherlock, Watson follows the head of a medical clinic focused on rare disorders, Dr. John Watson, as he navigates new medical mysteries following the death of his best friend, Sherlock Holmes. The show was produced by CBS Studios and debuted in January 2025 on the network. After a solid inaugural run, the show was renewed for a second season in March of 2025. Showrunner Sweeny served as an executive producer along with Chestnut, Sallie Patrick, Teng, Shäron Moalem, Brian Morewitz and Aaron Kaplan. The latest season two episode, “Wrongful Life,” saw 3.1 million live plus same day viewers, per Nielsen figures. DMV starred Harriet Dyer, Tim Meadows and Tony Cavalero as underpaid East Hollywood DMV workers dealing with office and personal dramas while interfacing with customers who deeply dread dealings with their workplace. DMV ‘s March 16 episode “Test Drive” garnered 2.8 million viewers in its live airing. The CBS Studios-produced show landed a series order in April 2025 and a full-season pickup later that year. Klein served as the showrunner and executive produced alongside Matt Kuhn, Aaron Kaplan, Wendi Trilling, Robyn Meisinger and Trent O’Donnell. The cancellation news arrives after CBS announced a slew of renewals for its 2026-2027 season. In addition to Marshals and George & Mandy’s First Marriage , the network has renewed CIA, Tracker, Matlock, Elsbeth, Fire Country, NCIS, NCIS: Origins, NCIS Sydney, Boston Blue, Sheriff Country, FBI, Ghosts, Survivor and The Amazing Race . CBS has also greenlit two new series. The Silicon Valley drama Cupertino from The Good Wife creators Robert and Michelle King will see a lawyer (Mike Colter) take on Silicon Valley behemoths. The procedural Einstein from creator Andy Breckman will star Matthew Gray Gubler as the famed physicist’s “brilliant but directionless” grandson, who after a brush with the law is forced to team up with a detective on her cases. THR",0,2026-03-28 09:46:46
25,https://variety.com/2026/tv/news/watson-dmv-canceled-cbs-1236701835/,‘Watson’ and ‘DMV’ Canceled at CBS,Variety,2026-03-27T22:00:00,3730,"Mar 27, 2026 3:00pm PT ‘Watson’ and ‘DMV’ Canceled at CBS By Selome Hailu Plus Icon Selome Hailu Latest ‘Watson’ and ‘DMV’ Canceled at CBS 12 hours ago ‘Hannah Montana’ Anniversary Special Hits 6.3 Million Views in Three Days as Original Series Jumps 1,000% in Views 17 hours ago ‘The Madison’ Debuts With 8 Million Views in 10 Days on Paramount+, Biggest Taylor Sheridan Series Launch Ever 2 days ago See All CBS CBS has canceled “ Watson ” and “ DMV .” “Watson” premiered in January 2025 and will soon conclude its second season. The drama series stars Morris Chestnut as Dr. John Watson in a modern Sherlock Holmes story that sees Watson, per the official description, “turn his attention from solving crimes to solving medical mysteries. While Watson’s team of ‘doc-tectives’ may have defeated Moriarty (Randall Park) last season, they remain determined in Season 2 in their mission to investigate and treat the world’s most rare diseases for their clinic’s patients. With his eyes fixed on the future, Watson faces an unexpected twist when Sherlock Holmes (Robert Carlyle), who was presumed dead, resurfaces, forcing him to confront a buried secret from his past – one that lies hidden within his own body. Related Stories Russell T Davies Says New Show 'Tip Toe' Is a 'Reaction to Where Politics Is Heading': 'Queer Discourse' Has Become 'So Dangerous in a Way I Never Thought Would Happen Again' HBO Max Series ‘Proud,’ About a Gay Man Taking Care of a Baby, Could Spark Dialogue in Polarized Poland: ‘There Hasn’t Been a Show Like That Before’ (EXCLUSIVE) Craig Sweeny created “Watson” and executive produced alongside Chestnut, Larry Teng, Shäron Moalem, Aaron Kaplan and Brian Morewitz. Popular on Variety “DMV” is a workplace comedy set in the East Hollywood Department of Motor Vehicles that premiered in October 2025 and will soon conclude its first season. Per the official description, the series followed “Colette (Harriet Dyer), a driving examiner with a big heart and bad boundaries; Gregg (Tim Meadows), a misanthropic former English teacher; Vic (Tony Cavalero), a former bouncer who loves putting difficult drivers in their places; Barbara (Molly Kearney), a newly promoted manager who tries hard but often misses the mark; Noa (Alex Tarrant), a charming surfer who seems destined for much greater things; and Ceci (Gigi Zumbado), a scrappy photographer who isn’t afraid to speak her mind.” The single-camera comedy was created by Dana Klein, who serves as executive producer alongside Matt Kuhn, Aaron Kaplan, Wendi Trilling and Robyn Meisinger. ‘Harry Potter’ Series Is ‘A Lot of Pressure’ but It’s ‘Very Special,’ Says HBO Max Exec: ‘The World That Has Been Created Is Absolutely Extraordinary’ J.K. Rowling Says ‘I’m So Happy’ With HBO’s ‘Harry Potter’ Series Right After Celebrating the Olympics for Banning Trans Women From Female Events Daniel Radcliffe Got Pitched a ‘Wizard of Oz’ Remake With Emma Watson as Dorothy and Himself as a ‘Karate-Kicking Cowardly Lion’: ‘One of the Worst Ideas… It Should Not Be Made’ ‘Harry Potter’ First Look: The Wizarding World of Hogwarts Is Revealed ‘Harry Potter’ Series Will Take Viewers Inside Malfoy Manor, Says New Draco Actor: ‘You Get an Insight Into How He Is’ Paul Bettany ‘Hasn’t Heard Anything’ About Playing Voldemort in HBO’s ‘Harry Potter’ Series but Says He’s a ‘Big Fan’ of the Franchise Loading comments... More From Our Brands Rolling Stone Jack White Slams Trump’s Signature on U.S. Dollars Amid America’s Rising Cost of Living Robb Report Ryan Seacrest Spins His 40-Acre California Wine Country Estate Back on the Market Sportico Lachlan Murdoch Makes 92x Return on Royals Cricket Sale WWD Consumer Confidence Continues to Drop as Gas Prices Rise",0,2026-03-28 09:46:35
