id,url,title,source,publication_date,text_length,full_text,is_duplicate,created_at
8,https://deadline.com/2026/03/talamasca-the-secret-order-canceled-amc-1236768227/,‘Talamasca: The Secret Order’ Canceled At AMC,Deadline,2026-03-27T23:33:38,2627,"Skip to main content By Rosy Cordero Rosy Cordero Associate Editor, TV @SocialRosy More Stories By Rosy ‘Talamasca: The Secret Order’ Canceled At AMC ‘Poser’ Adds Trio Of Series Regulars; Barbara Hershey, Julio Macias, Adam Beach & Michael Trucco Among Recurring As Production Begins ‘Ms. Pat Show’ Renewed For Sixth Season As Show Moves To Paramount+ View All March 27, 2026 4:33pm Justin Kirk and Nicholas Denton AMC AMC is not moving forward with another season of its second Anne Rice series, Talamasca : The Secret Order , Deadline has confirmed. The freshman series focused on a secretive society called the Talamasca, composed of the men and women responsible for tracking and containing the witches, vampires, and other creatures scattered around the globe. Related Stories Cancellations and Renewals 2026 TV Cancellations Photo Gallery: Series Ending This Year & Beyond Cancellations and Renewals 2026 TV Series Renewals Photo Gallery Talamasca: The Secret Order was led by Nicholas Denton, and co-starred Elizabeth McGovern, William Fichtner, Maisie Richardson-Sellers, and Celine Buckens, with Jason Schwartzman serving as a guest star and Eric Bogosian and Justin Kirk reprising their roles from AMC’s Interview with the Vampire as crossover characters in the new series. “While we are not proceeding with another season of Talamasca: The Secret Order , we are proud of the series and grateful for the efforts of everyone involved. The Talamasca has a storied place within the Anne Rice Immortal Universe, and we expect to see at least some of these characters, and the organization itself, in future expressions of the franchise,” AMC said in a statement Friday afternoon. Watch on Deadline As Deadline recently announced, the third season of Interview with the Vampire, now called The Vampire Lestat , will premiere Sunday, June 7. In the upcoming rock and roll-centric season, the Vampire Lestat (Sam Reid) goes on an electric multi-city tour while being haunted by “muses” from his wild and rebellious past. As his band’s popularity and star power rise, so does Lestat’s influence over vampires and humans alike, leaving others to contend with Lestat’s power in the face of the Great Conversion, an unnatural surge in the vampire population. Variety was first to announce the cancellation. ‘Project Hail Mary’ Orbiting $46M+ Frame; ‘They Will Kill You’ At $5M-$6M CBS Cancels ‘DMV’ & ‘Watson’; What It Means For Network’s Comedy Pilots Pete Davidson To Play Mafia Killer & Paul Walter Hauser Is DEA Agent In ‘Tommy Karate’ Tiger Woods Arrested For DUI After Rollover Crash In Florida Read More About: 6 Comments",0,2026-03-28 09:46:16
20,https://variety.com/2026/tv/news/talamasca-the-secret-order-canceled-amc-anne-rice-1236701872/,‘Talamasca: The Secret Order’ Canceled After One Season at AMC (EXCLUSIVE),Variety,2026-03-27T23:00:00,4129,"Mar 27, 2026 4:00pm PT ‘Talamasca: The Secret Order’ Canceled After One Season at AMC (EXCLUSIVE) By Joe Otterson Plus Icon Joe Otterson TV Reporter joeotterson Latest ‘Talamasca: The Secret Order’ Canceled After One Season at AMC (EXCLUSIVE) 11 hours ago NBC Drama Pilot ‘Protection’ Casts Taylor Bloom 2 days ago Harry Treadaway Joins Amazon Cop Thriller Series ‘Bishop’ 2 days ago See All David Gennard/AMC “ Talamasca: The Secret Order ” has been canceled at AMC after just one season, Variety has learned exclusively. “While we are not proceeding with another season of ‘Talamasca: The Secret Order,’ we are proud of the series and grateful for the efforts of everyone involved,” an AMC spokesperson said in a statement to Variety . “The Talamasca has a storied place within the Anne Rice Immortal Universe, and we expect to see at least some of these characters, and the organization itself, in future expressions of the franchise.” Related Stories Debra OConnell Rises to Chairman of U.S. Entertainment TV for Disney as Creative Chief Dana Walden Unveils Her Executive Team Walt Disney Studios Promotes Erin Barrier to SVP of Communications This marks the first time AMC has canceled a show within what they have dubbed the Anne Rice Immortal Universe. The premium cabler originally acquired the rights to Rice’s works back in 2020. Since then, they have launched the shows “Interview with the Vampire” and “Mayfair Witches” in addition to “Talamasca.” Popular on Variety “Interview with the Vampire,” now called “The Vampire Lestat,” is returning for a third season on June 7, while “Mayfair Witches” will be back with its third season in early 2027. “Talamasca” aired its six-episode first season beginning in October 2025, with what is now the series finale airing in late November. Nicholas Denton led the cast, which also included Elizabeth McGovern, William Fichtner, Maisie Richardson-Sellers and Celine Buckens. Jason Schwartzman guest starred, with both Eric Bogosian and Justin Kirk reprising their roles from “Interview with the Vampire” in guest star roles. Per the official logline, the show followed Guy Anatole (Denton), who, “on the cusp of graduating law school, is approached by a representative of the Talamasca, a secretive agency that monitors and protects us from the supernatural world. When Guy learns that the Talamasca has been tracking him since his childhood, he falls headlong into a world of secret agents and immortal beings who, up to now, have maintained a fragile balance with the mortal world.” “Talamasca” was based on both “The Vampire Chronicles” and “The Lives of the Mayfair Witches.” John Lee Hancock developed the series and served as executive producer and co-showrunner alongside Mark Lafferty. Mark Johnson, who oversees the Immortal Universe for AMC, was also an executive producer, as was Tom Williams, Christopher Rice, and the late Anne Rice. Hancock was also a director on the series. Andrew Garfield Defends Watching ‘Harry Potter’ Movies Even if ‘It’s Controversial and We Shouldn’t Be Putting Money in the Pocket’ of ‘She That Shall Remain Nameless’ ‘Harry Potter’ Series Star Paapa Essiedu Says He’s Received Death Threats Over Snape Casting: ‘I’ve Been Told, “Quit or I’ll Murder You”’ J.K. Rowling Says ‘I’m So Happy’ With HBO’s ‘Harry Potter’ Series Right After Celebrating the Olympics for Banning Trans Women From Female Events Katie Leung ‘Would Not Want to Go Back’ to Her Time Shooting ‘Harry Potter’ Movies: ‘I Was So Easily Influenced’ Daniel Radcliffe Got Pitched a ‘Wizard of Oz’ Remake With Emma Watson as Dorothy and Himself as a ‘Karate-Kicking Cowardly Lion’: ‘One of the Worst Ideas… It Should Not Be Made’ UTA Signs ‘Lord of the Flies’ and HBO’s ‘Harry Potter’ Star Lox Pratt (EXCLUSIVE) Loading comments... More From Our Brands Rolling Stone Jack White Slams Trump’s Signature on U.S. Dollars Amid America’s Rising Cost of Living Robb Report Ryan Seacrest Spins His 40-Acre California Wine Country Estate Back on the Market Sportico Lachlan Murdoch Makes 92x Return on Royals Cricket Sale WWD Consumer Confidence Continues to Drop as Gas Prices Rise",0,2026-03-28 09:46:29
32,https://www.hollywoodreporter.com/movies/movie-news/james-tolkan-dead-back-to-the-future-top-gun-1236549260/,"James Tolkan, ‘Back to the Future’ and ‘Top Gun’ Actor, Dies at 94",Hollywood Reporter,2026-03-27T22:57:22,3496,"Skip to main content By Mike Barnes Plus Icon Mike Barnes Senior Editor mikebarnes4 Follow Sign Up View All March 27, 2026 3:57pm James Tolkan Barry Brecheisen/Getty Images James Tolkan, the character actor who expressed a disdain for “slackers” in the Back to the Future trilogy and portrayed Tom Cruise’s no-nonsense commanding officer in Top Gun , has died. He was 94. Tolkan died Thursday in Saranac Lake, New York, a family spokesperson announced. Tolkan also played Napoleon and his look-alike in Woody Allen’s Love and Death (1975) and was the crooked accountant known as Numbers who works for Big Boy Caprice (Al Pacino) in Warren Beatty’s Dick Tracy (1990). Related Stories Music Dash Crofts, Seals & Crofts Singer Behind ""Summer Breeze,"" Dies at 87 Music News Chip Taylor, ""Wild Thing"" and ""Angel of the Morning"" Songwriter, Dies at 86 He appeared in three movies directed by Sidney Lumet: as a cop in the Pacino-starring Serpico (1973), as a determined D.A. in Prince of the City (1981) and as a judge in Family Business (1989). On Broadway, Tolkan portrayed salesman Dave Moss in the original 1984-85 production of David Mamet’s Glengarry Glen Ross . (Ed Harris played the character in the 1992 movie adaptation.) Tolkan, whose specialty was playing intense, intimidating types, was steely as Hill Valley High School principal Mr. Strickland in Back to the Future (1985) and its 1989 sequel, then returned as Strickland’s grandfather in Back to the Future Part III (1990). Pretty much wherever he went, fans asked him to berate them as “slackers” just for fun. In Top Gun (1986), he was imposing yet again as Tom “Stinger” Jardian when he lights into Cruise’s Pete “Maverick” Mitchell for reckless behavior. James Tolkan addresses Tom Cruise (right) and Anthony Edwards in ‘Top Gun.’ Paramount Pictures/Photofest Tolkan’s big-screen résumé also included The Friends of Eddie Coyle (1973), The Amityville Horror (1979), Wolfen (1981), WarGames (1983), Masters of the Universe (1987), True Blood (1989) and Opportunity Knocks (1990). Born on June 20, 1931, in Calumet, Michigan, James Stewart Tolkan cycled through Chicago after his parents divorced and wound up in Tucson, Arizona, where he graduated from Amphitheater High School in 1949. After a stint in the U.S. Navy, he attended Coe College and the University of Iowa, came to New York with $75 in his pocket and studied with Stella Adler and Lee Strasberg at The Actors Studio, where Beatty was a classmate in 1956. He made his onscreen debut in 1960 on an episode of ABC’s Naked City , and in 1966 he understudied for Robert Duvall before replacing him as bad guy Harry Roat in the original Broadway production of Wait Until Dark , starring Lee Remick. ( Alan Arkin was cast as Roat in the 1967 film.) Later, Tolkan played insurance investigator Norman Keyes on five episodes of NBC’s Remington Steele and several characters over 21 installments of A&E’s A Nero Wolfe Mystery (he directed a couple of episodes as well). He also guest-starred on Miami Vice , The Fresh Prince of Bel-Air , The Wonder Years , Leverage and many other shows. Survivors include his wife, Parmelee, who worked at the American Place Theater as a costumes and scenery painter. They met on the set of the 1971 off-Broadway play Pinkville when he was acting in it and she was a prop girl, and they married that year in Lake Placid. Donations in his memory can be made to your local animal shelter, animal rescue organization or Humane Society chapter. THR",0,2026-03-28 09:46:42
9,https://deadline.com/2026/03/harry-potter-and-the-philosophers-stone-trailer-breaks-records-hbo-1236768196/,‘Harry Potter & The Philosopher’s Stone’ Trailer Becomes Most-Watched In HBO & HBO Max History,Deadline,2026-03-27T22:45:48,1551,"Skip to main content By Armando Tinoco Armando Tinoco Staff Writer @armietinoco More Stories By Armando James Marsden Says He “Missed” Hugh Jackman While Filming ‘Avengers: Doomsday’ Miley Cyrus Set For “Giving Us Lifetime Achievement Award” At ‘RuPaul’s Drag Race’ Season 18 Finale ‘Women In Blue’ Season 2 Gets Premiere Date At Apple TV As First Look Photo Is Unveiled View All March 27, 2026 3:45pm 'Harry Potter and the Philosopher's Stone' HBO HBO ‘s adaptation of the Harry Potter book series is already breaking records for the premium cable network and the streamer HBO Max . The trailer for Harry Potter and the Philosopher’s Stone got 277 million organic (non-paid) views across platforms in its first 48 hours, becoming the most-watched trailer in HBO and HBO Max history and exceeding the previous record by more than double. Related Stories News ‘Harry Potter And The Philosopher’s Stone’: See First-Look Photos From Upcoming HBO Series News ‘Harry Potter’ Series First Teaser & Title Revealed; Christmas 2026 Release Date At HBO Set The series based on JK Rowling’s fantasy book series is set to debut Christmas 2026 on HBO and stream on HBO Max. Harry Potter and the Philosopher’s Stone stars Dominic McLaughlin as Harry Potter, Arabella Stanton as Hermione Granger and Alastair Stout as Ron Weasley. Watch on Deadline The series also stars John Lithgow as Albus Dumbledore, Janet McTeer as Minerva McGonagall, Paapa Essiedu as Severus Snape, Nick Frost as Rubeus Hagrid, Rory Wilmot as Neville Longbottom and Lox Pratt as Draco Malfoy.",0,2026-03-28 09:46:17
33,https://www.hollywoodreporter.com/tv/tv-news/napa-valley-streamfest-bill-lawrence-awards-chatter-podcast-1236548900/,Napa Valley StreamFest: ‘Shrinking’ Showrunner Bill Lawrence Set for Live ‘Awards Chatter’ Podcast Taping,Hollywood Reporter,2026-03-27T22:37:21,2141,"× Skip to main content By Scott Feinberg Plus Icon Scott Feinberg Executive Editor of Awards ScottFeinberg Follow Sign Up View All March 27, 2026 3:37pm Bill Lawrence Courtesy of Zach Braff Bill Lawrence , the Emmy-winning TV creator who made his name with Spin City , Scrubs , Cougar Town and Ted Lasso , and who currently has three shows simultaneously on the air — Apple TV+’s Shrinking , HBO’s Rooster and ABC’s revival of Scrubs — is the latest special guest confirmed to attend this year’s Napa Valley StreamFest . At 6 p.m. on Saturday, April 25, Lawrence will sit down with yours truly in front of festival attendees at the Uptown Theatre in Downtown Napa for an hourlong career-retrospective conversation that will be recorded for subsequent airing on The Hollywood Reporter ’s Awards Chatter podcast. Related Stories TV 'Marshals' Was the Biggest Thing on TV for Its Premiere Week Movies Napa Valley StreamFest: Mariska Hargitay Set for Icon Award, Live 'Awards Chatter' Podcast Taping Immediately after that, two of the stars of Shrinking , Christa Miller and Ted McGinley , will be interviewed by SiriusXM host Julia Cunningham, who will then present them with the fest’s Vanguard Award in recognition of “their versatility and enduring impact across decades of television history.” Cunningham will also preside over the presentation of several additional honors including the Social Impact Award to Jonathan Scott ( Property Brothers ) and the Breakthrough Artist Award to actress Sarah Ramos ( The Napa Boys ), along with several other previously announced honorees. As was previously announced , the night before — Friday, April 24 — will be highlighted by a celebration of Law & Order: SVU star, My Mom Jayne director and social activist Mariska Hargitay . The festivities will kick off at 6 p.m. at the Uptown Theatre when Hargitay sits down with yours truly for an hourlong career-retrospective conversation that will be recorded for subsequent airing on THR ’s Awards Chatter podcast. Immediately afterwards, the fest will present her with its Icon Award. The second annual Napa Valley StreamFest will run April 23-26. THR",0,2026-03-28 09:46:44
34,https://www.hollywoodreporter.com/news/general-news/tiger-woods-dui-charges-arrested-suv-rollover-crash-1236549226/,Tiger Woods Faces DUI Charge After SUV Rollover Crash,Hollywood Reporter,2026-03-27T22:23:38,2957,"× Skip to main content By Kevin Dolak Plus Icon Kevin Dolak View All March 27, 2026 3:23pm Tiger Woods Ross Kinnaird/Getty Images Legendary golf pro Tiger Woods has been arrested in Florida following a two-car crash near his home on Jupiter Island on Friday, in which he rolled over his SUV, according to the local sheriff’s office. Woods’ medical status was not immediately clear on Friday afternoon. But Sheriff Alex Villanueva with the Martin County Sheriff’s Office said at a press conference that Woods seemed to be in good condition when he was brought into the jail. Shortly before 2 p.m., a truck pulling a small trailer on South Beach Road in Jupiter Island was turning into a driveway when the driver looked in his rearview mirror and saw Woods’ Land Rover overtaking him at “high speeds,” the sheriff told the press on Friday. Related Stories Movies Tiger Woods Biopic in the Works at Amazon MGM Studios News PGA Golf Tournament Won't Be Held at Riviera Country Club Because of L.A. Wildfires “He saw it coming, so he tried to edge off to the side of the road. But this is a small two-lane road, and there was no shoulder for this pressure-cleaner gentleman to get off the side of the road,” Sheriff Villanueva said. “He was trying to move to the side of the road. The Land Rover overtook him at the last minute, swerved to avoid a collision but clipped the back end of the trailer of the pressure-cleaner apparatus, then rolled on the driver’s door,” he said. Woods was able to crawl out of the passenger door of the vehicle, the sheriff said. When DUI investigators arrived, they administered a breathalyzer test, but the golf pro was not under the influence of alcohol at the time of the crash, as the test registered 0.0, according to police. Nevertheless, authorities at the scene determined that Woods was impaired at the time of the crash. He refused to submit to a urine test. Woods will be facing a DUI charge, as well as additional charges for property damage and refusal to submit to a lawful test, Sheriff Villanueva said. This is not Woods’ first rollover crash while potentially having been impaired. In 2021, Woods was involved in a serious rollover crash in Los Angeles. In that incident, he drove into a median in the early hours of Feb. 23, struck a curb, mowed down a sign and drove into opposing lanes; he then hit a tree and rolled over. Police who responded to the scene found an empty pharmaceutical bottle in the backseat of his vehicle. And in 2017, Woods was discovered asleep at the wheel in Florida and arrested for drunk driving. He had several medications in his system then, including Ambien, Vicodin and THC. Woods subsequently checked into a rehabilitation clinic that year to get help. He pleaded guilty to reckless driving. It’s unclear when Woods would be arraigned after the Friday crash. The Hollywood Reporter did not immediately hear back from Woods’ rep when contacted on Friday evening. More to come. THR",0,2026-03-28 09:46:45
