id,url,title,source,publication_date,text_length,full_text,is_duplicate,created_at
24,https://www.hollywoodreporter.com/tv/tv-news/where-to-watch-f1-canadian-grand-prix-2026-live-stream-free-1236602542/,F1 Canadian Grand Prix Livestream: Here’s When and Where to Watch the 2026 Race Online,Hollywood Reporter,2026-05-24T10:00:00,1769,"× Skip to main content By Rudie Obias Plus Icon Rudie Obias View All May 24, 2026 3:00am MONTREAL, QUEBEC - JUNE 15: George Russell of Great Britain driving the (63) Mercedes AMG Petronas F1 Team W16 leads the field at the race start during the F1 Grand Prix of Canada at Circuit Gilles-Villeneuve on June 15, 2025 in Montreal, Quebec. Mark Thompson/Getty Images If you purchase an independently reviewed product or service through a link on our website, The Hollywood Reporter may receive an affiliate commission. The Formula 1 returns with round five in the 2026 season. And this time, F1 travels to Canada for the Lenovo Canadian Grand Prix. The motorsports event takes place at Circuit Gilles-Villeneuve in Montreal, Quebec with race day on Sunday, May 24. Want to watch race day live online? The F1 Canadian Grand Prix livestreams on Apple TV . apple tv free trial At a Glance: How to Watch 2026 F1 Canadian Grand Prix Race Day Online When: Sunday, May 24, 1 p.m. PT/4 p.m. ET Stream online: Apple TV Meanwhile, since F1 is considered a luxury sport, there has been a number of celebrity sightings during racing events, especially the Canadian Grand Prix, such as Al Pacino, Michael Douglas, Winnie Harlow, French Montana, Halsey and others. Livestream on race day to see which celebrities are at the Paddock Club this year. Related Stories TV Roland-Garros 2026 Livestream: Here's Where to Watch the French Open Online TV UEFA Women's Champions League Final 2026: Where to Watch the Soccer Match Live Online Where to Watch F1 Canadian 2026 Live : Air Date and Time, Apple TV Free Trial The F1 Canadian Grand Prix Race Day airs live on Sunday, May 24, at 1 p.m. PT/4 p.m. ET, available to livestream on Apple TV . After a seven-day free trial , new subscribers can",0,2026-05-24 10:45:57
1,https://deadline.com/2026/05/img-premier-league-production-end-of-era-1236917732/,Era Ends For IMG Today As Premier League Takes Production In-House: “It Was Inevitable They Would Want It”,Deadline,2026-05-24T09:01:09,10951,"Skip to main content Dismiss News Banner Breaking News Cannes Award Winners, Palme D'Or Goes To 'Fjord' Read the full story By Jesse Whittock Jesse Whittock International TV Co-Editor @WhittockTweets More Stories By Jesse The All-American Rejects Launch Microdrama Series ‘SuperFan’ On CandyJar; Watch The Trailer ChaiFlicks Buys ‘Bloody Murray’ & Renews ‘Shtisel’ Ex-TikTok Exec Stuart Flint To Advise Caspar Lee & Ben Jeffries’ Influencer View All May 24, 2026 2:01am Arsenal's Kai Havertz of Arsenal celebrates after scoring a match-winning goal against Burnley in the Premier League Stuart MacFarlane/Arsenal FC via Getty Images When IMG’s Barney Francis and John Hollywood join Deadline for a virtual interview, they’ve just left a monthly ‘ Premier League Huddle’ – a get-together with their teams to celebrate good work and talk about upcoming plans. Only this one had added significance, being the final meet before IMG-owned Premier League Productions ‘ (PLP) 22-year run producing coverage of the English Premier League for broadcast licensees around the world comes to an end later today. “We had a kind of farewell as we part company,” says Francis, IMG’s Chief Business Officer. Francis said a few words to staff, as did current PLP CEO Nick Morgan. Graham Fry, IMG’s former Managing Director of Worldwide Sports Production, returned for a Q&A about how the partnership had started and evolved. Related Stories News Canada Shakes: Montreal Canadiens Fans Trigger Earthquakes Celebrating NHL Playoffs Win Over Buffalo News The BBC Is Drawing Up Plans To Use AI To Save Money, But Staff Are Skeptical “It was interesting to hear Graham talk about it and get an insight into how much has moved on, from training cameras on three live games a week and a couple of magazine shows,” says Hollywood. Today, Premier League games broadcast almost every day of the week and volume of shoulder content is incommensurate to the environment in 2004. Watch on Deadline Fry set foot back in the PLP building just a day after Arsenal, the hated north London rivals of his beloved Tottenham Hotspur, were confirmed as Premier League champions with just today’s final round of games to go. “It did dawn on me that it was 22 years since Arsenal won last won the Premier League, and it was 22 years since Premier League Productions started, so perhaps Graham created it in the hope of preventing Arsenal from finding a way to stop them winning the league,” quips Hollywood. ‘The inevitable question’ Both Francis and Hollywood cut jovial figures this week despite the financial hit of losing the EPL production contract. They could simply be putting on brave faces, but if that’s the case the mask doesn’t split at all during our interview. Surely the end of an era-defining production partnership is a disappointing moment? “The inevitable question,” says Francis, as he begins explaining how the split came about. “We went through a lot of conversations about what a future might look like. We’re ambitious. We never sit still, so had big plans for how we were going to change our methodologies, our operating model, etcetera. “It just so happened that the Premier League had a similar mindset, which is about improving and driving efficiency at the same time. We had a very fertile conversation, but it was inevitable that at some point they were going to want to own it.” From the 2026/27 Premier League season, the Premier League will begin producing coverage itself, taking advantage of the ever-growing popularity of a league boasting players such as Erling Haaland, Bakayo Saka and Bruno Fernandes, and globally-followed clubs such as Arsenal, Liverpool, Manchester City and Manchester United. IMG, which is part of Ari Emanuel’s TKO Group Holdings following a $3.25B deal that closed last year , and the Premier League will retain a working relationship on distribution and archive, but it will be the league itself creating the pictures for the likes of Sky, Prime Video, TNT Sports, Canal+, DAZN and JioHotstar. Newcastle stars Alan Shearer in a 2005 Premier League match Laurence Griffiths/Getty Images Francis, a former Sky Sports exec who has been at the center of the Premier League’s financial growth and popularity boom for many years, understands the Premier League’s decision, which brings the league even closer to the licensees, just as international revenues edged ahead of domestic. Recent estimates suggest each Premier League season delivers around £2B ($2.7B) overseas, versus about £1.7B in the UK. For the league, launching Premier League Studios comes with risk such as big capex costs, Francis notes, but he back the size of the operation to succeed. “Only an organization like the Premier League, NFL or NBA could comprehend taking on that risk,” he adds. The move was ratified after a vote involving the 20 Premier League clubs voted back in October. Premier League CEO Richard Masters said at the time it would allow the competition to have better control of the content and more “optionality” should it decide to launch a long-touted direct-to-consumer service in the future, as trade publication Sportcal reported at the time. Manchester City’s Sergio Aguero scores a late winning goal against Queens Park Rangers in 2012, winning the title in arguably the most dramatic fashion in Premier League history AFP PHOTO/PAUL ELLIS AFP PHOTO/PAUL ELLIS Evolution of sports broadcasting During PLP’s run, the Premier League’s explosion in popularity has been mirrored by technological advances. Having begun in a physical studio servicing a traditional linear channel, it morphed into a state-of-the-art virtual set in Stockley Park making everything from digital and social content, and more magazine pieces. Editing and craft suites have been replaced by the cloud, while all games are now shot in 4K and as many of 215 are produced each year. Hollywood says the Covid-19 pandemic was a revelatory moment for IMG, highlighting how its product had gone beyond being simply football matches. “It was fascinating that the content service kept going throughout that period,” he says. “You got a real insight into the importance of it to the nation and the rest of the globe. The fact that the extent that the police were prepared to wave people through into Stockley Park so they could deliver on the content service was a certificate of the importance of what we do.” At several points in the interview, Francis refers to a featurette involving the relationship of England star Jack Grealish and Finlay Fisher, an 11-year-old boy. Fisher had written Grealish, a loveable rogue character who’s own sister, like Fisher, has cerebral palsy. They became close friends and the world took notice when Grealish performed his now-famous ‘worm dance’ goal celebration after Fisher asked him to do it. “The piece PLP created has been seen 50 million times around the world,” says Francis. “It was a wonderful piece of non-live content, and you can see how if you’re a Premier League licensee that it enhances your live games.” Jack Grealish performing his ‘worm’ celebration during an England game Harry Langer/DeFodi Images via Getty Images Premier League Studios will have a tough task to replicate the innovation PLP has been responsible for, especially in terms of international licensees. Both Hollywood and Francis point to Turnstile, a content memory bank that provides immediate access to “everything you could ever need” – for example, the iconic footage of Sergio Aguero’s title-winning goal for Manchester City against Queens Park Rangers in 2012. This allows local broadcasters and streamers to build their own packages around national stars plying their trade in the Premier League, and for PLP to ensure new content was available at the start of every new season. Hollywood says the Premier League product evolved as a “symbiotic relationship” between the two partners, with both sides providing ideas content and production innovation. “It was about how we could keep adding value,” says Francis. Hollywood adds he believes his team pitched more ideas to the Premier League than any other IMG client. This all builds up a picture of a hard hit to the IMG production business, but Francis and Hollywood insist it was always expected and that the company has been future-proofing for years. “Barney always wanted this to be the best, most amicable divorce ever and I think it is at that point,” says Hollywood. “It is a chance to reimagine our business, pivot, look at our tech stack and our plan for staff. We’ve got the right technical solutions, and this has coincided with more clients phoning us, sensing IMG might have more bandwidth to go and support other initiatives. Frankly, we’re in rude health.” Indeed, IMG still has the production contracts for the English Football League, the Saudi Pro League and MLS. The latter presents a gift and a curse: Studies and report show unprecedented levels of fan growth and investment, but the U.S. still values its homegrown sports above all else. For IMG, that presents a business challenge. “We need to get to the college students who want to work in media, for whom soccer is their number one sport, and then train them to be the next football broadcast operators, because you want people that live and breathe it. We’re lucky in the UK that we have that.” Liverpool celebrating their 2024/25 Premier League title victory Liverpool FC/Liverpool FC via Getty Images Hollywood says there are “a couple of very big projects in different sports” that IMG plans to announce shortly, and notes that there is new “technical muscle available” than in the Premier League-dominated past. Francis reels off an impressive list of work taking place this weekend, including the Belgian Open golf, the EuroLeague Final Four basketball and, of course, the final ten Premier League matches. “We certainly feel like we’re at the forefront in our industry of the changes that are coming around,” he adds. It would be a tough task for any company to replenish the revenues inevitably dropped from losing such a large contract, but for IMG the immediate focus is the final round of Premier League productions and remembering what was. “They go with our blessing and we part with their blessing,” says Hollywood. “There’s a lot of work to do to uncouple the two organizations, and there will be there will be tension throughout, but John’s done an unbelievable job of managing that uncoupling,” adds Francis. “What we must make sure is that on the last match-day round that we all hug each other and say goodbye with smiles on our faces, because we should reflect on 22 great years.” Florence Pugh Starrer ‘Midnight Library’ Being Chased By Multiple Studios ‘Mandalorian And Grogu’ Eyeing $90 Million Four-Day Domestic Opening Ben Stiller & Mike Judge Teaming On ‘Protective Custody’ Comedy At Apple Oscar Outlook For Cannes Movies; Neon Extends Streak; Jury Presser; More Read More About: Comments",0,2026-05-24 10:45:32
2,https://deadline.com/2026/05/box-office-mandalorian-and-grogu-1236918713/,‘Star Wars: Mandalorian & Grogu’ Now Seizing $97M-$98M 4-Day Opening And ‘A-‘ CinemaScore; ‘Obsession’ Scares Up +26% – Memorial Day Box Office,Deadline,2026-05-24T07:54:00,9293,"Skip to main content Dismiss News Banner Breaking News Cannes Award Winners, Palme D'Or Goes To 'Fjord' Read the full story By Anthony D'Alessandro Anthony D'Alessandro Editorial Director/Box Office Editor @AwardsTony More Stories By Anthony ‘Star Wars: Mandalorian & Grogu’ Now Seizing $97M-$98M 4-Day Opening And ‘A-‘ CinemaScore; ‘Obsession’ Scares Up +26% – Memorial Day Box Office ‘Fjord’ Palme D’Or Winner Cristian Mungiu Encourages Dialogue In Divided World: “Don’t Rush To Judge The Other” Park Chan-Wook Led Cannes Jury On Director, Actor & Actress Category Ties: “We Couldn’t Decide…” View All May 24, 2026 12:54am 'Star Wars: The Mandalorian & Grogu' Disney SUNDAY 12:49 AM: Star Wars: The Mandalorian and Grogu after an estimated $25.5M Saturday is heading to a $97M-$98M 4-day. That Saturday is a tad higher than Solo: A Star Wars Story ‘s $24.6M. Know that $100M 4-day is still in play. Many rivals see it there, but Disney always has a better sense of their numbers, not to mention if they don’t see it, they won’t call it. We’re hearing from sources that international is around $69M, however that figure is unverified by Disney. That would bring the Jon Favreau directed movie to north of its $160M WW forecast, around $167M WW on the high-end. Floating higher are Focus Features’ Obsession with an estimated $8.35M Saturday on its way to a, wow, $27M 4-day. 3-day is $21.5M , +26%. Lionsgate’s Michael is also coming in higher with a 4-day of $26M+, after an estimated $7.75M Saturday. A Memorial Day weekend that’s well north of $209M? That’s nothing to complain about. Watch on Deadline SATURDAY AM: Those who’ve watched Lucasfilm/Disney’s Star Wars: The Mandalorian and Grogu are giving it an A- CinemaScore, the same grade as Solo: A Star Wars Story , with definite recommend on PostTrak that’s staying steady at 71%. All of this pegs out to $33M in previews and first Friday yesterday for what’s shaping up to be a $91M-$96M 4-day. Rivals are calling the Jon Favreau-directed movie at $100M over the 4-day holiday, but it ain’t there, until its there. In the old days (meaning pre-Covid), Disney would softball weekend forecasts, but the studio is pretty much on the mark post-Covid, not underestimating for bloated headlines sake. The three-day is between $81M-$82M . Diversity demos for Mandalorian and Grogu are 52% Caucasian, 24% Latino and Hispanic, 10% Black, 8% Asian American and 6% Native American/other. Of those ticket buyers going to watch the Baby Yoda movie, 68% of them are Disney+ subscribers, more than other any other streaming subscriber in the theater (Netflix subs are attending at 62%). Imax and PLFs are repping 48% of ticket sales so far with Imax accounting for 16% alone and 3D pulling in an 8% share. Mandalorian and Grogu is playing in West, Mountain, Midwest, and Western Canada where 47.4% of their gross is coming compared to a norm of 45.3% for all other titles in the marketplace. AMC Disney Springs in Orlando is the pic’s leading location with close to $133K. Kids under 12 gave it a 95% positive and a 54% must-see right away; good enough for the nag factor to parents, I’m told. By the way, while Star Wars fans might not be all in their glory about Mandalorian and Grogu with numbers here on par with Solo: A Star Wars Story , rival studios aren’t crapping on it. Who the hell doesn’t want a 4-day $90M-plus opening at the Memorial Day box office in the post-Covid era? Furiosa , these bounty hunters are not. As one talent rep told us heading into the weekend, “Sometimes, these movies make more in merchandise than the actual movie.” Star Wars is one of the top five toy sellers annually with over $1 billion in retail sales. Grogu toys, since the launch of the Disney+ series, count 13 million toys sold during their first two years of release. The 4-day holiday weekend for all movies is coming at $209M which is -37% off last year’s record of $330.1M. Inde Navarrette and Michael Johnston in ‘Obsession’ (2026) (Focus Features/Courtesy Everett Collection) Meanwhile, Focus Features and Blumhouse-Atomic Monster’s Obsession is looking to push the King of Pop out of second place with an amazing +16% hike in its 3-day for a near $20M second weekend and 4-day of $24.8M and 11-day cume of $55.1M . If those numbers stick, Obsession will be +18% ahead of Longlegs at the same point in time (ended its run at $74.3M stateside) but -17% behind Focus Features’ highest grossing horror pic of all-time, Nosferatu (which was juiced by a Christmas launch, finaling at $95.6M domestic). Definite recommend has increased to 74% from 70% last weekend. More women are showing up now at 51% versus 41% in the pic’s opening weekend, however guys like this battle of the sexes movie a little more, with a slightly higher definite recommend, 75% to 73% (still overall, awesome). Very strong across the board quads, which is a studio’s dream, with men over 25 at 27%, women under 25 at 26%, women over 25 at 25% and guys under 25 at 22%. The 18-34 bunch is massive at 75%. The 18-24 set has now outpaced the 25-34 set, 40% to 35%. Best grades are women under 25 at 91% followed by men over 25 at 90%. Is there an Obsession 2 ? Curry Barker mentioned on the press tour he’d be open to a TV series with a new wish every episode. Michael still has moves around the globe, where he’s nearing $800M ($788.8M by EOD Monday) with fifth frame take of $18.5M over 3-days (excellent -29% hold), and $23.6M over four days. The running domestic take by end the end of the holiday will stand at $317.8M . Weekend estimates: Mandalorian and Grogu (Dis) 4,300 theaters, Fri $33M 3-day $81M-$82M 4-day $91M-$94M /Wk 1 Obsession (Foc) 2,655 (+40) theaters, Fri $6M 3-day $19.9M (+16%) 4-day $24.8M , Total $55.1M /Wk 2 Michael (LG) 3,306 (-254) theaters, Fri $5M (-29%) 3-day $18.5M (-29%) 4-day $23.6M , Total $317.8M/ Wk 5 Devil Wears Prada 2 (20th) 3,300 (-530) theaters, Fri $3.2M 3-day $11.3M (-37%) 4-day $14.6M , Total $198.1M /Wk 4 Sheep Detectives (AMZ) 3,207 (-347) theaters, Fri $2.1M (-14%) 3-day $8M (-16%) 4 day $11M Total $45.5M/Wk 3 Passenger (Par) 2,534 theaters, Fri $3.5M 3-day $8.5M 4-day $10.2M /Wk 1 The $15M Walter Hamada produced horror pic has a B- CinemaScore, and alright 64% definite recommend from the PostTrak audience. By comparison, the previous 18Mhz production of Hamada’s, January’s Primate opened to $11.1M and finaled at $25.6M off a $21M production cost (pic all in globally earned $39M). Male leaning at 54% with 41% female. Biggest demo is 18-24 at 36% with the 18-34 demo showing up at 69%. Latino and Hispanic moviegoers are tied in attendance with Caucasians at 31% apiece followed by 22% Black and 10% Asian American. No PLFs here. Pic’s best areas are West, South Central, South, and East where close to 80% of the gross is coming from vs a norm of 75.4% for all other titles in the marketplace. AMC Burbank in California is the pic’s top grossing theater with $12K through Friday. The opening is where tracking pretty much spotted it, and heck, this horror pic can be grateful for that in an Obsession obsessed holiday frame. Mortal Kombat II (NL) 2,726 (-808) theaters Fri $1.45M (-69%) 3-day $5.5M (-59%) 4-day $7.1M Total $73.6M /Wk 3 I Love Boosters (Neon) 1,750 theaters, Fri $1.5M 3-day $3.9M 4-day $4.6M /Wk 1 CinemaScore audiences give the Boots Riley movie a B. The 4-day here is similar to the wide break of Riely’s Sorry to Bother You in its second frame of $4.2M. That summer 2018 arthouse pic topped out at $17.4M stateside. Mostly female here at 56% with Caucasians at 36%, Black moviegoers at 34%, Latino and Hispanic at 17%, and Asian American at 8%. Boosters is playing best on the coasts where 56% of the gross is coming from versus 43% of the other titles. The Grand Lake cinema in Oakland, CA is the pic’s top grossing locale with close to $30K. Super Mario Galaxy Movie (Uni) 2,005 (-788) theaters Fri $700K (-34%), 3-day $2.6M (-42%) 4-day $3.3M Total $423.8M /Wk 8 Project Hail Mary (Amz) 1,321 (-856) theaters Fri $617K (-44%) 3-day $2.4M (-41%) 4-day $3M , Total $339.9M /Wk 10 ‘I Love Boosters’ Neon/Everett Collection FRIDAY AFTERNOON: Lucasfilm/Disney’s Star Wars: The Mandalorian and Grogu is on a journey similar to the 2018 Memorial Day pic Solo: A Star Wars Story . Friday and previews is looking like $34M for the Jon Favreau-directed feature ( Solo did $35.3M), which will translate to about $80M 3-day and $90M over four days at 4,300 theaters. Some rivals believe the Pedro Pascal movie has a shot at $100M, but don’t count your Jawas yet. Solo, as we told you, opened to $84.4M 3-day, $103M 4-day. The audience score on Rotten Tomatoes remains fixed at 88%. Related Stories Reviews ‘The Mandalorian And Grogu’ Review: Latest In ‘Star Wars’ Franchise Makes Magic Of ‘A New Hope’ Seem Far, Far Away News How To Watch The Star Wars Movies & TV Shows In Chronological Order Again, the difference between this Memorial Day and last year’s is that we don’t have two tentpole openers like a year ago WITH Lilo & Stitch (record holiday start of $182.6M) and Mission: Impossible – The Final Reckoning ($79M). Lilo & Stitch was the anomaly, and without it, well Mandalorian and Grogu is like an above-average opening for a major studio release over the holiday; not unlike Final Reckoning.",0,2026-05-24 10:45:33
