id,url,title,source,publication_date,text_length,full_text,is_duplicate,created_at
14,https://variety.com/2026/film/markets-festivals/uk-nigeria-hong-kong-romantic-comedy-my-nigerian-fiance-1236757601/,U.K.-Nigeria-Hong Kong Romantic Comedy ‘My Nigerian Fiance’ in the Works (EXCLUSIVE),Variety,2026-05-23T10:28:31,3300,"May 23, 2026 3:28am PT U.K.-Nigeria-Hong Kong Romantic Comedy ‘My Nigerian Fiance’ in the Works (EXCLUSIVE) By Naman Ramachandran Plus Icon Naman Ramachandran Latest ‘Sholay’ Actor Mac Mohan Gets Documentary ‘Discovering Sambha’ (EXCLUSIVE) 14 minutes ago Masculinity Satire Australian Animated Series ‘Finally, a Show About Men!’ Bows on YouTube (EXCLUSIVE) 39 minutes ago Inside ‘Sh(AI)ved,’ the AI-Created Vintage Adult Film Collection Unveiled at Cannes: ‘Splendid, Volcanic Orgasms’ 17 hours ago See All A13 Films A romantic comedy spanning Nigeria, the U.K. and Hong Kong was unveiled at the Cannes Film Market , with A13 Films founder Chidozie Christian Ahaiwe and U.K.-based Hong Kong creative Hiu Man Chan attached as executive producers on “My Nigerian Fiancé.” The project follows a successful London-based Nigerian man who enlists an Asian dancer to pose as his fiancé at a family anniversary celebration in Lagos. When the arrangement gives way to genuine feeling, both characters are forced to confront family pressure, ambition and identity. The film will draw on Nigerian music and fashion throughout. Related Stories Mel Gibson Unveils 'Resurrection of the Christ' First Look, Delays Release Dates for Two-Part Biblical Epic “This is a rare opportunity to take a global relatable romantic comedy and reinterpret it through the richness, humor, complexity, and emotional energy of both Nigerian and British culture,” Ahaiwe tells Variety . “The themes of love, identity, family pressure, migration, and cultural collision are deeply universal, but we also believe there’s something fresh, commercially exciting, and globally relevant about telling this story from both a Nigerian and U.K. perspective.” Popular on Variety Chan is also executive-producing a U.K. remake of the Hong Kong romance “My Indian Boyfriend: The Golden Mile” – a project that provided the creative impetus for “My Nigerian Fiancé,” though the two films tell different stories. “Nigeria has a rising market and the U.K.’s screen industry has been trying to tap into new opportunities arise, us included,” Chan tells Variety . “It seems like my latest portfolio could potentially become a romantic trilogy, after the ‘Boyfriend,’ now the ‘Fiancé,’ and the third one will certainly be called ‘My Husband,’ with a description to be decided in due course. Cinema in my opinion, is still the best space to explore love. We need to do all we can to preserve this magical space for the young generations to come.” The collaboration took shape during conversations at the Hong Kong Pavilion at the Cannes Film Market and later at Hong Kong cinema night. A13 Films is also developing “G-Boyz,” an investigative documentary thriller developed alongside producer Matthew Torne that examines Nigeria’s internet fraud economy. “My Nigerian Fiancé” is now in development, with casting expected later this year. Loading comments... More From Our Brands Rolling Stone Live Nation Settles With Estates of 2 Women Killed by Gunman at Beyond Wonderland Festival Robb Report MLB Hall of Famer Ken Griffey Jr. Listed His Lakefront Mansion in Orlando for $27 Million Sportico Club Sportico: What the Boss Taught Me About World Cup Tickets WWD The High School of Fashion Industries Celebrates 100th Student Fashion Show and Fundraiser",0,2026-05-23 10:40:22
15,https://variety.com/2026/film/markets-festivals/sholay-actor-mac-mohan-documentary-discovering-sambha-1236757594/,‘Sholay’ Actor Mac Mohan Gets Documentary ‘Discovering Sambha’ (EXCLUSIVE),Variety,2026-05-23T10:14:52,5518,"May 23, 2026 3:14am PT ‘Sholay’ Actor Mac Mohan Gets Documentary ‘Discovering Sambha’ (EXCLUSIVE) By Naman Ramachandran Plus Icon Naman Ramachandran Latest Masculinity Satire Australian Animated Series ‘Finally, a Show About Men!’ Bows on YouTube (EXCLUSIVE) 25 minutes ago Inside ‘Sh(AI)ved,’ the AI-Created Vintage Adult Film Collection Unveiled at Cannes: ‘Splendid, Volcanic Orgasms’ 17 hours ago Estonia Plans to Triple Its Film Industry as Two New Sound Stages Take Shape 21 hours ago See All Sippy Films/Jonathan Lennard/Charles Murphy/Mac Mohan Family Archive Emmy-nominated filmmaker Manjari Makijany (“Spin,” “Skater Girl”) will direct “ Discovering Sambha ,” a feature documentary on her father, Indian character actor Mac Mohan , with sister Vinati Makijany producing. The project is structured as an official India-Australia co-production, with production set to begin later this year and a release targeted for 2027. The project was unveiled at the Cannes Film Festival . Related Stories Mel Gibson Unveils 'Resurrection of the Christ' First Look, Delays Release Dates for Two-Part Biblical Epic Mac Mohan built a career spanning more than 50 years and over 280 films, among them “Don,” “Shaan,” “Karz,” “Zanjeer,” “Satte Pe Satta,” “Trishul,” “Khoon Pasina,” “Rafoo Chakkar” and “Khuddar.” He earned lasting cultural recognition as Sambha, the laconic henchman in Ramesh Sippy’s 1975 blockbuster “Sholay,” a role that has kept his name a household word across generations. Popular on Variety “Discovering Sambha” will draw on archival material, family recollections and reflections from colleagues, exploring themes of identity, legacy and the relationship between cinema and personal memory. Shivendra Singh Dungarpur, founder and director of the Film Heritage Foundation, which restored “Sholay” recently , has joined as an advisor. “Mac Mohan has a fan following of his own as much as the heroes of his day. No matter how big or small the role, he left an indelible mark on the hearts and minds of the people who continue to watch these films even today and remember him and the roles he played with great fondness,” Dungarpur said. Manjari Makijany leads Asia Pacific Pictures alongside producer Emmanuel Pappas (“Maya”), a banner focused on film, documentary and television projects across Australia, India and the wider Asia Pacific region. Vinati Makijany (“The Theory of Spice”) runs Mac Productions, the company originally established by Mac Mohan. “For much of the world, my father was Sambha. There’s so much to him that I’m still discovering through people that knew him before me. This may be the most cathartic process of filmmaking for me. As a daughter, I’m piecing together memories, absences, and emotions with my sister that shaped our lives and influenced my own filmmaking journey. This film is an intimate story about rediscovering the man I miss the most, my father,” director Manjari Makijany said. “Our father belonged to audiences long before he belonged to us. Through this documentary we hope to create something emotionally honest and universally relatable – not only for people who grew up with ‘Sholay,’ but for anyone who has ever tried to understand a parent, preserve a legacy, or reconnect with family history through memory and storytelling,” producer Vinati Makijany added. Bollywood actor Raveena Tandon, Mac Mohan’s niece, said: “Mohan mama carried so much grace and humility. His presence filled every room with laughter and stories. Though he played the quintessential baddie on screen, he was a golden-hearted señor and one of the warmest people you could know in real life. I’m proud of what Manjari and Vinati are doing. They are not just preserving the legacy of an actor, but the spirit of the man we all knew behind the screen. This documentary will allow audiences to discover a side of him that was personal, emotional, and beautifully human.” “There is something deeply moving about children rediscovering their father not only as a parent, but as a cultural memory shared by millions,” Pappas added. Shehzad Sippy of Sippy Films, whose family produced “Sholay,” said: “The characters and world of ‘Sholay’ continue to resonate across generations and geographies. Sambha remains one of the most recognizable characters in Indian cinema, and Mac Mohan brought a unique screen presence that audiences never forgot. We are pleased to see his story being revisited through the perspective of his daughters in a way that is intimate, respectful, and emotionally meaningful.” Bob Iger, After Stepping Down as Disney CEO, Tapped as Adviser to Josh Kushner’s Thrive Capital Disney’s ‘Toast to TV’ Emmy FYC Kickoff, Hosted by Dana Walden, Celebrates With A-List Stars, Producers Dwayne Johnson Says ‘Real Masculinity’ Means Supporting Warrior Women as ‘Moana’ Surfs to CinemaCon Disney+ Will Become ‘Immersive, Interactive Digital Centerpiece’ of the Company, CEO Josh D’Amaro Says LISTEN: Did OpenAI Kill What Disney’s ‘Super App’ Needs Most? ‘Wizards Beyond Waverly Place’ Brings Back Jennifer Stone as Harper Finkle for Final Season (EXCLUSIVE) Loading comments... More From Our Brands Rolling Stone Live Nation Settles With Estates of 2 Women Killed by Gunman at Beyond Wonderland Festival Robb Report MLB Hall of Famer Ken Griffey Jr. Listed His Lakefront Mansion in Orlando for $27 Million Sportico Club Sportico: What the Boss Taught Me About World Cup Tickets WWD The High School of Fashion Industries Celebrates 100th Student Fashion Show and Fundraiser",0,2026-05-23 10:40:23
16,https://variety.com/2026/tv/news/masculinity-satire-australian-animated-series-finally-a-show-about-men-youtube-1236757586/,"Masculinity Satire Australian Animated Series ‘Finally, a Show About Men!’ Bows on YouTube (EXCLUSIVE)",Variety,2026-05-23T09:50:11,3757,"May 23, 2026 2:50am PT Masculinity Satire Australian Animated Series ‘Finally, a Show About Men!’ Bows on YouTube (EXCLUSIVE) By Naman Ramachandran Plus Icon Naman Ramachandran Latest ‘Sholay’ Actor Mac Mohan Gets Documentary ‘Discovering Sambha’ (EXCLUSIVE) 6 minutes ago Masculinity Satire Australian Animated Series ‘Finally, a Show About Men!’ Bows on YouTube (EXCLUSIVE) 30 minutes ago Inside ‘Sh(AI)ved,’ the AI-Created Vintage Adult Film Collection Unveiled at Cannes: ‘Splendid, Volcanic Orgasms’ 17 hours ago See All Sad Man Studio “Finally, a Show About Men!,” an Australian short-form animated sketch comedy satirizing modern masculinity, premieres Sunday on Aunty Donna’s Grouse House YouTube channel from Gold Coast’s Sad Man Studio. The series is produced by husbands Samuel Leighton-Dore, who also serves as writer, and Bradley Tennant, with backing from Screen Queensland’s Online Production Grants. The pair co-direct the studio. Related Stories Mel Gibson Unveils 'Resurrection of the Christ' First Look, Delays Release Dates for Two-Part Biblical Epic “With ‘Finally, a Show About Men!,’ we wanted to create something emotionally honest, globally recognizable, and genuinely funny while exploring masculinity as both deeply human and slightly absurd,” Leighton-Dore said. “The series comes from a fascination with the contradictions of modern manhood – how performative, vulnerable, lonely, and theatrical it can be all at once. Animation gave us a way to approach those ideas through satire, surrealism, and heightened worlds that still feel emotionally truthful.” Popular on Variety The debut episode, “A Scrum Is A Safe Space,” is rugby-themed. Leighton-Dore and Tennant previously produced animated short film “Sensitive Gym Bros” and co-created animated sitcom “Willy,” now in development at Ludo Studio – the production company behind “Bluey” – and slated for a graphic novel release through Penguin Random House. “Screen Queensland is proud to support ‘Finally, a Show About Men!’ through our Online Production Grants, which champion emerging talent across the state,” said Julie Eckersley, executive director, Screen Content at Screen Queensland. “This bold animated series shows how online platforms are opening up space for voices to experiment with personal themes and connect meaningfully with audiences. We congratulate Sad Man Studio and the entire team on their commitment to unique storytelling and their exploration of big emotions.” Leighton-Dore added: “As the show explores, being a man is complex, serious, and often misunderstood – but occasionally, against all odds, a little bit sweet and funny. We’re excited for not all men to love what we’ve made.” Disney Revenue Rises 7% in Earnings Beat, Disney+ and Hulu Streaming Income Pops 88% to $582 Million LISTEN: Upfronts 2026: Disney’s Rita Ferro Details the Mouse House’s Cross-Platform Push, Embracing Live and Connecting Grammys, Super Bowl and Oscars for Big Brands OpenAI Will Shut Down Sora Video App; Disney Drops Plans for $1 Billion Investment Toddler Techno Creator Lenny Pearce Signs Disney Music and Content Development Deal Disney Seeks $10 Million for Super Bowl Commercials, but Advertisers Push Back (EXCLUSIVE) Disney Store Announces ‘May the 4th Be With You’ Star Wars Collection, Sets Weekly Countdown Collections Starting in April Loading comments... More From Our Brands Rolling Stone Live Nation Settles With Estates of 2 Women Killed by Gunman at Beyond Wonderland Festival Robb Report MLB Hall of Famer Ken Griffey Jr. Listed His Lakefront Mansion in Orlando for $27 Million Sportico Club Sportico: What the Boss Taught Me About World Cup Tickets WWD The High School of Fashion Industries Celebrates 100th Student Fashion Show and Fundraiser",0,2026-05-23 10:40:24
17,https://variety.com/2026/film/global/international-filmmakers-at-risk-egyptian-omar-salah-marei-1236757571/,International Coalition for Filmmakers at Risk Calls For Release of Egyptian Filmmaker Omar Salah Marei Jailed on Charges of ‘Spreading False News’,Variety,2026-05-23T09:48:41,4771,"May 23, 2026 2:48am PT International Coalition for Filmmakers at Risk Calls For Release of Egyptian Filmmaker Omar Salah Marei Jailed on Charges of ‘Spreading False News’ Omar Salah Marei was arrested on May 11 in his Cairo apartment without a warrant By Nick Vivarelli Plus Icon Nick Vivarelli International Correspondent @NickVivarelli Latest International Coalition for Filmmakers at Risk Calls For Release of Egyptian Filmmaker Omar Salah Marei Jailed on Charges of ‘Spreading False News’ 32 minutes ago Italian Global Series Festival in Cannes Launches Second Edition, Aiming to Boost Italy’s Status in the International TV Landscape 21 hours ago Saudi Powerhouse MBC Studios Unveils Slate Toplined By High-End Horror Movie ‘Traveller’s Hell’ 24 hours ago See All Courtesy ICFR The International Coalition for Filmmakers at Risk is calling for the “immediate and unconditional” release of Egyptian director and screenwriter Omar Salah Marei who is being held behind bars in Cairo reportedly on trumped up charges of “deliberately spreading false news,” based on posts on his social media accounts. Omar Salah Marei, 35 – who is known in Egypt ‘s film community for several shorts that blend humor with sharp social and political commentary – was arrested on the evening of May 11 in his Cairo appartment where, according to ICFR, plainclothes security officers “broke down the door, seized four laptops, two phones, cash, and scripts for future projects, and took Omar to an undisclosed location,” without a warrant. Related Stories Mel Gibson Unveils 'Resurrection of the Christ' First Look, Delays Release Dates for Two-Part Biblical Epic “For six days, no authority acknowledged holding him, and he had no contact with his family or his lawyer,” ICFR said in a statement. Popular on Variety Salah Marei then resurfaced on May 16 before Egypt’s Supreme State Security Prosecution, which is “the most serious prosecutorial track in the country,” according to ICFR. His lawyer, who is prominent human rights attorney Khaled Ali, confirmed to ICFR that Salah Marei has now been submitted by Egypt’s authorities to 15 days of pretrial detention, pending investigation. The charge: “deliberately spreading false news, based on posts on his social media accounts,” ICFR said. The next judicial hearing, to be held on May 25, will determine whether Omar Salah Marei’s pretrial incarceration is extended. Egyptian authorities could not immediately be reached for comment. ICFR in its statement underlined that Salah Marei has a medical condition that adds a layer of urgency to this case. “Omar has a thyroid disorder requiring daily medication that must not be interrupted. Three months before his arrest, he underwent surgery on his wrist — nine screws, two metal plates — and was still in active recovery and physiotherapy when he was taken,” it noted. “We have no reason to believe that he has received any medical care during the nine days he has now been in custody. The Law and Democracy Support Foundation has stated that denying him access to medication and care during his disappearance may already constitute ill-treatment under international law,” the statement added. “Omar is not a dissident in any conventional political sense,” the statement continued. “He is a filmmaker who came to cinema from engineering through his own initiative, and who uses comedy as a vehicle for social commentary.” The ICFR – which was founded by the International Documentary Film Festival Amsterdam, International Film Festival Rotterdam and the European Film Academy, to advocate for, and to act in solidarity with filmmakers at severe and acute risk – has vowed to continue to follow this case closely and report on further developments. Disney Revenue Rises 7% in Earnings Beat, Disney+ and Hulu Streaming Income Pops 88% to $582 Million Super Bowl Soap Opera: Disney Sells Some Commercials for $9 Million, But Still Faces Resistance From Large Ad Buyers (EXCLUSIVE) Disney Promotes April Carretta to EVP of Communications, Exec to Lead PR for Dana Walden Disney Cruise Ship Staffers Among Dozens Arrested in Child Porn Investigation Sam Altman Felt ‘Terrible’ Telling Disney CEO Josh D’Amaro About OpenAI’s Decision to Kill Off Sora, Says Companies Still Looking to Collaborate Super Bowl LXI Will Have Two Different Spanish Telecasts Across ESPN, Univision Loading comments... More From Our Brands Rolling Stone Live Nation Settles With Estates of 2 Women Killed by Gunman at Beyond Wonderland Festival Robb Report MLB Hall of Famer Ken Griffey Jr. Listed His Lakefront Mansion in Orlando for $27 Million Sportico Club Sportico: What the Boss Taught Me About World Cup Tickets WWD The High School of Fashion Industries Celebrates 100th Student Fashion Show and Fundraiser",0,2026-05-23 10:40:25
