id,url,title,source,publication_date,text_length,full_text,is_duplicate,created_at
14,https://variety.com/2026/film/festivals/cannes-acid-summer-drift-morethan-films-1236740267/,Cannes ACID Title ‘Summer Drift’ Lands at MoreThan Films for Sales (EXCLUSIVE),Variety,2026-05-07T11:08:37,3439,"May 7, 2026 4:08am PT Cannes ACID Title ‘Summer Drift’ Lands at MoreThan Films for Sales (EXCLUSIVE) By Naman Ramachandran Plus Icon Naman Ramachandran Latest Adil Hussain, Neha Dhupia’s Lionel Messi Fan Drama ’52 Blue’ to Open London Indian Film Festival (EXCLUSIVE) 4 hours ago Amazon MX Player Integrates Into Prime Video in India 4 hours ago ‘Squid Game’ Star Lee Byung-hun Boards Martial Arts Film ‘Nambeol’ 1 day ago See All CAVALE FILMS / ALTER EGO PRODUCTION MoreThan Films has boarded international sales on “ Summer Drift ” (“Virages”), the debut feature from Swiss co-directors Céline Carridroit and Aline Suter, ahead of its world premiere in the ACID sidebar at the Cannes Film Festival later this month. The Switzerland-France co-production is set during a Geneva summer and follows Johanna, a woman employed on the production floor of a luxury watch factory who, rather than parting with her aging VW Beetle, decides to restore it – forcing her back into the world of mechanics that had once turned her away. The film, which weaves through questions of labor and gender identity, operates as a hybrid between documentary and fiction. Related Stories 'Daredevil' Boss on Matt's Finale Reveal, the Defenders Reunion in Season 3 and When 'Punisher: One Last Kill' Takes Place 'Daredevil' Star Reveals [SPOILER]'s Shocking Death Was Changed After Filming: 'They CGI'ed Me Shooting Him in the Head' Cavale Films – the Geneva-based collective co-founded by the directors and producer Aurélien Marsais – produced the film alongside Cécile Lestrade. Carridroit and Suter also share screenplay credits. Popular on Variety “At MoreThan Films we are interested in films that push narrative boundaries and ‘Virages’ is a great example of how personal stories, such as Johanna’s, can translate to films that speak to a wider audience,” said Queralt Pons Serra, co-founder of MoreThan Films. “The directors worked together with the protagonist, with a lot of care and respect, to make sure that the film was true to her story, with a device that allowed Johanna to recreate parts of her life but also reinvent the way she was experiencing the world.” “Céline and Aline create a lighthearted luminous film that deals with complicated topics through the humorous and careless savoir-vivre of its protagonist,” added Lidia Damatto, the company’s other co-founder. “We’re sure this ‘Summer Drift’ will be a hit with festivals in the next few months.” ACID – France’s association of filmmakers dedicated to championing independent cinema’s path to theatrical release – selected nine titles for its 2026 Cannes program, six of them debut features. The section has historically served as a launchpad for emerging filmmakers, with past alumni including Justine Triet and Radu Jude. MoreThan Films, co-founded by Pons Serra and Damatto, operates between Barcelona and São Paulo, with a slate spanning documentary, fiction and experimental work by both emerging and established directors. Ranbir Kapoor Unveiled as Lord Rama in Trailer for Nitesh Tiwari’s Epic ‘Ramayana’ Hans Zimmer’s Bleeding Fingers Music Expands to London, Sets U.K. Leadership Loading comments... More From Our Brands Rolling Stone Chris Stapleton Covers Willie Nelson’s Pro-Immigrant Song ‘Living in the Promiseland’ on ‘Colbert’ Robb Report BMW’s ‘Neue Klasse’ iX3 Can Travel 434 Miles on a Single Charge Sportico Inter Miami Takes Equity Stake in Beckham-Founded IM8 Parent",0,2026-05-07 11:13:06
1,https://deadline.com/2026/05/sixteen-films-ken-loach-catalog-goodfellas-pacte-curzon-1236879633/,Sixteen Films Entrusts Ken Loach Classics To Trio Of Longtime Partners In Landmark Deals,Deadline,2026-05-07T11:03:09,4499,"Skip to main content By Melanie Goodfellow Melanie Goodfellow Senior International Film Correspondent @mel_goodfellow More Stories By Melanie Helen Mirren To Be Honored With Lifetime Achievement Award At Italy’s Taormina Film Festival Gary Lineker & Jorge Valdano-Narrated Cannes Doc ‘The Match’ About Argentina-England “Hand Of God” Game Sets Sales With Round 12 Former Berlinale World Cinema Fund Head Vincenzo Bugno To Be Honored In Cannes View All May 7, 2026 4:03am Ken Loach; 'Land and Freedom' Getty/Gramercy Pictures EXCLUSIVE: Ken Loach and Rebecca O’Brien’s Sixteen Films has sealed a trio of deals for a selection of the director’s back catalog titles as a first major step toward gathering his filmography under one umbrella. The London-based company has appointed France’s Goodfellas as worldwide sales agent for the titles, at the same time as entrusting their future distribution to Le Pacte in France, and Curzon in the UK and Ireland. The titles include Loach’s 2006 Palme d’Or winner The Wind That Shakes the Barley as well as Cannes contenders Land and Freedom (1995), My Name is Joe (1998), Bread & Roses (2000) and Sweet Sixteen (2002); Venice-selected work The Navigators (2001) and Ae Fond Kiss which premiered in Berlin in 2004. Related Stories News Gary Lineker & Jorge Valdano-Narrated Cannes Doc 'The Match' About Argentina-England ""Hand Of God"" Game Sets Sales With Round 12 News Former Berlinale World Cinema Fund Head Vincenzo Bugno To Be Honored In Cannes The announcement of the deals coincides with news that Loach will travel to Cannes this year for a screening of a 4K version of Spanish Civil War drama Land and Freedom in the festival’s Cinéma de Plage strand, the lineup for which was unveiled today . Watch on Deadline With time, a number of the films will be made available with new 4K remasters as part of a longer-term commitment to preserving and extending the reach of Loach’s work, with further titles due to be added to the list in the coming months “We’re really thrilled to be announcing this acquisition. It’s been a long-held desire of ours to bring the Ken Loach catalogue under one umbrella as an extraordinary legacy collection and this is a major leap forward in that direction,” said O’Brien. “Goodfellas, along with Le Pacte, have been very trusted partners for many years and it’s fantastic that they have joined with us on this project. In the UK Curzon feel like natural partners for us in this endeavour in the UK and we’re delighted they are coming on board after their slew of strong retrospectives.” O’Brien and Loach set up Sixteen Films in 2002 to oversee the production of the director’s films. They first started working with the Goodfellas team under their previous banner of Wild Bunch on the 2009 drama Looking For Eric. When company co-founders Vincent Maraval and Brahim Chioua branched off to set up their new company Goodfellas in 2023, Loach and O’Brien followed. “We are delighted to continue and deepen our relationship with Sixteen Films. They are our historical and privileged long-time partners and working on part of their library has been a long-awaited desire for our team,” said Goodfellas CEO Maraval. “Besides selling new projects, working on libraries and extending life of cinema classics is a work of passion for us. We will soon announce special events to help distributors to re-release Ken masterpieces.” Le Pacte co-founder and President Jean Labadie also highlighted his company’s long-standing relationship with Sixteen Films. “We have had the honour to distribute all Ken Loach movies since The Angels’ Share. Being in charge of these marvellous seven movies is fantastic for all our team,” he said. Curzon Head of Business Affairs Ulysse Kelbert said the acquisition of the titles for the UK chimed with a key pole of its activities. “Presenting the work of the great directors through fresh retrospectives and new home entertainment editions is a key tenet of our business, and we can’t wait to give these films the careful attention they deserve,” he said. “It is an honour to work with Ken, Rebecca and the teams at Sixteen Films and Goodfellas to bring these modern classics into the Curzon catalogue.” ‘Saturday Night Live UK’ Renewed For Season 2 At Sky Adrien Brody’s First Post Oscar Role Is Rachel Zegler, Ben Platt Drama Service Unifies With Amazon MX Player; ‘Matka King’ Renewed For S2 Fox Orders ‘Highway To Heaven’ Reboot From Katims, Amblin & Landon Productions Read More About: Comments",0,2026-05-07 11:12:51
2,https://deadline.com/2026/05/maggie-smith-stage-shepperton-studios-1236884269/,Shepperton Studios Unveils The Maggie Smith Stage,Deadline,2026-05-07T10:55:44,2256,"Skip to main content By Jesse Whittock Jesse Whittock International TV Co-Editor @WhittockTweets More Stories By Jesse Prime Video & Amazon MX Player Unify To Form Huge Indian Streaming Player ‘Matka King’: Prime Video Crowns Second Season Of Crime Drama Set In 1960s India Wyncor & OuiDo! Productions Form Content Distribution Business & Team On Two Animated Series View All May 7, 2026 3:55am Maggie Smith's sons Toby Stephens and Christopher Larkin outside The Maggie Smith Stage at Shepperton Studios Tim Whitby Shepperton Studios is honoring Maggie Smith . The UK studio unveiled The Maggie Smith Stage in a private ceremony attended by the late Harry Potter and Downton Abbey actress’s close friends and family members, including her sons Toby Stephens and Christopher Larkin . Smith had a long association with Shepperton and its sister studio Pinewood, where she filmed the likes of The Prime of Miss Jean Brodie (1969), for which she won the Academy Award for Best Actress and The Lonely Passion of Judith Hearne (1987), which earned her the BAFTA for Best Actress. She also worked at the studios on Othello (1965), Clash of the Titans (1981), The Secret Garden (1993), and Gosford Park (2001). Known as one of Britain’s most-loved actresses, Smith passed away in 2024 aged 89 following a career that brought her two Oscars, five BAFTAs, four Emmys and a Tony Award. Watch on Deadline Her sons Stephens and Larkin said today: “We are deeply touched by this recognition. Our mother would have been honoured to have her own stage at Shepperton, a place she had fond memories of and that means so much to the industry she dearly loved.” Pinewood Group, which owns Shepperton Studios, added: “Dame Maggie Smith is a national treasure and one of the finest actors of her generation. Her connection to both Shepperton and Pinewood Studios is deeply woven into our history, and we are honoured to recognise her contribution by naming The Maggie Smith Stage.” ‘Saturday Night Live UK’ Renewed For Season 2 At Sky Adrien Brody’s First Post Oscar Role Is Rachel Zegler, Ben Platt Drama Service Unifies With Amazon MX Player; ‘Matka King’ Renewed For S2 Fox Orders ‘Highway To Heaven’ Reboot From Katims, Amblin & Landon Productions Read More About: Comments",0,2026-05-07 11:12:52
3,https://deadline.com/2026/05/cannes-cinema-de-plage-loach-top-gun-presidents-men-1236884271/,Ken Loach Returns To Cannes With ‘Land And Freedom’ In Cinéma De Plage Lineup Alongside ‘Top Gun’ & ‘All The President’s Men’,Deadline,2026-05-07T10:52:10,2662,"Skip to main content By Melanie Goodfellow Melanie Goodfellow Senior International Film Correspondent @mel_goodfellow More Stories By Melanie Helen Mirren To Be Honored With Lifetime Achievement Award At Italy’s Taormina Film Festival Gary Lineker & Jorge Valdano-Narrated Cannes Doc ‘The Match’ About Argentina-England “Hand Of God” Game Sets Sales With Round 12 Former Berlinale World Cinema Fund Head Vincenzo Bugno To Be Honored In Cannes View All May 7, 2026 3:52am L-R Land and Freedom, Top Gun, All The President's Men, Molière, Cyrano and the Young King Everett Collection, Michael Crotto Cannes Palme d’Or winner Ken Loach will be back at the festival for the first time in three years for a screening of Spanish Civil War drama Land and Freedom in the Cinéma de Plage strand which was unveiled today. It is among 11 films programmed for the festival’s nightly open-air screenings on the public Macé Beach opposite the Majestic Hotel. The lineup also features a 40th anniversary screening of Top Gun in the presence of Motion Picture Association (MPA) CEO Charles H. Rivkin, as well as Alan J. Pakula All The President’s Men , with Robert Redford and Dustin Hoffman, which screened in Competition at the 1976 Cannes Film Festival. Related Stories News Gary Lineker & Jorge Valdano-Narrated Cannes Doc 'The Match' About Argentina-England ""Hand Of God"" Game Sets Sales With Round 12 News Former Berlinale World Cinema Fund Head Vincenzo Bugno To Be Honored In Cannes One new film, Molière, Cyrano and the Young King , a French period comedy-drama by Michel Leclerc and starring Artus, Doria Tillier, Julia Piaton and Franck Dubosc, will also world premiere in the strand. Watch on Deadline Full Cinéma de Plage Lineup Top Gun Tony Scott 1986, 1h50, United States The Bullet Train/Super Express 109 Junya Sato 1975, 2h32, Japan Molière, Cyrano and the Young King Michel Leclerc 2026, 1h58, France A Man and a Woman Claude Lelouch 1965, 1h42, France All The President’s Men Alan J. Pakula 1976, 2h18, United States Viva maria ! Louis Malle 1965, 2h02, France / Italy Land and Freedom Ken Loach 1995, 1h49, United Kingdom / Spain / Germany4K restored version. Cría Cuervos Carlos Saura 1976, 1h45, Spain The Birds, the Bees and the Italians Pietro Germi 1966, 2h00, Italy I Hate Actors Gérard Krawczyk 1986, 1h30, France Mon oncle Jacques Tati 1958, 1h56, France ‘Saturday Night Live UK’ Renewed For Season 2 At Sky Adrien Brody’s First Post Oscar Role Is Rachel Zegler, Ben Platt Drama Service Unifies With Amazon MX Player; ‘Matka King’ Renewed For S2 Fox Orders ‘Highway To Heaven’ Reboot From Katims, Amblin & Landon Productions Read More About: Comments",0,2026-05-07 11:12:53
