id,url,title,source,publication_date,text_length,full_text,is_duplicate,created_at
26,https://www.hollywoodreporter.com/movies/movie-news/barbara-ling-dead-once-upon-time-hollywood-production-designer-1236644433/,"Barbara Ling, Oscar-Winning Production Designer on ‘Once Upon a Time in Hollywood,’ Dies at 73",Hollywood Reporter,2026-07-11T04:04:22,4124,"Skip to main content By Mike Barnes Plus Icon Mike Barnes Senior Editor mikebarnes4 Follow Sign Up View All July 10, 2026 9:04pm Barbara Ling Matt Winkelmeyer/Getty Images for SBIFF Barbara Ling, the production designer who turned back time and won an Oscar for re-creating 1969 Los Angeles for Quentin Tarantino ’s acclaimed Once Upon a Time in Hollywood , has died. She was 73. Ling died Thursday in Santa Barbara after a battle with cancer, a spokesperson for WME announced. A Los Angeles native, Ling also tooled around her hometown for the present-day, Michael Douglas-starring Falling Down (1993), then reteamed with director Joel Schumacher to set up the fictional Gotham City for Batman Forever (1995) and Batman & Robin (1997). Related Stories Movies Don Iwerks, Disney Camera and Projection Pioneer, Dies at 96 Movies Peter Van Norden, 'Police Academy 2' Actor, Dies at 75 In a career that spanned more than four decades, Ling served as the production designer on two 1991 classics, Oliver Stone ’s The Doors and Jon Avnet’s Fried Green Tomatoes , on which she also was an associate producer. She also teamed with director Scott Hicks on Hearts in Atlantis (2001), No Reservations (2007), The Lucky One (2012) and Fallen (2016). Most recently, she worked on Marc Forster’s A Man Called Otto (2022), starring Tom Hanks, and on the blockbuster biopic Michael (2026), directed by Antoine Fuqua. On Once Upon a Time in Hollywood (2019), Ling shared the Oscar for best production design with set decorator Nancy Haigh; the two had worked together once before, on the 1988 film Checking Out . Tarantino’s “main thing from the moment we sat down was, ‘I want this to be real. I want to see. I want to smell and I feel that Hollywood. I don’t want to do green screen over here or have the digital interpretation. Let’s really change the billboards, and let’s put the real facades back on,’” Ling said in a 2019 interview . “That is, to me, very exciting. It’s something we don’t do much of anymore. I knew that what he wanted was to encompass himself and the actors into an environment that you could feel is real. You’re not just staring at something that’s a piece of green screen where we piece together later. That was the starting ground of this. “I had to go out and figure out where I could attach real things to. It was quite an engineering feat to do, particularly on Hollywood Boulevard, to say, ‘I want the Pussycat Theater back.’ To build those marquees, it’s added weight. These are old and fragile buildings that we were working with. We had to also work with engineers to make sure we weren’t going to pull the facade off once we rebuilt the old signs. It was laborious but well worth it. “The night of the first shoot when all the neon lit up and the period cars came out and [Arianne Phillips’] costumes were out there, you absolutely believed you were in 1969 because everything was real. It was a movie filming a real street. We pretty much carried that theme through Westwood [to re-create the Bruin Theater] and everywhere we shot.” After winning her Oscar, Ling lamented to reporters backstage that “L.A. is not a preservation city, never has been. Now there’s been a nonstop movement of apartment building and glass towers. … What we did will be impossible to do next year. It’s unfortunate. We hope this will bring some nostalgia back and stop things from being torn down.” Born in August 1952, Barbara Claire Ling began her career designing sets and lighting for more than 200 theater, opera and musical productions. Among her early efforts was the 1981 HBO special The Pee-Wee Herman Show , taped at the Roxy in West Hollywood. She made the leap to filmmaking when David Byrne enlisted her to design his directorial debut, True Stories (1986). Her credits also included Heaven (1987), Less Than Zero (1987), V.I. Warshawski (1991), With Honors (1994) and Sydney Pollack’s Random Hearts (1999), among the films that demonstrated she was equally comfortable with period authenticity, contemporary realism and stylized fantasy. Survivors include her wife, Lindsay, and their sons, Clay and Will. THR",0,2026-07-11 10:20:08
27,https://www.hollywoodreporter.com/movies/movie-news/don-iwerks-dead-disney-camera-legend-1236644425/,"Don Iwerks, Disney Camera and Projection Pioneer, Dies at 96",Hollywood Reporter,2026-07-11T03:47:32,2781,"Skip to main content By McKinley Franklin Plus Icon McKinley Franklin View All July 10, 2026 8:47pm Don Iwerks David Bohrer/Los Angeles Times via Getty Images Don Iwerks, the Disney legend who spearheaded various camera and projection systems for the company’s parks and films, has died. He was 96. Disney announced Iwerks died Thursday evening. “It is with great sadness that we report that Disney Legend Don Iwerks has passed away at the age of 96,” reads a statement shared on Disney D23’s Instagram . “Iwerks was an innovator whose work brought The Walt Disney Company to new technological heights, aiding in perfecting the sodium vapor process used in 1964’s Academy Award®-winning Mary Poppins, developing the 360-degree Circle-Vision camera used to film America the Beautiful for Disney Parks, and implementing the projection system for the fan-favorite Star Tours attraction, among numerous other advancements. The achievements of Don Iwerks and his family have shaped Disney’s creative ethos and will forever be part of the company’s history.” Related Stories Movies Peter Van Norden, 'Police Academy 2' Actor, Dies at 75 TV Randolph Mantooth, Firefighter-Paramedic Johnny Gage on 'Emergency!,' Dies at 80 Born on July 24, 1929, Iwerks was the son of fellow Disney Legend Ub Iwerks, co-creator of Mickey Mouse (alongside Walt Disney himself). Iwerks began at Walt Disney Productions in 1950, when he was a special photographic processes laboratory technician. He was drafted into the Korean War but upon his return two years later returned to Disney. Iwerks took on his role as a camera technician position in 1953, when he worked on his first feature 20,000 Leagues Under the Sea . He went on to lead the machine shop department, camera service department and technical engineering and manufacturing division. The executive is particularly known for developing the 360-degree Circle-Vision camera; alongside Ub, he also helped develop the sodium vapor process. After 35 years with Disney, he founded Iwerks Entertainment Inc. in 1986. The company was acquired by SimEx Inc. in 2001. In 1997, Iwerks received the Gordon E. Sawyer Award from the Academy of Motion Picture Arts and Sciences’ Board of Governors, then named a Disney legend in 2009. “Don embodied that rare combination of heart, ingenuity and passion that has always defined Disney,” Disney CEO Josh D’Amaro said in a statement. “Through his innovative contributions to some of our most iconic films and attractions, he helped create experiences that have delighted generations of fans around the world. All of us at The Walt Disney Company will miss him deeply, and we send our most heartfelt condolences to his family, whose enduring connection to Disney has helped shape its legacy for over a century.” THR",0,2026-07-11 10:20:09
1,https://deadline.com/2026/07/don-iwerks-dead-disney-exec-1236979775/,Don Iwerks Dead: Former Disney Exec & Cinematic Innovator Was 96,Deadline,2026-07-11T03:04:19,4528,"Skip to main content By Glenn Garner Glenn Garner Associate Editor @xoxo_glenn More Stories By Glenn Don Iwerks Dead: Former Disney Exec & Cinematic Innovator Was 96 Christopher Nolan Praises Gen Z Filmmakers For “Utterly Rejecting” AI Slop: “It’s Hitting At Exactly The Wrong Time” Peter Van Norden Dies: ‘Police Academy 2’ & ‘The Naked Gun 2½’ Actor Was 75 View All July 10, 2026 8:04pm Don Iwerks David Bohrer/Los Angeles Times via Getty Images Don Iwerks , the former Disney executive who innovated several cinematic advancements during his career, has died. He was 96. The Iwerks Entertainment co-founder died peacefully on Thursday at Ojai Community Memorial Care Center, “surrounded by the love of family and friends,” according to an obituary shared by his family. “Those who knew Don remember not only his extraordinary accomplishments, but the quiet grace with which he achieved them,” the family said of Iwerks. “Like his father, he delighted in solving problems, sharing knowledge, and celebrating the successes of others. Humble, endlessly curious, and unfailingly optimistic, he believed every challenge held the possibility of a solution.” Related Stories Executives Fathom Entertainment Names Disney And Imax Alum Jason Brenek CEO Reviews 'Moana' Review: Disney's Live-Action Remake Runs Aground They added, “Up to the end he was sketching new inventions, cheering on the Los Angeles Dodgers, and watching classic films. Mary Poppins remained especially close to his heart—a film whose optimism and enduring message that anything was possible perfectly reflected the way Don lived his life. … To the world, Don was an engineer, inventor, and Disney Legend. To those fortunate enough to know him, he was a devoted husband and father, a trusted mentor, a steadfast friend, and an eternal optimist.” Watch on Deadline Disney CEO Josh D’Amaro paid tribute to Iwerks in a statement. “Don embodied that rare combination of heart, ingenuity and passion that has always defined Disney. Through his innovative contributions to some of our most iconic films and attractions, he helped create experiences that have delighted generations of fans around the world. All of us at The Walt Disney Company will miss him deeply, and we send our most heartfelt condolences to his family, whose enduring connection to Disney has helped shape its legacy for over a century,” he said. Don Iwerks accepts the Gordon E. Sawyer Award at the 1998 Academy Awards. Born July 24, 1929 in Dallas, Texas, Iwerks grew up in Southern California, where his father, animator Ub Iwerks, became Walt Disney’s business parter, co-creating Mickey Mouse and Oswald the Lucky Rabbit. In 1950, Don followed in his father’s footsteps when he began working at Walt Disney Studios’ Process Lab, shortly before he served for more than a year in Germany as a U.S. Army Signal Corps photographer during the Korean War. Don returned to Disney in 1952, working alongside his father in the Studio Machine Shop to help develop cameras, optical printers and special effects systems for Disney films and theme parks, including the original Circle-Vision camera system, refinements to the sodium traveling matte process used in Mary Poppins (1964), and numerous projection technologies for Disney attractions around the world. After 24 years, Don and fellow Disney exec Stan Kinsey co-founded Iwerks Entertainment in 1986, which became a global pioneer in giant-screen theaters, motion simulators and immersive 3D experiences worldwide. In 1998, Don was awarded the Gordon E. Sawyer Award at the Oscars for his technical contributions to the motion picture industry. He and his father Ub were also honored with a dedicated Main Street, U.S.A. window in Magic Kingdom at Walt Disney World Resort. Don is survived by survived by wife Betty; son Larry; son John and wife Chris; documentarian daughter Leslie and great-nephew Mike, both of whom went on to work at The Walt Disney Company. Don was preceded in death by his daughter Tamara, “whom he loved deeply and carried in his heart always.” In lieu of flowers, the family asks that donations be made to the Community Memorial Continuing Care Center of Ojai and The Walt Disney Family Museum. Disney’s Live-Action ‘Moana’ Lost At Sea With $40M-$45M U.S. Opening Morgan Spector & Rebecca Hall Eyed To Lead Netflix Series Based On 2025 Dan Brown Book Meta Disables New AI Image Generator Days After CAA & SAG-AFTRA Trashed It Sells Stake To Dept. M; Michael Schaefer Named CCO; TV Unit Launches Read More About: Comments",0,2026-07-11 10:19:39
2,https://deadline.com/2026/07/paramount-warner-bros-oregon-attorney-general-motion-1236979773/,Oregon AG Drops Demand For Records & Motion To Delay Paramount-Warner Bros. Discovery Merger,Deadline,2026-07-11T02:40:12,3890,"Skip to main content By Ted Johnson Ted Johnson Political Editor @tedstew More Stories By Ted Oregon AG Drops Demand For Records & Motion To Delay Paramount-Warner Bros. Discovery Merger New York Times Alleges Trump Administration’s Reverse Discrimination Lawsuit Was Retaliation For Its Reporting On EEOC Donald Trump Names Country Singer John Rich As Special Envoy For American Landowners; Focus Will Be On Fighting Large Wind And Solar Development View All July 10, 2026 7:40pm Getty Images UPDATED, with comment from AG: Oregon ‘s attorney general has dropped a civil investigative demand for Paramount to turn over records related to its efforts to secure federal approval for its merger with Warner Bros. Discovery . Oregon Attorney General Dan Rayfield also had asked a state circuit court judge to order Paramount to turn over the materials and to delay Paramount’s closing of its proposed acquisition of Warner Bros. Discovery by 60 days so the documents could be reviewed. A hearing has been scheduled for Monday in Multnomah County Circuit Court. A Paramount spokesperson said, “We are pleased that the Oregon Attorney General has withdrawn its motion to delay this transaction. It was the right decision and avoids an unwarranted effort to delay a lawful, pro-competitive merger. Related Stories News New York Times Alleges Trump Administration's Reverse Discrimination Lawsuit Was Retaliation For Its Reporting On EEOC Politics Donald Trump Names Country Singer John Rich As Special Envoy For American Landowners; Focus Will Be On Fighting Large Wind And Solar Development “Antitrust authorities around the world have carefully reviewed this transaction, clearing it or concluding that it does not violate any competition laws. That regulatory record underscores what the facts, the law and the economics make clear: this transaction will create a stronger challenger to dominant global streaming and technology platforms, expand consumer choice, increase investment in premium content and theatrical distribution, and create more opportunities for creators and workers. We look forward to completing the transaction and delivering those benefits.” Watch on Deadline Jenny Hansson, communications director for Rayfield, said in a statement, “Paramount made it clear that they weren’t going to comply with the investigative demand, and that they think they’re above the law. We’re not going to let them waste Oregonians’ resources on these games. We’ve withdrawn the motion to consider our next steps.” California Attorney General Rob Bonta and other state attorneys general are said to be considering a legal challenge to the transaction. Rayfield sought Paramount records of lobbying of federal officials, as well as its role in a statement that the DOJ released in support of the transaction. The attorney general also sought documents “related to the formulation and execution of lobbying strategies aimed at obtaining regulatory approval of the proposed merger, which Respond as internally named ‘Project Warrior.'” In a court filing, Paramount has objected to the document requests, arguing, among other things, that they impose “burdens and demands which are disproportionate” to the Oregon investigation and are “of such marginal relevance that the value of any materials sought is outweighed by the burden imposed on Paramount in having to provide such information.” “Lobbying activities and related communications are wholly irrelevant to whether the proposed acquisition ‘violates Oregon’s antitrust laws,'” the company’s legal team wrote. Disney’s Live-Action ‘Moana’ Lost At Sea With $40M-$45M U.S. Opening Morgan Spector & Rebecca Hall Eyed To Lead Netflix Series Based On 2025 Dan Brown Book Meta Disables New AI Image Generator Days After CAA & SAG-AFTRA Trashed It Sells Stake To Dept. M; Michael Schaefer Named CCO; TV Unit Launches Read More About: 2 Comments",0,2026-07-11 10:19:41
20,https://variety.com/2026/film/news/oregon-paramount-warner-bros-merger-drops-delay-1236807068/,Oregon D.A. Drops Motion to Delay Paramount-Warner Bros. Merger,Variety,2026-07-11T02:33:36,4520,"Jul 10, 2026 7:33pm PT Oregon D.A. Drops Motion to Delay Paramount-Warner Bros. Merger By Gene Maddaus Plus Icon Gene Maddaus Senior Media Writer @GeneMaddaus Latest Oregon D.A. Drops Motion to Delay Paramount-Warner Bros. Merger 8 hours ago LA28 Olympics Moves International Broadcast Center to Warner Bros. Ranch in Burbank 2 days ago Oregon A.G. Seeks Delay of Paramount-Warner Bros. Merger, Suggests DOJ Approval Was ‘Corrupt’ 3 days ago See All AFP via Getty Images The Oregon attorney general’s office has withdrawn its motion to delay the closing of the Paramount-Warner Bros. merger, according to a filing submitted Friday in the Multnomah County Circuit Court in Portland, Ore. The deal could close as soon as July 22, though several states, including Oregon and California, are investigating whether the $111 billion transaction violates their antitrust laws. The states could still seek an injunction to block the merger before that date. Related Stories 'Strictly Business' Cannes Lions Edition: Fox's Rob Wade and Billy Parks Bet on Bringing Scale to the Business of Creators NBA Draft 2026 on Sling TV: Here's How To Watch the Two-Day Event Online Without Cable Dan Rayfield, the Oregon attorney general, asked a court on Wednesday to extend the closing date by 60 days, arguing that his office needed more time to investigate because Paramount Skydance had not been responsive to records requests. The state sought records and responses to questions about the company’s lobbying of the White House and the Department of Justice, suggesting that the DOJ had improperly approved the merger in June. Popular on Variety The judge scheduled a hearing for the motion on Monday morning, but the issue is now moot. Rayfield’s office also withdrew its demand for records regarding “Project Warrior” — the code name for the effort to win regulatory approval of the deal. Paramount had argued that the requests were irrelevant to the antitrust issues the state is investigating. “We are pleased that the Oregon Attorney General has withdrawn its motion to delay this transaction,” a company spokesperson said. “It was the right decision and avoids an unwarranted effort to delay a lawful, pro-competitive merger.” Jenny Hansson, a spokeswoman for the A.G.’s office, said the agency is considering its next move. “Paramount made it clear that they weren’t going to comply with the investigative demand, and that they think they’re above the law,” she said. “We’re not going to let them waste Oregonians’ resources on these games. We’ve withdrawn the motion to consider our next steps.” Paramount is also working to win approval from the European Commission and the U.K., and has already received the blessing of authorities in Australia, Canada and China. “Antitrust authorities around the world have carefully reviewed this transaction, clearing it or concluding that it does not violate any competition laws,” the company stated. “That regulatory record underscores what the facts, the law and the economics make clear: this transaction will create a stronger challenger to dominant global streaming and technology platforms, expand consumer choice, increase investment in premium content and theatrical distribution, and create more opportunities for creators and workers. We look forward to completing the transaction and delivering those benefits.” Netflix’s ‘Little House on the Prairie’ Is a Charming Reimagining of Laura Ingalls Wilder’s Beloved Adventure: TV Review Acclaimed Chilean Filmmaker Valeria Sarmiento Bids Farewell to Directing With Affecting Childhood Sexual Abuse Drama ‘Behind the Rain’ Bombillo Amarillo, a Producer on Top Annecy Winner ‘The Violinist,’ Launches Animation Beachhead in Spain (EXCLUSIVE) ‘Five Years, Four Months’ Co-Director Esteban Hoyos García on Urgency of Remembering Colombia’s Disappeared Ahead of Right-Wing Presidency Jeffrey Wright Says Being Black Is a ‘Political Term,’ Talks Racist Abuse Against Kylian Mbappé: ‘They Think They Can Diminish How Powerful He Is With Their Stupidity’ ‘Succession’ Director Andrij Parekh to Helm ‘The Retrievals,’ Netflix Series About Real-Life IVF Scandal From ‘Maid’ Creator Loading comments... More From Our Brands Rolling Stone Comic Fends Off ‘Frivolous’ $27 Million Lawsuit Over ‘Lion King’ Joke, Will Seek Legal Fees Robb Report This New Sherry Cask-Matured Rum Comes From Scotland’s Islay Sportico Kawhi Trade Value Could Change Based on Aspiration Scandal WWD Inside Margherita Maccapani Missoni’s Private Couture Week Pop-up",0,2026-07-11 10:20:01
3,https://deadline.com/2026/07/christopher-nolan-praises-gen-z-utterly-rejecting-ai-1236979769/,Christopher Nolan Praises Gen Z Filmmakers For “Utterly Rejecting” AI Slop: “It’s Hitting At Exactly The Wrong Time”,Deadline,2026-07-11T02:32:41,3144,"Skip to main content By Glenn Garner Glenn Garner Associate Editor @xoxo_glenn More Stories By Glenn Don Iwerks Dead: Former Disney Exec & Cinematic Innovator Was 96 Christopher Nolan Praises Gen Z Filmmakers For “Utterly Rejecting” AI Slop: “It’s Hitting At Exactly The Wrong Time” Peter Van Norden Dies: ‘Police Academy 2’ & ‘The Naked Gun 2½’ Actor Was 75 View All July 10, 2026 7:32pm Christopher Nolan Zak Hussein/PMC As Christopher Nolan prepares to take viewers on an Imax odyssey, he’s hopeful for the future of filmmaking without the use of AI . The 2x Oscar winner admitted that not all applications of artificial intelligence are “useless of meaningless,” he explained that generative AI is “hitting at exactly the wrong time” for Hollywood. “I’ve never seen a more rapid wholesale dismissal of a supposedly foundational jump in technology in my lifetime,” Nolan told The Telegraph . “So much energy has been expended on bringing in AI, but if you look at that generation’s reaction, they’re utterly rejecting it.” Related Stories News Christopher Nolan Dismisses ‘The Odyssey’ Casting Backlash As “Irrelevant”: “That’s What Adaptation Is” News Meta Removes Muse Image AI Feature After Backlash: “Missed The Mark” Citing his own kids as an example, Nolan added, “Their judgment of AI slop has been immediate and harsh. They see it for what it is very quickly – and it’s much easier for them to identify it, because it grew out of an online world they know really well. And while that doesn’t mean that every aspect of the technology is useless or meaningless, in film-making it’s hitting at exactly the wrong time. After years of driving towards heavily virtual environments, we’re seeing a renewed interest in more tactile, more real forms of storytelling.” Watch on Deadline Nolan praised young filmmakers like Obsession director Curry Barker and Backrooms ‘ Kane Parsons for their use of practical effects when possible, noting “young people can’t get enough of” their work. “I think cinema is vital and essential and continues to transform itself – we’ve got all these great new young voices in movies, making the medium their own and moving it forward,” added Nolan. The use of AI in Hollywood continues to be a hot-button topic in recent years. SAG-AFTRA has endorsed the Trump administration’s AI policy framework , which calls for Congress to enact legislation that includes parental controls, intellectual property rights protection, First Amendment protections, expanding AI workforce development, allowing data centers to generate their own power and removing legal barriers that limit AI innovation. Last month, Trump signed an executive order for voluntary framework in which AI companies would provide the government with access to new models for a 30-day review period before their release. Disney’s Live-Action ‘Moana’ Lost At Sea With $40M-$45M U.S. Opening Morgan Spector & Rebecca Hall Eyed To Lead Netflix Series Based On 2025 Dan Brown Book Meta Disables New AI Image Generator Days After CAA & SAG-AFTRA Trashed It Sells Stake To Dept. M; Michael Schaefer Named CCO; TV Unit Launches Read More About: 2 Comments",0,2026-07-11 10:19:42
