id,url,title,source,publication_date,text_length,full_text,is_duplicate,created_at
5,https://deadline.com/2026/06/monte-carlo-tv-festival-preview-walking-dead-industry-fans-1236950044/,Monte-Carlo TV Festival’s 65th Edition: An Inside Take On The Event’s Industry-Fan Formula,Deadline,2026-06-08T09:52:30,8164,"Continue to Deadline SKIP AD You will be redirected back to your article in seconds Skip to main content Dismiss News Banner Breaking News Tony Awards Winners: 'Schmigadoon!' Best Musical, 'Liberation' Best Play; John Lithgow, Lesley Manville, 'Ragtime' Duo Top Acting Honors Read the full story By Stewart Clarke Stewart Clarke More Stories By Stewart ‘The Little Cult That Could’: A Nine-Year Journey Into A Michigan Doomsday Group Next Wave Of European Showrunners Revealed Elisee Junior St Preux On Bringing Haiti To Tribeca With ‘The Tropic Sun And His Eyes’ View All June 8, 2026 2:52am Monte-Carlo TV Festival Monte-Carlo TV Festival The eyes of the sporting world were on Monaco this weekend as Kimi Antonelli sped to victory at the Formula 1 Grand Prix. The principality also regularly provides a glamorous backdrop for movies and events. When it comes to TV, it has been the host of the Monte-Carlo TV Festival since the early 1960s. The Festival blends events for the public and the industry and the 65 th edition will open with Season 3 of The Walking Dead: Dead City , while Kristin Scott Thomas and Kurt Russell will receive its top honor, the Crystal Nymph. Ester Expósito and Matthew Broome , meanwhile, will take accolades for most promising talent, while a raft of projects compete for Golden Nymph awards across fiction, digital, and news and documentary categories. Related Stories News Goldie Hawn & Kate Hudson Have ""Thought A Lot About"" Making A Movie Together: ""Never Say Never"" News Monte-Carlo TV Festival To Open With 'The Walking Dead: Dead City' Season 3; Ester Expósito & Matthew Broome Set For Most Promising Talent Honors Ahead of this year’s Festival getting underway, its Executive Director, Cécile Menoni, gave Deadline the lowdown. Watch on Deadline DEADLINE: The calendar of festivals and events is jam packed. Where does the Monte-Carlo TV Festival fit in? Cécile Menoni : Many events focus primarily on the industry, while others are designed mainly for fans and the public. What makes Monte-Carlo unique is its ability to bring together every part of the television ecosystem in a single destination. Over five days, writers, producers, executives, talent, journalists and audiences share the same spaces, attend the same premieres and participate in the same conversations. There is also a strong symbolic dimension to the Festival. Created by Prince Rainier III in 1961, it has accompanied virtually every major transformation in television history, from the era of public broadcasters to cable television, the rise of international co-productions, the streaming revolution and now the emergence of digital-first storytelling. DEADLINE: This will be the 65 th edition of the Festival, what can we expect? Cécile Menoni : From Dame Kristin Scott Thomas and Kurt Russell, who will receive our Crystal Nymphs, to Jeffrey Dean Morgan and Lauren Cohan presenting The Walking Dead: Dead City , the Festival brings together some of the most influential figures in contemporary television. We are also delighted to welcome creators and producers such as Michael Hirst, one of the most respected storytellers in the industry, alongside talents including Aldis Hodge, Ben Watkins and Ester Expósito, recipient of the International Golden Nymph for Most Promising Talent. I am equally proud of the richness of this year’s Official Competition, which showcases programs from around the world and reflects the extraordinary diversity of storytelling today. DEADLINE: H ow do you balance the mix of industry and public events? Cécile Menoni : The public side of the Festival creates excitement, visibility and genuine engagement between viewers and the people who create the programs they love. The industry side creates opportunities for collaboration, networking and strategic discussions. We are not a market in the traditional sense, and that distinction is important. Our objective is not simply to facilitate business transactions, but to create an environment where meaningful conversations, creative exchanges and lasting relationships can develop naturally. Our role is to create an environment where both communities can interact naturally. The Business Forum, premieres, public screenings, talent encounters and industry discussions all contribute to a broader ecosystem that reflects the many ways television brings people together. DEADLINE: How has the Festival evolved? Cécile Menoni : A decade ago, many conversations centered primarily on broadcasters and traditional commissioning models. Today, the landscape is considerably more complex. Global streamers, digital platforms, independent producers, creator-led businesses and emerging technologies are all influencing how stories are developed, financed, distributed and consumed. Our responsibility as a Festival is not simply to reflect those changes but to anticipate them. This is one of the reasons why we have expanded the Business Forum, introduced new industry-focused discussions and launched the Digital Competition. These allow us to recognize excellence across a broader spectrum of content while fostering conversations about the future of storytelling. DEADLINE: Tell us about this year’s Crystal Nymphs and why Dame Kristin and Kurt Russell were selected. Cécile Menoni : The Crystal Nymph honors individuals whose careers have left a lasting mark on the television industry and on audiences worldwide. Dame Kristin Scott Thomas has built an extraordinary career distinguished by elegance, intelligence and artistic excellence. Across television, film and theatre, she has consistently delivered remarkable performances while maintaining a unique creative integrity that has earned admiration across generations. Kurt Russell represents another exceptional journey. Over several decades, he has become one of the most respected and recognizable figures in international entertainment. His versatility, longevity and ability to connect with audiences across generations make him a truly deserving recipient. DEADLINE: The Festival has always attracted Hollywood and U.S. talent. How important has that dimension been? Cécile Menoni : This longstanding connection with American talent and the U.S. entertainment industry has been part of the Festival’s DNA since its creation by Prince Rainier III in 1961 and remains one of the cornerstones of its international identity today. What is particularly fascinating today is how much the relationship between Europe and the United States has evolved. The flow of ideas is no longer one-directional. European series are traveling globally, international co-productions are becoming increasingly common and audiences are embracing stories regardless of their country of origin. DEADLINE: As you look back on your time with the Festival, what are the moments and highlights that come to mind? Cécile Menoni : This anniversary has encouraged us to look back at an extraordinary history. One of the projects I am particularly proud of this year is the documentary produced by TVMonaco, which retraces six decades of the Festival’s evolution and its close relationship with the television industry. Through archive footage and interviews, it highlights some of the remarkable personalities who have helped shape both the Festival and television itself. In the documentary, we hear reflections from figures such as Jerry Bruckheimer, Dick Wolf, Michel Drucker, Alexia Laroche-Joubert, Dominique Farrugia, Marie-France Brière and Rola Bauer, all of whom represent different chapters of television history. What makes me particularly proud is that the Festival has never been simply a celebration of fame. It has always been a place where creative talent, industry leaders and audiences can come together around a shared passion for storytelling. That spirit remains just as relevant today as it was in 1961. P!nk Opener; First Openly Trans Winner; EGOT Alert; Best Of The Red Carpet ‘Scary Movie’ Stabbing Record $55M Bow; $29M For He-Man’s ‘Universe’ Raman Bests Pratt In Latest Vote Count For No. 2 In L.A. Mayor Race ‘Power Ballad’ Looks To Connect Without YouTube Phenoms Or Jump Scares Read More About: Comments",0,2026-06-08 13:11:46
23,https://variety.com/2026/film/global/idris-elba-bond-rumors-not-true-audiences-wont-go-black-male-1236769140/,Idris Elba Says Bond Rumors Were ‘Never Legit’ and ‘Not Realistic’: Audiences ‘Won’t Go for a Black Male Playing Bond’,Variety,2026-06-08T09:29:15,3863,"Jun 8, 2026 2:29am PT Idris Elba Says Bond Rumors Were ‘Never Legit’ and ‘Not Realistic’: Audiences ‘Won’t Go for a Black Male Playing Bond’ By Ellise Shafer Plus Icon Ellise Shafer Latest Idris Elba Says Bond Rumors Were ‘Never Legit’ and ‘Not Realistic’: Audiences ‘Won’t Go for a Black Male Playing Bond’ 3 hours ago ‘Toy Story 5’ VFX Supervisor Has Been Keeping Taylor Swift Song a Secret Since February: ‘We Had to Create a Decoy Version of the Film’ Without It 3 days ago Piers Morgan Says SXSW London ‘Could Have Stood Up’ More for Cenk Uygur After He Was Banned From Entering U.K.: ‘I’m a Bit Disappointed’ 4 days ago See All Getty Images Idris Elba is putting those James Bond rumors to bed. The 53-year-old acclaimed actor — who tends to play heroic characters and currently stars in “Masters of the Universe” alongside Nicholas Galitzine — has been tipped to take over the 007 role since before Daniel Craig’s departure in 2021. But in a new cover interview with British GQ , Elba says the rumors were “never legit.” Related Stories John Lithgow Play 'Giant' Recoups $5.6 Million Broadway Investment Tony Awards 2026: 'Death of a Salesman' Leads With Six Wins, as 'Ragtime,' 'Schmigadoon!' and 'Liberation' Also Take Top Honors “I’ve always felt that it’s not a realistic thing,” he told British GQ. “James Bond was written how he was written for a reason. But I was complimented by it. And also, I think, in realistic terms, some markets just don’t go for that. Bond is big all over the world. And [audiences] won’t [all] go for a Black male, an African male, playing Bond. That’s not what they like in their culture. Period.” Popular on Variety But he also said he doesn’t necessarily think that Bond should change. “Bond is so unrealistic, so a hint of reality is good, but let’s not try and make it woke,” Elba continued. “I think you’ve got to be pure to what it is: escapism. Don’t try and answer the world’s taste. Just be Bond.” The rumor mill as to who will be the next Bond has been heating up as auditions have officially started. Prolific casting director Nina Gold (“Game of Thrones,” “The Crown”) is leading the charge for Amazon MGM Studios, who took creative control of the franchise last year. The next Bond movie is set to be directed by “Dune” helmer Denis Villeneuve, and Variety has heard that he and the studio are looking for someone on the younger side to step into Bond’s shoes. Tom Francis, the 26-year-old British actor best known for his Olivier-winning role opposite Nicole Scherzinger in the stage musical “Sunset Boulevard,” has already auditioned, a source told Variety last month . Other stars heavily rumored to be in the mix include Jacob Elordi, Aaron Taylor-Johnson and Callum Turner. Read Elba’s full British GQ interview here . ‘Chad Powers’ Star Glen Powell Is Everywhere, But He Promises He’s Not Burnt Out: ‘I Think People Are Worried About Me’ L.A. Plays Itself — But Not All of It — In Comedies Like ‘Hacks,’ ‘Nobody Wants This,’ ‘The Studio’ and ‘Shrinking’ Seth MacFarlane Lands on Emmy Ballot Nine Times as Peacock Mounts 19-Category ‘Ted’ Push, With Brennan Lee Mulligan in Guest Comedy (EXCLUSIVE) Sam Reich on ‘Game Changer’ Emmy Chances, Abby Lee Miller’s Surprise Dropout Fandom and Animated ‘Dimension 20’ Plans Ramy Youssef on Making Fox News Melt Down After He Taught Elmo Some Arabic Words on ‘Sesame Street’: ‘You Feel This Ramp-Up of Islamophobia’ How ‘Margo’s Got Money Troubles’ Unique Opening Credits Scene Was Created (EXCLUSIVE) Loading comments... More From Our Brands Rolling Stone ‘Cats’ Costume Designer Qween Jean Becomes First Openly Trans Person to Win Tony Award Robb Report TAG Heuer Just Unveiled a New Monaco Watch With a 12-Cylinder Dial Sportico Jalen Brunson Caught in a Fraught Era for Signature Shoes WWD Can Madonna and Macy’s Bring Kiko Milano’s Makeup Reign to the U.S.?",0,2026-06-08 13:12:06
6,https://deadline.com/2026/06/maggie-gyllenhaal-jesse-eisenberg-karlovy-vary-1236950035/,Maggie Gyllenhaal & Jesse Eisenberg To Be Honored At Karlovy Vary,Deadline,2026-06-08T09:21:54,2788,"Continue to Deadline SKIP AD You will be redirected back to your article in seconds Skip to main content Dismiss News Banner Breaking News Tony Awards Winners: 'Schmigadoon!' Best Musical, 'Liberation' Best Play; John Lithgow, Lesley Manville, 'Ragtime' Duo Top Acting Honors Read the full story By Zac Ntim Zac Ntim International Reporter @ZacharyNtim More Stories By Zac Indie Outfit Mirak Studio To Launch Production Facility In Albania Italian Global Series: Sally Wainwright Among Guests Set For Second Edition Maggie Gyllenhaal & Jesse Eisenberg To Be Honored At Karlovy Vary View All June 8, 2026 2:21am Maggie Gyllenhaal & Jesse Eisenberg Jamie McCarthy/Getty Images/Manny Carabel/Getty Images Maggie Gyllenhaal and Jesse Eisenberg will receive Karlovy Vary ’s honorary President’s Award during this year’s festival, which runs from July 3 to July 11. Gyllenhaal will be handed the award at the festival’s opening ceremony. She will also screen The Bride! as part of the celebrations. Eisenberg will receive his award later in the festival, and he will present The Double , directed by Richard Ayoade. Eisenberg stars in the film alongside Mia Wasikowska. “Maggie Gyllenhaal and Jesse Eisenberg are distinguished by a certain ‘trans-Atlantic’ sensitivity,” Karlovy Vary Artistic Director Karel Och said in a statement. Related Stories News Karlovy Vary Unveils Competition Lineup & Jury Members For Milestone 60th Edition News Maggie Gyllenhaal's 'The Bride!' Sets HBO Max Premiere Date “Their work as actors and directors has the ability to connect the New World and Europe while drawing on the most essential elements of both traditions. The humor of New York intellectuals is combined with wisdom, talent, and an original way of seeing the world.” Watch on Deadline This year’s edition marks Karlovy Vary’s 60th anniversary. 12 titles have been set for the Festival’s Crystal Globe Competition. Among those titles is Hijamat, the latest feature from Iranian filmmaker Nader Saeivar. Saeivar is best known for his long-term collaboration with Jafar Panahi. The pair have written two films together, including last year’s Palme d’Or winner It Was Just an Accident . Check out the full list of competition titles here . The New Yorker film critic Justin Chang will serve on the jury of this year’s Crystal Globe Competition alongside filmmaker Amanda Nell Eu, Czech sound designer, producer, and composer Pavel Rejholec, producer Nadia Turincev, and filmmaker Eskil Vogt. P!nk Opener; First Openly Trans Winner; EGOT Alert; Best Of The Red Carpet ‘Scary Movie’ Stabbing Record $55M Bow; $29M For He-Man’s ‘Universe’ Raman Bests Pratt In Latest Vote Count For No. 2 In L.A. Mayor Race ‘Power Ballad’ Looks To Connect Without YouTube Phenoms Or Jump Scares Read More About: Comments",0,2026-06-08 13:11:47
7,https://deadline.com/2026/06/hugh-laurie-responds-house-viral-criticism-1236950026/,Hugh Laurie Issues Waspish Retort To Viral Critique Of ‘House’ Having “Same Narrative Every Episode”,Deadline,2026-06-08T09:12:17,3295,"Continue to Deadline SKIP AD You will be redirected back to your article in seconds Skip to main content Dismiss News Banner Breaking News Tony Awards Winners: 'Schmigadoon!' Best Musical, 'Liberation' Best Play; John Lithgow, Lesley Manville, 'Ragtime' Duo Top Acting Honors Read the full story By Jake Kanter Jake Kanter International Investigations Editor @Jake_Kanter More Stories By Jake HBO’s ‘Harry Potter’ Series Casting Colin Creevey For Season 2 BBC ‘Newsnight’ Presenter Victoria Derbyshire Faced Workplace Conduct Investigation Claire Foy Says Acting With Richard E. Grant In ‘Savage House’ Was Like “Constantly Teetering On The Edge Of Nervous Breakdown” — SXSW London View All June 8, 2026 2:12am 'House' Adam Taylor/Fox /Courtesy Everett Collection House may have ended more than a decade ago, but Hugh Laurie is still prepared to do battle for the beloved Fox series. Janet Murray, a British journalist, went viral on X/Twitter over the weekend when she penned a review of House , in which she argued that the medical drama has the “same narrative every episode.” “Patient has mysterious illness. Hugh Laurie (House) gets diagnosis wrong. Patient nearly dies. Hugh Laurie gets diagnosis wrong again. Gets threatened with being fired. Patient nearly dies again,” she said. Related Stories News Hugh Laurie Returning To John Le Carré Universe With Mystery Role In 'Legacy Of Spies' News ""Terrible Thing"": Hugh Laurie Laments 'Tehran' Producer Dana Eden's Sudden Death “Hugh Laurie has last minute leftfield idea. Gets diagnosis right. Doesn’t get fired. Eight seasons of this?” Watch on Deadline Laurie was not impressed. He responded: “Thanks for your critique, Janet. We actually tried a couple of episodes where House (Hugh Laurie) (please put the brackets in the right place) gets it right first time, but they were only 6 minutes long. NBC weren’t happy. Then we tried some where House never gets it right and the patient dies. The audience wasn’t happy.” The actor continued: “One could apply your trenchant analysis to other art forms: JS Bach wrote 30 Goldberg variations on the same chord structure; Frida Kahlo painted 50 portraits of herself; Henry Moore, what?? “The point is, or was, variations on a theme; if all you see is hospital, medical blah blah, then it wasn’t meant for you. Nonetheless, I look forward to your first novel!” Thanks for your critique, Janet. We actually tried a couple of episodes where House (Hugh Laurie) (please put the brackets in the right place) gets it right first time, but they were only 6 minutes long. NBC weren’t happy. Then we tried some where House never gets it right and… — Hugh Laurie (@hughlaurie) June 7, 2026 Laurie was criticized for being “classless” with his message, to which he replied: “OK.” Murray saw the funny side. “Woken up to a few new followers this morning. Who may be disappointed to learn that TV reviews are not usually my forte,” she wrote. “Plus I may now be too busy working on my first novel.” P!nk Opener; First Openly Trans Winner; EGOT Alert; Best Of The Red Carpet ‘Scary Movie’ Stabbing Record $55M Bow; $29M For He-Man’s ‘Universe’ Raman Bests Pratt In Latest Vote Count For No. 2 In L.A. Mayor Race ‘Power Ballad’ Looks To Connect Without YouTube Phenoms Or Jump Scares Read More About: Comments",0,2026-06-08 13:11:48
29,https://www.hollywoodreporter.com/movies/movie-news/karlovy-vary-2026-maggie-gyllenhaal-jesse-eisenberg-awards-1236615294/,"Maggie Gyllenhaal, Jesse Eisenberg to Receive Karlovy Vary Honors",Hollywood Reporter,2026-06-08T09:00:00,2728,"× Skip to main content By Georg Szalai Plus Icon Georg Szalai Global Business Editor View All June 8, 2026 2:00am Maggie Gyllenhall Courtesy of Gareth Cattermole/Getty Images Karlovy Vary is rolling out the red carpet for Maggie Gyllenhaal ( The Lost Daughter , Secretary , The Honourable Woman ) and Jesse Eisenberg ( The Social Network , A Real Pain , When You Finish Saving the World ) this year. At its 60th anniversary edition next month, the Karlovy Vary International Film Festival will present its President’s Award to the “two distinctive personalities who have significantly shaped contemporary world cinema,” organizers said on Monday. “In their work, director, screenwriter and actress Maggie Gyllenhaal and the multifaceted actor, director, screenwriter and author Jesse Eisenberg transition smoothly between charismatic performances and bold auteur filmmaking.” Related Stories Movies Tamil Blockbuster 'Karuppu' Set for Global Streaming Launch on Amazon Prime Video Movies 'Lesbian Lines' Doc Shines a Light on Irish History Not Taught in School - and the Power of Listening Said KVIFF executive director Kryštof Mucha: “We at the festival are glad to be able to welcome two creative individuals whose work as actors, screenwriters, and directors is representative of contemporary trends in cinema and whose films are an intense experience for audiences.” Jesse Eisenberg Courtesy of KVIFF Gyllenhaal will receive her honor during the opening ceremony of the 60th edition of KVIFF on Friday, July 3. At the fest, she will also present her film The Bride! , which she wrote, directed and produced. The “imaginative continuation of the classic Frankenstein story, influenced by both the 1935 film Bride of Frankenstein and Mary Shelley’s original masterpiece,” the movie stars Jessie Buckley, Christian Bale, Annette Bening, Penélope Cruz, Peter Sarsgaard and Jake Gyllenhaal. Also receiving KVIFF’s President’s Award will be Eisenberg, whose upcoming film as a writer and director, The Debut , stars Julianne Moore and Paul Giamatti. Eisenberg also co-stars in and wrote the music and lyrics for the film’s musical-within-the-movie. The movie will be released in the fall by A24. In his honor, the Czech festival will screen The Double , directed by Richard Ayoade, in which Eisenberg plays the lead role. “Maggie Gyllenhaal and Jesse Eisenberg are distinguished by a certain ‘trans-Atlantic’ sensitivity,” said KVIFF artistic director Karel Och. “Their work as actors and directors has the ability to connect the New World and Europe while drawing on the most essential elements of both traditions. The humor of New York intellectuals is combined with wisdom, talent, and an original way of seeing the world.” THR",0,2026-06-08 13:12:13
8,https://deadline.com/2026/06/dani-swan-action-drama-iris-japan-toei-spain-1236950016/,Dani Swan Action Thriller ‘Iris’ Set To Film In Spain & Japan; Toei To Assist Japanese Portion Of Shoot,Deadline,2026-06-08T08:47:38,2781,"Continue to Deadline SKIP AD You will be redirected back to your article in seconds Skip to main content Dismiss News Banner Breaking News Tony Awards Winners: 'Schmigadoon!' Best Musical, 'Liberation' Best Play; John Lithgow, Lesley Manville, 'Ragtime' Duo Top Acting Honors Read the full story By Liz Shackleton Liz Shackleton pmc-media-editor-2024 More Stories By Liz China’s Damai Entertainment Sets International Release For $223M Surprise Hit ‘Dear You’ Thailand’s CEA Launches Bangkok International Content Market; First Edition Set For July Yeon Sang-ho’s Cannes Midnight Title ‘Colony’ Passes 3 Million Admissions On Korean Release View All June 8, 2026 1:47am L-R: Dani Swan, Lisa C. Satriano Rising Swan Entertainment EXCLUSIVE: U.S. indie Rising Swan Entertainment is gearing up to shoot female-led action thriller Iris , created by and starring Dani Swan ( The Matrix Resurrections ), in Spain and Japan, with Japan’s Toei Company assisting with the Japanese portion of the shoot. The film will be the feature directorial debut of Lisa C. Satriano, who has worked as an A.D. on films including Black Panth er, Venom , Atomic Blond e, Thor: Ragnaro k and The Butler . Rising Swan is producing with Spain’s Blue Iris Entertainment. Around 40% of the film will be shot in Japan with Toei providing studio facilities, casting support, production personnel and creative collaboration on production design and stunt coordination. Toei will also assist the production in applying for Japan’s production incentive . Watch on Deadline Related Stories News Japan's Toei Co Signs Development Deal With South Africa's Pambili Media For Samurai Epic 'Yasuke - Way Of The Butterfly' News International Insider: Trump's Tariff Targets; CinemaCon Compiler; Toei Interview Co-written by Swan and Bryan Hwang, the film combines action noir, psychological mystery and samurai mythology in a story set between modern Paris and feudal Japan. The producers describe the film as “an elevated international genre thriller with global audience appeal”. The creative team also includes DoP Damien Beebe ( Edge of Tomorrow ), stunt coordinator Anthony Nanakornpanom ( The Odyssey ) and VFX supervisor Alonso Valera ( Ex Machin a). Production is scheduled to begin in fall 2026 across Spain and Japan, with casting currently underway. Swan is represented by Alison Buck, Peter Sample and Jeff Silberman at Bohemia Group. Satriano is represented by United Talent Agency and Louis Pacella. P!nk Opener; First Openly Trans Winner; EGOT Alert; Best Of The Red Carpet ‘Scary Movie’ Stabbing Record $55M Bow; $29M For He-Man’s ‘Universe’ Raman Bests Pratt In Latest Vote Count For No. 2 In L.A. Mayor Race ‘Power Ballad’ Looks To Connect Without YouTube Phenoms Or Jump Scares Read More About: Comments",0,2026-06-08 13:11:49
