id,url,title,source,publication_date,text_length,full_text,is_duplicate,created_at
1,https://deadline.com/2026/03/kahlil-joseph-blknws-terms-conditions-digital-release-1236745756/,Kahlil Joseph’s ‘BLKNWS: Terms & Conditions’ Sets Digital Release Date,Deadline,2026-03-06T09:10:36,2321,"Skip to main content By Zac Ntim Zac Ntim International Reporter @ZacharyNtim More Stories By Zac Climate Reality Check: ‘Bugonia’ & ‘Sirāt’ Among Awards Titles To Pass Industry Test Olivier Awards: Rachel Zegler, Cate Blanchett, Tom Hiddleston & ‘Paddington: The Musical’ Among 2026 Nominees Allison Janae Hamilton Discusses Her Latest Film Project ‘Venus Of Ossabaw’ & How She Plans To Reach Audiences In The “Popular Arena” With Her Debut Feature ‘Floridaland’ View All March 6, 2026 1:10am ‘BLKNWS: Terms & Conditions’ Kahlil Joseph/Rich Spirit. EXCLUSIVE: Kahlil Joseph ’s debut feature BLKNWS: Terms & Conditions is set to debut globally on all digital platforms on March 6. Directed by artist and filmmaker Joseph and shot by Academy Award–nominated cinematographer Bradford Young, the film weaves together news clips, archival footage, scripted scenes, and music to form a unique story about Black life and history. The film was adapted from Joseph’s seminal video art installation, which was shown at the Venice Biennale in 2019. The film was released theatrically by indie distributor Rich Spirit through boutique screenings in select cities. The film is currently part of a theatrical residency at 180 Studios in London. Stateside, BLKNWS screened for over 100 days at the Lumiere Cinema in Los Angeles and 60 days at the IFC Center in New York. Joseph is the artist best known for his intellectually and emotionally dense installation works and music videos for artists such as Kendrick Lamar, Sampha, Flying Lotus, and Beyoncé, including the Emmy-nominated Lemonade . His gallery work has been shown everywhere from the Tate Modern to the Hammer Museum. 180 Studios has collaborated with Joseph for a decade, from staging his Kendrick Lamar ‘m.a.A.d’ installation as part of The Infinite Mix (2016) to commissioning his film Fly Paper (2018). Watch on Deadline BLKNWS debuted at last year’s Sundance Film Festival before a series of much-talked-about screenings at the 2025 Berlinale. ‘Heated Rivalry’ Creator Sets Historical Drama Series At Netflix; Bateman Among EPs How CAA’s Big-Bucks Loss Behind Closed Doors Is About To Go Large & Public California AG Slams Feds Over WBD Deal, Citing Antitrust Concerns ABC Orders New Seasons Of ‘High Potential,’ ‘9-1-1’ & ‘9-1-1: Nashville’ Read More About: Comments",0,2026-03-06 09:49:57
2,https://deadline.com/2026/03/copper-drama-series-cedar-cove-new-buyers-uktv-u-1236745743/,Classic TV Dramas ‘Copper’ & ‘Cedar Cove’ Find New Homes,Deadline,2026-03-06T09:08:54,2631,"Skip to main content By Stewart Clarke Stewart Clarke More Stories By Stewart Climate Reality Check: ‘Bugonia’ & ‘Sirāt’ Among Awards Titles To Pass Industry Test From Baltimore To Kyrgyzstan: ‘The Wire’ Duo Dominic West & Clarke Peters Talk Saddling Up For ‘Beyond The Silk Road’ With A Little Help From Sting ITV Studios Says That With A Deal Agreed, Paramount & WBD Are Open For Business View All March 6, 2026 1:08am Copper Beta Film EXCLUSIVE: Copper and Cedar Cove have proved their staying power, with both vintage TV dramas finding new homes. British channels group UKTV has snagged Copper for its streaming service U. Set in 1860s New York City, the series was created by Barry Levinson, Tom Fontana and Will Rokos. It proved popular on BBC America in the U.S. The show follows a tough police detective, Kevin Corcoran (Tom Weston-Jones) who returns from war to find his wife missing and his daughter dead. He divides his time between working cases and trying to piece together what happened to his family. Related Stories News A Royal Double For Beta Film: King Ludwig II Drama Coming To Market & New Season Of 'Máxima' In The Works Acquisitions 'Patience': More Buyers For Channel 4 Crime Drama The series was BBC America’s first original drama. While there was talk of a Copper movie when the drama ended after two seasons and 23 episodes, it never materialized. Cineflix and Shaw produced the scripted series. Watch on Deadline Cedar Cove starring Andie MacDowell , meanwhile, recently topped 400,000 views on YouTube in German-speaking territories. It has now been sold into Central and Eastern Europe, with commercial net TV2 picking it up for Hungary. Based on the Debbie Macomber´s best-selling novels, the show was made by Unity Pictures for Hallmark Channel in the U.S. Germany-based Beta sells Copper and Cedar Cove internationally and sealed the deals. The producer-distributor also said it has sealed several other European agreements for its catalog dramas. German crime TV movie series Big Ben has been acquired by free-to-air broadcaster Prima TV for the Czech Republic and Slovakia. Elsewhere, the long-running series The Call of the Mountain , about an alpine doctor, has been snagged by JOJ for Slovakia and by the AXN White channel for pay TV in Slovakia and the Czech Republic. ‘Heated Rivalry’ Creator Sets Historical Drama Series At Netflix; Bateman Among EPs How CAA’s Big-Bucks Loss Behind Closed Doors Is About To Go Large & Public California AG Slams Feds Over WBD Deal, Citing Antitrust Concerns ABC Orders New Seasons Of ‘High Potential,’ ‘9-1-1’ & ‘9-1-1: Nashville’ Read More About: Comments",0,2026-03-06 09:49:58
29,https://www.hollywoodreporter.com/movies/movie-reviews/war-machine-review-alan-ritchson-dennis-quaid-1236521853/,‘War Machine’ Review: Alan Ritchson’s Charisma Can’t Save This Hopelessly Basic Netflix Sci-Fi Actioner,Hollywood Reporter,2026-03-06T08:01:00,5271,"× Skip to main content By Frank Scheck Plus Icon Frank Scheck View All March 6, 2026 12:01am 'War Machine' Ben King/Netflix Action movies don’t get more generic than this second Netflix movie featuring the exact same title as the 2017 Brad Pitt starrer (good luck on your searches). War Machine stars Alan Ritchson of Reacher fame as the leader of a platoon of U.S. Rangers who have the bad luck of encountering a giant killer robot from outer space that seems to be left over from War of the Worlds . The sort of mindless time-killer that will boost your testosterone level while watching it, the film seems perfectly designed for those born too late to have seen the original Predator , or any of its 80s and 90s-era clones, during their theatrical runs. Related Stories Movies 'I Can Only Imagine 2' Review: Milo Ventimiglia in a Merciless MercyMe Sequel Movies Alan Ritchson Faces Otherworldly Threat in Netflix's 'War Machine' Trailer Ritchson’s character, known only as “81,” is given a cursory backstory in the form of an opening scene — set two years before the main action — depicting a tragic military incident involving his brother (an unfortunately underused Jai Courtney ) in Kandahar. Cue the subsequent flashbacks as 81 frequently relives his trauma at inopportune moments. War Machine The Bottom Line Not all it could be. Release date: Friday, March 6 Cast: Alan Ritchson, Blake Richardson, Keiynan Lonsdale, Daniel Webber, Jai Courtney, Esai Morales, Stephan James, Dennis Quaid Director: Patrick Hughes Screenwriters: Patrick Hughes, James Beaufort Rated R, 1 hour 46 minutes Undergoing training in Colorado with a new batch of recruits, 81 finds himself recruited by his commanding officers ( Dennis Quaid and Esai Morales, competing to see who can be the most gruffly macho) to lead a mission to retrieve a downed pilot in the wilderness. It’s there that they encounter the titular alien creation, who looks like a massive Roomba with legs. And the invader is definitely not friendly, throwing off a barrage of killer rays that blast the men to smithereens. The film’s first half largely features montages of the sort of hardcore training exercises — including walking at the bottom of a pool while carrying heavy weights — that Pete Hegseth probably uses to lull himself to sleep. But all the grunting, grimacing and flexing on display is merely a prelude to the main action, in which 81 and his fellow soldiers — who include “109” (Jack Patten), “7” (Stephan James) and “57” (Daniel Webber) — fight for their lives. It’s just as well the characters don’t have names, since they’re largely indistinguishable from each other. Director Patrick Hughes stages the viscerally forceful action scenes with undeniable skill, having garnered the relevant experience with his previous helming of such films as The Expendables 3 and The Hitman’s Bodyguard and its sequel . There are some terrifically staged sequences, including a hair-raising one involving traversing rapids with an overhead rope, for which the stunt performers and Ritchson, who clearly did many of his own stunts, deserved extra pay. There’s also no shortage of pyrotechnics, with the frequent explosions serving as useful reminders to viewers to stop folding their clothes and resume looking at the screen. The film’s R rating is well-deserved thanks to the profusion of burnt and dismembered bodies on view in the alien machine’s wake. Unfortunately, the screenplay by Hughes and co-writer James Beaufort leaves much to be desired, with lines like “Help me with 7!” sounding like a student imploring a classmate to give him the answer to a difficult test question. Not to mention this exchange during a particularly tense moment: “Wait, you mean it’s from another planet?” one of the soldiers asks. “Well, it sure as shit ain’t from this one,” 81 replies. Not even Stallone or Schwarzenegger could sell dialogue like that. Ritchson, whose massive bulk qualifies as a special effect itself, displays his usual charisma, but the one-note nature of the proceedings doesn’t give him the opportunity to do much more than look physically or emotionally anguished. Although he does appear very much at home behind the wheel of a massive excavator with which his character battles the alien machine in the climactic sequence. The film finishes on the sort of gung-ho patriotic note — complete with soldiers running in slow-motion with their rifles in hand — that could easily wind up in an American military recruitment commercial. They’ll probably leave out the fact that the film was shot primarily in Australia. Full credits Production: Emu Creek Pictures, Hidden Pictures, Huge Films, Lionsgate, Range Media Partners Distributor: Netflix Cast: Alan Ritchson, Blake Richardson, Keiynan Lonsdale, Daniel Webber, Jai Courtney, Esai Morales, Stephan James, Dennis Quaid Director: Patrick Hughes Screenwriters: Patrick Hughes, James Beaufort Producers: Todd Lieberman, Alexander Young, Patrick Hughes, Greg McLean, Rich Cook Executive producer: Valerie Bleth Sharp Director of photography: Aaron Morton Production designer: Enzo Iacono Editor: Andy Canny Composer: Dmitri Golovko Costume designer: Cappi Ireland Casting: Deanna Brigidi, Andrea Bunker, Amanda Mitchell Rated R, 1 hour 46 minutes THR",0,2026-03-06 09:50:29
19,https://variety.com/2026/film/global/the-heart-is-a-muscle-generational-trauma-healing-1236673243/,"‘The Heart Is a Muscle’ Director on Family, Fatherhood and Moving From Generational ‘Trauma’ to ‘Healing’ in South African Oscar Entry",Variety,2026-03-06T07:29:42,6074,"Mar 5, 2026 11:29pm PT ‘The Heart Is a Muscle’ Director on Family, Fatherhood and Moving From Generational ‘Trauma’ to ‘Healing’ in South African Oscar Entry By Christopher Vourlias Plus Icon Christopher Vourlias Latest ‘The Heart Is a Muscle’ Director on Family, Fatherhood and Moving From Generational ‘Trauma’ to ‘Healing’ in South African Oscar Entry 2 hours ago Both Worlds, Freeli Films Launch First U.S.-Africa Co-Production Partnership for Microdramas, With Taye Diggs Set to Star (EXCLUSIVE) 1 day ago Thessaloniki Agora Head on How ‘Resilience,’ ‘Investment’ in Future Power Documentary Festival’s Industry Arm Through ‘Difficult Times’ 2 days ago See All ""The Heart Is a Muscle"" (Courtesy of Joburg Film Festival) After launching last year in Berlin and being tapped as South Africa’s official entry for the international feature Oscar race, “The Heart Is a Muscle” comes home to South Africa this week, where it screens out of competition at the Joburg Film Festival alongside a nationwide theatrical release on March 6. The film was written and directed by debut director Imran Hamdulay and produced by Hamdulay, Brett Michael Innes, Khosie Dali, Lesley-Ann Brandt and Adam Thal. Starring Keenan Arrison and Melissa De Vries, alongside Loren Loubser, Dean Marais, Ridaa Adams, Danny Ross, Troy Paulse and Lincoln Van Wyk, it’s being repped globally by MMM Film Sales. Related Stories 'A Child of My Own' Review: Stylized Drama and Documentary Scrap Over the Truth In an Unhappy Maternity Tale 'Nina Roza' Review: An Eerily Doubled, Intricately Mirrored and Deeply Moving Reflection on Immigrant Identity The story begins with a scene that taps into every parent’s worst fear, when a five-year-old child wanders off from a family birthday party. A desperate search for the boy ensues, and when he turns up unharmed several hours later — playfully assuming it was all a game of hide and seek — he’s angrily reproached by his father, Ryan, played by Arrison. The violence of his reaction shocks both Ryan and the other partygoers, setting off a series of events that force him to reckon with his past and make peace with his own buried trauma. Popular on Variety Inspired by a similar event in Hamdulay’s own life, “The Heart Is a Muscle” is a moving exploration of fatherhood, intergenerational trauma and healing. It’s a film that the director said was sparked by his own journey into adulthood. The son of a prominent anti-apartheid activist who’s now considering starting a family of his own, Hamdulay said the movie took shape as he increasingly found himself reflecting on “what my dad passed on to me, and how am I going to live that and live through that as a father.” “Thinking about intergenerational passings, I kept reluctantly coming back to this word trauma. It’s just something that didn’t quite sit inside me in a way that was constructive. It kept feeling like a weight,” Hamdulay told Variety . “I really feel like what I also received from his legacy, and the memories he passed on, was a lot of healing and a lot of strength. I wanted to start talking to myself in ways of generational healing. What does that mean?” “The Heart Is a Muscle” is set in the Cape Flats, on the outskirts of Cape Town, an area largely comprised of Black and Colored communities that were resettled there during the apartheid era. The forced violence of segregation and displacement left behind a painful legacy, with poverty, crime and gang violence widespread, though Hamdulay says he was eager to rewrite that narrative — particularly with the proliferation of gang-related crime dramas about the Cape Flats that have been made in recent years. “I come from this area. These are people I know. It’s communities I know,” he said. “And there’s always been a deep frustration with the lack of nuance and complexity that is offered to not just the spaces, but the history, the legacy, the colors, the textures, and more importantly, the people.” Since debuting in the Panorama strand at last year’s Berlinale, where it won the Ecumenical Jury Prize, “The Heart Is a Muscle” has had a healthy festival run — most recently playing at Santa Barbara — yet Hamdulay insists that “hands down, the most rewarding and moving thing for me was when we showed the film in the community where it was made.” “I was watching the community see themselves on screen, within the complexities that they allow themselves to see inside of themselves and the people around them,” he said. “It was really rewarding in the most beautiful way.” The director’s next feature, set to begin production later this year, is an adventure story centered around four kids “running around the neighborhood, causing mischief,” he said, offering a Cape Flats spin on films like “Goonies” and “Where the Wild Things Are.” “I’d love for young teenagers to watch a film so they can see themselves on screen and be like, ‘Oh man, you know what? One day I’d like to make films,’” he said. “There’s a power in seeing yourself on screen.” The Joburg Film Festival runs March 3 – 8. ‘At the Sea’ Review: Amy Adams’ Commitment Can’t Save a Recovery Drama as Immediately Forgettable as Its Title ‘Who Killed Alex Odeh?’ Review: A Modest True Crime Doc Where the Answers Are Out in the Open ABC’s ‘RJ Decker’ Is an Off-Kilter Crime Drama With a Florida Vibe: TV Review ‘Amadeus’ Review: Jefferson Mays Shines as a Funny and Frothing Salieri in a Gorgeously Mounted, Essential Revival at the Pasadena Playhouse ‘Joe’s College Road Trip’ Review: Tyler Perry Lets Out His Inner Bad Grandpa in a Hilariously Profane Buddy Comedy ‘The Education of Jane Cumming’ Review: A Compelling Dramatization of the True Story Behind ‘The Children’s Hour’ Loading comments... More From Our Brands Rolling Stone Late-Night Hosts Celebrate Trump’s Firing of Kristi Noem: ‘Deport Her to El Salvador’ Robb Report Jack Daniel’s New McLaren F1 Collab Is a High Octane Version of This Tennessee Whiskey Sportico NCAA Asks State Supreme Court to End Chambliss’ Ole Miss Career WWD Designers Experiment With Materials at LVMH Prize Showroom",0,2026-03-06 09:50:18
20,https://variety.com/2026/film/news/amazon-mgm-studios-buddy-marini-japan-1236680798/,"Amazon MGM Studios Taps Warner Bros. Discovery, Hulu Veteran Buddy Marini to Head Japan",Variety,2026-03-06T06:50:38,3410,"Mar 5, 2026 10:50pm PT Amazon MGM Studios Taps Warner Bros. Discovery, Hulu Veteran Buddy Marini to Head Japan By Naman Ramachandran Plus Icon Naman Ramachandran Latest Amazon MGM Studios Taps Warner Bros. Discovery, Hulu Veteran Buddy Marini to Head Japan 2 hours ago ‘Paddington,’ ‘Into the Woods’ Lead 2026 Olivier Awards Nominations 20 hours ago Timothée Chalamet Kicks Off Asia Tour as ‘Marty Supreme’ Hits $172 Million Globally, Eyes $200 Million Milestone 22 hours ago See All Amazon MGM Studios Amazon MGM Studios has hired Buddy Marini to serve as its top executive in Japan , effective March 6. Based in Tokyo, he will drive the slate of local originals spanning film, TV series and anime, build out the studio’s network of creators and production partners, and work with global teams to bring Japanese stories to wider audiences. He reports to Nicole Clemens, who oversees international operations for Amazon MGM Studios and Prime Video. Related Stories ‘Salvation’ Review: The Roots of Violence Are Explored in Emin Alper’s Tense, Atmospheric Study of a Massacre 'In a Whisper' Review: A Funeral Uncovers Buried Secrets in Leyla Bouzid’s Emotional Family Mystery Marini’s career spans more than 25 years across entertainment, media and digital content in Japan and Asia. He comes to the role from Warner Bros. Discovery Japan, where as managing director he ran the full scope of the business – streaming, original production, pay-TV and licensing – with a 300-person team under his remit. Earlier in his career he launched manga platform Mangamo, ran Hulu Japan as CEO, and led Avex Asia out of Hong Kong. Popular on Variety “Japan continues to be a key territory for Prime Video,” said Clemens. “Our customers in Japan have an insatiable appetite for locally produced series and movies. With his deep understanding of Japanese entertainment, proven track record in streaming and content production, and strong relationships with key creative and distribution partners, Buddy is perfectly positioned to drive Amazon MGM Studios’ growth and success in Japan.” “I’m thrilled to join Amazon MGM Studios at such an important moment for storytelling and audience engagement in Japan,” Marini added. “I’ve spent my career working alongside creators, partners, and teams across film, television, manga and anime, and streaming, and I’m passionate about helping great stories reach their fullest audience potential.” Guy Ritchie’s ‘Young Sherlock’ Delivers a Perfect Origin Story: TV Review ‘Soumsoum, the Night of the Stars’ Review: Mahamat-Saleh Haroun’s Latest Is a Desert Parable That Loses Its Way In a Thrilling U.S. Headlining Debut at the Troubadour, Sienna Spiro Shows Why She’s About to Become the World’s Next Pop Vocal Superhero: Concert Review Steve Carell’s HBO Comedy ‘Rooster’ Is Dated and Uninspired: TV Review ‘The Bride!’ Review: Jessie Buckley and Christian Bale Are Magnetic Monsters in Maggie Gyllenhaal’s Lumbering Punk Horror Trip Dove Cameron Enchants in Prime Video’s Surprising Erotic Thriller ’56 Days’: TV Review Loading comments... More From Our Brands Rolling Stone Jennifer Lopez, David Guetta Team Up for Anthemic Single ‘Save Me Tonight’ Robb Report Jack Daniel’s New McLaren F1 Collab Is a High Octane Version of This Tennessee Whiskey Sportico NCAA Asks State Supreme Court to End Chambliss’ Ole Miss Career WWD Designers Experiment With Materials at LVMH Prize Showroom",0,2026-03-06 09:50:19
