id,url,title,source,publication_date,text_length,full_text,is_duplicate,created_at
6,https://deadline.com/2026/02/iranian-body-iifma-endorses-attacks-islamic-republic-1236739750/,Iranian Film Body IIFMA Endorses Targeted Actions Against Islamic Republic Government While Calling For Protection Of Civilian Population,Deadline,2026-02-28T22:58:34,4939,"Skip to main content By Melanie Goodfellow Melanie Goodfellow Senior International Film Correspondent @mel_goodfellow More Stories By Melanie U.S. And Israel Launch Strikes On Iran; Trump Says Reports Of Iran Supreme Leader’s Death Are “Correct” – Update YouTube Channel Creator & Manager Logicomix Strikes Deal With Sony Pictures France Césars 2026 Winners List: Carine Tardieu’s Family Drama ‘The Ties That Bind Us’ Wins Best Film View All February 28, 2026 2:58pm People look into the skies in Tehran as the U.S. and Israel launch missiles on strategic sites across the country Getty Images The Iranian Independent Filmmakers Association ( IIFMA ) has endorsed targeted attacks on government officials in Iran in the wake of the launch of a joint U.S. and Israel military operation against the country’s hardline Islamic Republic regime on Saturday. The dissident film body said in a statement that Iran’s “defenseless citizens” had had “no option but to seek urgent humanitarian intervention from the international community” in the wake of their government’s brutal crackdown on pro-democracy protests in January. As many as 30,000 people are believed to have been killed by officers of the Islamic Revolutionary Guard Corps (IRGC), who fired indiscriminately into crowds as they sought to disband pro-democracy demonstrations on January 8 and 9. Watch on Deadline Related Stories News Iran's Supreme Leader ""Dead,"" Trump Posts; Iran Says Not True As U.S. & Israeli Strikes Continues News U.S. And Israel Launch Strikes On Iran; Trump Says Reports Of Iran Supreme Leader's Death Are ""Correct"" - Update “For decades this regime has squandered national wealth on nuclear and military infrastructure while imposing harsh sanctions that have devastated the populace,” said IIFMA, which was created by exiled Iranian cinema professionals in the wake of the 2022 Woman Life Freedom movement, sparked by the killing of Mahsa Amini in police custody. “Its recent cowardly attacks on neighboring countries reveal its weakening grasp on power,” it added, referring to retaliatory Iranian missile attacks on Saturday on a number of Gulf states including Qatar, the United Arab Emirates, Bahrain and Saudi Arabia. “In this context, IIFMA calls upon the international community to uphold Iran’s sovereignty and to prioritize the protection of tens of millions of citizens held hostage by the Islamic regime. We advocate for targeted actions against government officials and oppressive agents while avoiding harm to innocent civilians. It is essential to put an end to this archaic cycle of patriarchal violence.” The body also raised its concern “for the lives of all prisoners, especially those involved in the ongoing Revolution”. “We are alarmed by the regime’s deceitful tactics, which may lead to a repeat of the Cinema Rex tragedy, where blame for civilian deaths is shifted onto foreign actors,” it said. The infamous Cinema Rex arson attack in the city of Abadan in southwest Iran in August 1978, in which Islamic extremists barred the doors of the theater and set it alight, killing up to 470 people, is seen as a trigger for the Iranian Revolution of 1979 in which the Islamic Regime come to power. It has since been proved it was the work of a quartet of Islamic revolutionaries, but claims at the time that it was a false flag operation orchestrated by the SAVAK secret police agents of Shah Mohammad Reza Pahlavi, turned public opinion and helped fuel the revolution. IIFMA’s statement was released towards the end of a fast-moving day in which the U.S. and Israel launched hundreds of missiles on strategic sites across Iran , following a pre-recorded video message from Trump that the operation was aimed at stopping the country’s nuclear campaign and bringing about regime change. Later in the day, Trump confirmed reports out of Israel that Supreme Leader Ayatollah Ali Khamenei had been killed after his Tehran compound was pounded by at least 30 strikes, although Iranian officials have denied his death. The surprise military operation has provoked a mixed response with anger in some quarters at home in the U.S. over the fact Trump launched the operation without consulting Congress, and concern worldwide that the situation could escalate out of control and wreak death and destruction across the Middle East. “In these challenging times, it is only through united resistance against theocracy that we can hope to end violence and forge a path toward lasting peace and freedom. True peace is not merely the absence of conflict; it is built upon the foundation of genuine liberty and dignity for all,” said IIFMA. Paramount And WBD Reveal Details Of $110B Deal: Latest News + Analysis ‘Scream 7’ Is Slaying: Pic Eyes Franchise-Best $60M+ In Opening Frame ‘Sinners’ ‘One Battle’ & ‘KPop Demon Hunters’ Win: Full List On The Set Of The ‘Peaky Blinders’ Movie With Cillian Murphy & The Rest Of The Gang Read More About: Comments",0,2026-03-01 02:59:16
28,https://www.hollywoodreporter.com/music/music-news/brit-awards-2026-olivia-dean-rules-the-night-with-artist-and-album-of-the-year-wins-1236518297/,BRIT Awards 2026: Olivia Dean Rules the Night With Artist and Album of the Year Wins,Hollywood Reporter,2026-02-28T22:58:33,4231,"× Skip to main content By Lily Ford Plus Icon Lily Ford @lilyfordtweets Follow Sign Up View All February 28, 2026 2:58pm Olivia Dean accepts Best Pop Act Award on stage during The BRIT Awards 2026. Gareth Cattermole/Getty Images The evening belonged to Olivia Dean at the 2026 BRIT Awards . This year, the U.K.’s biggest night for music was held at Manchester’s recently opened Co-op Live Arena, where comedian Jack Whitehall played host for the sixth time. One of the most anticipated performances heading into the BRITs was Harry Styles ‘, who delighted attendees with his first live performance of single “Aperture” from the upcoming album Kiss All The Time. Disco, Occasionally . Unsurprisingly, it was a hugely successful event for the Grammy-winning Dean, who continued her storming run of form with BRIT Award wins for the coveted artist of the year award and album of the year, as well as best pop act and, alongside Sam Fender, song of the year for their hit “Rein Me In.” Her popularity has skyrocketed over the past year following the release of her record The Art of Loving , which includes hits “Man I I Need” and “Nice to Each Other.” Related Stories Movies 'Awards Chatter' Pod: Joachim Trier on Oscar-Contending 'Sentimental Value,' His Oslo Trilogy and Why ""Tenderness Is the New Punk"" NEXT BIG THING Singer Erin LeCount on 'Pareidolia,' Giving Teens A Space to be ""Hysterical"" and Those 'Heated Rivalry' Edits “Making this album has changed my life,” Dean told fans at the Co-op Live while accepting the BRIT Award for album of the year from Wicked star Jeff Goldblum. She became visibly emotional as she added: “This album is about love and loving each other in a world that feels loveless right now.” In the international song of the year category, Bruno Mars and Rosé won for “APT.” British rock band Wolf Alice was named group of the year, while Spanish singer-songwriter Rosalia nabbed international artist of the year after fans went wild for “Lux” — and, in one of show’s more comical moments, gave Oasis frontman Liam Gallagher a shoutout while Whitehall made his way around the celebrity crowd in front of the stage. The late Black Sabbath legend Ozzy Osbourne was posthumously awarded the Lifetime Achievement BRIT. Take a look at the full list of winners at the 2026 BRIT Awards below. Song of the Year “Blessings,” Calvin Harris & Clementine Douglas “The Days,” Chrystal (The NOTION remix) “Defying Gravity,” Cynthia Erivo ft Ariana Grande “Azizam,” Ed Sheeran “Victory Lap,” Fred Again, PlaqueBoyMax, and Skepta “Survive,” Lewis Capaldi “Messy,” Lola Young “Nice to Meet You,” Myles Smith “Man I Need,” Olivia Dean “Where Is My Husband?” RAYE “Rein Me In,” Sam Fender ft Olivia Dean – WINNER “Family Matters,” Skye Newman Group of the Year The Last Dinner Party Pulp Sleep Token Wet Leg Wolf Alice – WINNER Breakthrough Artist of the Year Barry Can’t Swim EssDeeKid Jim Legxacy Lola Young – WINNER Skye Newman International Song of the Year “Ordinary,” Alex Warren “Pink Pony Club,” Chappell Roan “No Broke Boys,” Disco Lines and Tinashe “Sailor Song,” Gigi Perez “Golden,” HUNTR/X “Die With A Smile,” Lady Gaga and Bruno Mars “Love Me Not,” Ravyn Lenae “APT,” Bruno Mars and Rosé – WINNER “Manchild,” Sabrina Carpenter “Undressed,” SOMBR “The Fate of Ophelia,” Taylor Swift International Group of the Year Geese – WINNER HAIM Huntr/X Tame Impala Turnstile International Artist Bad Bunny Chappell Roan CMAT Doechii Lady Gaga Rosalia – WINNER Sabrina Carpenter Sombr Taylor Swift Tyler, The Creator Artist of the Year Dave Fred Again Lily Allen Jade Little Simz Lola Young Olivia Dean – WINNER Pink Pantheress Sam Fender Self-Esteem Album of the Year Dave, The Boy Who Played the Harp Lily Allen, West End Girl Olivia Dean, The Art of Loving – WINNER Sam Fender, People Watching Wolf Alice, The Clearing Pop Act JADE Lily Allen Lola Young Olivia Dean – WINNER RAYE Alt/Rock Act Blood Orange Lola Young Sam Fender – WINNER Wet Leg Wolf Alice Hip-hop/Grime Act Central Cee Dave – WINNER Jim Legxacy Little Simz Loyle Carner Dance Act Calvin Harris and Clementine Douglas FKA twigs Fred Again, PlaqueBoyMax, and Skepta – WINNER PinkPantheress R&B Act Jim Legxacy KWN Mabel Sasha Keeble SAULT – WINNER THR",0,2026-03-01 02:59:42
21,https://variety.com/2026/music/news/sombr-altercation-at-brit-awards-staged-rep-confirms-1236675443/,"Sombr Altercation at Brit Awards Was Staged, Rep Confirms",Variety,2026-02-28T22:56:27,3354,"Feb 28, 2026 2:56pm PT Sombr Altercation at Brit Awards Was Staged, Rep Confirms By Steven J. Horowitz Plus Icon Steven J. Horowitz Senior Music Writer speriod Latest Sombr Altercation at Brit Awards Was Staged, Rep Confirms 4 hours ago When We Were Young Festival on Hiatus for 2026, Will Return Next Year in Las Vegas 5 hours ago ‘KPop Demon Hunters’ Singers EJAE, Audrey Nuna and Rei Ami Perform ‘Golden’ at BRIT Awards 6 hours ago See All Gareth Cattermole/Getty Images Sombr was mid-performance at the Brit Awards when a random man bumrushed the stage and pushed the singer off the platform, leaving him stunned — only it was all planned, says his rep. The singer-songwriter, who was nominated for international artist and international song, was at the end of his smash single “Undressed” when a man joined him on the podium and shoved him hard. Security guards aggressively removed the man from the stage, and Sombr returned to the microphone to segue into his next song. Related Stories KLOS-FM Radio Host Uncle Joe Benson Dies at 76 O que fizeram com o meu twink Sombr? #BRITs pic.twitter.com/cO3UShaQHX — Music Feed (@canalmusicfeed) February 28, 2026 Shortly after the performance came to a close, Sombr’s rep confirmed to Variety that the whole thing was part of the act. Fans were already split online over whether the incident was staged or real. Naysayers noticed that the offender was wearing a shirt that read “Sombr is a homewrecker” — a nod to his latest single “Homewrecker,” which some claimed was a dead giveaway. But others weren’t necessarily convinced it was a stunt, considering how hard he was pushed and how additional security guards came to his rescue. Popular on Variety Brits host Jack Whitehall remarked on the incident after Sombr’s performance concluded. “Such a shame we didn’t have the security ready,” he said. The incident took place just days after Britain’s BAFTA Awards last Sunday, when John Davidson, the Scottish Tourette’s syndrome activist and real-life inspiration for the film “I Swear,” disrupted that ceremony with an outburst of racial slurs that occurred as “Sinners” stars Michael B. Jordan and Delroy Lindo were onstage. “I can’t begin to explain how upset and distraught I have been as the impact from Sunday sinks in,” Davidson told Variety earlier this week. Whitehall made a joking reference to that incident — which was not bleeped from the initial BAFTA broadcast and was audible to viewers — at the top of the Brits, saying “We’ve got the best in the business on the bleep button.” Sombr is coming off a red-hot year that saw his various singles “Undressed,” “Back to Friends” and “12 to 12” impact the charts. He recently performed at the Grammy Awards, where he was nominated for best new artist alongside Addison Rae, Alex Warren, the Marías, Leon Thomas, Lola Young, Katseye and Olivia Dean, who ended up taking home the award. Can New Disney CEO Josh D’Amaro Weather AI, Revitalize ‘Star Wars’ and Marvel and Save the Magic Kingdom? Loading comments... More From Our Brands Rolling Stone Oliver ‘Power’ Grant Died After ‘Courageous’ Battle With Cancer, Wu-Tang Clan Confirms Robb Report How Dusty Pink Became Menswear’s Hottest Color of Spring Sportico Miami of Ohio’s Perfect Hoops Run Sets Table for New $281M Arena WWD Black and White Style Is Trending on NAACP Awards 2026 Red Carpet",0,2026-03-01 02:59:34
22,https://variety.com/2026/shopping/news/how-to-watch-naacp-awards-live-online-streaming-free-1236675438/,How to Watch the NAACP Image Awards Live Online,Variety,2026-02-28T21:59:41,2445,"If you purchase an independently reviewed product or service through a link on our website, Variety may receive an affiliate commission. The NAACP is bringing its Image Awards to the widest audience yet — and cord-cutters have plenty of ways to tune in. The 57th NAACP Image Awards air live on Saturday, Feb. 28, 2026 at 8 p.m. ET/ 5 p.m. PT, with the main telecast broadcasting on BET. The show is also simulcast on CBS (along with other Paramount-owned outlets), meaning the entire event will stream live on Paramount+. Related Stories Ed Helms and Nat Wolff Join Rachel Zegler in Comedy Drama 'She Gets It From Me' Seth Rogen Pays Tribute to Catherine O'Hara at DGA Awards: Hails 'Studio' Co-Star as 'Utter Genius' and 'Nicest Person' STREAM LIVE ON PARAMOUNT+ $8.99/Month The other best option for viewers streaming live online without cable, the cleanest route is a live TV streaming bundle that carries BET and/or your local CBS station, including services such as DirecTV , currently offering a free trial ), Hulu + Live TV and Fubo TV . One of the most affordable platforms is Sling TV, whose $5 day-passes are a great option for streaming one-time events without the monthly comittment. STREAM LIVE ON DIRECTV Free Trial Deon Cole returns as host, with this year’s ceremony set to spotlight major honorees across dozens of categories. Leading the nominations are “Sinners,” with 18 nods, and “Bel-Air,” with seven nods. The nominees for Entertainer of the Year, the show’s signature category, include Cynthia Erivo, Doechii, Kendrick Lamar, Michael B. Jordan and Teyana Taylor. As always, several awards will also be presented during the ceremony’s telecast. This year’s honorees include Colman Domingo who will be presented with the President’s Award during the telecast; Viola Davis, with the Chairman’s Award; A$AP Rocky, with the Vanguard Award for fashion, presented at the annual fashion show on Friday, Feb. 27; and Rev. Dr. Jamal-Harrison Bryant, with the prestigious Mildred Bond Roxborough Social Justice Impact Award at the Creative Honors on Thursday, Feb. 26. Stream the NAACP Awards live online tonight here . Loading comments... More From Our Brands Rolling Stone War Is Peace: Trump’s Regime-Change Reversal Robb Report How Dusty Pink Became Menswear’s Hottest Color of Spring Sportico Miami of Ohio’s Perfect Hoops Run Sets Table for New $281M Arena WWD Black and White Style Is Trending on NAACP Awards 2026 Red Carpet",0,2026-03-01 02:59:35
29,https://www.hollywoodreporter.com/movies/movie-news/leonardo-dicaprio-actor-awards-2026-1236518191/,Leonardo DiCaprio to Miss Actor Awards Due to Filming Martin Scorsese’s ‘What Happens at Night’,Hollywood Reporter,2026-02-28T21:31:02,1999,"× Skip to main content By Lexi Carson Plus Icon Lexi Carson Associate Editor View All February 28, 2026 1:31pm Leonardo DiCaprio Stuart C. Wilson/Getty Images Leonardo DiCaprio is not attending the 32nd annual Actor Awards (formerly known as a Screen Actors Guild “SAG” Awards ) on Sunday night, The Hollywood Reporter has learned. DiCaprio won’t be able to attend the ceremony due to scheduling conflicts, as he’s filming the upcoming Martin Scorsese film, What Happens at Night, in Europe and starring alongside Jennifer Lawrence. The film is an adaptation of the ghost novel of the same name, which follows a married couple who travel to Europe to adopt a baby and stay in a deserted hotel filled with eccentric characters. It marks the seventh feature film that DiCaprio and Scorsese have worked on together, and the first onscreen collaboration for the actress with Scorsese as director. Related Stories TV How to Watch the 2026 NAACP Image Awards Online Movies ACE Eddie Awards for Editing: 'One Battle After Another,' 'Sinners' Win Top Prizes At the 2026 Actor Awards, the Oscar winner is nominated for two awards for his work in Paul Thomas Anderson’s One Battle After Another , including outstanding performance by a male actor in a leading role and outstanding performance by a cast in a motion picture. For best male actor, he’s nominated alongside Timothée Chalamet for Marty Supreme, Ethan Hawke for Blue Moon , Michael B. Jordan for Sinners and Jesse Plemons for Bugonia. While the One Battle After Another crew’s competition for best cast performance is Frankenstein, Hamnet, Marty Supreme and Sinners. DiCaprio won an Actor Award for The Revenant in 2016. This year, the actor is also nominated for an Oscar for best actor . He previously won the category in 2016 for The Revenant. The Actor Awards is available to stream live on Netflix on Sunday from 8-10 p.m. ET / 5-7 p.m. PT. It will be held at the Shrine Auditorium & Expo Hall in Los Angeles with Kristen Bell as the host. THR",0,2026-03-01 02:59:43
30,https://www.hollywoodreporter.com/movies/movie-news/awards-chatter-pod-joachim-trier-sentimental-value-1236517803/,"‘Awards Chatter’ Pod: Joachim Trier on Oscar-Contending ‘Sentimental Value,’ His Oslo Trilogy and Why “Tenderness Is the New Punk”",Hollywood Reporter,2026-02-28T21:27:07,3032,"× Skip to main content By Scott Feinberg Plus Icon Scott Feinberg Executive Editor of Awards ScottFeinberg Follow Sign Up View All February 28, 2026 1:27pm Joachim Trier Juan Naharro Gimenez/WireImage Joachim Trier , the guest on this episode of The Hollywood Reporter ‘s Awards Chatter podcast, which was recorded in front of film students at Chapman University, is one of the world’s greatest working filmmakers. A 51-year-old Danish-Norwegian writer and director, he has been described by the New York Times as “sensationally talented,” “a meticulous craftsman,” and “incapable of making an ugly image.” Trier was, until recently, best known for his “Oslo trilogy” — comprising 2006’s Reprise , 2011’s Oslo, August 31st and 2021’s The Worst Person in the World — each installment of which he directed and co-wrote with Eskil Vogt ; is set in Norway’s capital; explores memory, identity and time; centers on upper-middle-class, intelligent, but self-doubting protagonists; and stars the actor Anders Danielsen Lie . Related Stories NEXT BIG THING Singer Erin LeCount on 'Pareidolia,' Giving Teens A Space to be ""Hysterical"" and Those 'Heated Rivalry' Edits Movies Director Alexandre Trudeau Wades Into Berlin Fest's Artistic Freedom Debate: ""There's Politics Everywhere"" Four years after The Worst Person in the World was recognized with the Cannes Film Festival’s best actress prize for leading lady Renate Reinsve (who also appeared briefly in Oslo, August 31st ) and with Oscar nominations for best international feature and best original screenplay, Trier returned with Sentimental Value , a film about the complicated relationship between two sisters who were raised together in the same old home in Oslo (Reinsve and Inga Ibsdotter Lilleaas ) and their filmmaker father who left them and that home when they were young ( Stellan Skarsgård ) but returned to it following the death of their mother. Sentimental Value had its world premiere at last May’s Cannes Film Festival, where it received a 19-minute standing ovation and was awarded the festival’s Grand Prize. It subsequently won European Film Awards for best European film, director and screenplay and the BAFTA Award for best film not in the English language. And it was nominated for the Golden Globes for best picture (drama), director, screenplay and non-English-language film; the BAFTA Awards for best film, director and original screenplay; and the Critics Choice Awards for best picture, director and original screenplay. Meanwhile, still pending for the film is a nomination for the top Producers Guild Award, to say nothing of nine Oscar nominations — a tally exceeded by only three non-English-language films ever — including best picture, international feature and film editing; one for each of the film’s four of its principal stars; and two for Trier, best director and original screenplay, the latter shared with Vogt. For an in-depth discussion of the filmmaker’s life, films and worldview, be sure to check out the audio near the top of this post! THR",0,2026-03-01 02:59:44
