id,url,title,source,publication_date,text_length,full_text,is_duplicate,created_at
3,https://deadline.com/2026/03/bbc-damilola-taylor-doc-john-boyega-optomen-1236765129/,John Boyega To Feature In BBC Doc Exploring Tragic Death Of Damilola Taylor,Deadline,2026-03-25T09:00:00,3544,"Skip to main content Dismiss News Banner Breaking News Stephen Colbert Set To Write Next ‘Lord Of The Rings’ Movie After Forthcoming ‘The Hunt For Gollum’ Read the full story By Max Goldbart Max Goldbart International TV Co-Editor @Goldbart1 More Stories By Max John Boyega To Feature In BBC Doc Exploring Tragic Death Of Damilola Taylor ‘When Soccer Came To America’: TNT Sports Doc To Explore Pelé & George Best’s Impact On The Beautiful Game In The States BAFTA TV Analysis: ‘Adolescence’ Gets Set For Awards Season Swan Song View All March 25, 2026 2:00am John Boyega Optomen EXCLUSIVE: Star Wars star John Boyega will speak for the first time about being one of the last people to see Damilola Taylor alive in a BBC documentary about the tragic death of the 10-year-old. Taylor was fatally stabbed in 2000 in a stairwell in Peckham, South East London, just metres from his home. Boyega, who also grew up in Peckham, will take part in Damilola Taylor: The Last 24 Hours [working title ], speaking about what it was like to be one of the last people to see him alive, sharing the fear and uncertainty that followed in the aftermath of his death. The Force Awakens and Attack the Block star is joined by other close friends and family members who reveal the events that led to Taylor’s death and talk for the first time about the impact his tragic murder has had in shaping their lives. Related Stories News Richard Gadd's New Show 'Half Man' Gets HBO & BBC Premiere Dates News 'Young Sherlock' & 'Get Millie Black' Producer Developing Two New Dramas With Booker Prize-Winner Marlon James As It Bolsters Team Taylor’s death sent shockwaves through Britain and became a defining moment in the national conversation around the horrors of knife crime. A previous BBC drama about the terrible events, Damilola: Our Loved Boy, won two BAFTAs including for Sinners star Wunmi Mosaku. Watch on Deadline Directed by double Grierson Award-winning filmmaker Alex Thomas ( Bibaa & Nicole: Murder in the Park ) and produced by At Home With the Furys maker Optomen , the film retraces Taylor’s final day – charting his movements and examining the environment and pressures shaping the lives of young people around him at that time. Jack Bootle, the BBC’s Head of Commissioning, Specialist Factual, said: “The killing of Damilola Taylor shocked the UK and changed the lives of those closest to him forever. This film traces their stories – and honours Damilola’s memory through the voices of those who knew him best.” Thomas added: “Damilola’s story has never been told through the experience of the young people who were living it at the time. This film shows what it meant to grow up in an environment shaped by fear, bullying and the need to protect yourself — and how those pressures influenced the choices people made. Twenty-five years on, those experiences still stay with them, and many of those pressures still exist for young people today.” Damilola Taylor: The Last 24 Hours was commissioned by Bootle. The project was developed by Ruby Rookes. Executive producer is Becky Cadman, creative directors are Nick Hornby and Tina Flintoff, and producer is Nelson Adeosun. All3Media International will handle global distribution. Disney’s $1B Investment In OpenAI DOA As Sam Altman Pulls Plug On Sora Netflix Sets ‘13 Going On 30′ Reboot With Emily Bader & Logan Lerman; Garner An EP Hannah Berner & Paige DeSorbo Lead Comedy Series In Works At Netflix ‘John Wick’ Spinoff About Blind Assassin Caine Locked & Loaded For Start Read More About: Comments",0,2026-03-25 10:00:02
33,https://variety.com/2026/film/news/kevin-costner-jake-gyllenhaal-honeymoon-with-harry-shoot-1236698727/,"Kevin Costner, Jake Gyllenhaal to Film ‘Honeymoon With Harry’ in Queensland",Variety,2026-03-25T08:50:38,4146,"Mar 25, 2026 1:50am PT Kevin Costner, Jake Gyllenhaal to Film ‘Honeymoon With Harry’ in Queensland By Naman Ramachandran Plus Icon Naman Ramachandran Latest Oscar Winner Guneet Monga Kapoor-Led Women in Film India Partners With Jio Studios to Back Indian Producers at Cannes (EXCLUSIVE) 23 minutes ago Webtoon’s Studio N CEO Says Western Industry Is Still Learning the Power of Webcomic IP: ‘Every Time We Have a Hit Project, Our Job Gets Easier’ 3 hours ago ‘Indian Institute of Zombies’ Marks Kuku’s Big-Screen Debut With Campus Horror Comedy (EXCLUSIVE) 4 hours ago See All Azzato Photography/Momodu Mansaray Kevin Costner and Jake Gyllenhaal are set to begin shooting “ Honeymoon With Harry ” in Queensland , Australia, with production scheduled to kick off in April in Brisbane and The Whitsundays. The Amazon MGM Studios feature, adapted from a novel by Bart Baker, is directed by Glenn Ficarra and John Requa and scripted by Dan Fogelman, the trio previously united on “Paradise,” “Crazy, Stupid, Love” and “This Is Us.” Sarah Pidgeon is in talks to join the cast. Related Stories Netflix Thriller ‘Firebreak’: Director David Victori Unpacks the Craft Behind the Breakout Hit Jada Pinkett Smith to Reprise 'A Different World' Role in Netflix Sequel Series The emotional dramedy centers on a free-spirited, impulsive man (Gyllenhaal) whose honeymoon plans are thrown into disarray, leaving him stuck navigating an island getaway alongside his fiancée’s guarded, difficult father (Costner). What begins as a collision of personalities gradually gives way to an unlikely connection between the two. Popular on Variety “Queensland has everything we could hope for,” directors Ficarra and Requa said in a statement. “We’re doing Chicago, the Caribbean and everything in between – all within a day’s reach. The crew are great and the weather’s even better.” Producer Mike Karz, whose previous credits include “Valentine’s Day,” “Blended” and “Upgraded,” called Queensland’s locations and natural beauty an ideal fit for the film. “We’re having a great time collaborating with talented local creatives and crew to bring this story to life,” he said. Screen Queensland CEO Jacqui Feeney described the production as the latest chapter in a growing partnership with the studio. “We are delighted to be a trusted partner for Amazon MGM, with our local screen industry providing the high-quality expertise that they can rely on, while our competitive incentives enable them to capitalise on our captivating locations and first-class infrastructure,” she said. The production is estimated to contribute AUD$51 million ($35.6 million) to the Queensland economy and generate 215 jobs. Queensland Arts Minister John-Paul Langbroek highlighted benefits extending beyond the screen sector, noting the downstream impact on construction, catering, transport and accommodation businesses. “Honeymoon With Harry” is produced by Karz for Gulfstream Pictures alongside Jennifer Salke under Sullivan Street Productions, with Fogelman also serving as a producer. The film is supported by the Australian Government through the Location Offset and by the Queensland Government through Screen Queensland’s Production Attraction Strategy. The production joins a string of Amazon MGM titles made in Queensland, including “Balls Up,” “The Bluff,” “Subversion,” “Voltron” and an untitled Mike Thornton project. Neon, Oscar-Winning Studio Behind ‘Parasite’ and ‘Anora,’ in Talks to Sell Stake to Department M (EXCLUSIVE) The Movie Business Has Never Been Harder, So Why Are All These New Distribution Companies Launching? Neon Acquires Worldwide Rights to ‘Clarissa’ Starring Sophie Okonedo, David Oyelowo and Ayo Edebiri, Directed by Filmmakers Arie and Chuko Esiri Neon Buys Ryusuke Hamaguchi‘s Paris-Set ‘All of a Sudden’ Neon Buys Sundance Documentary ‘Once Upon a Time in Harlem’ Following Heated Bidding War Loading comments... More From Our Brands Rolling Stone OpenAI Pulls the Plug on Sora Just Months After Launch Robb Report Russell Crowe Shows Off Toledano & Chan’s Newest Brutalist Watch on TikTok Sportico Monarch Makes First WNBA Investment in Cleveland Team",0,2026-03-25 10:00:35
4,https://deadline.com/2026/03/series-mania-forum-awards-winner-kyrgyzstan-red-pants-1236765159/,Kyrgyzstan’s ‘Red Pants’ Wins Top Series Mania Forum Award,Deadline,2026-03-25T08:35:28,3232,"Skip to main content Dismiss News Banner Breaking News Stephen Colbert Set To Write Next ‘Lord Of The Rings’ Movie After Forthcoming ‘The Hunt For Gollum’ Read the full story By Jesse Whittock Jesse Whittock International TV Co-Editor @WhittockTweets More Stories By Jesse Kyrgyzstan’s ‘Red Pants’ Wins Top Series Mania Forum Award Banijay Enters Microdrama Space With Mockumentary ‘Survival Sisters’ For Finland’s YLE & Trio Of Titles In Iberia HBO Max Developing Pair Of Euro Medical Dramas & Taking Creative Cues From ‘The Pitt’ View All March 25, 2026 1:35am 'Red Pants' creators on stage at Series Mania Series Mania Here’s one of the most notable award wins in a minute: Kyrgyzstan drama Red Pants has won the influential Co-Pro Pitching Sessions event at Series Mania . The show, from Studio Oymo and Human Films, will receive a €50,000 ($58,000) prize after defeating 15 other projects for the award, which was the founding premise of the entire Series Mania conference. Also landing wins at Series Mania are French series R91 , which won the Series Mania Buyers Upfront yesterday, and Canada’s Chachachá! , which took home the SeriesMakers Award, which is handed out in association with Series Mania Institute. Related Stories News Banijay Enters Microdrama Space With Mockumentary 'Survival Sisters' For Finland's YLE & Trio Of Titles In Iberia News HBO Max Developing Pair Of Euro Medical Dramas & Taking Creative Cues From 'The Pitt' Ten-part series Red Pants is an action drama set in late 1970s Soviet Kyrgyzstan. It follows Aisha, a military officer’s daughter, who forms the notorious ‘Red Pants’ first female criminal gang to avenge her father’s death and challenge the oppressive regime. Watch on Deadline Tilek Cherikov is the writer and the producers are Erke Dzhumakmatova for Studio Oymo, Co-Producer Pavel Feldman & Alexander Seliverstov for Human Films. The Co-Pro Pitching Sessions are considered among the most important elements of the Series Mania Forum, and often showcases projects from little-known international drama-producing countries such as Kyrgyzstan. The previous winners have hailed from the likes of Slovakia and Ukraine. R91 becomes the second winner of the Series Mania Buyers Upfront. The thriller series out of France follows nuclear aircraft carrier Charles de Gaulle (R91), which sets sail on a strategic mission, only for crew member to be found dead and another missing. Military investigator Paul Fischer and his second-in-command Helena Duval are rushed aboard to solve the mystery. Next Episode is the producer and SND Groupe M6 has international sales rights. The SeriesMaker Award winner, Chachachá! , is an eight-part series out of Canada from writer-director Alison Fairweather Murray and Nice Picture! producer Jennifer Weiss. The Series Mania Forum continues today and ends tomorrow following the Lille Dialogues sessions, which run throughout the day. Donald Trump & Self-Censorship Report; Co-Pro Winner; Banijay Microdrama Disney’s $1B Investment In OpenAI DOA As Sam Altman Pulls Plug On Sora Netflix Sets ‘13 Going On 30′ Reboot With Emily Bader & Logan Lerman; Garner An EP Hannah Berner & Paige DeSorbo Lead Comedy Series In Works At Netflix Read More About: Comments",0,2026-03-25 10:00:03
5,https://deadline.com/2026/03/banijay-enters-microdrama-finland-survival-sisters-yle-1236765142/,Banijay Enters Microdrama Space With Mockumentary ‘Survival Sisters’ For Finland’s YLE & Trio Of Titles In Iberia,Deadline,2026-03-25T08:30:00,4742,"Skip to main content Dismiss News Banner Breaking News Stephen Colbert Set To Write Next ‘Lord Of The Rings’ Movie After Forthcoming ‘The Hunt For Gollum’ Read the full story By Jesse Whittock Jesse Whittock International TV Co-Editor @WhittockTweets More Stories By Jesse Banijay Enters Microdrama Space With Mockumentary ‘Survival Sisters’ For Finland’s YLE & Trio Of Titles In Iberia HBO Max Developing Pair Of Euro Medical Dramas & Taking Creative Cues From ‘The Pitt’ HBO Max’s Sarah Aubrey Says ‘Harry Potter’ Series Marks “Financial Investment You Wouldn’t Normally Make On A Television Series” View All March 25, 2026 1:30am Susanna Karttunen and Minna Virkajärvi Banijay Finland EXCLUSIVE: Banijay Entertainment has made its move into microdrama , with a vertical video order in Finland and a trio of projects in Iberia. Pubcaster YLE has ordered Survival Sisters , a 20-part mockumentary from Banijay Finland . Each five-minute episode will be produced in dual formats, 16:9 for YLE’s streaming service, YLE Areena, and 9:16 for the broadcaster’s social channels. Known locally as Lottakoulu , the show is billed as a “a fast-paced, character-driven comedy set inside a fictional Homefront Academy, where young women are trained to be ‘good citizens’, prepared for any societal threat. Through interviews, classroom scenarios and escalating absurdity, the series explores the expectations placed on women, from national duty to upholding traditional values, all while navigating friendship, identity and the relentless pressure of modern, everyday life.” Related Stories News HBO Max Developing Pair Of Euro Medical Dramas & Taking Creative Cues From 'The Pitt' News HBO Max Strikes Overall Deal With Former Movistar Content Chief Domingo Corral In Spain, Banijay Iberia is developing three innovative short-form projects: F**cking Honeymoon , Fortu & Jazz , and an anime project. Watch on Deadline F**cking Honeymoon is billed a story “where a perfect romantic escape unravels into chaos,” while Fortu & Jazz is a “contemporary” adaptation of classic Spanish literary IP in Fortu & Jazz . The series have been developed using a hybrid of live-action, anime-influenced visuals, and AI-supported creative tools, these projects leverage vertical framing and mobile-first production for snackable, high-impact 9:16 viewing. This marks France-based production giant Banijay’s biggest move into vertical video, which continues to attract legacy players into the mix. The announcement came at Series Mania in Lille, where Banijay showcased its latest scripted slate, and Steve Matthews, Head of Scripted, is speaking on a microdrama apps panel. In Brazil, Banijay Americas subsidiaries Endemol Shine Brasil and A Fábrica have partnered to create a slate of vertical-format microdramas. Minna Virkajärvi, executive producer at Banijay Finland said: “Banijay Finland is known for creating innovative, culturally-resonate, and often satirical drama and comedy, and Survival Sisters is a natural step as we expand into short-form and vertical formats. “Younger audiences are shifting the way we consume content, and this commission reflects both Yle’s and our commitment to exploring new ways of delivering premium storytelling without compromising ambition or quality. Susanna Karttunen is an exciting new Finnish voice, and this show’s relevance and sharp satirical edge will resonate strongly with viewers.” Teija Rantala, Yle’s Yle Chlidren’s and Youth Content Commissioner, added: “The theme of Survival Sisters hits close to home: The mood across Finland has grown uncertain, with young adults wondering what challenges their generation might be asked to face. With sharp, warm-hearted humour, the series asks what it means to be a good woman in a time of often overwhelming conversations – and above all, it liberates by making a difficult subject laugh-out-loud funny.” Banijay Finland’s scripted slate includes the likes of crime titles l Murder in Hanko and Detective Maria Kallio ; comedies such as Supporting Actor ; YA dance drama Dance Brothers; and recently announced projects Queen Heist and The Good Widow . Banijay Entertainment claims to be Europe’s number one studio in scripted, with over 60 labels producing over 100 titles annually. At Series Mania it has been showcasing the likes of A Woman of Substance , Falling , Half Man, Montmartre, Marie-Line Incognito, Wallander and Anatomy of a Moment. Disney’s $1B Investment In OpenAI DOA As Sam Altman Pulls Plug On Sora Netflix Sets ‘13 Going On 30′ Reboot With Emily Bader & Logan Lerman; Garner An EP Hannah Berner & Paige DeSorbo Lead Comedy Series In Works At Netflix ‘John Wick’ Spinoff About Blind Assassin Caine Locked & Loaded For Start Read More About: Comments",0,2026-03-25 10:00:04
6,https://deadline.com/2026/03/mackenzie-crook-wants-second-final-season-small-prophets-1236765151/,Mackenzie Crook Planning For A Second & Final Season Of His Hit Comedy ‘Small Prophets’,Deadline,2026-03-25T08:12:02,4474,"Skip to main content Dismiss News Banner Breaking News Stephen Colbert Set To Write Next ‘Lord Of The Rings’ Movie After Forthcoming ‘The Hunt For Gollum’ Read the full story By Stewart Clarke Stewart Clarke More Stories By Stewart Mackenzie Crook Planning For A Second & Final Season Of His Hit Comedy ‘Small Prophets’ Prime Video Europe Is Doubling Down On Drama & Says The Message Is: “More Series, More Series, More Series” Boxing Legend Canelo Álvarez & ‘Drive To Survive’ Producers Strike Global Production Partnership View All March 25, 2026 1:12am Pearce Quigley as Michael Sleep and Lauren Patel as Kacey in 'Small Prophets' Matt Squire, BBC There’s good news and bad news for fans of Mackenzie Crook’s hit comedy Small Prophets . The good news is Crook wants to write a second series, and one with more episodes. The less good news for viewers hoping this is the start of a long-running show is that the writer-director-actor wants the wrap up the story with a second season. “I want to write a second series. I want it to be eight episodes and then I want to leave it there,” Crook told Deadline at Series Mania, where his six-part comedy is in the International Panorama section. “I haven’t written it yet. I don’t know exactly what happens, but I think that would be great. First half [ends with] to be continued. Second half; the end. And there’s your story.” Related Stories News Mackenzie Crook Talks Big Ambitions For 'Small Prophets', View On 'The Paper' & Future In Film Acting News 'When Soccer Came To America': TNT Sports Doc To Explore Pelé & George Best's Impact On The Beautiful Game In The States Crook wrote, directed and stars in Small Prophets , which has struck a chord with viewers. It tells the story of Michael (Pearce Quigley) who is struggling to come to terms with his partner’s sudden disappearance. His father (Michael Palin) has a journal relaying how to conjure homunculi, magical creatures in jars who can prophesize the future. It’s a high-concept comedy with folklore and magical realism elements, but set in a suburban cul-de-sac. Watch on Deadline Last week the BBC said the show is its biggest scripted launch of the year and biggest comedy launch since 2024. The UK pubcaster has yet to officially greenlight Season 2, but Crook tells Deadline he’s hopeful and expecting to hear within days. Season 1 ends with an on-screen caption reading: ‘To be continued’. The show was ten years in the making, but viewers will not have to wait a decade for Crook to conjure a second series. “The majority of the ten years was figuring out what it was,” he explained. “Now I know what it is, I just have to go and finish off the adventure.” He added: “I’m quite excited about that because I want to know what happens next and I’m the one who gets to figure that out. I do feel a real responsibility now. Obviously I hoped it would go down well, but I didn’t realize how people would take it to their hearts so immediately. All these reactions have been so positive and heartfelt that I can’t f*** it up.” Without giving away major plot points, Season 1 ends with a suggestion that the main characters may be heading beyond English suburbia and to another country. Crook said he is pondering the setting and story for a second run. “I’ve got to figure out what I can change and what people want to be the same. How important is the setting of suburbia to the feel of the whole show and would I be making a completely different show if [Michael] went off to Canada? And he hasn’t got all the answers. If he went to Canada, he still doesn’t know where he’s going and what he’s going to find there. “The homunculi are a big part of it, and they need to come back. I don’t think he’s a spoiler to say that he will do the experiment again.” Ahead of Season 2 news, Crook reflected on why viewers have taken to the show. “There’s hopefully a kindness and a heart at the center of it,” he said. “But it’s been a surprise, I suppose, to find that it’s appealing to such a such a wide audience.” Small Prophets is produced by Crook’s Treasure Trove label and Blue House for the BBC with Sphere Abacus across international sales. Donald Trump & Self-Censorship Report; Co-Pro Winner; Banijay Microdrama Disney’s $1B Investment In OpenAI DOA As Sam Altman Pulls Plug On Sora Netflix Sets ‘13 Going On 30′ Reboot With Emily Bader & Logan Lerman; Garner An EP Hannah Berner & Paige DeSorbo Lead Comedy Series In Works At Netflix Read More About: Comments",0,2026-03-25 10:00:05
7,https://deadline.com/2026/03/tnt-sports-when-soccer-came-to-america-pele-george-best-1236765119/,‘When Soccer Came To America’: TNT Sports Doc To Explore  Pelé & George Best’s Impact On The Beautiful Game In The States,Deadline,2026-03-25T08:00:00,3158,"Skip to main content Dismiss News Banner Breaking News Stephen Colbert Set To Write Next ‘Lord Of The Rings’ Movie After Forthcoming ‘The Hunt For Gollum’ Read the full story By Max Goldbart Max Goldbart International TV Co-Editor @Goldbart1 More Stories By Max John Boyega To Feature In BBC Doc Exploring Tragic Death Of Damilola Taylor ‘When Soccer Came To America’: TNT Sports Doc To Explore Pelé & George Best’s Impact On The Beautiful Game In The States BAFTA TV Analysis: ‘Adolescence’ Gets Set For Awards Season Swan Song View All March 25, 2026 1:00am Pelé George Tiedemann /Sports Illustrated via Getty EXCLUSIVE: U.S. soccer fans are being infected by World Cup fever and TNT Sports is now set to explore a similar happening 50 years ago. TNT, which will move to HBO Max in the UK when it launches tomorrow, is making When Soccer Came to America : Goals, Glamour and the Beautiful Game , about the time that Pelé, George Best , and Johan Cruyff brought unprecedented attention to that very different kind of football. Produced by The Investigation of Lucy Letby maker ITN Productions (ITNP), the film examines the North America Soccer League’s (NASL) explosive growth during the 1970’s and 80’s as some of the greatest players in history joined. This was 50 years prior to David Beckham and Lionel Messi bringing another wave of interest to the game. Related Stories News HBO Max Developing Pair Of Euro Medical Dramas & Taking Creative Cues From 'The Pitt' Casting 'American Blue' Pilot Casts Kelly Jenrette, Carlito Olivero, Onye Eme-Akwari, Jess Gabor & Eddie Kaye Thomas Through archive footage and interviews with the likes of Pelé’s daughter and Best’s son, the documentary charts how the NASL became a cultural phenomenon, blending sport, celebrity, and ambition in an American experiment to popularize the world’s game. At the heart of the story is Pelé’s move to the New York Cosmos, a moment credited with igniting a soccer boom across the country. The film also revisits the influence of Best during his time in the league and Cruyff’s brief but impactful spell in North America. Watch on Deadline The doc is ITNP’s first for TNT Sports. “We’re delighted to work with TNT Sports on this project – just as America is preparing to host the World Cup,” said ITN content boss Ian Rumsey. “This is an amazing story and the archive we discovered will bring it to life for a new generation of fans preparing for the greatest show on earth.” The U.S. will host the soccer world cup in a few month’s time for the first time since 1994. The move comes as TNT Sports gets set to move to its new HBO Max home as the streamer finally launches in the UK. Producer and director of When Soccer Came to America is Oliver Price, EP is Andy Dunn, production manager is Hollie Clark and development assisstant producer is Natalie Chow. Disney’s $1B Investment In OpenAI DOA As Sam Altman Pulls Plug On Sora Netflix Sets ‘13 Going On 30′ Reboot With Emily Bader & Logan Lerman; Garner An EP Hannah Berner & Paige DeSorbo Lead Comedy Series In Works At Netflix ‘John Wick’ Spinoff About Blind Assassin Caine Locked & Loaded For Start Read More About: Comments",0,2026-03-25 10:00:06
