id,url,title,source,publication_date,text_length,full_text,is_duplicate,created_at
36,https://www.hollywoodreporter.com/tv/tv-features/the-testaments-premiere-june-return-creator-interview-1236558133/,‘The Testaments’ Creator Explains That Thrilling Premiere Cameo: “You Want Those Scenes to Feel Epic”,Hollywood Reporter,2026-04-08T04:45:00,10766,"Skip to main content Agnes, June's daughter played by Chase Infiniti, here with Daisy, played by Lucy Halliday, in 'The Testaments.' Disney/Russ Martin Logo text [This story contains MAJOR spoilers from the three-episode premiere of The Testaments . ] The Handmaid’s Tale viewers ( including this writer ) had one big question going into sequel series The Testaments : How would June factor in? The character who Elisabeth Moss made a household name ended The Handmaid’s Tale series on a mission to never give up fighting for her first daughter, Hannah/Agnes, who was taken by Gilead. But June vowed to do it secretly by continuing to lead the resistance movement called Mayday, and Moss and the show’s creative team behind the groundbreaking Hulu hit sealed their lips about if June’s ending meant she could appear onscreen when the Gilead universe returned with The Testaments . Related Stories Movies Gaten Matarazzo's 'Pizza Movie' Directors Respond to ""I'm Good Bro"" Meme Mocking Film's Marketing TV Lisa Vanderpump Says Dakota Mortensen ""Didn't Have a Big Storyline"" on 'Vanderpump Villa,' Despite 'Mormon Wives' Depicting Otherwise Now that The Testaments — the next Hulu and MGM adaptation of Margaret Atwood ‘s follow-up novel to The Handmaid’s Tale — has released its first three episodes , the secret is finally out: June is back! She’s revealed in the final moments of the premiere in what creator Bruce Miller calls below a superhero-like introduction, and her connection to this new story is explained in the third episode, when she becomes the Mayday handler for Daisy (Lucy Halliday), the new character who enters Gilead as an undercover “Pearl girl” who befriends June’s taken daughter, Agnes ( Chase Infiniti ). It’s not made clear yet, however, if June even knows that she sent Daisy to where her daughter is being raised in Gilead. Below, Miller, creator of The Handmaid’s Tale and The Testaments , spills on when they made the call to bring June back onscreen, if Moss needed any convincing (hint: she didn’t) and how they kept this massive secret. “You really want those scenes to feel particularly epic,” he tells THR . “There’s an aspect of superhero to June that we wanted to have in this, because her shadow is over the whole show. She’s looming over the whole thing.” *** The biggest question I tried to get out of you at the end of The Handmaid’s Tale — which you wouldn’t tell me! — was if June would appear in The Testaments . I’m very excited to see that she does. When did you decide that June would have a role in this show? There are a couple of answers. From the beginning, I felt like June would end The Handmaid’s Tale with certain business unfinished, so if you were going to tap back into Gilead, you would want to know what June was doing. She’s doing something — she hasn’t retired from dramatic operation. It just made sense. Even in the book, The Testaments , June is operating from the outside. You just don’t see her. So that was always an option. June would always be in this show. It’s a show about her daughter, and she certainly would be very curious about what happened and would be as influent in that life as she could be. It made sense. Then, of course, Elisabeth [Moss] was such a creative partner on The Handmaid’s Tale with me and Warren [Littlefield, executive producer]. She directed and we worked as closely as you could possibly work with anybody. She was absolutely spectacular. So the chance to bring her back in this role came from the fact that she came back in all her other roles. She’s an executive producer on this show. She’s our creative partner. It really did feel like if we had the opportunity, we could bring June into the show in a very natural way because we didn’t have to make a June show. We could bring her in when she affected one of our other stories. June (Elisabeth Moss), at the end of The Handmaid’s Tale , vowed to never stop fighting for the return of her first daughter Hannah, who was renamed Agnes when she was taken by Gilead. Viewers meet Agnes, played by Chase Infiniti, in The Testaments . Disney/Steve Wilkie Did Elisabeth Moss need any convincing to play June again? I don’t think it took much arm twisting to get Elisabeth say yes. ( Laughs .) She very kindly was enthusiastic, and I was thrilled. It is one of the great pleasures of my creative life to watch her do what she does, and to watch it any more times is really great. But I definitely feel like the “business unfinished” that we have with June is part of what this show is about, and to see how that ends up — it would be weird having Agnes be this concerned about who her mother was if we never even saw her mother. When it came to figuring out how many episodes June could appear in, did the story drive that? Lizzie is busy doing other shows. How much of this was a dance with her schedule? [ Note: June appears in future episodes this season .] All of those things are absolutely true, and it is always a balance of the very, very quotidian practical and the very, very heavy artistic. So what I tried to do is stay in the, “Let’s figure out a good story for June. What’s she going to be doing in these episodes?” And then I just try to be flexible because Elisabeth Moss’ schedule is very full. She’s a very busy artist who does lots of crazy, cool, interesting things, and I want her to continue that. To shoot the show, she has to physically be there. It’s not something you can do via Zoom. So we had to think about that. What I got was a sense of how long I would have her. Whether it’s going to be a day or two days or a week, and then I started to figure out how many episodes I could use her in and what stories I could tell. It ends up being practical. Like, how could she get to this set? But within that practicality, you really want those scenes to feel particularly epic. It has not leaked that she’s playing June again. Did you hide her in scripts? Did you cover her on set? What lengths did you go to? We hid her in scripts, absolutely. There’s been a lot to keep her out of. Absolutely. Did she have a code name in the scripts? Yes, she had a code name. Can you tell me what it was? No. ( Laughs .) It wasn’t “Rocket Woman,” which was her code name on Handmaid’s . You only get to watch the first time once. I just want to make it easier if people don’t want to hear spoilers to not hear them and have a more fun experience. That’s all. I want to make this experience unique. Lizzie and myself and Warren all have a very old-school sense of drama. We like episodes that end on a cliffhanger, and I will hang someone off a literal cliff if it takes that to do it. Margaret [Atwood] makes fun of how shamelessly dramatic I am, and I think Lizzie thinks keeping a secret would be great for when it comes out. She has a good nose. And Warren, well, he has made a few shows. The girls who are growing up in Gilead, played by (second to left) Rowan Blanchard, Mattea Conforti, Chase Infiniti and Isolde Ardies. Disney/Russ Martin The June reveal at the end of the first episode was thrilling. How much creative brainstorming went into this scene of slowly showing us that June is back? Did you film alternate versions? A lot went into it, mostly with Mike Barker, who was directing, and our DP Greta [Zozula]. Mike directed these first three episodes. He really stamped the show with a look that said: “How do we move it past Handmaid’s and still make it beautiful?” There’s an aspect of superhero to June that we wanted to have in this, because her shadow is over the whole show. Her hands are all over the show, but you don’t really see her. So you wanted to get the sense that she’s looming over the whole thing. So bringing her to us in that scene, for Mike as a director, was revealing how well we know her. That when you come up behind her — if you’ve watched The Handmaid’s Tale , you’re like, “Okay, that’s June.” You can tell just from the way she’s standing. But even if you come around and you’re like, “Who’s that?” and the show ends, there should be no barrier to coming in not knowing anything and moving onto the next story. You move onto Agnes, who gets her period and that whole story starts — and there’s someone watching Daisy, and we find out later who that is. We really wanted to keep it a surprise and make the reveal the only interesting part. Audiences are so savvy, it’s worth it to try to keep that fun alive. Coming in as a Handmaid’s Tale viewer and knowing what I know, I’m watching these early episodes thinking, “Of course Aunt Lydia [ Ann Dowd ] knows who Agnes is, because she has access to the bloodlines.” I thought Daisy’s arrival must be because Lydia and June are working together, but the show doesn’t say that, at least not in these first three episodes. Are you trying to keep that a mystery, in terms of if Lydia knows Agnes’ real identity and if Aunt Lydia and June are working together ? Yes. I did a lot of research on how these kind of rebellions and networks work within. They know nothing about who they’re talking to on the other side. They could be talking to their brother on the other end of the chain, but they don’t know that. And if they found out, it would be hugely dangerous for everybody. All these people are kind of siloed. And if I’m Lydia, I wouldn’t tell June. Would you tell June your daughter’s at her school? Not in a million years. She would do something crazy. So it makes sense for those kinds of operations that Daisy knows one person who’s in Mayday in the whole place, and that’s her handler June and that’s it. And that’s the reason these resistance movements work. How do they survive more than a year? They’re very secretive, because you see how much pressure they’re under. They don’t have to know specifically who they’re talking to or to have a sense of where that person is or who they might be. But with Lydia and June, they saw each other at the end of [ The Handmaid’s Tale ] finale . I don’t know that they’ve seen each other since, but they know they’re out there somewhere. June knows at the end of this message train is Lydia, and Lydia knows somewhere at the end of this message train is June. I think they’ve had enough experience together to modulate how they’re going to trust each other, and it’s interesting to watch. You can see it from a distance, how Lydia feels a certain way watching over June’s daughter. You feel that she’s been watching her since the beginning. It’s one of the first things she says, “I’ve been watching you for such a long time.” And Agnes is like, “Oh, crap.” *** The Testaments is now streaming its first three episodes, with new episodes releasing at 9 p.m PT/12 a.m. ET Tuesdays on Hulu. Head here for a refresher on how The Handmaid’s Tale set up The Testaments . THR",0,2026-04-08 10:13:51
3,https://deadline.com/2026/04/elisabeth-moss-returns-handmaids-tale-role-the-testaments-1236784340/,Elisabeth Moss Reprises ‘Handmaid’s Tale’ Role On ‘The Testaments’ Series Premiere,Deadline,2026-04-08T04:45:00,4477,"Skip to main content By Rosy Cordero Rosy Cordero Associate Editor, TV @SocialRosy More Stories By Rosy Elisabeth Moss Reprises ‘Handmaid’s Tale’ Role On ‘The Testaments’ Series Premiere Lou Diamond Phillips To Recur On Hulu Limited Series ‘Count My Lies’ As Katherine LaNasa’s Boyfriend Lifetime Rounds Out Spring Film Slate With ‘Duck Dynasty’ Love Story & Jana Kramer-Led Project View All April 7, 2026 9:45pm Elisabeth Moss in 'The Handmaid's Tale' Hulu SPOILER ALERT: The following reveals major plot points from Hulu ‘s series premiere of The Testaments . Surprise! If fans of The Handmaid’s Tale were worried they’d never see June Osbourne again, they needn’t have. Elisabeth Moss , who executive produces Hulu’s The Testaments , made her big return as the heroic character she played across 6 seasons of the mothership series in the new show’s premiere episode tonight. Series showrunner and executive producer Bruce Miller spoke to Deadline about the decision to have June be part of the show from Episode 1. Related Stories News Lisa Ann Walter Sets Title, Premiere Date For Hulu Stand-Up Special - Update Casting Lou Diamond Phillips To Recur On Hulu Limited Series 'Count My Lies' As Katherine LaNasa's Boyfriend “I think in some ways, June is such an anchor for the character of Agnes [Chase Infiniti] that I don’t think you could have the story without June, even if there was no Handmaid’s Tale ,” he revealed. “Elisabeth Moss has been our creative partner since the very, very beginning, and in every way. So I think that having her as an executive producer, you feel the presence of June all the time. Fortunately, we were able to move our schedules around and do everything that we could to get her into the show a little,” Miller added. Watch on Deadline The Testaments is set a few years after the events of The Handmaid’s Tale ‘s series finale. Viewers reconnect with June in the premiere of the continuation series as part of Daisy’s ( Lucy Halliday ) storyline in her native Toronto. The scene begins with Daisy longboarding on the street en route to a store, where she walks in greeting someone, and June is standing and observing while the Cranberries’ hit song Dream plays in the background. No words between them were exchanged. “Bringing back people from Handmaid’s Tale into this world to continue their story is just such a rich pleasure. This is especially true for the actors and me because you never get to go back [to a finished show] and say, well, a few years later they’re doing this. But we get to do it with a few different characters [on The Testaments] . I think it’s a pleasure, but it also rounds out the world in a way that you understand how you feel about Gilead because you have June there going, ‘Oh yeah, I used to feel that way too.'” Chase Infiniti, Lucy Halliday According to the source material, The Testaments by Margaret Atwood, Agnes is the new name given to June and Luke’s (O-T Fagbenle) daughter, Hannah, in The Handmaid’s Tale. Additionally, Daisy is really Nicole, June’s youngest daughter with Nick (Max Mighella). Due to Hannah and Nicole’s age differences in the series finale of Handmaid’s , Miller confirmed Daisy is not Nicole in The Testaments series. Daughter of June or not, Halliday shared her joy over working with Moss on the new show. “We were so fortunate to have Elisabeth Moss, even as an exec on this show; she was so influential in the experience that we had. She’s an encyclopedia of knowledge when it comes to Gilead in this world, and these characters, and we really leaned on that, and we really utilized that source,” shared Halliday. She continued, “And I think most of all, what she gave us was the reassurance that— because we’re stepping into a world that’s already loved and has done so well and been so prolific that neither one of us wanted to mess that up, or for audiences to feel uncomfortable upon our arrival— having her reassurance and her thumbs up in her space that she gave us to step into this world and these characters was brilliant.” Tonight’s premiere featured three episodes, which will later be available to stream via Hulu. The following weeks’ episodes will be released singularly on Wednesdays. Layoffs Underway At SPE; SPT Comedy Head, GSN Boss Among Names Ceasefire! Trump Agrees To Hold Off On Bombing Iran For Now CAA Signs Greta Gerwig As She Follows ‘Barbie’ With ‘Narnia’ Academy Sets Dates For 99th & Landmark 100th Oscars Ceremonies Read More About: Comments",0,2026-04-08 10:13:15
30,https://variety.com/2026/tv/news/jimmy-kimmel-donald-trump-iran-ceasefire-1236711101/,Jimmy Kimmel Says Donald Trump Threatens ‘Something Crazy’ and Then ‘Always Gives Two Weeks’ After Delaying Iran Strikes: ‘He’s Like a Conscientious Employee’,Variety,2026-04-08T04:27:53,3096,"Apr 7, 2026 9:27pm PT Jimmy Kimmel Says Donald Trump Threatens ‘Something Crazy’ and Then ‘Always Gives Two Weeks’ After Delaying Iran Strikes: ‘He’s Like a Conscientious Employee’ By Jack Dunn Plus Icon Jack Dunn Latest Jimmy Kimmel Says Donald Trump Threatens ‘Something Crazy’ and Then ‘Always Gives Two Weeks’ After Delaying Iran Strikes: ‘He’s Like a Conscientious Employee’ 6 hours ago ‘Euphoria’ Creator Sam Levinson on Losing Angus Cloud, Directing Eric Dane and Having ‘No Plans’ For Season 4 7 hours ago Attic Fire Breaks Out at Hollywood’s Magic Castle 8 hours ago See All ABC; Getty Jimmy Kimmel addressed the ceasefire between the United States and Iran during his Tuesday night monologue and pointed out a recurring pattern with President Donald Trump ’s negotiating tactics. “The President decided not to drop it for at least another two weeks,” the host said during “Jimmy Kimmel Live!” “He announced that at the request of Pakistan, which has been facilitating negotiations, he was giving Iran two weeks to live. This is how it goes every single time. Trump says something insane. He says, ‘I’m going to kill everybody tomorrow at 5 p.m.,’ we all freak out, then he’s like, ‘You know what, actually, I’ll kill everyone in two weeks.’ Then we relax, then he forgets he ever said it in the first place. He has the memory and skin color of a goldfish.” Related Stories FKA Twigs Sues Shia LaBeouf Over NDA from 2020 Sexual Battery Settlement Christy Carlson Romano Says 'Even Stevens' Co-Star Shia LaBeouf 'Doesn't Deserve to Be' on the Mount Rushmore of Disney Icons, Then Deletes Posts Kimmel later joked that Trump is like a “conscientious employee” the way he “always gives two weeks'” notice. He then cut to a series of clips in which Trump repeatedly said he would deliver a promise or know more about a touchy subject in two weeks. Popular on Variety The late-night host then went after a quote from press secretary Karoline Leavitt, who said, “Only the President knows where things stand and what he will do.” “And I don’t even believe he knows that,” Kimmel joked. “Trump said he would decimate Iranian power plants in such a way that they’ll be burning and exploding, never to be used again. Just like the toilets at Mar-a-Lago.” Kimmel added that if Trump destroyed Iran’s power plants, it would be “a war crime under the Geneva accords.” Kimmel then cut to a clip of Trump saying, “Allowing a sick country with demented leadership to have a nuclear weapon, that’s a war crime.” Kimmel then quipped, “Then lock yourself up right now because that’s the boat we are floating in right now.” Watch the entire monologue below. Bijou Phillips Hospitalized for Second Kidney Transplant, Urgently Seeks Donor Loading comments... More From Our Brands Rolling Stone Jimmy Kimmel Celebrates Trump Not Destroying Iran: ‘The Taco Tuesday of All Taco Tuesdays’ Robb Report Jacob & Co. Just Unveiled the World’s Fastest Tourbillon Sportico Sen. Warren Urges FCC to Shield Fans From Media Consolidation WWD Fashion Trust U.S. 2026 Awards Reveal Winners, Honor Tory Burch and Michèle Lamy",0,2026-04-08 10:13:45
4,https://deadline.com/2026/04/sam-levinson-dedicates-euphoria-season-3-angus-cloud-eric-dane-1236784352/,"Sam Levinson Dedicates ‘Euphoria’ Season 3 To “Those We Lost,” Including Angus Cloud, Eric Dane & Producer Kevin Turen",Deadline,2026-04-08T03:56:26,2689,"Skip to main content By Armando Tinoco , Natalie Sitek April 7, 2026 8:56pm Sam Levinson Getty Images Sam Levinson presented the third season of Euphoria at the TCL Chinese Theatre and dedicated it to “those who we lost,” which included Angus Cloud, Eric Dane, and producer Kevin Turen. The Euphoria creator introduced the Season 3 premiere of the HBO series and thanked the whole cast, mentioning some of the names that had transcended. “Some people ask why it took so long between seasons two and three,” he said. “There were obvious factors — the strikes, trying to make a schedule work with our very in-demand cast, but the real time was in trying to figure out how to find a way to pay respect to those who we lost.” Related Stories News ‘Euphoria’ Season 3 Premiere Red Carpet Photos: Zendaya, Jacob Elordi, Sydney Sweeney, Hunter Schafer & More Documentary Peabody Awards’ First Batch Of Nominees Include Oscar-Winning ‘Mr. Nobody Against Putin’, L.A. Fire Coverage He continued, “When Angus died, it was tough. I loved him deeply, and I fought hard to keep him clean. The year he died, in 2023, he was one of 73,000 people in America who died of a fentanyl overdose. I learned a whole lot that year, but what I realized more than anything is that death is what gives life meaning. You can’t be arrogant about existence. You’re forced to reckon with the fact that life itself is a wonder, a gift, a profound blessing.” Watch on Deadline Levinson said he wanted Euphoria Season 3 to be “the meaning beyond the absurdity.” The filmmaker said that he would dedicate this season “to those who we lost, Angus, Kevin, and Eric,” adding, “The Rebbe says, ‘The only way to see great light is to pass through great darkness.’ Well, it feels good to be on the other side.” Cloud played Fezco in the first two seasons of Euphoria . The actor died in 2023 from “acute intoxication” at the age of 25 in Oakland, California. Dane was able to reprise his role in the third season of the HBO drama before his death in February. The actor died of of respiratory failure with amyotrophic lateral sclerosis (ALS) as a contributing cause. Watch Levinson’s entire speech in the video below. #Euphoria creator Sam Levinson intros Season 3 at the premiere in LA and dedicates the season to “those who we lost,” including Angus Cloud, Eric Dane and producer Kevin Turen pic.twitter.com/OVyLoc7XeT — Deadline (@DEADLINE) April 8, 2026 Layoffs Underway At SPE; SPT Comedy Head, GSN Boss Among Names Ceasefire! Trump Agrees To Hold Off On Bombing Iran For Now CAA Signs Greta Gerwig As She Follows ‘Barbie’ With ‘Narnia’ Academy Sets Dates For 99th & Landmark 100th Oscars Ceremonies Read More About: Comments",0,2026-04-08 10:13:16
