id,url,title,source,publication_date,text_length,full_text,is_duplicate,created_at
22,https://variety.com/2026/music/news/jack-white-satanic-band-twin-temple-charley-crockett-1236807060/,"Jack White Offers Opening Slot to ‘Satanic’ Band Twin Temple — ‘Get in Front of Me, Satan!’ — as Charley Crockett Defends Decision to Dump Them",Variety,2026-07-11T01:39:06,7555,"Jul 10, 2026 6:39pm PT Jack White Offers Opening Slot to ‘Satanic’ Band Twin Temple — ‘Get in Front of Me, Satan!’ — as Charley Crockett Defends Decision to Dump Them By Chris Willman Plus Icon Chris Willman Senior Music Writer and Chief Music Critic ChrisWillman Latest Jack White Offers Opening Slot to ‘Satanic’ Band Twin Temple — ‘Get in Front of Me, Satan!’ — as Charley Crockett Defends Decision to Dump Them 9 hours ago Sarah McLachlan and Allison Russell on Touring Together and Summer Nights Devoted to ‘Forgetting Madness and Being Part of Something Beautiful’ 1 day ago Country Music Association Names Brittany Schaffer as New CEO to Succeed Sarah Trahern 3 days ago See All “Not today, Satan”… or “Hell yeah, Beelzebub”? A split is taking place in the polarizing realm of devil-rock, as practiced by self-styled “Satanic” duo Twin Temple . On Friday, country singer Charley Crockett took to social media to defend his decision to drop the act from his tour dates — even as Jack White piped up to offer them a high-profile spot on one of his shows. White took to Instagram Friday to make an offer: “Twin Temple, would you like to open my show in L.A. on September 29th at the Hollywood Palladium? Let me know. Get in front of me Satan!” (That quip was a whimsical twist on the White Stripes’ 2005 album title “Get Behind Me Satan,” which was an interpolation of Matthew 16:23.) Related Stories LISTEN: Politics Puts a Spotlight on the Production Exodus From California and Other U.S. Filming Hubs 'Strictly Business' Cannes Lions Edition: Fox's Rob Wade and Billy Parks Bet on Bringing Scale to the Business of Creators Twin Temple quickly and enthusiastically responded to the offer. “Unholy hell…. Sir Jack, you have no idea what this means to us,” they responded in his comments. “Lifelong fans — ‘Dead Leaves on the Dirty Ground’ was one of the first songs I (Alex) ever learned on guitar. We were actually planning on coming to this show. It would be a most infernal pleasure to play the devil’s music with you.” Popular on Variety Others joined in with shows of support, apparently unafraid of getting caught up in spiritual warfare. “Viva Anton LaVey!” wrote singer-songwriter Jenny Lewis, of Rilo Kiley fame, referring to the late founder of the Church of Satan, in her support of the act that performs seemingly tongue-in-cheek anthems like “Lucifer, My Love” and “Let’s Have a Satanic Orgy.” View this post on Instagram Meanwhile, Crockett, the acclaimed country indie-traditionalist, was not backing down after having made the call to dump the duo from opening his shows. “I won’t conform and I’m not sorry,” Crockett wrote in the caption to what his currently his lone photo on Instagram. “There are many things I’ve done in my life to apologize for but this ain’t one of them.” Crockett’s lengthy message didn’t go too narrowly into the subject of dropping Twin Temple from his bill, while he did address opening acts in general, along with spiritual power and “shameless exhjibitionists possessed by the desire to be famous and have the public’s adoration.” Wrote Crockett: “I might wake up at 1 p.m. on the back of that bus and find out that the opener ain’t working for me that night. Tough luck. Life is hard. This ain’t no temp agency. Get to stepping. Shit you might get you a life changing gig just by standing next to me. That’s magic. I’m not gonna advertise my charity out here because as soon as you do, it ain’t nothing but self promotion,” he said, in what could have been taken as a response to White publicly announcing his invitation to Twin Temple. He got more philosophical from there. “I’m not on the left. I’m not on the right,” Crockett wrote. “I’m on the road, and that’s a hard way to go. Believe me, the pace would kill you, bronc. I don’t give a damn whether you think I’m right or wrong. They say love your struggle. I say love the strength the creator gave you to overcome your struggle. Don’t believe in any kind of spiritual power? I’m sorry to hear that. God is the fabric that ties all life together. No need to even define or institutionalize it. The entertainment business is chock full of shameless exhibitionists possessed by the desire to be famous and have the public’s adoration. I swear they’d kill a relative. I see them everywhere. Been betrayed by many. Always stricken by the crack smoke and just dying to get ahead. I love what I do and I’m grateful for the privilege every minute, and if everybody disappears I’ll go back to the street corner where I started. Hell, sometimes I dream about it. Shout out to Angel in New Orleans who told me that if you wanna get high boy you got to start down low. I’ve found that about the only help you get out here in this business is when they lower the box.” View this post on Instagram Reaction in his comments was mixed, with some supporting Crockett’s “backbone” and others saying he was hurting himself by belaboring the subject. Some expressed mixed loyalty, as Crockett and White have a good amount of overlap between their respective fandoms. Many just wondered how an act like Twin Temple could have gotten booked for Crockett dates in the first place, and whether it was his responsibility to just grimace and bear it, or not, after they were. Twin Temple, a husband-wife duo formed by singer Alexandra James and guitarist Zachary James, broke the news on their social media Thursday, writing, “Today we were informed that Charley Crockett has decided to remove Twin Temple from his upcoming shows next week due to our Satanic imagery,. Unfortunately, that means we will not be able to perform for you next week as planned. We are really disappointed as we were looking forward to getting back out and seeing you, and also what it means as far as bringing different types of people and music lovers together. … We’re grateful for your support, not only of Twin Temple, but more importantly of artistic freedom. HAIL SATAN!” View this post on Instagram Crockett seemed taken aback by the pro-Satan nature of the act, which, however humorously intended, invokes classic totems like pentagrams on stage — a routine likely to go over better when they open for Danzig, as they will be in September, than with a crowd full of fans of traditional country. “I thought they were like Black Sabbath, but they ain’t. Not today, Satan,” Crockett wrote in a statement to Rolling Stone Thursday. Later, in a since-deleted Instagram post, he added, “Fuck Trump. Fuck Epstein. But hail Satan? Not me Jack.” Bombillo Amarillo, a Producer on Top Annecy Winner ‘The Violinist,’ Launches Animation Beachhead in Spain (EXCLUSIVE) ‘The Kitchen’ Director Alonso Ruizpalacios at BAM: ‘We Need More Trojan Horses’ Dengue Fever, Rains Be Damned: ‘We Can’t Wait to Go Back,’ Say ‘The Whistler’ Producers on Shooting in Colombia Jesse Eisenberg Says He Doesn’t ‘Want to Be Associated’ With Mark Zuckerberg: ‘If This Guy Is the Creator of This World, I Don’t Want to Live in That World’ Kevin Bacon, Kyra Sedgwick and Travis Bacon Talk About Their Bloody ‘Family Movie’ – and Why ‘Violence Can Be Hysterical’: ‘We Are Really Twisted People’ ‘Star Trek II: The Wrath of Khan’ Recalled by Director Nicholas Meyer Loading comments... More From Our Brands Rolling Stone Comic Fends Off ‘Frivolous’ $27 Million Lawsuit Over ‘Lion King’ Joke, Will Seek Legal Fees Robb Report This New Sherry Cask-Matured Rum Comes From Scotland’s Islay Sportico Kawhi Trade Value Could Change Based on Aspiration Scandal WWD Inside Margherita Maccapani Missoni’s Private Couture Week Pop-up",0,2026-07-11 10:20:03
5,https://deadline.com/2026/07/meta-disables-new-ai-image-generator-zuckerberg-1236979706/,Zucked Up! Meta Disables AI Image Generator After CAA & SAG-AFTRA Trashed It: “Missed The Mark”,Deadline,2026-07-11T00:51:47,3752,"Skip to main content By Glenn Garner , Dominic Patten July 10, 2026 5:51pm Mark Zuckerberg and the Meta Group logo Hans Lucas/AFP via Getty Images Just days after Meta introduced its Muse Image AI generator, the Mark Zuckerberg -run company has done a complete U-turn. Under pressure from a now-victory-lap-taking CAA and SAG-AFTRA, the tech behemoth announced Friday that the feature is “no longer available” on Instagram, admitting they “missed the mark” amid privacy concerns over the automatic opt-in for users. Related Stories Agencies CAA Calls BS On Meta’s AI Image Generator; Zuckerberg Pushes Back On Muse Privacy Worries News SAG-AFTRA Recommends Members Opt-Out Of Meta’s AI Feature: “Take Action To Protect Your Likeness” “Earlier this week, we announced that one way for people to generate images in Meta AI is by @-mentioning public Instagram accounts that they want to reference,” Meta said in an IG post Friday. “Our intent was to provide a useful creative tool and to give people control over whether their public content could be referenced in this way. We’ve heard the feedback that this feature missed the mark, so it’s no longer available.” Meta added, “We’ve heard the feedback that this feature missed the mark, so it’s no longer available.” Watch on Deadline A quick scan of Instagram shows that Meta has, in fact, disabled Muse. At its core, a Muse user just needed to tag a public or unprotected IG feed, and it instantly becomes meat for the AI generator to create its own images or “remixes,” as they are sometimes called, after which the images are available online permanently. Friday’s announcement comes after CAA called for Meta to implement guardrails for Muse, despite the agency rolling out its own AI Vault program to archive its members’ likenesses forever. “No one’s name, image, likeness, voice, or creative work should be used by any third party, including AI models, without clear, documented consent,” the uber-agency said Wednesday. In a statement on Friday, CAA said: “We commend Meta for its swift decision to remove the Muse Image feature. Putting individual rights and consent at the forefront is essential to building responsible technology. We look forward to ongoing conversations to ensure creators stay protected as technology evolves.” After sharing instructions on how to “dig into [Instagram’s] settings” to opt-out of the Muse Image tool and “protect your likeness,” SAG-AFTRA echoed CAA’s concerns about what appears to be a case of Big Tech overreach. In a statement issued Friday, SAG-AFTRA said: “With the dangers of nonconsensual digital replicas well known to all, a feature that encouraged that behavior is unwise. We appreciate its discontinuance. It is the responsible thing to do.” The use of AI in Hollywood continues to be a hot-button topic in recent years. SAG-AFTRA has endorsed the Trump administration’s AI policy framework , which calls for Congress to enact legislation that includes parental controls, intellectual property rights protection, First Amendment protections, expanding AI workforce development, allowing data centers to generate their own power and removing legal barriers that limit AI innovation. Last month, Trump signed an executive order for voluntary framework in which AI companies would provide the government with access to new models for a 30-day review period before their release. Erik Pedersen contributed to this report. Disney’s Live-Action ‘Moana’ Lost At Sea With $40M-$45M U.S. Opening Morgan Spector & Rebecca Hall Eyed To Lead Netflix Series Based On 2025 Dan Brown Book Meta Disables New AI Image Generator Days After CAA & SAG-AFTRA Trashed It Sells Stake To Dept. M; Michael Schaefer Named CCO; TV Unit Launches Read More About: 2 Comments",0,2026-07-11 10:19:44
6,https://deadline.com/2026/07/scripps-directv-retransmission-battle-tv-stations-go-dark-1236931598/,Scripps’ 54 Local Stations Return To DirecTV After Five-Week Blackout Over Retransmission Dispute,Deadline,2026-07-11T00:32:00,5083,"Skip to main content By Natalie Oganesyan , Dade Hayes July 10, 2026 5:32pm UPDATED, 6:05 PM: Scripps Local Media’s 54 broadcast stations have returned to DirecTV after a six-month blackout over a carriage dispute. The companies said Friday that they have agreed on a multiyear deal. The blackout affected such major markets as including Baltimore, Buffalo, Cincinnati, Cleveland, Denver, Detroit, Kansas City, Las Vegas, Milwaukee, Nashville, Phoenix, Salt Lake City, Tampa-St. Petersburg and others. PREVIOUSLY, May 31: Programming on Scripps Local Media’s 54 broadcast stations across 36 Nielsen-designated market areas has been suspended beginning at 7 p.m. ET today, as the third-largest operator of ABC affiliates and DirecTV have reached an impasse over retransmission rates with both sides laying blame at each other’s proverbial feet. Related Stories Legal Nexstar Rails Against $6.2B Tegna Merger Injunction; Calls Out DirecTV & State AGs' ""Cynical Attempt To Advance Their Own Commercial & Political Interests"" News Targeted New Ad Campaign Frames Upfronts In New York As ""Week-Long Metaphor For DirecTV"" In a statement , the multichannel distributor said Scripps is “demanding the highest rates DIRECTV has ever received from a station group, which would continue to dramatically raise costs for consumers and businesses already struggling with affordability. After DIRECTV declined those demands and sought a more reasonable agreement, Scripps chose to remove its stations from viewers in several major markets nationwide.” Watch on Deadline With dozens of television stations going dark, DirecTV noted the outage will impact voters ahead of key state and local primary elections in June and disrupt live sports events like the upcoming NBA and NHL Stanley Cup finals on ABC and the U.S. Open golf tournament on NBC. Scripps operates 17 ABC affiliates, including KTNV-ABC in Las Vegas, where the hometown Golden Knights will face off against the Carolina Hurricanes in the NHL championship. Next week will see the highly anticipated NBA-title-deciding matchup between the New York Knicks and San Antonio Spurs. “Broadcasters like Scripps continue to accumulate exclusive control over local sports teams or other civic content, only to then deny viewers access at times of peak demand,” the statement from DirecTV continued. “This enables stations to leverage municipal pride and fan loyalties to demand higher guaranteed retransmission rates from distributors like DIRECTV to carry their free, over-the-air stations, despite rising regulatory and public concern over escalating television and other day-to-day costs, and amid the growing availability of multiple streaming alternatives.” The blackout has impacted cities including Baltimore, Boise, Buffalo, Cincinnati, Cleveland, Denver, Detroit, Kansas City, Las Vegas, Lexington, Miami, Milwaukee, Nashville, Omaha, Phoenix, Salt Lake City, Tampa-St. Petersburg and West Palm Beach, among others. DirecTV also noted Scripps’ removal of 40 stations from Comcast Xfinity in 19 markets for over a month, starting April 1. “We understand customers are frustrated by temporarily losing their usual access to Scripps stations and the local news, network programming, and live sports they provide,” Rob Thun, chief content officer at DirecTV, said in a statement. “Unfortunately, Scripps is demanding the highest rates we have ever seen for programming that remains available for free over-the-air and through many station, network, and third-party streaming apps. We remain committed to protecting customers from indiscriminate and unnecessary cost increases for less popular programming while still working to restore the stations that many viewers rely on.” In a statement sent to Deadline, Scripps disputed its characterization by DirecTV, noting it has been “engaging in good-faith negotiations with DirecTV to establish an equitable agreement that serves both companies and, most importantly, consumers. Regrettably, DirecTV has elected to remove Scripps local stations from their lineup, employing the same heavy-handed tactics that have become synonymous with pay-TV operators who hurt their own subscribers by using them as bargaining chips in contractual disputes. By contrast, Scripps stations have gone dark only twice since we began broadcasting in the 1940s.” “Scripps remains committed to reaching a fair resolution that restores our local stations to DirecTV’s paying subscribers,” the statement concluded. “At stake is our viewers’ fundamental access to trusted local journalism, critical weather alerts, emergency information and live sports programming that strengthens community bonds — all essential public interest content in which Scripps invests substantially every day.” Disney’s Live-Action ‘Moana’ Lost At Sea With $40M-$45M U.S. Opening Morgan Spector & Rebecca Hall Eyed To Lead Netflix Series Based On 2025 Dan Brown Book Meta Disables New AI Image Generator Days After CAA & SAG-AFTRA Trashed It Sells Stake To Dept. M; Michael Schaefer Named CCO; TV Unit Launches Read More About: 21 Comments",0,2026-07-11 10:19:45
31,https://www.hollywoodreporter.com/lifestyle/shopping/stylish-baseball-apparel-mlb-gear-kristin-juszczyk-clothing-1236644120/,Kristin Juszczyk’s Elevated MLB Collab Comes Just in Time for the 2026 All-Star Game,Hollywood Reporter,2026-07-11T00:17:01,2735,"× Skip to main content By Erin Lassner Plus Icon Erin Lassner E-Commerce Writer View All July 10, 2026 5:17pm Courtesy of Off Season If you purchase an independently reviewed product or service through a link on our website, The Hollywood Reporter may receive an affiliate commission. Fashion designer Kristin Juszczyk — whose high-profile clients include Taylor Swift, Caitlin Clark and husband and NFL star Kyle Juszczyk — just unveiled her label Off Season’s first MLB collection . The limited-edition lineup, available on Friday, July 10 exclusively at Urban Outfitters (both online and in select stores), also marks her brand’s first retailer partnership. The six-style women’s clothing capsule features eight MLB teams — the Los Angeles Dodgers , New York Yankees, Boston Red Sox, Chicago Cubs, New York Mets, Philadelphia Phillies, San Francisco Giants and San Diego Padres — for 47 pieces total. Off Season’s summer drop pairs vintage-inspired aesthetics with elevated, on-trend designs, resulting in sporty-chic tracksuits, knit sweaters, halter tops and rugby tees. Related Stories Lifestyle These Cool and Comfortable Travel Shoes Will Take You From Airport to Aperitivo Lifestyle Taylor Swift Fans Eagerly Await First Look at Her Wedding Dress Off Season MLB Lightweight Track Pants $155 at urban outfitters XS-XL. shop off season x mlb drop The new collection, along with Juszczyk’s brand as a whole, is just one example of the broadening scope of traditional team merch, as recently evidenced by viral NBA courtside fashion from Timothée Chalamet, Swift and dozens more celebrity fans. As for baseball, Off Season’s collection joins an impressive list of premium fashion labels who have existing partnerships with MLB. A couple months back, California-cool athleisure brand Aviator Nation released its second MLB collab . Given demand from fans, Aviator Nation more than doubled the number of teams featured this time around, 13 vs. the six included in its 2025 drop . shop new aviator nation x mlb drop Polo Ralph Lauren , Madhappy , Sporty & Rich , Fear of God and Terez (in collaboration with retailer Revolve ) are just handful of other popular clothing companies with ongoing fashion partnerships with Major League Baseball. Below, a few favorites in anticipation of the 2026 All-Star Week. Terez x Revolve Dodgers Denim Logo Bomber $275 at revolve Yankees Denim Logo Bomber also available (and on sale for $220). Sporty & Rich Yankees Krystal Cropped Tank $90 at shopbop XS-XL. Fear of God x MLB New York Yankees Gym Shorts $150 at fanatics XS-3XL. Aviator Nation NY Mets 2026 Relaxed Pullover Hoodie $175 at aviator nation XS-XXL (unisex sizing). Off Season MLB Ruched Halter Top $80 at urban outfitters XS-XL. THR",0,2026-07-11 10:20:13
7,https://deadline.com/2026/07/randolph-mantooth-dead-emergency-1236979651/,Randolph Mantooth Dies: ‘Emergency!’ Star Who Appeared On Soap Operas & Other Series Was 80,Deadline,2026-07-11T00:16:45,3708,"Skip to main content By Erik Pedersen Erik Pedersen Managing Editor More Stories By Erik Randolph Mantooth Dies: ‘Emergency!’ Star Who Appeared On Soap Operas & Other Series Was 80 2026 Premiere Dates For New & Returning Series On Broadcast, Streaming & Cable 2026-27 Awards Season Calendar: Oscars, Emmys, Grammys, Guilds & More View All July 10, 2026 5:16pm Randolph Mantooth in 'Emergency!,' left and in a publicity still for 'The City' Everett Collection Randolph Mantooth , who starred as a Los Angeles paramedic on the NBC series Emergency! along with turns on soap operas including As the World Turns, One Life to Live and The City, has died. He was 80. His family told our sister site The Hollywood Reporter that Mantooth died July 9 in hospice in Ventura, CA, after a long illness. Related Stories Obituaries 2026 Deaths Photo Gallery: Hollywood & Media Obituaries News Louise Lasser Dies: ‘Mary Hartman, Mary Hartman’ Star Was 87 Born on September 19, 1945, in Sacramento, Mantooth began his screen career in the early 1970s, guesting on episodes of such popular series as The Virginian, McCloud, Adam-12, Marcus Welby, M.D. and Rod Serling’s Night Gallery . His big break came when he was cast as LAFD paramedic John Gage in Emergency, which was executive produced by Jack Webb and played like a fire department take on Dragnet. Debuting as a midseason replacement show in January 1972, Emergency! was shot in a near-documentary style and followed the adventures — and mundane downtime firehouse banter — of Squad 51. Each week, Mantooth’s Gage, partner Roy De Soto (Kevin Tighe) and their firefighter colleagues would answer calls both routine and calamitous. Viewers knew it was one of the latter when an extended alarm would sound at the station. The cast also featured Robert Fuller, Julie London and Bobby Troup. Running for five seasons into September 1977, the hourlong drama with comic elements never was a ratings hit, only denting the year-end primetime Top 30 once in the three-network universe. But it was solid counterprogramming against its 8 p.m. Saturday competition of CBS’ All in the Family and in its final two seasons, Norman Lear classic spinoff The Jeffersons. During its run, rock band The Tubes named-checked Mantooth in the song “What Do You Want From Life?” from its 1975 debut LP. In it, singer Fee Waybill was rattling off a list of things the listening is “entitled to” as an American citizen. Among them was “a personally autographed picture of Randy Mantooth.” He also voiced the Gage character in Emergency+4, a Saturday morning cartoon series that aired for two seasons on NBC in 1973-74. After his run in Emergency!, Mantooth went on to guest star in numerous series including Charlie’s Angels, Dallas, Murder She Wrote, The Fall Guy, L.A. Law, MacGyver, Walker, Texas Ranger and Criminal Minds, among many others. His last television credit was a two-episode guest spot as Wahewa chief Charlie Horse in Sons of Anarchy in 2011. His character presided over the wedding of Opie (Ryan Hurst) and Lyla (Winter Ave Zoli). Mantooth also appeared in more than 380 episodes of the ABC daytime soap Loving from 1987-95 and nearly 200 episodes of the network’s daytime drama The City from 1995-97. His other work in the genre included about three dozen episodes of CBS’ As the World Turns in the mid-2000s and a dozen of ABC’s One Life to Live. Disney’s Live-Action ‘Moana’ Lost At Sea With $40M-$45M U.S. Opening Morgan Spector & Rebecca Hall Eyed To Lead Netflix Series Based On 2025 Dan Brown Book Meta Disables New AI Image Generator Days After CAA & SAG-AFTRA Trashed It Sells Stake To Dept. M; Michael Schaefer Named CCO; TV Unit Launches Read More About: 4 Comments",0,2026-07-11 10:19:46
