id,url,title,source,publication_date,text_length,full_text,is_duplicate,created_at
15,https://variety.com/2026/film/reviews/only-beautiful-things-to-look-at-review-1236804494/,‘Only Beautiful Things to Look At’ Review: A Handsome but Muffled Portrait of State-Sanctioned Cruelty,Variety,2026-07-11T09:46:40,8228,"Jul 11, 2026 2:46am PT ‘Only Beautiful Things to Look At’ Review: A Handsome but Muffled Portrait of State-Sanctioned Cruelty The Czechoslovakian government's program of forced sterilization of Roma women is exposed in a richly shot, well-intentioned but rather dated drama from director Ivan Ostrochovský. By Jessica Kiang Plus Icon Jessica Kiang Latest ‘Only Beautiful Things to Look At’ Review: A Handsome but Muffled Portrait of State-Sanctioned Cruelty 32 minutes ago ‘The Guest’ Review: A Superb Trine Dyrholm Adds Unsentimental Value to a Piercing Family Drama 4 days ago Karlovy Vary Film Festival Topper Karel Och Talks About the 60th Edition Lineup and Its Cinematic Ambitions for Regional Filmmakers and Beyond 3 weeks ago See All Courtesy of Punkchart Films, Karlovy Vary Film Festival The fashions and furnishings of Czechoslovakia in the 1980s — the height of the state’s racist program of suppressing the Roma population through coerced sterilization — are painstakingly evoked in Slovakian filmmaker Ivan Ostrochovský’s “ Only Beautiful Things to Look At .” But the film’s attractive yet oddly bloodless presentation gives the impression of a period drama set much farther back, as though we’re peering at the prettily mounted arrowheads and artifacts of a long-gone atrocity through museum glass. Alongside the decision to centralize the perspective of a white female doctor, this old-school, soft-focus approach robs an undeniably well-intentioned movie of a vital edge of urgency and discomfort, allowing viewers to consign the cruelties it outlines to some imaginary distant past, when in truth, the sterilization policy continued well into the 21st century in both the Czech and Slovak Republics. The film begins with a montage of young Roma women, each shot as though for a studio portrait, impassively absorbing an offscreen voice lecturing them about family planning. “Sterilization,” the voice concludes disingenuously, “allows Gypsy women to improve their family’s quality of life.” The intention behind the portraiture is noble: to put faces to a crime more often recounted in impersonal statistics, when it is acknowledged at all. But although framed and lit with dignity by cinematographer Juraj Chlpík, none of these Roma women speak. The first words of argument or protest we hear are from Ingrid (Anna Geislerová), the film’s white protagonist, and she is not talking about reproductive rights at all. Instead, she is facing an all-male panel of her peers as she interviews for the role of head doctor at the hospital where she works. Ingrid knows the position will very likely go to one of her male colleagues, but that doesn’t stop her being angry and disappointed when it actually does. Popular on Variety Outside her work at the hospital, which in large part comprises assessing and performing the sterilizations in a procedure that leaves patients with a small scar beneath the navel nicknamed “the bow,” Ingrid has what can only be described as a beautiful life. With her music teacher husband Maros (Vlad Ivanov), she lives in a gorgeous house in the countryside, where her bedroom, glass-paned on two sides overlooking a lush forest, looks almost like a fairytale princess’ lair. In the warm-lit evenings she and Maros read and drink wine and listen to classical music; on her days off she goes for walks in the forest or, when it’s hot, visits the nearby river and looks on benignly as Roma children bob along playfully on tire tubes. It is only through her burgeoning friendship with Agata (a radiant Simona Boledovičová), a sweet-natured orderly who is reticent about her Romani idenitity, that Ingrid eventually starts to become uncomfortable with the work she does helping the hospital meet its government-recommended quotas for sterilizations. Ostrochovský’s film, co-written with Marek Leščák, is not anything quite as crude as a white savior narrative, but it is certainly one that assumes the best conduit for a wide audience to understand the cruelty visited on Czechoslovakian Roma families, is the moral awakening of a white woman. This faulty focus is particularly frustrating because Agata’s own story, and the manner in which she comes to reconcile herself with her Roma background, is by far the more intriguing narrative strand. As an orphan, Agata was separated from her sister Jula (an excellent Eva Mores), with each then going on to lead very different lives. Jula married within the Roma community, has had two children and is pregnant with an unwanted third. Agata, who at first barely acknowledges their connection, has been more independent, living with a roommate and working at the hospital, and recently getting serious with a boyfriend. “He’s white?” queries Jula in surprise when she hears that he’s a soldier. “Good for you.” The tides of unspoken resentment and disapproval that flow between the sisters are fascinating, with Agata able to move between Jula’s world, in a cramped flat in a crumbling building where kids play in dirty stairwells, and Ingrid’s enviably refined domestic environment. Eventually, just like Chlpík’s limpid camera, Agata comes to see the beauty in both, when in the film’s most moving moment, the sisters tacitly reconcile while Jula’s kids splash about in the tub at bathtime. There would have been the opportunity here to probe the long-term consequences for the Roma women bearing “the bow,” many of whom had been conned into a procedure that was misrepresented to them, in a language they did not speak, or in documentation they could not read. Instead, the film insistently returns us to Ingrid. As she’s kept awake by the first stirrings of her conscience, as she lazes in rumpled white bedsheets watching a beetle trundle across her pillow, as she’s depicted in macro close-ups that emphasize the blondeness of her hair, the fairness of her skin, the blueness of her eyes. Indeed, right up to a finale which resolves the remaining conflict with a rather glib miracle, the film’s loveliness practically becomes a liability, placing the real plight of the Roma several removes of perspective and aesthetic manipulation away, until you begin to wonder why we’re being given only beautiful things to look at, when there are so many ugly things that better warrant the attention. ‘Only Beautiful Things to Look At’ Review: A Handsome but Muffled Portrait of State-Sanctioned Cruelty Reviewed at Karlovy Vary Film Festival (Competition), Jul. 5, 2026. Running time: 88 MIN. Production: (Slovakia-Czech Republic-Hungary) An Aerofilms (in Czech Republic) release of a Punkchart Films, Negativ Film Productions production in co-production with Proton Cinema, Radio and Television Slovakia, Czech Television. (World sales: Punkchart Films, Bratislava). Producers: Ivan Ostrochovský, Albert Malinovský, Katarína Tomková. Co-producers: Pavel Strnad, Petr Oukropec. Crew: Director: Ivan Ostrochovský. Screenplay: Marek Leščák, Ostrochovský. Camera: Juraj Chlpík. Editors: Martin Malo, Josef Krajbich. Music: Michal Novinski. With: Anna Geislerová, Simona Boledovičová, Eva Mores, Vlad Ivanov, Éva Bandor, Attila Mokos. (Czech, Slovak, Hungarian, Romani dialogue) Sundance Film Festival, International Federation of Film Critics Establish Jury to Assess Movies From First-Time Foreign Directors (EXCLUSIVE) ‘A Happy Family’ Review: Anna Schinz’s Powerful Lead Performance Elevates a Confused Custody Drama ‘The Guest’ Review: A Superb Trine Dyrholm Adds Unsentimental Value to a Piercing Family Drama TV’s ‘Fall of Rome’ Broken Down by Scott Free’s David W. Zucker, Talking With ‘Wednesday’ Exec Producer Steve Stark at Italian Global Series Fest ‘3 Weeks After’ Review: A Bruising, Fiercely Controlled Study of High Schoolers in Moral and Psychological Freefall Maeve Jinkings, Bárbara Colen, Márcio Vito Attached to Star in Brazilian BAM Buzz Title ‘Mesopotamia’ (EXCLUSIVE) Loading comments... More From Our Brands Rolling Stone Comic Fends Off ‘Frivolous’ $27 Million Lawsuit Over ‘Lion King’ Joke, Will Seek Legal Fees Robb Report This New Sherry Cask-Matured Rum Comes From Scotland’s Islay Sportico Kawhi Trade Value Could Change Based on Aspiration Scandal WWD Inside Margherita Maccapani Missoni’s Private Couture Week Pop-up",0,2026-07-11 10:19:56
16,https://variety.com/2026/film/reviews/night-nurse-review-1236807149/,‘Night Nurse’ Review: Two Perverts Join Forces in a Gloriously Deviant Oddity About a Caretaker Drawn Into Her Patient’s Grifting Games,Variety,2026-07-11T09:39:45,6808,"Jul 11, 2026 2:39am PT ‘Night Nurse’ Review: Two Perverts Join Forces in a Gloriously Deviant Oddity About a Caretaker Drawn Into Her Patient’s Grifting Games Bruce McKenzie and newcomer Cemre Paksoy hypnotize in Georgia Bernstein’s daring feature debut, an erotic thriller that spins a real-world tale of exploitation into a disturbingly sumptuous fantasy. By Beatrice Loayza Plus Icon Beatrice Loayza Latest ‘Red Rocks’ Review: Weirdo, Cliff-Jumping Kiddies Are the Focus of Bruno Dumont’s Latest Experiment 2 months ago ‘The Birthday Party’ Review: Hafsia Herzi and Benoît Magimel Have a History in Léa Mysius’ Lackluster Home Invasion Thriller 2 months ago ‘I See Buildings Fall Like Lightning’ Review: Clio Barnard Returns With a Clunky Social-Realist Weepie About Five Friends in Birmingham 2 months ago See All Courtesy of Independent Film Company From the moment we meet luxury nursing-home patient Douglas (Bruce McKenzie), we feel something is up. The knowing sparkle in his baby-blue eyes; his slender gold chain and tufts of chest hair poking out of his medical jammies; his low, measured drawl — is it the voice of a former player who knows his mind is fading, and is playing sly to save face? Or is he perfectly in control of his faculties? In Georgia Bernstein ‘s gratifyingly perverse debut “ Night Nurse ,” this ambiguity upends the usual patient-caretaker dynamic, especially since Douglas’ new doe-eyed nurse Elemi (Cemre Paksoy) seems especially vulnerable to being controlled. Related Stories 'Strictly Business' Cannes Lions Edition: Fox's Rob Wade and Billy Parks Bet on Bringing Scale to the Business of Creators Strictly Business From Cannes Lions: NBCUniversal, IBM, State Farm, Autodesk and Coinbase Leaders on Marketplace Trends, AI and Reaching Consumers An erotic thriller with the glassy-eyed eeriness of a Peter Strickland joint, and with the kind of slippery sexual sensibility you might find in a Catherine Breillat provocation, “Night Nurse” premiered in Sundance’s experimental NEXT section this past January, and now opening in limited theaters across the U.S. It’s a gloriously deviant oddity, best suited to niche audiences drawn to atmosphere over plot, as Bernstein’s script achieves more as a woozy dreamspace than a neat crime story. Popular on Variety In any case, the scheme shaping the film’s stakes is introduced from the get-go, in a sultry opening credits scene where the camera glides over curly telephone cords and grasping hands in close-up. Over these images, two voices languidly recite what sounds like a roleplaying script, in which a desperate girl appeals to her grandpa for money. Later, we find out that this dialogue is a version of a game (albeit with real consequences) that Douglas plays with his nurses. The first night of Elemi’s shift, her patient corners her and pushes a phone into her face, demanding she play a hapless granddaughter begging her pops for settlement money; at the end of the call, Douglas takes over as her supposed attorney. It’s not immediately clear whether this scam has teeth or is merely a performance, but soon the full scope of Douglas’s grift (which also involves his day-nurse Mona, played coyly by Eléonore Hendricks) comes to the knowledge of the care facility’s leadership. This includes the steely Doctor Mann (Mimi Rogers), who may or may not have secrets of her own. There’s no (let’s say, conventional) sex here, but the nasty mind games and rough, breathless encounters pull in a satisfying amount of heat. Played gamely by newcomer Paksoy, fidgety Elemi plunges a bit too willingly into her part, fueling the film’s spicy propositions about the dark side of devotion and the potentially weird desires running, unsuspected, through dynamics of care and dependence. Bernstein was partly inspired by a true story involving her grandmother, who almost fell victim to a money-wiring scam by someone impersonating Bernstein’s brother, but the script only gestures at this real-world exploitation, ultimately using it as a jumping-off point for an erotic fantasy rife with taboos. Bernstein unfolds her naughty intrigue in the Chicago suburbs, where her grandmother lived, but the softly-lit, sterile locations — swimming pools, carpeted living rooms, motel rooms — evoke a state of limbo more than any real place. Cinematographer Lidia Nikonova’s waxy visuals work together with the cast’s lightly vacant performance styles to bolster this trance, creating a hazy mood that echoes Elemi’s loss of control; her gradual surrender to urges newly unleashed by Douglas. This brings us to the film’s greatest (and perhaps most frustrating) mystery: who is Elemi that she falls so deeply under her patient’s spell? This ambiguity doesn’t feel entirely intentional, but at least Paksoy’s performance makes her character’s unraveling feel nervy and thrillingly palpable. And as the film veers towards its unsettling finale, Bernstein turns a final trick that reveals her triumphantly sick sense of humor: “Night Nurse” is also a romance with a bleeding, black heart. ‘Night Nurse’ Review: Two Perverts Join Forces in a Gloriously Deviant Oddity About a Caretaker Drawn Into Her Patient’s Grifting Games Reviewed online, July 9, 2026. (In Sundance Film Festival — NEXT.) Running time: 95 MIN. Production: An Independent Film Company release of a Missing Link, Gary Prairie production. Producers: Veronica Barbosa, Georgia Bernstein, Liane Cunje, Edwin Linker, Lucy Rogers. Crew: Director, screenplay: Georgia Bernstein. Camera: Lidia Nikonova. Editor: Alex Jacobs. Music: Steven Jackson, Sam Clapp. With: Cemre Paksoy, Bruce McKenzie, Eleonore Hendricks, Colleen Rose Trundy, Mimi Rogers. Acclaimed Chilean Filmmaker Valeria Sarmiento Bids Farewell to Directing With Affecting Childhood Sexual Abuse Drama ‘Behind the Rain’ Social Issue Gore, Very Latino Gumshoes and OMG 2D Animation Power Up the Project Lineup at 2026’s Bogotá Audiovisual Market Jeffrey Wright Says Being Black Is a ‘Political Term,’ Talks Racist Abuse Against Kylian Mbappé: ‘They Think They Can Diminish How Powerful He Is With Their Stupidity’ ‘The Guest’ Review: A Superb Trine Dyrholm Adds Unsentimental Value to a Piercing Family Drama Sienna Spiro’s ‘The Visitor’ Introduces an Electrifying Voice That’s Here to Stay: Album Review Kevin Bacon, Kyra Sedgwick and Travis Bacon Talk About Their Bloody ‘Family Movie’ – and Why ‘Violence Can Be Hysterical’: ‘We Are Really Twisted People’ Loading comments... More From Our Brands Rolling Stone Comic Fends Off ‘Frivolous’ $27 Million Lawsuit Over ‘Lion King’ Joke, Will Seek Legal Fees Robb Report This New Sherry Cask-Matured Rum Comes From Scotland’s Islay Sportico Kawhi Trade Value Could Change Based on Aspiration Scandal WWD Inside Margherita Maccapani Missoni’s Private Couture Week Pop-up",0,2026-07-11 10:19:57
17,https://variety.com/2026/film/reviews/a-happy-family-review-1236804109/,‘A Happy Family’ Review: Anna Schinz’s Powerful Lead Performance Elevates a Confused Custody Drama,Variety,2026-07-11T09:19:52,7585,"Jul 11, 2026 2:19am PT ‘A Happy Family’ Review: Anna Schinz’s Powerful Lead Performance Elevates a Confused Custody Drama Swiss director Jan-Eric Mack's Karlovy Vary competition entry follows a working single mother at odds with child protection services. By Elena Lazic Plus Icon Elena Lazic Latest ‘A Happy Family’ Review: Anna Schinz’s Powerful Lead Performance Elevates a Confused Custody Drama 31 minutes ago ‘Chica Checa’ Review: Šimon Holý’s Karlovy Vary Competition Entry Is Worthy but Clumsy 6 days ago ‘The Get Out’ Review: Russell Crowe and a Game Supporting Cast Cannot Save Derrick Borte’s Tonally Ambitious Crime Comedy 2 weeks ago See All Courtesy of Karlovy Vary Intl. Film Festival There is a more interesting story lurking within Jan-Eric Mack ​’s “ A Happy Family ” than the one actually being told. At times, the Swiss filmmaker teases the possibility that the conventional narrative shown thus far might break into a bold, daring twist. It’s a promise unfulfilled, however, and those glimpses of something thornier and more daring ultimately come to seem like signs of a filmmaker not in total control of his argument. The first Swiss film to ever play in the Crystal Globe competition of the Karlovy Vary Film Festival , “A Happy Family” is a custody drama that turns out to be more interested in the “drama” part of the phrase, at the expense of plausibility. Related Stories 'Strictly Business' Cannes Lions Edition: Fox's Rob Wade and Billy Parks Bet on Bringing Scale to the Business of Creators NBA Draft 2026 on Sling TV: Here's How To Watch the Two-Day Event Online Without Cable Still, Anna Schinz impresses from the get-go as Nicole “Niki” Hofer, a single mother of two already struggling to satisfy child protection services in the film’s opening scene. DP Yunus Roy Imer previously shot “System Crasher”, Nora Fingscheidt’s explosive portrait of a difficult child navigating the foster system, and the same naturalism and attention to the slightest mood shifts is on display here. But what Mack actually aims to show through this aesthetic is less clear. Popular on Variety It is obvious in the scene that Niki loves her children, but it is odd that she is making them eat cereal without milk in front of the case worker who is observing them that morning. Perhaps the visit was unannounced; even so, Niki’s lack of preparation remains rather confusing when we learn in the next scene that she’s had several visits from social services already. This time around, she is even told that her youngest is getting sick and struggling to focus at school due to malnutrition. The stakes are already high. Niki works two jobs — in a laundry plant and a bar — and money is tight. But when tragedy very nearly strikes and the kids accidentally set fire to the flat while she is at work, the film itself is not at pains to identify economic precarity as the true cause of the disaster. In a meeting with the case workers who place Niki’s children in foster care following the incident, the angry mother explains that she did not receive her daughter’s distressed phone calls because her cellphone battery was dead at the time. This excuse is rendered all the more shocking when Niki blames her children for the catastrophe: Her phone was out of juice because the kids played too many games on it earlier that day. The filmmaking, however, does not interrogate or even acknowledge Niki’s lack of self-awareness. More interested in the mechanics of melodrama than in evolving a robust perspective or commentary on its protagonist, “A Happy Family” instead builds a comic rhythm in the back-and-forth between the defensive mother and her interlocutors. The scene ends with a hard cut as Niki lurches at one of the caseworkers, and the rest of the film maintains this lighthearted tone as she excitedly embarks on a wild adventure to get back to (and eventually kidnap!) her children. However this levity continues to jar with Niki’s immaturity, in that scene and beyond; even so, her juvenile lack of perspective is dramatically compelling. There are times when “A Happy Family” looks like it might not be the familiar tale of a hard-done-by mother fighting the system, but rather an interrogative character piece. As it goes on, the film reveals through intriguing details of dialogue and performance the profound personality flaws of a protagonist who initially seems less dangerous than she turns out to be. On several occasions, Mack’s filmmaking does point out that Niki is going too far: Some of the most high-octane and exciting moments in her incredibly irresponsible mission are scored by ominous melodies that sharply contrast with her enthusiasm. But Mack and his co-writers — including Schinz — never quite join the dots. Although everything suggests that Niki, in her reckless behavior, is at least partially responsible for her own situation, “A Happy Family” stops short of actually engaging with this idea. The film instead concludes with Niki’s banal statement on poverty pushing people to extremes — which isn’t entirely borne out by the reality of the story. Another recent film that explored remarkably similar dramatic and thematic territory, Daisy-May Hudson’s “Lollipop”, better humanized and problematized its complex female protagonist, situating her plight within a wider socioeconomic context, while never losing sight of the specifics of her experience and personality. Here, Niki’s impulsivity is romanticized, her lack of foresight excused, her temper explained away: The only way to make sense of the film’s perspective on her is to imagine her as the cliché of the working-class mum with a heart of gold, but who just doesn’t know any better. It is to Schinz’s credit that Niki ultimately comes across as a much more human and interesting figure than that. ‘A Happy Family’ Review: Anna Schinz’s Powerful Lead Performance Elevates a Confused Custody Drama Reviewed at Karlovy Vary International Film Festival (Crystal Globe Competition), July 4, 2026. Running time: 121 MIN. Production: (Switzerland) A C-FILMS AG production. (World sales: Bendita Film Sales, Santa Cruz de Tenerife.) Producers: Martin Joss, Peter Reichenbach. Crew: Director: Jan-Eric Mack. Screenplay: Anna Schinz, Nikita Afanasjew, Eva Kienholz, Jan-Eric Mack. Camera: Yunus Roy Imer. Editor: Benjamin Fueter. Music: Thomas Kuratli. With: Anna Schinz, Michael Neuenschwander, Julia Jentsch, Alireza Bayram, Bettina Stucky, Martina Apostolova. (German, English dialogue) Acclaimed Chilean Filmmaker Valeria Sarmiento Bids Farewell to Directing With Affecting Childhood Sexual Abuse Drama ‘Behind the Rain’ ‘Mu-ki-ra,’ From Colombian Creative Powerhouse Estefanía Piñeres Duque and ‘Decorado’ Producer Chelo Loureiro, Brought to Market by Latido Films (EXCLUSIVE) Harvey Keitel Shooting ‘No Bias,’ Written by Wife Daphna Kastner, Calls Out ‘Danger’ of AI When Mentioning Michael Caine AI-Narrated ‘The Odyssey’ Audiobook Netflix’s ‘Little House on the Prairie’ Is a Charming Reimagining of Laura Ingalls Wilder’s Beloved Adventure: TV Review ‘Chica Checa’ Review: Šimon Holý’s Karlovy Vary Competition Entry Is Worthy but Clumsy ‘The Kitchen’ Director Alonso Ruizpalacios at BAM: ‘We Need More Trojan Horses’ Loading comments... More From Our Brands Rolling Stone Comic Fends Off ‘Frivolous’ $27 Million Lawsuit Over ‘Lion King’ Joke, Will Seek Legal Fees Robb Report This New Sherry Cask-Matured Rum Comes From Scotland’s Islay Sportico Kawhi Trade Value Could Change Based on Aspiration Scandal WWD Inside Margherita Maccapani Missoni’s Private Couture Week Pop-up",0,2026-07-11 10:19:58
