id,url,title,source,publication_date,text_length,full_text,is_duplicate,created_at
23,https://variety.com/2026/tv/global/comcast-sky-itv-deal-terms-1236790155/,Comcast-Owned Sky Agrees on Terms to Buy ITV’s Broadcast and Streaming Unit (Report),Variety,2026-06-25T08:47:16,4061,"Jun 25, 2026 1:47am PT Comcast-Owned Sky Agrees on Terms to Buy ITV’s Broadcast and Streaming Unit (Report) By Leo Barraclough Plus Icon Leo Barraclough International Features Editor LeoBarraclough Latest Comcast-Owned Sky Agrees on Terms to Buy ITV’s Broadcast and Streaming Unit (Report) 3 hours ago Asa Butterfield, Jonny Lee Miller and Christine Tremarco Join Beatles Series ‘Hamburg Days’ 13 hours ago Dustin Hoffman, Juliette Binoche, Jeffrey Wright to Be Honored at Karlovy Vary Film Festival 2 days ago See All Courtesy of ITV Sky , the Comcast-owned U.K. pay-TV operator, has agreed on terms to buy British broadcaster ITV ’s media and entertainment division, which is its network arm. Reuters reported the development on Thursday, citing two people familiar with the negotiations. As part of the £1.6 billion ($2.1 billion) deal, ITV Studios – the standalone production unit – would acquire “The Great British Bake Off” producer Love Productions. The transaction could be valued between £80 million and £120 million based on comparable deals, and an earn-out, the sources said. ITV Studios is not part of the Sky acquisition. Related Stories 'Love Island USA' Season 8 Is Peacock's Most-Watched TV Debut Ever, With 23% of Viewership on Phones and Tablets 'All Her Fault' Team Sets Peacock Mystery Series 'The Break-In' Based on Katherine Faulkner Novel The deal had shifted in a positive direction in the past week, Reuters said, and was now being finalized by lawyers, according to the sources, speaking on condition of anonymity. Popular on Variety ITV declined to comment when reached by Variety . Representatives for Sky and Comcast did not immediately respond to request for comment. Following the Reuters report, ITV shares rose 2.9% on Thursday, giving the group, which comprises its broadcast and streaming unit and ITV Studios production company, a market ‌value of £3.1 ⁠billion ($4.08 billion). Reuters reported last month that the transaction would include a payout dependent on the ITV unit’s performance of about £200 million ($264 million). Reuters’ sources claimed that the deal could be closed in the next two weeks, but one cautioned that the timing could slip due to legal complications. However, even then, it won’t be a done deal. The U.K.’s Competition and Markets Authority and media regulator Ofcom both need to approve it, and the final decision lies with the British government’s culture secretary, Lisa Nandy. Rival broadcasters Channel 4 and Channel 5, which are both dependent on advertising revenue, are likely to oppose the deal on competition grounds. Another issue is ITV’s 40% stake in ITN, which supplies news output to Channel 4 and Channel 5 as well as ITV. The deal creates a merged company that can better compete with Netflix, YouTube, Amazon Prime Video and Disney+ in the U.K. streaming market. ITV has been focusing increasingly on boosting the reach of its streaming platform, ITVX, as audiences and advertisers continue to drift away from its linear channels. Lesley Manville, Aldis Hodge, Kevin McKidd to Headline Business Forum Lineup at Monte-Carlo Television Festival David Boreanaz on Taking On Iconic Role of Jim Rockford in ‘The Rockford Files’: ‘My Attitude Is “I Want to Make James Garner Proud”’ John Hannah Teases New ‘Mummy’: ‘You’ve Heard All the Rumors and It’s True. Everyone’s Back’ ‘Gone,’ ‘Tip Toe’ Star David Morrissey on Relying on Gut Instinct: ‘Analysis Can Be Paralysis Sometimes’ ‘The Uniform,’ From Miso Film and Fremantle, Returns for a Second Season – and Dives Into the Cracks Within the Police Force (EXCLUSIVE) Kristin Scott Thomas Receives Crystal Nymph From Prince Albert II at Monte-Carlo Television Festival Opening Loading comments... More From Our Brands Rolling Stone Leonard Cohen Estate Does Not Support Trump’s Plan to Use ‘Hallelujah’ at Freedom 250 Rally Robb Report Pomellato’s New High Jewelry Collection Is a Masterclass in Eclecticism Sportico CC Sabathia, Hunter Pence, Dexter Fowler on Day 3 at Cannes Lions WWD H&M Sees Flat Sales in Q2 With 3% Fewer Stores",0,2026-06-25 11:44:59
7,https://deadline.com/2026/06/blue-murder-motel-acorn-tv-itv-deals-cozy-crime-1236967146/,Acorn TV & ITV Buy Kiwi Cozy Crime Drama ‘Blue Murder Motel’,Deadline,2026-06-25T08:19:04,2643,"Skip to main content By Stewart Clarke Stewart Clarke More Stories By Stewart ‘Culpables’ & ‘Fault’ Films Sweep Prime Video Originals Rankings, Taking Half Of The Top 10 Seriesly Berlin Expands for 2026 With ‘Stories At Risk’ Initiative & New Creator Track France TV Boards BBC & PBS Nature Doc ‘An Hour On Earth’ View All June 25, 2026 1:19am Blue Murder Motel APC Buyers in the U.S. and UK have checked in to Blue Murder Motel . The cozy crime show about a pair of career cops who retire to a beachside town hails from New Zealand and has been picked up by Acorn TV for the U.S. and Canada and ITV for the UK. The series follows married couple Vinny and Cole, who leave their cop careers behind to run a motel in a sunny beachside New Zealand town. Events take an unexpected turn when a dead body is discovered. That sets the tone, as the retired detectives find themselves drawn into investigating crimes, with a new case in each episode. Related Stories News Paramount's 5 Pacts With WBD's TNT Sports For Tour De France Highlights News ITV Boss Dodges Sale Question But Says Networks Biz Is Now ""Recognized By Shareholders As A Strong Business"" Blue Murder Motel was created by Kate McDermott ( Step Dave ) and directors include Lucy Lawless. Michala Banas ( McLeod’s Daughters ) stars as Vinny and Brett Tucker ( The Americans ) as Cole. The cast also includes Jayden Daniels, Stephanie Tauevihi and Jaime McDermott. A second season is in production. The series is produced by Great Southern Television for Kiwi pubcaster TVNZ. It is sold by APC , which launched it at London Screenings in Feb. Cozy crime remains a big seller internationally. The UK has shows such as Midsomer Murders and Death in Paradise , and France has emerged as a hot spot for the drama sub-genre, with hits including High Intellectual Potential and Bright Minds (aka Astrid et Raphaëlle ). Watch on Deadline APC has also sold the series to BBC First in Poland, BBC NL in the Netherlands and BBC Belgium, and Disney for its Star Crime channel in the Balkans. Emmanuelle Guilbart and Laurent Boissel, Joint CEOs and Joint Founders of APC, said: “There continues to be strong demand for well-written, light crime drama. Blue Murder Motel is the perfect example of a primetime series that is warm, funny and hugely appealing to wide audiences all around the globe.” Sky & ITV Agree Terms Over $2.1B Deal, Anno Imminent: Report James Bond Search Heats Up As Producers Target Actors, Set New Auditions ‘Supergirl’ Review: DC’s Latest Superhero Pic Doesn’t Fly High Enough ‘Toy Story 5’ Won’t Play Nice With ‘Supergirl’, Eyes Win With Near-$90M Read More About: Comments",0,2026-06-25 11:44:41
29,https://www.hollywoodreporter.com/tv/tv-news/asa-butterfield-jonny-lee-miller-christine-beatles-hamburg-1236630442/,"Asa Butterfield, Jonny Lee Miller and Christine Tremarco Join BBC Beatles Drama ‘Hamburg Days’",Hollywood Reporter,2026-06-25T08:11:07,2528,"Skip to main content By Lily Ford Plus Icon Lily Ford @lilyfordtweets Follow Sign Up View All June 25, 2026 1:11am Butterfield (left) will play Beatles manager Brian Epstein in 'Hamburg Days' Courtesy of Getty Logo text Asa Butterfield , Jonny Lee Miller and Adolescence star Christine Tremarco have joined the upcoming six-part Beatles drama at the BBC . Hamburg Days , created by The Crown ‘s Christian Schwochow alongside head writer Jamie Carragher ( Succession ), is currently filming in Hamburg, where the band performed over 250 shows. Sex Education alum Butterfield has joined the cast as Beatles manager Brian Epstein, while Miller ( Trainspotting ) will play Jim McCartney, father to Paul McCartney, and Tremarco John Lennon’s guardian Aunt Mimi. Related Stories Movies In 'The Lion at My Back,' A Teenage Asylum Seeker and a Cypriot in Her 40s Form an Unexpected Bond (Exclusive Clip) TV Gary Oldman to Receive Edinburgh TV Fest's Golden Icon Award (Exclusive) More cast additions confirmed this week include Darci Shaw as Cynthia Lennon, Ryan Sampson as Liverpool promoter Alan Williams, Archie George as singer Tony Sheridan, Jorden Myrie as Lord Woodbine, Lea Drinda as Astrid Kirchherr, Tash Major as Dot Rhone, and Louis McCartney, who will play Ringo Starr. They join the previously announced Rhys Mannion as Lennon, Ellis Murphy as McCartney, Harvey Brett as George Harrison, Louis Landau as Stu Sutcliffe, Patrick Gilmore as Pete Best, and Casper von Bülow as Klaus Voormann. Hamburg Days is set in the early 1960s in the smoke-filled clubs of Hamburg’s St. Pauli red light district, where an inexperienced young rock ’n’ roll band from Liverpool collides with two young artists, Klaus Voormann and Astrid Kirchherr. Together, they help spark a transformation that turns a scrappy group of teenagers into the greatest music phenomenon the world has ever known. W&B Television and Turbine Studios are producing the series with music curated by music producer David Holmes ( Killing Eve ). Hamburg Days was developed by Benjamin Benedict ( Generation War ) and is written by Jamie Carragher, who also serves as executive producer. Showrunner and executive producer Christian Schwochow is directing alongside Laura Lackmann ( Call My Agent Berlin ). Frank Lamm ( Andor ) serves as director of photography. Klaus Voormann is an exclusive consultant to the series. The show will air in the U.K. on BBC iPlayer and BBC One. AGC International is handling worldwide sales outside the U.K. (BBC) and Germany (ZDF). THR",0,2026-06-25 11:45:06
8,https://deadline.com/2026/06/netflix-dept-q-cast-season-2-starts-production-goode-1236967138/,Netflix’s ‘Dept. Q’ Adds New Cast & Rolls Cameras On Season 2,Deadline,2026-06-25T08:08:09,2954,"Skip to main content By Max Goldbart Max Goldbart International TV Co-Editor @Goldbart1 More Stories By Max Netflix’s ‘Dept. Q’ Adds New Cast & Rolls Cameras On Season 2 BBC & BritBox Returning To ‘The Other Bennet Sister’ For Three-Part Christmas Special Amazon MGM’s Ludovic Attal Joins ‘Bad Boy’ Studio Sipur As President View All June 25, 2026 1:08am Matthew Goode as DCI Carl Morck in 'Dept. Q' Netflix Netflix ’s hit Dept. Q thriller has welcomed new cast and rolled cameras on Season 2. The series is introducing Aisling Franciosi ( Speak No Evil, The Nightingale ) as Kimmie, Greg Wise ( The Crown, The Buccaneers ) as Derek Powell, Nicholas Rowe ( Red Eye S2, Spy Among Friends ) as Thomas Fulton, Tony Curran ( Outlander: Blood of my blood, Mary and George ) as Winnie Calderwood, Hamish Clark ( Monarch of the Glen ) as Christopher Herron, Alex Ferns ( Waiting for the Out, The Batman ) as Phil Allenbeck, Ross Anderson ( Knight of the Seven Kingdoms, The Rig ) as Ricky Daddario, Rebecca Root ( Heartstopper, The Wheel of Time ) as June Lovesay, Isla Johnston ( The Queen’s Gambit, The Carpenter’s Son) as Agnes and Amy Brenneman (The Old Man, Judging Amy) as Helen. Related Stories Executives Netflix Moves Adult Animation Back Under Head Of Comedy Tracey Pakosta Books Everything We Know About Netflix's 'Little House On The Prairie' Reimagining So Far Dept. Q stars Matthew Goode as DCI Carl Morck, leading a team of misfits from the basement of an Edinburgh police station, charged with cases previously deemed unsolvable. Returning to support him are Alexej Manvelov ( Jack Ryan, Top Dog ) as Akram Salim, Leah Byrne ( But When We Dance ) as DC Rose Dickson and Jamie Sives (Guilt, Chernobyl) as DS James Hardy, along with Mark Bonnar ( Line of Duty, Ludwig ) as Stephen Burns, Kate Dickie ( The Witch, Game of Thrones ) as Moira Jacobson, Aaron McVeigh as Jasper and Sanjeev Kohli ( Still Game, River City ) as Martin Fleming. Watch on Deadline Produced by The Crown maker Left Bank , Dept. Q has been one of Netflix’s biggest hits outside the U.S. in recent years. Based on the Jussi Adler-Olsen novels, Dept. Q comes from writer-director Scott Frank ( The Queen’s Gambit , Godless) and is exec produced by Frank, Rob Bullock and Charlotte Moore, the latter’s first big project since joining Left Bank from the BBC. Manda Levin and Jessica Burdett will oversee for Netflix. Bullock said: “This season, Carl and his band of misfits tackle a terrible crime hidden in the highest echelons of Scottish society. It is a story for our times: rich and powerful people who believe they are above the law. Carl, of course, knows otherwise.” Sky & ITV Agree Terms Over $2.1B Deal, Anno Imminent: Report James Bond Search Heats Up As Producers Target Actors, Set New Auditions ‘Supergirl’ Review: DC’s Latest Superhero Pic Doesn’t Fly High Enough ‘Toy Story 5’ Won’t Play Nice With ‘Supergirl’, Eyes Win With Near-$90M Read More About: 2 Comments",0,2026-06-25 11:44:42
30,https://www.hollywoodreporter.com/movies/movie-news/the-lion-at-my-back-film-clip-karlovy-vary-2026-cyprus-1236626729/,"In ‘The Lion at My Back,’ A Teenage Asylum Seeker and a Cypriot in Her 40s Form an Unexpected Bond (Exclusive Clip)",Hollywood Reporter,2026-06-25T08:02:00,2192,"× Skip to main content By Georg Szalai Plus Icon Georg Szalai Global Business Editor View All June 25, 2026 1:02am ‘The Lion at My Back’ Courtesy of KVIFF In The Lion at My Back , director Tonia Mishiali tells a cinematic story of an unexpected bond. Mariama, a Senegalese asylum seeker in Cyprus, has just turned 18. She meets Stella, who is in her 40s and recently decided to break free from the clutches of addiction to make a fresh start. The new film from Mishiali, whose 2018 debut feature Pause , about a housewife in an unhealthy marriage who starts daydreaming about revenge, turned heads, brings the Cypriot producer, writer and director back to Karlovy Vary. In fact, The Lion at My Back will world premiere on July 6 in the Crystal Globe competition of the 60th edition of the Karlovy Vary International Film Festival ( KVIFF ). Related Stories Movies Kino Lorber Takes U.S. Rights to Manuela Martelli's Cannes Film 'The Meltdown' (Exclusive) TV Defying the Trolls, the 'Rick and Morty' Verse Keeps Expanding Sokhna Diallo, Elena Kallinikou, Prokopis Agathocleous and Herodotos Miltiadous lead the cast. The KVIFF website promises “a vivid, heartwarming, and hopeful story about how family bonds and motherly love can be found in the most unlikely places.” Mishiali wrote the screenplay for The Lion at My Back with Dianne Jones and Simona Nobile. The director of photography is Manu Tilinski, the editor is Emilios Avraam. The producers are Mishiali, Katarzyna Ozga, Nicolas Steil, Marinos Charalambous, Vladimir Subotic and Antoine Simkine. The production company behind the film is Bark Like A Cat Films, with co-production by Iris Productions and Avaton Films. The Yellow Affair is handling sales on The Lion at My Back . Ahead of its world premiere at the big Czech film festival, THR can now premiere an exclusive sneak peek at the movie. In the clip below, we meet the two leading ladies sharing a tender moment of conversation. They discuss men, pain and more – and they do so in an unusual landscape that seems made to stimulate your senses. So, sit back, relax and get ready to dive into an exclusive first cinematic and emotion-filled taste of The Lion at My Back . THR",0,2026-06-25 11:45:07
31,https://www.hollywoodreporter.com/tv/tv-news/gary-oldman-slow-horses-edinburgh-tv-fest-golden-icon-1236628414/,Gary Oldman to Receive Edinburgh TV Fest’s Golden Icon Award (Exclusive),Hollywood Reporter,2026-06-25T08:00:00,2411,"× Skip to main content By Scott Roxborough Plus Icon Scott Roxborough Europe Bureau Chief sroxborough Follow Sign Up View All June 25, 2026 1:00am Gary Oldman in 'Slow Horses.' Courtesy of Apple TV We can only pray he keeps the flatulence in check. Oscar-winning actor Gary Oldman , known to fans of AppleTV+ series Slow Horses as the shambolic, gassy spy Jackson Lamb, will be honored at this year Edinburgh Television Festival with the fest’s lifetime achievement honor, the Golden Icon Award. He will also sit down with TV presenter Edith Bowman for a conversation on six seasons of Slow Horses and other highlights from his remarkable career. “To receive an award bearing the title ‘Global Icon’ is both enormously flattering and faintly alarming!” Oldman said in a statement. “In all seriousness, I am touched by this generosity and thankful to all those whose creativity, trust, and collaboration have shaped my journey. My warmest thanks to the festival, and I very much look forward to being with you in Edinburgh.” Related Stories Movies Marek Eben Hosts KVIFF Ceremonies With Hollywood Stars and the Czech 'Dancing With the Stars.' Which One Is More Stressful? Lifestyle Ludacris, Caviar Ice Cream and Paris Hilton by Boat: Inside the UTA and DoorDash Ads Executive Soirée at Cannes Lions Born in 1958 in working-class New Cross, South London, Oldman came up through British theater before breaking out in the 1980s playing dangerous, damaged men, from Sid Vicious in Sid and Nancy to playwright Joe Orton in Prick Up Your Ears . By the mid-1990s, roles in Léon: The Professional , True Romance and The Fifth Element had cemented him as Hollywood’s go-to heavy, earning him the nickname “Scary Gary” from Air Force One co-star Harrison Ford. The 2000s saw a reinvention, and one of the most acclaimed second acts in Hollywood history. Alongside supporting roles in major franchises — playing Sirius Black in the Harry Potter films and Jim Gordon in Christopher Nolan’s Dark Knight trilogy — Oldman played George Smiley in Tinker Tailor Soldier Spy (2012), earning his first Oscar nomination, and followed up with an Oscar-winning performance as Winston Churchill in Darkest Hour (2018). His transition to serial TV, with the Emmy and Bafta-winning Slow Horses has been equally successful. Season 6 of Slow Horses debuts on Apple TV Sept. 16. The 2026 Edinburgh Television Festival runs Aug. 25-28. THR",0,2026-06-25 11:45:08
9,https://deadline.com/2026/06/lionel-richie-falls-ill-cuts-short-tour-first-night-1236967125/,"Lionel Richie Falls Ill On Stage, Cutting Short First Night Of New Tour",Deadline,2026-06-25T07:24:54,2345,"Skip to main content By Jake Kanter Jake Kanter International Investigations Editor @Jake_Kanter More Stories By Jake Lionel Richie Falls Ill On Stage, Cutting Short First Night Of New Tour Beatles Series ‘Hamburg Days’ Adds Asa Butterfield, Jonny Lee Miller & Christine Tremarco Paramount-Warner Merger Reportedly Set To Clear EU Antitrust Hurdles — But With Caveats View All June 25, 2026 12:24am Lionel Richie performs in Belfast in 2025 Getty Lionel Richie was forced to abandon the first night of his new tour after feeling unwell during a performance in Minnesota. The 77-year-old American Idol judge complained about feeling dizzy during the opening night of the Sing a Song All Night Long Tour featuring Earth, Wind & Fire. Appearing at the Grand Casino Arena in St. Paul, Richie sat down during a rendition of “Dancing on the Ceiling,” according to videos posted on X/Twitter. “When you’re feeling dizzy, sit your ass down,” he told concertgoers, per The Minnesota Star Tribune . BREAKING: Lionel Ritchie concert in St Paul at Grand Casino Arena canceled mid-show. Ritchie sat down on stage during “Dancing on the Ceiling”, said he felt dizzy. Performed one more song at piano, “Three Times a Lady”, then announced unplanned intermission. Did not return. pic.twitter.com/RNalkYHnmG — Patrick Kessler (@PatKessler) June 25, 2026 Because he was feeling dizzy and strange, @lionelrichie performed Dancing on the Ceiling sitting down on opening night @grandcasarena pic.twitter.com/5LYk5unI9s — Jon Bream (@jonbream) June 25, 2026 The Tribune reported that the Rock & Roll Hall of Famer then performed “Three Times a Lady” at a piano before calling an unexpected intermission. He did not return to the stage. Watch on Deadline Saxophonist Dino Soldo told the audience that Richie would not be able to continue. “Unfortunately, Lionel is not feeling well,” he said. “Additional information will be available.” Deadline has contacted Richie’s reps for comment. Before the gig, he posted excitedly about the tour. View this post on Instagram Sky & ITV Agree Terms Over $2.1B Deal, Anno Imminent: Report James Bond Search Heats Up As Producers Target Actors, Set New Auditions ‘Supergirl’ Review: DC’s Latest Superhero Pic Doesn’t Fly High Enough ‘Toy Story 5’ Won’t Play Nice With ‘Supergirl’, Eyes Win With Near-$90M Read More About: Comments",0,2026-06-25 11:44:43
10,https://deadline.com/2026/06/mia-mckenna-bruce-alex-hassell-rosie-day-audible-tutor-1236966150/,Mia McKenna-Bruce & Alex Hassell To Voice Rosie Day’s Audible Original Thriller ‘The Tutor’,Deadline,2026-06-25T07:01:00,2812,"Skip to main content By Andreas Wiseman Andreas Wiseman Executive Editor, Film & International @AndreasWiseman More Stories By Andreas Mia McKenna-Bruce & Alex Hassell To Voice Rosie Day’s Audible Original Thriller ‘The Tutor’ Natalie Burn To Topline Cartel Action-Thriller ‘Dead Weight’, Guatemala Shoot Due This Fall Jonathan Banks & Alexander Siddig Among Cast For Indie Pic ‘Words From The Oven’ Filming In Pennsylvania View All June 25, 2026 12:01am Mia McKenna-Bruce, Alex Hassell, Rosie Day and 'The Tutor' Ruth Crafer/DWGH Photography/Courtesy EXCLUSIVE : Mia McKenna-Bruce ( How to Have Sex ) and Alex Hassell ( Rivals ) have been set to voice Audible Original thriller The Tutor from writer and actor Rosie Day ( Outlander ). In The Tutor , “Eloise Hart returns to the secondary school where she studied under the mercurial brilliance of her former teacher Jack Collins. But Eloise isn’t here to teach the young minds of tomorrow, she’s here to burn this man from the inside out. When she discovers sixteen-year-old musical prodigy Olivia in her class, the echoes of the past begin to feel dangerously close. As old secrets burn with new flames, Eloise must master the very feelings that have shaped her to stop history repeating itself again.” Related Stories News 'SPLBERG': Audible To Launch Podcast Series About Man Who Pretended To Be Steven Spielberg's Nephew News Andrew Scott & George MacKay Lead Voice Cast Of Russell Tovey's Debut Novel 'Starlings', Which Is Being Published By Audible Rosie Day said: “I was inspired to write The Tutor by how often women’s trauma is dismissed, minimised, or misunderstood. Eloise’s story came from a desire to give voice to buried anger and the need for accountability. Rather than focusing solely on healing, I was interested in the darker, less socially acceptable response – revenge.” Watch on Deadline She continued: “ What does it mean for a woman to return to the source of her trauma not for closure, but to take control of the narrative that once silenced her? Ultimately, the novel is about reclaiming power in a world that often denies women the clarity or even the permission to name what happened to them. It asks whether revenge can ever bring resolution, or if the real battle is learning to trust yourself again when that trust has been broken.” Best known for playing Mary Hawkins in hit Starz series Outlander , Day has is also known for Living The Dream, Misfits, Call the Midwife, Good Omens, The Sandman, Grantchester and Black Books . Sky & ITV Agree Terms Over $2.1B Deal, Anno Imminent: Report James Bond Search Heats Up As Producers Target Actors, Set New Auditions ‘Supergirl’ Review: DC’s Latest Superhero Pic Doesn’t Fly High Enough ‘Toy Story 5’ Won’t Play Nice With ‘Supergirl’, Eyes Win With Near-$90M Read More About: Comments",0,2026-06-25 11:44:44
