id,url,title,source,publication_date,text_length,full_text,is_duplicate,created_at
23,https://www.hollywoodreporter.com/movies/movie-news/delroy-lindo-bafta-tourettes-naacp-image-awards-1236518416/,Delroy Lindo Speaks Out on BAFTA Tourette’s Incident at NAACP Image Awards: “Something Negative Becoming Positive”,Hollywood Reporter,2026-03-01T02:43:35,2501,"× Skip to main content By Hilary Lewis Plus Icon Hilary Lewis Deputy Editor, East Coast hilarylewis Follow Sign Up View All February 28, 2026 6:43pm Ryan Coogler and Delroy Lindo at the 2026 NAACP Image Awards. Paras Griffin/Getty Images for BET At the end of the week that saw the 2026 BAFTA Awards descend into controversy after guest John Davidson, who has Tourette Syndrome, shouted the N-word while Michael B. Jordan and Delroy Lindo presented an award, the 2026 NAACP Image Awards offered numerous opportunities for those affected by the incident to express their support for Jordan and Lindo. And Lindo himself offered his first public comments on the incident, taking the stage with his Sinners writer-director Ryan Coogler a little over an hour into the ceremony to loud applause at the Pasadena Civic Auditorium. Related Stories Movies Viola Davis Incites Inspiration During NAACP Image Awards Speech: ""Our Crown Has Already Been Bought, All We Have to Do Is Wear It"" Movies 2026 NAACP Image Awards: Winners List (Updating Live) “I’d just like to officially say, I appreciate, we appreciate all the support and love we have been shown in the aftermath of what happened last weekend. It means a lot to us,” Lindo said. He added the moment is a “classic case of something that could be very negative becoming very positive” and reflected on the “honor” of being at the NAACP Image Awards . BAFTA has since offered a full apology for the incident , which reached a wider audience when it aired during the BBC broadcast of the awards show, and vowed to launch a “comprehensive review” of the ceremony. Earlier during Saturday’s NAACP Image Awards, which aired live on CBS and BET, host Deon Cole jokingly offered a prayer for anyone in the audience with Tourette’s to “read the room.” Later, presenting the first award of the evening, to Sinners ‘ Miles Caton, Regina Hall took a moment to recognize “kings” Jordan and Lindo for their “class,” comments that led to a standing ovation. Abbott Elementary star and creator Quinta Brunson, winning the second award of the evening for best actress in a comedy series, also offered a shoutout to the cast and crew of Sinners . “We see you,” she said. “We’re behind you … love you.” Sinners led this year’s NAACP Image Awards nominations with 18 nods and had won nine of those by the time Coogler and Lindo took the stage. Afterward, the film won two more, including best actor (Michael B. Jordan) and best motion picture, bringing its total to 11. THR",0,2026-03-01 02:59:36
24,https://www.hollywoodreporter.com/movies/movie-news/viola-davis-naacp-image-awards-speech-1236518377/,"Viola Davis Incites Inspiration During NAACP Image Awards Speech: “Our Crown Has Already Been Bought, All We Have to Do Is Wear It”",Hollywood Reporter,2026-03-01T02:29:56,3493,"× Skip to main content By McKinley Franklin Plus Icon McKinley Franklin View All February 28, 2026 6:29pm Viola Davis accepts the Chairman's Award during the 57th NAACP Image Awards. Paras Griffin/Getty Images for BET Viola Davis delivered a powerful speech at the 2026 NAACP Image Awards on Saturday night, where she reflected on her early beginnings, success in the industry and the current state of the nation. The EGOT winner was honored with the Chairman’s Award, hitting the stage on Saturday and beginning her acceptance speech by noting, “I always feel like I’m going to step into feeling like I deserve it.” “I like this quote, that the definition of hell is on your last day on Earth, the person you became meets the person that you could have become,” she continued. “I say that about our nation, I say that about myself; that there is no becoming until you face the depth and the darkness of your own soul. There is no becoming without healing, and without a radical acceptance of one’s truth. I know that about myself growing up in poverty.” Related Stories Movies 2026 NAACP Image Awards: Winners List (Updating Live) Movies Leonardo DiCaprio to Miss Actor Awards Due to Filming Martin Scorsese's 'What Happens at Night' The Woman King actress reflected on her upbringing, noting, “Little chocolate girl with thick lips and wide nose in Rhode Island in 1965. I didn’t see hope. I didn’t see dreams. I just wanted to be somebody. I wanted success because I thought it was significance. And no one can describe the journey of going from the little chocolate girl searching for hope, searching for God, and the girl living a transcendent life.” “That is a hero’s journey, and we have only to follow the thread of a hero’s path. And where we had thought we would find an abomination, we shall find a God. And where we thought that we could slay the other, we will slay ourselves. And where we had thought to journey outwards, we shall come to the center of our own existence,” Davis added. “And where we had thought to be alone, we shall come to be with all the world. There is no soul of a nation without the soul of its people. And the soul of its people is not just who is represented in the breathing and alive people in this room, but by all those who are no longer here. We either move forward together or not at all. There is no man behind the curtain who has a control over your life.” “Our crown has already been bought and paid for,” she said. “All we have to do is wear it.” Davis went on to commend “the people that we forget, the people don’t that we don’t think about, the work that we don’t want to do,” sharing praise for “the people working at the food pantry in Central Falls feeding 3000 people a month, the people who are caring for my mother who’s in advanced dementia, caring for the least of these.” “You are my hero. I see you,” she concluded. “Thank you.” Saturday night, Colman Domingo additionally received the President’s Award, while Salt-n-Pepa and DJ Spinderella were set to be inducted into the NAACP Image Awards ’ Hall of Fame. Ahead of the televised awards show, a slew of winners were unveiled earlier this week. Michelle Obama, Will Packer and Kendrick Lamar’s Super Bowl halftime show each won big during night one ; Lamar, SZA and Cardi B took home awards during night two ; and Sinners, Gracie’s Corner, Ironheart, Celebrity Family Feud and Straw acquired victories on night three . See the full 2026 NAACP Image Awards winners list here . THR",0,2026-03-01 02:59:37
1,https://deadline.com/2026/02/shia-labeouf-arrested-again-new-orleans-1236739886/,"Shia LaBeouf Arrested Again On Additional Charge Related To Earlier Jailing In New Orleans; Reflects On “Dirty, Ugly, Disgusting” Behavior",Deadline,2026-03-01T02:07:42,4687,"Skip to main content By Natalie Oganesyan Natalie Oganesyan Weekend Editor @nat_oganesyan More Stories By Natalile Shia LaBeouf Arrested Again On Additional Charge Related To Earlier Jailing In New Orleans; Reflects On “Dirty, Ugly, Disgusting” Behavior Maggie Gyllenhaal Talks Directing Brother Jake Gyllenhaal For The First Time In ‘The Bride!’ & Early Feelings Of Envy In Her Career ‘Paradise’s Sterling K. Brown On Xavier & Annie’s “Purely Platonic” Bond: “We Don’t Get A Chance To Explore Enough Of These Relationships On Camera” View All February 28, 2026 6:07pm Shia LaBeouf attends the 23rd Annual Hollywood Film Awards on Nov. 3, 2019 in Beverly Hills, California. Emma McIntyre/Getty Images Shia LaBeouf has once again been arrested, this time on an additional charge of misdemeanor count of simple battery related to an incident earlier this month in which he assaulted several people in New Orleans, per the Associated Press . The actor was previously booked and posted bail in the aftermath of the Feb. 17 bar brawl , in which he punched patrons and shouted anti-gay slurs. The Transformers alum now faces three charges, with his next hearing scheduled for March 19. City police previously said LaBeouf was “causing a disturbance and becoming increasing[ly] aggressive” at a Royal Street business outside the French Quarter. LaBeouf’s attorney Sarah Chervinsky told the AP that LaBeouf voluntarily turned himself in to the Orleans Parish Prison upon learning of the new arrest warrant issued yesterday. Watch on Deadline Related Stories News Shia LaBeouf Posts ""Free Me"" After Being Arrested At Mardi Gras Party Legal Shia LaBeouf And FKA Twigs Settle Sexual Battery Suit - Update “No regular person would be required to post over $100,000 in bonds, and be jailed two separate times for one misdemeanor incident,” Chervinsky said. “Just as he does not deserve preferential treatment, Mr. LaBeouf also does not deserve to be treated more harshly by the police and courts just because he is a public figure.” The news comes amid LaBeouf’s sprawling interview with Channel 5 with Andrew Callaghan , during which he rambled about his past legal issues, sobriety journey, religious beliefs and former relationships with artist FKA Twigs and actress Mia Goth. At one point, he left the interview couch to grab a beer and, toward the conclusion of the conversation, walked away and accidentally broke his wall. “I fucked up, it’s on me,” he said of the New Orleans arrest. “It was no good, bro. My behavior’s dirty, ugly, disgusting, so I gotta eat it, you know?” LaBeouf also posited he may still be charged with a hate crime, which carries a more severe penalty, though in some statements he expressed a cavalier attitude toward his latest controversy. “Who gives a fuck though? It’s another experience. Jail be another adventure. What are you gonna do?” he said. Despite having attended support groups for addiction previously, he said, “I don’t think I have a drinking problem. I think I have a different problem, and I’m gonna address it … I think I have a small man complex. Some kind of Napoleonic, I don’t know what it is. I think it’s something that has to do with anger and ego more than my drinking.” He added that he has often been “forced to get sober by the court system, usually, and then women get scared, so you gotta stay sober for the girl.” In more eyebrow-raising comments, he admitted his bigotry is “why I got arrested.” “Big, gay people are scary to me,” he said, saying that when three gay men “are touching my leg, I get scared. I’m sorry. If that’s homophobic, then I’m that.” He said he gets triggered when his “masculinity is challenged,” adding, “I’m good with gay, be gay over there though, don’t be gay in my lap.” Later, he pivoted: “I am wrong for touching anyone ever and that’s the end of my statement on this whole shit.” LaBeouf also confirmed that once released from jail (he said he didn’t know who bailed him out), he returned to party in the French Quarter during Mardi Gras. This isn’t the first time the Disturbia actor has been embroiled in unsavory dealings. The former child star-turned-embattled figure was previously sued by ex-girlfriend Twigs for sexual battery, assault and infliction of emotional distress, which was later settled . Of that matter, he admitted to Callaghan: “Whatever she said, run with most of it.” Paramount And WBD Reveal Details Of $110B Deal: Latest News + Analysis ‘Scream 7’ Is Slaying: Pic Eyes Franchise-Best $60M+ In Opening Frame ‘Sinners’ ‘One Battle’ & ‘KPop Demon Hunters’ Win: Full List On The Set Of The ‘Peaky Blinders’ Movie With Cillian Murphy & The Rest Of The Gang Read More About: Comments",0,2026-03-01 02:59:08
2,https://deadline.com/2026/02/trump-iran-supreme-leader-dead-1236739723/,Iran State TV Confirms Supreme Leader Ali Khamenei  Is Dead; New Israeli Strikes On Tehran Begin,Deadline,2026-03-01T01:44:00,7729,"Skip to main content By Dominic Patten Dominic Patten Executive Editor, Legal, Labor & Politics @DeadlineDominic More Stories By Dominic Iran State TV Confirms Supreme Leader Ali Khamenei Is Dead; New Israeli Strikes On Tehran Begin Paramount + WBD Vs. Coalition Of The Unwilling: CA AG Pulling Together Blue States Probe Of Mega-Merger Paramount Purchase Of Warner Bros. Discovery Stirs Angst At CNN – Again View All February 28, 2026 5:44pm A protester holds a sign with the images of Reza Pahlavi & Ali Khamenei during a January 2026 protest Getty Images UPDATE: 5:44 PM: Iranian state TV has confirmed that Supreme Leader Ali Khamenei is dead. The news comes hours after Donald Trump proclaimed the harsh 37-year rule of the cleric had ended with the US and Israeli attack on Iran . With dozens of other members of the Iranian leadership also dead, Khamenei was said to have died in his official office in the early hours of the first wave of attacks on Iran by US and Israeli air forces. “The Supreme Leader of the Islamic Revolution was martyred at their workplace in the Leader’s Residence,” official Iranian media tweeted just minutes ago.. “At the moment of martyrdom, they were carrying out their assigned duties and present at their workplace (their office), and this cowardly attack occurred in the early hours of Saturday morning.” Related Stories News U.S. And Israel Launch Strikes On Iran; Trump Says Reports Of Iran Supreme Leader's Death Are ""Correct"" - Update News Brit Awards Host Jack Whitehall Takes Jab At BAFTAs Over Racial Slur Incident: ""We've Got The Best In The Business On The Bleep Button"" As the Islamic Republic uncharacteristically quickly acknowledged Khamenei’s death, no successor has been announced. Added to that, with celebrations breaking out in Iran following weeks of massive protests against the regime, Israel has launched a series of new strikes on Iran. Watch on Deadline News of the official confirmation of Khamenei’s killing spread within seconds online and on cable news, which has been covering the situation in Iran and the region wall-to-wall since late last Friday. Trump said today that this weekend’s Operation Epic Fury barrage was just the start of a “massive and ongoing” operation of regime change and to end Iran’s long running nuclear program. To that, U.S. Central Command posted a missile strike video just as news of Khamenei’s death was revealed with tears and promises of 40 days of mourning in Iran. The Iranian regime was warned. CENTCOM is now delivering swift and decisive action as directed. pic.twitter.com/nNDoDexH6g — U.S. Central Command (@CENTCOM) March 1, 2026 PREVIOUSLY, 2:04 PM: Iran’s Supreme Leader is dead, Donald Trump has proclaimed in a lengthy social media post. However, under bombardment from American and Israeli forces, the Iranian government still insists Ali Khamenei is alive, though no one has seen the much-feared cleric in days. “Khamenei, one of the most evil people in History, is dead,” Trump wrote this afternoon at 1:37 p.m. PT. As the BBC noted soon after the openly regime-change-seeking Trump posted, there has still been “no independent verification” of Khamenei’s death. Iranian State media is saying, as it has been all day, that the 86-year-old Khamenei is alive. Just before Trump posted, Khamenei’s own X feed put up a defiant image of a sword-wielding figure and more Shia warrior symbolism. به نام نامی حیدر علیه‌السلام pic.twitter.com/n848j6KASq — KHAMENEI.IR | فارسی (@Khamenei_fa) February 28, 2026 At the same time, as American and Israeli forces once again attempted to halt Iran’s nuclear program, satellite images show the top cleric’s residence was destroyed in Operation Epic Fury. Also, publicly unveiled plans for Khamenei to address the Islamic Republic were shelved. Still, with no solid word of what the state of the murderous Revolutionary Guard and the Iranian military are and who they are backing, Trump had no such caution about the Iranian leader’s future in his own post. “This is not only Justice for the people of Iran, but for all Great Americans, and those people from many Countries throughout the World, that have been killed or mutilated by Khamenei and his gang of bloodthirsty THUGS,” POTUS added from his Mar-a-lago estate in Florida With rumors of the fate of Khamenei, who has ruled Iran since 1989, swirling in the hours after the first attacks on Tehran, cable news outlets scrambled to pivot as Trump made his announcement. Broadcast networks such as CBS shuffled their programming lineups to get primetime specials on “War with Iran” on air tonight On CNN , guests like former Trump National Security Adviser, the retired U.S. Army Lieutenant General H.R. McMaster, who was recently named as a CBS News contributor, tried to provide instant context of what the immediate fallout could be. In American cities like Los Angeles, anti-Khamenei protesters were celebrating on the streets and online within minutes of Trump’s posting. As MS Now , the BBC, Fox News and CNN brought on their top anchors for coverage, the still-Warner Bros. Discovery-own cable net also reported that “celebrations” were taking place in Tehran over reports of Khamanei’s death. The Iranian capital, like many cities and regions in the country, has seen mass protests and mass killings by the regime over the past few months. Speaking on Israeli TV earlier Saturday, PM Benjamin Netanyahu referred to Khemenei as “no longer” in charge, a significant choice of words. Earlier Saturday, Trump spoke of Khamenei being dead, and told NBC in a phone call interview that “we feel that that is a correct story.” As various members of the Iranian elite were also said to be wiped out, Trump added: “The people that make all the decisions, most of them are gone.” In a White House-supplied photo, Donald Trump with (L-R) CIA Director John Ratcliffe, Secretary of State Marco Rubio and White House Chief of Staff Susie Wiles on Feb. 28, 2026 in Palm Beach, Fla. At the same time as Trump posted, a United Nations Security Council meeting continued. Condemning the “hostile” U.S. and Israel for having broken international law and the U.N. charter, Iranian representatives stuck to their script and weaved away from any confirmation of Khamenei’s death. Also Saturday, Trump said the strikes on Iran, which today had fired back at U.S. bases, Tel Aviv and Jerusalem and American allies in the Middle East, would go on for several more days. Exiled Crown Prince Reza Pahlavi, who has emerged as a possible ruler of a new Iran, also took to social media after Trump. Calling Khamenei “the bloodthirsty despot of our time,” the 65-year-old son of the last Shah, whose own brutal and bloodthirsty regime was overthrown in 1979 in the Ayatollah Khomeini-led revolution, told officials in Iran to switch sides. “This is your final opportunity to join the nation, to help ensure Iran’s stable transition to a free and prosperous future, and to take part in building that future,” the U.K.-residing Pahlavi, who has spent most of his life outside Iran, wrote. My fellow compatriots, Ali Khamenei, the bloodthirsty despot of our time, the murderer of tens of thousands of Iran’s bravest sons and daughters, has been erased from the face of history. With his death, the Islamic Republic has in effect reached its end and will very soon be… https://t.co/pm3ZXY9IYZ — Reza Pahlavi (@PahlaviReza) February 28, 2026 Paramount And WBD Reveal Details Of $110B Deal: Latest News + Analysis ‘Scream 7’ Is Slaying: Pic Eyes Franchise-Best $60M+ In Opening Frame ‘Sinners’ ‘One Battle’ & ‘KPop Demon Hunters’ Win: Full List On The Set Of The ‘Peaky Blinders’ Movie With Cillian Murphy & The Rest Of The Gang Read More About: 5 Comments",0,2026-03-01 02:59:10
