id,url,title,source,publication_date,text_length,full_text,is_duplicate,created_at
27,https://variety.com/2026/film/news/allu-arjun-deepika-padukone-atlee-raaka-1236711151/,"Allu Arjun, Deepika Padukone, Director Atlee Unite for Fantasy-Action Film ‘Raaka,’ Backed by Sun Pictures",Variety,2026-04-08T07:22:00,3531,"Apr 8, 2026 12:22am PT Allu Arjun, Deepika Padukone, Director Atlee Unite for Fantasy-Action Film ‘Raaka,’ Backed by Sun Pictures By Naman Ramachandran Plus Icon Naman Ramachandran Latest Allu Arjun, Deepika Padukone, Director Atlee Unite for Fantasy-Action Film ‘Raaka,’ Backed by Sun Pictures 3 hours ago Microdrama Platform ReelShort Teams With Thailand’s AIS in First Southeast Asia Telco Deal 3 hours ago India’s PVR Inox Eyes Indie Distribution Pipeline via MAMI Independent Initiative (EXCLUSIVE) 20 hours ago See All Sun Pictures India’s Sun Pictures has unveiled the title of its large-scale fantasy-action collaboration between director Atlee , Allu Arjun and Deepika Padukone : “ Raaka .” The announcement came Wednesday, on Arjun’s birthday, accompanied by a title poster that leans into dark, creature-driven imagery. Atlee, whose credits include the Shah Rukh Khan blockbuster “Jawan” as well as Tamil-language hits “Mersal” and “Bigil,” described the project as a long-gestating passion. “‘Raaka’ isn’t just a film… it’s a part of me I’ve carried for years. For 18 years, I held on to one idea, never letting it fade. It tested me, shaped me, and stayed with me through everything. And honestly… this is just the beginning,” he said. Related Stories Christy Carlson Romano Says 'Even Stevens' Co-Star Shia LaBeouf 'Doesn't Deserve to Be' on the Mount Rushmore of Disney Icons, Then Deletes Posts FKA Twigs Sues Shia LaBeouf Over NDA from 2020 Sexual Battery Settlement Sun Pictures, the Chennai-based production banner, said the film represents its highest ambitions for Indian cinema’s international reach. “Sun Pictures is privileged to bring together the singular storytelling of Atlee and the iconic stature of Allu Arjun in a project built for the world,” the company said in a statement. Popular on Variety Arjun, who won the Indian National Film Award for best actor for his performance in “Pushpa: The Rise,” arrives at “Raaka” off the back of a franchise that reshaped Indian cinema’s commercial landscape. The first “Pushpa” film, directed by Sukumar and co-starring Rashmika Mandanna and Fahadh Faasil, grossed some $42 million worldwide on its 2021 release. Its 2024 sequel, “Pushpa 2: The Rule,” collected approximately $194 million globally, making it the third-highest-grossing Indian film of all time behind “Dangal” and “Baahubali 2: The Conclusion.” Padukone, who previously worked with Atlee on “Jawan” opposite Shah Rukh Khan, joins the project as female lead – her first collaboration with Arjun. Her casting was announced by Sun Pictures last year. Celine Dion Adds Six More Concert Dates in Paris This AI-Powered Website Builder Can Help Creatives Launch Their Business in Seconds Oscar Winner ‘Mr. Nobody Against Putin’ Among Peabody Award Nominations in Documentary, News, Radio/Podcast and Public Service Alexandra Latishev’s Feminist Fantasy Fable ‘Sirens’ Enchants Vitrine Filmes España (EXCLUSIVE) Microdrama Platform ReelShort Teams With Thailand’s AIS in First Southeast Asia Telco Deal ‘Summer House’ Stars Amanda Batula and West Wilson Hug in ‘In the City’ Spinoff Trailer; Bravo Sets Premiere Date and Full Cast Loading comments... More From Our Brands Rolling Stone Jimmy Kimmel Celebrates Trump Not Destroying Iran: ‘The Taco Tuesday of All Taco Tuesdays’ Robb Report Jacob & Co. Just Unveiled the World’s Fastest Tourbillon Sportico Sen. Warren Urges FCC to Shield Fans From Media Consolidation WWD Fashion Trust U.S. 2026 Awards Reveal Winners, Honor Tory Burch and Michèle Lamy",0,2026-04-08 10:13:41
34,https://www.hollywoodreporter.com/tv/tv-features/shrinking-finale-season-4-cast-time-jump-creator-interview-1236557468/,‘Shrinking’ Boss Confirms Who Will Return for Season 4 After That Finale: “Still a Bunch of Stories to Tell”,Hollywood Reporter,2026-04-08T07:00:00,15314,"Skip to main content ""My one hint would be that I don't think you can ever get away from where the show started, which is with Jason Segel and Harrison Ford, who both have very distinct things we know we have to service,"" says co-creator Bill Lawrence about where 'Shrinking' goes after the season three finale. Apple TV Logo text [This story contains MAJOR spoilers from the season three finale of Shrinking , “And That’s Our Time.”] If you are wondering if Shrinking just ended after that season three finale, don’t worry — the show isn’t over. It’s coming back for season four . But the season three finale, titled “And That’s Our Time,” did feel like it could have been a series finale, and there’s a reason for that: It was initially going to be the end of the show. The hit Apple series co-created by Bill Lawrence with stars Jason Segel and Brett Goldstein was pitched with a three-season plan, and Lawrence tells The Hollywood Reporter now that when they decided to continue on while writing season three, they wanted to stay true to that original vision. Related Stories The AI Issue The Emmys Tried to Get a Handle on AI. The Writers Had Notes. TV Napa Valley StreamFest: 'Shrinking' Showrunner Bill Lawrence Set for Live 'Awards Chatter' Podcast Taping “We’ve told the story of whether or not Jason Segel’s Jimmy is going to make it through the death of his wife and come out the other side as someone who might be able to find joy and happiness in his life again,” says Lawrence of season three ending with Jimmy being ready to pursue a relationship with Sofi (played by Cobie Smulders). “This is the finale of that three-season story. And I hope that people will dig it that when we come back — whether there’s a time jump or not — that it’ll feel like we’re telling a completely different story.” The episode felt like it could have been the end-end because everyone left Jimmy — albeit, most of them temporarily. After getting engaged, Gaby and Derrick No. 2 (Damon Wayans Jr.) decided to celebrate their impending nuptials by joining Liz ( Christa Miller ) and Derek (Ted McGinley) on their extended trip to Barcelona; Brian (Michael Urie) and husband Charlie (Devin Kawaoka) are heading to Tennessee; and Sean (Luke Tennie) is moving out of Jimmy’s pool house. Jimmy’s daughter Alice (Lukita Maxwell American) is also gone — she’s off to college in Connecticut — and so is Jimmy’s surrogate father Paul, played by Harrison Ford , who moved away with wife Julie (Wendie Malick), also to Connecticut. But don’t worry — Lawrence says everyone, including Ford, will be back for season four, and a likely season five. And there will be a time jump when the gang gets back together. “It’s not an accident that Alice goes to school at Wesleyan University and that in the end of the finale, she’s going by to have dinner at Paul’s house,” he teases. “Time passage changes a lot of things — as to where people are, where they’re living and how things have progressed. So, yes, Harrison’s back on the show.” Below, prolific TV creator Lawrence answers more burning finale questions — including what Jimmy’s second chance will look like when the show jumps ahead to season four — as he talks more about what the next era of Shrinking will be like when it returns. *** This season finale felt like it could have been a series finale. I can explain that. This is the ending of the three-season story we pitched . This is a narrative that I’m trying to get out there. Here’s what I love about doing streaming television. When I used to do Spin City and Scrubs and Cougar Town stuff, they would be like, “We want you to do this for 900 episodes, and nobody should ever change.” Someone asked Zach Braff in the seventh year of Scrubs , “How much has J.D. changed since the first year?” And he’s like, “I think I have a beard now?” ( Laughs .) But now when you go to streaming, you pitch a beginning, middle and end. At least, I do. I went, “The first year of Shrinking is about grief and the second year is about forgiveness, and the third year is about moving forward through it.” We’re lucky enough that we all like each other. The actors love the gig; Harrison’s been cool and like, “I don’t care if this is my last gig ever,” and Apple loves doing the show. But we decided as a staff that we are not going to veer from our three-season story. And that’s because we’re fans of the show. Everybody likes their own shit, but we’re nerdy fans of the show and the actors and actresses — and if we turned on the fourth season and Jimmy was just sitting around saying to Paul, “You know, I’ve been thinking about it, and I’m still super sad about my wife,” I’d be like, “I don’t fucking want to watch this anymore. I already saw this!” So our burden and our decision was: This is the end of that story. This is the finale of that three-season story. And I hope that people will dig it that when we come back, whether there’s a time jump or not, that they’ll feel like we’re telling a completely different story. One of the cool things is that Apple told us in time, so as writers — it was really challenging but — we were able to go, “What are some Easter eggs we can put in so there are things we’re addressing when we pick it up again two years later?” We always do that on this show. Our fans are so savvy — they’re always ahead of what we think are super hidden tricks! An example was in the second year. We love going online and messing with people who are trolls, and being nice with people who are fans, and we saw a lot of people saying, “How come Gaby hasn’t ever had it out with Louis?” We already had that planned in the third year — that the way to get this guy [Louis] extricated from this was to have the one person who is never going to forgive him go, “Get the fuck out of here!” So I think we ended the story, but also left a lot of Easter eggs for people to know characters who are coming back, things that’ll be different work-wise and dynamics that will be a little different. Jimmy (Jason Segel) in the season three finale. Apple TV I remember when you spoke with THR at the beginning of Shrinking about your three-season plan, so this all makes a lot of sense to hear now. At what point did you guys make that decision to continue on, was it while you were making season three? Yes. We were in the middle of writing season three. We knew Apple was into us continuing on, so we talked to the cast: “Guys, are you interested in doing this still?” And then, “Are we all interested in doing it still?” Then we had to talk a little and asked ourselves, “Is there a new story to tell?” The thing we’re so lucky about is that top to bottom — not only the main cast, but even secondary characters like Rachel Stubington, who plays Summer; and Damon Wayans Jr. or Wendie Malick — we find them all so interesting. There are still a bunch of stories to tell. What we’ve told is the story of whether or not Jason Segel’s Jimmy is going to make it through the death of his wife and come out the other side as someone who might be able to find joy and happiness in his life again. Is the entire ensemble returning? The entire ensemble is returning. Including Harrison Ford? Even with Paul in Connecticut, we are going to see what he is up to? When I say we found out in the middle of the year, it’s not an accident that Alice goes to school at Wesleyan University and that in the end of the finale, she’s going by to have dinner at Paul’s house. And time passage changes a lot of things — as to where people are, where they’re living and how things have progressed. So, yes, Harrison’s back on the show. Are you planning this as now another three-season story, through season six? Or are you taking it season by season? We have great partners in Apple, and I’ll admit that the shows I love — like Hacks , is doing their fifth season. I can’t tell you what the right amount of years is for a show. I know that we aren’t going into this season as if it’s our last, because we’re telling another story that needs a little space to tell it. So I’ll probably do this year and then ask our partners, “Do you want to end it year five, or you want to end it at year six?” That’s kind of our vibe. I’ve been thinking about this a lot with streaming because everything’s evolving. I’m a massive fan of The Pitt and if The Pitt , in the finale, said, “Surprise! In three weeks a show is coming called The Night Shift ,” I would be like, “Fuck, yeah. Shawn Hatosy all day!” Who’s to say what storytelling looks like now? I would watch a show about where Michael Urie’s Brian goes in his life and what he’s doing, even if it wasn’t with this cast of characters. I just really dig working with these performers. All the secondary characters are leads of their own show, and that’s one of the reasons why the show works. Paul (Harrison Ford) moves to Connecticut with wife Julie (Wendie Malick) at the end of season three. Apple TV Brett Goldstein (co-creator) took an onscreen step back this season, so you have also set up this Shrinking world where characters can come in and out. Was that Louis decision precipitated by the story? The Louis thing of it all is two things. I always say, “A lot of people might not like this story; as long as it feels authentic, that’s a great reason to do it.” Brett’s character on the show was loosely based on a true story, because we do our research. Whether you could do it or not and forgive him, we started from a quote of a father who forgave the teen driver who killed his teen child. He said, “I couldn’t stand to watch two young lives be lost.” But we knew that was a story where a tremendous amount of people would go, “There’s no fucking way I would never be friends with a person who did that.” So in our heads, we go, “That makes sense. We’re not going to do it in perpetuity, and we’re going to make sure that we hold onto one character who is like, ‘What the fuck? Get the fuck out of here.'” And that was Gaby. So as far as Brett goes, we always knew Louis would be limited. And the secondary thing was that Brett has his own show that he’s working on — Escorted at Amazon ; Brett’s writing and starring in his own series, so we knew he wasn’t a long-term character. And everybody’s aware that he was shooting Ted Lasso , which is another show that is doing what we’re talking about in a very cool way, and I say that even as a fan of Jason Sudeikis and Jack Burditt. Everybody who has seen the pictures and knows that Ted Lasso is coaching a girls team [in season four] is like, “Oh, this isn’t season four of Ted Lasso . This is season one of whatever new Ted Lasso is now.” And that’s definitely something we were looking at for Shrinking . You have a lot of other shows you’re working on, Ted Lasso included. So how does continuing Shrinking fit in for you? One of my greatest skills sets, I think, is getting to occasionally take credit for other people’s amazing work. The truth is that I’m super engaged and love it, and I’m lucky enough that I can work with so many people. I like to gauge that I can run one-and-a-half shows myself or with a partner per year. The shows that I ran and worked on were three in the last two years: Shrinking , Bad Monkey and Rooster . With Ted Lasso , I’m such a massive fan of Jack and Jason. There’s massive continuity. A lot of people from our company still work on it; a lot of the original writers are so great and still on it. So I’m not spread too thin. When you do this long enough — like, the production designer of Rooster was the production designer of Spin City ; we’ve been working together for 31 years, which is insane. So if you have that kind of support network of editors and DPs where you all have each other’s back, you can do multiple things just because we all have a shorthand. The way you ended Shrinking season three opens up so many possibilities of what you could do, but also who you could focus on. Do you still view Jimmy as the core focus? My one hint would be that I don’t think you can ever get away from where the show started, which is with Jason Segel and Harrison Ford, who both have very distinct things we know we have to service. I want to do right by Parkinson’s and by Harrison’s journey, and by staying in an inspiring place — for what that means because of how personal it is not only to Harrison and to [Michael J.] Fox, but to me, because of my family and to Brett because of his family. So that will, without a doubt, go on. And Jason is the anchor and the weed of the show. I won’t divulge what the new story is, but I’ve already given you a hint. If we started with Jason hearing a song and getting teary and reminiscing about his wife, you would go, “I thought in the last three seasons this already happened? I thought he got through this?” I think people will enjoy watching. Jimmy’s daughter Alice (Lukita Maxwell) heads off to college at the end of the season. Apple TV So now Jimmy will be in a new romantic era of his life. People will watch what his journey is like, and what that means to rebuild a life and be who he is. I was just with the writers, because we were figuring out the arcs for the next two seasons this morning with me and Neil Goldman and Brett Goldstein, and I could tell you, but I’m not allowed! With Michael J. Fox playing a Parkinson’s patient this season , it was moving to hear him talk about being able to actually be himself while acting. Are you hoping to bring him back? Well, he made the mistake of saying he enjoyed it. He’ll definitely be back. All my shows are about mentorship in some way. Mike was one of my first mentors professionally in Hollywood. He was so great to me when I was a kid. I should not have been running that show [ Spin City ]. I was way too young, and he was respectful and awesome. So to have him back in my world, and as such an inspiring, optimistic, hopeful guy for how he’s navigating this? Not only is it what I need and cherish personally, because I love to know him so much, but I find that it’s so authentic that it makes a lot of the stories we’re telling and that part of the show really work. How far ahead do you think you’ll jump when you return with season four? Will we see Gaby’s wedding, or will we pick up with her already having like three kids? I don’t want to spoil too much, but we’ve always done a couple month jump from season to season, at most, because we have these continual stories. One of the funny things for us was to say that it’s like Groundhog Day. If anybody took the time to look at how long the show was, the show always takes place over like three weeks or a month. So this [jump to season four] will definitely be significant and beyond a year or two. Christa Miller (Lawrence’s wife who plays Liz) had such a great season as well. She killed it, by the way. I’m so proud of her. I thought the stuff when she admitted how vulnerable she was was so good. People think she’s playing a version of herself, and she gets so mad because our last kid just left — we’re an empty nest and I’m the wuss. I’m the one who is losing his mind and sad and spending way too much time with them and following my daughter around Europe. My wife was like, “Deuces! I’ll see you around!” And she’s like, “You switched it on the show!” Shrinking is now streaming all three seasons on Apple TV. THR",0,2026-04-08 10:13:49
33,https://www.hollywoodreporter.com/tv/tv-news/the-trio-johanna-hedman-skyshowtime-series-teaser-clip-1236554312/,‘The Trio’ First-Look Clip Teases Seductive SkyShowtime Swedish Original (Exclusive),Hollywood Reporter,2026-04-08T07:00:00,2995,"× Skip to main content By Georg Szalai Plus Icon Georg Szalai Global Business Editor View All April 8, 2026 12:00am 'The Trio' Courtesy of Anders Hazelius/SkyShowtime SkyShowtime ‘s Swedish original series The Tri o ( Trion ) , an adaptation of the bestselling coming-of-age novel by Johanna Hedman, is described as “a story about love, sex and passion.” The six-part show, starring August Wittgenstein ( Das Boot , The Crown , Faithless , Tomb Raider ), Felix Sandman ( Home for Christmas , Quicksand ), Seth Manteus ( Cherries ) and Rebecka Harper, received a premiere date on Wednesday, namely June 1. The first two episodes of the show will premiere that day, followed by two new episodes weekly after that. Related Stories Business ESPN Launches in Europe and Asia-Pacific on Disney+ Business Paramount Confirms Middle East Funds Are Backing Its Warner Bros. Discovery Buy THR can also reveal an exclusive teaser for the series below. “When middle-aged Hugo is approached by the daughter of both of his childhood loves, he is thrown back 20 years in time,” reads a synopsis for the series. “Hugo is about to embark on his first years at university and has moved to Stockholm to become a resident of the Stiller family. This is where he meets Thora, the daughter of the house. This is also where he meets August, Thora’s constant companion and occasional lover. This is just the beginning of a wonderful friendship, of a whirlwind love affair, of the realization that nothing will ever be the same again. This is also the reason why Hugo never truly moved on. Will he dare to reclaim everything he has lost?” Kai Finke , chief content officer at SkyShowtime, has called The Trio “a passionate and fearless exploration of desire and connection,” adding that the series “is unlike anything else we’ve commissioned and is exactly the kind of fresh storytelling we’re proud to champion.” ‘The Trio,’ courtesy of Alfred Bolsöy Courtesy of SkyShowtime Anders Hazelius, the director of the series, written by Veronica Zacco, has called it “an intoxicating, passionate, and bittersweet tale of the conflict between the longing for love and the yearning for freedom.” SkyShowtime said about the series on Wednesday: “Laced with yearning and nostalgia, The Trio ( Trion ) combines a sensuous, sophisticated love story with a poignant, bittersweet reflection on the relentless passage of time, and through rich characterization and emotional storytelling, the series explores Hedman’s timeless themes of desire and loss.” The Trio is produced by SF Studios in co-production with SkyShowtime, ZDF, SVT, Film Stockholm and Night Train Media. Ina Sohlberg, Tina Bergström, Emma Hägglund and Susann Billberg Rydholm serve as the producers and executive producers for SF Studios. Eccho Rights is handling international sales. The first clip, which THR can reveal here, teases the emotion, the intimacy, and the love triangle that audiences can expect from the series. Watch the teaser for The Trio here. THR",0,2026-04-08 10:13:48
