id,url,title,source,publication_date,text_length,full_text,is_duplicate,created_at
1,https://deadline.com/2026/06/ajay-devgn-chauhaan-jio-studios-colour-yellow-productions-1236967208/,Ajay Devgn To Star In Jio Studios & Colour Yellow Action Pic ‘Chauhaan’; October 2027 Release Date Set,Deadline,2026-06-25T11:25:42,2252,"Skip to main content By Jesse Whittock Jesse Whittock International TV Co-Editor @WhittockTweets More Stories By Jesse Alan Cumming On How “Gothic And Queer” Aesthetic On ‘The Traitors’ Won Over Audiences & Is “Probably Changing Attitudes” – Cannes Lions Towerhouse Signs Deals With Spate Of YouTube Content Brands Including Culture Genesis & ‘American Mayhem With Larry The Cable Guy’ Show Priyanka Chopra Jonas Says She Was “Shocked” By Success Of Prime Video Pirate Pic ‘The Bluff’ & Updates On S.S. Rajamouli’s ‘Varanasi’ – Cannes Lions View All June 25, 2026 4:25am Indian action star Ajay Devgn is returning to the precinct he knows best. The actor will lead Chauhaan , a feature from director Neeraj Yadav and production houses Jio Studios and Colour Yellow Productions . A theatrical release date of October 1, 2027 has been slated. You can see a first look at Devgn above in a teaser trailer to announce the movie, which the makers say is set in a “gritty and action-packed world.” No further plot details right now, but in the teaser we protestors in Jammu and Kashmir city Pulwama lining up to take on army guards, with Devgn, face covered by a skull bandana, staring them down as they rush towards the authorities. Jyoti Deshpande, Aanand L Rai, and Himanshu Sharma are producing. Watch on Deadline The announcement came on the anniversary of the birthday of Devgn’s father Veeru Devgan, a celebrated Hindi cinema’ stunt choreographer who passed away in 2019. Devgn is best known internationally for starring in Indian box office smash RRR , which came from S.S. Rajamouli. He has also starred in pics such as Drishyam , Drishyam 2 and Maidaan . This week, Priyanka Chopra Jonas told an audience about Rajamouli’s upcoming 2027 feature Varanasi , while a separate Deadline story noted the director had flown into the Annecy International Film Festival for an update on animated movie Baahubali: The Eternal War, on which he is a producer. Sky & ITV Agree Terms Over $2.1B Deal, Anno Imminent: Report James Bond Search Heats Up As Producers Target Actors, Set New Auditions ‘Supergirl’ Review: DC’s Latest Superhero Pic Doesn’t Fly High Enough ‘Toy Story 5’ Won’t Play Nice With ‘Supergirl’, Eyes Win With Near-$90M Read More About: Comments",0,2026-06-25 11:44:34
2,https://deadline.com/2026/06/peppa-pig-hasbro-child-actors-ai-backlash-1236967142/,‘Peppa Pig’ Causes AI Stink: Concern As Beloved Hasbro Series Asks Child Actors To Sign Over Their Voices To Artificial Intelligence,Deadline,2026-06-25T11:17:52,5972,"Skip to main content By Jake Kanter Jake Kanter International Investigations Editor @Jake_Kanter More Stories By Jake Lionel Richie Falls Ill On Stage, Cutting Short First Night Of New Tour Paramount-Warner Merger Reportedly Set To Clear EU Antitrust Hurdles — But With Caveats Ari Emanuel’s Mari Reportedly In Talks Over $6B Deal To Buy ATG, Owner Of Theater Venues Behind Shows Like ‘Paddington’ View All June 25, 2026 4:17am Entertainment One EXCLUSIVE : Peppa Pig is famed for her love of jumping in muddy puddles, but the company behind the hit children’s TV series has created a different kind of splash with its approach to AI. Hasbro , the U.S. entertainment giant that acquired the Peppa Pig brand in 2019, is asking child actors on the animated series to sign over their voices to artificial intelligence under new contract terms, Deadline can reveal. Industry sources said AI clauses are now frequently appearing in kids’ contracts on TV and film projects, but Hasbro’s embrace of the terms on Peppa Pig has become a lightning rod for concern. Related Stories News 'Jem And The Holograms' Live-Action Series In Works At Amazon With Kilter Films & Hasbro News 'The Game Of Life' Movie In Works From Amazon MGM, Chernin And Hasbro; Sean Anders Directing And Allan Loeb Writing Nearly 1,000 people have signed an open letter (copied in full below), organized by the Agents of Young Performers Association (AYPA), condemning AI terms on an “international children’s franchise.” Watch on Deadline The open letter does not name Peppa Pig, and the AYPA declined to identify the series, but industry sources told Deadline that it refers to the beloved show. The letter was also not specific about the clause in question, but theoretically, it could give Hasbro the power to clone a child’s voice and then use the AI-generated audio in Peppa Pig commercial assets. Hasbro told Deadline that it was committed to protecting child performers, adding that it wished to approach discussions about artificial intelligence responsibly and transparently. “Consent Must Be Treated With Care” AYPA members are increasingly concerned about children being asked to effectively surrender their voice and image rights. Agents frequently ask the body for advice on AI clauses without naming specific projects. The AYPA’s open letter said these clauses are often presented as a “take it or leave it” ultimatum, meaning children can lose out on work if their parents or guardians refuse to agree to the terms. “Where the performer is a child, consent must be treated with the greatest of care. Children cannot provide fully informed legal consent and a parent or guardian’s approval should never be used as a blanket licence to capture, clone, train, or reuse a child’s voice indefinitely,” the letter said. “Any agreement involving a child’s voice should be fully exempt from all AI usage. No child should have their future professional identity shaped by an AI model created before they were old enough to understand its consequences.” It concluded: “We reject all contracts that require child performers to surrender voice rights indefinitely and without limits.” ‘Peppa Pig’ Season 11 A Hasbro spokesperson said: “Hasbro is aware of the open letter circulating regarding AI clauses in children’s performance contracts. We are not able to comment on specific negotiations or contractual arrangements. “The protection of child performers is core to who Hasbro is, it’s part of our DNA. As industry standards around AI continue to evolve, we are committed to engaging with this issue in a responsible and transparent manner.” Created by Mark Baker and Neville Astley in 2004, Peppa Pig has become an international phenomenon. Season 11 premiered in the U.S. on Nickelodeon in March, featuring a storyline in which Peppa’s brother George is revealed to be moderately deaf. In the same month, Hasbro installed Adam Redfern, a writer on The Adventures of Paddington , as Peppa Pig ‘s showrunner. AYPA Open Letter On AI Clauses In Kids Contracts: To studio executives, producers, casting teams, commissioners, and all those shaping the future of recorded performance. We write at a moment when artificial intelligence is already the topic of much dispute, discussion and grave concerns throughout the industry. Most recently, a major studio who owns the IP for an international children’s franchise producing a long running animated television series has offered contracts to child voice actors insisting that they agree to the use of AI thus allowing them to use the child’s voice in all commercial assets within their franchise. The refusal to remove this clause with an attitude of ‘take it or leave it’ has led us write this letter to make it clear that this will not be accepted and to bring this matter to the attention of the wider industry. Where the performer is a child, consent must be treated with the greatest of care. Children cannot provide fully informed legal consent and a parent or guardian’s approval should never be used as a blanket licence to capture, clone, train, or reuse a child’s voice indefinitely. Any agreement involving a child’s voice should be fully exempt from all AI usage. No child should have their future professional identity shaped by an AI model created before they were old enough to understand its consequences. Their voice should not become a permanent commercial asset before they have the legal and personal capacity to decide for themselves. We the undersigned urge you to commit to responsible industry practice. Collectively, we reject all contracts that require child performers to surrender voice rights indefinitely and without limits. Sky & ITV Agree Terms Over $2.1B Deal, Anno Imminent: Report James Bond Search Heats Up As Producers Target Actors, Set New Auditions ‘Supergirl’ Review: DC’s Latest Superhero Pic Doesn’t Fly High Enough ‘Toy Story 5’ Won’t Play Nice With ‘Supergirl’, Eyes Win With Near-$90M Read More About: Comments",0,2026-06-25 11:44:35
14,https://variety.com/2026/film/global/daniele-luchetti-new-film-your-little-matter-tecla-insolia-1236790197/,"Daniele Luchetti Sets New Film ‘Your Little Matter,’ Starring Tecla Insolia as an Orphan Looking for Her Birth Mother (EXCLUSIVE)",Variety,2026-06-25T11:17:07,3621,"Jun 25, 2026 4:17am PT Daniele Luchetti Sets New Film ‘Your Little Matter,’ Starring Tecla Insolia as an Orphan Looking for Her Birth Mother (EXCLUSIVE) By Nick Vivarelli Plus Icon Nick Vivarelli International Correspondent @NickVivarelli Latest Paramount-Warner Bros. Merger Set to Clear European Union Regulatory Hurdle (Report) 20 hours ago Eugene Jarecki Knew Streamers ‘Were Never Going to Touch’ His Julian Assange Documentary. So He’s Releasing It Through Bitcoin With the Help of Jack Dorsey 20 hours ago Shivani Pandya Malhotra, Former Managing Director of Saudi Arabia’s Red Sea Film Festival, on Expanding Her Dubai-Based Ta Films Shingle (EXCLUSIVE) 2 days ago See All Getty Images Veteran Italian director Daniele Luchetti — whose “The Ties” opened the 2020 Venice Film Festival — is back behind the camera on “Your Little Matter” (“Dove Non Mi Hai Portata”), a drama about a young writer looking into her parents’ dark past led by rising Italian talent Tecla Insolia . Italy’s Fandango and Vision Distribution have teamed to co-produce the film, which started shooting on Wednesday, and will jointly handle international sales. Related Stories 'All Her Fault' Team Sets Peacock Mystery Series 'The Break-In' Based on Katherine Faulkner Novel 'Ponies' Canceled After One Season at Peacock Insolia, who was among the European Shooting Stars showcased at this year’s Berlin Film Festival, broke out in the Sky Original miniseries “The Art of Joy,” in which she played a Sicilian woman born into poverty at the turn of the 20th century who frees herself from social constraints. In “Your Little Matter” (first-look image below), Insolia plays Maria Grazia, a writer driven by the desire to uncover her origins who tracks down the story of her birth mother, who abandoned her on a checkered blanket besides a bush in Rome’s Villa Borghese park in 1965. Popular on Variety It’s a true story, based on an autobiographical Italian novel written by Maria Grazia Calandrone. Courtesy Fandango “Through fragments of memory, secrets and silences, Maria Grazia pieces together the mosaic of her family history in a journey that explores the meaning of motherhood and the universal need to know where we come from,” says the provided synopsis. Besides Insolia, Luchetti’s latest drama also stars Margherita Buy, Alessandro Preziosi, Marcello Fonte and Nicola Rignanese. “Your Little Matter” is a co-production between Italy’s Fandango and Vision Distribution and Spain’s BTeam Prods. Luchetti is among Italy’s top directors, whose credits include the third season of RAI/HBO’s Elena Ferrante TV series “My Brilliant Friend” and Elio Germano films “My Brother Is an Only Child” and 2024’s “Trust,” which sold quite widely. YouTube TV Launches Customized Multiview Across the Full Channel Lineup YouTube Creators are Making a Splash This Awards Season. Here’s a Guide to the Platform’s Top Contenders YouTube Unveils Exclusive Shows From Alex Cooper, Trevor Noah, Kareem Rahma and More at Upfront YouTube Sees Growing Share of Consumers Eager to Watch Its Videos Music Critic Anthony Fantano Defends Himself Against Halsey: ‘I’m Not the Devil Himself’ Smosh Hires MTV Vet Cory Midgarden as YouTube Sketch Comedy Channel’s First-Ever Chief Content Officer (EXCLUSIVE) Loading comments... More From Our Brands Rolling Stone Leonard Cohen Estate Does Not Support Trump’s Plan to Use ‘Hallelujah’ at Freedom 250 Rally Robb Report Pomellato’s New High Jewelry Collection Is a Masterclass in Eclecticism Sportico CC Sabathia, Hunter Pence, Dexter Fowler on Day 3 at Cannes Lions WWD H&M Sees Flat Sales in Q2 With 3% Fewer Stores",0,2026-06-25 11:44:50
15,https://variety.com/2026/streaming/global/tartakovsky-conan-cartoon-network-studios-prime-video-1236790207/,Genndy Tartakovsky Sets ‘Conan the Barbarian’ Series with Cartoon Network Studios and Prime Video,Variety,2026-06-25T11:11:51,5813,"Jun 25, 2026 4:11am PT Genndy Tartakovsky Sets ‘Conan the Barbarian’ Series with Cartoon Network Studios and Prime Video Tartakovsky announced the new series Wednesday via a pre-recorded video at the Warner Bros. Animation, CNS, Hanna-Barbera studio focus at Annecy. By Ryan Gaur Plus Icon Ryan Gaur Latest New Animated Series ‘Adventure Time: Bubblegum and Marceline’ Gets HBO Max Order (EXCLUSIVE) 22 hours ago See All 'Conan the Barbarian' Courtesy of Cartoon Network Studios/Prime Video Genndy Tartakovsky is developing a “ Conan the Barbarian ” series with Cartoon Network Studios and Prime Video – suggesting the animation great is firmly back in the Warner Bros. fold having spent a few years developing features with Sony, returning earlier this year with a new season of “Primal” on Adult Swim. The announcement was made at an Annecy Studio Focus of Warner Bros. Animation, Cartoon Network Studios and Hanna-Barbera Studios Europe, a fixture in the Annecy scene hosted this year by the studios’ president, Sam Register, Hanna-Barbera London head Sarah Fell and WBA senior VP for current series Jay Bastian. Related Stories 'Ponies' Canceled After One Season at Peacock Alan Jackson's Star-Studded Farewell Concert to Be Filmed for 'The Last Show' NBC Special “I’ve been trying to develop ‘Conan’ since 2008, but the world was not ready,” Tartakovsky said via a pre-recorded video at the session. “But now, after Adult Swim’s ‘Samurai Jack’ and ‘Primal,’ it’s prime time for this to come to life,” he went on. “I have been so inspired by the books written by Robert E. Howard, whose work I have a personal connection with. So far I feel super excited. This is the only IP I’ve worked on other than ‘Star Wars: The Clone Wars,’ and I think it’s going to be something special.” Popular on Variety Tartakovsky’s returning to Cartoon Network is a big deal, having been one of the foundational voices that formed the studio, developing early shows like “Dexter’s Lab” and “Samurai Jack.” “Primal” has been the creator’s one recent outlet for the action-animation he had become renowned for, opting of late for comedies like “Fixed” and “Hotel Transylvania 4: Transformania.” “Conan” could see Genndy let off the leash once again, making this very exciting news for fans. The other big news from the Studio Focus, as revealed in exclusivity by Variety , was a third “Adventure Time” spin-off series, “Adventure Time: Bubblegum and Marceline.” This follows the continuity set up by “Fiona and Cake” but is further removed from the more episodic “Adventure Time: Side Quests.” Though little else but a logo was shown in the room, the excitement of the Annecy crowd when the announcement was made was palpable. Credit: WBEI For the remainder of the panel, the three executives delivered updates on the previously announced “Yokoso Scooby-Doo,” “Foster’s Funtime With Imaginary Friends” and “Supermutant Magic Academy” while screening two episodes of “Adventure Time: Side Quests,” which hits Hulu on June 29. “Yokoso Scooby-Doo” is an anime interpretation of the series, with Warner electing “Pokémon” studio OLM to help produce it. While Scooby’s iconic design is still intact, Shaggy, voiced by Matthew Lillard, gets a full anime makeover. Footage showed the gang fending off attacks from a sushi monster during a car chase with rapid-fire gags. On working with OLM, Bastian noted: “They really make it feel like an authentic anime series, they know what they’re doing. They made 1,300 episodes and 24 Pokémon movies, so they seem like the right people to trust.” “Foster’s,” which reboots the 2004 series “Foster’s Home for Imaginary Friends,” comes from Hanna-Barbera in collaboration with London studio BlueZoo. The show skews a tad younger than the original, converting the beloved 2D designs into CGI with 2D facial expressions. Multiple clips from the show entertained the Annecy audience, all of which carried the high energy fans would expect. While footage of “Supermutant Magic Academy” had been shown during a making of on Tuesday at Annecy, a true surprise was the screening of two whole episodes of “Adventure Time: Side Quest.” The executives had little to say, letting the episodes speak for themselves. So much of what “Adventure Time” fans love about it – the fast pace and relentless humor – is paired with some modernizing elements, like more painterly backgrounds and far more heightened facial expressions. “We love coming here,” Register announced, expressing his appreciation from within the dangerously high Annecy temperatures. “This is the best animation audience in the entire globe — there is no better audience for what we all do and what we all love. So thank you for braving this incredible heat, we really appreciate it.” ‘Gone,’ ‘Tip Toe’ Star David Morrissey on Relying on Gut Instinct: ‘Analysis Can Be Paralysis Sometimes’ Lesley Manville Always Reads Reviews: ‘If You Don’t Like Me Then You Don’t Like Me. I’m Not Gonna Give Up’ ‘Vikings’ Creator Michael Hirst on Dream Project About Medieval Heretics and New Show ‘Bloodaxe’: ‘It’s a New World’ Emilia Clarke’s ‘Ponies,’ ‘The Other Bennet Sister’ Among Competitors for Monte-Carlo Television Festival’s Golden Nymph Zeeko Zaki on Whether Dick Wolf Would Make a Show About ICE – and Leading ‘FBI’ as an Arab-American Muslim: ‘I’m Still the Only One’ Why ‘The Walking Dead: Dead City’ Is the Perfect Opener for Monte-Carlo TV Festival: ‘It’s a True Cultural Phenomenon’ Loading comments... More From Our Brands Rolling Stone Leonard Cohen Estate Does Not Support Trump’s Plan to Use ‘Hallelujah’ at Freedom 250 Rally Robb Report Pomellato’s New High Jewelry Collection Is a Masterclass in Eclecticism Sportico CC Sabathia, Hunter Pence, Dexter Fowler on Day 3 at Cannes Lions WWD H&M Sees Flat Sales in Q2 With 3% Fewer Stores",0,2026-06-25 11:44:51
16,https://variety.com/2026/film/news/ajay-devgn-chauhaan-jio-studios-colour-yellow-1236790225/,"Ajay Devgn Sets Action Comeback With ‘Chauhaan,’ From Jio Studios and Colour Yellow",Variety,2026-06-25T11:11:17,4532,"Jun 25, 2026 4:11am PT Ajay Devgn Sets Action Comeback With ‘Chauhaan,’ From Jio Studios and Colour Yellow By Naman Ramachandran Plus Icon Naman Ramachandran Latest Ajay Devgn Sets Action Comeback With ‘Chauhaan,’ From Jio Studios and Colour Yellow 32 minutes ago Anshuman Jha’s First Ray Films Boards Little Lamb’s Animated Feature ‘Error#404,’ Selected for MIFA at Annecy (EXCLUSIVE) 6 hours ago Acclaimed Bengali Drama ‘Pinjar’ Lands International Deal, Girls’ Education Initiative (EXCLUSIVE) 8 hours ago See All Jio Studios/Colour Yellow Top Bollywood star Ajay Devgn is set to headline “ Chauhaan ,” an action entertainer presented by Jio Studios and produced in association with Colour Yellow Productions, marking his debut collaboration with filmmaker Aanand L. Rai. The title was unveiled Thursday on what would have been the birth anniversary of Devgn’s late father, stunt choreographer and action director Veeru Devgan. Related Stories Peacock Gives Series Order to ‘Dungeon Crawler Carl’ TV Series From Seth MacFarlane’s Fuzzy Door, Chris Yost 'Love Island USA' Season 8 Is Peacock's Most-Watched TV Debut Ever, With 23% of Viewership on Phones and Tablets The announcement video features the classic song Amitabh Bachchan song “Jumma Chumma De De” from “Hum” (1991) in the backdrop. The preview opens with a tense dialogue tracking a costly military encounter. The sequence outlines the failure of conventional tactical measures, including tear gas, pellet guns, and water cannons, to handle localized resistance. The narrative shifts to a public address in Kashmir before building to the introduction of Devgn’s character, the titular Chauhaan. The film is directed by Neeraj Yadav and produced by Jyoti Deshpande, Rai and Himanshu Sharma under Jio Studios and Colour Yellow Productions, with a theatrical release date set for Oct. 1, 2027. Popular on Variety Devgn, who has appeared in over 100 films across a career stretching more than three decades, first established himself as a leading action star with his 1991 debut “Phool Aur Kaante,” in which he was introduced standing astride two moving motorcycles. That picture was directed by his father, Veeru Devgan, who had built a reputation as one of Bollywood’s most sought-after stunt choreographers before moving into direction. Over the following decades, Ajay Devgn went on to headline action franchise “Singham” and comedy franchise “Golmaal,” as well as thrillers such as “Drishyam” and its sequel, and won his third Indian National Film Award for Best Actor for his role in the period epic “Tanhaji” (2020). Recent releases including the supernatural thriller “Shaitaan” (2024) and action outing “Raid 2” (2025) were both box office successes, while his most recent releases – “Son of Sardaar 2” and “De De Pyaar De 2,” both 2025 – saw him return to comedy. Jio Studios, the content arm of Reliance Industries, has emerged as one of Indian cinema’s most active financiers and is coming off the back of “Dhurandhar,” Aditya Dhar’s spy action thriller starring Ranveer Singh, both instalments of which are amongst the highest grossing films of Indian cinema. Colour Yellow Productions, founded by Rai, has produced a range of critically and commercially successful titles including the “Tanu Weds Manu” franchise and “Raanjhanaa.” The screenplay for “Chauhaan” is by Himanshu Sharma, who has collaborated with Rai across much of his filmography. Rising British Star Matthew Broome on ‘My Fault: London’ Success, 007 Dreams: ‘I Would Love to Audition’ for Bond Movie John Hannah Teases New ‘Mummy’: ‘You’ve Heard All the Rumors and It’s True. Everyone’s Back’ ‘The Uniform,’ From Miso Film and Fremantle, Returns for a Second Season – and Dives Into the Cracks Within the Police Force (EXCLUSIVE) ‘There Has to Be Meat on the Bone’ to Create Long-Running Series, Executive Producers Argue at Monte-Carlo: ‘Follow the Stories You Want to Dig Into’ How ‘The Other Bennet Sister’ Star Ella Bruccoleri Learned to Love Jane Austen: ‘It Actually Feels Like She’s on My Side’ David Boreanaz on Taking On Iconic Role of Jim Rockford in ‘The Rockford Files’: ‘My Attitude Is “I Want to Make James Garner Proud”’ Loading comments... More From Our Brands Rolling Stone Leonard Cohen Estate Does Not Support Trump’s Plan to Use ‘Hallelujah’ at Freedom 250 Rally Robb Report Pomellato’s New High Jewelry Collection Is a Masterclass in Eclecticism Sportico CC Sabathia, Hunter Pence, Dexter Fowler on Day 3 at Cannes Lions WWD H&M Sees Flat Sales in Q2 With 3% Fewer Stores",0,2026-06-25 11:44:52
