id,url,title,source,publication_date,text_length,full_text,is_duplicate,created_at
23,https://variety.com/2026/film/news/cineverse-buys-horror-comedy-portal-to-hell-1236806935/,Cineverse Buys Horror-Comedy ‘Portal to Hell’ (EXCLUSIVE),Variety,2026-07-11T00:11:02,4747,"Jul 10, 2026 5:11pm PT Cineverse Buys Horror-Comedy ‘Portal to Hell’ (EXCLUSIVE) By Brent Lang Plus Icon Brent Lang Executive Editor BrentALang Latest Cineverse Buys Horror-Comedy ‘Portal to Hell’ (EXCLUSIVE) 10 hours ago Neon, Oscar-Winning Studio Behind ‘Anora’ and ‘Longlegs,’ Sells Stake to Department M 16 hours ago Box Office: ‘Moana’ Sets Sail With $4.5 Million in Thursday Previews 19 hours ago See All Cineverse and its horror division Bloody Disgusting have acquired U.S. VOD and streaming rights to “ Portal to Hell ,” the Slamdance and Frightfest debut feature from Woody Bess. A limited theatrical rollout is expected ahead of Cineverse’s digital release this summer. Trey Holland (“The Diabolical”), Romina D’Ugo (“12 Monkeys”), Keith David (“The Thing”), and Richard Kind (“Spin City,”) star in the indie horror-comedy. “Portal to Hell” follows “Dunn (Holland), a debt collector who lives a life of routine until a portal opens in his local laundromat, followed by a demon (Kind) sent to drag his neighbor, Mr. Bobshank (David), to hell for an unpaid debt. Helping people settle their debts is Dunn’s specialty, but when the demon offers a sinister deal — three souls in exchange for Bobshank’s freedom — he refuses. Related Stories LISTEN: Politics Puts a Spotlight on the Production Exodus From California and Other U.S. Filming Hubs Strictly Business From Cannes Lions: NBCUniversal, IBM, State Farm, Autodesk and Coinbase Leaders on Marketplace Trends, AI and Reaching Consumers The film is written and directed by Bess (who also wrote the 2024 Blacklist script “Total Landscaping.” Producing the film is Holland, Lucas Ford and Tom Watts. Little Shadows serves as the production company in association with Hello Moon, Ford Films, This is Swington, Dalmatian Cow, and Baked Studios. Executive Producers include David, Dionne Lea Williams, Matthew Dean Russell and George A Loucas. Popular on Variety Michael McDonald, Casey Deidrick, Trevor Newlin, Ryan Follesé, Kevin Fonteyne, and Monet Weir round out the cast. “We’re excited to bring ‘Portal to Hell’ to Cineverse and work with the passionate group of genre folks over there to release the film. Their reach and partnership felt like a good home to bring our film to a larger audience” the filmmakers said in a statement. The deal was negotiated by Raven Banner’s Cecilia Brush and Michael Paszt and Dan Fisher, vice president of acquisitions at Cineverse. Raven Banner reps worldwide rights and will continue to sell available territories at the upcoming Cannes Film Festival. Other deals for the title include Lighthouse (Germany) and 9th Planet (Poland). “Portal to Hell is exactly the kind of sharp, wildly entertaining genre film that Cineverse and Bloody Disgusting audiences respond to — inventive, funny, and genuinely horror-forward, with a terrific cast led by Keith David and Richard Kind,” said Fisher. Here’s a look at the theaters that will be showing “Portal to Hell.” Paradise – Toronto, ON – July 9th, 2026 Laurelhurst Theater – Portland, OR – July 24th + July 25th, 2026 Screenland Amour – Kansas City – July 31st, 2026 The Palace Eastwood – Syracuse, NY – July TBD Rio Theater – Vancouver, BC – August TBD Cinema Art Theater – Rehoboth Beach, DE – August 8th, 2026 The Independent – Huntsville, AL – August 21st, 2026 Chase Park Plaza Cinema – St. Louis, MO – August TBD Bama Theatre – Tuscaloosa, AL – August TBD Shoals Theatre – Florence, AL – September 5th, 2026 Darkside Cinema, Corvallis, OR – September TBD Rodeo Cinema – Oklahoma City, OK – October TBD Lumiere Cinema – Beverly Hills, CA – September TBD Colombia Stands in for Mexico in ‘Belleza,’ Paul Presburger’s First Feature at New Venture Ivan Ostrochovský Talks ‘Only Beautiful Things to Look At’ About Forced Sterilization – and Its U.S. Remake: ‘This Was Happening All Around the World’ ‘Mu-ki-ra,’ From Colombian Creative Powerhouse Estefanía Piñeres Duque and ‘Decorado’ Producer Chelo Loureiro, Brought to Market by Latido Films (EXCLUSIVE) Harvey Keitel Shooting ‘No Bias,’ Written by Wife Daphna Kastner, Calls Out ‘Danger’ of AI When Mentioning Michael Caine AI-Narrated ‘The Odyssey’ Audiobook Maeve Jinkings, Bárbara Colen, Márcio Vito Attached to Star in Brazilian BAM Buzz Title ‘Mesopotamia’ (EXCLUSIVE) Trine Dyrholm Crashes a Party in Mads Mengel’s ‘The Guest,’ Proving She’s ‘Simply One of Denmark’s Greatest Actors’ Loading comments... More From Our Brands Rolling Stone Comic Fends Off ‘Frivolous’ $27 Million Lawsuit Over ‘Lion King’ Joke, Will Seek Legal Fees Robb Report This New Sherry Cask-Matured Rum Comes From Scotland’s Islay Sportico Kawhi Trade Value Could Change Based on Aspiration Scandal WWD Inside Margherita Maccapani Missoni’s Private Couture Week Pop-up",0,2026-07-11 10:20:05
32,https://www.hollywoodreporter.com/news/general-news/wimbledon-final-tennis-celebrities-garfield-barbaro-sinner-1236643812/,"Strawberries, Cream and A-Listers: Why Every Celebrity Wants to Be Seen at Wimbledon Right Now",Hollywood Reporter,2026-07-10T23:40:39,9010,"× Skip to main content By Lily Ford Plus Icon Lily Ford @lilyfordtweets Follow Sign Up View All July 10, 2026 4:40pm Priyanka Chopra Jonas calls husband Nick at Wimbledon while seated next to Cynthia Erivo on July 9. Photo by Karwai Tang/WireImage Royalty. Sun. Strawberries. Cream. Oh, and tennis . Every year in London, it feels like the whole world descends on one of its southernmost suburbs: Wimbledon . Nearly a century and a half old, the historic tennis tournament — one of four Grand Slams on the ATP Tour — lasts around two weeks at the beginning of July and promises some of the most thrilling grass-court tennis you’ve ever seen (as well as some awful tube traffic). The quality of the game only seems to rise every year as seeded and unseeded players alike battle each knock-out match like it’s the last they’ll ever play. The anointing of its gentlemen’s and ladies’ singles victors remains the highest achievement in the sport. You could be Jannik Sinner, Carlos Alcaraz, Serena Williams, or even better, and you’ll still thirst for a Wimbledon win more than any other Slam. Related Stories Business Banijay CEO Marco Bassetti on All3Media Mega-Merger and What Comes Next News Former MP and Reality TV Star Ann Widdecombe Found Killed at Her Home, Man Arrested Granted, the prize money will only contribute to that competitiveness: The total tournament pool of winnings comes to an eye-watering £64,200,000 (approximately $85.8 million), with the singles champions taking home £3.6 million ($4.8 million) each. Compare this to 1968, when the men’s winner would earn £2000 ($2,600), and the women’s just £500 ($670), and it doesn’t take long to see how lucrative a sport tennis has become over the course of six decades. But the beauty of Wimbledon also lies within its uncertainty. Its prestige pushes players to maximum capacity and produces results that earn gasps from even the most polite of upper-class Brits perched in the Royal Box. Take 23-year-old Arthur Fery, a wildcard entrant who ranked 114th in the world before this year’s event, and who has now fought his way to a semi-final spot against the 3rd-ranked player in men’s singles tennis, Alexander Zverev. The Briton’s fairy tale run has made him this Wimbledon’s poster boy for underdogs. His predicted world ranking after it’s over? 36th. The tournament, by and large, is a king-maker. But why are Bad Bunny, Maude Apatow, Cynthia Erivo, David Beckham, Joe Jonas, Elle Fanning, Rami Malek, Dustin Hoffman and Benedict Cumberbatch all over Wimbledon’s social media hashtag this year? The event has always pulled in the world’s biggest stars. Such is its eminence that the Prince and Princess of Wales always find time to drop in (for the latter, it’s an obligation — she’s the patron of the All England Lawn Tennis Club, which hosts Wimbledon every year), but Wimbledon is increasingly becoming as glitzy as a film festival or fashion week. The Hollywood Reporter has a couple of guesses as to why it’s never been chicer to take a trip to Wimbledon Village. 1. The Perfect Place to Hard-Launch a Relationship Wimbledon is often the first public outing for a fresh celebrity couple, whether it’s Hollywood actors — such as, this time, Andrew Garfield and Monica Barbaro, who came in coordinated Ralph Lauren outfits — or a different sport entirely, like Ferrari’s F1 golden boy Charles Leclerc and his now-wife Alexandra in 2023. Olivia Rodrigo and Louis Partridge famously dined on tea, scones, and jam this time last year, in what was only their second or third public appearance together. Or maybe it’s not even a romantic relationship that sets social media on fire, but a platonic one: Wicked co-stars Jonathan Bailey and Ariana Grande were photographed giggling over a Pimm’s in the stands two years ago. From left: Monica Barbaro and Andrew Garfield at Wimbledon July 4, 2026. Photo by Karwai Tang/WireImage Why is Wimbledon such a popular choice for celebrities looking to go Getty official? Well, everyone dresses up for the occasion — it might just be the sleekest, preppiest dress code in the world — so flattering photos are guaranteed. It’s great publicity, because Wimbledon is considered a pretty sophisticated sporting event, and an interest in tennis scores you culture points. While you’ll almost certainly get some airtime on the BBC and ESPN, which have had the exclusive media rights for the tournament in the U.K. and U.S., respectively, for years, there’s no real responsibility to talk to journalists or fellow members of the public. Just a cab ride from central London, you can come and go as you please, escorted by security, and pretend you’re a die-hard spectator. 2. The Brands Have Skin in the Game The official tournament partners this year, such as IBM, Ralph Lauren, American Express, and Rolex, all have their own hospitality suites that serve hot food, champagne, afternoon tea, and fantastic views of the external courts. Some of the top-tier packages granting access to these luxury pavilions and Centre Court suites go for upwards of £3,000 ($4,000) per person. Most stars will be guests of these brands, of course, such as the annual Wimbledon luncheon with British Vogue , British GQ , and Ralph Lauren, co-hosted by none other than Anna Wintour. Garfield and Barbaro stopped by, as did Tom Hiddleston, Emma Corrin, Michaela Coel, Naomi Ackie, and Simone Ashley, all of them dressed impeccably by Ralph Lauren (again, never a bad photo). And if they aren’t leasing a suite, they’re still repped in the stands: Elle Fanning came in Dior, David Jonsson in LOEWE, and Maura Higgins in Chanel. Evian, the tournament’s official water partner, had U.S. influencers Alix Earle and Anastasia Karanikolaou swing by, which brings us to reason three… 3. It’s a Flex It’s hard to think of a more luxurious sporting event than Wimbledon. Monaco Grand Prix might give it a run for its money on pure glamor, but at least you can swap the smell of motor oil for strawberries and cream at the tennis. There’s a sense of serenity in Wimbledon Village, not to mention an onsite pharmacy and medical centre, shops, phone charger dispensers, and a wealth of food options including Cajun fried chicken, crayfish and a portion of lobster at £28.50 ($38.22) apiece. Tickets can range from £30 ($40) all the way to £10,000 ($13,400) for a men’s singles final ticket, and the majority are offered through a ballot, which means your attendance is often completely dependent on dumb luck. Unless you’re willing to give the Wimbledon queue a go, which has reported wait times of up to seven hours this year and even has some avid fans camping out overnight in uncharacteristically scorching weather here in London. So, getting an invite or nabbing a coveted seat in the Royal Box next to Queen Camilla, Paul McCartney, or Hugh Laurie is a real “made it” moment for some stars. Its exclusivity is as alluring as the standard of tennis on display, but the feel-good vibes are still just as palpable watching on the enormous screen from Henman Hill. 4. Social Media Is Turning Wimbledon Into a Can’t-Miss Event Call it the Zendaya effect if you like, but social media buzz around the tournament is as frenzied as it’s ever been. On Instagram and TikTok in particular, users are accruing thousands of views through “Day at Wimbledon” videos or by offering tips on the aforementioned mega-queue. Attendees have reportedly spoken about a much younger demographic appearing at the matches over the last few years, and The Guardian has reported that Wimbledon has been purposefully courting influencers who can get tennis to a whole new generation. Their director of marketing, Usama Al-Qassab, said the approach is working, and that attendees are generally inching younger every year over the last decade. Ticket holders in the ballot average at around mid-40s in age, while for those in the queue it is 35. Al-Qassab said demand for the event had surged in recent years among international visitors too, and that the ballot for tickets is more competitive than ever. Around 300,000 people came to Wimbledon in just the first week this year — a new record. It aligns with tennis’ growth on a global stage, with 106 million people around the world now picking up a racket regularly. That’s an increase of 25.6 percent in five years, according to a 2024 study released by the tennis’ global governing body, the International Tennis Federation (ITF). Much of this is likely related to the intensity around Gland Slam rivalries — the younger generation now has their own Nadal and Federer in Sinner and Alcaraz — as well as the sport’s gender equity, and tennis getting the Hollywood treatment through the Zendaya-starring Challengers and Netflix doc Break Point . TikTok, a brand also present at Wimbledon this year, can boast having made Morgan Riddle a star: The ex-girlfriend of U.S. tennis star Taylor Fritz, Riddle’s social-savvy brain (and 600,000 followers) earned her the title “the most famous woman in men’s tennis.” THR",0,2026-07-11 10:20:15
24,https://variety.com/lists/moana-cast-characters-live-action-animated/,‘Moana’ Cast Guide: Every Live-Action Character vs. the Original Animation,Variety,2026-07-10T23:30:00,6709,"Jul 10, 2026 4:30pm PT ‘Moana’ Cast Guide: Every Live-Action Character vs. the Original Animation By Matt Minton , Tanya Fedak , Mya Copeland Everett Collection Moana and Maui are setting sail once again — this time, in live-action. Releasing in theaters July 10, Disney’s animated musical “Moana” comes back to life with a brand new live-action remake led by Catherine Laga’aia, who stars as the titular character. Similar to the original, the film follows Moana’s journey to restore the heart of Te Fiti and help her village people of Motunui. Dwayne Johnson reprises his role as the shapeshifting demigod Maui, who joins Moana on her quest (while also treating audiences to a new and improved rendition of “You’re Welcome.”) Jemaine Clement also returns to the story as the CGI-version of the crab Tamatoa, who is known for his love of all things shiny. “Moana” will also welcome in new faces to bring the story to life, including Laga’aia, who is making her film debut. As for those who’ve grown to love the animated film’s chaotic animal sidekicks, you need not worry, as even Pua and Heihei will be returning to tag along on Moana’s journey across the sea. Here is a look at the key characters and the actors who bring them to life: Moana (Catherine Laga’aia) After Auli’i Cravalho’s angelic voice introduced the world to “How Far I’ll Go” ten years ago, newcomer Catherine Laga’aia leads this new take and appears as the brave titular character who learns to embrace her love of the sea. Born in Sydney, Australia, the 19-year-old breakout star previously appeared in three episodes of “The Lost Flowers of Alice Hart” as a young version of Candy, the character played by Frankie Adams. Laga’aia grew up with eight siblings; her father, Jay Lagaʻaia, is also a performer, appearing in Star Wars films like “Attack of the Clones” and “Revenge of the Sith” as Tycho Celchu. Maui (Dwayne Johnson) Dwayne Johnson returns to play the cocky, shapeshifting demigod Maui, who accompanies Moana on her journey to return Te Fiti’s heart and save the island of Motunui. The ten-time WWE world champion quickly became a major blockbuster star through roles in the “Jumanji” films, “Fast & Furious” and “Black Adam.” In recent years, he was in the awards conversation for director Benny Safdie’s “The Smashing Machine” and recently set a lead role in “Sing Sing” director’s new film, “Free Byrd.” Gramma Tala (Rena Owen) Gramma Tala, played by Rena Owen, is the heart of “Moana” as both Moana’s grandmother and the storyteller who helps the Kakamora tribe reconnect with their roots. Owen, who was born in New Zealand, has worked with the likes of George Lucas and Steven Spielberg, appearing in “A.I. Artificial Intelligence,” voicing Taun We in “Star Wars: Episode II – Attack of the Clones” and portraying Nee Alavar in “Star Wars: Episode III – Revenge of the Sith.” She recently reprised her role as Taun We in a 2021 episode of “Star Wars: The Bad Batch.” Chief Tui (John Tui) John Tui (“Fast & Furious Presents: Hobbs & Shaw,” “Solo: A Star Wars Story”) takes up the mantle of Chief Tui, Moana’s protective father and leader of the people of Motunui. Although encouraging of Moana following in his footsteps as chief, he is wary of her desire to explore the ocean beyond their island home. Temuera Morrison (“Aquaman,” “Star Wars: Episode III – Revenge of the Sith”) originated the role, with longtime Lin-Manuel Miranda collaborator Christopher Jackson (“Hamilton,” “In the Heights”) providing the singing voice for Chief Tui in the animated film. Sina (Frankie Adams) Moana’s perceptive mother, Sina both understands her daughter’s longing for the water but wants to protect her from danger. Samoan New Zealand actor Frankie Adams (“The Expanse,” “Shortland Street”) steps into the role, taking over from Nicole Scherzinger (“Sunset Boulevard,” “The X Factor”) in the original. Tamatoa (Jemaine Clement) Jemaine Clement (“Rio,” “What We Do in the Shadows”) returns as the glitzy king crab Tamatoa, and it’s hard to imagine anyone else delivering the catchy song “Shiny” in the same way. The jewel-encrusted crustacean harbors a grudge against Maui and fiercely guards his shiny collection, including the demigod’s fishhook after it falls into his lair. Pua the Pig Moana’s trusty, if a little skittish, pet pig Pua would follow her anywhere, even if he’s a little unsure of the ocean. The live-action production used a mix of real animals and animatronics to bring Moana’s sidekick to life. The animated Pua was voiced using a combination of real pig vocalizations and sound effects from voice actor Frank Welker, whose long list of credits includes Fred Jones in “Scooby Doo,” Pegasus in “Hercules,” Cri-Kee in “Mulan” and Abu, Rajah and the Cave of Wonders in “Aladdin.” Heihei the Rooster Heihei is a constantly confused rooster who accidentally joins Moana on her quest after seeking refuge in her boat. Always unaware of what’s happening around him, Heihei is simply along for the ride. Kakamora The Kakamora are hostile nomads floating across the sea who are easily identified by their armor made of coconut. Always ready to engage in battle, they are small but dangerous, especially when the hundreds of them band together. Te Kā Te Kā is the giant, dangerous demon of earth and fire Moana must get past to successfully restore the heart of Te Fiti. Gramma Tala first tells Moana the story of Te Kā, who awoke when Maui stole the heart of Te Fiti. While battling the demigod, the heart was ultimately lost in the sea, which only infuriated Te Kā more. ‘Succession’ Director Andrij Parekh to Helm ‘The Retrievals,’ Netflix Series About Real-Life IVF Scandal From ‘Maid’ Creator Cinetic Media Swoops on North American Sales Rights to ‘Manhunt,’ a Locarno Main Competition Contender (EXCLUSIVE) Social Issue Gore, Very Latino Gumshoes and OMG 2D Animation Power Up the Project Lineup at 2026’s Bogotá Audiovisual Market Colombia Adds Massive Soundstage as Bogotá Audiovisual Market Attendance Soars and ‘Narcos’ Star-Led ‘Rookies’ Cleans Up in Project Prizes Jesse Eisenberg on Why It Would Be ‘Silly’ to Leave U.S. Because of Trump, Says ‘The Debut’ Is ‘The Opposite of AI’ Following A24 DeepMind Partnership Acclaimed Chilean Filmmaker Valeria Sarmiento Bids Farewell to Directing With Affecting Childhood Sexual Abuse Drama ‘Behind the Rain’ Loading comments... More From Our Brands Rolling Stone Comic Fends Off ‘Frivolous’ $27 Million Lawsuit Over ‘Lion King’ Joke, Will Seek Legal Fees Robb Report This New Sherry Cask-Matured Rum Comes From Scotland’s Islay Sportico Kawhi Trade Value Could Change Based on Aspiration Scandal WWD Inside Margherita Maccapani Missoni’s Private Couture Week Pop-up",0,2026-07-11 10:20:06
33,https://www.hollywoodreporter.com/business/digital/meta-pulls-opt-out-ai-tool-hollywood-outrage-1236644312/,Meta Pulls Back on Opt-Out AI Function After Hollywood Outrage: “This Feature Missed the Mark”,Hollywood Reporter,2026-07-10T23:26:28,2482,"× Skip to main content By Alex Weprin Plus Icon Alex Weprin Senior Editor alexweprin Follow Sign Up View All July 10, 2026 4:26pm Photo by Justin Sullivan/Getty Images Meta has removed a feature from its new Muse AI photo and video tools that had sparked outrage from Hollywood power players like CAA and SAG-AFTRA. The tech giant on Friday evening said that it had pulled functionality that let users create AI content by tagging another public user to effectively remix their content. The company made it applicable to all public Instagram profiles unless users actively opted out of the feature. “Earlier this week, we announced that one way for people to generate images in Meta AI is by a-mentioning public Instagram accounts that they want to reference,” the company said in a statement Friday. “Our intent was to provide a useful creative tool and to give people control over whether their public content could be referenced in this way. We’ve heard feedback that this feature missed the mark, so it’s no longer available. The feature had sparked outrage from Hollywood power players, including CAA, which said in a statement Wednesday that “no one’s name, image, likeness, voice, or creative work should be used by any third party, including AI models, without clear, documented consent. “ SAG-AFTRA followed with a statement of its own, saying that “anything other than a clear and conspicuous OPT-IN for these types of uses of Instagram users’ images is unacceptable, and an utter miscalculation of public sentiment regarding the obvious dangers and harms inherent in such use.” It seems Meta has heard those concerns in dropping the functionality. After the news was unveiled Friday, CAA released a statement commending the decision, which read, “We commend Meta for its swift decision to remove the Muse Image feature. Putting individual rights and consent at the forefront is essential to building responsible technology. We look forward to ongoing conversations to ensure creators stay protected as technology evolves.” The backtrack bears a striking similarity to OpenAI’s backlash to the launch of its Sora app last year, which launched with limited IP protections, resulting in a slew of infringing characters, including many recognizable celebrities and figures, before backing away a few days later and cracking down on it. OpenAI, ultimately, nixed Sora as it shifted its strategy toward enterprise customers. July 10, 6:18 p.m. Updated with CAA’s statement. THR",0,2026-07-11 10:20:16
