id,url,title,source,publication_date,text_length,full_text,is_duplicate,created_at
7,https://deadline.com/2026/05/crunchyroll-anime-awards-2026-winners-list-1236920076/,Crunchyroll Anime Awards 2026 Winners — Full List,Deadline,2026-05-23T22:36:24,4201,"Skip to main content Dismiss News Banner Breaking News Cannes Award Winners, Palme D'Or Goes To 'Fjord' Read the full story By Glenn Garner Glenn Garner Associate Editor @xoxo_glenn More Stories By Glenn Stephen Colbert Follows Up Final ‘Late Show’ With Guest Host Spot On Michigan Talk Show After “Excruciating 23 Hours Without Being On TV” Boots Riley Says “Nope” To ‘I’m a Virgo’ Season 2, Jokes: “I Think We Watch TV Too Much” ‘Dutton Ranch’ EP Reacts To Creator Chad Feehan’s Exit: “I’m Grateful To Him” View All May 23, 2026 3:36pm 10th Crunchyroll Anime Awards Crunchyroll Anime Awards Crunchyroll celebrated the 10th edition of its Anime Awards on Saturday in Tokyo, honoring this year’s winners, who were chosen from 73 million votes globally. Hosted by hosted by Sally Amaki and Jon Kabira, the 10th Crunchyroll Anime Awards selected the final season of My Hero Academia for Anime of the Year, which was presented by The Weeknd. Other big winners this year include Demon Slayer: Kimetsu no Yaiba Infinity Castle for Film of the Year, Lazarus for Best Original Anime, One Piece for Best Continuing Series and Gachiakuta for Best New Series. Related Stories News Crunchyroll Anime Awards Nominations Revealed News Crunchyroll Anime Awards Draws Up Date For 10th Anniversary 2026 Ceremony The awards show will soon be available to stream on Crunchyroll and Crunchyroll’s YouTube Channel, along with Sony Group Corp Global and Japan YouTube Channels. Watch on Deadline See the full list of winners from the 10th Crunchyroll Anime Awards below. Anime of the Year My Hero Academia (final season) Film of the Year Demon Slayer: Kimetsu no Yaiba Infinity Castle Best Original Anime Lazarus Best Continuing Series One Piece Best New Series Gachiakuta Best Opening Sequence ‘On The Way’ by AiNA THE END — DAN DA DAN (Season 2) Best Ending Sequence ‘I’ by Bump of Chicken — My Hero Academia (final season) Best Action Solo Leveling: Arise from the Shadow (Season 2) Best Comedy DAN DA DAN (Season 2) Best Drama The Apothecary Diaries (Season 2) Best Isekai Anime Re:ZERO – Starting Life in Another World (Season 3) Best Romance The Fragrant Flower Blooms With Dignity Best Slice of Life SPY x FAMILY (Season 3) Best Animation Solo Leveling: Arise from the Shadow (Season 2) Best Background Art Gachiakuta Best Character Design Gachiakuta Best Director Akinori Fudesaka, Norihiro Naganuma — The Apothecary Diaries (Season 2) Best Main Character Maomao — The Apothecary Diaries (Season 2) Best Supporting Character Katsuki Bakugo — My Hero Academia (final season) ‘Must Protect At All Cost’ Character Anya Forger — SPY x FAMILY (Season 3) Best Anime Song ‘IRIS OUT’ by Kenshi Yonezu — Chainsaw Man – The Movie: Reze Arc Best Score Demon Slayer: Kimetsu no Yaiba Infinity Castle — Yuki Kajiura, Go Shiina Best Voice Artist Performance (Japanese) Aoi Yuki as Maomao — The Apothecary Diaries (Season 2) Best Voice Artist Performance (English) Lucien Dodge as Akaza — Demon Slayer: Kimetsu no Yaiba Infinity Castle Best Voice Artist Performance (Arabic) Tariq Obaid as Taro Sakamoto — SAKAMOTO DAYS Best Voice Artist Performance (Brazilian Portuguese) Charles Emmanuel as Akaza — Demon Slayer: Kimetsu no Yaiba Infinity Castle Best Voice Artist Performance (Castilian Spanish) Carles Teruel as Akaza — Demon Slayer: Kimetsu no Yaiba Infinity Castle Best Voice Artist Performance (French) Bastien Bourlé as Izuku Midoriya — My Hero Academia (final season) Best Voice Artist Performance (German) Gerrit Schmidt—Foß as Akaza — Demon Slayer: Kimetsu no Yaiba Infinity Castle Best Voice Artist Performance (Hindi) Abhishek Sharma as Jinshi — The Apothecary Diaries (Season 2) Best Voice Artist Performance (Italian) Mosè Singh as Denji — Chainsaw Man – The Movie: Reze Arc Best Voice Artist Performance (Latin Spanish) Jose Antonio Toledano as Akaza — Demon Slayer: Kimetsu no Yaiba Infinity Castle Florence Pugh Starrer ‘Midnight Library’ Being Chased By Multiple Studios ‘Mandalorian And Grogu’ Eyeing $90 Million Four-Day Domestic Opening Ben Stiller & Mike Judge Teaming On ‘Protective Custody’ Comedy At Apple Oscar Outlook For Cannes Movies; Neon Extends Streak; Jury Presser; More Read More About: Comments",0,2026-05-24 10:45:38
26,https://www.hollywoodreporter.com/lists/cannes-film-festival-takeaways-ai-queer-cinema/,"Hollywood Ghosts the Croisette, Queer Cinema Owns It and AI Crashes the Party: Five Takeaways From Cannes 2026",Hollywood Reporter,2026-05-23T22:24:11,8547,"× Skip to main content By Scott Roxborough Plus Icon Scott Roxborough Europe Bureau Chief sroxborough Follow Sign Up View All May 23, 2026 3:24pm Published on May 23, 2026 (L to R): Competition favorite 'The Black Ball,' 'Club Kid' director Jordan Firstsman, Vin Diesel at 'The Fast and The Furious' screening, humanoid robot at Cannes. Cannes Film Festival, Mustafa Yalcin/Anadolu,Rocco Spaziani/Archivio Spaziani/Mondadori Portfolio, Anna KURTH / AFP The 79th Cannes Film Festival was, on the surface, a more subdued edition. No studio films, fewer stars and a lineup more meh than magnifique. But that relative calm was deceptive. Beneath it, Cannes 2026 functioned less as a showcase of immediate hits than as a seismic map of the indie film industry, revealing shifting tectonic plates in the transformation of the indie sector, the changing role of studios on the festival circuit, and the accelerating impact of AI across production and marketing. What followed on the Croisette was not noise, but signal. Hollywood Stayed Home — and Everyone Noticed Image Credit: Hoda Davaine/Getty Images for Universal Pictures Cannes usually delivers at least one full-throttle Hollywood moment. Last year, Tom Cruise brought Mission: Impossible — The Final Reckoning to the Palais, the same place he debuted Top Gun: Maverick in 2022. This year, Hollywood stayed home, with filmmakers like Christopher Nolan ( The Odyssey ) and Steven Spielberg ( Disclosure Day ) preferring to fly past the Croisette. There was not a single studio movie to grace that famous red carpet. It was telling that the festival’s biggest red-carpet crowd was for a 25-year-old Universal action franchise. The midnight anniversary screening of The Fast and the Furious drew a massive cheering both outside the Palais and inside the theater, in a celebration that brought even Vin Diesel to tears . It was a touching moment, but also a quietly damning one for a festival that had to go back a quarter century to find its Hollywood moment. The reasons the majors stayed home are manifold. Cannes is expensive, the critics can be merciless, and the box office bump for a festival premiere is never guaranteed. (The Cannes launch of Mission: Impossible 8 didn’t appear to help much when the film finally hit theaters). Warner Bros.’ success last year with One Battle After Another and Sinners — two Academy Award-winning blockbusters that skipped the festival circuit — suggests Cannes needs the studios more than the studios need Cannes. It Was a Gay Old Cannes Image Credit: Cannes Film Festival LGBTQ+ cinema ruled Cannes this year. The biggest and hottest movies of the festival focused on queer characters, themes, or perspectives. In competition, Ira Sachs’ The Man I Love , starring Rami Malek as a gay performance artist navigating the AIDS crisis in 1980s New York, received a 10-minute ovation and chatter about an awards run for the Oscar-winning Bohemian Rhapsody star. Lukas Dhont, the Belgian filmmaker behind Girl and Close , wowed most critics — though not The Hollywood Reporter ‘s David Rooney — with Coward , his WWI drama about queer love in the foxholes. Then there were the Javis — Spanish directing duo Javier Calvo and Javier Ambrossi — whose La Bola Negra wove together three generations of queer men across the Spanish Civil War and beyond, which received the festival’s longest standing ovation (a reported 20 minutes) and overwhelming critical praise. Outside competition, Jane Schoenbrun’s queer slasher Teenage Sex and Death at Camp Miasma opened Un Certain Regard and Jordan Firstman’s Club Kid , a comedy that feels like an Adam Sandler movie with drugs and dolls, was the festival’s hottest ticket. The Market Started Slow — Then Found Its Legs Image Credit: Cannes Film Festival Ask anyone in the first week, and the Marché felt like a wake. Ask them in the final days and the mood had shifted considerably. After a sluggish opening week that left many sellers staring at their phones, the Cannes Film Market found something like a second wind in its final days, with a flurry of high-profile acquisitions injecting some much-needed energy into what had been a cautious, defensive Marché. The deal that set the tone arrived early: Jordan Firstman’s Cannes breakout Club Kid sold to A24 after a heated bidding war, with the indie distributor paying out a reported $17 million for worldwide rights to the surprisingly sweet (and nearly family-friendly) comedy set in the gay clubbing scene. Then came the late surge. Netflix picked up animated feature In Waves , and, at the time of writing, is close to securing domestic rights to festival favorite The Black Ball ( La Bola Negra ) starring Penélope Cruz and Glenn Close, and the Léa Seydoux title Gentle Monster . Both look like award plays for the streamer. Warner Bros.’ nascent specialty label Clockworks, which brought a restored version of Ken Russell’s 1971 classic The Devils to screen in Cannes Classics, is in talks to take Park Chan-wook’s The Brigands of Rattlecreek , a revenge Western written by Bone Tomahawk writer/director S. Craig Zahler and set to star Matthew McConaughey, Austin Butler, Pedro Pascal and Tang Wei for North America. If it closes, it would be a significant statement of intent for the newly minted WB division. It may not have been a vintage year for deal volume but there was a sense of quality over quantity and, by the close, some hopeful signs of green shoots for the indie film industry. The French Are Furious About Bolloré and Canal+ Image Credit: Magali Cohen / Hans Lucas / AFP via Getty Images The biggest drama at Cannes 2026 was off-screen and involved a growing civil war between French film industry professionals and the country’s top studio, Canal+. On the eve of the festival, some 600 French film professionals, including Juliette Binoche, Adèle Haenel and Swann Arlaud, signed an open letter protesting Vincent Bolloré, the right-wing media mogul who is the leading shareholder in Canal+. The letter didn’t mince words, calling Bolloré’s expanding French media empire — he is already a leading force in film and TV production and, through Canal+, is planning a takeover of UGC, the country’s third-largest theatrical exhibitor — a “fascist takeover of the collective imagination.” The anti-Bolloré petition gained momentum after Canal+ CEO Maxime Saada, speaking in Cannes, said he would blacklist the signatories . Thousands put their names to the open letter, including international stars like Javier Bardem, Mark Ruffalo, Yorgos Lanthimos and Ken Loach. By the end of the festival, there were more than 3,500 names on the petition. France’s biggest trade union representing entertainment workers has said it will file a lawsuit against Canal+ for Saada’s blacklisting threat. The audiences at Cannes screenings made their feelings clear by loudly booing the Canal+ and Studiocanal logos whenever they appeared on the big screen. With French elections next year and the far-right National Rally party expected to challenge for the presidency, this particular French film drama is nowhere near its climax. AI Is Here — and the Industry Has Stopped Pretending Otherwise Image Credit: Kishin Shinoyama A humanoid robot spotted marching up and down the Croisette seemed to sum up the worst AI fears of the film industry — the machines have arrived and they are taking your place. But inside the Palais and the market tents, the conversation over artificial intelligence had moved beyond fear into something more like uneasy acceptance. Fighting AI “is a battle we will lose,” said Demi Moore, a Cannes jury member this year, at the festival’s opening press conference, suggesting the film industry needs to “find ways in which we can work with it.” That’s not the official Cannes line. The festival has banned films using generative artificial intelligence from its competition lineup. But at the Cannes film market, and in discussions at industry events over the past two weeks, the tone has shifted. AI-friendly tech giant Meta signed on as an official partner to the festival in a multiyear deal. Its AI tools were used to help produce a [out of competition] festival entry: Steven Soderbergh’s documentary John Lennon: The Last Interview . At the Marché du Film, there was an “AI for Talent Summit” that took the AI revolution as given, focusing instead on ethical AI use, data sovereignty and on the ways the technology can be used to enhance, rather than replace, creativity. For the indie film industry, it felt like a turning point. THR",0,2026-05-24 10:45:59
27,https://www.hollywoodreporter.com/tv/tv-news/sherri-shepherd-farewell-talk-show-bittersweet-end-1236605157/,Sherri Shepherd Says Farewell to Talk Show After Four Years: “A Bittersweet End”,Hollywood Reporter,2026-05-23T22:06:24,1961,"Skip to main content By Lexi Carson Plus Icon Lexi Carson Associate Editor View All May 23, 2026 3:06pm Sherri Shepherd Courtesy of Andrew Werner/Sherri Logo text Sherri Shepherd has officially signed off from her daytime talk show, Sherri. Following her final show on Thursday, Shepherd took to Instagram Friday to pen a goodbye message to her journey on the show. “Family!!!! Thank you so much for all of the love and support over these last 4 years,” she wrote as a caption to a video, which included her walking in the empty studio. “It was a bittersweet end to a life I got to know so well. But here is to new beginnings…if you thought you were sick of me before just you wait.” Related Stories TV Sherri Shepherd Says She's ""Overwhelmed"" With Support Following Talk Show Cancellation TV Sherri Shepherd's Daytime Talk Show Canceled, Citing ""Evolving Daytime Television Landscape"" Taraji P. Henson, Niecy Nash, Lena Waithe, Donnie Wahlberg, Jennie Garth, Constance Zimmer and more left comments of support. View this post on Instagram It was first reported in February that Debmar-Mercury, the Lionsgate-owned syndicated TV production company, would cancel Sherri after four seasons. “This decision is driven by the evolving daytime television landscape and does not reflect on the strength of the show, its production — which has found strong creative momentum this season — or the incredibly talented Sherri Shepherd ,” said Debmar-Mercury co-presidents Ira Bernstein and Mort Marcus in a statement at the time. “We believe in this show and in Sherri and intend to explore alternatives for it on other platforms.” Two days later, Shepherd took to Instagram to share that she was “completely overwhelmed by the outpouring of love” for her and the Sherri show. Sherri’s cancellation came just hours after NBCUniversal announced plans to end The Kelly Clarkson Show following season seven. Thursday night was also Stephen Colbert’s last Late Night show. THR",0,2026-05-24 10:46:00
8,https://deadline.com/2026/05/florence-pugh-midnight-library-studios-in-talks-cannes-1236919776/,Florence Pugh Starrer ‘The Midnight Library’ Heading For Cannes Market’s Biggest Deal With Multiple Studios Chasing,Deadline,2026-05-23T22:03:21,3519,"Skip to main content Dismiss News Banner Breaking News Cannes Award Winners, Palme D'Or Goes To 'Fjord' Read the full story By Andreas Wiseman Andreas Wiseman Executive Editor Of International & Co-Head Of Film @AndreasWiseman More Stories By Andreas Netflix Closing In On Cannes Competition Buzz Title ‘La Bola Negra’ For The U.S. After Buyer Chase Doug Liman’s AI-Enabled Crypto Movie ‘Bitcoin’ To Feature Bezos, Zuckerberg, Putin, Eric Trump & More As Characters Netflix Taking U.S. Rights To Romain Gavras’ ‘Sacrifice’ With Chris Evans, Anya Taylor-Joy, Vincent Cassel, Salma Hayek Pinault, Charli xcx & More — Cannes Market View All May 23, 2026 3:03pm 'The Midnight Library;' Florence Pugh Getty Images EXCLUSIVE : Florence Pugh fantasy drama The Midnight Library , which will be directed by Lion filmmaker Garth Davis, is being chased by multiple studios in what will likely be the biggest deal out of this year’s Cannes market. We understand Paramount, Focus and Sony are in the mix for domestic and select international markets on the circa $70M movie, with producer-financier Studiocanal, which is selling the movie, expected to hold onto its territories. This will likely be a territory split akin to the deal the Euro studio struck on Paddington In Peru . A winner should become clear in coming days. Related Stories Festivals The Jury Has Spoken, American Films Shut Out, But What Does It All Mean For Oscars? - Cannes Film Festival Festivals Park Chan-Wook Led Cannes Jury On Director, Actor & Actress Category Ties: ""We Couldn't Decide..."" In the big-canvas “love letter to life,” Pugh will play Nora Seed, who finds herself in a library between life and death with the chance to experience all the potential lives she could have lived. Watch on Deadline Deadline revealed the biggest domestic deal of the Cannes market so far in the shape of Clockwork’s pact for The Brigands Of Rattlecreek and the biggest overall deal of the market so far with Amazon’s early 20s international deal for Pumping Black . When it makes, The Midnight Library deal will comfortably surpass those and likely pushes past $30M. Studiocanal and Blueprint Pictures are behind the project. The regular collaborators optioned Matt Haig’s popular novel, which has a screenplay by Olivier Award winner Laura Wade ( Rivals ) and Tony nominee Nick Payne ( We Live In Time ). First published by Canongate in 2020, the book has sold 15 million copies and has been translated into 56 languages. We’ve heard good things about the project from buyers on the ground in Cannes. Haig will executive-produce. The plan is for the project to enter pre-production this fall with shoot at the start of 2027. Studiocanal is expected to release theatrically across their territory footprint of the UK, France, Germany, Italy, Poland, Benelux, Australia, New Zealand, and South Africa. It’s the biggest-budget project the Euro studio has mounted in some time. Graham Broadbent and Pete Czernin of Blueprint will produce with Anita Overland and Pugh. Blueprint’s Ben Knight and Diarmuid McKeown executive-produce. Anna Marsh, Ron Halpern and Dan MacRae executive produce for Studiocanal. Studiocanal and the studios declined to comment. Florence Pugh Starrer ‘Midnight Library’ Being Chased By Multiple Studios ‘Mandalorian And Grogu’ Eyeing $90 Million Four-Day Domestic Opening Ben Stiller & Mike Judge Teaming On ‘Protective Custody’ Comedy At Apple Oscar Outlook For Cannes Movies; Neon Extends Streak; Jury Presser; More Read More About: Comments",0,2026-05-24 10:45:39
28,https://www.hollywoodreporter.com/tv/tv-news/watch-stream-french-open-2026-tennis-live-online-free-1236603842/,Roland-Garros 2026 Livestream: Here’s Where to Watch the French Open Online,Hollywood Reporter,2026-05-23T22:00:00,3869,"× Skip to main content By Jonathan Zavaleta Plus Icon Jonathan Zavaleta View All May 23, 2026 3:00pm PARIS, FRANCE - JUNE 07: Coco Gauff of United States plays a backhand against Aryna Sabalenka during the Women's Singles Final match on Day Fourteen of the 2025 French Open at Roland Garros on June 07, 2025 in Paris, France. Julian Finney/Getty Images If you purchase an independently reviewed product or service through a link on our website, The Hollywood Reporter may receive an affiliate commission. The 2026 French Open is here, marking an opportunity for No. 4-ranked player Coco Gauff to repeat. Although the American superstar won the French Open title last year, Gauff hasn’t captured victory since the Wuhan Open in October 2025. This could be a good chance for the 22-year-old to win back-to-back La Coupe Suzanne-Lenglen trophies at Roland-Garros. At a Glance: Watch the 2026 French Open Online When: May 24 to June 7 TV Channels: TNT, truTV Streaming online: DirecTV , HBO Max , Hulu + Live TV , Sling This year, Gauff and Aryna Sabalenka landed in the same half after the draw, setting up the potential for a semifinal clash. Gauff beat Sabalenka at the 2025 French Open, although Iga Swiątek, the 2024 winner, is the odds-favorite to win this year’s edition. Of the Pole’s six Majors, four have been in the French Open. Related Stories TV UEFA Women's Champions League Final 2026: Where to Watch the Soccer Match Live Online TV 'The Late Show With Stephen Colbert': Here's Where to Watch the Final Episode Online On the men’s side, Jannik Sinner is only missing a French Open title on his way to his first career grand slam. His closest rival, Carlos Alcaraz, the back-to-back reigning champion at Roland-Garros, will miss the tournament and Wimbledon due to a wrist injury. Sinner also avoids an early meeting with Novak Djokovic, who landed in the opposite half of the draw. That sets up the potential for a Sinner vs. Djokovic final, although the Serbian veteran has to get through tough competition on his way to the final, including Giovanni Mpetshi Perricard in the first round, and potentially Joao Fonseca, Casper Ruud and Alexander Zverev. How to Watch the 2026 French Open Online If you’re looking to stream the tournament, matches airs on TNT and truTV and livestream on HBO Max . There are multiple ways to stream the tournament live; here’s what you need to know. Editor’s Choice DirecTV get 5-day free trial DirecTV carries TNT and truTV in all of its packages, letting fans stream the tournament live. The Premier package adds HBO Max , or you can get TNT and truTV with the streamlined Sports Genre Pack. All of the plans include a five-day free trial . Best Streaming HBO Max sign up now HBO Max is available as a standalone streaming service, part of a bundle with Disney+ and Hulu , or an add-on to Prime Video . The streamer carries all of the matches during the French Open. Best Streaming Bundle Hulu + Live TV get 3-day free trial Hulu + Live TV includes TNT and truTV in its package, and the streaming platform comes with a three-day free trial . Tennis fans get access to ESPN and Tennis Channel 2 for additional coverage, as well as Hulu, Disney+ and ESPN Unlimited. Best Affordable Sling sign up now Sling’s Blue package includes TNT and truTV, which carries matches live. Sling Blue starts at $45.99/mo., although there is no free trial option. However, pricing and channel availability depends on your local TV market. Learn more about Sling TV here . French Open 2026 Schedule, Key Dates The tournament runs from May 24 through June 7. The mixed doubles final takes place on June 4, with the women’s singles final on June 6, and the men’s final on June 7. The tournament is held at Roland-Garros Stadium, in Paris, France, which is nine hours ahead of Pacific Time. Check out a complete French Open 2026 schedule here . THR",0,2026-05-24 10:46:01
