id,url,title,source,publication_date,text_length,full_text,is_duplicate,created_at
16,https://variety.com/2026/film/global/goya-awards-2026-sundays-sirat-deaf-decorado-1236675538/,"Goyas 2026: ‘Sundays,’ ‘Sirāt’ Sweep Spanish Academy Awards",Variety,2026-03-01T00:30:58,5116,"Feb 28, 2026 4:30pm PT Goyas 2026: ‘Sundays,’ ‘Sirāt’ Sweep Spanish Academy Awards Oliver Laxe's ‘Sirāt’ won more awards, dominating craft categories, but Alauda Ruiz de Azúa's ‘Sundays’ scored the biggest: picture, director, actress and original screenplay By John Hopewell Plus Icon John Hopewell Chief International Correspondent john_hopewell Latest Goyas 2026: ‘Sundays,’ ‘Sirāt’ Sweep Spanish Academy Awards 2 hours ago London TV Screenings 2026: 10 Takeaways From Buzz Titles Such as ‘Baywatch’ to U.S. Deals, Asia’s Taking Center Stage and More Startling Facts About Microdramas 2 days ago Fremantle Scales Music Game Show ‘Hitster’ With Series Orders From Germany, Netherlands and Canada (EXCLUSIVE) 3 days ago See All 'Sundays' (L-R) Blanca Soroa, Miguel Garcés and Patricia López Arnaiz in ‘Sundays’ Courtesy of SSIFF “Sirāt,” Oliver Laxe’s techo-sluiced Moroccan desert odyssey, swept the 40th Spanish Academy Goya Awards in craft categories. A “brilliantly bizarre, cult-ready vision of human psychology tested to its limits,” said Variety , ““Sirāt” is nominated for two Oscars and already won a Cannes Festival Jury Prize. “Sirāt” won most awards at Saturday’s Goya Awards ceremony. However, Alauda Ruiz de Azúa’s “Sundays,” a study of failing family dynamics, plagued by intolerance, won the biggest: best picture, director, actress (Patricia López Arnaíz) and original screenplay. “ Sundays ” won San Sebastian’s top Golden Shell last September. Related Stories KLOS-FM Radio Host Uncle Joe Benson Dies at 76 With Oscar voting in full swing, sound went to the Oscar-nominated all-female team of “Sirāt” : supervising sound editor Laia Casanovas, re-recording mixer Yasmina Praderas and production sound mixer Amanda Villavieja who spent nine months on and off on the sound design process. Popular on Variety The biggest breakout of the night, however, was “ Deaf ,” a Berlinale Panorama Audience Award winner and portrait of the challenges facing the deaf, here a mother, in a world where they are expected to hear. Barcelona is not Berlin. It took just 150 seconds of Saturday’s Goya Awards for co-host Luis Tosar, wearing a Palestine pin, to condemn “Gaza genocide” – with the audience pretty well unanimously bursting out in applause. Susan Sarandon, winner of this year’s International Goya of Honor, thanked Spanish President Pedro Sánchez and many artists from Spain who “talk with such moral lucidity.” “It helps me to feel less alone, part of a larger community,” in a world dominated by “cruelty” and “violence,” she added. “Dictators can govern countries by whims. That can be denying gender violence and climate change, invading countries and deporting immigrants,” said Joaquin Oristrell, a co-winner of adapted screenplay for “La Cena,” again to raucous applause, In her acceptance speech, Sarandon quoted American writer Howard Zinn: “To be hopeful in bad times is not just foolishly romantic. It is based on the fact that human history is a history not only of cruelty, but also of compassion, sacrifice, courage, kindness.” 40th Spanish Academy Goya Awards, 2026 Best Picture “Sundays,” Manu Calvo, Marisa Fernández Armenteros, Sandra Hermida, Nahikari Ipiña, Director Alauda Ruiz de Azúa, “Sundays” Actress Patricia López Arnaíz Actor Jose Ramón Soroiz, “Maspalomas” New Director Eva Libertad, “Deaf” Original Screenplay Alauda Ruiz de Azúa, “Sundays” Adapted Screenplay Joaquín Oristrell, Manuel Gómez Pereira, Yolanda García, “La Cena” Art Direction Laia Ateca, “Sirāt” New Director Eva Libertad, “Deaf” Supporting Actor Álvaro Cervantes, “Deaf” Supporting Actress Nagore Aramburu, “Sundays” New Actress Miriam Garlo, “Deaf” New Actor Toni Fernández Gabarre, “Sleepless City” Documentary Feature Albert Serra, “Afternoons of Solitude” Animated Feature “ Decorado ,” Alberto Vazquez, Chelo Loureiro, Iván Mimabres, José María Fernández de Vega Sound Amanda Villavieja, Laia Casanovas, Yasmina Praderas, “Sirāt” Original Music Kangding Ray, “Sirāt” Cinematography Mauro Herce, “Sirāt” Editing Cristóbal Fernández, “Sirāt” Production Design Oriol Maymó, “Sirāt” Original Song Alba Flores, Sílvia Pérez Cruz, “Flowers for Antonio” Special Effects Paula Gallifa Rubia, Ana Rubio, “Los Tigres,” Costume Design Helena Sanchís, “La cena,” Makeup & Hairstyling Ana López-Puigcerver, Belén López-Puigcerver y Nacho Díaz, “The Captive” Ibero-American Film “Belén,” Dolores Fonzi, Argentina European Film Fiction Short “Angulo Muerto,” Cristian Beteta Animated Short “Gilbert,” Jordi Jiménez, Arturo Lacal, Alex Salu Documentary Shor “El Santo,” Carlo D’Ursi. Honorary Goya Gonzalo Suárez International Honorary Goya Susan Sarandon Can New Disney CEO Josh D’Amaro Weather AI, Revitalize ‘Star Wars’ and Marvel and Save the Magic Kingdom? Loading comments... More From Our Brands Rolling Stone Oliver ‘Power’ Grant Died After ‘Courageous’ Battle With Cancer, Wu-Tang Clan Confirms Robb Report How Dusty Pink Became Menswear’s Hottest Color of Spring Sportico Miami of Ohio’s Perfect Hoops Run Sets Table for New $281M Arena WWD Black and White Style Is Trending on NAACP Awards 2026 Red Carpet",0,2026-03-01 02:59:29
4,https://deadline.com/2026/02/goya-awards-alauda-ruiz-de-azua-los-domingos-best-film-1236739597/,Goya Awards: Alauda Ruiz de Azúa’s ‘Los Domingos’ Dominates & Wins Best Film,Deadline,2026-03-01T00:25:09,4305,"Skip to main content By Zac Ntim Zac Ntim International Reporter @ZacharyNtim More Stories By Zac ‘Found:’ Lucian Msamati, Ronkẹ Adékọluẹ́jọ́, Merv Lukeba & Paul Kaye To Lead British Social Thriller From ‘To Leslie’ Producer ‘This Is Buzz:’ Mark Pellington’s Experimental Slamdance Title Inspired By The Cult MTV Show Lands North American Distribution Deal Open Letter Expressing “Deep Concern” About Reported Plans To Dismiss Berlinale Head Tricia Tuttle Rises To 700 Signatories Including Nancy Spielberg, Kleber Mendonça Filho & Sean Baker View All February 28, 2026 4:25pm Alauda Ruiz de Azua Lluis GENE / AFP via Getty Images Alauda Ruiz de Azúa ’s latest film, Los Domingos , dominated this evening’s Goya Awards , winning five awards, including Best Film. Scroll down for the full list of winners. The film’s haul also included Best Director and Best Original Screenplay for Azúa and Best Actress for Patricia López Arnaiz. Oliver Laxe’s Sirât also racked up a series of wins this evening, including Best Cinematography, Sound and Editing. This evening’s Goya Awards took place in Barcelona. Los Domingos had led this year’s nominations with 13 nods. The film debuted at last year’s San Sebastian Film Festival, where it won the top prize. Shot in De Azúa’s native Bilbao, the film follows the story of Ainara, an intelligent 17-year-old who is trying to decide what to study at university. However, the young woman begins to feel a calling from God and decides to embrace the life of a cloistered nun. The news takes her entire family by surprise, creating a chasm and putting everyone to the test. We spoke with De Azúa about the film ahead of San Sebastian in 2025. You can read that interview here . Related Stories News How To Vote For Sound - Key Tips From Industry Insiders And MPSE President David Barber: ""Sound Is Inherently Invisible When It Works"" News Arthouse Indies Mix It Up With Winter Olympics & Kpop On Super Bowl Weekend -- Specialty Preview Oliver Laxe’s Sirât trailed Los Domingos with 11 noms. The film debuted at Cannes last year, where it won the Jury Prize, and has become a surprise awards season frontrunner. The film is Spain ’s submission for the Best International Feature Film Oscar. The film follows a father and his son who arrive at a rave deep in the mountains of southern Morocco. They are searching for Mar — their daughter and sister — who vanished months ago at one of these endless, sleepless parties. Watch on Deadline Susan Sarandon won the honorary Goya Awards this evening. She gave a press conference during her time in Spain, which we wrote about here . See the full list of tonight’s winners below: BEST PICTURE Los Domingos BEST DIRECTOR Alauda Ruiz de Azúa — Los Domingos BEST NEW DIRECTOR Eva Libertad BEST ORIGINAL SCREENPLAY Alauda Ruiz de Azúa — Los Domingos BEST ADAPTED SCREENPLAY Joaquín Oristrell, Manuel Gómez Pereira and Yolanda García Serrano —La cena BEST ORIGINAL MUSIC Kangding Ray — Sirât BEST ORIGINAL SONG Alba Flores and Sílvia Pérez Cruz — Flores para Antonio BEST ACTOR Jose Ramon Soroiz — Maspalomas BEST ACTRESS Patricia López Arnaiz — Los Domingos BEST SUPPORTING ACTOR Álvaro Cervantes BEST SUPPORTING ACTRESS Nagore Aranburu BEST NEW ACTOR Antonio Fernández Gabarre — Sleepless City BEST NEW ACTRESS Miriam Garlo — Sorda BEST PRODUCTION DESIGN Oriol Maymó — Sirât BEST CINEMATOGRAPHY Mauro Herce — Sirât BEST EDITING Cristóbal Fernández— Sirât BEST ART DIRECTION Laia Ateca Font — Sirat BEST COSTUME DESIGN Helena Sanchis — The Dinner BEST MAKEUP AND HAIR Ana López-Puigcerver, Belén López-Puigcerver, and Nacho Díaz — The Captive BEST SOUND Amanda Villavieja, Laia Casanovas, and Yasmina Praderas — Sirat BEST SPECIAL EFFECTS Paula Gallifa and Ana Rubio — Los Tigres BEST ANIMATED FILM Decorado BEST DOCUMENTARY Afternoons of Solitude BEST IBERO-AMERICAN FILM Belén BEST EUROPEAN FILM Sentimental Value BEST FICTION SHORT FILM Ángulo muerto BEST DOCUMENTARY SHORT FILM El Santo BEST ANIMATED SHORT FILM Gilbert Paramount And WBD Reveal Details Of $110B Deal: Latest News + Analysis ‘Scream 7’ Is Slaying: Pic Eyes Franchise-Best $60M+ In Opening Frame ‘Sinners’ ‘One Battle’ & ‘KPop Demon Hunters’ Win: Full List On The Set Of The ‘Peaky Blinders’ Movie With Cillian Murphy & The Rest Of The Gang Read More About: Comments",0,2026-03-01 02:59:13
27,https://www.hollywoodreporter.com/news/general-news/shia-labeouf-arrest-again-new-orleans-battery-charge-1236518250/,Shia LaBeouf Arrested Again in New Orleans on Battery Charge Amid Recent Comments Denying Drinking Problem,Hollywood Reporter,2026-03-01T00:17:05,3287,"× Skip to main content By Lexi Carson Plus Icon Lexi Carson Associate Editor View All February 28, 2026 4:17pm Shia LaBeouf Rich Fury/Getty Images Shia LaBeouf has been arrested again in New Orleans. According to Orleans Parish Sheriff’s Office records, LaBeouf was taken into custody Saturday and charged with one additional misdemeanor count of simple battery. The Transformers star’s attorney, Sarah Chervinsky, said that after learning New Orleans police had issued a new arrest warrant Friday, LaBeouf voluntarily turned himself in to the Orleans Parish jail, according to the Associated Press . “No regular person would be required to post over $100,000 in bonds and be jailed two separate times for one misdemeanor incident,” Chervinsky said. “Just as he does not deserve preferential treatment, Mr. LaBeouf also does not deserve to be treated more harshly by the police and courts just because he is a public figure.” Related Stories General News Who Won and Lost the Week: The Great Netflix Pull-Out Edition (Plus Tyra, Shia and More) News Shia LaBeouf to Remain Free on $100,000 Bail After New Orleans Bar Altercation The legal trouble began during Mardi Gras earlier this month. LaBeouf was arrested Feb. 17 following an altercation at R Bar in the Faubourg Marigny. Authorities said he became aggressive and allegedly fought with two men, both of whom told police he assaulted them. LaBeouf is accused of punching one bartender multiple times and striking another in the face. He also allegedly shouted homophobic slurs during the incident. The Hollywood Reporter reported details of the altercation at the time. LaBeouf was later taken to a local hospital for undisclosed injuries. After being released, he was formally charged with two counts of simple battery. In an interview with YouTuber Andrew Callaghan released Saturday morning, the 39-year-old actor addressed what he said led to his initial arrest and discussed his recent behavior. “It’s not nice to hurt people ever. It’s fucking lame. People got hurt. I got to deal with that. I’mma deal with that in full. I’ll eat it all,” he said. “It was on me. It’s not on them. It’s on me. I messed up.” When asked if he takes responsibility, LaBeouf responded, “Definitely. Yeah. 1,000 percent.” He added, “My side is this — my behavior, bullshit. I got to deal with that. Does that mean I got to go to rehab again? I’m just not into it, bro. I don’t think my answers are there. If I genuinely did, I’d go. I don’t think I have a drinking problem. I think I have a different problem, and I’m going to address it.” The Fury actor said he believes he has a “small man complex,” explaining, “I think it’s something that has to do with anger and ego more so than my drinking. That’s where I’m at now on my journey, and I’m trying to navigate it.” When asked what triggered his anger, LaBeouf said, “I’ll be honest with you, big gay people are scary to me. I’m standing by myself, and three gay dudes are next to me, touching my leg, I get scared. I’m sorry if that’s homophobic. Then I’m that.” Asked whether that situation happens often, he said it occurred only once. “That’s why I got arrested,” he said. LaBeouf concluded, “I am wrong for touching anyone, ever. And that’s the end of my statement on this whole shit.” THR",0,2026-03-01 02:59:41
5,https://deadline.com/2026/02/maggie-gyllenhaal-jake-gyllenhaal-the-bride-envy-1236739761/,Maggie Gyllenhaal Talks Directing Brother Jake Gyllenhaal For The First Time In ‘The Bride!’ & Early Feelings Of Envy In Her Career,Deadline,2026-03-01T00:14:13,3263,"Skip to main content By Natalie Oganesyan Natalie Oganesyan Weekend Editor @nat_oganesyan More Stories By Natalile Maggie Gyllenhaal Talks Directing Brother Jake Gyllenhaal For The First Time In ‘The Bride!’ & Early Feelings Of Envy In Her Career ‘Paradise’s Sterling K. Brown On Xavier & Annie’s “Purely Platonic” Bond: “We Don’t Get A Chance To Explore Enough Of These Relationships On Camera” Shailene Woodley, Thomas Doherty Discuss Working With An Intimacy Coordinator To Develop Their ‘Paradise’ Romance View All February 28, 2026 4:14pm Maggie Gyllenhaal Getty Images Maggie Gyllenhaal discussed her experience directing her brother, actor Jake Gyllenhaal , in her forthcoming Gothic romance movie The Bride! In a sprawling discussion with The New York Times , she explained, “I waited until I was absolutely sure that asking him to do this part in the movie — it’s a pretty small part, it’s just a cameo, really — I made sure, I really did some work in thinking to make sure it was the right thing to do to ask him.” The Lost Daughter filmmaker described “tearing up” while broaching the subject with her sibling, adding with a laugh that she “waited too long … that was a rookie mistake.” Related Stories News Cover Story: 'Hamnet's Jessie Buckley On Love, Her Process, Her Past And Her Connection With Co-Star Paul Mescal: ""He Held Me"" Acquisitions Netflix Snaps Up Action Thriller Spec 'Kill Switch' From Harrison Query; Jake Gyllenhaal To Star “It meant so much to me,” she added, given that she strived early on in her career to distinguish herself from her filmmaker father, screenwriter mother and fellow performer brother. She said she and the Brokeback Mountain star have “never been estranged but we’ve never been as close as we are now.” Watch on Deadline Elsewhere in the interview, Maggie Gyllenhaal described her fascination with envy and having felt some latent feelings of jealousy toward her brother’s early movie stardom. “In general, I am very interested in envy. I think there’s a reason why it’s a seven deadly sin. I’m interested in it in terms of watching other people’s movies come out. Admiration versus envy. What creates it? I think it’s usually feeling starving, like you don’t have enough,” she said, while also noting that taking a beat to reach out to Wuthering Heights director Emerald Fennell “free[d] the competition up and you realize: ‘No, no. We’re actually 100 percent on the same team. There absolutely is enough to go around.'” She concluded, “I don’t think I knew that at first, when I was young and Jake was a movie star right away. I don’t think I was in touch with the envy, but it was there.” The Bride! — due in theaters March 6 — stars Jessie Buckley (in the title role), Christian Bale, Peter Sarsgaard (also Maggie Gyllenhaal’s spouse), Annette Bening and Penélope Cruz. It loosely draws inspiration from the 1935 classic Bride of Frankenstein , itself based on Mary Shelley’s landmark novel. Paramount And WBD Reveal Details Of $110B Deal: Latest News + Analysis ‘Scream 7’ Is Slaying: Pic Eyes Franchise-Best $60M+ In Opening Frame ‘Sinners’ ‘One Battle’ & ‘KPop Demon Hunters’ Win: Full List On The Set Of The ‘Peaky Blinders’ Movie With Cillian Murphy & The Rest Of The Gang Read More About: 1 Comments",0,2026-03-01 02:59:14
17,https://variety.com/gallery/naacp-image-awards-red-carpet-fashion-best-dressed/,NAACP Image Awards 2026 Red Carpet Arrivals,Variety,2026-03-01T00:05:47,7697,"Feb 28, 2026 4:05pm PT NAACP Image Awards 2026 Red Carpet Arrivals By Angelique Jackson Plus Icon Angelique Jackson angelique814 Latest Delroy Lindo Thanks Supporters After BAFTA N-Word Incident: ‘It’s a Classic Case of Something That Could Be Very Negative Becoming Very Positive’ 1 hour ago NAACP Image Awards 2026 Winners (Updating Live) 2 hours ago ‘G.I. Joe’ Reboots in the Works at Paramount; Max Landis Pitching a Script Years After #MeToo Allegations Derailed Career 1 day ago See All Getty Images The 57th NAACP Image Awards are here, and the stars are outfitted in their best looks on the baby blue carpet. The telecast, hosted by Deon Cole, caps the NAACP’s week-long celebration of Black excellence, with awards presented in more than 90 categories (across film, television and streaming, music, literature and podcasts). Ryan Coogler’s period vampire drama “Sinners” received the most nominations with 18 nods, while “Bel-Air” led all television shows with seven nominations. During the show, special honors will be presented to industry icons Viola Davis, Colman Domingo, Salt-N-Pepa and DJ Spinderella, and the Entertainer of the Year will be revealed. Nominees for that prize, the show’s signature category, are Cynthia Erivo, Doechii, Kendrick Lamar, Michael B. Jordan and Teyana Taylor. The Image Awards will be broadcast live from the Pasadena Civic Auditorium at 8 p.m. ET/PT on BET, CBS and across Paramount networks. MORE: 2026 NAACP Image Awards Winners List Teyana Taylor Image Credit: Variety via Getty Images Entertainer of the Year nominee Teyana Taylor arrives on the blue carpet at the NAACP Image Awards. Salt-N-Pepa and DJ Spinderella Image Credit: Variety via Getty Images Cheryl “Salt” James, Deidra “DJ Spinderella” Roper and Sandra “Pepa” Denton pose on the carpet at the 57th NAACP Image Awards. The pioneering rap group will be inducted into the NAACP Image Awards Hall of Fame . Colman Domingo Image Credit: Getty Images Colman Domingo arrives at the NAACP Image Awards. The Emmy winner and Oscar nominee will receive the President’s Award during the ceremony. Julius Tennon, Viola Davis and Genesis Tennon Image Credit: Frazer Harrison/Getty Images Chairman’s Award honoree Viola Davis (center) poses on the carpet at the NAACP Image Awards with her husband Julius Tennon and daughter Genesis Tennon. Keke Palmer Image Credit: Variety via Getty Images Keke Palmer strikes a glamorous pose at the NAACP Image Awards. Ryan Michelle Bathe and Sterling K. Brown Image Credit: Variety via Getty Images Ryan Michelle Bathe and Sterling K. Brown smile for photographers at the NAACP Image Awards. Chase Infiniti Image Credit: Gilbert Flores/Variety via Getty Images “One Battle After Another” breakout Chase Infiniti attends the NAACP Image Awards. Sev Ohanian, Zinzi Coogler and Ryan Coogler Image Credit: Getty Images “Sinners” producers Sev Ohanian, Zinzi Coogler and Ryan Coogler attend the 57th NAACP Image Awards at Pasadena Civic Auditorium on February 28, 2026 in Pasadena, California. (Photo by Frazer Harrison/Getty Images) Wunmi Mosaku and Delroy Lindo Image Credit: Getty Images “Sinners” stars Wunmi Mosaku and Delroy Lindo arrive at the NAACP Image Awards. Kerry Washington Image Credit: Variety via Getty Images Kerry Washington poses on the carpet at the NAACP Image Awards. Deon Cole Image Credit: Getty Images NAACP Image Awards host Deon Cole arrives on the carpet. Tyla Image Credit: Getty Images for BET Tyla poses for photographers on the baby blue carpet at the NAACP Image Awards. Halle Bailey Image Credit: Getty Images Halle Bailey (“You, Me & Tuscany”) attends the NAACP Image Awards. Quinta Brunson Image Credit: Getty Images “Abbott Elementary” creator and star Quinta Brunson attends the NAACP Image Awards. Aldis Hodge and Miles Caton Image Credit: Variety via Getty Images “Cross” star Aldis Hodge poses with “Sinners” breakout Miles Caton on the carpet at the NAACP Image Awards. Regé-Jean Page Image Credit: Getty Images Regé-Jean Page (“You, Me & Tuscany”) attends the NAACP Image Awards. Issa Rae Image Credit: Getty Images Issa Rae poses on the carpet at the NAACP Image Awards. Tyler James Williams Image Credit: Frazer Harrison/Getty Images “Abbott Elementary” star Tyler James Williams on the carpet at the NAACP Image Awards. Chloe Bailey Image Credit: Getty Images Chloe Bailey attends the NAACP Image Awards. Nnamdi Asomugha Image Credit: Variety via Getty Images Nnamdi Asomugha attends the NAACP Image Awards. Janelle James Image Credit: Getty Images “Abbott Elementary” star Janelle James smiles for photographers at the NAACP Image Awards. Tyriq Withers Image Credit: Frazer Harrison/Getty Images Tyriq Withers (“Reminders of Him,” “Him”) attends the NAACP Image Awards. Jayme Lawson Image Credit: Variety via Getty Images “Sinners” star Jayme Lawson on the carpet at the NAACP Image Awards. Uzo Aduba Image Credit: Getty Images Uzo Aduba attends the NAACP Image Awards. Lovie Simone Image Credit: Getty Images “Forever” star Lovie Simone poses for photographers at the NAACP Image Awards. Eva Marcille Image Credit: Getty Images Eva Marcille poses on the blue carpet at the NAACP Image Awards. Edwina Findley Image Credit: Getty Images Edwina Findley shines on the blue carpet at the NAACP Image Awards. Mario Van Peebles Image Credit: Gilbert Flores/Variety via Getty Images Actor and director Mario Van Peebles poses on the carpet at the NAACP Image Awards. Michelle Buteau Image Credit: Getty Images Michelle Buteau poses on the carpet at the NAACP Image Awards. Don Lemon Image Credit: Getty Images Don Lemon attends the NAACP Image Awards. Emayatzy Corinealdi Image Credit: Getty Images “Reasonable Doubt” star Emayatzy Corinealdi attends the NAACP Image Awards. Brandon Claybon Image Credit: Paras Griffin/Getty Images for BET “Beyond the Gates” star Brandon Claybon smiles for photographers at the NAACP Image Awards. Pretty Vee Image Credit: Getty Images for BET Pretty Vee poses on the carpet at the NAACP Image Awards. Elijah Blake Image Credit: Getty Images for NAACP Elijah Blake attends the NAACP Image Awards. Ms. Pat Image Credit: Frazer Harrison/Getty Images “The Ms. Pat Show” star Ms. Pat arrives to the NAACP Image Awards. Tabitha Brown Image Credit: Getty Images Tabitha Brown smiles for photographers at the NAACP Image Awards. Jabari Banks Image Credit: Frazer Harrison/Getty Images “Bel-Air” star Jabari Banks attends the NAACP Image Awards. Terrence J and Trevor Jackson Image Credit: Paras Griffin/Getty Images for BET Terrence J and Trevor Jackson during pre-show livestream at the 57th NAACP Image Awards. Kyla Pratt Image Credit: Aaron J. Thornton/Getty Images for NAACP Kyla Pratt poses on the carpet before co-hosting the livestream pre-show for the NAACP Image Awards. Michael Cooper Jr. Image Credit: Frazer Harrison/Getty Images “Forever” star Michael Cooper Jr. attends the NAACP Image Awards. Aiyana-Lee Image Credit: Deadline via Getty Images Aiyana-Lee (“Highest 2 Lowest”) on the carpet at the 57th NAACP Image Awards. Mignon Image Credit: Frazer Harrison/Getty Images “Sistas” star Mignon attends the NAACP Image Awards. Claudia Jordan Image Credit: Aaron J. Thornton/Getty Images for NAACP Claudia Jordan attends the NAACP Image Awards. Can New Disney CEO Josh D’Amaro Weather AI, Revitalize ‘Star Wars’ and Marvel and Save the Magic Kingdom? More From Our Brands Rolling Stone Oliver ‘Power’ Grant Died After ‘Courageous’ Battle With Cancer, Wu-Tang Clan Confirms Robb Report How Dusty Pink Became Menswear’s Hottest Color of Spring Sportico Miami of Ohio’s Perfect Hoops Run Sets Table for New $281M Arena WWD Black and White Style Is Trending on NAACP Awards 2026 Red Carpet",0,2026-03-01 02:59:30
