id,url,title,source,publication_date,text_length,full_text,is_duplicate,created_at
9,https://deadline.com/2026/04/producers-guild-announces-show-dates-2027-2028-awards-1236784093/,Producers Guild Sets Show Dates For 2027 & 2028 Awards,Deadline,2026-04-07T23:14:52,4662,"Skip to main content By Pete Hammond Pete Hammond Awards Columnist/Chief Film Critic @DeadlinePete More Stories By Pete ‘Heated Rivalry’ And Emmy Winners Dan Levy, Hannah Einbinder, Jane Lynch Lead Honorees For Critics Choice’s Celebration Of LGBTQ+ Cinema & Television ‘The Drama’ Review: Complications Arise For Zendaya’s And Robert Pattinson’s Perfect Wedding In Kristoffer Borgli’s Smart And Tart Anti-Romcom Oscars Moving To Peacock Theater At L.A. Live In 2029 View All April 7, 2026 4:14pm Producers Guild of America There must be something in the water today. First the Academy of Motion Picture Arts and Sciences and ABC got things rolling with the anticipated announcement of ceremony dates for both the 99th and 100th Oscar shows (March 14, 2027 and March 5, 2028). That was quickly followed by SAG-AFTRA’s announcement of its Actor Awards show dates for the next two years (February 28, 2027 and February 20, 2028). And now stepping right in line is the PGA with its info for the next two Producers Guild Awards. Related Stories News Academy Reveals Dates For 99th & Landmark 100th Oscars Ceremonies + Voting Timeline Below The Line 2026-27 Awards Season Calendar Today, the Producers Guild of America announced key dates for the 2027 Producers Guild Awards, which will take place on Saturday, February 27, 2027. They also said the 2028 PGA Awards will take place on Saturday, February 19, 2028. Watch on Deadline The PGA Awards ceremony is often a harbinger for Oscars , most recently this year with the crowning of eventual Best Picture Oscar winner One Battle After Another. The guild’s annual show celebrates the work and accomplishments of producers and recognizes outstanding achievements in producing across various categories, including theatrical motion pictures, TV, documentaries, animation and emerging media. The most recent ceremony recognized influential film producers with special honors including Amy Pascal, who received the David O. Selznick Achievement Award in Theatrical Motion Pictures; Jason Blum, who received the Milestone Award; and Mara Brock Akil, who received the Norman Lear Achievement Award in Television. Top honors, in addition to One Battle After Another , went to The Pitt, KPop Demon Hunters, The Studio, Adolescence and Traitors. ‘One Battle After Another’ producers Paul Thomas Anderson and Sara Murphy accept their PGA Award Michael Buckner Below are the key dates for the 38th annual Producers Guild Awards, with dates for the annual East and West Coast celebrations TBA: Producing Credits Form Deadlines Documentary Motion Pictures: Friday, August 28, 2026 Television Programs (Television Series/Specials; Televised or Streamed Motion Pictures; Sports, Children’s, and Short Form): Friday, September 25, 2026 Innovation Award: Thursday, October 1, 2026 Theatrical Motion Pictures and Animated Motion Pictures: Friday, October 9, 2026 Screener Submission Deadline Documentary Motion Pictures: Friday, August 28, 2026 Nomination Polls Open Sports, Children’s and Short Form: Tuesday, November 24, 2026 Television Series/Specials and Televised or Streamed Motion Pictures: Thursday, December 17, 2026 Theatrical Motion Pictures and Animated Motion Pictures: Monday, December 21, 2026 Nomination Polls Close Sports, Children’s, and Short Form: Wednesday, December 9, 2026 Theatrical Motion Pictures; Animated Motion Pictures; Television Series/Specials; Televised or Streamed Motion Pictures: Thursday, January 7, 2027 Nominees Announced Innovation Award & Documentary Motion Pictures: Tuesday, December 8, 2026 Sports, Children’s, and Short Form: Friday, December 11, 2026 Theatrical Motion Pictures; Animated Motion Pictures; Television Series/Specials; Televised or Streamed Motion Pictures: Friday, January 8, 2027 Final Polls Open Sports, Children’s, and Short Form: Monday, January 18, 2027 Theatrical Motion Pictures; Animated Motion Pictures; Documentary Motion Pictures; Television Series/Specials; Televised or Streamed Motion Pictures: Friday, January 22, 2027 Final Polls Close Sports, Children’s, and Short Form: Monday, February 8, 2027 Theatrical Motion Pictures; Animated Motion Pictures; Documentary Motion Pictures; Television Series/Specials; Televised or Streamed Motion Pictures: Friday, February 19, 2027 2027 Awards Show Saturday, February 27, 2027 2028 Awards Show Saturday, February 19, 2028 (timeline dates TBA) Layoffs Underway At SPE; SPT Comedy Head, GSN Boss Among Names Ceasefire! Trump Agrees To Hold Off On Bombing Iran For Now CAA Signs Greta Gerwig As She Follows ‘Barbie’ With ‘Narnia’ Academy Sets Dates For 99th & Landmark 100th Oscars Ceremonies Read More About: Comments",0,2026-04-08 10:13:22
40,https://www.hollywoodreporter.com/music/music-industry-news/universal-music-statement-bill-ackman-acquisition-proposal-1236558292/,Universal Music Backs Lucian Grainge Amid Takeover Bid by Bill Ackman,Hollywood Reporter,2026-04-07T23:01:34,2067,"× Skip to main content By Ethan Millman Plus Icon Ethan Millman Music Editor View All April 7, 2026 4:01pm Lucian Grainge Neilson Barnard/Getty Images Universal Music Group issued a brief statement Monday addressing Bill Ackman ‘s proposal to acquire the record company, stating that the company’s board of directors and advisors “will review the proposal in accordance with its fiduciary duties and analyze its implications for shareholders, employees, artists, songwriters and other stakeholders.” “The Board of Directors has complete confidence in UMG’s strategy and the leadership of Sir Lucian Grainge and the Company’s management team,” the company said. “UMG will have no further comment on the proposal until the Board of Directors completes its review.” Related Stories Music Universal Music Group Gets $63.5 Billion Takeover Offer From Bill Ackman's Pershing Square Music Universal Music Group Posts $14.4B In Revenue For 2025, $4.1B in Fourth Quarter Ackman’s Pershing Square Capital Management had unveiled its proposal late Monday, in a takeover bid worth about $63 billion. Ackman argued UMG’s stock is undervalued despite its status as the world’s largest music company, citing several factors including a delay to get UMG listed on the U.S. stock market (the company is currently traded out of Euronext and Ackman had pushed to get a U.S. listing too), as well as “suboptimal shareholder investor relations, communications, and engagement.” “Since UMG’s [stock market] listing, [UMG chairman and CEO] Sir Lucian Grainge and the company’s management have done an excellent job nurturing and continuing to build a world-class artist roster and generating strong business performance,” Ackman said. “However, UMG’s stock price has languished due to a combination of issues that are unrelated to the performance of its music business and importantly, all of them can be addressed with this transaction.” If a deal did happen UMG would be merged with Pershing Square SPARC Holdings, and the company would become a Nevada corporation listed on the NYSE. THR",0,2026-04-08 10:13:56
41,https://www.hollywoodreporter.com/movies/movie-news/adrian-grenier-devil-wears-prada-2-starbucks-ad-1236558195/,Adrian Grenier Gets Justice for His ‘Devil Wears Prada’ Character in Starbucks Ad,Hollywood Reporter,2026-04-07T23:00:48,2320,"× Skip to main content By McKinley Franklin Plus Icon McKinley Franklin View All April 7, 2026 4:00pm Adrian Grenier in 'The Devil Wears Prada.' 20th Century Fox Film Corp./Courtesy Everett Collection Adrian Grenier has no hard feelings about not being part of The Devil Wears Prada 2 . The actor, who appeared in the original 2006 film, has been vocal about his “disappointment” over not being invited to reprise his role of Nate for the long-awaited 2026 follow-up. But in a new ad for Starbucks’ Energy Refreshers, Grenier admits he has no ill will about not being featured in the upcoming film. “You might have seen the headlines — I wasn’t asked to be part of a certain sequel. But I’m good. Really. It’s all good energy,” Grenier says in the ad, after which the camera pans out to see the actor is talking to a Starbucks barista. Related Stories Movies Meryl Streep Calls Out Melania Trump While Talking 'The Devil Wears Prada 2' With Anna Wintour for Vogue Movies Meryl Streep Was ""Imitating"" Two Directors for 'Devil Wears Prada' Character Instead of Anna Wintour “So a toast to Nate,” he added, in reference to his Devil Wears Prada character, whom was the chef boyfriend to Anne Hathaway’s Andy Sachs, the assistant to Meryl Streep’s Miranda Priestly, the editor-in-chief of fashion magazine Runway . The fictional couple break up in the first film due to Andy’s busy schedule, though they seemingly reconcile at the end. “He made a mean sandwich, he loved his girlfriend, to a point,” he added. “He wasn’t perfect. So let’s leave Nate in 2006 and keep this good energy going.” However, the Entourage concluded the ad on an open-ended, cheeky front, noting, “I mean, if they call, I’m free.” A majority of the original Devil Wears Prada cast and director David Frankel are returning for the sequel, which releases on May 1. Hathaway, Streep, Emily Blunt and Stanley Tucci will all reprise their roles, though it was revealed in July 2025 that Grenier would not be involved in the project. “Obviously, it was a disappointment that I didn’t get the call to be in the sequel,” Grenier told Page Six in March. “But I also understand there was some backlash with Nate, the character, so that might have something to do with it.” He added, “It leaves room for a beautiful spinoff in which Nate has his own film.” THR",0,2026-04-08 10:13:57
10,https://deadline.com/2026/04/trump-agrees-two-week-ceasefire-iran-1236784103/,"Ceasefire! Trump Backs Off “Destructive Force Being Sent Tonight To Iran”, For Now",Deadline,2026-04-07T22:59:08,3946,"Skip to main content By Dominic Patten Dominic Patten Executive Editor, Legal, Labor & Politics @DeadlineDominic More Stories By Dominic Ceasefire! Trump Backs Off “Destructive Force Being Sent Tonight To Iran”, For Now Last-Minute Blake Lively Vs. Justin Baldoni Settlement Hopes Dashed; Trial Still Set For Next Month “Criminal”: Timothy Busfield’s Lawyer Slams Sex Abuse Alleging Parents Of ‘Cleaning Lady’ Actors As More Of Melissa Gilbert’s ABC Interview Airs Tonight View All April 7, 2026 3:59pm Donald Trump on Air Force One on February 6, 2026 Getty UPDATED with Iranian statements: Donald Trump on Tuesday accepted a ceasefire deal with Iran brokered by Pakistan for an off-ramp on his threat that a “whole civilization will die tonight, never to be brought back again.” Promising brimstone and fire, Trump had given the regime in Tehran until 5 p.m. PT/8 p.m. PT to open the blocked Strait of Hormuz before undefined attacks would commence. Related Stories News Donald Trump Warns “A Whole Civilization Will Die Tonight” If Iran Doesn’t Agree To Deal By Deadline News Donald Trump’s Cell Phone: How Reporters Got President’s Initial Comments On Iran War By Just Calling Him Up Almost from the moment Trump said he would hit Iran even harder than usual, the extreme position found POTUS clearly looking for a way out of his own deadline. In what many will view as a widely anticipated TACO move with less than two hours remaining on his self-imposed clock, Trump took to social media to unveil the latest state of affairs. “Based on conversations with Prime Minister Shehbaz Sharif and Field Marshal Asim Munir, of Pakistan, and wherein they requested that I hold off the destructive force being sent tonight to Iran, and subject to the Islamic Republic of Iran agreeing to the COMPLETE, IMMEDIATE, and SAFE OPENING of the Strait of Hormuz, I agree to suspend the bombing and attack of Iran for a period of two weeks,” POTUS posted. Watch on Deadline Read live on many cable newsers, a statement from Tehran took a very different perspective on what went down between the U.S. and Iran in the flurry of the past few hours and that 10-point plan. “We congratulate the people of Iran for this victory and reiterate that until the final details of the victory are finalized, officials and people must remain united and defiant,” Iran’s National Security Council stated. “The enemy, in its unfair, unlawful, and criminal war against the Iranian nation, has suffered an undeniable, historic, and crushing defeat,” it added, insisting the ceasefire permits Iran to carry on with their much feared nuclear program, escape U.S. sanctions and be acknowledged as in charge of the strait. A follow-up statement from the country’s foreign minister took a less bellicose tone and offered some practical specifics. “For a period of two weeks, safe passage through the Strait of Hormuz will be possible via coordinating with Iran’s Armed Forces,” Abbas Araghchi said, fulfilling one of the White House’s core objectives amid fast-rising oil prices in the West. Israel is also a part of the ceasefire but was subjected to a last-minute barrage of missile attacks today from Iran and its minions. Israeli officials reportedly asserted that they will halt their bombing campaign of the Islamic Republic for the next 14 days, for now. As news of the ceasefire spread and become topic No. 1 on cable news and online, CNN ’s Jake Tapper asked the question to his on-air guests that was certainly on the mind of many. “Peace is good, lack of killing people good, but is there anything fundamentally different today from yesterday?” the veteran anchor inquired. All agreed, not much. Layoffs Underway At SPE; SPT Comedy Head, GSN Boss Among Names Ceasefire! Trump Agrees To Hold Off On Bombing Iran For Now CAA Signs Greta Gerwig As She Follows ‘Barbie’ With ‘Narnia’ Academy Sets Dates For 99th & Landmark 100th Oscars Ceremonies Read More About: 29 Comments",0,2026-04-08 10:13:23
11,https://deadline.com/2026/04/lisa-ann-walter-stand-up-special-hulu-exclusive-1236583685/,"Lisa Ann Walter Sets Title, Premiere Date For Hulu Stand-Up Special – Update",Deadline,2026-04-07T22:54:00,3264,"Skip to main content By Matt Grobar Matt Grobar Senior Film Reporter More Stories By Matt Lisa Ann Walter Sets Title, Premiere Date For Hulu Stand-Up Special – Update Gil Harari & Jonathan Silverman Return To Paradigm To Lead New Physical Production Division Brave Artists Management Signs ‘Riverdale’ Alum Marisol Nichols View All April 7, 2026 3:54pm Lisa Ann Walter Tyren Redd UPDATED, 3:54 p.m.: Hulu has announced that Abbott Elementary star Lisa Ann Walter ‘s debut stand-up special, on which we were first to report last fall, is titled It Was an Accident and will premiere Friday, May 15. In the hour, Walter takes on feral Gen-Xers, self-loathing, and navigating a backsliding America, via the no-filter lens of a grown-ass woman who has been paying attention. Walter wrote, performed, and directed it herself, exec producing alongside Abbott co-star Sheryl Lee Ralph, Michelle Caputo, and Shannon Hartman, with Art & Industry producing. Read more on Walter and her special below. PREVIOUS EXCLUSIVE, OCTOBER 14: After touring as a stand-up for 20 years, Abbott Elementary star Lisa Ann Walter has inked a deal for Hulu to release her debut comedy special in 2026. Watch on Deadline No word yet on what Walter will be discussing in the special. But she directed it herself, taping it at Helium Comedy Club in Philadelphia, PA. It’ll stream on Hulu and Hulu on Disney+ for bundle subscribers in the U.S. and on Disney+ internationally. Related Stories News Comedian Zoltan Kaszas Self-Releasing New Special ‘London Fog’ In November News Comedian Becky Robinson To Unveil Debut Stand-Up Special ‘Entitled’ Later This Month The special is produced by Art & Industry, and is executive produced by Walter, Walter’s Abbott co-star Sheryl Lee Ralph, Michelle Caputo and Shannon Hartman. Walter plays fan favorite Melissa Schemmenti in ABC’s highest rated comedy, Abbott Elementary, which is currently airing its fifth season Wednesdays on ABC, with episodes streaming next day on Hulu. She has previously co-created, produced and starred in several network sitcoms: Fox’s My Wildest Dreams, ABC’s Life’s Work, and NBC’s Dance Your Ass Off. She’s also known for stand-out performances in films like The Parent Trap, Shall We Dance, Bruce Almighty, Steven Spielberg’s War of the Worlds, and the Lionsgate action-comedy Killers with Ashton Kutcher. Walter published the memoir The Best Thing About My Ass Is That It’s Behind Me with Harper One in 2011, seeing it reach #13 on both Amazon and the New York Times Comedic Essays Bestseller List. As an advocate for many years, she is on the board of numerous organizations: The Entertainment Community Fund (for whom she won $1 million as Celebrity Jeopardy champion), the ERA Coalition, and the SAG-AFTRA National & Local organization, where she was recently elected as the first Vice President of the Los Angeles Local. The comedic multi-hyphenate is represented by Authentic, Gersh, and Innovative for stand-up, as well as Del Shaw Moonves. Layoffs Underway At SPE; SPT Comedy Head, GSN Boss Among Names Ceasefire! Trump Agrees To Hold Off On Bombing Iran For Now CAA Signs Greta Gerwig As She Follows ‘Barbie’ With ‘Narnia’ Academy Sets Dates For 99th & Landmark 100th Oscars Ceremonies Read More About: 1 Comments",0,2026-04-08 10:13:24
12,https://deadline.com/2026/04/tfc-promotes-cecily-pierce-manager-1236784055/,TFC Promotes Cecily Pierce To Manager,Deadline,2026-04-07T22:32:28,2025,"Skip to main content By Denise Petski Denise Petski Senior Managing Editor More Stories By Denise TFC Promotes Cecily Pierce To Manager David Zayas & Stephen Bishop Join ‘R.J. Decker’ In Recurring Roles ‘Dark Matter’ Sets Season 2 Release Date; First- Look Photos View All April 7, 2026 3:32pm Cecily Pierce Matthew Solomon EXCLUSIVE: Cecily Pierce is moving up at TFC Management . Pierce has been promoted to manager, having most recently served as the coordinator across both TFC Management and TFC Productions. A graduate of Cambridge University and a London native, Pierce originally moved to Los Angeles to pursue an MFA at UCLA. After completing her Masters, she joined TFC as assistant to company co-founder Ben Jacobson. After quickly establishing herself as an asset to both the management and production arms of the business, she was promoted to coordinator in 2024. Pierce’s roster includes emerging filmmakers such as Lee Knight ( A Friend of Dorothy ) and Nicholas Finegan, as well as a diverse range of television writers and showrunners, including Brad Winters ( Berlin Station ) and William Spetz ( Tore ). “Cecily is a homegrown success story!,” said TFC co-founders Jacobson and David Stone. “She started with us as an assistant and worked to become an integral part of our team. She’s warm, sophisticated, and deeply passionate about client advocacy. We’re so thrilled to continue to elevate her here at TFC.” Watch on Deadline “I feel so lucky to be able to keep growing at TFC,” said Pierce. “There is so much care and sophistication in the way that this company operates, and it’s been a perfect home for me. I’m genuinely inspired by my teammates and our clients every day, and I’m excited to continue building alongside them!” Layoffs Underway At SPE; SPT Comedy Head, GSN Boss Among Names Ceasefire! Trump Agrees To Hold Off On Bombing Iran For Now CAA Signs Greta Gerwig As She Follows ‘Barbie’ With ‘Narnia’ Academy Sets Dates For 99th & Landmark 100th Oscars Ceremonies Read More About: 2 Comments",0,2026-04-08 10:13:25
