id,url,title,source,publication_date,text_length,full_text,is_duplicate,created_at
32,https://www.hollywoodreporter.com/movies/movie-news/platino-awards-xcaret-2026-nominations-mexico-film-tv-1236542664/,"Platino Awards Xcaret Reveal 2026 Nominations: ‘Belén,’ ‘Los Domingos’ Lead Films With 11 Noms",Hollywood Reporter,2026-03-20T22:46:54,4387,"× Skip to main content By Chris Gardner Plus Icon Chris Gardner chrissgardner Follow Sign Up View All March 20, 2026 3:46pm One of the statues given out during the Platino Awards. Courtesy of Premios Platino The stage is being set for the 13th annual Platino Awards Xcaret, a ceremony that honors the best of Ibero-American film and TV. Leading the film nominations with 11 each are Dolores Fonzi’s Belén (Argentina) and Alauda Ruiz de Azúa’s Los Domingos (Spain), followed by Kleber Mendonça Filho’s The Secret Agent (Brazil) and Oliver Laxe ’s Sirât (Spain) with eight and seven, respectively. On the TV side, Bruno Stagnaro’s The Eternaut (Argentina) leads the nominees with 13 noms followed by the Rafael Cobos, Fran Araujo and Alberto Rodriguez-created series The Anatomy of a Moment (Spain) with 12. Related Stories Movies Box Office: Neon Touts 'Sentimental Value,' 'Secret Agent' and a Myriad of Other Milestones on Eve of Oscars Movies Oscar Season's Most Burning Question: Why Not Timothée? For a fourth time in its 13-year history, the Platino Awards will take place inside the Gran Tlachco Theater at Xcaret Park in Riviera Maya on May 9. Xcaret, a luxury enclave home to hotels, restaurants, experiences and adventure in the heart of the resort town, welcomes the awards back after a year away in the event’s other home base of Madrid, Spain. The show will be broadcast across the Americas. Nominations were unveiled today at the Telemundo Center in Miami. “This year, we return to Mexico, a beloved country that has shared so many adventures and successful initiatives with these awards. After 13 years, having the honor and responsibility of recognizing the best in Spanish and Portuguese-language film and television is a challenge we gladly embrace with commitment, year after year,” said Enrique Cerezo, who serves as executive president of the Platino Awards and president of EGEDA. “The privilege of bringing together all the talent from the world’s largest region in a joyful, diverse, enriching, and festive gathering is also a reward for everyone who makes up the great Platino family.” Competing for best film are It’s Still Night in Caracas (Venezuela), Belén (Argentina), Los Domingos (Spain), The Secret Agent (Brazil) and Sirât (Spain). Nominated in the best miniseries or TV series category are Anatomy of a Moment (Spain), Chespirito: Unintentionally (Mexico), The Eternaut (Argentina), and The Dead Women (Mexico). Best long-form series nominees are Fatal Beauty (Brazil), The Promise (Spain), Dreams of Freedom (Spain), and Velvet: The New Empire (United States). Vying for best director are Alauda Ruiz de Azúa ( Los Domingos ), Dolores Fonzi ( Belén ), Kleber Mendonça Filho ( The Secret Agent ), and Oliver Laxe ( Sirât ). Best documentary film award nominees include Apocalypse in the Tropics (Brazil), Under the Flags, The Sun (Paraguay/Argentina), Flores para Antonio (Spain) and Afternoons of Solitude (Albert Serra, Spain). Nominated for best actor on the film side are Alberto San Juan ( The Dinner ), Guillermo Francella ( Homo Argentum ), Ubeimar Ríos Gómez ( A Poet ), and Wagner Moura ( The Secret Agent ). Singled out as best actress are Blanca Soroa and Patricia López Arnaiz ( Los Domingos ), Dolores Fonzi (Belén), and Natalia Reyes ( One Night in Caracas ). Álvaro Morte ( Anatomy of a Moment ), Javier Cámara ( Jakarta ), Leonardo Sbaraglia ( Menem ) and Ricardo Darín ( The Eternaut ) heard their names mentioned for best male performance in a miniseries or TV series, while Candela Peña (Fury), Carla Quílez (Jakarta), Griselda Siciliani (Envious) and Paulina Gaitán (The Dead Women) got nominated on the female side in the same category. Best supporting actor nominees include Álvaro Cervantes ( Deaf ), Edgar Ramírez ( One Night in Caracas ), Juan Minujín ( Los Domingos ) and Rodrigo Santoro ( The Blue Trail ), while best supporting actress nominees are Camila Pláate and Julieta Cardinali ( Belén ), Dira Paes ( Manas ) and Nagore Aranburu (Los Domingos). The 13th edition of the Platino Awards Xcaret is presented with support from Quintana Roo, Riviera Maya and Grupo Xcaret. Additional support comes from UN Tourism, the Ibero-American Film Academies and Institutes, WAWA and ICAA with sponsors AIE, Hertz, CREA SGR, L’Oréal, Mrs Greenfilm, Telemundo, Universo, TNT and HBO Max. For the full list of nominees, click here . THR",0,2026-03-21 09:39:56
12,https://deadline.com/2026/03/starz-layoffs-post-separation-lionsgate-1236761926/,Starz Lays Off 7% Of Staff 10 Months After Separation From Lionsgate,Deadline,2026-03-20T22:44:43,2192,"Skip to main content By Nellie Andreeva Nellie Andreeva Editor-In-Chief @DeadlineNellie More Stories By Nellie HBO’s Comedy ‘Comeback’: Amy Gravitt On Being First To Satirize AI With Valerie Cherish’s Return, “Full Slate”, ‘Big Bang’ Spinoff & More Larry David Starz Lays Off 7% Of Staff 10 Months After Separation From Lionsgate Jake Borelli Returns To ‘Grey’s Anatomy’ As Director View All March 20, 2026 3:44pm Getty EXCLUSIVE : In Starz ‘s Q4 earnings report in February, the company called 2026 a “positive financial inflection point,” saying it would focus on profitability and generating positive free cash flow after its separation from Lionsgate . In addition to OTT subscriber growth and increasing content ownership, cost-reduction inevitably is part of the equation. That includes staff cuts. Starz underwent a round of layoffs Friday that impacted 7% of the company’s employees, Deadline has learned. The move, which is believed to involve a reorg, comes 10 months after newly public Starz, run by President and CEO Jeff Hirsch , separated from Lionsgate . Watch on Deadline Related Stories Culture List Of Hollywood & Media Layoffs From Paramount To Warner Bros Discovery To CNN & More News Lionsgate Layoffs Will Trim Overall Staff By 50; Read Company’s Internal Memo As reported in February, Starz reached 17.6 million total U.S. subscribers as of Q4 2025, a gain of 170,000, driven by 12.7 million OTT subscribers. The company reported a Q4 net loss of $20.7 million, narrowing its losses post-separation from Lionsgate . “2025 was a very successful year, one in which we exceeded all of our financial guidance,” Hirsch said on the earnings call. “It’s a feat we’re especially proud of amidst the pressures you see happening across the industry.” Starz previously laid off 10% of the company staf f in 2023 in preparation for the separation from Lionsgate. ‘Project Hail Mary’ $71M+ U.S. Bow Sets Amazon Record; Best Of ’26 HBO Comedy Boss On Being First To Spoof AI With ‘The Comeback’, Larry David & More Warner Bros Lands AI-Themed ‘Playground’ For Timothée Chalamet & Plan B Starz Lays Off 7% Of Staff 10 Months After Separation From Lionsgate Read More About: 2 Comments",0,2026-03-21 09:39:33
33,https://www.hollywoodreporter.com/movies/movie-news/timothee-chalamet-marty-supreme-streaming-release-hbo-max-1236542899/,Timothée Chalamet’s ‘Marty Supreme’ Sets Streaming Debut,Hollywood Reporter,2026-03-20T22:41:47,1928,"× Skip to main content By Ryan Gajewski Plus Icon Ryan Gajewski Senior Entertainment Reporter View All March 20, 2026 3:41pm Timothée Chalamet in 'Marty Supreme.' A24/Courtesy Everett Collection After its much-discussed awards season , Timothée Chalamet ‘s A24 feature Marty Supreme is spinning toward its streaming release. HBO Max announced Friday that director Josh Safdie ‘s acclaimed sports drama is set to begin streaming April 24 on the platform. Marty Supreme hit theaters Dec. 25 and stars Chalamet, Gwyneth Paltrow , Odessa A’zion, Kevin O’Leary, Tyler Okonma (aka Tyler, the Creator), Abel Ferrara, Fran Drescher , Luke Manley and Koto Kawaguchi. Marty Supreme centers on Marty Mauser (Chalamet), an ambitious table tennis player in New York City during the 1950s who is willing to do whatever it takes to become a world champion. Related Stories Movies 'Bloodsport' Reimagining in the Works from Michaela Coel, A24 Movies It's Time for a Chalamet Break Safdie helmed the film from a script he co-wrote with Ronald Bronstein. Chalamet, Safdie, Bronstein, Eli Bush and Anthony Katagas served as producers. Among the movie’s nine Academy Award nominations were nods for best picture, best actor for Chalamet, best director for Safdie and best screenplay for Safdie and Bronstein. Chalamet earned a Golden Globe Award for his lead performance, but the film came up empty-handed at Sunday’s Oscar ceremony. Some of Chalamet’s comments throughout the awards campaign were heavily scrutinized. This included the star saying last month that he would not want to be involved with an art form that “no one cares about” and citing ballet and opera as examples. The remarks were referenced at multiple points throughout the Oscar telecast. In his review of Marty Supreme for The Hollywood Reporter , chief film critic David Rooney wrote that, “as a kinetic portrait of a life in perpetual motion, Marty Supreme is a wonder.” THR",0,2026-03-21 09:39:57
34,https://www.hollywoodreporter.com/business/business-news/schiff-production-town-hall-burbank-1236542924/,The U.S. Has Been Losing Movie and TV Production for Years. Where Have Lawmakers Been?,Hollywood Reporter,2026-03-20T22:41:33,3697,"× Skip to main content By Winston Cho Plus Icon Winston Cho View All March 20, 2026 3:41pm Adam Schiff Getty A few numbers to consider when thinking about the current state of Hollywood: Nearly half of all film and scripted series shot outside the United States last year; Los Angeles County lost more than 42,000 entertainment jobs from 2022 to 2024; and Paramount Skydance and Warner Bros. Discovery made just 15 theatrical movies combined that filmed in the country over the last two years. The narrative that the U.S. is losing its grip as the production capital of the world took centerstage at a hearing on Friday in Burbank City Hall convened by Sen. Adam Schiff, who’s looking to build support for a federal tax incentive to bring jobs back stateside. “The urgency cannot be greater,” he said, before proceeding to call out “unprecedented consolidation” in Hollywood as Paramount Skydance looks to acquire Warner Bros. Related Stories Business Hollywood Spending in Illinois Rises as State Aims for More TV and Movie Projects Business Disney, Warner Bros. Discovery Both Nab $125M+ in California Tax Credits While the hearing was representative of the many issues plaguing the entertainment industry and Los Angeles-based film community, it also highlighted the lack of clarity and urgency by the federal government, state and city in how to address them. For years, observers have been ringing alarm bells of consolidation in Hollywood and the flight of productions to other countries for more generous filming subsidies. Workers in the industry, particularly those in L.A., are now paying the price. “We’re always reacting,” said Rep. Lou Correa. “We’re not ahead of curve here. It’s going to hurt us.” Up first, The Pitt star and executive producer Noah Wyle talked up the significance of instituting a federal tax incentive scheme. His show is “proof of concept,” he said, that productions will return to the U.S. if more subsidies are offered. “It is vital to the strength of the industry and city to support these incentives,” Wyle added. “It’s an investment in the city’s most precious commodity and asset. it’s an investment in its people.” A closer look at The Pitt ‘s financials: With a 20 percent tax credit from California, the show got a rebate of roughly $760,000 per episode. That lowered its total first season spend from roughly $100 million to $88 million, a difference of the cost of roughly two episodes. To some, film incentives are seen as an engine for jobs creation. When a production comes to town, it’s not just the crew members, hair stylists and electricians on the set that are hired. Money trickles down to workers from caterers to carpenters to dry cleaners. IATSE has long advocated for a federal film and TV tax credit. While state subsidies are helpful, president Matt Loeb said, they’re not enough. “Without a comprehensive federal policy response, the U.S. risks turning its back on a signature American industry,” he added. Since 2022, employment for below-the-line workers is down 45 million hours, according to the union. Over the same period, the U.S.’s share of global production dropped from 52 percent to 38 percent. Most major studio tentpoles — the kind that bring bucks — now shoot in the U.K. One question that’s emerged since Paramount’s proposed deal to acquire Warner Bros. is where it will shoot the 30 movies per year the studios committed to producing. It likely won’t be in the U.S. without a federal subsidy, according to Loeb. “A commitment to 30 pictures doesn’t mean anything unless they’re done here,” he said. Still, he observed that it’s not too late, explaining that “they moved that fast and they can come back that fast.” THR",0,2026-03-21 09:39:58
23,https://variety.com/2026/film/news/row-k-crisis-money-trouble-madue-apatow-movie-1236694347/,Crisis at Row K: New Indie Film Distributor’s Money Problems Put Reputations and Maude Apatow’s Directorial Debut in Jeopardy (EXCLUSIVE),Variety,2026-03-20T22:41:09,9774,"Mar 20, 2026 3:41pm PT Crisis at Row K: New Indie Film Distributor’s Money Problems Put Reputations and Maude Apatow’s Directorial Debut in Jeopardy (EXCLUSIVE) By Matt Donnelly Plus Icon Matt Donnelly Chief Correspondent @MattDonnelly Latest ‘Baywatch’ Adds Nadia Gray to Recurring Cast 10 hours ago Crisis at Row K: New Indie Film Distributor’s Money Problems Put Reputations and Maude Apatow’s Directorial Debut in Jeopardy (EXCLUSIVE) 10 hours ago North Road Company Launches North Road Films; Kori Adelson Named President (EXCLUSIVE) 16 hours ago See All Less than eight months after it launched, Row K Entertainment , a new Hollywood distribution label, is being beset with unpaid bills and concerns about its finances. Eight sources from outside the company and within told Variety that cash flow has been an increasingly urgent issue at Row K since its inception last summer. Vendors and consultants haven’t been paid for months, six of the sources say, resulting in work stoppages and legal threats. Related Stories ITV Boss Rejects Concerns About Super-Sized Banijay-All3Media, Says Company is Still 'Actively Engaged' in Talks With Sky ITV Reports $4.6 Billion Revenue for 2025 as Sky Sale Talks Continue After a splashy debut at the 2025 Toronto International Film Festival, where the company acquired four movies, Row K’s slate looks imperiled. One of the films that Row K picked up during TIFF, Maude Apatow’s directorial debut “Poetic License,” has been pushed from a planned May release to September, insiders say. The decision has baffled Apatow’s team and inner circle. This includes the film’s producer (her father, Judd Apatow) and the film’s star (her mother, Leslie Mann). The film earned glowing reviews when it debuted at TIFF and screened at SXSW. Had it not moved, Maude Apatow would have released the film at the same time she will star in the anticipated third season of “Euphoria.” Popular on Variety Other titles on the slate include January’s “Dead Man’s Wire” from Gus Van Sant and the romantic indie “Charlie Harper.” At the center of the storm sit Row K founders Christopher Woodrow and Raj Singh. The former is a producer with prolific credits (Alejandro González Iñárritu’s Oscar winning “Birdman”), who was caught up in a contentious 2014 lawsuit with backers from his former company Worldview Entertainment. That suit claimed Woodrow embezzled and mismanaged funds. In 2018, Woodrow and Worldview walked away from litigation with neither party admitting liability. Singh has a smaller profile in the business, though he formerly served as CEO of comedy shop National Lampoon. “Row K’s release of ‘Dead Man’s Wire’ has provided an important opportunity to evaluate and refine our strategy as a new entrant building in a highly competitive marketplace. Like many early-stage companies, we moved quickly to establish a slate and are now taking a more measured, disciplined approach – prioritizing commercially viable titles, strengthening our internal infrastructure, and aligning our team accordingly,” Woodrow and Singh told Variety in a statement. The pair operates through the holdings company Media Capital Technologies, which first caught industry attention as a co-financier of Lionsgate’s film slate in 2024. Their Row K pitch was undeniably sexy: a nimble acquisitions and distribution label for smaller and mid-budget films with commercial appeal. The indie sector is desperate for more buyers given the amount of media consolidation that has taken place in recent years. The creative team at Row K, led by IMAX and Paramount Pictures vet Megan Colligan , are living a professional “nightmare,” according to one source with close knowledge of the company. Phones ring constantly with demands for payment from scores of outside vendors – music rights owners to audio visual teams – as Woodrow and Singh have consistently kicked the can down the road. “The money is coming” is a constant refrain inside the sleek Sunset Blvd. offices of Row K, multiple sources said. The cash issue is confusing to many, as Media Capital Technologies has touted backing from MassMutual, a sizeable insurance and financial services company. But sources say that MCT’s relationship with MassMutual isn’t that of an equity investor. Instead, it acts as a credit facility for the company. Another insider familiar with Media Capital Technologies said MassMutual’s investment in Row K is layered and includes operating capital. MassMutual could not be reached for comment. “As is standard in our industry, certain payments are scheduled in alignment with incoming receivables as part of prudent working capital management, and we remain in active communication with our partners to ensure all obligations are met in a timely fashion. Row K is well-capitalized, continues to support its existing projects, and is focused on long-term, sustainable growth with a clear emphasis on commerciality,” Woodrow and Singh added. CAA helped build Row K. The agency’s media finance group provides a pipeline of talent and movies for sale to the wider industry. While there’s a perception that CAA has a stake in its business, an agency insider said CAA serves only as an advisor. Wealthy media investor Michael Lambert also has an advisory role. The former domestic TV president at 20 th Century Fox amounts to little more than an elder statesman who keeps an office and occasionally drops into meetings, per sources. CAA had no comment on the matter. While Colligan and top lieutenants continue to report to work, the relationship between the creative execs and Woodrow and Singh is distressed. It’s unclear how long they will remain with the company. Not only are the creatives humiliated to leave important consultants unpaid, the team has also watched anxiously as Woodrow and Singh have openly expressed doubts about the viability of the movies they purchased at TIFF, per numerous sources. Another Row K insider said Woodrow and Singh still have faith in their team. Variety has learned that three top Row K employees — Colligan, Chief Revenue Officer Mo Rhim and Chief Marketing Officer Ben Carlson — have retained attorney Bryan Freedman to address their concerns about ongoing financial and practical issues at Row K. The company’s first release was “Dead Man’s Wire,” which carried a mid-seven-figure price tag and grossed just $2.5 million in the U.S. earlier this year. An insider at Row K admitted that the founders “learned a great deal” from the release, which will represent millions in losses. The company only hired a financial controller for Row K in the weeks before “Dead Man’s Wire” hit theaters. “Poetic License” was set for the top of this summer, though sources said the decision to push it was made at the behest of Woodrow and Singh, who doubted the film’s earning potential. Another source said Maude Apatow delivered the final cut of her film to Row K at the end of February and has yet to receive payment (violating the sale contract, the source added, as funds are due within 10 days of receiving the print). Other sources said that Row K has not “accepted delivery” of the Apatow movie, which suggests the company may not have the funds available to fulfill the contract. Woodrow and Singh’s real reason for pushing the date, two of the sources believe, was to force Team Apatow to walk. Stakeholders in the project are distressed, as there’s no indication the film won’t be a commercial success between positive reviews and the profile of the Apatow family. One Row K insider said Apatow’s team originally desired a late 2026 release and were convinced otherwise. A different source close to the film said this was blatantly false, and that the film is a “love letter” to Mann and was always intended for a Mother’s Day rollout. The date change threw promotional plans into chaos, another source added. A promotional college tour featuring Maude Apatow was scrapped. Long-lead press like magazine covers have already been booked. “Poetic License” was snapped up by Row K in a competitive auction, and sources suspect that talks with the other interested TIFF buyers will resume in the coming days. Reps for Maude Apatow had no comment. WME, the agency representing the Apatow family and the sales agent on “Poetic License,” also declined to comment. Woodrow and Singh are said to have greater faith in “Cliffhanger,” a reboot of the Sylvester Stallone film starring Lily James and Pierce Bronson, set for August. Two insiders familiar with that deal said that, despite press releases announcing the acquisition, Row K never formally closed the transaction with CAA. This leaves the film open for a new buyer in the event that Row K’s troubles continue. The fourth film set up at Row K, Emilia Jones and Nick Robinson’s “Charlie Harper,” will move forward with release per one source. Row K still intends to attend next month’s CinemaCon, the annual convention of movie theater owners, and to touch down at the Cannes Film Festival in May as an active buyer. This week Row K made it clear that it is still looking for projects to distribute, announcing that it had bought “Mister,” an action-comedy with Walton Goggins and Chloe Grace Moretz. “This film exemplifies the kind of star-driven, big-screen entertainment we’re building Row K around,” Woodrow and Singh upon the acquisition, adding, “and it’s a powerful addition to our growing slate.” North American Rights for ‘Broken Voices’ Acquired by Sumerian (EXCLUSIVE) Loading comments... More From Our Brands Rolling Stone BTS Nails Its Comeback With ‘Arirang’ Robb Report Inside a Historic N.Y.C. Townhouse Where Painter Mark Rothko Once Lived Sportico WNBA Releases CBA Term Sheet With Top Salaries Above $1M, Rev Sharing WWD ITS Contest Names All 10 Finalists Winners for 2026",0,2026-03-21 09:39:46
