id,url,title,source,publication_date,text_length,full_text,is_duplicate,created_at
14,https://variety.com/2026/film/global/italy-highest-grossing-movie-buen-camino-spanish-remake-1236721036/,"‘Buen Camino,’ Italy’s Highest-Grossing Movie of All Time, Set for Spanish Remake (EXCLUSIVE)",Variety,2026-04-14T10:17:25,5758,"Apr 14, 2026 3:17am PT ‘Buen Camino,’ Italy’s Highest-Grossing Movie of All Time, Set for Spanish Remake (EXCLUSIVE) Piperplay is also in advanced talks to sell ""Buen Camino"" remake rights to France and Germany By Nick Vivarelli Plus Icon Nick Vivarelli International Correspondent @NickVivarelli Latest Wes Anderson to Receive Fellini Award in Italian Maestro’s Hometown of Rimini 19 hours ago Luca Guadagnino Defends Timothée Chalamet After Ballet and Opera Controversy: I ‘Don’t Understand How One Comment Can Become a Planetary Polemic’ 1 day ago ‘All the Evil in the World’ Doc, About Murder of Leftist Italian Student in Egypt, Sparks Political Storm After Being Denied Government Funding 4 days ago See All Courtesy Filmitalia Spain’s AF Films has acquired Spanish remake rights to “ Buen Camino ,” the Italian comedy that recently became the country’s all-time highest-grossing film by scoring a whopping more than $82 million local box office haul. The “Buen Camino” adaptation agreement between AF Films and Italian sales company Piperplay is the first remake deal to be announced since the comedy – starring local comedy sensation Checco Zalone as a rich and debauched father who zips around in a red Ferrari searching for his runaway daughter along Spain’s famous Camino de Santiago spiritual pilgrimage –became an Italian box office sensation that generated buzz elsewhere in the world. Related Stories Ruby Modine and Richard Harmon to Star in Boman Modine's Horror-Thriller 'A Most Delightful Game' for Lazy Sunday and 10/09 Films (EXCLUSIVE) The protagonist, Checco, is forced to leave his gilded life behind to search for Cristal, his missing teenage daughter. “He thus finds himself, against his will, on the Camino de Santiago, amid hardship, blisters, clashes, and revelations. But this unexpected journey will become the only chance for father and daughter to truly get to know each other,” as the official synopsis puts it Popular on Variety Piperplay is also in advanced talks to sell “Buen Camino” remake rights to France and Germany. “Buen Camino,” which is produced by Italy’s Vuelta-owned Indiana Production , launched in Italy via Medusa distribution on Dec. 25 and went on to dominate the Italian market, holding the box office spot for the following five weeks, drawing more than 9 million Italians. More significantly, the film surpassed Zalone’s previously held records for a local title, the last of which was with 2016’s “Quo Vado,” about a Southern Italian slacker hellbent on holding on to his parasitic government job even when he is transferred to the North Pole. Due to its more universal storyline “Buen Camino” can make for more congenial remake material than Zalone’s previous pictures, possibly proving that local comedies can travel. “We are now in exactly the same position that were were in with “Quo Vado” 10 years ago. The world outside Italy is astonished at our box office haul and wondering, “How did these guys pull it off?,” Buen Camino director Gennaro Nunziante said in an interview with Variety . “But this time we’ve taken it to the next level, and not just in terms of box office. This film has much more international appeal compared with “Quo Vado,” he noted. “Buen Camino proved that a story about a father, a daughter, and a road can become a box office phenomenon with no franchise behind it. That’s exactly why it travels,” said Indiana partner Daniel Campos Pavoncelli in a statement. “We’re very honored that this idea from Gennaro Nunziante and Luca Medici (aka Checco Zalone) is drawing such a broad appeal,” he added. “The Spanish-language remake is the logical next step: the Camino de Santiago is Spanish territory, Spanish culture, and a potential audience that already knows the geography. We are very proud to have AF Films do this remake,” Campos Pavoncelli went on to point out. Commented AF chief Frank Aziza: “At AF Films, we feel deeply connected to ‘Buen Camino’ because it is a story that, through humor, speaks to something essential: human relationships and second chances.” “We are drawn to projects like this one, which have the ability to make audiences laugh and feel at the same time, while inviting them to see themselves reflected in the characters.” AF Films, which operates between Europe and the U.S., is known for developing high-end feature films and prestige TV projects through strategic studio alliances and cross-border financing models. Recent projects in which AF have been involved include Sundance standout “Sorry, Baby”; thriller “Above and Below,” toplining Antonio Banderas; action movie “Hammer Down,” that they are developing with “Oppenheimer” producer Charles Roven; and HBO Max series “Mariachis.” Chalamet or Jordan? Oscars Betting Becoming a $100 Million-Plus Business With Kalshi and Polymarket Nine Variety Actors on Actors, Cover, Awards Circuit Podcast and Inside the Frame Winners at Oscars 2026 IFF Panama Closing Night Film ‘Milly, Queen of Merengue,’ About the Four-Time Latin Grammy Winner, Spins a Tale of Grit and Heart The Actor Awards Set Dates for 2027 and 2028 Ceremonies on Netflix Billy Crystal Delivers Emotional Rob Reiner Tribute at Oscars and Is Joined by Meg Ryan, Kathy Bates, Demi Moore, Jerry O’Connell and More: ‘What Fun We Had’ ‘Mr. Nobody Against Putin’s’ ‘Insane’ Oscars: Artificial Rainbows, Toilet Interviews and Speaking Truth to Trump’s Government Loading comments... More From Our Brands Rolling Stone Billy Idol on Hall of Fame Induction: ‘You Couldn’t Have Dreamed It Better’ Robb Report Why the Final Round of the Masters Could Be as Thrilling as Last Year’s Tournament Sportico TPG Agrees to Buy Learfield in Deal Worth Roughly $2 Billion WWD EXCLUSIVE: Balenciaga Highlights Basque Ties Via New Art Series",0,2026-04-14 10:21:04
15,https://variety.com/2026/film/global/cannes-directors-fortnight-lineup-2026-barry-keoghan-1236721069/,"Cannes’ Directors’ Fortnight Lineup: ‘Butterfly Jam’ Starring Barry Keoghan and Riley Keough, Radu Jude’s Next Film and More",Variety,2026-04-14T10:09:56,5225,"Apr 14, 2026 3:09am PT Cannes’ Directors’ Fortnight Lineup: ‘Butterfly Jam’ Starring Barry Keoghan and Riley Keough, Radu Jude’s Next Film and More By Alex Ritman Plus Icon Alex Ritman @alexritman Latest Thaddea Graham, Amber Grappy and Laura Marcus to Star in Rosie Brear’s Debut Short ‘Bloodsuckers’ (EXCLUSIVE) 1 hour ago Angel Studios Unveils Revolutionary War Action-Musical ‘Drummer Boy’ From Grammy-Winning Christian Pop Group For King and Country (EXCLUSIVE) 14 hours ago Jordan Firstman’s Buzzy Cannes Debut ‘Club Kid’ Boarded by UTA Independent Film Group and Charades, Unveils First Look (EXCLUSIVE) 20 hours ago See All Getty Directors ‘ Fortnight, the independent sidebar competition that runs alongside the Cannes Film Festival, is adding a splash of star power to its 58th edition, alongside some major filmmaking names from the world of independent cinema. Heading a typically eclectic lineup, the 2026 event is opening with “Butterly Fly,” the English-language debut from Kantemir Balagov, the Russian director behind the acclaimed 2019 drama “Beanpole.” The film, set in a tight-knit U.S. community of Circassian immigrants, stars Barry Keoghan , Riley Keough , Harry Melling and Monica Bellucci. Related Stories Ruby Modine and Richard Harmon to Star in Boman Modine's Horror-Thriller 'A Most Delightful Game' for Lazy Sunday and 10/09 Films (EXCLUSIVE) Elsewhere, Romanian auteur Radu Jude returns with a quick-fire following up to last year’s “Dracula” with his adaptation of Octave Mirbeau’s “The Diary of a Chambermaid,” starring Ana Dumitrascu, Vincent Macaigne and Mélanie Thierry. Popular on Variety From the U.S., Reed Van Dyk brings his debut feature “Atonement,” starring Kenneth Branagh, Hiam Abbass, and Boyd Holbrook. Set during the early days of the Iraq War and inspired by real events, the film follows a U.S. marine’s attempts to reconcile with the survivor of a firefight that devastated an Iraqi family. Thanks to Directors’ Fortnight, Clio Barnard becomes the solitary British filmmaker in the Cannes lineup. The celebrated indie director returns to the competition for a third time with “I See Buildings Fall Like Lighting.” Adapted by Enda Walsh from Keiran Goddard’s novel, the film — about five friends who grew up on a council estate — is led by an ensemble of fast-rising talent, including Anthony Boyle, Joe Cole, Jay Lycurgo, Daryl McCormack and Lola Petticrew. From Argentina, Lisandro Alonso returns to Cannes once again with “Double Freedom,” which comes almost quarter of a century after his debut feature, “La Libertad” premiered in Un Certain Regard and set a benchmark for so-called slow cinema. South Korean writer-director July Jung returns to the Croisette with “Dora.” The film, starring Sakura Ando and Kim Doyeon, centers on a young woman whose physical and emotional illness begins to lift when she falls in love. One of the more consistent Korean presences at Cannes, Jung’s debut “A Girl at My Door” screened in Un Certain Regard in 2014, while “Next Sohee” closed Critics’ Week in 2022. Of three animated features in the lineup of features, “La Vertige” closes this year’s Directors’ Fortnight, while also marking the second film debuting on the Croisette from Quentin Dupieux, whose absurdist comedy “Full Phil” — starring Woody Harrelson and Kristen Stewart — is in the Midnight Screening section. The film was shot entirely in 3D using motion-capture. See the Directors’ Fortnight 2026 feature selection below. “Butterfly Jam,” Kantemir Balagov — opening film “Once Upon a Time in Harlem,” William Greaves & David Greaves “Femme De Chambre” (“The Diary of a Chambermaid”), Radu Jude “Dora,” July Jung “Gabin,” Maxence Voiseux “Clarissa,” Arie Esiri and Chuko Esiri “L’espèce Explosive” (“Too Many Beasts”), Sarah Arnold “Low Expectations,” Eivind Landsvik “Double Freedom,” Lisandro Alonso “We Are Aliens,” Kohei Kadowaki “Merci D’être Venu” (“Thanks for Coming”), Alain Cavalier – Documentaire “I See Buildings Fall Like Lighting,” Clio Barnard “Atonement,” Reed Van Dyk “Shana” De Lila Pinell “Death Has No Master,” Jorge Thielen Armand “Carmen, L’oiseau Rebelle,” Sébastien Laudenbach “9 Temples to Heaven,” Sompot Chidgasornpongse “Le Vertige,” Quentin Dupieux — closing film James Ransone’s ‘Sinister’ and ‘Black Phone’ Director Says the ‘Oscars In Memoriam Ignored Him but I Cannot’ After Late Actor Excluded: ‘He Is Dearly Missed’ Oscars In Memoriam Excludes James Van Der Beek, Eric Dane, Brigitte Bardot, Malcolm-Jamal Warner and More The Actor Awards Set Dates for 2027 and 2028 Ceremonies on Netflix Oscars 2027 and 2028 Set March Ceremony Dates ‘Bridesmaids’ Reunion: Kristen Wiig, Melissa McCarthy and Co. Make Oscars Laugh by Reading Fake Notes From Nominees Kid Rock Says Conan O’Brien’s Oscars Diss Mocking Turning Point USA’s Super Bowl Halftime Show Was ‘Not a Very Good’ Joke Loading comments... More From Our Brands Rolling Stone Billy Idol on Hall of Fame Induction: ‘You Couldn’t Have Dreamed It Better’ Robb Report Why the Final Round of the Masters Could Be as Thrilling as Last Year’s Tournament Sportico TPG Agrees to Buy Learfield in Deal Worth Roughly $2 Billion WWD EXCLUSIVE: Balenciaga Highlights Basque Ties Via New Art Series",0,2026-04-14 10:21:05
1,https://deadline.com/2026/04/cannes-directors-fortnight-unveils-2026-lineup-1236860043/,"Cannes Directors’ Fortnight Unveils Starry 2026 Lineup With Films By Kantemir Balagov; Clio Bernard; Esiri Brothers, Radu Jude, Reed Van Dyk & Quentin Dupieux",Deadline,2026-04-14T10:06:27,6935,"Skip to main content By Melanie Goodfellow Melanie Goodfellow Senior International Film Correspondent @mel_goodfellow More Stories By Melanie Paradise City Sales Boards Yemen-Set Cannes Critics’ Week Title ‘The Station’ Cannes Critics’ Week Unveils 2026 Lineup: Will Sharpe & Stephanie Hsu-Voiced Animation ‘In Waves’ To Open Parallel Section Hungary Elections: Péter Magyar Wins As Trump Favorite Viktor Orbán Concedes Defeat View All April 14, 2026 3:06am Butterfly Jam AR Content, Why Not Productions, Goodfellas Kantemir Balagov ’s New Jersey-set drama Butterfly Jam , starring Barry Keoghan and Riley Keough, will open the 58th edition of Cannes Directors’ Fortnight. It is among 19 features, selected from 1,800 submissions, and nine short and medium-length works announced on Tuesday by the parallel section for its 2026 edition running from May 13 to 23, alongside the Cannes Film Festival. Butterfly Jam revolves around a teenager from growing up in New Jersey’s Circassian community, with dreams of becoming a wrestler, whose life takes an unexpected turn when one of his father’s misguided schemes goes wrong. Related Stories News Cannes Parallel Section ACID Unveils 2026 Lineup News Cannes Critics' Week Unveils 2026 Lineup: Will Sharpe & Stephanie Hsu-Voiced Animation 'In Waves' To Open Parallel Section It is exiled Russian director Balagov’s first English-language feature after his 2019 Cannes breakout Beanpole . Watch on Deadline It is produced by Alexander Rodnyansky’s AR Content, Pascal Caucheteux’s Why Not Productions ( Emilia Pérez ) and Goodfellas, which is also handling sales. Artistic Director Julien Rejl, and his team have delivered one of the most high-profile and starriest Directors’ Fortnight selections since he took first took the helm for the 2023 edition. Aside from Butterfly Jam , with Keoghan and Keough, the lineup also features Reed Van Dyk’s Iraqi war veteran drama Atonement , with Kenneth Branagh, Hiam Abbass and Boyd Holbrook; Arie Esiri and Chuko Esiri’s ‘Mrs Dalloway-reimagining Clarissa with Sophie Okonedo, David Oyelowo and Ayo Edebiri, and July Jung’s Dora , starring Japanese actress Sakura Ando ( Shoplifters ) and K-pop star and actress Kim Do-yeon. Shot in 35mm in Nigeria, Clarissa is the second feature from the Esiri brothers after debut Eyimofe (This Is My Desire) , which premiered in Berlin and went on to win five African Movie Academy Awards. Neon acquired U.S. rights to the film earlier this year and is also handling international sales. It one of two Neon prebuys in this year’s selection alongside documentary Once Upon A Time In Harlem , which debuted in Sundance this year. Read Deadline’s deep dive into the film here . Rejl, who marked his early editions with a desire to true discoveries, that had not even been scouted up by development labs, appears to have changed his approach for this edition. A number of established directors have made the cut this year including Clio Barnard’s I See Buildings Fall Like Lightning ; Radu Jude’s The Diary of a Chambermaid ; Alain Cavalier’s Thanks for Coming ( Merci d’être venu ); Lisandro Alonso’s Double Freedom , Quentin Dupieux ‘s Le Vertige and Domingo Sotomayor’s La Perra . Starring Anthony Boyle, Joe Cole, Jay Lycurgo, Daryl McCormack and Lola Petticrew and adapted from the book of the same name by Keiran Goddard, I See Buildings Fall Like Lightning marks Bernard’s third time in Ava & Ali and The Selfish Giant . Cavalier’s Thanks for Coming ( Merci d’être venu) continue his series of works documenting his life and thought on filmmaking as he ages, and could be the last work of the 94-year-old director. Jude’s adaptation of Octave Mirbeau’s classic The Diary of a Chambermaid, starring Ana Dumitrascu alongside Vincent Macaigne and Mélanie Thierry, marks the Romanian director’s first time in Cannes. A late submission, Argentinian director Alonso’s new film is described as a demi-remake of his 2001 breakthrough film Freedom revisiting the protagonist Misael in a different time of Argentina’s history. There is still space for first films in the section, which last year debuted Iraqi drama The President’s Cake , which went on to win the Cannes Caméra d’Or prize, open to all first films playing across the Official Selection and parallel sections, and then made it to the short list in the International Feature Film category 98th Academy Awards as Iraq’s submission. Six first films are in the mix this year including 9 Temples To Heaven by Thai director Sompot Chidgasornpongse, a long-time collaborator of Apichatpong Weerasethakul who previously took assistant director credits on Memoria and Cemetery of Splendour . Other debuts include Atonement , Norwegian director Eivind Landsvik’s Low Expectations , French filmmaker Maxence Voiseux’s documentary Gabin , Swiss-Italian director Sarah Arnold’s Too Many Beasts and Japanese director Kohei Kadowaki’s We Are Aliens . As previously announced, Directors’ Fortnight will fete Claire Denis will be feted with the honorary Golden Carriage (Carrosse d’Or) at the opening ceremony on May 13. Cannes Directors’ Fortnight 2026 Edition Feature Films (*denotes first film and eligibility for Caméra d’Or) Butterfly Jam (opening film) Dir: Kantemir Balagov 9 Temples To Heaven * Dir: Sompot Chidgasornpongse Atonement * Dir: Reed Van Dyk Clarissa Dirs: Arie Esiri & Chuko Esiri Death has no master ( La muerte no tiene dueño ) Dir: Jorge Thielen Armand The Diary of a Chambermaid Dir: Radu Jude Dora Dir: July Jung Double Freedom ( La libertad doble ) Dir: Lisandro Alonso Gabin * – documentary Dir: Maxence Voiseux I See Buildings Fall Like Lightning Dir: Clio Barnard Low Expectations ( Lave Forventninger ) * Dir: Eivind Landsvik Once Upon A Time In Harlem – documentary Dirs: William Greaves & David Greaves La Perra Dir: Domingo Sotomayor Shana Dir. Lila Pinell Thanks for Coming ( Merci d’être venu ) – documentary Dir: Alain Cavalier Too Many Beasts ( l’Espèce Explosive ) * Dir: Sarah Arnold Viva Carmen ( Carmen, L’Oiseau Rebel ) – animation Dir: Sebastian Laundenbach We Are Aliens (animation) * Dir: Kohei Kadowaki Le Vertige – animation (Closing Film) Dir: Quentin Dupieux Short and Medium-Length Films The Joyless Economy – documentary Dir: Marjorie Conrad Oh Boys Dir: Antonio Donato Early Morning Dir. Sebastián Lojo Eri – animation Dir: Yano Honami Pithead Dir: Wannes Vanspauwen & Pol De Plecker The Daughters Of The Late Colonel Dir: Elizabeth Hobbs Nothing Happens After Your Absence Dir: Ibrahim Omar Free Eliza ( Notes On An Anatomical Imperfection ) Dir: Alexandra Matheou In Search of the Green-striped Bird Dir: Saïd Hamich Benlarb BBC Employees Brace For “Ominous” Town Hall About Cuts Nicola Coughlan & Aimee Lou Wood As Next Two Hosts Of British Show Tokyo Film Festival Appoints Hisamatsu Takeo As New Director ‘Spider-Man’ & ‘Spider-Verse’, ‘Insidious’ Trailer, Jumanji’ Title & More From Sony Read More About: Comments",0,2026-04-14 10:20:48
2,https://deadline.com/2026/04/the-brutalist-investor-lip-sync-rebuked-unpaid-tax-bill-1236860006/,"Lip Sync Productions, UK Film Investor That Backed ‘The Brutalist,’ Rebuked For “Deliberate” Failure To Pay $19M Tax Bill",Deadline,2026-04-14T10:05:00,3117,"Skip to main content By Jake Kanter Jake Kanter International Investigations Editor @Jake_Kanter More Stories By Jake Paramount-Warner Bros: UK Competition Watchdog Seeks Views On Deal Ahead Of Formal Probe ‘SNL UK’ Ratings Dive 36% To New Low For Riz Ahmed-Hosted Episode ‘SNL UK’ Takes On ‘The Traitors,’ Mocking Claims Contestants Display Unconscious Racial Bias View All April 14, 2026 3:05am Lipsync handled post on 'The Brutalist' A24 / Courtesy Everett Collection EXCLUSIVE : Lip Sync Productions , the British film and TV investor behind titles including The Brutalist and Viggo Mortensen’s Falling , has been named and shamed by the UK’s tax authorities. HM Revenue & Customs (HMRC) said Lip Sync Productions, a sister company to the collapsed Lipsync post-house , was at the top of its most recently published list of “deliberate tax defaulters.” HMRC revealed that Lip Sync Productions failed to pay a £14.1M ($19M) tax bill between 2019 and 2023, meaning it had been slapped with a penalty of £7M. There is no suggestion that third parties involved in Lip Sync’s film projects were aware of the tax default. Watch on Deadline Related Stories News Cinema Chief Pleads With Directors To Make Shorter Movies: ""You're Making The Film For An Audience"" Casting Adrien Brody Says He Has Not Accepted A Role Since Oscar-Winning Performance In 'The Brutalist' Peter Hampden, the owner and director of Lip Sync Productions, did not respond to a request for comment. Hampden’s co-founder, Norman Merry, died last year after being diagnosed with cancer. An HMRC spokesperson declined to comment on the details of Lip Sync Productions’ unpaid tax bill, but said: “We are committed to tackling those who deliberately default on the tax they owe. By publishing the names of deliberate defaulters and their penalties, we send a clear message that non-compliance has consequences.” Begbies Traynor was appointed as a voluntary liquidator at Lip Sync Productions in January. Hampden continues to serve as a director of the company, as well as related party Glenthorp Limited, which was the parent company of Lipsync Post. Deadline revealed last May that Lipsync Post had collapsed . Ireland’s Playhouse Studios later acquired Lipsync’s assets , saving dozens of jobs in the process. Oury Clark, the administrator appointed to handle Lipsync Post’s demise, said the company had received a “substantial claim” from HMRC, worth more than £17.5M. In a report, Oury Clark said it was assessing the dispute with HMRC “in respect of the VAT treatment of various historic transactions” and “the utilisation of tax relief schemes” by Lipsync Post and third-party clients. Lip Sync Productions was founded in November 2006. It backed projects including We Need To Talk About Kevin , Great Expectations , Nowhere Boy , and Made In Dagenham . BBC Employees Brace For “Ominous” Town Hall About Cuts Nicola Coughlan & Aimee Lou Wood As Next Two Hosts Of British Show Tokyo Film Festival Appoints Hisamatsu Takeo As New Director ‘Spider-Man’ & ‘Spider-Verse’, ‘Insidious’ Trailer, Jumanji’ Title & More From Sony Read More About: Comments",0,2026-04-14 10:20:49
