id,url,title,source,publication_date,text_length,full_text,is_duplicate,created_at
21,https://variety.com/2026/film/global/ventana-sur-goes-to-cannes-new-talent-marche-du-film-1236721033/,"Ventana Sur Goes To Cannes Lineup Includes Second-Chance Comedy, Supernatural Genre and Animated Aztec Action Adventure (EXCLUSIVE)",Variety,2026-04-14T08:46:58,9237,"Apr 14, 2026 1:46am PT Ventana Sur Goes To Cannes Lineup Includes Second-Chance Comedy, Supernatural Genre and Animated Aztec Action Adventure (EXCLUSIVE) Organized by Cannes' Marché du Film and Uruguay’s ACAU agency, the five-title lineup also takes in gender doc ‘The Way You See Me’ and ‘The Grass,’ an intimate take on working-class motherhood By John Hopewell Plus Icon John Hopewell Chief International Correspondent john_hopewell Latest Ventana Sur Goes To Cannes Lineup Includes Second-Chance Comedy, Supernatural Genre and Animated Aztec Action Adventure (EXCLUSIVE) 1 hour ago Festival do Rio Goes to Cannes: New Brazilian Directors, the Horror of Homelessness, Remarkable True Stories (EXCLUSIVE) 4 days ago Neto Villalobos’ Tropical Dystopia Thriller ‘Love Is the Monster,’ With ‘Gloria’ Star Paulina García, Boarded by Mexico’s Liminal Estudio (EXCLUSIVE) 6 days ago See All The Mantises Photo: Adam Schwartz What kind of films are Latin America and Spain’s new generation filmmakers making? One answer will be supplied in May at the Cannes Film Festival which includes a showcase, Marché du Film ’s Ventana Sur Goes to Cannes – Río de la Plata, highlighting five first features. Among them are Uruguay’s buzzy dramedy “When I Existed,” Spain’s supernatural thriller “The Mantises” and “The Mark of the Jaguar,” a Brazil-Mexico animated Aztec action adventure. Related Stories Ruby Modine and Richard Harmon to Star in Boman Modine's Horror-Thriller 'A Most Delightful Game' for Lazy Sunday and 10/09 Films (EXCLUSIVE) The showcase’s five titles, all in post-production, also take in two films that have worked themselves up the ranks at Ventana Sur: “The Grass,” screened at its 2024 Proyecta project showcase, and “The Way You See Me,” which played at the meet-market’s Punto Género in 2022. Popular on Variety Shown in excerpts at Cannes, all five films are now in post-production and bid fair to hit festivals later this year. “When I Existed” weighs in as a buzzy, feel-good second chance drama comedy “This is a story of reinvention built around the things that truly matter,” says producer Federico Cetta at Uruguay’s El Cielo Cine, who produces with David Matamoros at Spain’s Doce Entertainment. A highlight at Locarno’s Spanish Previews last August, “The Mantises,” Didac Gimeno’s supernatural coming of age thriller, drinks deep at the well of Spain’s grand tradition of auteur genre cinema: Think “The Orphanage” and [“REC”]. Animated feature “The Mark of the Jaguar: The Awakening of Fire” delivers an ambitious revisionist view of Latin American history, an “epic fantasy” where “Latin American children and their families will see that the story of our mixed heritage is not as it has been told,” writer-director Victor Mayorga told Variety . “The Grass” is a “poetic realist” film, says director Ivana Galdeano, about single mother Karina raising her children in a humble part of Argüello, Córdoba, Argentina. Winner of a Lacau Colour & Postproduction Prize and the Usheru Audience Award at December’s Ventana Sur, LGBTQ identity doc “The Way You See Me” records the social confrontation sparked by the director’s decision to abandon a female identity. “Ventana Sur Goes to Cannes reveals the strength and diversity of Latin American cinema today. The selection spans fiction, documentary, animation and genre, reflecting the richness of our voices and the role of Ventana Sur as a platform that connects our stories with the world,” said Gisella Previtalli, president of Uruguay’s ACAU film-TV agency. The diversity also mirrors for range of Ventana Sur itself. It began in 2009 highlighting arthouse pics in post-production at its still centerpiece Primer Corte showcase. One, “Leap Year,” picked up by Pyramide, went on to win the 2010 Cannes Festival’s Camera d’Or. In a pioneering move, Ventana Sur also launched a genre platform, Blood Window, and then Animation!, soon the key forum for the medium in Latin America. A doc-feature showcase has followed. ACAU organizes the Cannes Festival showcase with the Marché du Film before both partners team late 2026 with Argentina’s INCAA, on the on-site Ventana Sur – Río de la Plata. It will be hosted by ACAU in Montevideo for the second time after a compact, efficient edition in the Uruguayan capital in 2024. Organized by the Cannes Festival’s Marché du Film, the Goes to Cannes series of seven showcases of works in progress from festivals and markets all over the world is offering two new awards in 2026: the OCS+ Award, with €15,000 ($17.6 million) for the French distributor of a Goes to Cannes project, and the AH Media Production Award of €10,000 ($11,700) in cash. These prizes join the well-known Sideral Cinema Award of a €10,000 minimum guarantee for one of the projects. A closer look at the Ventana Sur Goes to Cannes – Río de la Plata titles: “The Grass,” (Ivana Galdeano, “El Pasto,” Inimaginaria Producciones, Eliana Campos and Brava Cine, Argentina; Los Besos Contenidos Uruguay) Karina, a single mother, lives in a rudimentary cottage in a humble part of Córdoba, Argentina. “The real work of mothers in working class neighborhoods remains largely invisible. In cinema, everything appears magically done,” Galdeano tells Variety. “Through “intimate moments and shared silences,” “The Grass” “seeks to reveal the profound beauty in everyday acts of care: a mother’s early morning walks to school, the patient kneading of bread, the gentle combing of children’s hair,” she adds. ‘The Grass’ “The Mantises,” (“Las Mantis,” Didac Gimeno, Mgc, El Médano, Wild Lemon, DarkStudios in Spain; Motoneta Cine in Argentina) Part of a new wave of fantasy cinema that embraces the visual and the symbolic as its primary narrative language, Gimeno has told Variety . Shot on Super16mm, “The Mantises” turns on Aitana, 14, who, after her mother’s death, spends the summer at her uncle’s house, whose nearby forest and animals are a portal to the afterlife. Produced by Spain’s MGC and Argentina’s Motoneta Cine, it’s a film “about grief, but also daring to explore the occult, the forbidden and the supernatural as a way to heal,” Gimeno notes “The Mark of the Jaguar: The Awakening of Fire,” (“La Marca del Jaguar, El Despertar del Fuego,” Victor Mayorga, Origem Content, Brazil; Ocelotl Company, Mexico) From Origem and Ocelotl, behind Annecy 2021 Contrechamp player “My Uncle Jose,” a fantasy action adventure with drama grounded, however, in archaeological and anthropological record. Set in an Aztec world, young Mexica warrior Xilactzin, accused of stealing sacred bones, crosses to the Mictlan underworld to retrieve them and battle the goddess of darkness, Itzpapalotl. “Strong identity, tenderness and a genuine connection to Latin American culture,” says lead producer Ducca Rios at Origem. ‘The Mark of the Jaguar – The Awakening of Fire’ “The Way You See Me,” (“Como tú me ves,” M Untitled, Barlovento Cine, Mexico, Argentina) Blending documentary and drama, “The Way You See Me” emerges from the director’s “personal experiment grounded in a decision to renounce the expectations imposed on me as a woman,” say helmer M Untitled. “The film turns the gaze back on the viewer, revealing how society polices and perpetuates rigid binary norms that shape who we become and the possibilities to resist them,” M Untitled adds. Sold in international by Paula Portela’s Buenos Aires and Montevideo-based Compañía de Cine. ‘The Way You See Me’ “When I Existed,” (“Cuando yo existía,” Alejandro Damiani, Martin Avdolov, El Cielo Cine, Uruguay, with Doce Entertainment, Spain, and Metropolis Films, Uruguay) Declared dead, Silvio Berlusconi cannot collect his pension, will do anything, caught in bureaucracy, to prove he is alive. Along the way, he reconnects with old friends, the life he left behind and the one he could have had, including his wife and daughter, realizing he doesn’t need a piece of paper to feel alive. Fronted by César Troncoso, star of “The Pope’s Toilet” from Oscar nominee César Charlone and shot in sometimes high-style, its DP is “Society of the Snow” camera operator Manuel Branaa. ‘When I Existed’ – Courtesy of the Marché du Film How to Watch the 2026 Oscars Ceremony Live Online Jimmy Kimmel Slams CBS at the Oscars for Not Supporting Free Speech and Jokes That Trump Is ‘Going to Be Mad’ That ‘Melania’ Isn’t Nominated Sean Penn Receives Mock Oscar in Ukraine After Skipping Academy Awards; Actor’s Trophy Made of Train Metal ‘That Was Damaged by the Russians’ in a Missile Strike Conan O’Brien Starts Oscars by Roasting Timothée Chalamet’s Ballet and Opera Controversy as Camera Cuts to ‘Marty Supreme’ Star Laughing ‘Sinners’ Stars Recreate the ‘Pierce the Veil’ Sequence With Stunning Oscar Performance of ‘I Lied to You’ Norway Cheers Its First Oscar for Best International Feature Film With Joachim Trier’s ‘Sentimental Value’ as ‘Historic Moment’ Loading comments... More From Our Brands Rolling Stone Jack White Questions How Christians Can Support Trump ‘After This Blasphemy’ Robb Report Why the Final Round of the Masters Could Be as Thrilling as Last Year’s Tournament Sportico TPG Agrees to Buy Learfield in Deal Worth Roughly $2 Billion WWD EXCLUSIVE: Balenciaga Highlights Basque Ties Via New Art Series",0,2026-04-14 10:21:11
7,https://deadline.com/2026/04/bbc-adrian-mole-cast-oliver-savell-alan-carr-sue-townsend-1236859128/,BAFTA-Nominated Actor Who Plays A Young Alan Carr In ‘Changing Ends’ Set To Lead BBC’s Adrian Mole Adaptation,Deadline,2026-04-14T08:00:00,3424,"Skip to main content By Max Goldbart Max Goldbart International TV Co-Editor @Goldbart1 More Stories By Max BAFTA-Nominated Actor Who Plays A Young Alan Carr In ‘Changing Ends’ Set To Lead BBC’s Adrian Mole Adaptation ‘Saturday Night Live UK’ Lands Nicola Coughlan & Aimee Lou Wood As Next Two Hosts ‘Saturday Night Live’ Finds New Home In Canada On ‘Heated Rivalry’ Streamer Crave View All April 14, 2026 1:00am 'The Secret Diary of Adrian Mole' BBC Oliver Savell , who has been twice BAFTA nominated for his role as a young Alan Carr in Changing Ends , is leading the BBC ’s adaptation of Sue Townsend ’s The Secret Diary of Adrian Mole . The adaptation, which is being overseen by One Day author David Nicholls with writers including Caitlin Moran, comes nearly 30 years after the previous Townsend drama. First look has just dropped and the show will launch next year. A nationwide search has taken place to find Savell, who will play the lead from the iconic book aboout an awkward teen in Margaret Thatcher-era Britain. The show starts in 1981 as Adrian begins his diary about family life and being a teenager before the advent of mobile phones and social media. With only a ballpoint pen as his guide, Adrian worries about his spots, his parents’ divorce, the torment of first love and the fact he’s never seen a female nipple. Related Stories News BBC Employees Brace For ""Ominous"" Town Hall About Cuts News BBC & MGM+'s 'Legacy Of Spies' Adaptation Finds Its Bill Haydon & Casts 'All Quiet On The Western Front' Star As Hans-Dieter Mundt & Agnes O'Casey In Lead Role Savell is joined by Lisa McGrillis ( Rivals, Mum ), who plays his mother Pauline, and Colin Hoult ( After Life, Slow Horses ), his father George. Pam Ferris ( Matilda, Darling Buds of May ) joins the cast as Grandma, Galaxie Clear ( Extra Geography, Secret Service ) is Pandora and Alun Armstrong ( The Choral, Breeders ) is Bert. Other cast also announced today include Jude Forsey as Nigel, Rory Keenan as Mr Lucas, David Wilmot as Mr Scruton and Karl Collins as Mr Cherry. Watch on Deadline Savell has twice been nominated for his role in ITV’s semi-autobiographical Changing Ends — including at the upcoming BAFTAs — which is about the early life of Carr and stars the Celebrity Traitors winner as himself. The adaptation is being produced by Outlaws maker Big Talk Studios . Overseen by Nicholls, the starry writers room features Caitlin Moran, Caroline Moran, Dillon Mapletoft, Oliver Taylor and Jack Rooke. The Secret Diary of Adrian Mole Aged 13¾ ( 9×30’) is a Big Talk Studios production for BBC iPlayer and BBC One. The series was commissioned by Lindsay Salt, Director of BBC Drama. The director is Alex Winckler ( Somewhere Boy, Mary and George ) and the producer is Charlotte Robinson ( A Thousand Blows ). The executive producers are Kenton Allen and Luke Alkin for Big Talk Studios, and Nicholls and Winckler. The estate of Sue Townsend is represented by Jane Villiers at Sayle Screen. Big Talk is part of ITV Studios . Filming is underway in and around Hartlepool and the series is due to air next year. BBC Employees Brace For “Ominous” Town Hall About Cuts ‘Spider-Man’ & ‘Spider-Verse’, ‘Insidious’ Trailer, Jumanji’ Title & More From Sony ‘The Rookie’ Renewal: How Young Appeal, Lean Production & Tax Credit Fuel Staying Power Rock Hall Of Fame Class Of 2026: Collins, Idol, Vandross, Iron Maiden, More Read More About: Comments",0,2026-04-14 10:20:55
6,https://deadline.com/2026/04/tommyinnit-presenting-youtube-series-100-questions-stephen-fry-1236859054/,Minecraft Supremo TommyInnit Presenting Sony’s Debut Digital Series With Stephen Fry Among First Guests,Deadline,2026-04-14T08:00:00,3463,"Skip to main content By Max Goldbart Max Goldbart International TV Co-Editor @Goldbart1 More Stories By Max BAFTA-Nominated Actor Who Plays A Young Alan Carr In ‘Changing Ends’ Set To Lead BBC’s Adrian Mole Adaptation ‘Saturday Night Live UK’ Lands Nicola Coughlan & Aimee Lou Wood As Next Two Hosts ‘Saturday Night Live’ Finds New Home In Canada On ‘Heated Rivalry’ Streamer Crave View All April 14, 2026 1:00am TommyInnit with Stephen Fry Sony TommyInnit , who runs the most popular Minecraft channel on Twitch, is leading the first series and channel to emerge from Sony ’s new international digital arm with guests including Stephen Fry . 100 Questions with Tom Simons will feature the Minecraft supremo under his real name alongside interviewees as he is given exactly 100 questions to get to know his guests. Once he runs out of the 100, they are gone. Launching next week, TommyInnit’s first tranche of guests include British thespian Fry, who recently competed on Celebrity Traitors alongside creator Niko Omilana , Professor Brian Cox and creators like Stampy, James Marriott and Sweet Anita. Related Stories News 'Jumanji' Stars Reveal Threequel's Title, Debut Trailer - CinemaCon News Aaron Sorkin Offers First Look At Jeremy Strong's ""Professional Defendant"" Mark Zuckerberg In 'The Social Reckoning' Trailer - CinemaCon Sony said 100 Questions is “designed as a repeatable, creator-led series built for digital audiences.” It will also have a dedicated YouTube channel where full eps will be posted. Clips may be posted to other channels including TommyInnit’s personal platforms. Watch on Deadline It comes from Sony Pictures Television International Production ’s nascent digital arm , which is led by ex-BBC Studios executive Matt Ford and former Channel 4 digital boss Sacha Khari. TommyInnit is one of the world’s most popular streamers. He has more than 50 million followers across platforms and surpassed 1 billion YouTube views at just 17. He holds the Guinness World Record for most-followed Minecraft channel on Twitch and has sold out live events. TommyInnit said: “I started out making videos in my room, and over the past few years I’ve been lucky enough to build a career outside of that, writing books, touring and now my own chat show! This feels like a chance to push myself even further out of my comfort zone, having conversations you wouldn’t expect. From asking Stephen Fry about his least favourite word to chatting with Brian Cox about the meaning of life, it’s been an unreal experience so far.” Ford added: “Launching our first digital studio channel with Tom is a big moment for us. He’s one of the most distinctive creators in the market, with a deep understanding of how to connect with large, engaged audiences. This is just the beginning- we’re building a focused slate of original concepts with a select group of creators and leading talent, and see a significant opportunity to develop ideas like this at scale.” TommyInnit is repped by MonRae Management. Earlier this year, Deadline explored how content creators are helping shape the British TV industry behind and infront of the camera. BBC Employees Brace For “Ominous” Town Hall About Cuts ‘Spider-Man’ & ‘Spider-Verse’, ‘Insidious’ Trailer, Jumanji’ Title & More From Sony ‘The Rookie’ Renewal: How Young Appeal, Lean Production & Tax Credit Fuel Staying Power Rock Hall Of Fame Class Of 2026: Collins, Idol, Vandross, Iron Maiden, More Read More About: Comments",0,2026-04-14 10:20:54
5,https://deadline.com/2026/04/locker-room-talk-pearl-mackie-chizzy-akudolu-grace-link-1236858960/,"Pearl Mackie, Kerry Howard & Chizzy Akudolu Among Cast Of Grace Link’s ‘Locker Room Talk’",Deadline,2026-04-14T08:00:00,3355,"Skip to main content By Jesse Whittock Jesse Whittock International TV Co-Editor @WhittockTweets More Stories By Jesse UK Agency YMU Ups Five In Entertainment Division ‘Saturday Night Live’ Finds New Home In Canada On ‘Heated Rivalry’ Streamer Crave Tributes Flood In For Bollywood Music Icon Asha Bhosle: “Her Voice Was A Pillar Of Indian Cinema” View All April 14, 2026 1:00am L-R: Florence Andrews, Chizzy Akudolu, Grace Link, Kerry Howard, Pearl Mackie and Rhianna Merralls YellowBelly, Seamus Ryan, John Phillips/Getty, ByPip, Jacob Backhouse EXCLUSIVE: Pearl Mackie ( Doctor Who , The Diplomat ), Chizzy Akudolu ( Tommy & Tuppence , Holby City ) and Kerry Howard ( Him and Her , Bad Apples ) are among the six actresses making up the cast of Grace Link ‘s indie TV series Locker Room Talk . Link ( Geek Girl , Bulletproof ), Florence Andrews ( House of Gucci , School of Rock ) and Rhianna Merralls ( Plebs ) will round out the lead cast. Locker Room Talk will unfold entirely inside a women’s changing room after a weekly yoga class. Link is the showrunner and creator of the seven-part comedy-drama, whose episodes will run for 10 minutes and drop of YouTube. Each episode will include candid conversations about body image, health, friendship and the contradictions of modern womanhood. Related Stories News 'Sorry, I Didn't Know' Renewed For Season 6 At ITV News Minecraft Supremo TommyInnit Presenting Sony's Debut Digital Series With First Guest Stephen Fry Link and Chloe Luo from Bag Lady Films and Amanda Boyle are the executive producers, and production is slated to begin in London ahead of a May release. Boyle is also directing. Watch on Deadline Partnering with the series are women’s health and wellbeing charities The Pachamama Project and BRC Chat, which producers say reflects “commitment to amplifying conversations around women’s bodies, healthcare and lived experience.” Molton Brown is a sponsor. “This ensemble has the wit and raw magnetism of women I’d love to find myself sitting next to on a moist wooden bench at 7am,” said Link. “Amanda and I couldn’t have wished for a more big-hearted, full-blooded, firecracker of a cast. The chemistry between them was instant and electric; they dive into the topics we too often whisper about with wonder, mischief and a conspiratorial glee.” “We always knew this show would live or die on the cast,” added Boyle. “You need characters you’d actually want to addictively be stuck in a changing room with, and actors who are funny right down to their bones but can still break your heart. “Pearl, Chizzy, Grace, Flo and Kerry bring all of that, each in completely different ways. Together they’ve got this chaotic, loveable, slightly feral energy, and watching them rip into Grace’s scripts is a total riot.” Mackie is represented by United Agents and Curate, Akudolu is repped InterTalent, Howard is represented by Curtis Brown, Andrews by Grantham Hazeldine, Link is repped by Independent Talent and Boyle is represented by Casarotto Ramsay & Associates. BBC Employees Brace For “Ominous” Town Hall About Cuts ‘Spider-Man’ & ‘Spider-Verse’, ‘Insidious’ Trailer, Jumanji’ Title & More From Sony ‘The Rookie’ Renewal: How Young Appeal, Lean Production & Tax Credit Fuel Staying Power Rock Hall Of Fame Class Of 2026: Collins, Idol, Vandross, Iron Maiden, More Read More About: Comments",0,2026-04-14 10:20:53
27,https://www.hollywoodreporter.com/tv/tv-news/saturday-night-live-uk-hosts-musical-guests-1236558578/,"‘Saturday Night Live UK’ Season 1: Nicola Coughlan, Aimee Lou Wood Tapped to Host",Hollywood Reporter,2026-04-14T07:38:00,2521,"Skip to main content By Lily Ford Plus Icon Lily Ford @lilyfordtweets Follow Sign Up View All April 14, 2026 12:38am Coughlan, Wood will host weeks 5 & 6 of 'SNL UK.' Courtesy of Getty Logo text Saturday Night Live UK is officially midway through its first season. The show kicked off on March 21 with inaugural host and SNL hall-of-famer Tina Fey, who shepherded the relatively unknown cast of British social media stars and stand-up comedians to a solid start. The Hollywood Reporter ‘s review determined : “Good cast, spotty writing — like the mothership,” about the London spin-off of Lorne Michaels’ long-running NBC sketch show. That first episode on Sky (available on Peacock in the U.S.) was watched by over 220,000 people in Britain. With musical guest Wet Leg, the opener’s sketches were wide-ranging and made use of the U.K.’s over-performing rolodex of talent. Related Stories Movies Cannes Critics' Week Lineup: Animated Feature 'In Waves' to Open Fest Sidebar Movies In '52 Blue,' an Indian Man Goes on a Journey to Meet His Idol, Lionel Messi (Exclusive Trailer) Taking over from Fey on March 28 was Fifty Shades of Grey star Jamie Dornan, supported by rock group Wolf Alice. He passed the hosting baton to Riz Ahmed, promoting his new Amazon series Bait , alongside Kasabian on April 3, and on April 11, British comedian Jack Whitehall hosted with musical guest Jorja Smith. Those in the U.S. might recognize Whitehall as the emcee for the F1 75 Live event last year. Bridgerton star Nicola Coughlan is set to host the next show after a brief hiatus on April 25, with the Foo Fighters as her musical guest. She’ll be promoting season two of her Channel 4 dramedy Big Mood . Then, White Lotus alum Aimee Lou Wood has been confirmed to take the reins on May 2, next to British singer-songwriter Meek. Though the show got off to a strong start in viewership, its most recent episode — with Ahmed — took a 42 percent audience plunge. It was watched by just 130,950 people in the U.K. The season regulars on SNL UK include Hammed Animashaun, Ayoade Bamgboye, Larry Dean, Celeste Dring, George Fouracres, Ania Magliano, Annabel Marlow, Al Nash, Jack Shep, Emma Sidi, and Paddy Young. Here, THR rounds up a definitive list of the announced hosts and musical guests, which will be updated as new names are announced. Mar. 21: Tina Fey, Wet Leg Mar. 28: Jamie Dornan, Wolf Alice Apr. 3: Riz Ahmed, Kasabian Apr. 11: Jack Whitehall, Jorja Smith Apr. 25: Nicola Coughlan, Foo Fighters May 2: Aimee Lou Wood, Meek THR",0,2026-04-14 10:21:18
