id,url,title,source,publication_date,text_length,full_text,is_duplicate,created_at
25,https://www.hollywoodreporter.com/movies/movie-news/4k-train-to-busan-colony-release-date-1236563535/,"Well Go USA Is Sending ‘Train to Busan’ Back to Theaters, Sets Date for Yeon Sang-ho’s New Zombie Movie",Hollywood Reporter,2026-04-14T09:36:10,2229,"× Skip to main content By Abid Rahman Plus Icon Abid Rahman International Editor, Digital gentlemanabroad Follow Sign Up View All April 14, 2026 2:36am 'Colony' Well Go USA Logo text Zombie fans rejoice! Train to Busan , Yeon Sang-ho ‘s 2016 Korean masterpiece, is heading back to theaters to celebrate the 10th anniversary of the film that reanimated the zombie genre. And that’s not all — Yeon’s new film about the pernicious undead has set its North American theatrical release date. Leading indie and specialist distributor Well Go USA Entertainment is bringing Train to Busan back to American and Canadian theaters on Aug. 14. The film will be presented in 4K for the first time in theaters. There are no details as yet how many theaters or where exactly the film will play. Related Stories TV 'Saturday Night Live UK' Season 1: Nicola Coughlan, Aimee Lou Wood Tapped to Host Movies Cannes: ACID Unveils Lineup of Nine ""Adventurous"" Films, Including Two by Directors From Iran Train to Busan was a global smash hit when it was released. The film, which stars an ensemble cast including Gong Yoo, Jung Yu-mi and Don Lee, tells the story of a zombie apocalypse that suddenly breaks out and threatens the lives of passengers on a train between Seoul and Busan. The film was followed by the animated prequel Seoul Station (2016) and the standalone sequel Peninsula (2020). Well Go USA has also revealed that it has acquired the North American rights to Yeon’s newest zombie feature Colony . That film will have its world premiere at the Cannes Film Festival in May, with a theatrical release set for Aug. 28 this year. Well Go USA has revealed a teaser trailer to the film (see below). Written and directed by Yeon, Colony , per a description from the producers, “follows Professor Se-jeong as she is thrust into a terrifying hellscape when a mutating virus is unleashed during a biotech conference, forcing authorities to seal the facility to contain the outbreak. Unable to escape, Se-jeong and a group of survivors must fight to stay alive as the infected undergo horrific transformations and threaten to spread the virus.” Colony stars Gianna Jun ( My Sassy Girl ) and Koo Kyo-hwan ( Peninsula , Escape from Mogadishu ). THR",0,2026-04-14 10:21:16
3,https://deadline.com/2026/04/taskmaster-alex-horne-poland-launch-wbd-tvn-avalon-1236859237/,‘Taskmaster’ Expands Global Reach With Polish Version As Alex Horne Says: “This Has Got A Bit Out Of Control”,Deadline,2026-04-14T09:02:09,3249,"Skip to main content By Stewart Clarke Stewart Clarke More Stories By Stewart Second & Final Season Of ‘Black Sands’ Launching On The Viaplay Streaming Service In The U.S. Beta Film Links With Enteractive On Content Management Of Series & Movies Including ‘Gomorrah’ & ‘The Lives Of Others’ Apple TV Assembles ‘The Husbands’: Joe Alwyn, Richard Gadd, Kingsley Ben-Adir, Joel Kinnaman, Daniel Ings, Bob Morley & Fehinti Balogun To Star In Upcoming A24 Series With Juno Temple View All April 14, 2026 2:02am Taskmaster Channel 4 EXCLUSIVE: Taskmaster ’s international rollout is continuing apace, with a local version greenlit by Polish broadcaster TVN . Warner Bros. Discovery-owned TVN’s version of the hit comedy-entertainment format will be produced by Avalon and Constantin. The news comes as several new international Taskmaster series have just launched, with more to come through 2026. The format has an all-powerful ‘Taskmaster’ who, with the help of a loyal assistant, tests the wiles of a panel of comedians over the course of each series by setting them weird and wonderful challenges. Alex Horne created the show and is a host on the long-running UK version alongside comedian Greg Davies. “I think this has got a bit out of control, to be honest,” he said as news of the latest international deal dropped. “But I am still thrilled that the people of Poland are finally going to see their top comedians casting dignity to one side as they strive to impress the Polish version of Greg Davies.” Watch on Deadline Related Stories News ""They're All About To Get F*cked"": Damon Lindelof Reveals Blue-Collar Reason He Signed Anti-Paramount-WBD Merger Missive News CinemaCon Preview: How Paramount & Warner Bros' Crazy Plan For 30 Films A Year Could Be Taken Seriously There is wind in the Taskmaster sails internationally. The Poland news comes after Swedish commercial network TV4 greenlit two more seasons, with Avalon and Fremantle producing what will be their fourteenth and fifteenth seasons of the show. WBD in Norway has also renewed its deal and is making more Taskmaster locally, with Nordisk producing alongside Avalon. The Norwegian version won the local TV Academy Award (Gullruten) for Best Comedy Show in 2024. Iceland and Estonia launched their own takes on the format last month on Syn and TV3 respectively. Elsewhere, a Dutch Taskmaster will bow on RTL later this year. The TVN deal will take the total number of countries that have their own version to fourteen. Avalon sells the show around the world as well as producing it. “We’re thrilled to be partnering with TVN and Constantin to bring Taskmaster to Poland,” said Paula Warwick, Head of Distribution at Avalon. “The strength of the format and its ability to deliver guaranteed comedy have driven its dedicated global following, and we can’t wait to bring it to Polish audiences. With more territories coming on board this year, its global expansion shows no signs of slowing.” BBC Employees Brace For “Ominous” Town Hall About Cuts Nicola Coughlan & Aimee Lou Wood As Next Two Hosts Of British Show Tokyo Film Festival Appoints Hisamatsu Takeo As New Director ‘Spider-Man’ & ‘Spider-Verse’, ‘Insidious’ Trailer, Jumanji’ Title & More From Sony Read More About: Comments",0,2026-04-14 10:20:50
26,https://www.hollywoodreporter.com/movies/movie-news/takeo-hisamatsu-festival-director-tokyo-film-festival-1236562266/,Takeo Hisamatsu Named Festival Director of Tokyo Film Festival,Hollywood Reporter,2026-04-14T09:00:00,4233,"× Skip to main content By Abid Rahman Plus Icon Abid Rahman International Editor, Digital gentlemanabroad Follow Sign Up View All April 14, 2026 2:00am Takeo Hisamatsu Courtesy of the Tokyo International Film Festival Takeo Hisamatsu has been named festival director of the Tokyo International Film Festival . Hisamatsu takes over the top role from Tokyo fest chairman Hiroyasu Ando , effective April 14. Ando is set to step down as chairman of Asia’s biggest film festival on May 31. Hisamatsu, who previously held the festival director role at Tokyo from March 2017 to March 2021, is a veteran of the Japanese entertainment industry. In recent years he has served as president of what is now Shochiku Broadcasting as well as deputy general manager of Warner Bros. Pictures Japan. Hisamatsu is also a successful film producer and his productions include Lee Sang-il’s Unforgiven (2013); Keishi Ohtomo’s Rurouni Kenshin (2012); Hirokazu Kore-eda’s Air Doll (2009) and Still Walking (2008); Miwa Nishikawa’s Dear Doctor (2009); Ryosuke Hashiguchi’s All Around Us (2008); and Yoji Yamada’s Love and Honor | Bushi no ichibun (2006). Related Stories Movies Tokyo Film Festival, TIFFCOM 2026 Dates Set General News Tokyo: 'Palestine 36' Takes Grand Prix, Zhang Lu's 'Mothertongue' Wins Two Prizes Hiroyasu Ando Courtesy of the Tokyo International Film Festival The widely liked and respected Ando’s term as chairman of Tokyo fest began in 2019. In his time in the role, Ando oversaw the festival’s big move from Roppongi to the Hibiya-Yurakucho-Marunouchi-Ginza area of Tokyo, the reorganization of the programming structure, and the promotion of greater international exchange, such as the TIFF Lounge conversation series. Ando also shepherded the festival through the global challenges of the COVID-19 pandemic and the subsequent slow recovery faced by the film industry. Ando is set to receive the prestigious French government honor of Officer of the Order of Arts and Letters (Ordre des Arts et des Lettres) in an award ceremony to be held by the French Ambassador to Japan on April 15. “During my seven-year tenure as chairman of TIFF, I have focused on addressing four key challenges: 1. Deepening international exchange through cinema and people. 2. Addressing social issues through the platform of film. 3. Nurturing talent to shape the future. 4. Strengthening collaborative relationships with the local host community,” Ando said in a statment. “I believe that we have achieved tangible success, reflected in the growth of our audience numbers, revenues, and number of international guests. However, TIFF is still a work in progress and therefore must continue to strive for even greater heights.I sincerely appreciate your continued support and cooperation under the festival’s new leadership.” Hisamatsu said in a statement, “After five years since my last appointment with the Tokyo International Film Festival, it is a great honor to once again be given the opportunity to shoulder the significant responsibility of festival director. During my previous tenure, I championed the vision of ‘Entertainment and Art in Symmetry.’ Through a diverse lineup of films and events, we aimed to create a festival filled with a sense of celebration, which ultimately contributed to an increase in attendance. Hisamatsu added, “The Japanese government has now positioned the content business as a vital growth sector and is strengthening its support. Given this opportunity, I will commit to ensuring that TIFF plays a key role in tboth deepening cultural value and promoting the commercial development of the film industry. I sincerely appreciate your continued support and cooperation.” The 39th edition of the Tokyo film fest will open on Oct. 26, and run for 10 days until Nov. 4. The associated film market, TIFFCOM, will open its doors to attendees on Oct. 28 and run through Oct. 30. The festival will once again take place in the Hibiya-Yurakucho-MarunouchiGinza area of Japan‘s capital. TIFFCOM will again be located in the Tokyo Metropolitan Industrial Trade Center Hamamatsucho-Kan. UNIJAPAN, the organizers of the festival, began a call for submissions on April 7 and is now open through July 7 via the festival website. THR",0,2026-04-14 10:21:17
20,https://variety.com/2026/film/global/bloodsuckers-thaddea-graham-amber-grappy-laura-marcus-1236720393/,"Thaddea Graham, Amber Grappy and Laura Marcus to Star in Rosie Brear’s Debut Short ‘Bloodsuckers’ (EXCLUSIVE)",Variety,2026-04-14T09:00:00,4756,"Apr 14, 2026 2:00am PT Thaddea Graham, Amber Grappy and Laura Marcus to Star in Rosie Brear’s Debut Short ‘Bloodsuckers’ (EXCLUSIVE) By Alex Ritman Plus Icon Alex Ritman @alexritman Latest Thaddea Graham, Amber Grappy and Laura Marcus to Star in Rosie Brear’s Debut Short ‘Bloodsuckers’ (EXCLUSIVE) 1 hour ago Angel Studios Unveils Revolutionary War Action-Musical ‘Drummer Boy’ From Grammy-Winning Christian Pop Group For King and Country (EXCLUSIVE) 14 hours ago Jordan Firstman’s Buzzy Cannes Debut ‘Club Kid’ Boarded by UTA Independent Film Group and Charades, Unveils First Look (EXCLUSIVE) 20 hours ago See All MrMr Thaddea Graham (“ Sex Education ,” “ Bad Sisters “), Amber Grappy (“One Day,” “Black Mirror”) and Laura Marcus (“Star Wars Andor,” “Bad Education”) have been announced as the stars “Bloodsuckers,” the debut short film written and directed by Rosie Brear, who has produced music videos for the likes of PJ Harvey, Blood Orange and Wet Leg. A teaser for the dark comedy thriller has also been unveiled. “Bloodsuckers,” which filmed last year and whose soundtrack was created by queer icon Lynks, will now be submitted for film festivals throughout 2026 and has already received a shortlist nomination for the 1.4 awards. Related Stories Ruby Modine and Richard Harmon to Star in Boman Modine's Horror-Thriller 'A Most Delightful Game' for Lazy Sunday and 10/09 Films (EXCLUSIVE) The story follows Bliss (Graham), who is 26, lonely, and convinced she’s a vampire slayer. But when her housemate Molly (Laura Marcus) takes her relentless bullying a step too far, Bliss comes to the conclusion that perhaps the demons she’s been hunting have been under her roof the whole time. Popular on Variety “Written in lockdown, ‘Bloodsuckers’ is my love letter to London flatshares,” said Brear, a producer at London-based commercial and music video banner MrMr. “It’s a film about loneliness and finding your place in the world, however unconventional it may be.” Graham is an award-nominated actress and writer who has also previously been seen in “After The Hunt” and “Jay Kelly,” amd will soon star alongside Elle Fanning and Nicole Kidman in Apple TVs “Margot’s Got Money Troubles.” She was Graham was nominated for Best Actress at the RTS Awards 2025. Marcus is an actress, model and filmmaker, who was awarded best writer at the BFI Future Film Festival for her short film “The Massive F*cking Bender.” Her credits also include “Silent Witness,” “The Serpent Queen” and “Star Wars: Andor” and she’ll soon be seen in the upcoming “The Hunger Games” prequel “Sunrise on the Reaping” and and as a series regular role in Netflix’s “Assassin’s Creed” live-action thriller. Alongside “One Day” and “Black Mirror,” Grappy’s credits include HBO’s “The Baby” and two series of the BBC’s queer-focused show “Wreck.” In 2023 she was the lead in Olivier-Award winning play “Sleepova” and played Audrey in Ralph Fiennes’ production of “As You Like It” in 2025. “Bloodsuckers” is written, directed and produced by Brear for MrMr, and produced by Katie Lambert for MrMr and Multitude Media CEO Will Wood for Method in Madness. Executive producers are Martha McGuirk, Nick Sadler, Kirsty Bell, Connor O’Hara, Wood and Jamie Gamache. Music is by Lynks while Rik Burnell (“The Jury: Murder Trial,” “Red Herring”) serves as director of photography. The film is a MrMr, Method in Madness, Lowkey and First Flights production. “Bloodsuckers” won the First Flights scriptwriting grant and was supported by Kodak, Panavision, SHL, Final Cut and Company 3. Through the grant, the film was awarded £5k as well as a donation from Kodak of 16mm stock to shoot on film. See the “Bloodsuckers” teaser below. ‘KPop Demon Hunters’ Stars Shine With Triumphant ‘Golden’ Oscars Performance Paul Thomas Anderson Wins Best Director Oscar for ‘One Battle After Another’: ‘You Make A Guy Work Hard for One of These’ Kid Rock Says Conan O’Brien’s Oscars Diss Mocking Turning Point USA’s Super Bowl Halftime Show Was ‘Not a Very Good’ Joke PGA Awards Announces 2027 and 2028 Ceremony Dates, Reveals Key Timeline Michael B. Jordan Wins the Oscar and Shouts Out Denzel Washington, Halle Berry and More: ‘I Stand Here Because of the People Who Came Before Me’ Sean Penn Receives Mock Oscar in Ukraine After Skipping Academy Awards; Actor’s Trophy Made of Train Metal ‘That Was Damaged by the Russians’ in a Missile Strike Loading comments... More From Our Brands Rolling Stone Billy Idol on Hall of Fame Induction: ‘You Couldn’t Have Dreamed It Better’ Robb Report Why the Final Round of the Masters Could Be as Thrilling as Last Year’s Tournament Sportico TPG Agrees to Buy Learfield in Deal Worth Roughly $2 Billion WWD EXCLUSIVE: Balenciaga Highlights Basque Ties Via New Art Series",0,2026-04-14 10:21:10
19,https://variety.com/2026/film/festivals/tokyo-international-film-festival-hisamatsu-takeo-director-1236720290/,Tokyo International Film Festival Names Hisamatsu Takeo as New Director,Variety,2026-04-14T09:00:00,4368,"Apr 14, 2026 2:00am PT Tokyo International Film Festival Names Hisamatsu Takeo as New Director By Naman Ramachandran Plus Icon Naman Ramachandran Latest Tokyo International Film Festival Names Hisamatsu Takeo as New Director 1 hour ago ‘Super Mario Galaxy Movie’ Stays No. 1 at U.K., Ireland Box Office 3 hours ago Indian Rapper King’s Prime Video Series ‘Lukkhe’ Sets Worldwide Premiere Date (EXCLUSIVE) 4 hours ago See All Tokyo International Film Festival Hisamatsu Takeo has been appointed festival director of the Tokyo International Film Festival , effective April 14, marking his return to the post he held from 2017 to 2021. He steps in as outgoing chair Ando Hiroyasu prepares to leave the organization on May 31. Hisamatsu’s second stint at TIFF comes as the 39th edition, set for Oct. 26 through Nov. 4 in the Hibiya-Yurakucho-Marunouchi-Ginza district, opens film submissions through July 7. Related Stories Ruby Modine and Richard Harmon to Star in Boman Modine's Horror-Thriller 'A Most Delightful Game' for Lazy Sunday and 10/09 Films (EXCLUSIVE) “After five years since my last appointment with the Tokyo International Film Festival, it is a great honor to once again be given the opportunity to shoulder the significant responsibility of festival director,” Hisamatsu said. He added that during his previous tenure he had championed a vision of entertainment and art in symmetry, and that he would now commit to deepening the festival’s cultural value while advancing the commercial development of the film industry. Popular on Variety Hisamatsu’s career spans nearly five decades across exhibition, distribution and production in both Japan and the U.S. A Shochiku veteran who rose through its theatrical operations, he also held senior distribution roles at Warner Bros. Pictures Japan across two separate stints, and ran his own production and acquisition outfit, My Way Movies, prior to his first TIFF appointment. Ando, who became chair in July 2019, oversaw a significant reshaping of the festival during his seven-year tenure, including moving the main venue from Roppongi to its current Hibiya-Yurakucho-Marunouchi-Ginza home, restructuring the programming slate, and launching the TIFF Lounge conversation series. He has been awarded the Officer of the Order of Arts and Letters by the French government, with the French Ambassador to Japan set to present the honor on April 15. “I believe that we have achieved tangible success, reflected in the growth of our audience numbers, revenues, and number of international guests,” Ando said, adding that the festival “must continue to strive for even greater heights” under its new leadership. Submissions for the 39th edition are open now via the festival’s official website, through the July 7 deadline. The main international competition accepts features with a Japanese premiere – including documentaries and animation – completed after Jan. 1, 2026. The Asian Future section, a competitive strand for first, second or third features from emerging directors across Asia and the Middle East, is also accepting entries. At last year’s 38th edition, the festival received 1,970 submissions from 108 countries and regions, with Annemarie Jacir’s “Palestine 36” taking the Tokyo Grand Prix. Companion market TIFFCOM runs Oct. 28–30. ‘Weapons’ Star Amy Madigan Wins Oscar for Best Supporting Actress and Bursts Into Witchy Cackle ‘Bridesmaids’ Reunion: Kristen Wiig, Melissa McCarthy and Co. Make Oscars Laugh by Reading Fake Notes From Nominees Jessie Buckley Makes Oscars History as First Irish Best Actress Winner, Dedicates Win to the ‘Beautiful Chaos of a Mother’s Heart’ James Ransone’s ‘Sinister’ and ‘Black Phone’ Director Says the ‘Oscars In Memoriam Ignored Him but I Cannot’ After Late Actor Excluded: ‘He Is Dearly Missed’ Ricky Gervais Rejects Fan Request to Host Oscars: ‘F— That!’ Sean Penn Becomes Fourth Male Actor to Win Three Oscars; ‘He Couldn’t Be Here This Evening or Didn’t Want To,’ Says Presenter Kieran Culkin Loading comments... More From Our Brands Rolling Stone Billy Idol on Hall of Fame Induction: ‘You Couldn’t Have Dreamed It Better’ Robb Report Why the Final Round of the Masters Could Be as Thrilling as Last Year’s Tournament Sportico TPG Agrees to Buy Learfield in Deal Worth Roughly $2 Billion WWD EXCLUSIVE: Balenciaga Highlights Basque Ties Via New Art Series",0,2026-04-14 10:21:09
4,https://deadline.com/2026/04/tokyo-film-festival-hisamatsu-takeo-director-1236858876/,Tokyo Film Festival Appoints New Director,Deadline,2026-04-14T09:00:00,2950,"Skip to main content By Zac Ntim Zac Ntim International Reporter @ZacharyNtim More Stories By Zac ‘The Hunger Games: Sunrise On The Reaping’ Trailer: Joseph Zada & Whitney Peak Make Their Franchise Debuts Kier-La Janisse Expands Her Spectacular Optical Label Into Distribution UK-Based Sales Company CrossBorder Films To Launch Ahead Of Cannes View All April 14, 2026 2:00am Hisamatsu Takeo Tokyo Film Festival Hisamatsu Takeo has been appointed as Festival Director at the Tokyo Film Festival , replacing Ando Hiroyasu, who is due to step down on May 31. Takeo previously served as the Festival Director from 2017 to 2021. Hiroyasu had been the festival chairman since 2019. Under his leadership, Tokyo relocated its main festival hub from Roppongi to the Hibiya-Yurakucho Marunouchi-Ginza area. Hiroyasu was recently awarded the Officer of the Order of Arts and Letters by the French government, with the award ceremony to be held on April 15. Related Stories News Yoji Yamada & Sang-il Lee Talk Government Film Funding And Japan's Live-Action Industry News 'Hamnet' Director Chloé Zhao Says She Is ""Exploring"" Making A Doc For Her Next Feature Hiroyasu, in a statement, said the festival “achieved tangible success” during his time as Chairman, which was “reflected in the growth of our audience numbers, revenues, and number of international guests.” Watch on Deadline “However, TIFF is still a work in progress and therefore must continue to strive for even greater heights. I sincerely appreciate your continued support and cooperation under the festival’s new leadership,” Hiroyasu said. Takeo will begin his tenure on April 14. The longtime exec has had stints at Warner Bros. Pictures Japan and Shochiku. He launched his own company, My Way Movies, before joining the festival for his first stint in 2017. “After five years since my last appointment with the Tokyo International Film Festival, it is a great honor to once again be given the opportunity to shoulder the significant responsibility of Festival Director,” he said in a statement. “During my previous tenure, I championed the vision of Entertainment and Art in Symmetry. Through a diverse lineup of films and events, we aimed to create a festival filled with a sense of celebration, which ultimately contributed to an increase in attendance.” He added: “The Japanese government has now positioned the content business as a vital growth sector and is strengthening its support. Given this opportunity, I will commit to ensuring that TIFF plays a key role in both deepening cultural value and promoting the commercial development of the film industry.” BBC Employees Brace For “Ominous” Town Hall About Cuts ‘Spider-Man’ & ‘Spider-Verse’, ‘Insidious’ Trailer, Jumanji’ Title & More From Sony ‘The Rookie’ Renewal: How Young Appeal, Lean Production & Tax Credit Fuel Staying Power Rock Hall Of Fame Class Of 2026: Collins, Idol, Vandross, Iron Maiden, More Read More About: Comments",0,2026-04-14 10:20:52
