id,url,title,source,publication_date,text_length,full_text,is_duplicate,created_at
29,https://www.hollywoodreporter.com/movies/movie-features/obsession-megan-lawless-sarahs-big-scene-interview-1236603882/,‘Obsession’ Star Megan Lawless Unpacks Sarah’s Big Scene: “I Knew It Would Stick With Audiences”,Hollywood Reporter,2026-05-22T23:32:07,12515,"× Skip to main content By Lexi Carson Plus Icon Lexi Carson Associate Editor View All May 22, 2026 4:32pm Megan Lawless at the 'Obsession' premiere in Los Angeles. Frazer Harrison/Getty Images Logo text [This story contains spoilers from Obsession .] Sometimes, people miss what’s right in front of them. In Curry Barker ‘s Obsession , Bear (Michael Johnston) uses a One Wish Willow and wishes for his longtime crush, Nikki (Inde Navarrette), to love him more than anyone else in the world. The wish comes true, but at the cost of tragic consequences. One of those comes when Nikki kills Megan Lawless’ Sarah after Bear sneaks out to talk to her in her car. While the scene shown in the final film is already brutal, Sarah’s death was originally more graphic in the cut that premiered at the Toronto International Film Festival in September. What made it even more tragic was that Sarah had feelings for Bear that she was seemingly about to vocalize — and then it was too late. “Sarah would have been the ideal choice. I think they would have just been perfect for each other,” Johnston previously told The Hollywood Reporter . Related Stories Movies 'Obsession' Filmmaker Curry Barker Just Released His First Hit Movie. He's Ready to Get Back to His Bedroom and Edit the Next One Movies 'Obsession' Star Michael Johnston Knows You Think Bear Is the Real Villain -- But He Disagrees Now, as the hit film enters its second successful weekend at the box office, Lawless speaks with THR about Sarah going “out in an iconic way,” what could’ve happened if Nikki never showed up to the car that night, Nikki changing her appearance to look like Sarah in the ending and who she believes the movie’s villain actually is. *** One lesson from this film is to be upfront and honest about your feelings. Bear, of course, was too nervous to tell Nikki that he liked her. But Sarah also seemed too nervous to tell Bear how she felt. If Sarah had been honest from the beginning, do you think that would’ve changed anything? That is such a good question that I’ve never thought about. Honestly, I think Bear was so caught up in his feelings for Nikki that I’m not sure it would have changed much. I think he still would have had tunnel vision towards Nikki. But I would have loved it if Sarah did that, because I feel like she’s got it in her to speak her truth to Bear. And I guess when she does, it’s too late. But if they had that conversation in the car earlier, maybe we could have avoided everything that ensued. ( Laughs. ) It would have been better if everyone had just come clean about their feelings earlier than they actually did. When I spoke with Michael , he told me that Sarah and Bear would have been a great match, and she would have been the clear choice. What is your reaction to that? Do you agree? I totally agree with that. Bear obviously needs someone that would reciprocate his feelings, and I also feel like you can tell from our dialogue that we have this depth and connection. Bear isn’t in love with an idea of me, like he is with Nikki. He knows real sides of me, and I know real sides of him. Yeah, I think we would have made a great match. I wish we could see what would happen. The party scene was one of the creepiest, but also funniest moments, with Nikki reading her poem, and Sarah, Ian (Cooper Tomlinson) and Bear’s reaction to it, especially when she pulls your chair out. What was the atmosphere like on set during that scene? From my perspective, I was getting over being sick, and it was an overnight shoot, and we were all wearing tiny little clothes. I’m wearing my little dress, and Nikki’s wearing her little outfit, and I remember us all being a little chilly. There’s pictures of us behind the scenes wearing big throw blankets over ourselves. But it was also really fun because it wasn’t often that we had so many of us on set at the same time. And all of the extras in that scene were also friends of Curry and Cooper, and friends of ours. Skyler Zurn, the casting director, was there. We all got to be bumming it out together behind the scenes of that, and when we were filming it, we didn’t take that super seriously. I love the comedic elements of that scene because we all understood them in the moment while we were filming, and we were getting a kick out of everything that was happening. I remember when Inde was doing that monologue, we knew the absurdity of it. Our reactions are genuine because it is so absurd, but once the cameras cut, we can fall into the humor of it more. Rather than when the cameras are rolling, it’s our concern, our reactions are more serious, and then once the cameras cut, it’s like, “Dang, what the hell was that?” ( Laughs. ) Michael Johnston stars as Bear, Megan Lawless as Sarah and Cooper Tomlinson as Ian in Obsession . Courtesy of Focus Features Was that your first time seeing the freaky Nikki version of her? It was my second time. The first time was when I visited set on some random day and Inde was performing one of those last scenes on the couch at the very end of the movie, where she’s screaming. That was absurd. I was so impressed by her because, up until that point, I hadn’t ever seen her perform Nikki. So, I was really happy seeing that, because I was like, “OK, this movie is gonna come together now that I’ve seen what Nikki looks like on camera. This movie’s really gonna work because Inde is so stellar.” Sarah also has a brutal death scene. What was your reaction to finding out that your character was going to die like that? I was happy about it, because you want to go out in an iconic way. Everyone dies, and my death really kicks things off well. You will not forget my death scene, and I was glad it was so momentous in the storyline and nuts, because I knew it would stick with audiences. Also, the scene in the car right before is so beautiful. When Michael and I were rehearsing it, I loved the dialogue. It felt so real and raw. An actor’s favorite thing is to perform a scene like that. Michael and I had the best time, and to know it was followed up by my brutal death was even more spectacular, because I knew it gave weight to both sides of that scene, the death and the conversation before. So I just feel honored to have such an iconic death scene in this film that no one will forget. ( Laughs. ) I heard that it was also one of the funniest days on set, too? I totally stand by that. That was my favorite day on set. It was just a little ridiculous, if you take a step back and you see everything that’s going on behind the scenes, because Inde was wearing this crazy wig that had a helmet underneath it, basically something to protect her head when she bashed into the glass. She looked so funny, it was just hilarious. She had to commit to running into the glass as fast as she could and charging at me. We had to play out this thing that felt a little silly, but with 100 percent commitment, as actors do. And we didn’t have many tries. We had two takes to get it right. They were like, “Don’t actually hold her head hard or push her head in. We can’t do that for safety reasons,” so she was holding her hand gently on the back of my head, and then I was miming, slamming my head into the brick, and that whole sequence is just funny. There was a doll version of myself that they placed in, and they bashed the head in next. It’s peak actors acting, that feels silly, but you need to commit. ( Laughs. ) Originally, what premiered at TIFF was a more violent version of that scene, which would’ve received an NC-17 rating . What was it like for you to see that reaction since it’s your character? It’s so funny you asked that, because the reaction was completely unexpected to me. I’m sitting here like, “Aw, poor Sarah gets brutally killed.” The whole theater at TIFF erupted into cheering at that moment. I was like, “Why is everyone cheering? Ouch!” ( Laughs. ) I did not expect everyone to be cheering. I thought people would be crying, maybe. ( Laughs. ) But I think it’s because the moment is so iconic. These horror fans, that’s their bread and butter. They just go bananas for something like that. And that version had me in ADR originally. Curry wanted me to make gurgling noises that he would add into that scene, after my head is actually kicked in. So, you’d hear Sarah gurgling, like she’s still alive, and they took that out when they edited it to not be NC-17, but it was brutal. There’s a lot of discourse about who the true villain is in this movie. A lot of people are saying Bear, but there’s also some debate about whether everyone in this film is a villain. We have Ian secretly hooking up with Nikki and not telling Bear. And then Sarah is friends with Nikki, but she obviously likes Bear. Do you think it’s a little more nuanced about who the villain is? Do you see a clear villain? I think it’s good to think about everything from a nuanced perspective and to have discourse about this. But obviously, I’m biased; I am Team Sarah till I die. ( Laughs. ) I don’t think Sarah is the villain. I mean, if you really put yourself in Sarah’s shoes, she and Nikki have this friendship, and Nikki has been telling her, “I’ll talk to Bear and tell him you like him. I know you like Bear. You guys would make a great match. You should go for that.” If your best friend was gunning for you to pursue your love interest, and then one day there’s a flip of the switch, and they’re dating, I would be so offended! I remember talking about it with Curry. From the moment they start dating, it irritates me, because my best friend is now dating the guy I like out of nowhere, when she had never expressed interest before? It feels like a slap in the face, and I feel like Sarah tries to go about it in the best way possible, being honest, that she doesn’t like it, and that it feels like a betrayal, in a sense. But also not overstep and tell them what they should do. I think she holds off for as long as possible in telling her friends, “You can do this and can’t do that.” But she can also be honest that it doesn’t seem healthy. Ultimately, in that car scene, she really knows that’s the time you need to step in, like Sarah knows it’s time to step in after seeing what she saw at the party, now I need to hold my friends accountable because whatever is going on is not OK. This is not healthy for anyone involved. Of any character in this film, Sarah is not the villain… I do think Bear’s the villain! ( Laughs. ) What do you think would have happened if Nikki hadn’t come up to the car and interrupted Sarah and Bear? I love this question. I’d like to think that Bear would have seen what was right in front of him the whole time. I don’t think I’d necessarily want them to kiss or break any boundaries. Obviously, from Sarah’s perspective, they are in a relationship still. I wouldn’t want to impose on that in any way, but for Bear to wake up and be like, “Sarah, this is not healthy, whatever Nikki and I are doing. And I appreciate you being honest with me about your feelings. Let me break things off with Nikki.” In a normal world, where the One Wish Willow doesn’t exist and Nikki isn’t obsessed and that would lead to disastrous consequences, that would be the ideal scenario. ( Laughs. ) Maybe they would have kissed, but I don’t think I really want that personally, because I think it goes against everything Sarah believes. Inde Navarrette at the end of Obsession. At the end, it’s so interesting that Nikki starts to change her appearance to look like Sarah by drawing on her tattoos and wearing her dress. Whose idea was that and what do you think about how she’s almost trying to become Sarah or mirror her in a way? That was always written in the script, so it was Curry’s idea. It’s crazy because you see my dead body there naked and it’s because Nikki’s wearing my clothes. She’s even smoking the joint. I think that is such an eerie touch, and it continues to add to the theme of this unhealthy obsession that was against Nikki’s own agency, but also an unhealthy obsession in romantic situations: You will change yourself to appease the person you want and that’s not healthy either. So, adding in that layer to be like, “Don’t do this! Don’t try to become someone else. Don’t try to become whatever they want to be.” I think that is a nice touch at the end. *** Obsession is now playing in theaters . Check out all of The Hollywood Reporter ‘s coverage here , including a Curry Barker profile and spoiler interviews with Inde Navarrette and Michael Johnston . THR",0,2026-05-23 10:40:38
7,https://deadline.com/2026/05/stranger-things-eleven-pink-dress-donated-the-smithsonian-1236919522/,‘Stranger Things’ Duffer Brothers & Shawn Levy Donate Eleven’s Pink Dress To The Smithsonian,Deadline,2026-05-22T23:20:58,4714,"Skip to main content By Nellie Andreeva Nellie Andreeva Editor-In-Chief @DeadlineNellie More Stories By Nellie ‘Stranger Things’ Duffer Brothers & Shawn Levy Donate Eleven’s Pink Dress To The Smithsonian Tom Hardy Leaving ‘MobLand’ After Season 2 As Paramount+ Drama Eyes Season 3 Renewal ‘How To Survive Without Me’: Joe Romano To Play Younger Version Of Dad Ray, Katie Aselton & Will Yun Lee Also Cast As Guest Stars In HBO Max Pilot View All May 22, 2026 4:20pm Millie Bobby Brown costume from 'Stranger Things,' Season 1-2 Netflix/Getty Stranger Things has marked a lot of firsts for Netflix : it became the first original series to become a global hit and cultural phenomenon, the first series owned by the streamer and the first title Netflix has been able to turn into a licensing bonanza with a slew of consumer product deals. Now the supernatural coming-of-age drama, which wrapped its five-season run on New Year’s Eve, also has become Netflix’s first show with a presence at the Smithsonian . It will be represented by Eleven’s (Millie Bobby Brown) signature outfit built around her iconic pink dress from Season 1. Ryan Lintelman, entertainment curator, Smithsonian’s National Museum of American History, announced the donation at a Netflix FYC event for the series at the Hollywood Forever Cemetery Thursday night attended by Stranger Things cast and crew, including creators/executive producers/directors Matt and Ross Duffer , director/executive producer Shawn Levy and stars David Harbour, Natalia Dyer, Jamie Campbell Bower and Noah Schnapp. Related Stories Documentary Love Match: Tennis Legend Rafael Nadal Gets Standing O At Madrid Premiere Of 'Rafa' Netflix Series News Netflix Taking U.S. Rights To Romain Gavras' 'Sacrifice' With Chris Evans, Anya Taylor-Joy, Vincent Cassel, Salma Hayek Pinault, Charli xcx & More -- Cannes Market “This is amazing, thank you so much,” Matt Duffer exclaimed as he, Ross Duffer and Levy walked on stage to sign the deed of gift. (You can watch the signing video below.) Levy has his own history with the Smithsonian having directed and produced the 2009 feature Night at the Museum: Battle of the Smithsonian starring Ben Stiller, which is set there. Watch on Deadline In his speech, Lintelman noted that Stranger Things “told a compelling and complex story with themes that resonate now and will stand the test of time: The deeply American skepticism of authority and established wisdom – especially the federal government and unethical activities in the pursuit of science and security,” before ad-libbing, almost apologetically, about his own status of a federal government representative to a big laugh from the audience. The other themes from the show Lintelman highlighted as exemplified by Eleven’s costume include “The belief that a group of committed individuals can change the world, the idea that young people have a unique ability to see the truth that others can’t, and the power of friendship, courage, and love to overcome any obstacle.” Lintelman also underlined the significance of the costume, designed by Kimberly Adams and Malgosia Turzanska, which will be part of the national collection at the Smithsonian. “This costume so brilliantly illustrates Eleven’s journey to discover herself and claim her power,” he said. “Until this point in the series, Eleven had only worn hospital gowns and hand-me-downs, suggesting her lack of autonomy and individuality; when she first puts on the dress and a blonde wig, Eleven remarks that she looks pretty, a major step on her journey to self-awareness and empowerment.” (L-R): Shawn Levy, Matt Duffer, Ross Duffer and Smithsonian Coordinator Ryan Lintelman during the deed of gift signing at Netflix’s FYSEE LA ‘Stranger Things’ event on May 21, 2026 at the Hollywood Forever Cemetery in Los Angeles. Netflix Lintelman also mentioned the dress’s cultural zeitgeist impact as one of the most sought-after costumes of the 2016 Halloween season. Halloween costumes was the first area Stranger Things expanded into as a brand, followed by dozens of others, from toys and games to live experience to clothing and other consumer products. ‘Stranger Things’ EPs the Duffer Brothers and Shawn Levy sign the deed of gift for Eleven’s dress’s donation to the Smithsonian at a Netflix FYC event: “This is amazing!” pic.twitter.com/Tle8ay2Vbj — Deadline (@DEADLINE) May 22, 2026 ‘Mandalorian And Grogu’ Eyeing $90 Million Four-Day Domestic Opening Julia Roberts To Lead ‘Home Economics’ As 3000 Pictures Gets Rights To Novel Ben Stiller & Mike Judge Teaming On ‘Protective Custody’ Comedy At Apple Netflix Buys Starry ‘Sacrifice’; amfAR Gala; 193 Inks Output Deals; Reviews & Studio Read More About: 1 Comments",0,2026-05-23 10:40:13
30,https://www.hollywoodreporter.com/music/music-news/phil-collins-contemplate-live-performances-1236604755/,"Phil Collins Says He Declined to Perform at Rock and Roll Hall of Fame Induction Ceremony, but Would “Contemplate” Future Live Performances",Hollywood Reporter,2026-05-22T23:16:12,3219,"× Skip to main content By McKinley Franklin Plus Icon McKinley Franklin View All May 22, 2026 4:16pm Phil Collins performs at the Little Dreams Foundation Benefit Gala in 2016. Gustavo Caballero/Getty Images Phil Collins said in a new interview with BBC Breakfast that he declined the opportunity to perform at his forthcoming induction into the Rock and Roll Hall of Fame , but that he would not rule out future live performances while sharing a positive health update. During the Friday interview, the Oscar-winning musician was asked if he’d perform again, to which he replied, “I can’t really see it happening. But I’m healthier now than I have been for quite a while.” Collins has faced several health issues over recent years, including kidney issues and five knee surgeries. After enduring a spinal injury in 2007, the “In the Air Tonight” singer has faced health struggles that have prevented him from performing. Related Stories News Why Billy Bob Thornton Doesn't Discuss Politics: ""I'm Not an Expert"" Lifestyle Dave Coulier Says Cancer Treatment Has Led to Changes in His Speech and Physical Appearance The “In the Air Tonight” singer further revealed that he was asked to perform at the 2026 Rock and Roll Hall of Fame induction ceremony. Collins has already been inducted into the esteemed musical museum with Genesis in 2010, and now joins a rare group of two-time inductees. “They asked me if I would perform and I said no, because you’ve got to be match fit to do something like that,” he said. “You can’t just go on stage and — you’re gonna have to rehearse and then by that point, if you’ve not been singing, your voice is going to be shot and then that’s not gonna be good. So I’d rather not do it.” However, Collins said he would “contemplate” another live performance in his future. “But whether I would go out again, I would contemplate, yeah. I’m constantly saying to myself, I better go back down into my studio at home,” he said. The eight-time Grammy Award winner shared in a five-part interview on BBC Two’s Eras that he was living under 24-hour care in January. “It’s an ongoing thing,” Collins said of his health. “I have a 24-hour live-in nurse to make sure I take my medication as I should. I’ve had challenges with my knee. I had everything that could go wrong with me, did go wrong with me. I got COVID in hospital — my kidneys started to back up, you know, everything that started that could, all seemed to converge at the same time. I had five operations on my knee now — I’ve got a knee that works and I can walk, albeit with assistance, you know, crutches or whatever.” He also explained that his past drinking contributed to kidney problems. (Collins is now sober.) “I’d probably been drinking too much, and so my kidneys were messed up, you know. I enjoyed coming off tour, coming off the road, but I thought, right, I’m gonna do all those things that I couldn’t do. I wasn’t one of those guys that sort of stayed up all night drinking. I’d drink during the day, but I guess I had too much of it. I was never drunk, although I fell over a couple of times. But, it is just one of those things that happened and it all caught up with me and I spent months in hospital,” he said. THR",0,2026-05-23 10:40:39
31,https://www.hollywoodreporter.com/movies/movie-news/the-incredible-edible-mena-suvari-jean-evans-jenna-milly-1236604725/,"Mena Suvari, Jean Evans, Steph Tolev to Star in Teen Body-Swap Comedy ‘The Incredible Edible’ (Exclusive)",Hollywood Reporter,2026-05-22T23:14:00,2923,"× Skip to main content By Ryan Gajewski Plus Icon Ryan Gajewski Senior Entertainment Reporter View All May 22, 2026 4:14pm Mena Suvari (left), Jean Evans, Steph Tolev and Jake Picking Amy Sussman/Getty Images; Jesse Grant/Getty Images; Chris Saucedo/Getty Images; Phillip Faraone/Getty Images A comedy feature is set to focus on the unexpected effect of a psychedelic gummy. Mena Suvari ( American Beauty ), Jean Evans ( Busboys ), Steph Tolev ( Tires ), Jake Picking ( Top Gun: Maverick ) and Rodney J. Hobbs ( Young Dylan ) are set to star in filmmaker Jenna Milly’s teen body-swap movie The Incredible Edible , The Hollywood Reporter has learned. Principal photography recently wrapped in Los Angeles for the project that hails from Paillette Pictures. The Incredible Edible is set over the final 24 hours before high school graduation and centers on Evans as an overachieving valedictorian who discovers that a psychedelic edible has caused her to begin body-switching with those around her. Her experiences through the perspective of her classmates, teachers and mother (Suvari) lead her to question the future that she has planned for herself. Related Stories Movies Heidi Gardner, William H. Macy to Star in Dramedy 'The Swimming Lesson' (Exclusive) Movies Sam Lerner, Camille Hyde, Nikola Djuricko to Star in Comedic Thriller 'Jacob and the Wolf' (Exclusive) Marking her feature directorial debut, Milly helmed the indie film from her own script. Producers include Milly for Paillette Pictures and Clément Bauer for Resonate Entertainment, alongside Emily Sheehan, Andrew DeCesare and Mike Day. Susan Cartsonis and Suzanne Farwell are executive producing for Resonate Entertainment. Jacalyn Alongi, John-Paul Howard, Casey Burke, Kenzie Yolles, Jake Somnath, Sebastian Amoruso, Landon Boyce, Lidya Jewett and Isa Mellody round out the cast. Milly’s previous feature screenwriting credits include The Fabulous Four with Bette Midler and Susan Sarandon, You’re Dating a Narcissist with Marisa Tomei and the Mary Holland-led Golden Arm . Milly is represented by David Boxerbaum at Verve Talent & Literary Agency, Ryan Saul at Evoke Entertainment and Linda Lichter at Lichter Grossman. “I’ve always dreamt about making a fun popcorn movie that pays homage to the quirky science-fiction high school films of the ’80s,” Milly says. “Our cast is amazing, and this story is absolutely wild. It was so much fun to shoot. I’m so proud of this magical film.” Suvari returns to the teen comedy genre after starring in the hit American Pie franchise. The actress, who is also known for the Oscar-winning movie American Beauty , is set to head back to the American Horror Story for the forthcoming season 13 after her role on 2018’s American Horror Story: Apocalypse . She is repped by represented by Innovative Artists, Management Production Entertainment and Jackoway Austen. Evans is repped by Greene Artists and CT Media. THR",0,2026-05-23 10:40:40
