id,url,title,source,publication_date,text_length,full_text,is_duplicate,created_at
22,https://variety.com/2026/film/global/trial-of-hein-north-america-france-sales-1236711179/,"Berlinale Award Winner ‘Trial of Hein’ Sells to North America, France and More (EXCLUSIVE)",Variety,2026-04-08T10:08:18,3324,"Apr 8, 2026 3:08am PT Berlinale Award Winner ‘Trial of Hein’ Sells to North America, France and More (EXCLUSIVE) By Leo Barraclough Plus Icon Leo Barraclough International Features Editor LeoBarraclough Latest Riz Ahmed Takes Aim at British During Opening Monologue on ‘Saturday Night Live U.K.’: ‘We Like It When Things Are a Little Bit Crap’ 3 days ago ‘The Michael Jackson Story’ Docuseries, Featuring La Toya Jackson, Dionne Warwick and More, Sells to Multiple Territories (EXCLUSIVE) 6 days ago ‘Sound of Falling’ Leads German Film Awards Race Followed by ‘Yellow Letters’ 1 week ago See All Courtesy of Tamtam Film Athens-based boutique film house Heretic has secured major distribution deals for “Trial of Hein,” including North American rights, following its premiere at the Berlin Film Festival , where it won the Teddy Jury Award. North American rights for Kai Stänicke’s debut feature, which screened in the Berlinale’s Perspectives section, have been acquired by Strand Releasing ahead of the film’s North American premiere at New Directors/New Films in New York. Related Stories Christy Carlson Romano Says 'Even Stevens' Co-Star Shia LaBeouf 'Doesn't Deserve to Be' on the Mount Rushmore of Disney Icons, Then Deletes Posts FKA Twigs Sues Shia LaBeouf Over NDA from 2020 Sexual Battery Settlement In addition, Paradis Films will handle distribution in France, and DCM will distribute the film in all German-speaking territories. The film has also been sold to Lev Cinemas in Israel. Popular on Variety The film follows Hein, who returns to his remote island home after 14 years, only to find himself unrecognized by the local community, which demands a trial to determine whether he truly is who he claims to be – setting in motion a quietly unsettling exploration of identity, belonging and perception. Jon Gerrans, co-president of Strand Releasing, said “Trial of Hein” is “such a carefully structured film with style reminiscent of dogma and influences of classic cinema.” He added that having New Directors/New Films for the North American premiere was “the perfect platform for audiences here.” Marguerite Gigom, acquisitions executive at Paradis Films, added: “ ‘Trial of Hein’ was an immediate standout for us when we discovered it in Berlin, a true favorite. The film impressed us with the strength of its vision and the confidence of its filmmaking, marking the arrival of a new voice.” “Trial of Hein” is produced by Andrea Schütte, Dirk Decker and Dario Suter, with Katrin Jochimsen, Felix von Boehm and Kai Stänicke serving as co-producers. The film is a Tamtam Film production, co-produced with Dario Suter, Lupa Film and ZDF – Das kleine Fernsehspiel, and supported by MOIN Film Fund Hamburg Schleswig-Holstein, Nordmedia – Film and Media Company of Lower Saxony/Bremen, Hessen Film & Medien, the German Federal Film Fund (DFFF) and German Films. Bijou Phillips Hospitalized for Second Kidney Transplant, Urgently Seeks Donor Loading comments... More From Our Brands Rolling Stone Jimmy Kimmel Celebrates Trump Not Destroying Iran: ‘The Taco Tuesday of All Taco Tuesdays’ Robb Report Jacob & Co. Just Unveiled the World’s Fastest Tourbillon Sportico Sen. Warren Urges FCC to Shield Fans From Media Consolidation WWD Fashion Trust U.S. 2026 Awards Reveal Winners, Honor Tory Burch and Michèle Lamy",0,2026-04-08 10:13:36
23,https://variety.com/2026/film/news/norwegian-horror-youve-been-chosen-blue-finch-sales-cannes-1236711162/,Norwegian Horror ‘You’ve Been Chosen’ Boarded for World Sales by Blue Finch Films Ahead of Cannes Frontières (EXCLUSIVE),Variety,2026-04-08T10:00:00,3532,"Apr 8, 2026 3:00am PT Norwegian Horror ‘You’ve Been Chosen’ Boarded for World Sales by Blue Finch Films Ahead of Cannes Frontières (EXCLUSIVE) By Naman Ramachandran Plus Icon Naman Ramachandran Latest Allu Arjun, Deepika Padukone, Director Atlee Unite for Fantasy-Action Film ‘Raaka,’ Backed by Sun Pictures 3 hours ago India’s PVR Inox Eyes Indie Distribution Pipeline via MAMI Independent Initiative (EXCLUSIVE) 20 hours ago ‘Super Mario Galaxy Movie’ Powers to No. 1 at U.K., Ireland Box Office 22 hours ago See All Blue Finch Films Blue Finch Films has come aboard as worldwide sales agent on Norwegian psychological horror “You’ve Been Chosen,” which will be presented at the Frontières Proof of Concept showcase during next month’s Cannes Film Festival . Frontières is a leading genre-focused co-production and pitch market, running annually alongside the Cannes Film Market. Written and directed by Viljar Bøe, the film follows Fredrik, a man whose life is upended when he begins receiving anonymous letters with instructions that reward obedience and punish resistance. Drawn deeper into an increasingly brutal system, he is forced to confront the limits of his own free will and the true cost of belonging. The project is rooted in themes of loneliness, psychological control and the seductive pull of structure in an isolated life. Related Stories Christy Carlson Romano Says 'Even Stevens' Co-Star Shia LaBeouf 'Doesn't Deserve to Be' on the Mount Rushmore of Disney Icons, Then Deletes Posts FKA Twigs Sues Shia LaBeouf Over NDA from 2020 Sexual Battery Settlement The deal marks the third partnership between Blue Finch and Bøe, following “Good Boy” and “Above the Knee,” both of which earned critical recognition across their festival and release runs. Popular on Variety Bøe is producing alongside Anders Fløysand and Arne Dahr under production company Sleazemania!. Evrim Ersoy, Mike Chapman and Fatima Hayward serve as executive producers. “Having become fast fans of Viljar’s work, we are thrilled for this to be our third collaboration. ‘You’ve Been Chosen’ is a shockingly violent, thrill filled joyride,” said Mike Chapman, Blue Finch Films co-founder. “You’ve Been Chosen” joins a Blue Finch sales slate that also includes Rotterdam title “Bowels of Hell” from Oscar-winning production company RT Features, SXSW selection “Imposters,” and horror title “Dolly,” which opened theatrically through IFC last month. ‘X-Men’ Reboot Director Says ‘Beef’ Creator and ‘The Bear’ Writer Are ‘Working on a Draft’ of the Script: ‘We’re Still Developing’ Rapper Lil Tjay Arrested in Connection With Offset Shooting in Florida Ty Myers on Going ‘Heavy on the Soul’ With His New Album, and Bringing John Mayer and Stevie Ray Vaughan Influences to Country Music as an Old Soul of 18 IFF Panama Closing Night Film ‘Milly, Queen of Merengue,’ About the Four-Time Latin Grammy Winner, Spins a Tale of Grit and Heart This AI-Powered Website Builder Can Help Creatives Launch Their Business in Seconds Jimmy Kimmel Says Donald Trump Threatens ‘Something Crazy’ and Then ‘Always Gives Two Weeks’ After Delaying Iran Strikes: ‘He’s Like a Conscientious Employee’ Loading comments... More From Our Brands Rolling Stone Jimmy Kimmel Celebrates Trump Not Destroying Iran: ‘The Taco Tuesday of All Taco Tuesdays’ Robb Report Jacob & Co. Just Unveiled the World’s Fastest Tourbillon Sportico Sen. Warren Urges FCC to Shield Fans From Media Consolidation WWD Fashion Trust U.S. 2026 Awards Reveal Winners, Honor Tory Burch and Michèle Lamy",0,2026-04-08 10:13:37
24,https://variety.com/2026/film/global/new-outlooks-on-motherhood-iff-panama-su-mirada-her-gaze-1236709709/,"Sofía Quirós Úbeda, Paz Fábregas, Tres Tigres, Monte & Culebra and Mentes Fritas Compete at Panama’s Su Mirada Female Director Focus",Variety,2026-04-08T09:50:11,16956,"Apr 8, 2026 2:50am PT Sofía Quirós Úbeda, Paz Fábregas, Tres Tigres, Monte & Culebra and Mentes Fritas Compete at Panama’s Su Mirada Female Director Focus Su Mirada is an impressive guide to emerging and new female directors in Central America and the Caribbean, many exploring motherhood and often backed by energetic regional producers By Anna Marie de la Fuente Plus Icon Anna Marie de la Fuente @adelafuente1 Latest Identity Comes Under Focus at IFF Panama’s Primera Mirada Showcase 6 minutes ago Netflix Argentina Opens New Office, Presents Titles From Ricardo Darín, Alex de la Iglesia, Pablo Larraín, Santiago Mitre and Pablo Trapero 14 hours ago IFF Panama Closing Night Film ‘Milly, Queen of Merengue,’ About the Four-Time Latin Grammy Winner, Spins a Tale of Grit and Heart 16 hours ago See All 'The Son of the Congo' Courtesy of Irreverente The theme of motherhood prevails in IFF Panama ’s Su Mirada – Her Gaze – program but from less traditional approaches, says industry coordinator Cat Caballero, who has observed different outlooks in this year’s crop. “You see varying perspectives that range from a child’s relationship with his mother, as well as on the woman who decides not to become a mother, and the one who chose to be a mother but is struggling through that whole process,” she notes. Related Stories FKA Twigs Sues Shia LaBeouf Over NDA from 2020 Sexual Battery Settlement Christy Carlson Romano Says 'Even Stevens' Co-Star Shia LaBeouf 'Doesn't Deserve to Be' on the Mount Rushmore of Disney Icons, Then Deletes Posts The theme came up organically, she observes, even among those who were not selected. Popular on Variety “They also dealt with motherhood – but not necessarily from the experience of being a mother, rather from other aspects of motherhood as an experience for women. That really caught my attention, especially because these are unconventional outlooks on that experience.” The section is split into two categories, development and post (WIP) with 15 contenders in the former of which one will take home a cash prize of $5,000. The winner of the WIP section, which has three finalists chosen out of 10 submissions, earns $10,000. Deliberations on both sections were held virtually before the festival and the winners will be announced at the closing night on April 12. Thanks to the alliance between both IFF Panama and Colombia’s Cartagena Film Festival (FICCI), the WIP prizewinner will travel to Cartagena where they will be given the chance to further develop their project and build strategic connections with potential partners. FICCI runs over April 14 – 19. IFF Panama takes place April 9 – 12. WIP jurors are Diana Cadavid, LALIFF and TIFF Programmer; Itzel Martínez, filmmaker and head of Ambulante, and Mariana Núñez, visual artist, designer and VP of communications and culture at Ciudad del Saber, Panama. “Silent Birds” (“Madre Pájaro”), Sofía Quirós Úbeda , Costa Rica, Argentina. Pic follows an eight-year-old boy navigating grief and shifting family bonds as he confronts his mother’s illness in a rural landscape. Produced by Sputnik Films, Murillo Cine and a wide international consortium, it reflects a strong multi-country co-production model. With a cast led by Oliver Macluf Vargas and Wendy Chinchilla (“Clara Sola”), the project reinforces the region’s auteur-driven pipeline. Quirós Úbeda describes it as “a reflection on other ways of accompanying childhood through grief, without replacing those who are gone.” ‘Silent Birds’ Courtesy of Sputnik Films “The Fool and the Moon” (“El Loco y la Luna”), Julia Scrive-Loyer, Dominican Republic, Argentina. A character-driven feature follows a man confronting grief, guilt and emotional paralysis after his mother’s death, as he attempts to reconnect with his past. Produced by Monte & Culebra and Argentina’s Greta Films, with support from Ibermedia, it reflects a growing regional co-production network. The company continues its auteur-driven trajectory following titles like “Pepe,” winner of the Silver Bear at Berlinale 2024. Scrive-Loyer describes it as “an invitation to eventually find our own way to be free.” Written and directed by Julia Scrive-Loyer, it stars José Luis Jiménez, Maia Otero, Carlos García, Vicente Santos, Judith Rodríguez. “To the Future” (“Al futuro”), Paz Fábrega, Costa Rica, Uruguay, Spain Balancing motherhood, financial pressure and creative urgency, Fábrega turns the camera on her own life in a hybrid exploration of fiction and documentary. Produced by Costa Rica’s Temporal Films alongside La Mayor Cine (Uruguay) and Edna Cinema (Spain), it builds on the company’s internationally recognized slate, including Rotterdam Tiger prizewinner “Agua fría de mar,” “Viaje” and “Medea.” Co-producer Carla Sospedra describes it as “an intensely personal project in which Paz Fábrega not only directs but also appears on-screen alongside her children. Her tender yet uncompromisingly realistic gaze, filming her own life and assuming emotional and formal risks, results in a unique hybrid format …underscoring the film’s artistic ambition and emotional authenticity.” FILMS IN DEVELOPMENT Jurors: Elena Gonzalez, director, Cultural Center of Spain; Monica Moya, industry head, Cartagena Film Festival; Nyra Soberón, actress, director and acting coach “Diaries of Silence” (“Diarios del silencio”), Daniela Muñoz Barroso, Spain, Cuba. This essay documentary is written, directed and produced by Muñoz Barroso alongside Leila Montero and Efthymia Zymvragaki, and backed by Estudio ST Producciones Cinematográficas, Gris Medio and Colectivo de Creación Estudio ST. Shot across Spain and Cuba in 4K, HD and 16mm, the project blends autobiography and sensory exploration of hearing loss, migration and motherhood. Facing hearing loss, Muñoz travels to Cuba from Madrid to preserve the sensory memory of her home for her child. “I film to preserve the sounds I may lose, turning memory into a space that can still be heard.” “Do Not Leave Your Homeland” (“Ne quittes pas ton pays”), Aliha Thalien, Martinique, France. A feature project exploring the legacy of France’s 1960s-launched migration program Bumidom, it follows Augustine, a woman who returned to Martinique after decades in France, as she navigates solitude, memory and community across generations. Thalien’s previous shorts include “Nos Îles,” recognized at FID Marseille, Go Short, DocsBarcelona and “Saturne en Été,” winner at the AfroFuturist Femmes Film Festival. For Thalien, the film will explore “the legacy of Bumidom across several generations in Martinique and the Paris region” through an ensemble-driven, intimate and observational approach. “Hotel Fung” Carolina Fung, Costa Rica, Panama. A docu-fiction hybrid exploring memory, migration and identity through the story of a filmmaker reconnecting with her Chinese Costa Rican heritage and her grandparents’ lost hotel. Produced by Sofía Meza Herrera of Blue Paradox Films, the project is positioned as a potential multi-country co-production, with Panama attached and European partners in discussion. It has participated in industry programs including Ibermedia’s Atitlán Projects, Warmi Lan of Mafiz and the Extremadura Film Residency. Also set to participate in the IB platform of DocsMx. Fung describes it as “a feature film about memory, belonging, and identity,” blending documentary, fiction and video game-inspired animation. ‘Hotel Fung’ Courtesy of Blue Paradox Films “Love in the Time of Bacanería” (“El amor en los tiempos de bacanería”), Patricia Pepén, Dominican Republic. Set in Santo Domingo, 17-year-old Zuleika navigates romances and her strained relationship with her mother, discovering that true love lies within herself. Produced by Mentes Fritas Producciones, known for “Rafaela,” “El Día de la Tormenta,” and “La Bachata de Biónico,” the project has participated in Warmi Lab, Nuevas Miradas, FICCI Opera Prima Lab and Cannes Marché du Film. Winner of the Audience Design Award from the World Cinema Fund and supported by Fonprocine 2025 and SAPCINE, the producers aim to combine authenticity with audience appeal while expanding international co-productions and financing. ‘Love in the Time of Bacaneria’ Courtesy of Mentes Fritas “Nana, the Songs of Our Grandmothers” (“Nana, los cantos de nuestras abuelas”), Tamara Espinoza, Nicaragua, Panama. Docu in advanced development follows a 70-year-old Kuna woman who sings to restore spiritual balance while searching for an heiress as rising sea levels threaten her territory. Produced by Nicaragua’s Cinecolibrí in collaboration with Tecla Films, the project is in discussions for a co-production with Panama-based Ainifilms. It builds on Cinecolibrí’s emerging slate, including “Dule Ina” and “Guided by the Moon.” Protagonist Briseida Iglesias states: “Memory is to be left in the earth.” ‘Nana, the Songs of Our Grandmothers’ Courtesy of Cine Colibri phuyu wayra “Paper Tower” (“Torre de Papel”), Laura Garcia Cordon, Guatemala. Set in Guatemala’s courthouse, judges, lawyers, guards, detainees and a mother seeking justice navigate a fragile system where time blurs and law is a daily performance. Produced by Iris Andante, “Paper Tower” builds on the company’s observational documentary work, including the short “Arizona 314: Lecciones para una elección.” Garcia Cordon’s debut feature explores hidden perspectives within the justice system, enabled by her unique access as a journalist. Says Garcia Cordon: “It allows me to document the workings of the courthouse from within, in its courtrooms and hallways and now also in a private office that has given me the privilege of filming the behind-the-scenes of criminal justice.” ‘Paper Tower’ Courtesy of Iris Andante “Quemada,” Ardelia Istarú, Costa Rica, Panama Produced by Costa Rica’s Tres Tigres, behind Locarno-won title “I Have Electric Dreams” by Valentina Maurel, and Panama’s Mansa Productora, it has secured the Ibermedia Co-production Fund and is finalizing local financing, with no pre-sales to date. Blending archive, fiction, and performance, the hybrid documentary explores memory, sexuality and a mother–daughter relationship. The project is currently negotiating post-production partnerships in France. Says Istarú: “By blending abstract animation and personal testimony, the film seeks to protect the images of the past and transform memory into a sensory experience of healing.” ‘Quemada’ Courtesy of Tres Tigres “Routine Procedure” (“Procedimiento De Rutina”), Kryzz Gautier, Dominican Republic, USA. Following five patients paralyzed by routine surgeries in August 1989, including Clara whose C-section altered her life, the documentary tracks her daughter decades later as she investigates this forgotten medical tragedy. Produced by Reclaimed Entertainment, known for developing bold, character-driven stories across queer, Latina and disabled narratives, the project blends investigative rigor with personal memory. “This film sits at the intersection of investigative journalism and the dissection of an intimate mother–daughter relationship. That tension between personal urgency and factual inquiry is what defines the film,” says Gautier. “Sirens” (“Sirenas”), Alexandra Latishev Salazar, Costa Rica, Spain. Set in a coastal town, it follows a woman who, after her husband’s disappearance, becomes entangled with a group of women whose bodies and identities begin to transform. Produced by Costa Rica’s La Linterna Films and Pacífica Grey as well as Spain’s Vitrine, the project builds on the company’s internationally recognized slate, including Latishev’s debut feature “Medea,” which represented Costa Rica in the Oscars and Goyas, and IDFA-winning “Rebel Objects.” Feminist horror project participated in San Sebastian festival’s residency program Ikusmira Berriak and Costa Rica’s Tres Puertos Lab. The producers note it offers “a political reimagining of body and transformation” through a hybrid language between genre and auteur cinema. “Suggunya: Between Seas, Molas and Memories” (“Suggunya: Entre mares, molas y memorias”), Olowaili Green Santacruz, Colombia, Panama, U.K., U.S. In advanced development, it follows a young Gunadule woman reclaiming her people’s history of a 17th-century Scottish expedition through memory and weaving traditions. Produced by Colombia’s SentARTE – Art with Meaning, Studio Antirawaa and Panama’s Wagua Films, t he film is part of a co-production alliance spanning the Americas and Europe, and aims to shoot in the U.K. It’s currently participating in industry platforms, including The Edinburgh Pitch. It builds on SentARTE’s slate, including “Muu Palaa” and “Akababuru.” Green Santacruz describes it as “a story told from our point of view as women, where struggle and resistance stand out.” “The Son of the Congo” (“El Hijo del Congo”), Jhojaddy Grissel Ramírez, Panama, Brazil. An Afro-Panamanian dancer returns to his neighborhood after his father’s death, navigating family responsibility, a violent environment and the need to reconnect with his body and ancestral roots. Produced by Irreverente, known for “Bila Burba” and “Bitácora: The Art of Resistance,” in co-production with República Pureza Filmes (Brazil), the project foregrounds Afro-Panamanian culture and Congo dance and will feature mostly non-pro actors. “’The Son of the Congo’ emerges from the intersection of personal and collective experiences, exploring how body, territory and memory shape Afro-descendant identity,” notes Ramírez. ‘Routine Procedure’ Courtesy of Reclaimed Entertainment “The Whisper of the River” (“El susurro del río”), Jessica Guifarro, Honduras. A feature project exploring rootedness and memory through intimate encounters along a river. Produced by Óptica Fílmica, which has been recognized for its documentary shorts “La Leona” and “La Fuente.” The project is still deep in the research and development phase. “I film from the heart of the communities I live in and observe. I combine cell phones, archival footage, and digital cameras to craft personal and collective narratives that preserve local memory,” says Guifarro. “The Woman from the Heat” (“La mujer del calor”), Natalia Solórzano Vásquez. A feature following a woman in a town where the sun never sets, whose husband’s miraculous recovery turns her private wish into public punishment, pushing her toward a radical act of redemption. Currently seeking production partners, the project is positioned for international co-production. Solórzano Vásquez describes it as “a way to continue observing the truth when reality needs a body to embody it,” blending her documentary background with a fiction-driven exploration of faith, guilt and the body. “Under My Bed a Giraffe Sleeps” (“Debajo de mi cama duerme una jirafa”), Aria Sánchez and Marina Meira, Cuba. A fiction feature centered on a young girl preparing for a national wrestling competition while grappling with her mother’s disappearance and her own shifting sense of reality. Produced by Tijera Producciones, it builds on the company’s slate, including the award-winning short “Primera Enseñanza” and the documentary short “Leonas.” The Cuban-Brazilian directing duo describe it as a film that “works with defamiliarizing elements and atmospheres that lead us to feel the absurd within seemingly ordinary worlds.” Aria Sánchez and Marina Meira, directors of ‘Under My Head a Giraffe Sleeps,’ Courtesy of Tijera Prods. “Yara’s Light ” (“La luz de Yara”), Violena Ampudia, Spain, Cuba Hybrid documentary is produced by Estudio ST, based in Madrid and Havana. Filmed in eastern Cuba on 16mm, it gathers local mothers to explore childbirth, postpartum depression and shared memory, blending myth, archive and performance. As stories of the mythical Luz de Yara emerge, a character named Isabel walks into the mountains following a light. Estudio ST, led by Leila Montero and Daniela Muñoz, is known for festival titles including “Mafifa “and “4 Hoyos” and fosters a new generation of Cuban filmmakers. LISTEN: Andra Day on Why She Supports No Kid Hungry’s Campaign to End Childhood Hunger: ‘It’s of the Utmost Importance’ ‘Euphoria’ Creator Sam Levinson on Losing Angus Cloud, Directing Eric Dane and Having ‘No Plans’ For Season 4 ‘Gird Your Loins’: The Best ‘Devil Wears Prada’ Merch Yet Arrives Ahead of the Sequel ‘Sacred Heart’ Lands U.S. Theatrical Release Through Fathom Entertainment – Film News in Brief Kaitlin Olson Breaks Down the ‘High Potential’ Season 2 Finale: Where Morgan and Karadec Stand, Roman’s Disappearance and Is [SPOILER] Dead? Attic Fire Breaks Out at Hollywood’s Magic Castle Loading comments... More From Our Brands Rolling Stone Jimmy Kimmel Celebrates Trump Not Destroying Iran: ‘The Taco Tuesday of All Taco Tuesdays’ Robb Report Jacob & Co. Just Unveiled the World’s Fastest Tourbillon Sportico Sen. Warren Urges FCC to Shield Fans From Media Consolidation WWD Fashion Trust U.S. 2026 Awards Reveal Winners, Honor Tory Burch and Michèle Lamy",0,2026-04-08 10:13:38
