id,url,title,source,publication_date,text_length,full_text,is_duplicate,created_at
1,https://deadline.com/2026/05/victorian-psycho-maika-monroe-first-teaser-trailer-horror-1236917718/,‘Victorian Psycho’: Maika Monroe Is A Crazed Governess In First Trailer For Cannes Horror,Deadline,2026-05-21T12:17:57,1954,"Continue to Deadline SKIP AD You will be redirected back to your article in seconds Skip to main content By Andreas Wiseman Andreas Wiseman Executive Editor Of International & Co-Head Of Film @AndreasWiseman More Stories By Andreas ‘A Man Of His Time’, Starring Swann Arlaud, Earns 11-Minute Standing O At Cannes World Premiere Romance Drama ‘Prisoners Of Paradise’, Starring Ellie Bamber & Rhona Mitra, Scores North American Deal — Cannes Market Brazil’s Globoplay Joins AI-Enabled Sci-Fi Series ‘Space Nation’ — Cannes Market View All May 21, 2026 5:17am Here’s your first teaser trailer for Maika Monroe horror Victorian Psycho . Based on the novel by Virginia Feito, the synopsis reads: “When eccentric governess Winifred (Monroe) arrives at a remote gothic manor in Victorian England, her unnerving charm hides a deadly secret. Strange, unsettling incidents become harder to ignore as Winifred descends into madness, and her increasingly brutal acts shatter the calm of the estate. How far will this psycho killer go, and who will survive her wrath?” Bleecker Street has U.S. rights to the Zachary Wigon directed movie, also Jason Isaacs and Thomasin McKenzie. Bleecker Street plans to release the film nationwide theatrically in 2026. True Brit releases in UK. Pic is produced by Dan Kagan ( Longlegs ) under his Traffic banner as well as Sebastien Raybaud ( Greenland: Migration ) for Anton and Wigon, in association with Anonymous Content. EPs include Anonymous Content’s Nick Shumaker and Bard Dorros, Feito, and Bleecker Street’s Kent Sanderson and Miranda King. Anton is fully financing the film and is representing international rights. TikTok-Famous Agent To ‘Harry Potter’ Actors Mishandled Self-Tapes BBC Plots Major Poirot Series; Search On For Agatha Christie Icon Michael Bay To Direct True Story Of Mission To Save Two Downed Pilots In Iran Matt Damon In Talks To Lead Daniels’ Secret Pic In Universal Reunion Read More About: Comments",0,2026-05-21 12:20:57
25,https://www.hollywoodreporter.com/movies/movie-news/maika-monroe-cannes-victorian-psycho-trailer-premiere-film-1236603208/,Maika Monroe’s Wayward Governess Is Bloodthirsty in Gory Teaser Trailer for ‘Victorian Psycho’,Hollywood Reporter,2026-05-21T12:00:00,2325,"× Skip to main content By Lily Ford Plus Icon Lily Ford @lilyfordtweets Follow Sign Up View All May 21, 2026 5:00am Maika Monroe as Winifred Notty in 'Victorian Psycho.' Cannes Film Festival Maika Monroe is eerily bloodthirsty in a newly released teaser trailer for her latest horror, Victorian Psycho . The film — from the producers of Longlegs , the feature that solidified Monroe’s status as a Scream Queen — gets its world premiere on Thursday in Cannes’ Un Certain Regard, after The Hollywood Reporter unveiled an exclusive first look as the fest got underway earlier this month. Zachary Wigon’s period movie also stars Thomasin McKenzie, Jason Isaacs, Amy De Bhrun, Ruth Wilson, Jacobi Jupe and Evie Templeton, and will release in the fall. It adapts Virginia Feito’s 2025 novel of the same name. Related Stories Business Mixed Martial Arts Pioneer Scott Coker Plans 2027 Launch of New Global MMA League With $60M in Financing, Including From Tony Hawk Lifestyle Diego Luna, 'Andor' Star Denise Gough, Jeffrey Wright, Richard Ayoade Lend Their Voices to Liam Young's Immersive Experience 'In Other Worlds' The teaser shows Monroe playing an eccentric young governess in 1858, who arrives at the remote gothic manor, Ensor House. As she assimilates, staff begin to inexplicably disappear, and the owners wonder if something is amiss about (or possessing) the young woman. In the first-look interview, Monroe unpacked her serial killer governess, Winifred, with THR ‘s David Canfield: “It terrified me. I knew that it would be the hardest role that I have ever done — and so incredibly different from anything I’ve ever done.” She continued: “There’s always a little part of me in roles that I do, something that I can ground it with or connect it with within my own personal life — but this role was really a departure from that. It was working from the ground up, creating this character where I couldn’t rely on my own self. It really, in the most magical way, took a toll on me. I felt it every day.” Director Wigon added that he found it fascinating to see an outsider who “desperately wants to be an insider, and it’s simply impossible.” “It’s a very, very deep paradox. She will never belong — and she will never stop wanting to belong,” he told THR about Winifred. Watch the teaser for Victorian Psycho below. THR",0,2026-05-21 12:21:25
24,https://www.hollywoodreporter.com/business/business-news/new-mma-league-scott-coker-tony-hawk-2027-launch-1236600979/,"Mixed Martial Arts Pioneer Scott Coker Plans 2027 Launch of New Global MMA League With $60M in Financing, Including From Tony Hawk",Hollywood Reporter,2026-05-21T12:00:00,4425,"× Skip to main content By Georg Szalai Plus Icon Georg Szalai Global Business Editor View All May 21, 2026 5:00am Scott Coker at a Bellator press conference Courtesy of Lucas Noonan Is the mixed martial arts world ready for a new global challenger? Former Bellator boss and Strikeforce founder Scott Coker thinks so, and so does a group of strategic investors across sports, media, technology and finance providing $60 million in financial backing. So, TKO Group’s UFC, led by Dana White, and Bellator MMA will want to watch out. After nearly four decades shaping the global combat sports landscape, Coker is back to lead a new MMA league venture with funding led by investment firm Creator Sports Capital and participation from Griffin Gaming Partners and others. Additional investors include Upper Deck; Steve Kaplan, owner of D.C. United and co-founder of Oaktree Capital; Swimmy Minami, founder of Visional and a limited partner of the New York Yankees; skateboarding legend Tony Hawk; former Fortress Investment Group vice-chairman Dean Dakolias; and others, “including several with ownership stakes in both the NFL and NBA,” according to the founders. Coker will serve as co-founder and CEO of the still unnamed company, whose global debut is eyed for early 2027. Peter Levin of Griffin Gaming Partners will serve as co-founder and chairman of the board. The company’s advisory group features former TelevisaUnivision CEO and former Viacom CFO Wade Davis, former Sony Pictures Television chairman Steve Mosko, and Kevin Kay, the former president of Paramount Network, CMT, Spike TV and TV Land. The timing of the unveiling of the plans for a new MMA league comes as the sport has grown into a $20 billion-plus global market with more than 625 million fans worldwide, driven by the highly coveted male 18–34 demographic. “Yet despite that growth, professional athletes across more than 40 countries lack a clear pathway to career advancement and access to elite competition, a gap the new league is being built to close,” the founders highlighted. It wants to “set a new standard for the sport and place athletes firmly at the center of the global MMA ecosystem.” The founders pointed to Coker’s track record of discovering and developing the careers of such MMA legends as Daniel Cormier, Ronda Rousey and Gina Carano. Peter Levin (left) and Scott Coker (right), courtesy of MMA venture founders Courtesy of new MMA venture backers “I always knew I wanted to come back when the time was right, with the right vision and a carefully curated team. That time is now,” said Coker. “There is an incredible demand for a fresh, new global brand in MMA. This new league is about returning to what matters: the integrity of competition, respect for the athletes and sharing their remarkable journeys with the world. We are building something authentic, something that belongs to the athletes and to the fans who live and breathe this sport.” Levin served as both an advisor and investor in Strikeforce, which was sold to UFC in 2011. “Scott is a generational operator in the world of combat sports,” said Levin. “He has proven time and again that he can scale a business globally and profitably. His ‘fighter-first’ orientation has earned him loyalty and admiration from MMA athletes around the globe and across generations. He’s a world-beater, and I’m looking forward, yet again, to embarking on this journey together.” Levin’s sports track record also includes previously representing such MMA competitors as Randy “The Natural” Couture and Quinton “Rampage” Jackson, and investing in the likes of the World Golf Tour, Par 3 golf league Grass League , Major League Volleyball and Welsh soccer club Swansea City A.F.C. Added Benjamin Grubbs, co-founder and co-managing partner of Creator Sports Capital: “Scott Coker is one of the few operators in combat sports who has built winning franchises at a global scale, and he has done it by putting athletes first. The sport has reached a moment where a generation of world-class talent deserves a clear path to the top, and Scott has the experience, the relationships and the vision to deliver it.” The full leadership team of the new league is expected to be named in the coming weeks. Additional details, including the league name, its structure and different format, region and athlete participation, and event schedules, are also planned to be revealed in the near future. THR",0,2026-05-21 12:21:24
2,https://deadline.com/2026/05/rami-malek-cannes-man-i-love-1236917649/,Rami Malek Says “There Was A Certain Sense Of Fear” In Taking On ‘The Man I Love’ After Playing Freddie Mercury In ‘Bohemian Rhapsody’ – Cannes,Deadline,2026-05-21T11:55:33,4002,"Continue to Deadline SKIP AD You will be redirected back to your article in seconds Skip to main content By Anthony D'Alessandro Anthony D'Alessandro Editorial Director/Box Office Editor @AwardsTony More Stories By Anthony James Gray & Producers Anthony Katagas & Rodrigo Teixeira On Unleashing ‘Paper Tiger’ At Cannes Within A Year’s Time – Crew Call Podcast Pedro Almodóvar Speaks Out Against Donald Trump, Canal+ Talent Boycott At Cannes: “Worst Thing To Happen To Us Is To Stay Silent” Warner Bros Production EVP Kevin McCormick To Exit After Second Stint At Studio, Sets Producer Deal On The Lot View All May 21, 2026 4:55am CANNES, FRANCE - MAY 21: (L-R) Luther Ford, Rami Malek, Ira Sachs and Tom Sturridge pose during ""The Man I Love"" photocall at the 79th annual Cannes Film Festival at Palais des Festivals on May 21, 2026 in Cannes, France. Kate Green/Getty Images Before taking on a performing artist who is battling AIDs in 1980s New York in Ira Sachs ‘ latest Cannes feature The Man I Love , star Rami Malek said “I can’t do this, there’s too many similarities.” Similarities to his Oscar winning Best Actor role of Freddie Mercury in Bohemian Rhapsody who also suffered from AIDs. “It could be problematic,” after he read the script, “There was a certain sense of fear.” In the The Man I Love , Malek plays fictional character Jimmy George, a well-known singer and performer, in 1980s New York. He’s just survived a three-week stay in a hospital after an HIV–spell. He ventures on, rehearsing for a stage piece based on André Brassard’s 1974 film Once Upon a Time in the East , playing the stormy and defiant Hélène, who sings with a band. Related Stories News 'Fatherland' Producer Ewa Puszczyńska On Working With Paweł Pawlikowski, Poland's Growing Production Landscape & ""Finding Common Ground"" With Filmmakers News 'The Birthday Party' Clip: First Look At Monica Bellucci In Cannes Palme D'Or Contender Unveiled Set against the 1980s New York, at the peak of Ronald Regan’s America reactionary homophobia, the movie doesn’t focus on the dark side of Jimmy’s struggle with AIDs rather his desire to keep moving, to be unapologetically alive and energized to give all you have left to art. Watch on Deadline Dissecting what concerned him about the connection between Freddy Mercury and Jimmy George, Malek pondered, “was it the singing? Was it what was going on in the period. I knew I had to address the fear. If there was anything that Freddie taught me it was to address the fear. If there’s anything I learned from Ira (Sachs) is that he makes unique cinema unlike any other, and I knew I was in extraordinary hands. If He was choosing me, I could rely on him, not only to depend on him throughout the film, but to elevate it, to push myself, to force myself to race into that fire. When I raced into, I started to discover that these were men who were similar, but they were also worlds apart.” “You have an icon, a legend in Freddie who really had a destination whereas Jimmy is just searching for creativity, and love and intimacy and joy in every moment. Does he sing as well as Freddie, no.” “Was he ever going to be perfect? He didn’t have to be. It was just about this element of creating, and living and joy and New York in that period was a very different time.” “I see them as two radically different figures altogether,” said Malek about Freddie Mercury and Jimmy George. The Man I Love , out of the gate here at Cannes, is already generating Oscar buzz again for Malek. Mubi has the pic offshore, with U.S. up for grabs. The Man I Love earned a ten-minute standing ovation at its world premiere last night. Sachs was here at Cannes previously with 2019’s Frankie. TikTok-Famous Agent To ‘Harry Potter’ Actors Mishandled Self-Tapes BBC Plots Major Poirot Series; Search On For Agatha Christie Icon Michael Bay To Direct True Story Of Mission To Save Two Downed Pilots In Iran Matt Damon In Talks To Lead Daniels’ Secret Pic In Universal Reunion Read More About: Comments",0,2026-05-21 12:20:59
14,https://variety.com/2026/film/global/netflix-bad-bridgets-emilia-jones-alison-oliver-1236701512/,"Netflix Snaps Up ‘Bad Bridgets,’ Irish Period Thriller Starring Emilia Jones and Alison Oliver From ‘Kneecap’ Director (EXCLUSIVE)",Variety,2026-05-21T11:43:47,3166,"Continue to Variety SKIP AD You will be redirected back to your article in seconds May 21, 2026 4:43am PT Netflix Snaps Up ‘Bad Bridgets,’ Irish Period Thriller Starring Emilia Jones and Alison Oliver From ‘Kneecap’ Director (EXCLUSIVE) By Alex Ritman , K.J. Yossman Getty “Bad Bridgets” the Irish period thriller that was one of the buzziest projects to launch at last year’s American Film Market, has found a home. Netflix will release the film, which will be led by Emilia Jones (“CODA,” “Task”) and Alison Oliver , globally. Oliver, who has starred in “Saltburn” and “Wuthering Heights,” recently replaced Daisy Edgar-Jones, who was originally attached to play opposite Jones. Related Stories 'Another Day’ Review: Adèle Exarchopoulos Gives an Understated and Deeply Lived-In Performance in Jeanne Herry’s Graceful Alcoholism Drama 'Think Good' Review: French Canadian Thesp Monia Chokri Convinces as a Jewish Wife Trapped in a Toxic Relationship From writer-director Rich Peppiatt , who won a BAFTA for his acclaimed directorial debut “Kneecap,” the film is being produced by Margot Robbie’s LuckyChap Entertainment. It was inspired by the book “Bad Bridget: Crime, Mayhem, and the Lives of Irish Emigrant Women” by Elaine Farrell and Leanne McCormick. Popular on Variety Set in the 19th century against the backdrop of a famine-ravaged Ireland, the story focuses on two sisters who make a treacherous journey to America to escape an abusive father, poverty and hunger. Once in New York, they join the ranks of other Irish women, the so-called “Bridgets,” creating mayhem in the city. The book was optioned by Peppiatt and his “Kneecap” producer Trevor Birney in 2025, with the two producing alongside LuckyChap for their Coup d’Etat Films banner, which launched in 2024. “Bad Bridgets” will shoot in Northern Ireland and Ireland later in 2026. Oscar-winning production designer James Price and costume designer Kate Hawley are on board. The film was developed with the support of Queens University, Belfast. FilmNation launched the package to international buyers at the AFM, with WME Independent repping for the U.S. Michael Pennington, ‘Star Wars: Return of the Jedi’ Actor, Dies at 82 ‘No Harrison Ford’: Disneyland’s New Han Solo Debuts at Galaxy’s Edge and Gets Roasted by Fans for ‘Worst Wig Ever’ and More ‘Star Wars’ Writer’s Scripted Hollywood Satire Podcast ‘See You in Hell’ Takes on AI in Timely New Episode ‘Star Wars’ and ‘Fortnite’ Unleash Three New Islands, Including a Horror Game Featuring Darth Vader Ian McKellen Says Obi-Wan Kenobi Actor Alec Guinness Told Him to Stay Quiet on Gay Rights Because ‘It’s Unseemly for an Actor to Dabble in Political Affairs’ Damon Lindelof Reveals Why He Was Fired From Star Wars Movie: Story Was the ‘Protestant Reformation Inside Star Wars’ Loading comments... More From Our Brands Rolling Stone Jeff Probst Accidentally Spoils a Major Part of ‘Survivor’ Finale Robb Report This New 131-Foot Explorer Yacht Concept Brings Elegance to Long-Range Expeditions Sportico Athlos, Ohanian’s Women-Only Track Meet, to Expand to London WWD Authentic Brands Group to Acquire Lee in a Deal Valued at Up to $1 billion",0,2026-05-21 12:21:13
