id,url,title,source,publication_date,text_length,full_text,is_duplicate,created_at
46,https://www.hollywoodreporter.com/movies/movie-news/project-hail-mary-daniel-pemberton-1236546310/,‘Project Hail Mary’ Filmmakers Had a Radical Idea for Composer Daniel Pemberton,Hollywood Reporter,2026-03-24T23:11:00,10667,"× Skip to main content By Byron Burton Plus Icon Byron Burton byronsburton Follow Sign Up View All March 24, 2026 4:11pm Project Hail Mary composer Daniel Pemberton Kate Green/Getty Images Logo text When filmmakers Phil Lord and Chris Miller first called Daniel Pemberton about Project Hail Mary , the conversation started with wood blocks. Not metaphorically — literally. The directing duo had an idea that the entire film could be scored on a single percussion instrument. Pemberton loved the spirit of it. He also told them, with his characteristic directness, that it probably wouldn’t sustain a two-and-a-half-hour film. That exchange says something about how this particular creative partnership works. And why it keeps producing results. Related Stories Movies Ryan Gosling's 'Project Hail Mary' Curling Cardigan Goes Viral Movies 'Project Hail Mary' Offers 4 Lessons Hollywood Should Learn -- But Won't Andy Weir had already proven that his brand of rigorously researched, deeply human science fiction could fill a movie theater. The Martian , his debut novel adapted by director Ridley Scott in 2015 with Matt Damon, grossed over $630 million worldwide and earned seven Academy Award nominations. When Project Hail Mary was still in manuscript form, Ryan Gosling moved quickly, acquiring the rights from Weir to star in and produce the sci-fi adaptation. Lord and Miller, the creative duo behind The Lego Movie , the Jump Street franchise and the Spider-Verse films, came aboard to direct while Drew Goddard, who had written The Martian screenplay, returned to adapt Weir’s latest work. Project Hail Mary follows Gosling as Ryland Grace, a science teacher who appears in the film’s early scenes addressing his students about a fast-growing solar drainage crisis, intercut with that same teacher aboard a spacecraft light years from Earth with no memory of how he got there. Where The Martian split its narrative tension between a stranded astronaut and the team scrambling to reach him, Project Hail Mary turns that structure inward, with Grace’s returning memory serving as the mission control, gradually assembling the stakes around him. Sandra Hüller co-stars as Eva Stratt, the international project director who put Grace on the ship in the first place, while James Ortiz oversaw the puppetry for the alien Rocky, and provided the voice as well. Pemberton was no stranger to the world of Lord and Miller, having scored both 2018’s Spider-Man: Into the Spider-Verse and 2023’s Across the Spider-Verse for the duo as producers. He also scored their Apple TV+ genre-hopping series The Afterparty . But Project Hail Mary’s gravitational pull brought Pemberton deeper into the process than their prior collaborations. Pemberton relocated to Los Angeles, writing beside the editing suite as Lord and Miller refined their cut again and again. A composer who has never stayed in one genre long enough to be defined by it, Pemberton spoke with The Hollywood Reporter to discuss the score’s unlikely sonic building blocks, the eight-minute cue that contains every musical idea in the film, and what to expect when he shifts from scoring the saviors of the universe to the Masters of the Universe . Your working relationship with Phil Lord and Chris Miller has covered a lot of ground, the Spider-Verse films, The Afterparty , and more. But this is the first feature they’ve directed with you scoring. How did those early conversations go? I got involved quite early, reading the script and writing ideas that got played on set with Ryan (Gosling). Making the score feel very organic through the prism of space meant finding ways to connect the audience to the Earth and to humanity. We recruited a bunch of school kids to Abbey Road Studios and recorded them clapping, stamping their feet, slapping things, etc. We also used voices and manipulated some electronically, trying to emulate the “making it up as you go along” spirit of the film. Ryland Grace’s improvisational techniques to save the planet is kind of the way I tried to take the score. The choir almost sounded like you were creating your own language, and communication is such an important aspect of the film. What exactly are we hearing there? We did a lot of experimentation early on with vocals and vocal ideas. For some of those, we built very unusual kinds of electronic instruments that gave me the power to be expressive in a way that was quite unique and hadn’t really been done. I would merge synthetic voices with real voices. I wanted something that connected Ryland and Rocky. Because Rocky is from this other planet and his communication is different, I wanted a sound world that subconsciously would connect you to this otherworldly being and illustrate how the communication between them is so important. And how communication between all of us is incredibly important in terms of connection. There’s a thing called a cristal baschet, which is this old instrument from the ’40s and ’50s, all made of glass, that you play with water. That’s a big part of the score. We were trying to create this orchestra that was not a traditional orchestra. Project Hail Mary Jonathan Olley/Amazon Content Services I’m thinking about Ryland Grace pre-mission, with his memories intact and an arguably cowardly approach to life, contrasting with the Ryland we meet at the beginning in space, with missing memories and an admirable ability to roll up his sleeves. Thematically, how did you use music to separate those two versions of him? Ryland changes, as you know, through the movie. When Rocky starts to arrive, that element of the score also arrives. So Rocky, in the same way that he brings his own personality and outlook into the story, also brings a different sonic outlook and melodic outlook. Once they start communicating, the score actually starts going in a new direction, more of these unusual voices. Early on in the film those voices are there, but they’re sparing, then they really come to life after that first connection. We call it the “cat and mouse sequence,” the bit where Rocky’s trying to send the message to Ryland. Ryland and Rocky’s journey into the upper atmosphere as part of their mission has an intensity that lingers in the audience’s chest . When you’re tasked with writing a cue dealing with that much emotional pressure and tension, while balancing sound design and effects, how do you find the balance? You’re talking about the “fishing trip.” That’s a huge piece. That’s like eight minutes long and it’s quite unlike the rest of the film in some ways, in terms of its dramatic intensity. That is a great example of our intentions with the film, because that cue starts with a single wood block. There’s nothing else at the beginning of that cue, just one wood block being hit over and over again. From that one wood block, it builds and builds and it never stops. The idea behind that is it locks the audience into this tension. And the audience might not even realize it, but they need the release of this sequence and we don’t ever give it to them, which makes it so intense. That cue has every single musical idea I put in this film. It’s got kids’ percussion, it’s got electric cello, it’s got cristal baschet, it’s got glass harmonica, it’s got orchestra, it’s got millions of weird bits of percussion. This score has everything. I used to joke that this film score has every single sound in it except the kitchen sink, but we do actually have that in this film. One of the earliest sounds I made was a squeaky tap. I was around a friend’s very nice, big house in the countryside, very old, very creaky pipes. I was like, “Oh my God, this is the most amazing, unusual sound.” I wanted to create a language that was very organic and water-based, so I sampled it and turned it into an instrument, because of the organic, unstable nature of that sound. Was there a particular cue you kept tinkering with as the cut evolved? I don’t think I’ve ever been on a film where we revisited more sequences than this movie. Every sequence in the film we revisited. I was on this film for a very, very long time. I ended up pretty much living in the edit. I went to L.A. and was writing next to the edit room for quite a long time, because it allowed us to push every idea and boundary to see what would work and what wouldn’t. One of my favorite bits, one I always felt very protective of, is when Ryland turns on the Astrophage collector on the space walk. He presses the button and then he goes into the stars with all the red. I thought it was such a beautiful visual sequence. I was like, “You’ve got to let me do something for that, because this is going to be a very powerful, cinematic IMAX moment.” Would you say this is the most challenging score of your career, even accounting for the Spider-Verse productions? It’s definitely the most challenging, most complicated score I think I’ve ever done. It’s interesting when you’ve got a film that is about language and communication, and the ambition in the scoring is to also create a new process with different instruments and different techniques. That involves a huge amount of experimentation, a huge amount of failure, and a huge amount of discovering weird bits of gold. At one point I was really keen on trying to do a huge amount on steel drums, because I wanted stuff that was very organic, metal that was reflective of the spaceship. And it worked, but only to a certain level. There are tons of tests and things that got binned, but out of each of those experimentations we’d find a little nugget of gold. And that gold would go on the pile and become part of the score writing approach. When Ryland finds out it might not be a one-way trip, the emotion plays on his face with such intensity amid the quietness, and then you marry that with score. Can you talk about the arc of that scene? When I’m scoring a movie, if there’s an option to try and make people cry, I zero in on that moment and spend so much time trying to work out how to get it to the most effective that it can be. It’s really fascinating to see how emotions can be pulled out of an audience. You can just raise the volume a tiny bit or bring it down. You can make these tiny little tweaks and it can have a huge difference. Is originality a north star for you when you’re looking at potential projects? Wait until you see Masters of the Universe , which is also fantastic. It’s really going to surprise people. I’m just finishing that up at the moment, and even though it’s an IP, the director Travis Knight has been fantastic and we’ve got something really, really fun. I think it invokes the most fun you can have at a cinema. THR",0,2026-03-25 10:00:49
47,https://www.hollywoodreporter.com/tv/tv-news/the-pitt-noah-wyle-london-season-3-kpop-demon-hunters-1236545076/,"‘The Pitt’ Star Noah Wyle Calls for Universal Health Coverage in U.S., Talks Season 3 and Explains Why the Hit Show “Could Run Forever”",Hollywood Reporter,2026-03-24T22:44:11,5545,"Skip to main content By Georg Szalai Plus Icon Georg Szalai Global Business Editor View All March 24, 2026 3:44pm 'The Pitt' chat after a screening in London, with HBO boss Casey Bloys (left) talking to show star and executive producer Noah Wyle (right) Courtesy of David Jon for HBO Max Logo text The Pitt , HBO Max’s widely lauded hit series that has repeatedly mirrored reality, including a recent timely season 2 ICE storyline , got the London spotlight on Tuesday evening. Tied to Thursday’s U.K. and Ireland launch of Warner Bros. Discovery (WBD) streamer HBO Max, the first episode of the medical procedural screened in central London, followed by a discussion between HBO and HBO Max chief Casey Bloys and The Pitt star and executive producer, and former ER actor, Noah Wyle . Created by R. Scott Gemmill, the series stars Wyle as Dr. Michael “Robby” Robinavitch, who leads an understaffed, underfunded emergency room set in Pittsburgh. The show has developed a reputation for accurately portraying the world of healthcare workers and having its fair share of episodes that closely resemble what is happening in the real world. Related Stories Movies Hong Kong Action Film 'The Furious' Releases Brutal First Trailer TV Disney+ Sets Big-Budget Korean Remake of 'The Americans' Starring Lee Byung-hun, Han Ji-min Coinciding with the launch of HBO Max in the U.K., The Pitt will begin streaming in the market on Thursday, March 26, with all episodes of season 1 and much of season 2, which is still rolling out in the U.S., dropping at once. The streamer will be available in the U.K. directly via its URL, as well as via launch partners Sky and Prime Video. On Tuesday evening, Wyle expressed his hope that the series would also touch a nerve in the U.K., despite the country’s healthcare system being different from that in the U.S., making it “frustrating for totally different reasons.” About the U.S., the star said: “Our system at the moment is laden with the insurance companies being the intermediary … and care being predicated by the algorithm that the insurance company dictates. So it’s really become a profit-driven, quality-of-care-diminishing system. And I think it’s really enviable that that’s not part of your conversation” here in the U.K., where the National Health Service, or NHS, is the publicly funded system that provides comprehensive free care. Concluded Wyle: “I personally think we need some sort of national healthcare service in the United States. We need universal coverage for everybody.” The star and executive producer also discussed how The Pitt takes audiences inside the E.R. “Everything is geared towards it being a voyeuristic experience for the viewer, kind of analogous to being in the back seat of a patrol car going on a ride-along, or being embedded with a combat unit in battle,” he explained. “And it’s an endurance test on the viewer, just like it is on the characters. So that makes it an interesting relationship.” He continued: “We’re working in real time, shooting 360 degrees. It’s very kinetic, it’s very active, and it’s the closest to doing live theater that you can work with a camera.” Wyle also shared on Tuesday evening in London that “one of the gratifying things about season two is that we realized that we don’t need a big deus ex machina plot device to keep this engaging, that there is something really fascinating about watching everyday people try to get through the course of their day, beset by all the trials and tribulations that come over the course of their day.” And he offered: “If that is satisfying television, then this show could run forever.” The medical drama is produced by John Wells Productions with Warner Bros. TV. Gemmill, Wyle and John Wells executive produce alongside JWP’s Erin Jontow, Joe Sachs, Simran Baidwan and Michael Hissrich. The Pitt returned to HBO Max in the U.S. almost exactly one year after it premiered, with new episodes of the 15-episode season dropping weekly ahead of the April 16 finale. The first season of The Pitt won five Emmys , including for best drama series, best actor for Wyle and best supporting actress for Katherine LaNasa . The hit medical drama was renewed for season three ahead of its season two premiere. Bloys asked Wyle about the status of season 3, saying: “You are writing season three right now, and then you’ll start producing. Talk a little bit about the process for coming up with the season. … When will it get on its feet?” Replied Wyle: “Very soon, boss. We are in the process of writing character arcs for season three for everybody. It’s a very interesting show to break because, unlike a lot of shows where there are 22 episodes that may play out over a calendar year, this is 15 hours of one day. So you’re painting with a much finer brush. For a character’s arc, it’s not really enough to go through the courtship of a romance, but it’s enough to get your head turned. These are really small arcs that happen in the course of a day, but can be really satisfying if you’re engaged with that character.” Bloys also asked Wyle about his medical instincts after playing a doctor for 23 years, only for the star of The Pitt to share how he helped KPop Demon Hunters producer Michelle Wong at the Critics Choice Awards . “She slipped out of her SUV and hit her head on the ground really hard, and I was the only one around,” Wyle recalled, before quipping that “delusion kicked in.” Concluded the star: “She had a little cut on her elbow. Somebody handed me a Band-Aid, and I felt very medical.” THR",0,2026-03-25 10:00:50
27,https://deadline.com/2026/03/page/2/,More Stories,Deadline,2026-03-01T00:00:00,7585,"Skip to main content Dismiss News Banner Breaking News Stephen Colbert Set To Write Next ‘Lord Of The Rings’ Movie After Forthcoming ‘The Hunt For Gollum’ Read the full story Latest in Alan Ritchson Won’t Face Criminal Charges & Isn’t Pursuing Charges Following Bike Bust-Up, Says Tennessee Police Reacher star Alan Ritchson won’t face criminal charges and isn’t pursuing charges in relation to a well-publicized incident over the weekend in which the actor was involved in a violent confrontation, according to the Brentwood Police Department of Tennessee. The police unit told us in a… By Andreas Wiseman Mar 24, 2026 3:11 pm Print Print Alan Ritchson Won’t Face Criminal Charges & Isn’t Pursuing Charges Following Bike Bust-Up, Says Tennessee Police Read the full story TV Documentary+ Acquires TIFF Hit ‘Still Single’ About “Sushi Superstar” Masaki Saito EXCLUSIVE: Documentary+, the nonfiction content streaming platform available around the world, has acquired global rights to culinary-themed Still Single . The documentary about ""sushi superstar"" Masaki Saito, owner of the namesake Michelin two-starred restaurant in Toronto, will premiere on… By Matthew Carey Mar 24, 2026 3:09 pm Print Print Documentary+ Acquires TIFF Hit ‘Still Single’ About “Sushi Superstar” Masaki Saito Read the full story Exclusive Film Aunjanue Ellis-Taylor Joins CBS Series ‘Einstein’ As Series Regular Oscar nominee Aunjanue Ellis-Taylor ( King Richard, Justified: City Primeval) has joined the cast of Einstein , the new CBS drama series starring Matthew Gray Gubler and Melissa Fumero. The series joins CBS' 2026-27 broadcast season and is currently in production. In a series regular role… By Rosy Cordero Mar 24, 2026 3:00 pm Print Print Aunjanue Ellis-Taylor Joins CBS Series ‘Einstein’ As Series Regular Read the full story TV Meta Ordered To Pay $375M In New Mexico Social Media Verdict; L.A. Jury Still Deliberating After A Week UPDATED with Meta statement: After a week of deliberations, jurors in the Los Angeles social media trial are still having a hard time coming to a decision, but a New Mexico panel swiftly found Meta was negligent in protecting minors from predators on its various platforms. The verdict reached… By Dominic Patten Mar 24, 2026 2:51 pm Print Print Meta Ordered To Pay $375M In New Mexico Social Media Verdict; L.A. Jury Still Deliberating After A Week Read the full story Business ‘John Wick’ Spinoff About Blind Assassin Caine Gearing Up Production Under Donnie Yen’s Direction EXCLUSIVE: Lionsgate’s John Wick spinoff, the untitled Caine project which will see Donnie Yen directing and reprising his role as the blind assassin, will begin production next month, we understand. The project, which was announced at CinemaCon last spring , will follow Caine's story in the… By Anthony D'Alessandro Mar 24, 2026 2:49 pm Print Print ‘John Wick’ Spinoff About Blind Assassin Caine Gearing Up Production Under Donnie Yen’s Direction Read the full story Exclusive Film Marcia Ann Burrs Dies: Hallmark’s Mrs. Claus, Actor On ‘Young Sheldon’, ‘Mad Men’, ‘It’s Always Sunny In Philadelphia’ Was 85 Marcia Ann Burrs, a veteran character actor whose many TV appearances included stints as Mrs. Claus in two Hallmark Christmas TV-movies and, in a memorable episode of It’s Always Sunny In Philadelphia , the long-ago high school girlfriend of Danny DeVito’s Frank Reynolds, died Sunday, March 22, in… By Greg Evans Mar 24, 2026 2:47 pm Print Print Marcia Ann Burrs Dies: Hallmark’s Mrs. Claus, Actor On ‘Young Sheldon’, ‘Mad Men’, ‘It’s Always Sunny In Philadelphia’ Was 85 Read the full story TV Disney’s $1B Investment In OpenAI DOA As Sam Altman Pulls Sora Plug: “The Deal Is Not Moving Forward” Disney’s much heralded $1 billion investment in OpenAI is over as the Sam Altman-led tech giant said Tuesday that it will be shuttering its stand-alone Sora text-to-video app. “The deal is not moving forward,” a Disney insider told Deadline of the agreement then-House of Mouse CEO Bob Iger reache… By Dominic Patten Mar 24, 2026 2:04 pm Print Print Disney’s $1B Investment In OpenAI DOA As Sam Altman Pulls Sora Plug: “The Deal Is Not Moving Forward” Read the full story Business ‘The Real Housewives Of New Jersey’ Season 15 Renewed At Bravo With Teresa Giudice, Melissa Gorga & Dolores Catania The Garden State is about to bloom again this spring as Bravo has renewed The Real Housewives of New Jersey for Season 15. After almost two years off the air, RHONJ will pick up cameras again this spring with Teresa Giudice, Melissa Gorga, and Dolores Catania set to return. The reality… By Armando Tinoco Mar 24, 2026 1:56 pm Print Print ‘The Real Housewives Of New Jersey’ Season 15 Renewed At Bravo With Teresa Giudice, Melissa Gorga & Dolores Catania Read the full story TV Doc Talk Podcast Covers Thessaloniki Documentary Festival In Greece: Tête-À-Tête With Juliette Binoche And Head Of Program Yorgos Krassakopoulos It took a lot of guts for Academy Award winner Juliette Binoche to create a dance and theater piece that called for her to perform strenuous and complicated choreography in front of a live audience for over an hour. After all, she embarked on the project — co-created with dancer-choreographer Akram… By Matthew Carey Mar 24, 2026 1:51 pm Print Print Doc Talk Podcast Covers Thessaloniki Documentary Festival In Greece: Tête-À-Tête With Juliette Binoche And Head Of Program Yorgos Krassakopoulos Read the full story Film Oliver Stone & Josh Hartnett Underway On ‘White Lies’, Director’s First Movie Drama In A Decade: “I Feel Really Like I’m Starting Again, As When I Made ‘Platoon’ And ‘Salvador’ In 1986” Three-time Oscar winner Oliver Stone is underway on new movie White Lies , which marks his first narrative feature in a decade. Josh Hartnett ( Oppenheimer ) stars in the movie, which Deadline can confirm and reveal more details about today. The Platoon , Born On The Fourth Of July and JFK director… By Andreas Wiseman , Justin Kroll Mar 24, 2026 1:00 pm Print Print Oliver Stone & Josh Hartnett Underway On ‘White Lies’, Director’s First Movie Drama In A Decade: “I Feel Really Like I’m Starting Again, As When I Made ‘Platoon’ And ‘Salvador’ In 1986” Read the full story Film Why Anti-Trust Regulators Should Reject WBD-Paramount Skydance Link-Up: Guest Column EDITOR’S NOTE : After his recent column on theatrical windows contributed to Universal's decision to preserve the 45-day window between theaters and the ancillary waterfall, Deadline asked Joseph M. Singer to weigh in on the continuing efforts by Paramount owners David and Larry Ellison to get the… By Joseph M. Singer Mar 24, 2026 12:46 pm Print Print Why Anti-Trust Regulators Should Reject WBD-Paramount Skydance Link-Up: Guest Column Read the full story Business BTS Comeback Concert Scores 13.1M Views Through Sunday On Netflix; ‘Peaky Blinders’ Movie Debuts At No. 1 For Film BTS made their comeback Saturday, performing for live the first time in four years in Seoul, South Korea. Luckily, it was streaming on Netflix for the fans across the world who couldn’t be there, and within just over a day had racked up 13.1M views. That put it at No. 1 on the non-English TV… By Katie Campione Mar 24, 2026 12:18 pm Print Print BTS Comeback Concert Scores 13.1M Views Through Sunday On Netflix; ‘Peaky Blinders’ Movie Debuts At No. 1 For Film Read the full story Music Previous page of stories Previous Next page of stories Next Sidebar Newswire PMC Deadline is a part of Penske Media Corporation. © 2026 Deadline Hollywood, LLC. All Rights Reserved. Powered by WordPress.com VIP Site",0,2026-03-25 10:00:28
