id,url,title,source,publication_date,text_length,full_text,is_duplicate,created_at
24,https://www.hollywoodreporter.com/tv/tv-news/sony-pictures-television-img-licensing-breaking-bad-show-1236629350/,"Sony Pictures Television, IMG Licensing to Develop Global Licensing Program for Entire ‘Breaking Bad’ Franchise (Exclusive)",Hollywood Reporter,2026-06-25T11:00:00,2760,"× Skip to main content By Lily Ford Plus Icon Lily Ford @lilyfordtweets Follow Sign Up View All June 25, 2026 4:00am Bryan Cranston in 'Breaking Bad' Ursula Coyote/© AMC /Courtesy Everett Collection IMG Licensing and Sony Pictures Television will team up to develop a global licensing program for the Breaking Bad franchise. The Hollywood Reporter can reveal that the multi-year collaboration will deliver consumer products, brand partnerships and immersive fan experiences worldwide — all themed to one of the biggest television shows in history that saw Bryan Cranston’s Walter White turn to making and selling meth following a terminal cancer diagnosis. The licensing deal will span the entire franchise, including the flagship, Emmy-winning series, which ran from 2008 to 2013, as well as prequel spinoff Better Call Saul (2015-2022) and the 2019 feature film El Camino with returning star Aaron Paul. Related Stories TV Ricky Gervais Pitches Animation Debut 'Alley Cats' at Annecy Masterclass: ""I Could Make This Forever"" Movies Virginie Efira to Receive Locarno Leopard Club Award IMG Licensing will work closely with Sony Pictures Television and series creator Vince Gilligan to “identify strategic partners across key categories including premium apparel, collectibles, food and beverage, home decor, travel, publishing, and experiential activations.” The program will target major markets globally, focusing on collabs that will resonate with long-time fans, while simultaneously introducing the franchise to new audiences. “ Breaking Bad , Better Call Saul , and El Camino represent one of the most acclaimed bodies of work in television history, with a fanbase that’s as devoted as any in the medium,” said Jennifer Rogers Doyle, executive vice president of franchise at Sony Pictures TV. “IMG Licensing’s track record of building programs that truly reflect what fans love about a great story makes them the right partner to bring this universe beyond the screen in ways that feel authentic to what Vince Gilligan created,” she added. The deal marks the first time Sony has appointed an external licensing agency to develop a global licensing program for the franchise. They join a slew of other entertainment brands to have tapped IMG Licensing in the past year, including StudioCanal, Sarah J. Maas , and The Little Prince. “We are honored to be expanding the Breaking Bad universe through meaningful collaborations and products,” said Desmond Sansevere, vice president, IMG Licensing. “From once-in-a-lifetime characters like Walter White, Jesse Pinkman, and Saul Goodman, to iconic moments that have shaped both television and popular culture, this franchise has firmly cemented its place in the cultural zeitgeist for generations to come.” THR",0,2026-06-25 11:45:00
3,https://deadline.com/2026/06/viqueens-teaser-viking-ella-purnell-rita-ora-erling-haaland-1236967140/,"‘ViQueens’ Teaser: Animated Viking Drama Featuring Ella Purnell, Rita Ora & Norway Soccer Star Erling Haaland Unveiled In Annecy",Deadline,2026-06-25T11:00:00,4172,"Skip to main content By Melanie Goodfellow Melanie Goodfellow Senior International Film Correspondent @mel_goodfellow More Stories By Melanie SS Rajamouli Heads To Annecy For ‘Baahubali: The Eternal War’ WIP Event At Start Of European Tour Netflix Sets Release Date For Brad Bird’s ‘Ray Gunn’; Unveils Clip, Images For Sam Rockwell & Scarlett Johansson-Voiced Protagonists – Annecy Netflix Unveils ‘Ghostbusters: Night Shift’ First Look, Concept Art, Logline, Characters & Clip – Annecy View All June 25, 2026 4:00am EXCLUSIVE: Dutch-Norwegian director Zwart Arbeid gave a sneak peek of his upcoming animated feature ViQueens in a masterclass at the Annecy International Animation Film Festival on Thursday, and Deadline can share the teaser exclusively too. Co-starring Ella Purnell and Rita Ora in the voice cast, with a special appearance by global soccer superstar Erling Haaland, the adventure-comedy follows fearless Viking girls Ingrid and Hedvig as they defy tradition to return a stowaway boy to China. Their journey spans icy fjords, Byzantine intrigue, and the fabled Silk Road, blending Viking grit with ancient Chinese wisdom, unexpected alliances, and a touch of magic. Related Stories News SS Rajamouli Heads To Annecy For 'Baahubali: The Eternal War' WIP Event At Start Of European Tour Festivals Netflix Unveils 'Ghostbusters: Night Shift' First Look, Concept Art, Logline, Characters & Clip - Annecy The teaser launch coincides with a special Annecy masterclass presented by Zwart ( The Karate Kid , The Mortal Instruments ) and producer Veslemøy Ruud Zwart, sharing the creative journey behind the making of the film and unveiling an innovative production methodology they developed called “Reference Capture.” Designed to bridge the gap between live-action filmmaking and animation, Reference Capture combines performance, cinematography, and physical staging early in the creative process, providing animators with a rich visual and emotional foundation for storytelling, with every frame still being animated and no AI being used. “From the beginning, we wanted ViQueens to feel as emotionally authentic and cinematically grounded as a live-action film while retaining all the imagination and scale that animation makes possible,” said Zwart. “Reference Capture allowed us to bridge those worlds by capturing real performances, camera language, and physicality early in the process, giving our artists a richer foundation from which to build the film’s animated universe.” The film features an original score by acclaimed composer Christophe Beck, whose iconic work on Disney’s Frozen and Frozen II has resonated with audiences around the world and helped define a generation of animated storytelling. Joining Purnell, Ora, and Haaland in the voice cast are Steve Speirs as King Erik, Anton Lesser as the scheming Lars, and Alan Carr as the Bard, an overly enthusiastic royal scribe. “The teaser is our first opportunity to invite audiences into the world of ViQueens ,” said producer Veslemøy Ruud Zwart. “It captures the humor, heart, adventure, and cinematic scope of the film while showcasing a new approach to animation production that has been central to bringing this story to life.” Animation and visual effects for ViQueens are being produced by Gimpville, with post-production and audio services provided by OPCM both out of Norway. The film is executive produced by Torgeir Sanders of Gimpville ( Troll , Troll Hunter ), Robert Chandler of Space Age Films ( The Amazing Maurice , The Canterville Ghost ), Peter Clausen of OPCM ( Lilyhammer , Jo Nesbø’s Harry Hole , Troll , Billionaires Island ), Andrew Williams of Vamonos , Rasmus Ramstad of Rumba AS, and Solveig Langeland of Sola Media, which is also handling worldwide sales. The film is slated for delivery in late 2026, with a home territory release planned for December 25, 2026. Sky & ITV Agree Terms Over $2.1B Deal, Anno Imminent: Report James Bond Search Heats Up As Producers Target Actors, Set New Auditions ‘Supergirl’ Review: DC’s Latest Superhero Pic Doesn’t Fly High Enough ‘Toy Story 5’ Won’t Play Nice With ‘Supergirl’, Eyes Win With Near-$90M Read More About: Comments",0,2026-06-25 11:44:36
4,https://deadline.com/2026/06/ricky-gervais-enthusiastic-response-alley-cat-1236967183/,"Ricky Gervais Receives Enthusiastic Response For Expletive-Filled, Riotously Politically Incorrect Yet Philosophical Netflix Animation ‘Alley Cats’ – Annecy",Deadline,2026-06-25T10:12:32,2662,"Skip to main content By Melanie Goodfellow Melanie Goodfellow Senior International Film Correspondent @mel_goodfellow More Stories By Melanie SS Rajamouli Heads To Annecy For ‘Baahubali: The Eternal War’ WIP Event At Start Of European Tour Netflix Sets Release Date For Brad Bird’s ‘Ray Gunn’; Unveils Clip, Images For Sam Rockwell & Scarlett Johansson-Voiced Protagonists – Annecy Netflix Unveils ‘Ghostbusters: Night Shift’ First Look, Concept Art, Logline, Characters & Clip – Annecy View All June 25, 2026 3:12am Alley Cats, Ricky Gervais Netflix, Getty Images Ricky Gervais touched down at the Annecy International Animation Festival on Thursday for a sneak peek presentation of his Netflix adult animation Alley Cats , following the trials and tribulations of a group of British cats from all walks of society. He got a hero’s welcome as he entered the festival’s packed out 1,400-capacity main Bonlieu theatre and was then serenaded with a raucous rendition of “Happy Birthday” marking his turning 65 today. As well as writing and directing the show, Gervais reprises his trademark deadpan self as ginger tomcat Gus, alongside Tom Basden, Andrew Brooke, David Earl, Kerry Godliman, Jo Hartley, Diane Morgan, Natalie Cassidy and Tony Way in the voice cast. Related Stories News Netflix's 'Dept. Q' Adds New Cast & Rolls Cameras On Season 2 Executives Netflix Moves Adult Animation Back Under Head Of Comedy Tracey Pakosta The presentation kicked off with a preview of the first two episodes of the show introducing Gus and his motley crew of stray cats, who are joined each day by a posh domesticated cat called Ponce. Watch on Deadline Tapping into the zeitgeist of a down-at-heel broken Britain, the cats spend their days watching nature programs and musing on a range of out-of-the-hat topics from the complications of cat suicide, when you have nine lives and always land on your feet, to the etiquette of crapping on a freshly dug grave plot. Gervais told the audience in an Q&A following the screening that the show was a continuation of his process and work across The Office , Extras and After Life , transposing his observations of life into drama, and also tapped into his love of animals. “I’ve loved animals all my life.. cats they’re just sort of perfect creatures. They’re so independent, they’re so tiny, and think they’re lions,” he said. Sky & ITV Agree Terms Over $2.1B Deal, Anno Imminent: Report James Bond Search Heats Up As Producers Target Actors, Set New Auditions ‘Supergirl’ Review: DC’s Latest Superhero Pic Doesn’t Fly High Enough ‘Toy Story 5’ Won’t Play Nice With ‘Supergirl’, Eyes Win With Near-$90M Read More About: Comments",0,2026-06-25 11:44:37
25,https://www.hollywoodreporter.com/tv/tv-news/ricky-gervais-netflix-series-alley-cats-animation-annecy-1236630430/,Ricky Gervais Pitches Animation Debut ‘Alley Cats’ at Annecy Masterclass: “I Could Make This Forever”,Hollywood Reporter,2026-06-25T10:08:32,2333,"× Skip to main content By Scott Roxborough Plus Icon Scott Roxborough Europe Bureau Chief sroxborough Follow Sign Up View All June 25, 2026 3:08am A still from Netflix's 'Alley Cats' trailer. Netflix Ricky Gervais really likes being a cat. “I don’t have to do hair and makeup, I don’t have to get up early,” Gervais said about playing the chubby foul-mouthed tabby Gus in his new Netflix animated series Alley Cats . “The cats never get old. So as I get older and fatter, I can still sit in a chair and continue to make this forever.” Gervais presented the first two, 15-minute episodes of Alley Cats to the Annecy crowd on Thursday and discussed the making of the show in a one-hour masterclass. He was greeted with thunderous applauses and a spontaneous chorus of “Happy Birthday” (Gervais turned 65 today). Related Stories Movies Virginie Efira to Receive Locarno Leopard Club Award TV Asa Butterfield, Jonny Lee Miller and Christine Tremarco Join BBC Beatles Drama 'Hamburg Days' The British creator of The Office and Extras wrote and co-directed the series, with Elliot Dear, who helmed the “All Through The House” episode from season two of Netflix’s Love Death and Robots . The show follows the adventures of a gang of British alley cats, led by Gervais’ Gus. Tom Basden, Andrew Brooke, David Earl, Kerry Godliman, Jo Hartley and Diane Morgan round out the voice cast. ‘Alley Cats’ Courtesy of Netflix Gervais and the cast recorded all the dialog for the series before a single frame of animation was shot. The cast recorded together in the same room, not the typical practice for animation, so they could improv lines and bounce ideas off one another. “I told them ‘Don’t do cartoon voices. Talk as you normally do,'” said Gervais, explaining the show’s naturalistic feel. “I wanted everything to be realistic. Except for the fact that the cats talk.” Gervais’ trademark style appears to have survived the man-to-cat transfer. The series combines potty-mouthed put-downs with more sentimental story lines. As Netflix’s promotional blurb puts it: “Gervais’ signature style of heart and social commentary that audiences have come to expect.” The Alley Cats tagline says it all: “Nine lives, zero fucks.” The first season of six, 15-minute Alley Cats episodes drops on Netflix Aug. 7. Check out the Alley Cats trailer below. THR",0,2026-06-25 11:45:02
26,https://www.hollywoodreporter.com/music/music-industry-news/suno-reveals-incubator-program-for-indie-artists-1236630427/,AI Music Platform Suno Reveals Incubator Program For Indie Artists,Hollywood Reporter,2026-06-25T10:00:00,2822,"× Skip to main content By Ethan Millman Plus Icon Ethan Millman Music Editor View All June 25, 2026 3:00am Illustration by Neil Jamieson AI music platform Suno announced a new incubator program for independent musicians, the company’s latest goal in courting the artist community as AI remains among the most controversial topics among creators. The new program, called Spark, will include grants, mentorship and marketing support, Suno said, as the company said it’s looking to “help more artists turn ideas into finished projects, connect those projects with fans, and build new opportunities to grow their careers both on and beyond Suno.” “Making it as an independent artist isn’t easy,” Suno chief music officer Paul Sinclair and head of creator economy and monetization Rosie Nguyen said in a blog post published Thursday morning. “Every day, we meet talented artists with great ideas, unique perspectives, and a clear vision for their music, but who may not have the resources or connections to take the next step. At Suno, we want to help create a future where more artists have the opportunity to develop their craft, find their audience, and build sustainable creative careers.” Sinclair and Nguyen said that potential applicants for Spark must be at least 18-years-old, be a musician releasing music under their own name and must be an unsigned, independent act. Suno entered the music business to significant controversy, as all the major record companies sued the company on allegations of mass copyright infringement over Suno’s AI training model. Suno reached a settlement and partnership with Warner Music Group last year and since then ha s looked to further position itself to music creators as a partner. (Suno remains in litigation with major labels Universal Music Group and Sony Music Entertainment.) “One of the best parts of working in music is discovering artists at the beginning of their journey,” Sinclair and Nguyen wrote. “We can’t wait to meet the talented creatives who join Spark, hear what they’re working on, share their stories, and learn from them along the way.” Despite the legal dispute, Suno has continued to grow more valuable, as the company recently closed a $400 million funding round t hat valued the company at $5.4 billion. While Suno has looked to posture itself as an artist-friendly tool, there’s still no shortage of artists staunchly against AI music creation. Over the weekend, SZA took to social media strongly criticizing hundreds of her songs being used to train AI models, writing that “If your a musician and you support this degenerate shit? Your disgusting and there’s NOTHING YOU COULD EVER SAY TO ME TO MAKE THIS OKAY.” Doja Cat similarly decried AI this week after she said fans had mistaken some AI songs online for hers. “Fuck AI for real,” Doja wrote. THR",0,2026-06-25 11:45:03
17,https://variety.com/2026/biz/news/tubi-creatorverse-lineup-amazon-fire-tv-exclusive-1236789738/,Tubi to Provide Creatorverse Lineup to Amazon’s Fire TV (EXCLUSIVE),Variety,2026-06-25T10:00:00,3918,"Jun 25, 2026 3:00am PT Tubi to Provide Creatorverse Lineup to Amazon’s Fire TV (EXCLUSIVE) By Corbin Bolies Plus Icon Corbin Bolies Latest Tubi to Provide Creatorverse Lineup to Amazon’s Fire TV (EXCLUSIVE) 2 hours ago Sony Pictures Invests $100 Million in Cosm, Shared-Reality Venue Owner 18 hours ago ‘Hard Fork’ Hosts Kevin Roose, Casey Newton Sign With UTA (EXCLUSIVE) 20 hours ago See All Tubi Tubi , Fox’s free streaming service, has found a host of new screens for its Creatorverse lineup of shows. The service is bringing its suite of creator-led shows and movies to Amazon ‘s Fire TV platform, giving those with Fire TVs or tablets a front seat to shows starring creators such as Bob the Drag Queen, Celina Myers, Keith Lee, Joey Graceffa and more. The service is also home to a suite of video podcasts through a deal with SiriusXM, including “Conan O’Brien Needs a Friend,” “Rotten Mango,” the upcoming “What Now? With Trevor Noah” and “The School of Greatness” and more. Related Stories Bravo Bucks Tough Ad Trends, Keeping Some Upfront Dollars Moving Away From Traditional Cable (EXCLUSIVE) 'Ponies' Canceled After One Season at Peacock “Tubi is building a bridge to Hollywood for creators, a destination where their content lives alongside Hollywood’s biggest hits,” Rachel Berk, Fox and Tubi’s senior vice president of distribution platform partnerships, said in a statement. “We built the Creatorverse on the belief that the next wave of entertainment talent is already here, and this partnership with Amazon puts our creators in front of Fire TV’s audience and on the radar of every advertiser looking for what’s next in streaming.” Popular on Variety Tubi launched the creator platform last year, bringing more than 500 videos from YouTube onto the platform from creators including Kinigra Deon, FunnyMike and Dan and Riya. The company expanded the service earlier this year through its “Creatorverse Incubator” partnership with TikTok, allowing TikTok creators — identified in part by the social media giant — to produce shows exclusively for the platform. Tubi now has more than 20,000 episodes from more than 300 creators within the Creatorverse, with one — “Terri Joe: Missionary in Miami” — debuting on Variety ‘s Streaming Original Movies Chart at No. 8. Advertisers will also get a bite of the apple, as brands using Amazon’s DSP platform will get priority access to Tubi’s Creatorverse advertising inventory — and thus Tubi’s more than 100 million monthly active users. “At Fire TV, our focus is helping our customers discover the content they love quickly and easily,” Charlotte Maines, Amazon’s vice president of devices content and advertising, said in a statement. “Making creator-led content easier to discover enhances the customer experience while creating new opportunities for advertisers to connect with highly engaged audiences.” Kristin Scott Thomas Receives Crystal Nymph From Prince Albert II at Monte-Carlo Television Festival Opening Lesley Manville, Aldis Hodge, Kevin McKidd to Headline Business Forum Lineup at Monte-Carlo Television Festival How ‘The Other Bennet Sister’ Star Ella Bruccoleri Learned to Love Jane Austen: ‘It Actually Feels Like She’s on My Side’ Kurt Russell Receives Crystal Nymph Award at the Monte-Carlo Television Festival From Princess Charlene of Monaco ‘Gone,’ ‘Tip Toe’ Star David Morrissey on Relying on Gut Instinct: ‘Analysis Can Be Paralysis Sometimes’ David Boreanaz on Taking On Iconic Role of Jim Rockford in ‘The Rockford Files’: ‘My Attitude Is “I Want to Make James Garner Proud”’ Loading comments... More From Our Brands Rolling Stone Leonard Cohen Estate Does Not Support Trump’s Plan to Use ‘Hallelujah’ at Freedom 250 Rally Robb Report Pomellato’s New High Jewelry Collection Is a Masterclass in Eclecticism Sportico CC Sabathia, Hunter Pence, Dexter Fowler on Day 3 at Cannes Lions WWD H&M Sees Flat Sales in Q2 With 3% Fewer Stores",0,2026-06-25 11:44:53
