id,url,title,source,publication_date,text_length,full_text,is_duplicate,created_at
14,https://variety.com/2026/film/global/chentian-suha-arraf-may-odeh-arab-media-network-ecam-forum-1236769207/,"Palestine-German Project ‘Chentian,’ by ‘Lemon Tree,’ ‘The Syrian Bride’ Scribe Suha Arraf, Adds Jordan Co-Producer Arab Media Network (EXCLUSIVE)",Variety,2026-06-08T13:02:49,7022,"Jun 8, 2026 6:02am PT Palestine-German Project ‘Chentian,’ by ‘Lemon Tree,’ ‘The Syrian Bride’ Scribe Suha Arraf, Adds Jordan Co-Producer Arab Media Network (EXCLUSIVE) The story of Palestinian women fighting for the liberation of their body and their land will be pitched at ECAM Forum in Madrid. By Annika Pham Plus Icon Annika Pham Latest Switzerland’s Sister Distribution Boards ‘The Indies’ From ‘They Will Be Dust’ Producers: ’It’s Not Character-Driven but Image-Driven’ (EXCLUSIVE) 3 days ago Madrid ECAM Forum Chiefs on Lineup, With 2026 Palme d’Or Winner Federico Luis, and Next Indie Gems to Track: ‘Everybody Is Looking at Spain’ 4 days ago Rotterdam Tiger Award Winner Paz Fábrega Sets ‘To the Future’ With Spain’s Edna Cinema and Uruguay’s La Mayor Cine Ahead of ECAM Forum (EXCLUSIVE) 6 days ago See All May Odeh, Suha Arraf Courtesy Mayana Films Pedigreed Palestinian producer May Odeh (“Aisha Can’t Fly Away,” “A Useful Ghost,” “Hanging Gardens,” “200 Meters” ) has added Jordan’s Rina Khoury from Arab Media Network ‘s Abu-Lughod Studios to her early list of backers of “Chentian,” helmed by “ Lemon Tree ” and “The Syrian Bride” scribe Suha Arraf . The buzzy project, now in development, scooped the €35,000 ($41,650) Tin Post-Production Award at this year’s Göteborg Film Festival Nordic Film Market. It will next be pitched June 10 at the ECAM Forum co-production market in Madrid. Popular on Variety Related Stories Backstage at 'The Lost Boys': How Tony Nominee Ali Louis Bourzgui Becomes a Punk Rock Vampire 'I Punched a Hole in the Box and Got Out': Nathan Lane, Laurie Metcalf and a Tony-Nominated 'Death of a Salesman' Revival for the Ages Odeh, who received the Variety MENA Talent Award in 2000, is producing for Odeh Films in Palestine and Germany’s Mayana Films , co-founded with Zorana Mušiki. The film is produced in association with German producer Lena Zimmerhackel and with support from the Arab Cultural Fund. Set in “an isolated farming Palestinian village inside Israel” according to the logline, “Chentian” centers on two sisters, Nabila and Shams, bound by an exchange marriage to two brothers. When her husband dies in a tractor accident, Nabila who lives trapped in the same household as Shams and her husband Walid, starts to develop a forbidden desire for her brother-in-law. As Israeli authorities begin confiscating their land, personal tensions collide with political pressure. “‘Chentian’ is a feminist and political film about the relationship between women’s bodies and the land. The body and the earth intersect through a strong symbolic layer, as both are sources of creation and women and the land alike are both given without limits,” Arraf told Variety , before expanding the core of the film. “There can be no liberation of Palestine without the liberation of women,” she pointed out, adding: “In ‘Chentian,’ the female protagonists were raised to believe that they are not capable, that they lack the strength or ability to act. But when an opportunity finally presents itself, they discover that they are powerful and fully capable of doing anything.” “’Chentian’ tells the story of repressed female potential and the lack of confidence women are often made to feel about their own abilities, until they come to realize how strong they truly are. Underscoring the rural setting, a rarity as “most Palestinian films take place in refugee camps or cities,” Arraf said the atmosphere in the pic draws from her own experience of growing up until the age of 18 in “a beautiful Galilean village near the Lebanese border [the Israeli town of Mi’ilyaa]. “You may leave the village, but the village never leaves you,” she observed. To pay for her university studies, she herself worked in tobacco farming, a harsh physical work “which taught me patience and faith in the belief that eventually you will see the result of what you have planted and cared for.” “The relationship to the land is extremely important for us Palestinians,” Arraf insisted. “Most of our land has been confiscated, taken away to build roads, military camps, or settlements [Israelis] call ‘mitzpe’. I still remember being around 10 years-old, when large parts of my village’s land were confiscated. But the village resisted,” she said. Going back to her feature, Arraf said locations, cast and crew are still up in the air as the film is in the financing stage. But she feels confident in the hands of Odeh, “a Palestinian like me who also comes from a small village. She is an exceptional producer and a fierce fighter for the films she believes in,” Arraf stressed. Odeh for her part said that when first approached by Arraf a year and a half ago, she was convinced by the material and the helmer’s vision. “I came on board ‘Chentian’ first of all as a Palestinian producer who is deeply committed to producing more films by women directors, and especially more stories where women are not on the margins, but truly at the center,” said Odeh. “What immediately moved me [with “Chentian”] is how the film speaks about very intimate female experiences while still reflecting larger political realities, without becoming didactic,” added the producer who will be looking at ECAM Forum for potential co-producers – including from Spain, sales agents and festival programmers. Meanwhile Arraf whose first feature, the multi-awarded “Villa Touma,” hit the screens in 2014, is looking forward to her second directorial gig. “I write for other directors because I truly love writing. But the kind of films I aspire to direct are different: visually layered with minimal dialogue, built on complex human relationships, symbolism, poetry and the beauty of the image itself,” she said. Her next screenplay, entitled “Kingdom of Bees,” will also be female-focused. Inspired by a true story from her village that involved a woman from her own family, the story set against the backdrop of war in Lebanon will focus on the “golden generation of peasant women.” ‘The Hunting Wives’ Shoots Its Shot in Comedy Emmy Races, Brittany Snow and Malin Åkerman Go Lead (EXCLUSIVE) Tony Awards 2026: ‘Death of a Salesman’ Leads With Six Wins, as ‘Ragtime,’ ‘Schmigadoon!’ and ‘Liberation’ Also Take Top Honors L.A. Plays Itself — But Not All of It — In Comedies Like ‘Hacks,’ ‘Nobody Wants This,’ ‘The Studio’ and ‘Shrinking’ As Emmys Submission Deadline Day Passes, Last Minute Surprises Include ‘The Bear’ Bonus Episode ‘Gary’ David Harbour Sets Emmy Bid for ‘DTF St. Louis’ in Supporting Actor With Multiple Noms in Play (EXCLUSIVE) With Emmy Submissions Likely to Drop Again, Smaller Field Could Boost Dark Horse Series and Performers Loading comments... More From Our Brands Rolling Stone ‘Cats’ Costume Designer Qween Jean Becomes First Openly Trans Person to Win Tony Award Robb Report Bombardier’s Global 8000 Jet Just Flew From Canada to France in Record Time Sportico Jalen Brunson Caught in a Fraught Era for Signature Shoes WWD Estée Lauder Invests in the U.K., Bringing Candle, Home Fragrance Making In-house",0,2026-06-08 13:11:56
25,https://www.hollywoodreporter.com/movies/movie-news/they-fight-trailer-andre-holland-wendell-pierce-hulu-1236616161/,"Andre Holland, Wendell Pierce, Samira Wiley Lead Trailer for Hulu’s Boxing Drama ‘They Fight’ (Exclusive)",Hollywood Reporter,2026-06-08T13:00:00,2127,"× Skip to main content By Ryan Gajewski Plus Icon Ryan Gajewski Senior Entertainment Reporter View All June 8, 2026 6:00am Andre Holland (left) and Wendell Pierce in 'They Fight.' Courtesy of Andscape Andre Holland takes a swing at getting a fresh start in the trailer for Hulu ‘s boxing drama They Fight . Holland ( Moonlight ), Wendell Pierce ( The Wire ) and Samira Wiley ( The Handmaid’s Tale ) star in writer-director Sheldon Candis’ feature that premieres Monday at Tribeca Festival before making its Hulu debut July 17. Anthony B. Jenkins, Toussaint Francois Battiste and Mykelti Williamson round out the cast. Based on the 2018 documentary of the same name, They Fight centers on real-life Walt Manigan (Holland), an ex-con who longs to patch things up with Ketta (Wiley), the mother of his young son. After putting his boxing past behind him, Walt finds himself coaching a D.C.-based team of teen boxers who aspire to compete for the national championship. The movie’s trailer can be seen below and is exclusive to The Hollywood Reporter . Related Stories Movies 'Mineshaft: The Cruising Murders' Review: An Engrossing if Incohesive Dive Into William Friedkin's Gay S&M Thriller and Its Surrounding Controversy Lifestyle Katie Holmes, Meg Ryan and Jodie Foster Support Female Filmmakers at Chanel Tribeca Festival Luncheon “If y’all can see past my mistakes, I promise you I’ll give you everything I’ve got,” Holland says in the footage. Candis helmed the film from a script he wrote with Andrew Renzi that is based on Renzi’s 2018 documentary. Producers include Renzi, Jason Michael Berman and Ben Renzo. “ They Fight is my love letter to one of my all-time favorite directors John G. Avildsen,” says Candis about the Oscar-winning director of Rocky and the original Karate Kid trilogy. “It’s a Karate Kid -inspired narrative punched in the face with a John Hughes coming of age story about Southeast D.C. kids fighting to dream within amateur youth boxing.” The filmmaker adds, “Andre Holland plays the real life character of Walt Manigan within this documentary adaption of a man searching to reclaim his soul.” THR",0,2026-06-08 13:12:08
24,https://www.hollywoodreporter.com/tv/tv-news/louis-ck-jay-leno-stephen-a-smith-bill-maher-mark-twain-1236615096/,"Louis C.K., Jay Leno and Stephen A. Smith Among Big Names Set for Bill Maher’s Mark Twain Prize Ceremony (Exclusive)",Hollywood Reporter,2026-06-08T13:00:00,3126,"× Skip to main content By Scott Feinberg Plus Icon Scott Feinberg Executive Editor of Awards ScottFeinberg Follow Sign Up View All June 8, 2026 6:00am Louis C.K., Jay Leno and Stephen A. Smith. Rich Fury/Getty Images, Paul Morigi/Getty Images, Paul Morigi/Getty Images Standup comedian Louis C.K. , former late night talk show host Jay Leno and TV commentator Stephen A. Smith are among the big names who will participate in the celebration of Bill Maher when the veteran stand-up comedian and TV talk show host receives the Mark Twain Prize for American Humor from the John F. Kennedy Memorial Center for the Performing Arts on Sunday, June 28, The Hollywood Reporter can exclusively report. Others set to participate in the ceremony in Washington, D.C., which will be filmed for subsequent streaming on Netflix, include standup comedian Whitney Cummings, actor Woody Harrelson, media mogul Arianna Huffington and singer/songwriter John Mellencamp, all of whom are regular guests on Maher’s HBO program Real Time with Bill Maher . Related Stories General News Zarna Garg Defends Performing at Riyadh Comedy Festival as ""Ordained by Some Higher Power"" Music After Slamming ""Boring"" Freedom 250 Concert Dropouts, Trump Says ""Cancel It"" The Mark Twain Prize, named after the 19th century writer who was born Samuel Langhorne Clemens, was created in 1998 to annually honor one of the world’s great humorists. Previous recipients include Richard Pryor (1998), Jonathan Winters (1999), Carl Reiner (2000), Whoopi Goldberg (2001), Bob Newhart (2002), Lily Tomlin (2003), Lorne Michaels (2004), Steve Martin (2005), Neil Simon (2006), Billy Crystal (2007), George Carlin (2008), Bill Cosby (2009, rescinded in 2018), Tina Fey (2010), Will Ferrell (2011), Ellen DeGeneres (2012), Carol Burnett (2013) Jay Leno (2014), Eddie Murphy (2015), Bill Murray (2016), David Letterman (2017), Julia Louis-Dreyfus (2018), Dave Chappelle (2019), Jon Stewart (2022), Adam Sandler (2023), Kevin Hart (2024), and Conan O’Brien (2025). Maher, who specializes in social and political commentary in his standup routine and on Real Time (which he has hosted since 2003), is a polarizing figure at the moment, having angered both Pres. Donald Trump and much of the left with his acerbic criticisms of the current White House and the “woke,” respectively. Trump, who has long been a target of Maher’s jokes and sued Maher for $5 million in 2013 over one particular crack, hosted the comedian for dinner at the White House in April 2025. But their detente did not last long, as Maher continued to joke about Trump, prompting Trump to opine that the comedian is “a highly overrated LIGHTWEIGHT” and to describe the dinner as a “waste of time.” Back in March 2026, Trump, not long after attempting to rename the Kennedy Center as the Donald J. Trump and John F. Kennedy Memorial Center for the Performing Arts, expressed, via spokespeople, displeasure with the establishment’s selection of Maher for the Mark Twain Prize. On May 29, a federal judge ordered that Trump’s name must be removed from the establishment’s outdoor and indoor signage by June 12. THR",0,2026-06-08 13:12:07
