id,url,title,source,publication_date,text_length,full_text,is_duplicate,created_at
27,https://www.hollywoodreporter.com/movies/movie-news/ostlund-shoots-new-scene-of-the-entertainment-system-is-down-1236603185/,Ruben Östlund Adds New Scene to ‘The Entertainment System Is Down’ With Nicholas Braun,Hollywood Reporter,2026-05-21T07:36:36,5167,"× Skip to main content By Scott Roxborough Plus Icon Scott Roxborough Europe Bureau Chief sroxborough Follow Sign Up View All May 21, 2026 12:36am Two-time Palme d'Or winner Ruben Ostlund was President of the Cannes Jury in 2023. VALERY HACHE/AFP via Getty Images Ruben Östlund may not be competing at Cannes this year — the two-time Palme d’Or winner ( The Square , Triangle of Sadness ) took his new, still-unfinished film, The Entertainment System Is Down out of contention for the 2026 fest — but he still found time for a quick trip to the Croisette. The Swedish filmmaker told The Hollywood Reporter he is still deep in post-production for the film, and does not expect it be done before the end of the year. Kirsten Dunst, Daniel Brühl, and Keanu Reeves are among the starry cast in Östlund’s new satire, set on a long-haul flight between England and Australia where the entertainment system fails and passengers are forced to face the existential horror of boredom. Related Stories Movies Cannes Embraces Ira Sachs' 'The Man I Love' Movies 'Red Rocks' Review: Bruno Dumont's Beautifully Shot French Riviera Kids Flick Is a Minimalist Drama Mostly for Adults Östlund said he continues to tweak the movie, including adding a new sequence with Succession star Nicholas Braun. “I’m going to Amsterdam. We’re going to shoot a little additional scene that came up during the editing,” he said. “I got an idea during the editing that I think is really great so we’re going to put that in.” Östlund began principal photography on The Entertainment System is Down in late January 2024, shooting a remarkable 75 days on a single studio set built around a real Boeing 747 acquired and outfitted specifically for the film. The sheer volume of footage accumulated during that extended shoot has made for a lengthy editing process. “I could just become completely mad and never stop editing the film,” Östlund quipped, before quickly reassuring his fans that the film would not be too long in coming. “I’m actually starting to see the light at the end of the tunnel.” The real reason for Östlund’s visit to the Croisette, however, was not his own film but a new venture he hopes will change the way people discover cinema. Together with fellow Swedish filmmakers Felix Herngren, the director of The 100-Year-Old Man Who Climbed Out the Window and Disappeared , and Johan Kindblom, writer and creator of the acclaimed Swedish series Cleo , Östlund has launched MyList — a film recommendation platform built on the simple but increasingly radical premise: That human taste beats algorithmic curation. The site, which has just launched in Sweden , invites filmmakers, actors, writers, musicians, politicians and ordinary film lovers alike to compile personal lists of recommended films, organized by theme or category, with context and personal reflections. Östlund’s has corralled his famous friends and collaborators to do lists. Dunst, Brühl and Reeves have all posted their top 5 MyList selections, as has Polish auteur Pawel Pawlikowski, currently in Cannes competition with his new film Fatherland , and Palme d’Or and Oscar winner Sean Baker ( Anora ). Baker’s list is not your typical top 5, but a selection of the films he believes best capture the experience of heroin addiction with a candid personal account of his own struggles with the drug. The MyList founders say it was frustration with the dominant model of film discovery — whether driven by streaming algorithms or aggregated ratings scores — that drove them to launch their alternative site. “Today you almost rate everything — you rate the beach, you rate streets, the restaurants, you rate your kids, your wife. It’s not a good way of looking at life,” said Herngren. “With this site, a recommendation becomes meaningful, personal. It becomes more than just: was it a four or a five or a three?” Östlund is also drawn to the platform’s ability to bridge the gap between film industry insiders and the broader public. “It’s interesting when you can mix professionals from the industry — actors, film critics — next to people working with something completely different,” he said, noting that the site’s ambition extends well beyond cinema enthusiasts. “MyList has a little approach of trying to reach the ones who maybe haven’t even considered themselves cinephiles.” On the practical side, MyList will link each recommended title directly to available streaming options in the user’s region — solving, as Herngren put it, the familiar frustration of receiving a recommendation and then having no idea where to actually watch it. The team also has plans to eventually incorporate links to theatrical screenings, though that functionality is not yet live. The site is ad-supported and free to users, with a small referral fee paid by participating streaming services when users click through to their platforms — Netflix, notably, has not yet signed on. For now, MyList is available only in Sweden, but the founders say an English-language version of the site is imminent, with a broader European and ultimately global rollout to follow. “The internet has no borders,” said Kindblom. “It will travel.” THR",0,2026-05-21 12:21:27
18,https://variety.com/2026/film/global/mick-jagger-alice-rohrwacher-sisters-josh-oconnor-1236755704/,"Mick Jagger Set to Star in Alice Rohrwacher’s ‘Three Incestuous Sisters’ Joining Josh O’Connor, Dakota Johnson, Saoirse Ronan, Jessie Buckley, Isabella Rossellini",Variety,2026-05-21T07:31:48,5313,"Continue to Variety SKIP AD You will be redirected back to your article in seconds May 21, 2026 12:31am PT Mick Jagger Set to Star in Alice Rohrwacher’s ‘Three Incestuous Sisters’ Joining Josh O’Connor, Dakota Johnson, Saoirse Ronan, Jessie Buckley, Isabella Rossellini Jagger will reportedly play a lighthouse keeper who is O'Connor's father By Nick Vivarelli Plus Icon Nick Vivarelli International Correspondent @NickVivarelli Latest Mick Jagger Set to Star in Alice Rohrwacher’s ‘Three Incestuous Sisters’ Joining Josh O’Connor, Dakota Johnson, Saoirse Ronan, Jessie Buckley, Isabella Rossellini 5 hours ago Asghar Farhadi on Paris-Set ‘Parallel Tales’ and Returning to War-Battered Iran: ‘It’s Like Having a Sick Mother…You Cannot Leave Her and Just Let Her Be’ 21 hours ago RAI Cinema Scores Sales in Cannes on New Works by Mario Martone, Gianni Amelio, Irene Dionisio (EXCLUSIVE) 2 days ago See All Getty Mick Jagger is set to star in Italian director Alice Rohrwacher’s adaptation of U.S. author Audrey Niffenegger’s novel “Three Incestuous Sisters,” alongside previously announced cast members Dakota Johnson, Josh O’Connor , Saoirse Ronan, Jessie Buckley and Isabella Rossellini. The Rolling Stones frontman touched down in a helicopter earlier this week on the volcanic island of Stromboli, off the coast of Sicily, where Rohrwacher’s gothic drama is shooting, according to an inside source who confirmed Italian press reports. He is staying in a villa on the island where Isabella Rossellini’s father, Roberto Rossellini, famously began his scandalous affair with her mother Ingrid Bergman on the set of his film by the same title in 1949. Related Stories Has Raye Already Busted Into the Pantheon of Great 21st-Century Entertainers? This Year's Smashing Tour Has Told the Tale 'Think Good' Review: French Canadian Thesp Monia Chokri Convinces as a Jewish Wife Trapped in a Toxic Relationship “Three Incestuous Sisters” marks the first English-language feature by Rohrwacher who is a two-time Cannes prizewinner with “The Wonders” (2014) and “Happy as Lazzaro” (2018). The buzzy film is based on Niffenegger’s illustrated gothic novel about three sisters living in isolation, whose relationship is disrupted by the arrival of a lighthouse keeper’s son. Other plot details are being kept under wraps. According to unconfirmed Italian press reports, Jagger is playing the lighthouse keeper whose son is being played by Josh O’Connor. Popular on Variety Jagger’s standout acting roles comprise his debut in Donald Cammell and Nicolas Roeg’s “Performance,” in which he toyed with his public persona playing a burned-out, decadent rock star; a ruthless corporate mercenary in Geoff Murphy’s 1992 sci-fi flop “Freejack,” which is now a cult-classic; a drag queen in Sean Mathias’s 2015 “Bent”; a jaded business exec running an escort agency in George Hickenlooper’s “The Man From Elysian Fields” (2001); and, more recently, a reclusive art collector in Italian director Giuseppe Capotondi’s 2019 noir “The Burnt Orange Heresy” that bowed from Venice. Earlier this month The Rolling Stones announced the release of a new studio album “Foreign Tongues,” due on July 10 from Capitol Records. The 14-track collection follows less than three years after the band’s Grammy Award-winning “Hackney Diamonds” — which was their first in nearly 15 years. The new album is being introduced by the lead single “In the Stars,” released digitally on Friday (May 5) alongside the album’s opening track “Rough and Twisted.” Rohrwacher’s most recent feature is “La Chimera” (2023), led by O’Connor and also starring Rossellini, that competed in Cannes. “La Chimera” was released in the U.S. by Neon and sold widely around the world. Rohrwacher was honored earlier this year with the European Film Academy’s Achievement in World Cinema Award. “Three Incestuous Sisters” is financed and produced by Indian Paintbrush. Johnson and Ro Donnelly are producing for Johnson’s TeaTime Pictures, along with Steven Rales for Indian Paintbrush. Rohrwacher is also producing. The Italian line producer is Fandango. Principal photography on “Three Incestuous Sisters” started in April with ten weeks of shooting planned in Stromboli and Rome. ‘The Mandalorian and Grogu’ Gets Divided First Reactions, From a ‘Thrilling Adventure’ to ‘One of the Weakest Star Wars Movies’ and a ‘Snooze Fest’ White House Posts Image of Trump as the Mandalorian to Celebrate Star Wars Day Disney Store Announces ‘May the 4th Be With You’ Star Wars Collection, Sets Weekly Countdown Collections Starting in April Ian McKellen Says Obi-Wan Kenobi Actor Alec Guinness Told Him to Stay Quiet on Gay Rights Because ‘It’s Unseemly for an Actor to Dabble in Political Affairs’ ‘Star Wars’ Writer’s Scripted Hollywood Satire Podcast ‘See You in Hell’ Takes on AI in Timely New Episode Damon Lindelof Reveals Why He Was Fired From Star Wars Movie: Story Was the ‘Protestant Reformation Inside Star Wars’ Loading comments... More From Our Brands Rolling Stone Jeff Probst Accidentally Spoils a Major Part of ‘Survivor’ Finale Robb Report This New 131-Foot Explorer Yacht Concept Brings Elegance to Long-Range Expeditions Sportico Athlos, Ohanian’s Women-Only Track Meet, to Expand to London WWD Authentic Brands Group to Acquire Lee in a Deal Valued at Up to $1 billion",0,2026-05-21 12:21:17
19,https://variety.com/2026/film/markets-festivals/hollywood-ventures-group-vineyard-melody-cannes-option-1236755712/,Hollywood Ventures Group Options Namratha Stanley’s ‘Vineyard Melody’ (EXCLUSIVE),Variety,2026-05-21T07:13:36,4729,"Continue to Variety SKIP AD You will be redirected back to your article in seconds May 21, 2026 12:13am PT Hollywood Ventures Group Options Namratha Stanley’s ‘Vineyard Melody’ (EXCLUSIVE) By Naman Ramachandran Plus Icon Naman Ramachandran Latest Prashanth Neel Says NTR’s ‘Dragon’ Is His ‘Biggest Attempt at a Patriotic Movie,’ Confirms ‘Salaar’ Sequel to Follow 2 hours ago Hollywood Ventures Group Options Namratha Stanley’s ‘Vineyard Melody’ (EXCLUSIVE) 5 hours ago ‘Drishyam’ Indonesian Remake Stars Real-Life Couple Vino G. Bastian, Marsha Timothy as Rivals (EXCLUSIVE) 6 hours ago See All Hollywood Ventures Group Hollywood Ventures Group has optioned Namratha Stanley’s memoir “ Vineyard Melody ” for a film adaptation, with the deal closed during the Cannes Film Festival . HVG co-founder Glenn Gainor has had director conversations in Cannes as the company charts the project’s development path. Published by Regalo Press, the memoir follows Stanley from a decade-plus of domestic abuse in Bangalore to the vineyards of Bordeaux. The turning point comes when a violent attack by her husband nearly kills both her and her daughter. Stanley boards a plane to France to pursue an MBA, leaving her daughter in her parents’ care while she establishes herself abroad, and eventually builds her own wine label while fighting to bring her daughter out of India to join her. Related Stories 'Hope' Review: Na Hong-jin's Overlong Creature Feature Is a Guns-Blazing Riot of Bawdy Humor, Bad CGI and Brilliant Action 'Parallel Tales' Review: Isabelle Huppert Is a French Novelist Spying on the Apartment Across the Street in Asghar Farhadi's Weirdly Muddled Voyeuristic Head Game “Understanding her origin story, I realized I was looking at a very powerful woman, a very strong person, a person of conviction and a beautiful moral compass,” Gainor says. Popular on Variety Gainor built Screen Gems’ physical production department at Sony Pictures, having previously produced three features for Adam Sandler’s Happy Madison label – “Strange Wilderness,” “Grandma’s Boy,” and “Deuce Bigalow: European Gigolo.” He later oversaw Amazon MGM productions including “Being the Ricardos,” “The Tender Bar,” and “Red One,” and received the Social Impact Producer of the Year award at the 2024 Venice Film Festival. He tells Variety he sees in the material a quality central to the projects HVG pursues. “I believe her story has a sense of urgency,” Gainor says. The company has yet to determine whether the project will take shape as a local-language production, an international film, or a platform title, with those decisions to be worked through in partnership with collaborators. “As a writer, you hope to find partners who truly connect with the core of your narrative,” Stanley says. “When Glenn and I first met in Paris, and later traveled to Bordeaux, our conversations cemented the fact that he shared my exact vision for the screen adaptation. Hollywood Ventures Group represents the future of storytelling, and I am incredibly proud to trust them with this project.” HVG was co-founded by Sandy Climan, who serves as chair. Climan, a former Universal Studios executive vice president and founding head of CAA’s corporate practice, produced Martin Scorsese’s “The Aviator” – earning a BAFTA and a Golden Globe – and executive produced digital live-action 3D feature, “U2 3D.” The company’s portfolio spans impact-driven projects alongside commercial IP, including representation of Platinum Universe’s catalog of more than 1,300 comic book characters. John Boyega Confirms ‘I Actually Have’ Spoken to New ‘Star Wars’ Boss About Finn’s Future, Years After Warning Disney Never to Sideline Black Characters Again ‘Star Wars’ Day: Fans Streamed Franchise for 33 Billion Minutes in 2025 Damon Lindelof Reveals Why He Was Fired From Star Wars Movie: Story Was the ‘Protestant Reformation Inside Star Wars’ ‘The Mandalorian and Grogu’ Gets Divided First Reactions, From a ‘Thrilling Adventure’ to ‘One of the Weakest Star Wars Movies’ and a ‘Snooze Fest’ Can Adam Driver’s Axed ‘Star Wars’ Movie ‘The Hunt For Ben Solo’ Be Revived Under New Disney CEO? Soderbergh Says ‘Nope’: ‘If It Was Gonna Happen, It Would’ve’ Ian McKellen Says Obi-Wan Kenobi Actor Alec Guinness Told Him to Stay Quiet on Gay Rights Because ‘It’s Unseemly for an Actor to Dabble in Political Affairs’ Loading comments... More From Our Brands Rolling Stone Jeff Probst Accidentally Spoils a Major Part of ‘Survivor’ Finale Robb Report This New 131-Foot Explorer Yacht Concept Brings Elegance to Long-Range Expeditions Sportico Athlos, Ohanian’s Women-Only Track Meet, to Expand to London WWD Authentic Brands Group to Acquire Lee in a Deal Valued at Up to $1 billion",0,2026-05-21 12:21:18
28,https://www.hollywoodreporter.com/tv/tv-reviews/the-boroughs-review-alfred-molina-duffer-bros-netflix-1236602497/,‘The Boroughs’ Review: Alfred Molina Leads an All-Star Ensemble Through Netflix’s Clunky Geriatric Spin on ‘Stranger Things’,Hollywood Reporter,2026-05-21T07:01:00,6236,"× Skip to main content By Angie Han Plus Icon Angie Han Television Critic ajhan Follow Sign Up View All May 21, 2026 12:01am 'The Boroughs' Courtesy of Netflix The question of time, and how best to spend it, is front of mind for the characters of Netflix’s The Boroughs . As Boomers living out their last years in an idyllic desert retirement community, they’re never not aware of how quickly time can move, how little of it they might have left, how much of it they’ve wasted already or fear wasting still. There is some irony, then, in the fact that the series’ greatest flaw might be misallocation of this precious resource. While the sci-fi thriller proves a fine enough way to while away a few hours, with a plot that boils down to “ Stranger Things but old people” and an A-list cast that’d turn the grey hairs of A Man on the Inside green with envy, I left thinking too much of its eight 45-minute episodes had been spent on the former, at the expense of the latter. Related Stories Movies Cannes Flashback: When 'Thelma & Louise' Closed Out the Fest and Opened a Door Movies How 'Remarkably Bright Creatures' Went From Bestseller to Netflix With Sally Field, Lewis Pullman The Boroughs The Bottom Line A great cast let down by a dull plot. Airdate: Thursday, May 21 (Netflix) Cast: Alfred Molina, Geena Davis, Alfre Woodard, Denis O'Hare, Clarke Peters, Bill Pullman, Carlos Miranda, Jena Malone, Seth Numrich, Alice Kremelberg Creators: Jeffrey Addiss, Will Matthews The Stranger Things comparison, by the way, is neither incidental nor unintentional. Matt and Ross Duffer serve as executive producers for the series from The Dark Crystal: Age of Resistance creators Jeffrey Addiss and Will Matthews, and it shows in the sweet-spooky tone, the CG critters, the touches of nostalgia (one character’s hobby is fixing up old TVs, of the sort even 70somethings aren’t using anymore). Alfred Molina leads the starry ensemble as Sam, a Boroughs newcomer who has no intention whatsoever of enjoying his time there, to the exasperation of his overtaxed daughter, Claire (Jena Malone). He’s only moved in because he and his wife, Lilly (Jane Kaczmarek), had paid for a spot before her recent passing, and he plans to stay only until he can convince the CEO, Blaine (Seth Numrich), to refund the money. But things change once he meets Jack (Bill Pullman), a gregarious neighbor who insists on throwing a welcome barbecue in Sam’s honor. That party, which comes midway through the Ben Taylor-directed premiere, is the single most delightful scene The Boroughs has to offer. Over burgers and beers, the cul-de-sac crew — including the boho-glam Renee ( Geena Davis ), the sardonic Wally (Dennis O’Hare, a standout among standouts) and ex-hippies Art (Clarke Davis) and Judy ( Alfre Woodard ) — gossip about their other neighbors, rib each other about their respective body counts (the sex kind, not the death kind), trade their gnarliest medical anecdotes. In short, they just hang. It’s a blast. As Sam takes in the scene I did the same — marveling at the assemblage of talent, luxuriating in their chemistry, getting excited for whatever might come next. Unfortunately, it turns out to be the last time The Boroughs really lets itself indulge in its greatest asset, that ensemble cast, in quite that way. Later that night, Sam is awoken by strange noises outside his house, and upon investigating discovers a giant spider-legged monster with a taste for human fluids. And while the EMTs he reports it to are dismissive, Sam comes to believe the creature is somehow connected to bizarre ramblings from his home’s previous tenant, a dementia patient (Ed Begley Jr.) now residing in the community’s long-term care facility. From there, the rest of the cul-de-sac start to catch wind of the mystery as well, joining forces to fight back against whatever’s lurking in the night. Eventually. First, The Boroughs scatters the core clique to the winds, sending Judy spiraling into grief over a dead ex-lover, Wally scrambling for a miracle to cure his terminal cancer and so on. Individually, none of these storylines are without their charms. The best of them, Renee’s flirtation with a younger security guard ( Vida ‘s Carlos Miranda) has the giddy sweetness of a rom-com, and even the wheel-spinniest of the bunch — Art’s solo spiritual journey into the desert — has Clarke’s thoroughly winsome performance to recommend it. But painted in strokes too broad and hasty to draw out any nuance, and missing the warm chemistry that sparks whenever the characters are allowed to savor each other’s company, they add up to something less than the sum of their parts. Meanwhile, the mystery taking up so much of the show’s time runs out of steam well before the answers are revealed. Semi-interesting clues are discovered only to go nowhere. Real scares and surprises prove few and far between. Scenes that should provoke wonder for either their natural beauty (sunsets over the endless desert sky) or their supernatural strangeness (glowing dots scattering across the air like stars in a galaxy) are undermined by the signature Netflix aesthetic of flat lighting and muddy coloring. Even the villains seem underwhelmed by their own one-dimensional motives: “Why does anyone do anything?” one scoffs when asked to explain himself. To be sure, the series even at its clunkiest is never less than perfectly watchable; any show that sees Woodard shooting at monsters or O’Hare preparing to thwack one with a meat cleaver can’t help but be at least a little amusing. But it’s a letdown for a story with bright early gleams of potential. Built around the poignant concept of a monster stealing time from those who have the least of it to spare, aimed at toppling our own fears around aging, and brought to life by a cast with more than enough talent to land the humor, the heart and the horror inherent in all those ideas, The Boroughs could have been an all-timer. Instead, I found myself doing precisely what the mourning Sam has to learn not to do: dwelling on the past — longing to return once more to that campfire from the first episode, savoring those precious few moments when we were allowed to relish the simple joys of really great company. THR",0,2026-05-21 12:21:28
