id,url,title,source,publication_date,text_length,full_text,is_duplicate,created_at
19,https://variety.com/2026/film/global/james-nelson-joyce-the-man-who-stole-portugal-1236739743/,"James Nelson Joyce, Richard E. Grant and Dominic West to Star in Dark Comedy ‘The Man Who Stole Portugal’",Variety,2026-05-07T09:00:00,4906,"May 7, 2026 2:00am PT James Nelson Joyce, Richard E. Grant and Dominic West to Star in Dark Comedy ‘The Man Who Stole Portugal’ Beta Cinema is handling world sales and will launch the period heist film — inspired by a real life financial fraud — in Cannes By Alex Ritman Plus Icon Alex Ritman @alexritman Latest Rooney Mara to Play an ‘Enigmatic, Beautiful, Violent’ Mother in Paris-Set ‘Quest for Love’ From Antonia Campbell-Hughes, HanWay Launching in Cannes 2 hours ago James Nelson Joyce, Richard E. Grant and Dominic West to Star in Dark Comedy ‘The Man Who Stole Portugal’ 2 hours ago Miles Teller and Eddie Redmayne in Talks to Play Mismatched CIA Agents in Doug Liman Spy Thriller ‘Star One,’ CAA Launching Sales in Cannes (EXCLUSIVE) 14 hours ago See All David Reiss, Pip Seed, supplied by agent Principal photography has begun on “The Man Who Stole Portugal,” a darkly comic period heist inspired by one of the most audacious financial frauds of the 20th century. Directed by BAFTA nominee Thomas Napper (“Jawbone,” “Widow Clicquot”), the script is by Richard Galazka, inspired by the titular true crime book by Murray Teigh Bloom. In his first film lead role, BAFTA nominee James Nelson Joyce (“This City is Ours,” “A Thousand Blows”) plays Alves Reis, a self-made outsider with a genius for turning a closed door into an opportunity. Shut out and underestimated, he’s is determined to give his wife Maria (Emily Fairn, “House of Guinness,” “The Responder”) and their family the life they deserve and, hustle by hustle, he begins to invent his way upwards. From forged credentials to official contracts, his journey takes him via colonial backwaters all the way to the boardrooms of the Bank of Portugal — until his greatest bluff becomes one of the greatest cons in history. Related Stories 'Daredevil' Star Reveals [SPOILER]'s Shocking Death Was Changed After Filming: 'They CGI'ed Me Shooting Him in the Head' 'Daredevil' Boss on Matt's Finale Reveal, the Defenders Reunion in Season 3 and When 'Punisher: One Last Kill' Takes Place Alongside Joyce and Fairn, the cast also includes Joel Fry (“Bank of Dave,” “Our Flag Means Death”), Herbert Nordrum (“The Worst Person in The World,” “The Royal Hotel”), Kim Bodnia (“F1,” “Killing Eve”), Nia Towle (“Rings of Power,” “Persuasion”), Richard E. Grant (“Saltburn,” “Can You Ever Forgive Me”) and Dominic West (“The Crown,” “The Wire”). Popular on Variety Michael Elliott (“A Long Winter,” “Small Axe,” “Benediction”) produces for EMU Films, with Walli Ullah and Jim Mooney as executive producers. Terry Smith is Executive Producer and also finances via Moviedrome. The production will shoot in the U.K., Portugal and South Africa as the story’s sweep moves from the glamour and political turbulence of 1920s Lisbon to colonial Angola and the elite printing houses of London. “Alves Reis is fascinating because he doesn’t set out to destroy the system, he wants a way into it. He wants security, respect, and a future for his family,” said Napper. “That feels very alive now, when so many people feel the odds are stacked against them. What makes the story so thrilling is watching an outsider learn how to open those doors, bluff by bluff, and for a while make the system work for him. It’s outrageous and funny, but it also speaks to something very current: who gets access, who gets shut out, and what people will do to cross that line.” Added Elliott: “’The Man Who Stole Portugal’ gives audiences the thrill of a great heist movie, but with a true story so outrageous you can hardly believe it happened. It’s funny, stylish and full of momentum, with a character at its centre who is impossible not to watch. Thomas has a brilliant instinct for the human story inside the spectacle, and with this cast we think audiences are going to get a film that is hugely entertaining, surprising and has a real edge.” Beta Cinema is handling world sales and will launch the project to international buyers at the upcoming Marché du Film in Cannes. “’The Man Who Stole Portugal’ is the tale of a criminal genius who realised that forging a contract to print banknotes was infinitely easier than forging the notes themselves,” said executive producer Smith. “It’s also remarkably prescient – the shockwaves it sent through the Portuguese economy, and the political collapse that followed, find strong echoes in the money printing by central banks during the 2008–09 financial crisis and COVID.” Ranbir Kapoor Unveiled as Lord Rama in Trailer for Nitesh Tiwari’s Epic ‘Ramayana’ Hans Zimmer’s Bleeding Fingers Music Expands to London, Sets U.K. Leadership Loading comments... More From Our Brands Rolling Stone Chris Stapleton Covers Willie Nelson’s Pro-Immigrant Song ‘Living in the Promiseland’ on ‘Colbert’ Robb Report BMW’s ‘Neue Klasse’ iX3 Can Travel 434 Miles on a Single Charge Sportico Inter Miami Takes Equity Stake in Beckham-Founded IM8 Parent",0,2026-05-07 11:13:11
11,https://deadline.com/2026/05/richard-e-grant-dominic-west-the-man-who-stole-portugal-1236884097/,Richard E. Grant & Dominic West Among Cast Set For Dark Comedy ‘The Man Who Stole Portugal’ — Cannes Market,Deadline,2026-05-07T09:00:00,2860,"Skip to main content By Zac Ntim Zac Ntim International Reporter @ZacharyNtim More Stories By Zac Rooney Mara To Star In ‘Quest For Love’ — Cannes Market William Baldwin & Leo Gregory Board Jane Spencer’s Road Movie ‘The Road To Nevermore’ Mubi Acquires Multiple International Territories On Lukas Dhont’s Cannes Competition Title ‘Coward’ View All May 7, 2026 2:00am Richard E. Grant & Dominic West Pip Seed Principal photography has begun on The Man Who Stole Portugal , a feature project from director Thomas Napper ( Jawbone ) that has been described as a “darkly comic period heist” about “one of the most audacious financial frauds of the 20th century.” The film stars James Nelson Joyce (This City is Ours) as Alves Reis, a self-made outsider with a genius for turning a closed door into an opportunity, the official synopsis reads. The synopsis continues: “Shut out and underestimated, Reis is determined to give his wife Maria, played by Emily Fairn (The Responder), and their family the life they deserve, and, hustle by hustle, he begins to invent his way upwards. From forged credentials to official contracts, his journey takes him via colonial backwaters all the way to the boardrooms of the Bank of Portugal – until his greatest bluff becomes one of the greatest cons in history. Related Stories News Mokster Films & Lester Hsi's D-Day Pictures Team On Taiwanese Horror Film 'Revive' Casting Adrien Brody & Rachel Zegler To Lead Karim Aïnouz's 'Last Dance' With Ben Platt Co-Starring & Writing Original Music & 'Evita' Star Zegler Singing; FilmNation Launching For Cannes Market “The Man Who Stole Portugal follows Reis’ hunger for status into a world of financiers, diplomats, bureaucrats, and opportunists, as he makes the establishment a grand accomplice in its own deception.” Watch on Deadline The cast also includes Joel Fry ( Bank of Dave ) as Jose, Herbert Nordrum ( The Worst Person in the World ) as Karel, Kim Bodnia ( F1 ) as Adolf, with Richard E. Grant ( Can You Ever Forgive Me ) as Sir William, and Dominic West ( Downton Abbey: The Grand Finale ) as Carlos. Napper directs from a script by Richard Galazka, inspired by the true crime book by Murray Teigh Bloom. Michael Elliott ( A Long Winter ) produces for EMU Films, with Walli Ullah and Jim Mooney as Executive Producers. Terry Smith is the Executive Producer and also finances via Moviedrome. The production will shoot in the UK, Portugal, and South Africa. Beta Cinema is handling world sales and will launch the project to international buyers at the upcoming Cannes Market . ‘Saturday Night Live UK’ Renewed For Season 2 At Sky Adrien Brody’s First Post Oscar Role Is Rachel Zegler, Ben Platt Drama Service Unifies With Amazon MX Player; ‘Matka King’ Renewed For S2 Fox Orders ‘Highway To Heaven’ Reboot From Katims, Amblin & Landon Productions Read More About: Comments",0,2026-05-07 11:13:02
10,https://deadline.com/2026/05/curtis-brown-cfo-simon-flamank-exiting-agency-uta-1236883021/,Curtis Brown CFO Exiting After A Decade,Deadline,2026-05-07T09:00:00,2061,"Skip to main content By Max Goldbart Max Goldbart International TV Co-Editor @Goldbart1 More Stories By Max ‘Saturday Night Live UK’ Renewed For Season 2 At Sky Curtis Brown CFO Exiting After A Decade ‘American Hostage’ To Roll Out On MGM+ Internationally, With HBO Max, Movistar Plus+ & Stan Among Buyers View All May 7, 2026 2:00am Simon Flamank Curtis Brown EXCLUSIVE: The Chief Financial Officer of UK agency Curtis Brown is exiting after a decade. The 125-year-old agency, which reps the likes of Ncuti Gatwa, Robert Pattinson and Margaret Atwood, confirmed Simon Flamank ‘s exit after he was terminated as director on Companies House late last month. Flamank, a respected figure in the world of TV and film industry finance, has been with UTA -owned Curtis Brown since 2016. We understand he is leaving shortly to pursue his passions and doesn’t have another role lined up. Succession plans will be announced in due course. Flamank was with Curtis Brown during a period of change. He helped navigate the agency during the Covid-19 pandemic and would have been front and center of Curtis Brown’s acquisition by American agency UTA for around £43M ($58.6M ) in 2022. According to Curtis Brown parent UTA UK’s latest company accounts for full-year 2024, the agency turned over £77M. More recent financials are not available. Watch on Deadline Flamank has worked for a number of media companies at C-suite level including Bob & Co, the entertainment firm set up by Bob Benton that invested in a number of UK outfits. He has also consulted for a number of businesses. Flamank is one of the most senior figures at Curtis Brown. He works closely with Chair and CEO Jonny Geller, President Jonathan Lloyd, directors Nick Marston and Sarah Spear, and COO Raneet Ahuja. ‘Saturday Night Live UK’ Renewed For Season 2 At Sky Adrien Brody’s First Post Oscar Role Is Rachel Zegler, Ben Platt Drama Service Unifies With Amazon MX Player; ‘Matka King’ Renewed For S2 Fox Orders ‘Highway To Heaven’ Reboot From Katims, Amblin & Landon Productions Read More About: Comments",0,2026-05-07 11:13:01
12,https://deadline.com/2026/05/berlin-world-cinema-fund-head-vincenzo-bugno-honor-cannes-1236884096/,Former Berlinale World Cinema Fund Head Vincenzo Bugno To Be Honored In Cannes,Deadline,2026-05-07T08:23:23,3757,"Skip to main content By Melanie Goodfellow Melanie Goodfellow Senior International Film Correspondent @mel_goodfellow More Stories By Melanie Gary Lineker & Jorge Valdano-Narrated Cannes Doc ‘The Match’ About Argentina-England “Hand Of God” Game Sets Sales With Round 12 Former Berlinale World Cinema Fund Head Vincenzo Bugno To Be Honored In Cannes David Di Donatello Awards: Feel-Good Movie ‘The Last One For The Road’ Sweeps Board To Win Best Film & Director View All May 7, 2026 1:23am Vincenzo Bugno Arab Cinema Fund Vincenzo Bugno , the former longtime director of the Berlinale ’s World Cinema Fund (WCF), will be feted with the inaugural Arab Cinema Gamechanger Award on the fringes of the Cannes Film Festival this year. Bugno was head of the WCF for 21 years prior to stepping down at the end of 2025. Under his direction, the fund evolved into a cornerstone of international co-production and circulation for films from Middle East , North Africa, Sub-Saharan Africa, Latin America, and Southeast Asia. Notable Arab world recipients under this tenure included Hala Lotfy’s Coming Forth By Day , Kaouther Ben Hania’s Four Daughters , Ayten Amin ’s Souad , Suhaib Gasmelbari ’s Talking About Trees and Morad Mostafa’s Aisha Can’t Fly Away . Watch on Deadline Related Stories Casting Adrien Brody & Rachel Zegler To Lead Karim Aïnouz's 'Last Dance' With Ben Platt Co-Starring & Writing Original Music & 'Evita' Star Zegler Singing; FilmNation Launching For Cannes Market News Doug Liman To Direct 'Star One' With Miles Teller & Eddie Redmayne -- Cannes Market The prize, overseen by the Arab Cinema Center (ACC), will be bestowed on Bugno at the awards ceremony for its 10th Critics’ Awards for Arab Films in Cannes on May 16. In a release announcing the honor, the ACC said Bugno had built a career “defined by a rare combination of cultural sensitivity, curatorial rigor, and an unwavering commitment to reshaping the global cinematic landscape”. The center continued that Bugno had played an influential behind-the-scenes role in championing independent voices from regions historically marginalized within the global film industry, and notably the Arab World. “Central to Bugno’s philosophy is a rejection of Eurocentric frameworks and reductive narratives. His curatorial approach has consistently emphasized authenticity over conformity, guided by his long-held belief that ‘the more local, the more international’, it said. It noted that Bugno also played a key role in shaping the Middle East focus of Open Doors at the Locarno Film Festival in 2007, an initiative that helped introduce emerging filmmakers from the region to European industry networks for the first time. Bugno remains actively involved in other key industry initiatives. He serves as a curator for the TorinoFilmLab Feature Lab and is engaged in festival work in Bolzano/Bozen, while maintaining strong ties to major cultural hubs such as Berlin and Venice. “Receiving this award brings me immense joy. It is deeply heartening to know that colleagues in the Arab World have viewed my work so positively over the years, particularly our efforts to amplify the voices of new filmmakers and champion innovative storytelling,” said Bugno. “This achievement is not mine alone; it would never have been possible, whether through the WCF or other initiatives, without the passion and dedication of the incredible team and colleagues I’ve had the privilege of working with for years”. ‘Saturday Night Live UK’ Renewed For Season 2 At Sky Adrien Brody’s First Post Oscar Role Is Rachel Zegler, Ben Platt Drama Service Unifies With Amazon MX Player; ‘Matka King’ Renewed For S2 Fox Orders ‘Highway To Heaven’ Reboot From Katims, Amblin & Landon Productions Read More About: Comments",0,2026-05-07 11:13:03
20,https://variety.com/2026/tv/reviews/legends-review-steve-coogan-netflix-1236738403/,Steve Coogan and Tom Burke Excel as Undercover Agents in Netflix War on Drugs Drama ‘Legends’: TV Review,Variety,2026-05-07T07:01:00,6112,"May 7, 2026 12:01am PT Steve Coogan and Tom Burke Excel as Undercover Agents in Netflix War on Drugs Drama ‘Legends’: TV Review By Alison Herman Plus Icon Alison Herman TV Critic aherman2006 Latest Netflix’s ‘Lord of the Flies’ Adaptation Is a Harrowing Watch With a Stellar Young Cast: TV Review 3 days ago Apple TV Horror Comedy ‘Widow’s Bay’ Walks a Tonal Tightrope to Bewitching Effect: TV Review 1 week ago ‘Stranger Things’ Animated Spinoff ‘Tales From ’85’ Is a Depressing, Cynical Retread: TV Review 2 weeks ago See All Courtesy of Netflix In the parlance of undercover operatives, a “legend” is the false identity one concocts to infiltrate a criminal network. “Your legend has to come from you, or it won’t work. Your legend has to be part of you, or it won’t work,” explains Don ( Steve Coogan ), a British customs agent charged with training a group of amateur spies to infiltrate heroin rings in the twilight of the Thatcher era. “And when legends don’t work, people die.” “Legends” is also the name of the compact, compelling Netflix series Don kicks off by assembling a ragtag crew of secretaries, airport security officers and other understimulated misfits from his agency’s ranks for the mission at hand. Created and written by Neil Forsyth (“The Gold”), “Legends” is loosely based on a real set of customs operations in the late 1980s that intercepted several tons of narcotics with limited budget and resources. But together with directors Brady Hood and Julian Holmes as well as a uniformly strong cast, led by a gravel-voiced Coogan and Tom Burke (“Furiosa”) as Don’s star pupil, Forsyth makes “Legends” a gripping tale of found potential and assumed identity. Related Stories GameStop (Yes, GameStop) Makes $56 Billion Bid for eBay In a show of its brisk, no-nonsense pace, “Legends” has Don whittle a busful of applicants down to just four recruits in the first 15 minutes of the premiere. (And that timestamp includes an economical cold open that cuts between two overdose deaths at opposite ends of the class spectrum, establishing why Thatcher has chosen to tackle the drug crisis with such urgency.) Guy is a working-class Londoner whose wife supports his frustrated ambitions. He’s joined by Sophie (Charlotte Ritchie), a clerical genius with a gift for reading documents; Kate (Hayley Squires), a Northerner who wants to fight the damage drugs have inflicted on her home region; and Bailey (Aml Ameen), a son of immigrants whose adopted country is blinded by racism to his considerable ability. Having lucked into an opportunity for rewarding work and excitement, all four intend to make the most of it. Popular on Variety Don divides his team between heroin’s two main domestic distribution centers: Liverpool, where the decimation of dockside industrial work has turned an entire generation toward narcotics and crime, and London, where a Kurdish gang based in the Turkish neighborhood of Green Lanes imports product from Pakistan. (The second episode’s upbeat opening sequence follows an opium crop’s supply chain from harvest to processing to Turkey to the U.K.) Kate and Bailey take Liverpool, where they recruit informants and plant sources in pursuit of local kingpin Declan Carter (Tom Hughes). Guy gets sent to Green Lanes on his own, apart from a charming Greek ex-con (Gerald Kyd) who Don gets out of jail in exchange for an introduction to the Kurds. Guy’s legend, who he speaks about in the third person like a separate entity with “his” own thoughts and feelings, is a former legitimate businessman with a chip on his shoulder post-divorce. Per Don’s instructions, however, Guy’s personality and mannerisms don’t change when he’s in character. “I feel like I’ve been waiting my entire life for this,” he tells Don. All the spy fiction clichés about losing oneself in the lie get bandied about, but Burke’s capable performance gives the sense of a man awakened rather than transformed. In the United States, the War on Drugs is mostly remembered as a quagmire, one that fueled the social blight of mass incarceration rather than address the root cause of mass substance abuse. “Legends” is more optimistic about its characters’ accomplishments than, say, “The Wire,” and — as indicated by Coogan’s casting — has a sense of humor to match. Scenes where the agents come in from the field to snipe at one another in a makeshift office have a chemistry that would seem like a durable blueprint for future seasons if the story wasn’t finite. But “Legends” still has plenty to say about the declining fortunes of middle-class England as presided over by Thatcher, plus the meddling of career-motivated politicians in dirty work of actual law enforcement. Alex Jennings of “The Crown” plays a perfectly posh Home Secretary pressuring Don to move up his timeline for a major party conference. Mostly, though, “Legends” takes the same evident pleasure in risk-taking and adventure as its protagonists. Guy’s long con of ingratiating himself into the Green Lanes operation makes his arc the fullest expression of the show’s namesake concept, but his colleagues do stints as property developers, German tourists and shady lawyers, adopting aliases and even going overseas as the work demands. It’s all so fun you can forget the deadly stakes of the assignment at hand — which is precisely the point. All six episodes of “Legends” are now streaming on Netflix. Steve Coogan and Tom Burke Excel as Undercover Agents in Netflix War on Drugs Drama ‘Legends’: TV Review Production: Tannadice, Lion Television, All3 Media Crew: Created by Neil Forsyth Cast: Steve Coogan, Tom Burke, Hayley Squires, Aml Ameen, Charlotte Ritchie Ranbir Kapoor Unveiled as Lord Rama in Trailer for Nitesh Tiwari’s Epic ‘Ramayana’ Hans Zimmer’s Bleeding Fingers Music Expands to London, Sets U.K. Leadership Loading comments... More From Our Brands Rolling Stone Chris Stapleton Covers Willie Nelson’s Pro-Immigrant Song ‘Living in the Promiseland’ on ‘Colbert’ Robb Report BMW’s ‘Neue Klasse’ iX3 Can Travel 434 Miles on a Single Charge Sportico Inter Miami Takes Equity Stake in Beckham-Founded IM8 Parent",0,2026-05-07 11:13:12
