id,url,title,source,publication_date,text_length,full_text,is_duplicate,created_at
16,https://variety.com/2026/film/news/prashanth-neel-dragon-ntr-patriotic-salaar-sequel-1236755756/,"Prashanth Neel Says NTR’s ‘Dragon’ Is His ‘Biggest Attempt at a Patriotic Movie,’ Confirms ‘Salaar’ Sequel to Follow",Variety,2026-05-21T10:33:30,6665,"Continue to Variety SKIP AD You will be redirected back to your article in seconds May 21, 2026 3:33am PT Prashanth Neel Says NTR’s ‘Dragon’ Is His ‘Biggest Attempt at a Patriotic Movie,’ Confirms ‘Salaar’ Sequel to Follow By Naman Ramachandran Plus Icon Naman Ramachandran Latest Hollywood Ventures Group Options Namratha Stanley’s ‘Vineyard Melody’ (EXCLUSIVE) 5 hours ago ‘Drishyam’ Indonesian Remake Stars Real-Life Couple Vino G. Bastian, Marsha Timothy as Rivals (EXCLUSIVE) 6 hours ago Grief Doc ‘The Last Note’ Acquired by HG Distribution as Fusee Launches Three-Doc Slate at Cannes Film Market (EXCLUSIVE) 6 hours ago See All Mythri Movie Makers Indian filmmaker Prashanth Neel is reframing expectations for “ Dragon ” – his NTR -starring action film targeting a June 2027 release – as his most ambitious patriotic statement to date, while confirming that a “Salaar” sequel will go into production the moment it wraps and revealing plans to eventually step away from large-scale action for a mythological series he has spent roughly two decades developing. “This is probably going to be our biggest attempt at making a patriotic movie,” Neel tells Variety . Related Stories 'Lincoln Lawyer' to End With Season 5 at Netflix, Series Adds Six Recurring Guest Stars 'Running Point' Renewed for Season 3 at Netflix The promotional glimpse – released on the eve of NTR’s birthday and viewed more than 49 million times within two days – officially unveiled the title and laid out the film’s historical and criminal scaffolding. It constructs a premise in which British colonial rule in India was fundamentally sustained by control of the opium trade, with the British commanding 95% of the global market through Afghanistan and the Golden Triangle. In the film’s telling, the British exit from India in 1947 fractured that empire into two warring factions – the Afghan Trading Company and the Golden Trading Company – igniting the conflict at the story’s center. Popular on Variety Reshoot rumors that had circulated ahead of the glimpse are unfounded, Neel says. The production took time off to allow NTR to build his physique without CGI assistance. “They’re just rumors. We never reshot a single scene till now. The only reason we took some time off was because he wanted to be authentically fit for the movie without any CGI. He wanted to build a body,” he says, while also negating rumours of “Dragon” being a spy film. NTR plays Luger – named after the German Luger PP 08 pistol – an assassin sent to Afghanistan at the age of 10 in 1947 and trained to serve as the Afghan Trading Company’s chief enforcer. Neel describes the character as the most morally complex he has attempted, drawing a parallel to audience responses to Pablo Escobar in the TV series “Narcos.” “We are trying to portray a very, very negative character, but a character that you understand why he’s negative,” he tells Variety. Childhood is the emotional engine Neel returns to across all his films, and “Dragon” is no exception. Rooted in the 70s Hindi-language cinema he grew up watching – films that invariably opened with a protagonist’s formative years – his approach holds that character is fixed in childhood and largely immovable thereafter. “My childhood basically becomes my biggest emotion in my movies,” he says, “and in ‘Dragon’ also it is my biggest strength.” That emotional grounding is also what he says separates genuine elevation scenes from empty spectacle. “When you talk about an elevation scene, it always comes from drama,” Neel says. “If I am not invested in the drama, then I will not be elevated when I see what I see. It just cannot be a set piece.” The construction, he says, begins long before the payoff – laying what he calls bread crumbs early enough that the drama lands with full force when it arrives. The goal is a scene that functions like a song: something audiences return to. The film marks a deliberate shift in directorial register for Neel. “This is the first time that I’m probably going to let my actors do the heavy lifting for me in the movie,” he says. “Dragon” extends the post-independence dystopian universe he has built across the “K.G.F” film and “Salaar,” though Neel frames it as distinct in intent – a story in which the patriotic dimension, obscured by the glimpse’s dark aesthetic, is central. The broader ensemble includes Anil Kapoor, Biju Menon and Rukmini Vasanth, among others. Music is by Ravi Basrur, who scored both “K.G.F” instalments and “Salaar.” On franchise prospects, Neel is measured. Any sequel will hinge on audience reception, and he says he will not assume goodwill on the strength of his previous films. The “Salaar” follow-up, however, is already scheduled. “That will happen immediately after the ‘Dragon’ movie is done,” he says. On “K.G.F 3,” he says he does not yet know when he will be able to turn his attention to it. Once those obligations are met, Neel intends to leave this genre behind. He has been developing a mythological series for approximately two decades and wants to write and direct it before anything else. He also acknowledged a longstanding desire to make a small intimate drama that current commitments have kept out of reach. On international release, Neel says any decision will follow an assessment of the finished film. “We cannot make better visuals than what the Hollywood people have made, but we can try and make a better emotion than what they have made,” he says. “We are making a very, very Indian movie, which can appeal to an international audience also.” John Boyega Confirms ‘I Actually Have’ Spoken to New ‘Star Wars’ Boss About Finn’s Future, Years After Warning Disney Never to Sideline Black Characters Again Lego Drops Star Wars Sets with Interactive Smart Play Bricks: Here’s Where To Buy Online Mark Hamill Supports New ‘Star Wars’ Boss After Kathleen Kennedy’s Exit and ‘Last Jedi’ Issues: ‘I Can’t Think of Better Hands’ Than Dave Filoni Disney Store Announces ‘May the 4th Be With You’ Star Wars Collection, Sets Weekly Countdown Collections Starting in April ‘Star Wars’ Writer’s Scripted Hollywood Satire Podcast ‘See You in Hell’ Takes on AI in Timely New Episode ‘No Harrison Ford’: Disneyland’s New Han Solo Debuts at Galaxy’s Edge and Gets Roasted by Fans for ‘Worst Wig Ever’ and More Loading comments... More From Our Brands Rolling Stone Jeff Probst Accidentally Spoils a Major Part of ‘Survivor’ Finale Robb Report This New 131-Foot Explorer Yacht Concept Brings Elegance to Long-Range Expeditions Sportico Athlos, Ohanian’s Women-Only Track Meet, to Expand to London WWD Authentic Brands Group to Acquire Lee in a Deal Valued at Up to $1 billion",0,2026-05-21 12:21:15
17,https://variety.com/2026/tv/news/senators-fcc-chairreview-paramount-warner-bros-merger-foreign-investors-1236755538/,Senate Democrats Implore FCC Chair to Conduct ‘Rigorous’ Review of Paramount-Warner Bros. Merger Foreign Investment: Deal ‘Raises National Security Alarms’,Variety,2026-05-21T10:00:00,9359,"Continue to Variety SKIP AD You will be redirected back to your article in seconds May 21, 2026 3:00am PT Senate Democrats Implore FCC Chair to Conduct ‘Rigorous’ Review of Paramount-Warner Bros. Merger Foreign Investment: Deal ‘Raises National Security Alarms’ By Todd Spangler Plus Icon Todd Spangler NY Digital Editor xpangler Latest Netflix Will Soon Start Livestreaming Charlamagne Tha God’s ‘Breakfast Club’ Worldwide in Deal With iHeartMedia, Marking Its First Live Daily Show 48 minutes ago Senate Democrats Implore FCC Chair to Conduct ‘Rigorous’ Review of Paramount-Warner Bros. Merger Foreign Investment: Deal ‘Raises National Security Alarms’ 2 hours ago Paramount’s Junk-Status Credit Rating to Be Downgraded Further Following Warner Bros. Merger to Reflect ‘Major Ongoing Uncertainties,’ S&P Global Says 18 hours ago See All Getty Images Democratic senators are again urging the FCC to not rubber-stamp Paramount Skydance ‘s proposed $111 billion takeover of Warner Bros. Discovery — citing concerns over foreign investors, including Middle Eastern wealth funds, that are backing the pact. The pending Paramount-WBD merger “raises national security alarms,” according to the senators, led by U.S. Sen. Maria Cantwell (D-Wash.), the ranking member of the Senate Committee on Commerce, Science and Transportation. The group sent a letter May 20 to FCC Chairman Brendan Carr outlining their concerns. That came after another group of Senate Democrats sent the agency chief a similar letter two months ago . Related Stories Prince Harry and Meghan Markle Developing Film Adaptation of Afghan War Memoir 'No Way Out' for Netflix Westminster Kennel Club Dog Show Moves to Netflix Starting Next Year Under New Deal The crux of their misgivings: In April, Paramount disclosed in an FCC filing that the merged Paramount-WBD would be 49.5% owned by foreign investors , with about 38.5% of the equity in the new company owned by the sovereign wealth funds of Saudi Arabia, Qatar and Abu Dhabi . Paramount’s filing seeks a declaratory ruling by the FCC permitting that foreign ownership — and in fact, asked the agency to authorize up to 100% foreign equity ownership in its broadcast licensees. Congress set a 25% limit on direct foreign ownership of American TV and radio stations. Popular on Variety “The scale, concentration and scope of this proposal raise serious questions,” the senators wrote. “Foreign governments hostile to a free and independent press could exert unprecedented influence over a media conglomerate vital to American journalism and culture.” They continued, “If the filing is approved, Saudi, UAE and Qatari sovereign investment funds would have significant influence over a number of the most significant and impactful news reporting and investigative journalism outlets in the United States, including CNN, CBS News, 60 Minutes, and 28 local Paramount-owned television stations in 17 of the country’s largest media markets.” “Paramount’s petition asks for an unprecedented degree of foreign control of U.S. broadcasting,” the senators wrote. “[W]e have serious doubts that paving the way for these anti-democratic governments to own between 49.5% and 100% of an American media empire serves the ‘public interest.’” Carr, at a press conference earlier Wednesday following the FCC’s monthly open meeting, acknowledged that the Paramount-WBD deal has “some foreign investment or foreign dollars that are involved in being invested in CBS to complete the purchase. And so we are running regular course process on that. So we put out a public notice to seek comment on that foreign investment.” Carr added, “My understanding is there is a role for CFIUS,” referring to the U.S.’s intra-agency Committee on Foreign Investment in the United States, which reviews foreign investments in American businesses for potential national security risks. CFIUS, Carr said, “will ultimately make an up-or-down decision on that foreign investment. But the transaction itself isn’t going to come before the FCC, other than that foreign-ownership piece.” The Treasury Department, which leads CFIUS, has not confirmed that the committee is reviewing the Paramount-WBD transaction. In March, Democratic Sens. Elizabeth Warren and Richard Blumenthal criticized the Trump administration for failing to initiate a CFIUS review of the deal. Paramount has said that the Gulf States backing the WBD deal would not be given board representation and that, therefore, CFIUS review is not warranted. The Ellison family and RedBird Capital Partners would collectively hold the largest equity stake in the combined company and continue to hold 100% of the voting shares, according to Paramount. Meanwhile, at the May 20 meeting, Democratic FCC Commissioner Anna Gomez said that what Paramount’s petition is asking for is “very serious.” Earlier this month she had called for the FCC to conduct a “vigorous” review of the foreign investment in the proposed Paramount-WBD pact. “These are not just some foreign companies. These are sovereign wealth funds controlled by countries that are not friendly to the press,” Gomez said. “And Paramount has said, ‘Give us up to 100% foreign ownership.'” Because the Middle Eastern funds would have indirect ownership stakes, under the statute, the FCC can waive the limit on foreign government ownership — “but it doesn’t mean we should,” Gomez said. Others signing on to the May 20 letter to Carr were Sens. Edward J. Markey (D-Mass.), Ben Ray Luján (D-N.M.) John Hickenlooper (D-Colo.), Andy Kim (D-N.J.) and Warren. The full text of the letter is at this link . The lawmakers pointed out that the FCC has never before allowed a sovereign wealth fund to hold a significant ownership stake of a U.S. broadcaster. They also noted that Carr in 2024 expressed concerns about foreign ownership of TikTok, and he also opposed a transfer of radio stations because of a lack of plans to “wall off the unvetted foreign interests.” But Carr “appears to have no such concerns about this deal,” according to the Democratic senators. They cited an interview Carr gave to CNBC in March in which he said about the proposed Paramount-WBD merger, “I think this is a good deal, and I think it should get through [FCC review] pretty quickly.” In the letter to Carr, the senators said, “These comments raise questions about your impartiality and the rigor of the Commission’s review of this unprecedented foreign investment.” The senators also referenced an unconfirmed report that China’s Tencent was among the investors in Paramount’s WBD bid. In December, Paramount said Tencent, which had committed $1 billion to the Paramount Skydance bid, was no longer a financing partner because of the WBD board’s concerns over foreign ownership. In March, Bloomberg reported that Tencent was back on board as an investor in the deal with fresh funding. About the reported involvement of Tencent, the senators wrote, “Allowing our most significant global adversary to partly own Paramount or a combined new entity that will own CNN and CBS News would risk our national security.” The lawmakers posed the following questions to Carr, requesting answers and documents by June 5: Will you commit to a comprehensive review by Team Telecom, especially given the unprecedented risks to press freedom posed by the proposed equity investors? Will the Commission and Team Telecom specifically review Tencent’s role in the transaction and equity stake in Paramount? Will you commit to voting on Paramount’s request to raise its foreign ownership at the Commission level? If not, why? Do you believe that foreign ownership of between 49.5% and 100% of Paramount, contemplated by the filing, would mean that the Middle Eastern sovereign wealth investment funds would have effective control or influence over decision making? What specific assurances have the Saudi, Emirati, and Qatari sovereign wealth funds, and Tencent, provided the Commission that they will not attempt to influence the editorial, journalistic, or content decisions at Paramount, either by suppressing reporting and creative content unfavorable to their governments or by promoting content that runs contrary to American interests or values? Please provide all related documents. Ian McKellen Says Obi-Wan Kenobi Actor Alec Guinness Told Him to Stay Quiet on Gay Rights Because ‘It’s Unseemly for an Actor to Dabble in Political Affairs’ ‘Mandalorian and Grogu’ Is First ‘Star Wars’ Movie to Be Shot Entirely in Los Angeles Thanks to California Tax Incentive, Says Director Jon Favreau Damon Lindelof Reveals Why He Was Fired From Star Wars Movie: Story Was the ‘Protestant Reformation Inside Star Wars’ Lego Drops Star Wars Sets with Interactive Smart Play Bricks: Here’s Where To Buy Online ‘The Mandalorian and Grogu’ Brings ‘Star Wars’ Back to the Movies After 7 Years. Will the Force Resonate With Younger Audiences? ‘Star Wars’ Writer’s Scripted Hollywood Satire Podcast ‘See You in Hell’ Takes on AI in Timely New Episode Loading comments... More From Our Brands Rolling Stone Jeff Probst Accidentally Spoils a Major Part of ‘Survivor’ Finale Robb Report This New 131-Foot Explorer Yacht Concept Brings Elegance to Long-Range Expeditions Sportico Athlos, Ohanian’s Women-Only Track Meet, to Expand to London WWD Authentic Brands Group to Acquire Lee in a Deal Valued at Up to $1 billion",0,2026-05-21 12:21:16
5,https://deadline.com/2026/05/deadline-reality-tv-summit-sxsw-london-netflix-taskmaster-1236917635/,"Deadline’s Reality TV Summit Comes To SXSW London Featuring Netflix’s UK Unscripted Boss, Top Producers, AI Deep Dive & ‘Taskmaster’ With Alex Horne",Deadline,2026-05-21T09:51:50,2770,"Continue to Deadline SKIP AD You will be redirected back to your article in seconds Skip to main content By Stewart Clarke Stewart Clarke More Stories By Stewart Netflix Reveals ‘One Hundred Years Of Solitude’ Part Two Plans, Including Standalone Grand Finale: Watch The Trailer Alfonso Herrera Inks Sony Deal To Develop, Direct & Star In TV Series ‘Jordan’s Love’ Romantic Drama Starts Production In Detroit View All May 21, 2026 2:51am The Reality TV Summit at SXSW London on June 2 Deadline Deadline is bringing its Reality TV Summit to SXSW London with panels, keynotes and masterclasses on June 2. Syeda Irtizaali , Netflix’s UK unscripted boss, will be the keynote speaker. Irtizaali is one of the UK’s best-known unscripted execs. She was one of the architects behind the landmark BBC-NBC deal that has seen The Traitors become a smash hit on both sides of the pond. She will reveal her priorities and goals as Director, UK Unscripted, at Netflix and give her take on the business. Alex Horne is joining proceedings to talk about his hit show Taskmaster . Horne will be joined by director Andy Devonshire, series producer Andy Cartwright and executive producer Jon Thoday. Together, they will break down how the team continues to create Taskmaste r’s inventive games while balancing comedy and competition. Related Stories News Sky Buys Rebooted 'Baywatch' For UK & Ireland News Crossed Wires Festival To Co-Curate SXSW London Podcast Track; Jamie Laing, Miquita Oliver & More Join Schedule A session on the future of entertainment programming will feature executives behind shows including SNL UK , The Traitors , Last One Laughing: UK , Destination X and The Apprentice . Speakers include UTAS UK ’s Helen Kruger Bratt, Twofour’s David Brindley, Studio Lambert ’s Tim Harcourt, Fremantle ’s Ben Crompton and Remarkable/Initial/Znak TV’s Natalka Znak . Watch on Deadline There will also be a focus on how artificial intelligence is impacting the unscripted biz, with 404 Films talking about its AI-powered talent show, AiMation on making the world’s first AI reality show, Spirit Studios on how AI can power up true crime and docs, and the Twinnin platform discussing how contributors and performers can best be represented. The event will be held at the Tab Church in Shoreditch on June 2. It is open to all SXSW London delegates. Deadline readers are also invited and can register here : Reality TV Summit at SXSW London Sign up now, as space is limited. TikTok-Famous Agent To ‘Harry Potter’ Actors Mishandled Self-Tapes BBC Plots Major Poirot Series; Search On For Agatha Christie Icon Michael Bay To Direct True Story Of Mission To Save Two Downed Pilots In Iran Matt Damon In Talks To Lead Daniels’ Secret Pic In Universal Reunion Read More About: Comments",0,2026-05-21 12:21:02
6,https://deadline.com/2026/05/clip-birthday-party-monica-bellucci-cannes-contender-1236917377/,‘The Birthday Party’ Clip: First Look At Monica Bellucci In Cannes Palme D’Or Contender Unveiled,Deadline,2026-05-21T09:21:16,2120,"Continue to Deadline SKIP AD You will be redirected back to your article in seconds Skip to main content By Melanie Goodfellow Melanie Goodfellow Senior International Film Correspondent @mel_goodfellow More Stories By Melanie European Screenwriters Body Voices Support For Signatories Of Anti-Bolloré Letter & Says Canal+ Talent Boycott Is Symptomatic Of Wider Pan-Europe Trend ‘The Birthday Party’ Clip: First Look At Monica Bellucci In Cannes Palme D’Or Contender Unveiled 2026 Esports World Cup Moves To Paris From Riyadh Due To Iran War View All May 21, 2026 2:21am EXCLUSIVE: Monica Bellucci hits Cannes Film Festival this year in Léa Mysius’ Palme d’Or contender The Birthday Party ( Histoires De La Nuit) and Deadline can reveal a first look of the star in the dark thriller, which closes the main competition program on Friday. Adapted from Laurent Mauvignier’s eponymous best-selling, the picture revolves around Thomas, Nora and their teenage daughter Ida who live on remote marshland where social contact is limited. Bellucci plays their only neighbour Cristina, an Italian painter. As the two households plan a surprise birthday party for Nora, strange disturbances begin to occur and unease rolls over the marsh. Director and actress Hafsia Herzi, who was in Cannes last year with her own film The Little Sister , and actor Bastien Bouillon ( Leave One Day, The Count of Monte Cristo) play the couple. Further cast members include Benoît Magimel, Bastien, Tawba El Gharchi and Paul Hamy. The Birthday Party is the third feature from Léa Mysius, who was previously in Cannes with Ava and The Five Devils , and shared an Oscar nomination with Jacques Audiard and Thomas Bidegain for the screenplay of Emilia Pérez . The film is produced by Paris-based F Comme Film and sold internationally by mk2 films. TikTok-Famous Agent To ‘Harry Potter’ Actors Mishandled Self-Tapes BBC Plots Major Poirot Series; Search On For Agatha Christie Icon Michael Bay To Direct True Story Of Mission To Save Two Downed Pilots In Iran Matt Damon In Talks To Lead Daniels’ Secret Pic In Universal Reunion Read More About: Comments",0,2026-05-21 12:21:03
7,https://deadline.com/2026/05/netflix-japan-nhk-deal-20-drama-monday-late-show-1236917636/,Netflix Going Big In Japan With Deal For 20 NHK Dramas & Variety Show,Deadline,2026-05-21T09:19:16,2253,"Continue to Deadline SKIP AD You will be redirected back to your article in seconds Skip to main content By Max Goldbart Max Goldbart International TV Co-Editor @Goldbart1 More Stories By Max ‘Vengeance: Murder On The Heath’ Creator Aysha Rafaele Bemoans Lack Of Progress In Portrayal Of Black & British Asian People On TV Since Adeel Akhtar Made BAFTA History For ‘Murdered By My Father’ ‘Kylie’ Producer John Battsek Says “Everyone & Anyone” Can Relate To Story Of Kylie Minogue, Who Revealed Second Cancer Diagnosis In Netflix Doc This Week ‘The Investigation Of Lucy Letby’ Producer ITN Productions Names New International Boss View All May 21, 2026 2:19am Selection of NHK drama series. NHK Netflix is going big in Japan after striking a deal with national broadcaster NHK for a wealth of dramas and landing its first variety show. The streamer, which has been keen to expand its Japanese footprint, will launch six NHK series next month including Taiga drama Strategist KANBE ; the morning serial Mampuku ; Drama 10’s Descending Stories: A Life in Rakugo , The Science Club and Tokyo Salad Bowl , and premium drama My Family . A total of 20 NHK dramas will drop on Netflix by 2027. The deal includes annual Taiga dramas, which Deadline spotlighted in its Global Breakout series in 2024. Netflix has long partnered with major Japanese broadcasters to bring drama to audiences in Japan and globally but the addition of NHK titles marks an expansion of that commitment. Big Netflix Japan hits include Alice in Borderland and Last Samurai Standing . Watch on Deadline The streamer is also making moves in the Japanese unscripted space. Netflix has committed to its first Japanese variety show, buying Nippon TV’s Monday Late Show . Hosted by Shingo Murakami and Matsuko Deluxe, the hit show has been airing for 15 years. It is known for focusing on trending topics and local stories, spotlighting personalities and communities from across Japan. TikTok-Famous Agent To ‘Harry Potter’ Actors Mishandled Self-Tapes BBC Plots Major Poirot Series; Search On For Agatha Christie Icon Michael Bay To Direct True Story Of Mission To Save Two Downed Pilots In Iran Matt Damon In Talks To Lead Daniels’ Secret Pic In Universal Reunion Read More About: Comments",0,2026-05-21 12:21:04
