id,url,title,source,publication_date,text_length,full_text,is_duplicate,created_at
23,https://www.hollywoodreporter.com/movies/movie-news/bfi-cannes-great-8-showcase-films-2026-christina-hendricks-1236588067/,"BFI’s Cannes Great 8 Showcase Includes Films With Christina Hendricks, Joe Locke, Hiam Abbass",Hollywood Reporter,2026-05-07T10:00:00,9642,"× Skip to main content By Georg Szalai Plus Icon Georg Szalai Global Business Editor View All May 7, 2026 3:00am BFI's Great 8 for Cannes 2026. From left to right – top: 'Our Share of Sand,' 'Salvation,' 'Florid,' 'In Starland.' Bottom - 'Daughter of Eden,' 'Black Church Bay,' 'Ancestors,' 'Masc.' Courtesy of BFI The Brits are coming… to the Croisette! The British Film Institute ( BFI ) continued an annual tradition on Thursday, unveiling its 2026 crop of “Great 8” movies, eight features from the “most exciting first-time and early career filmmakers” that it will showcase to international distributors and festival programmers in the run-up to and during the Marché du Film market taking place during the 79th edition of the Cannes Film Festival . This year, the program features only debut films. Now in its ninth year, the Great 8 showcase will screen unseen footage from all of the titles, introduced by their filmmakers, online exclusively to buyers and festival programmers from midday Friday. Related Stories TV 'Saturday Night Live U.K.' Gets Season 2 Renewal From Sky Movies Richard E. Grant, Dominic West, James Nelson-Joyce and Emily Fairn Set for 'The Man Who Stole Portugal' Among the movies being presented is the feature directing debut of Boiling Point actor Ray Panthaki, starring Clarence Maclin in his first leading role, as well as films starring the likes of Christina Hendricks, Joe Locke and Hiam Abbas . “Our annual Great 8 showcase, which has previously championed both first and second time filmmakers, focuses entirely on debuts for its ninth edition,” said Briony Hanson, the British Council’s director of Film. “With formats and genres ranging from thrillers to experimental films on show, and films from Wales, Northern Ireland, Scotland and England in the lineup, the selection represents the breadth of new voices and new work happening in the U.K. It also symbolizes the importance of collaboration to the U.K. industry, with a number of non U.K.-born directors and co-productions in the mix.” Added Agnieszka Moody, the BFI’s head of international relations: “It’s incredibly encouraging to see another fantastic lineup of strong U.K. debuts for this year’s Great 8 – showcasing the range of unique and original filmmaking voices coming into our industry.” Great 8 films and filmmakers who have gone on to find international acclaim and commercial success after last year’s selection include Imran Perretta’s Ish and Ashley Walters’ Animol , the organizers highlighted. Previous Great 8 films also include Charlotte Wells’s Aftersun , Rungano Nyoni’s I Am Not A Witch , Georgia Oakley’s Blue Jean , and Charlotte Regan’s Scrapper . Below is a closer look at the 2026 crop of Great8 titles. Ancestors Ireland, U.K. Drama Director/writer: David Turpin Producers: Miranda Ballesteros, David Collins, Eamon Hughes Cast: Éanna Hardwicke, Jessica Reynolds, Jack Wolfe, Rupert Everett, Christina Hendricks Production: Screen Ireland, Yellow Moon, Northern Ireland Screen, Samson Films, Lunatica Sales: Mister Smith Synopsis: “A love story, a noir mystery and a metaphysical fable, Ancestors follows Beau (Hardwicke) as he searches 1980s London for his missing friend, Tiny (Wolfe). Dream, reality, memory and history entwine, forcing Beau to come face-to-face with truths beyond life and death.” Black Church Bay U.K. Mystery Drama Director/writer: Rhys Marc Jones Producers: Tristan Goligher, Alex Polunin Cast: Tom Cullen, Joe Locke, Marli Siu, Rakie Ayola, Dylan Michael (Miles) Production: BBC Film, Ffilm Cymru Wales, Ossian International, The Bureau Sales: The Bureau Synopsis: “Black Church Bay is a mystery-drama about a conflicted young teacher (Cullen) dealing with the consequences of a high school student (Locke) disappearing. It follows the immediate aftermath of the event, exploring the lengths a person might go to hide their true self – to save their skin at the expense of their soul.” Daughter of Eden U.K./Ireland Psychological Thriller Director/writer: Fateme Ahmadi Producers: Jack Tarling, Pietro Greppi Cast: Yasmin Al-Khudhairi, Hiam Abbass, Amir El-Masry, Lindsay Duncan Production: BFI, BBC Film, Fís Éireann/ Screen Ireland, Civic Studios, Three Point Capital, Lunapark Pictures, Shudder Films, Newgrange Pictures Sales: Lucky Number Synopsis: “London, 2006. In the months leading up to Saddam Hussein’s execution, Nessa, a British Iraqi nurse, encounters an older woman, Maryam, at the hospital and suspects that she is the government informant responsible for her parents’ execution in Iraq years earlier. Nessa infiltrates Maryam’s life as her nurse, aiming to find the truth. To her surprise, Maryam begins to develop a closer bond with her – but Nessa cannot let go of the obsession. Nessa’s search for truth turns into something darker when she finally feels certain that she has the right person; consumed by rage, she begins to punish Maryam, while neglecting her own health, family and career. As the lines between truth and projection blur, Nessa is forced to confront the consequences of what her pain has set in motion.” Florid U.K. Drama Director/writer: Billy Lumby Producers: Rupert Lloyd, Joy Gharoro-Akpojotor Cast: Jonathan Jules, Saskia Chana, Unknown T Production: BBC Film, Film i Väst, Academy Films, Head Gear, An Atar Studios, Joi Productions Filmgate (SE), Metrol Technology, Trigger Films, Red Union Films Sales: Atar Studios Synopsis: “Set in the world of London’s supported accommodation and psychiatric wards, Florid tells the story of Jamal, a young man who hears voices. Struggling to balance his medication with his musical and romantic desires, Jamal’s equilibrium is rocked when Kyla moves in next door. Told from an authentic first-person experience, Florid has been made with the community it is based in. It is an emotive and immersive story that seeks to bring the audience into an unseen world.” In Starland U.K. Drama Director: Ray Panthaki Writers: Ray Panthaki, Jason Kavan Producers: Daniel Khalili, Ray Panthaki, Daisy Allsop, Victor Paul Wajnberg Cast: Clarence Maclin, Bella Maclean, Miss Benny, Marcus Scribner, Ben Dickey Production: Le Bateau Lavoir, Archface Films, Killer Films Sales: Le Bateau Lavoir Synopsis: “In small-town America, Ernie, a 50-year-old loner with a mysterious past, lives a quiet, solitary life. After a chance encounter with a group of influencers in their twenties who are passing through town, Ernie invites them into his home – a decision that unsettles the fragile world he’s spent years trying to exist within. They move fast, live online, turning everything into something to be seen. Finally finding a place he can fit in, Ernie is drawn into a digital world of hedonism, self-exploration and belonging – but the connection he’s been searching for begins to come at a cost. As the line between private life and performance starts to blur, and the town grows more watchful, a carefully held secret begins to surface… A coming-of-middle-age story about what we inherit, the patterns we carry, and the choices they leave us with.” Masc U.K. Drama Director: Bertil Nilsson Writers: Bertil Nilsson, Joshua Griffin Producers: Bertil Nilsson, EP Joanne Michael Cast: Joshua Griffin, Tega Alexander, Ed White, Reece King Production: Duktiga Sales: Duktiga Synopsis: “Robin is a young man caught between multiple identities – autistic, biracial, queer – and different ideas of masculinity. This leads us on an intimate, and at times funny, journey of self-discovery and missteps told in five chapters over the course of a critical year in Robin’s life. He tries on different roles, failing from job to job while transforming his appearance and mannerisms to fit in. But will revealing what he’s most desperate to hide finally open the door to belonging?” Our Share of Sand U.K. Drama Director/writer: Shalini Adnani Producers: Sara Bonakdar, Alan McAlex, Balthazar de Ganay, Giorgos Karnavas, Michael Graf Cast: Ellora Torchia, Mohammed Zeeshan Ayyub, Maya Mehta, Jyoti Dogra, Krish More, Ravi Ranjan Production: BFI, Film4, Fifth Mirror Pictures, Heretic, Suitable Pictures Sales: Global Constellation Synopsis: “After years apart, 12-year-old Maya returns to India with her mother to reunite with her father – a sandmining business man. Immersed in a world where labour, legacy and extraction collide, she forms a fragile bond with Kiran, a young worker. When a tragic accident leaves him permanently injured, a police investigation turns Maya into a key witness, with her father relying on her account to absolve him. Torn between loyalty and a growing unease she cannot name, Maya begins searching for the truth herself. As her mother quietly unravels within a stifling marriage, Maya uncovers a pattern of silence, exploitation and repeated harm-forcing her to confront her father’s deception and the family’s inherited complicity she must choose to break.” S alvation U.K. Psychological Thriller Director/writer: Tom Nicoll Producers: Dom Riley, Tom Nicoll, Scott Trotter Cast: Liam Harkins, Stephen McMillan, Kathleen McDermott, Conor McCarron Production: Creative Scotland, Lane Films Sales: Lane Films Synopsis: “A tenacious aspiring guru must go to extreme measures to pay off the debts he’s accrued from trying, and failing, to set up an online life-coaching business in a post-industrial Scottish town. Exploring the world of male influencer culture and how it might be affecting the young men who come into its orbit, Salvation blends mounting tension, dark comedy and a forensic focus on its protagonist to explore the very modern story of a delusional life coach spiralling out of control.” THR",0,2026-05-07 11:13:16
24,https://www.hollywoodreporter.com/tv/tv-news/saturday-night-live-uk-season-2-sky-snl-1236588953/,‘Saturday Night Live U.K.’ Gets Season 2 Renewal From Sky,Hollywood Reporter,2026-05-07T09:48:45,2146,"× Skip to main content By Georg Szalai Plus Icon Georg Szalai Global Business Editor View All May 7, 2026 2:48am Ania Magliano and Paddy Young during Weekend Update on Saturday Night Live UK Courtesy of Sky Saturday Night Live U.K. will be back for an extended second season, Sky said on Thursday. The first season hosts have included Aimee Lou Wood, Nicola Coughlan, Tina Fey, Jamie Dornan, Riz Ahmed and Jack Whitehall. Hannah Waddingham will host this coming Saturday’s episode before Ncuti Gatwa wraps up season 1. Sky said on Thursday that it has ordered 12 episodes of the U.K. incarnation of NBC’s legendary late-night comedy show for season 2, up from eight episodes in the debut season. Season 2 will start airing in September and run until early 2027. Said executive producer Lorne Michaels: “I’m incredibly proud of our team and the show. It keeps getting better every week. I’m grateful to Dana Strong and Sky for believing in and supporting SNL U.K. I’m excited for the season ahead.” Added Phil Edgar-Jones, executive director, unscripted originals at Sky: “It’s fair to say people doubted SNL would work in the U.K., but thanks to Lorne Michaels, his longtime Saturday Night Live producing team and UTAS U.K., alongside our brilliant cast and writers, SNL U.K. is Sky’s most talked about show of the year. It’s now firmly part of the cultural conversation, and we’re thrilled the show will be returning.” Related Stories Movies Richard E. Grant, Dominic West, James Nelson-Joyce and Emily Fairn Set for 'The Man Who Stole Portugal' Movies 'Shana' Must Deal With a Toxic Partner Leaving Prison, a Death and More. Can a Ring Protect Her? (Exclusive Cannes Directors' Fortnight Trailer) SNL U.K. is produced by UTAS U.K. and Broadway Video for Sky and Now. Michaels is executive producing; for Broadway Video, Erin David serves as producer; for UTAS U.K., managing director Helen Kruger Bratt oversees production. SNL U.K. was commissioned by Edgar-Jones for Cecile Frot – Coutaz , chief advertising and content officer of Sky and CEO of Sky Studios. The final musical guests of season 1 will be Myles Smith and Holly Humberstone. THR",0,2026-05-07 11:13:17
5,https://deadline.com/2026/05/rooney-mara-quest-for-love-cannes-market-1236884144/,Rooney Mara To Star In ‘Quest For Love’ — Cannes Market,Deadline,2026-05-07T09:32:03,2962,"Skip to main content By Zac Ntim Zac Ntim International Reporter @ZacharyNtim More Stories By Zac Rooney Mara To Star In ‘Quest For Love’ — Cannes Market William Baldwin & Leo Gregory Board Jane Spencer’s Road Movie ‘The Road To Nevermore’ Mubi Acquires Multiple International Territories On Lukas Dhont’s Cannes Competition Title ‘Coward’ View All May 7, 2026 2:32am Rooney Mara Andreas Rentz/Getty Images Rooney Mara ( Carol ) will lead Quest For Love , a new feature written and directed by Antonia Campbell-Hughes ( It Is in Us All ). Rooney Mara will star as the lead Maris. The character has been described as a “deeply complex woman who explores her capacity to feel love through her relationship with her estranged ten-year-old son.” Mara will also serve as an executive producer on the project with WME Independent handling North American sales. Hanway is handling international. Macdara Kelleher and John Keville of Wild Atlantic Pictures are producers on the project. The company’s recent credits include Richard Linklater’s Blue Moon and Saipan starring Steve Coogan. Related Stories News Richard E. Grant & Dominic West Among Cast Set For Dark Comedy 'The Man Who Stole Portugal' -- Cannes Market News Mokster Films & Lester Hsi's D-Day Pictures Team On Taiwanese Horror Film 'Revive' Campbell-Hughes made her feature debut with It Is in Us All , starring Cosmo Jarvis and Claes Bang. The film premiered at SXSW, where it won the Special Jury Recognition for Extraordinary Cinematic Vision. She has recently wrapped production on her second feature, High End . The film stars Andrea Riseborough, Guy Pearce, and Raffey Cassidy. Watch on Deadline Quest For Love was developed as part of the joint Screen Ireland and Luxembourg Film Fund initiative for female and non-binary filmmakers launched at Cannes in 2023. The film’s official synopsis reads: “The ruthlessly unsentimental but alluring Maris (Rooney) tears into Paris, with her estranged ten-year-old son Maxy. Raised around her recently deceased father’s euthanasia work, she’s unsure if she’s even capable of feeling love. Setting up home in the charming Marais neighbourhood, she explores her capacity for human connection with Maxy, who desperately craves his mother’s love. Magnetic and funny, Maris easily draws people into her orbit, but her nocturnal habits hint at a dangerous violence that lurks beneath the surface. Unlike his amoral mother, Maxy knows right from wrong – and he’s clever enough to use her tricks against her to survive. Maris re-ignites a relationship with Alex, a devoted old flame whose growing love for Maxy forces her to make a deadly choice between mother and son.” ‘Saturday Night Live UK’ Renewed For Season 2 At Sky Adrien Brody’s First Post Oscar Role Is Rachel Zegler, Ben Platt Drama Service Unifies With Amazon MX Player; ‘Matka King’ Renewed For S2 Fox Orders ‘Highway To Heaven’ Reboot From Katims, Amblin & Landon Productions Read More About: Comments",0,2026-05-07 11:12:55
6,https://deadline.com/2026/05/saturday-night-live-uk-renewed-season-2-at-sky-1236884143/,‘Saturday Night Live UK’ Renewed For Season 2 At Sky,Deadline,2026-05-07T09:30:11,3930,"Skip to main content By Max Goldbart Max Goldbart International TV Co-Editor @Goldbart1 More Stories By Max ‘Saturday Night Live UK’ Renewed For Season 2 At Sky Curtis Brown CFO Exiting After A Decade ‘American Hostage’ To Roll Out On MGM+ Internationally, With HBO Max, Movistar Plus+ & Stan Among Buyers View All May 7, 2026 2:30am SNL UK Sky Saturday Night Live UK has been renewed for a second season. The first ends in nine days’ time but Sky and Universal Television Alternative Studio (UTAS) have liked what they’ve seen enough to give an early greenlight for a second run, which will air an extended 12 episodes from fall 2026. The show lands on Peacock the day after it airs on Sky One in the UK. The first season has featured hosts including Aimee Lou Wood, Nicola Coughlan and Tina Fey. Hannah Waddingham will shepherd this coming Saturday’s ep and Ncuti Gatwa will take charge of the final one. Related Stories News David Di Donatello Awards: Feel-Good Movie 'The Last One For The Road' Sweeps Board To Win Best Film & Director Casting Adrien Brody & Rachel Zegler To Lead Karim Aïnouz's 'Last Dance' With Ben Platt Co-Starring & Writing Original Music & 'Evita' Star Zegler Singing; FilmNation Launching For Cannes Market SNL creator Lorne Michaels, who produces the UK version, said: “I’m incredibly proud of our team and the show. It keeps getting better every week. I’m grateful to [Sky boss] Dana Strong and Sky for believing in and supporting SNL UK. I’m excited for the season ahead.” Watch on Deadline The UK comedy community was skeptical about SNL UK but the vast majority would concur it has gone down well. While overnight ratings haven’t been anything to write home about, the show has been received well with critics, has attracted a high caliber of guest host and has performed extremely well on social media. A Deadline analysis recently found that it had stormed past 86 million views across its official online accounts on YouTube, Instagram Reels, X/Twitter, and TikTok. Jimmy Fallon was even in town late last month taking that week’s host Coughlan on a wild studio tour . SNL UK has also been praised for its platforming of younger talent, many of whom came up through social media. Particular breakouts include George Fouracres, Al Nash and Jack Shep. Speaking to Deadline before the eight-episode first season kicked off, lead producer James Longman said he wanted to leave a legacy. The move is a big one for Sky given that SNL UK is by a distance its most expensive unscripted show of all time, with each episode costing into the millions of pounds. If SNL UK runs for years, it will have a major impact on the annual Sky budget. The pay-TV giant has also been greenlighting more original drama of late and recently struck a scripted deal with Canal+. SNL UK is produced by UTAS UK and Broadway Video for Sky and Now. Michaels is executive producing; for Broadway Video, Erin David serves as producer; for UTAS UK, Managing Director Helen Kruger Bratt oversees production. SNL UK was commissioned by Phil Edgar Jones, Executive Director of Unscripted Originals at Sky, for Cecile Frot Coutaz, Chief Advertising and Content Officer, Sky, CEO Sky Studios. Edgar Jones said: “It’s fair to say people doubted SNL would work in the UK, but thanks to Lorne Michaels, his longtime Saturday Night Live producing team and UTAS UK, alongside our brilliant cast and writers, SNL UK is Sky’s most talked about show of the year. It’s now firmly part of the cultural conversation and we’re thrilled the show will be returning in the Autumn, bringing laughter and mischief to our audiences, live from London on a Saturday night.” ‘Saturday Night Live UK’ Renewed For Season 2 At Sky Adrien Brody’s First Post Oscar Role Is Rachel Zegler, Ben Platt Drama Service Unifies With Amazon MX Player; ‘Matka King’ Renewed For S2 Fox Orders ‘Highway To Heaven’ Reboot From Katims, Amblin & Landon Productions Comments",0,2026-05-07 11:12:56
16,https://variety.com/2026/film/global/rooney-mara-quest-for-love-antonia-campbell-hughes-hanway-1236740286/,"Rooney Mara to Play an ‘Enigmatic, Beautiful, Violent’ Mother in Paris-Set ‘Quest for Love’ From Antonia Campbell-Hughes, HanWay Launching in Cannes",Variety,2026-05-07T09:30:00,3927,"May 7, 2026 2:30am PT Rooney Mara to Play an ‘Enigmatic, Beautiful, Violent’ Mother in Paris-Set ‘Quest for Love’ From Antonia Campbell-Hughes, HanWay Launching in Cannes By Alex Ritman Plus Icon Alex Ritman @alexritman Latest James Nelson Joyce, Richard E. Grant and Dominic West to Star in Dark Comedy ‘The Man Who Stole Portugal’ 2 hours ago Miles Teller and Eddie Redmayne in Talks to Play Mismatched CIA Agents in Doug Liman Spy Thriller ‘Star One,’ CAA Launching Sales in Cannes (EXCLUSIVE) 14 hours ago ‘The Housekeeper’ First Look: Richard Eyre’s Daphne du Maurier-Inspired Romance Starring Anthony Hopkins, Helena Bonham Carter and Caitríona Balfe Wraps Production (EXCLUSIVE) 1 day ago See All Getty, supplied Oscar nominee Rooney Mara is escaping to Paris to explore intimacy, morality and the limits of human connection in the newly-announced feature “Quest for Love,” which she will also exec produce. The film marks the latest feature behind the camera for Irish actress and writer/director Antonia Campbell-Hughes following her SXSW-bowing directorial debut “It is in Us All” starring Cosmo Jarvis and Claes Bang and the recently-wrapped “High End,” starring Andrea Riseborough, Guy Pearce and Raffey Cassidy. Related Stories GameStop (Yes, GameStop) Makes $56 Billion Bid for eBay HanWay Films has boarded “The Quest for Love” and will launch international sales in Cannes. WME Independent is handling North American sales. Popular on Variety The story follows the ruthlessly unsentimental but alluring Maris (Rooney) as she tears into Paris with her estranged ten- year-old son Maxy. Raised around her recently deceased father’s euthanasia work, she’s unsure if she’s even capable of feeling love. Setting up home in the charming Marais neighbourhood, she explores her capacity for human connection with Maxy, who desperately craves his mother’s love. Magnetic and funny, Maris easily draws people into her orbit, but her nocturnal habits hint at a dangerous violence that lurks beneath the surface. Unlike his amoral mother, Maxy knows right from wrong – and he’s clever enough to use her tricks against her to survive. Maris re-ignites a relationship with Alex, a devoted old flame whose growing love for Maxy forces her to make a deadly choice. “Quest for Love” was developed as part of the joint Screen Ireland and Luxembourg Film Fund initiative for female and non-binary filmmakers launched at Cannes in 2023. It’s produced by Macdara Kelleher and John Keville of Wild Atlantic Pictures, whose recent credits include “Lee Cronin’s The Mummy.” Richard Linklater’s Oscar-nominated “Blue Moon,” “Drop” starring Meghann Fahy, and “Saipan” starring Steve Coogan and Éanna Hardwicke, as well as “The Rainmaker,” based on the novel by John Grisham. Gilles Chanial of Les Films Fauves joins as co-delegate producer. Chanial’s most recent project, July Jung’s Dora and Lisandro Alonso’s “Double Freedom” will have its world premiere in Cannes Directors’ Fortnight competition. “Cinema has created many magnetic and iconic characters who dance on the edge of subversion and violence, from ‘American Psycho’ to ‘Silence of the Lambs,’ but few are women,” said Gabrielle Stewart, CEO of HanWay Films. “Antonia and Rooney have a very clear vision to challenge us with Maris, who tears through Paris on her ducati: enigmatic, beautiful, violent and a mother.” Mara is represented by WME. Campbell-Hughes is represented by United Agents and Entertainment 360. Ranbir Kapoor Unveiled as Lord Rama in Trailer for Nitesh Tiwari’s Epic ‘Ramayana’ Hans Zimmer’s Bleeding Fingers Music Expands to London, Sets U.K. Leadership Loading comments... More From Our Brands Rolling Stone Chris Stapleton Covers Willie Nelson’s Pro-Immigrant Song ‘Living in the Promiseland’ on ‘Colbert’ Robb Report BMW’s ‘Neue Klasse’ iX3 Can Travel 434 Miles on a Single Charge Sportico Inter Miami Takes Equity Stake in Beckham-Founded IM8 Parent",0,2026-05-07 11:13:08
